2015-06-10	CON	DavidCameron	My hon. Friend is right. In looking at the components of a deal, we need Europe to come forward with an offer, which we have done, and we need America and China, the big countries, to be engaged in the debate, making offers about carbon emissions, but what will bring it all together is making sure that the advanced world brings forward climate finance funds, so that we can reassure poorer countries, island states and others that there will be assistance for them as they fight climate change and make the necessary changes in their own economies. Britain has put a lot of money on the table. We now need others to do the same, and I think we will make progress in the coming months.
2015-06-10	CON	DavidCameron	On TTIP, I will say to the hon. Gentleman, as I said to Labour, that raising these false fears about potential privatisation of the NHS is a waste of an opportunity. In the English NHS, the commissioners of services will make the decisions and they invest over and over again in a national health service. In Scotland, as he knows, the only person who can privatise the NHS is the Scottish Government. Instead of raising false fears, we should be putting on the table bold proposals to open up American markets. For instance, the Scottish knitwear manufacturer that I visited recently, suffers from massive tariffs and wants to be able to sell into the US. He should spend his time looking after those businesses and those jobs and fighting for them
2015-06-10	CON	DavidCameron	On the question of TTIP, I would argue that the NHS is protected. There is no way that a TTIP agreement can lead to changes in our NHS. I suggest to the Labour party that instead of raising the profile of a threat that does not exist and trying to seek false reassurances, it would be better if the whole of the UK political system could come together and push the Americans to go further and put more on the table, so that this trade deal benefits working people in Britain. That is the argument we need to make
2015-06-10	CON	DavidCameron	The hon. Lady, like some others, is chasing after a false demon. There have been such clauses in all the trade agreements that we have signed, and my understanding is that we have not lost a single case. My view is that instead of asking for things that are not necessary, we should ask for things that will benefit Britain, such as opening up the United States. Let me give one example. Because of the Jones Act, if we want to ship goods from one port to another in America, we have to use US vessels. In a world of free trade and openness, we should be pushing for changes to that sort of thing. Let us put our efforts into that, rather than into raising false demons over trade deals.
2015-06-10	CON	DavidCameron	The right hon. and learned Lady asked about the climate change agreement. Our view is that it should be legally binding and that is what we are pressing for. The language in the communiqué is progress and America is pitching into these arguments, but of course we would like them to go further
2015-06-10	CON	DavidCameron	We did have discussions about that. There is obviously very good information sharing between Britain and America, and there is increasingly better sharing of information among European countries, with the progress on the passenger name record. Where we need even more co-operation is clearly between countries such as Britain and Turkey, which can sometimes act as a gateway for people joining ISIL. That is where we need to focus our efforts.
2015-06-10	CON	DavidCameron	We had a pretty lengthy discussion about ISIL, because in my view Islamist extremists, violence and terrorism are the greatest threat that we face on the national security front. It is a threat that very directly affects us here and it is worrying how many people from Britain have gone to fight for ISIL, so we have to cope with this right across the piece. My hon. Friend is right: we need to invest in the Iraqi Government and their capacity to bring the country together by being a Government for all—Sunni, Shi’a and Kurd—and having security forces that represent all Sunni, Shi’a and Kurd. We need to encourage President Abadi to take bold steps in that direction, while helping him to train his forces, which is what our effort and above all the American effort is all about.
2015-06-10	CON	JamesCartlidge	I set up my company in 2004. I was originally a mortgage broker, although we have since diversified, and I want particularly to focus on mortgages. I have to say to the shadow housing spokesman, the hon. Member for Wolverhampton North East (Emma Reynolds), that when we started in 2004 I was absolutely shocked and appalled by some of the practices in the mortgage lending industry. I was stunned that people who already had an adverse credit history and huge unsecured debts would call us up seeking a mortgage. Indeed, they were often able to obtain one, on a self-certified basis, through so-called adverse, heavy-adverse and super-adverse products. One very famous American bank even had a “credit builder” product, which basically meant “unlimited-adverse”. People could have missed as many payments as they wanted and still obtain a mortgage
2015-06-10	CON	JamesCleverly	Right hon. and hon. Members might not be aware that there is a town called Braintree in Massachusetts in America. My predecessor, Brooks Newmark, embodied that transatlantic bridge as he was born in Connecticut before he came to the UK to go to school at the age of nine. Those who knew Brooks will remember a fierce intellect that drove success at both Oxford and Harvard universities and in the financial services sector. Any Member who was intimidated by that academic and commercial success need no longer fear now that I stand here in his stead
2015-06-10	LAB	CarolineFlint	By this time next year we could have a binding agreement from 196 countries that puts us on a path to a sustainable future, but it will require us to show real leadership. It used to be said we would never get a deal without the world’s biggest emitters stepping up. Well, America and China have already taken one step with a deal that could see China’s emissions peak in 2030 and would see the US reduce its emissions to 26% to 28% below 2005 levels by 2025
2015-06-10	LAB	ChristianMatheson	Chester is also a centre for the financial services. MBNA, Bank of America, M&S Bank and Lloyds Banking Group all have major presences in the city, and I urge any business looking to invest or relocate to consider the merits of Chester—its beauty, its quality of life, its transport links, its skilled workforce and, if I may, its enlightened electorate
2015-06-11	CON	EdwardGarnier	We are all concerned about getting the balance correct between security and civil and human rights, and I have absolutely no doubt that the Home Secretary will devote her time to ensuring that, but is she concerned about reports that the social media websites in the United States are threatening to refuse to co-operate with legitimate requests for the provision of information about suspected terrorists and other serious criminals? If the reports are true, what conversations will she have with her American counterparts to ensure that that does not happen, and will she remind them during the course of those discussions that there is still a great deal of concern in this House and elsewhere about the lack of balance in the United Kingdom-United States extradition treaty?
2015-06-11	CON	HarriettBaldwin	The hon. Gentleman points out something that appears in the Rothschild report—that the bank still faces a range of uncertainties, particularly regarding regulatory action from America. The price today therefore reflects that information.
2015-06-11	CON	JacobReesMogg	Of course, we have to start with the basics. There is a fundamental failing in the Bill in its very title, because it refers to “own resources”. It is not “own resources”; it is our money. It is British taxpayers’ money. It is not some fantastic European lottery win that has suddenly been found, and it is not like the gold that the kings of Spain found in Latin America of old. It is not made-up money; it is real money earned by British taxpayers running to the tune of £14 billion a year
2015-06-11	LAB	GeraintDavies	I welcome the Minister to her post and offer a sobering thought to the Chancellor, who might need it after his Mansion House speech. Given that the nationalisation of RBS was in response to an unforeseen sub-prime debt crisis in America, does the Minister agree that changes to the law to require a budget surplus every year might reduce the fiscal flexibility we need to respond to such a crisis in the future—even by renationalising the banks, if necessary?
2015-06-15	CON	EdwardLeigh	What are the objections to full home rule? What are the real objections to full fiscal autonomy, apart from the fact that we appointed a Lord Smith—with lots of no doubt very worthy people—to produce a report, which has been overtaken by events? We are told that full fiscal autonomy will result in tax competition within the Union. What is wrong with that? That is what keeps the American states vibrant and competitive with one another and continually innovating. Do we not insist that our taxes in Britain compete with those of Europe? We are told that tax competition would create downward pressure on taxes. Well, I am sorry about that. Why should the Scottish Parliament not be able to lower or raise air passenger duty? It can do whatever it likes. I know it has had that power and it will be allowed it under Smith, but if that power is allowed, why not powers for other things
2015-06-15	CON	ThrseCoffey	Well, that is very sweet. The hon. Gentleman and I, in our very first summer here together as Members of Parliament, had the joy of going to the United States of America to participate in the British-American parliamentary group. We have been firm friends since. [Hon. Members: “Ooh!”] Exactly—what goes on in Vegas, stays in Vegas
2015-06-15	LAB	KevanJones	I am just trying to be helpful. The hon. Gentleman might have the wording “United Kingdom’s constitution” in an amendment, but would it have any legal force? An amendment to the American constitution, or to any other written constitution, is legally binding. What would be the status of the hon. Gentleman’s amendment?
2015-06-15	LAB	KevanJones	I do not want to divert from the subject, but was not the reason for the Scots’ enthusiasm in going forward in 1707—[Interruption.] It was not an economic blockade; it was speculation in the colonies of central America.
2015-06-16	LAB	KelvinHopkins	Just to reinforce the point that the hon. Gentleman makes about America compared with Britain, I was recently on a parliamentary visit to Washington where we met a senior member of the Democratic party. I explained that there were limits on electoral expenditure in general elections in Britain, unlike in America, and he said, “How civilised.”
2015-06-16	LAB	MichaelGapes	The other advantage of bringing forward the referendum is that it cuts the period of uncertainty for the Koreans, the Americans, the Chinese and the other countries wishing to invest in the United Kingdom. They would have less uncertainty than they would have if we left the referendum to the end of 2017. One of the strongest arguments against a referendum is the economic and political uncertainty it engenders. If foreign investors, or people planning long-term investment projects, think there is no guarantee that the United Kingdom will remain in the European Union, they will not give priority to investing in our country. They will hold back, or choose to go to a country such as Ireland, the Netherlands or France, where there is certainty over their continuing membership of the European Union.
2015-06-17	CON	JamesHowarth	Today’s unemployment figures provide further compelling evidence of the strength of the United Kingdom’s economic recovery, thanks in large measure to the long-term economic plan for this country. But given the strength of that recovery, may I lodge an appeal to my right hon. Friend that we now commit to spending 2% of GDP on our defences, both to plug the military capability gaps we have had to sustain and, in these troubled times, to assure our principal ally, the United States of America, that so long as we have a Conservative Government, defence of the realm will be the No. 1 priority of this Government?
2015-06-17	CON	MarcusFysh	The amount of value we create in our work is key to what we can expect to earn over the long term. We heard earlier this afternoon from the Secretary of State for Education how this Government are focused on getting great teaching and skills to our young people to give them the best chances in life. I support that and am keen to ensure that recent improvements on that front in my Yeovil constituency are consolidated and taken further. I want more funding for school places in my county of Somerset, too, so that we can build a better future for our children, developing their talents to their full potential. I also support the plan for productivity mentioned earlier by the Chief Secretary to the Treasury. We have a plan for productivity, not just platitudes as espoused by the Opposition. Differences in productivity levels between G7 nations have been relatively static over time, reflecting widely different structural characteristics. There are significant measurement problems in the statistics—for example, in picking up the intangible benefits of changing technology. Productivity growth has dipped in America, too, in recent years, so it is not just a British disease, as some are trying to claim, although we should look to America as an example of an economy with higher productivity growth on average than we have managed over time
2015-06-17	LAB	ShabanaMahmood	What has been happening to productivity on this Government’s watch? Seven years on from the global financial crisis—some Tories appear to have forgotten that there was a global financial crisis before Labour left power—productivity is still 1.7% below the pre-crisis peak. Between 2010 and 2014, productivity has grown by an average of just 0.4% a year. In quarter 4 of 2014, productivity growth fell by 0.2% compared with the previous quarter, and productivity growth was also negative in 2013 and 2012, at minus 0.3% and minus 1.2% respectively. UK output per hour is now 17 percentage points below the G7 average and 31 percentage points below that of the United States of America
2015-06-17	LAB	StevenReed	It takes British workers until the end of Friday to produce what a German or American worker has produced by Thursday, and yet British workers work some of the longest hours in the industrialised world. The fault lies not with our workforce, but with a Government who have failed on investment. After 2010, the previous coalition Government choked off investment in infrastructure, which damaged the confidence of the private sector to invest. They failed to reform the banking sector with regional and sectoral banks, so it remained difficult for businesses to secure the investment and borrowing they needed to grow
2015-06-18	CON	KevinFoster	We keep hearing about residency. What about citizens of the United States of America, one of our oldest allies, who are resident in this country? We know the answer: the system is based on citizenship and on the parliamentary franchise, and it is right for it to continue on that basis. I shall vote against the amendment, but I hope that Front Benchers have been listening to the debate, because the amendment has raised a legitimate point. In the not too distant future, we should have a proper debate about our franchise, so that we can deal with some of the numerous anomalies that we have discussed today. We could then set a franchise for the 21st century, and give Members who are in favour of reducing the age to 16 the chance to vote for such a move.
2015-06-29	CON	DavidCameron	Secondly, we must deal with the security threat at source, whether ISIL in Iraq and Syria or other extremist groups around the world. British aircraft are already delivering the second-largest number of airstrikes over Iraq, and our airborne intelligence and surveillance assets are assisting other countries with their operations over Syria. We are working with our UN, EU and American partners to support the formation of a Government of national accord in Libya, and we will continue to do all we can to support national Governments in strengthening weak political institutions and dealing with the ungoverned spaces where terrorists thrive. As I have said here many times before, if we need to act to neutralise an imminent threat to the UK, we will always do so
2015-06-29	CON	EdwardLeigh	That is certainly the case in the United States, where the states have full fiscal autonomy, including the power to issue bonds and the like—the whole lot, as far as I know. This country is definitely not the United States, despite the best efforts of Mr Blair, but if there is one aspect of America we should like to emulate, it is its vigorous civic culture. Its states, counties and towns have real power and the capability to respond to people’s needs and democratic desires. Surely we all want Scotland to have that capacity, just as we want the whole UK to have it. The fact that fiddling with thresholds is so expensive makes Governments and Parliaments niggardly about raising them—each £100 is inordinately expensive—but why should the Scottish Parliament be less responsible than the UK Parliament? Can anybody tell me why a responsible Scottish Parliament should not also be niggardly about that power and use it in a very conservative—small c—way
2015-06-29	CON	GeorgeOsborne	My hon. Friend makes a very important point. Britain is overly dependent on its exports to the rest of the EU. About 50% of our exports go to the EU. We have been working very hard to expand our exports to fast-growing economies in Asia, Latin America and Africa. Although, in general, UK export performance has been quite disappointing in recent years, that is principally because of the weakness of the European economy. Our export performance to many of these emerging economies has been very much better, and we want to build on that—particularly, of course, our links with the Commonwealth countries.
2015-06-29	LAB	GrahamStringer	This will result in not only an economic benefit for Scotland, but in real competition, which will come in two forms: there will be competition for passengers on short-haul flights, for which APD is £13 per passenger, and for those on longer-haul flights, for which it is £71 per passenger. Obviously, the same amount is paid for the return flight. A passenger from Newcastle therefore has an incentive—this applies to large families in particular—to travel to Edinburgh or Glasgow in order to save some money. Someone travelling long distance from north America or China has the same incentive.
2015-06-29	LAB	HelenGoodman	A further collapse in the Greek economy would obviously be extremely bad for the Greek people and for our exporters, particularly in pharmaceuticals. Even the Financial Times this morning described the creditors programme as “economically counter-productive”, and we have learned that the US Treasury Secretary urged the creditors to take a more compromising stance. Did the Chancellor follow the American lead, and will he do so as the days go by?
2015-07-01	CON	DavidCameron	On that specific issue, there is still a lot of work to be done to identify all the circumstances of this appalling attack and the support that the gunman received. As we get that information and confirm it, I will ensure that the House is regularly updated. I can confirm that the discussions between my right hon. Friend the Home Secretary and the Tunisians went ahead and were successful. As I have said previously, that is looking at everything, from the protective security in hotels and resorts to intelligence co-operation at the highest levels between Britain and Tunisia, so that we can help with its capacity to combat such appalling events. It will need a lot of long-term work between our two countries, but the French, the Germans and the Americans are also willing to help, and we need to co-ordinate between ourselves how best to support that country on its road to democracy.
2015-07-01	CON	GeorgeDuncanSmith	I welcome my hon. Friend to his place. The Government rightly spend significant sums of money on support for disabled people throughout the UK. In fact, I think the amount we spend on disabled people, as a proportion of GDP, is more than is spent by America, Germany and France together. I am proud of that. It is the right thing to do, and we should continue to do it. However, many people who have disabilities are desperate for work. We have now increased the proportion who are in work to record levels, but that is not good enough. I want to get it up to the same level as for the rest of society.
2015-07-01	CON	HelenWhately	When looking at the progress made in recent years, we should look beyond pay and consider the success of women on boards. The work of the 30% Club has been very influential in that area. In 2010 only 12.5% of FTSE 100 board members were women, but now the figure is up to 24.7%. The UK leads many countries around the world in that regard, including America, Canada and Australia. We should also appreciate the increasing number of women in leadership positions in both the private and public sectors
2015-07-01	LAB	BarbaraKeeley	I wish to raise with my hon. Friend the point that was made in our debate on sport and the Olympic legacy last week: the gross inequality between men and women in relation to payment and sponsorship in sport. That is one of the worst areas. America has the wonderful Title IX legislation, which ensures equal funding if and when it comes from the public purse, which is another thing to bear in mind. Not only is this so unequal, but, worse still, it is unequal to people such as our football team that will play in Canada tonight.
2015-07-01	LAB	NeilCoyle	The attraction of living in the constituency is partly the amazing local food and drink industry. I am sure that many Members are familiar with Borough market—it has been there for 1,000 years, so I hope they have noticed it. Bermondsey has had the reputation of being the larder of London for many years. The first tinned food factory anywhere in the UK was opened in Bermondsey in the 1800s. More recently, a market has opened on Maltby Street—please visit—and there are no fewer than six breweries and a gin distillery open locally. I cannot promise to shout everyone a drink, but please do visit. Despite the positives of such an amazing constituency, inequality is still a massive concern. Child poverty remains stubbornly high across Rotherhithe and Bermondsey in particular. Low pay and unequal gender pay are definitely a factor. It is no coincidence that the justice for cleaners campaign is based in the constituency and helping in particular women from the Latin American community who are working as cleaners
2015-07-01	LAB	SeemaMalhotraSaluja	I want to share a couple of cases of stereotype-busting by women who have entered different professions or jobs, starting with my sister. I do not have daughters, so I may just talk about sisters. I have three sisters—perhaps that can be a new dimension of the competition today. My sister is an engineer. She works with racing cars in America and is often the only woman involved in any particular race. She started out life, as I did, at the Green School in Hounslow. Being a racing car engineer was not part of the careers advice. Being a politician was not part of my careers advice either. I remember asking whether we might invite a politician to speak at the school and was told that we did not really want to be political
2015-07-02	CON	GiacomoLopresti	We have led by example. I agree with points the Prime Minister made last September at the NATO summit in Newport when he called on NATO members that are not making their 2% of GDP contribution to spend more. The UK and the US account for almost four fifths of the total NATO defence spend. The US will pay practically 73% of NATO’s total estimated budget for 2015. The European nations cannot keep relying on the Americans to write the cheques to provide them with the personnel, kit and manpower to protect them. We are next on the list, paying 6.6%, followed by France with 4.7% and Germany with 4.2%. It is estimated that Germany is planning to spend nearly £14 billion less than us on defence. France will spend £10 billion less than us. The US is spending around £300 billion more than the UK, Germany and France put together
2015-07-02	CON	JulianLewis	I am afraid I have to disagree with my hon. and gallant Friend. If the vote had been carried, intervention would have taken place the very next weekend. The vote was defeated in this House and the Americans, as a result of that defeat, wisely followed suit, and we did not go down that dangerous road
2015-07-02	CON	MichaelFallon	We do not want to give any succour to Assad. I do not think that anybody in this House wants the Assad regime to continue for a day longer than is necessary; we want Assad to go. But we are equally clear that ISIL operations in Iraq and elsewhere, probably including Libya, are being directed from northern Syria. We already have American air strikes being carried out in northern Syria and air strikes being carried out from other Gulf countries. We have air strikes being carried out by Canadian aircraft that are helping to keep our streets safe as well.
