2015-01-05	LAB	AndrewBurnham	Let me turn to post-arrival monitoring. A number of states in America have introduced it for all travellers returning from an affected country, whereas only those showing symptoms on return are actively monitored here. Given that symptoms of Ebola can emerge up to 21 days after exposure, is there a case for strengthening post-arrival monitoring in line with other countries
2015-01-08	CON	LiamFox	I am extremely grateful to my hon. Friend for his intervention. Luke Coffey is not only a mutual friend of ours; he was also a special adviser in the Ministry of Defence. His work at the Heritage Foundation has been instrumental in pushing understanding of the wider issues on Capitol hill. The hon. Member for Ilford South mentioned the resolution in Congress. I shall tell the House exactly what it said. It was a bipartisan resolution, as the hon. Gentleman correctly said, and it was put forward in the House of Representatives. It stated: “Resolved, That it is the sense of the House of Representatives that— (1) the United States honors the contribution that Gibraltar has made to advancing United States’ security interests in the Mediterranean region since 1801 and extends its deepest appreciation and thanks to the government of Gibraltar and its citizens; (2) the views and rights of Gibraltarians should be taken into account in any discussion on the future of Gibraltar.” Our American allies, and our colleagues in the House of Representatives, understand that being on the right side of international law is of prime importance. We need to make that point as clearly as we possibly can
2015-01-08	LAB	BarrySheerman	Fifty years ago Harold Wilson, who was born in my constituency, delivered a speech to the Labour party conference in Scarborough. It is now known as the “white heat of technology” speech. He said that for years this country had been ruled by a few people who went to posh schools and then to Oxford or Cambridge and who were essentially amateurs, but that the new world had no future for people without skills, or even for semi-skilled people. He saw that the future was in high skills, quality management and high science. He told us to look at what was happening in Russia: they had put a man into space before the Americans. He had been to the United States and seen production lines in the automobile industry where nothing was touched by a human hand. He could see that as a country we had to become highly skilled
2015-01-08	LAB	MichaelGapes	Let me begin where the right hon. Member for Croydon South (Sir Richard Ottaway) ended. We in this country have important relations with Spain in the context of a number of issues. As the Committee itself made clear, Spain is an important European Union and NATO partner, and co-operates with the United Kingdom on a number of our strategic priorities. Some of those are listed in the report, including counter-terrorism and the combating of drug smuggling. There is an economic agenda within the European Union, and a reform agenda. Migration policy is a complex issue, and there are wider international and trade matters. Both the United Kingdom and Spain have historic associations with both north and south America that date from the colonial period, and both countries have a strong interest in the current talks on the transatlantic trade and investment partnership. Beyond that, both countries, as democratic, pluralistic societies, are appalled by terrorism, whether it is carried out in Paris or in countries such as Iraq and Syria
2015-01-09	CON	ChristopherChope	Under clause 4, the registration certificate system would require people to fill in the form accurately and give information about their previous criminal convictions, in exactly the same way as anybody who wishes to go to the United States of America has to obtain a visa. If it is all right for the United States, why is it not all right for the United Kingdom, which is an attractive place to visit? People are not deterred from visiting the United States by such a requirement, and they would be no more inhibited from coming to our country if we had such requirements. The Bill would ensure that as far as possible people would be able to stay in the United Kingdom if they wanted to, provided they had registration certificates
2015-01-12	CON	HugoSwire	The issue that caught the attention of this House and of the world was the abduction of the Chibok girls. We are still supporting the Nigerian authorities in trying to establish the girls’ location through the provision of surveillance assets and intelligence expertise. Information generated by these assets has been provided to an intelligence fusion cell in Abuja, where British personnel are working alongside Nigerian, American and French colleagues. We are clearly unable to comment on the results of ongoing intelligence operations, as the House will accept, but while the girls are still missing our resolve and that of the international community to continue the search remain strong. I remind the House that we are dealing with an area the size of Belgium under the control of Boko Haram, and intelligence is difficult, but we are not giving up at this point.
2015-01-12	CON	PhilipDavies	Not only did the OFT make it clear that the current regime worked in the best interests of the customer, but we have practical arguments from the US showing that the kind of price cap the hon. Lady wants to introduce does not work. In fact, when America introduced the price cap, it led to higher prices on both the primary and secondary markets. A study by the university of California found that by focusing on penalties for those who engage in prohibited transactions, anti-ticket scalping —as they call it—regulations seemed to lead to higher prices in the resale market. If a seller is taking more of a risk, they will want to command a higher price—that is what happens with the free market, supply and demand and the rest of it. I am surprised my hon. Friend the Member for North East Cambridgeshire is not aware of that. The university of Texas found that such regulation increased prices not only in the secondary market, but in the primary market. The hon. Member for Washington and Sunderland West says she wants to stand up for consumers, but by rejecting the amendment, we will do just that
2015-01-12	LAB	MaryGlindon	Given that the Kurds still face attacks by ISIS forces using sophisticated captured American arms, is the Secretary of State satisfied that our allies have enough heavy weapons, including tanks and helicopters, to counter those attacks?
2015-01-13	CON	KennethClarke	The last Labour Government completely failed to foresee what happened, and I think that even now they do not quite understand where they went wrong. They ran a massive surplus during the dotcom bubble, because they stuck to my fiscal figures, and found their tax revenues were inflated for a time. Then, when the next South Sea bubble came around and we had the credit bubble and the credit crunch, they were still—at the top of crazy levels of growth—running a fiscal deficit. They borrowed, but claimed they did not have a deficit. Well, they did not have much of one in 2006, but once the crazy tax revenues from the City collapsed, they were left high and dry, with the full extent of their irresponsibility exposed. They had failed to regulate the mad borrowing and lending in the City of London just as the Americans had failed in Wall Street. It was free money, which their last Chancellor indulged in, and when the bubble burst they were caught.
2015-01-13	LAB	JamesCunningham	When we look at the general trend over the past five years, we can see that the Chancellor thought that the problem was confined to Britain. He has consistently made excuses every time his targets have not been met because the Tories cannot face up to the fact that the crisis started internationally, particularly in America, but unless they face up to that, they will never get the economy right. They will tinker with it, but they will not get it right and as a consequence the cost of living has gone up and wage values have gone down by 6%.
2015-01-14	CON	DavidCameron	Absolutely, and those wheels must keep turning. The point my hon. Friend makes is important. Of course I look at The Sun every morning, and I was fascinated to see this article. The fact is that under Labour, female unemployment went up by 24%. Under this Government the number of women in work is at its highest since records began. The proportion of women-led businesses in our country is up by a third, but it is still true that if we could get the same level of female entrepreneurship in Britain as there is in America, we would virtually wipe out the remaining unemployment.
2015-01-14	CON	TimothyYeo	The second way to cut costs is to embrace enthusiastically the opportunity of demand-side response. Few people understand the enormous potential benefits of this. It is sometimes wrongly characterised as a way of cutting power off from consumers. It is in fact a chance for consumers to earn some money back by agreeing voluntarily, sometimes at short notice, to reduce their consumption. The evidence from America is that this new technology, developed in the last few years, is unlocking a considerable potential for reducing demand for electricity at peak times. This has two big advantages: it cuts the need to maintain large amounts of expensive surplus capacity, most of which is used only for a very small amount of time each year, and eliminating that surplus would reduce the bill of every consumer. It is also one of the cheapest and most cost-effective ways to cut greenhouse gas emissions. At present, providers of genuine demand-side response, as opposed to the operators of diesel farms, are not being sufficiently encouraged by the capacity market. I urge my right hon. Friend to look carefully at the ways in which next year’s capacity market auction can be tweaked to ensure that genuine demand-side response providers get a bigger share of the market than the 1% that was achieved last month
2015-01-14	LAB	JohnHealey	Weak demand is always a problem for an industry such as the steel industry. Although in the past year UK demand for steel has increased by 15%, most of that has been supplied by imported steel, not UK-produced steel—that is what we have to change. It is the high energy prices that pose the risk of pricing British steel-making out of business. The full cost of energy for large energy-intensive users, such as steel makers, is €77 per megawatt-hour in the UK, which compares with €49 in France, €38 in the US and €33 in Germany. Of course when high-end products go through several processes—melting, casting, re-melting, rolling and finishing—that premium and extra cost is multiplied. We need the Secretary of State to commit his Government to bringing in, once state aid clearance is achieved, help with the cost of the renewables obligation—that is imperative. We need help and a promise to negotiate a good transatlantic trade deal which benefits the metals industry and many of its user industries and deals with some of the problems associated with restricted procurement practices arising through the “Buy America” regime. Finally, we need to see a commitment to using any local economic benefit clauses that can be put in place in public procurement. Just as there is common ground in the industry among companies and the trade unions on the future of the industry and what is needed, we need in this House, from today’s debate, common ground among the parties.
2015-01-15	CON	EricOllerenshaw	I also thank the Minister and, as the hon. Member for Scunthorpe mentioned—he seemed to mention everything—there is the five-year action plan. We talked about unmet need and the Americans have talked about recalcitrant cancer strategy, but I add my support to the hon. Gentleman that that becomes part of the responsibilities of the taskforce
2015-01-15	CON	JulianSmith	I will give way later. What surprises me about the hon. Member for Swansea West, who at the start of this Parliament wanted to be head of the Business, Innovation and Skills Committee, is that he has not given any focus to the benefits of TTIP. This is our biggest export partner; the biggest trading relationship that we have. The huge focus of our attention here should be on saying and explaining that this deal will mean hundreds of pounds less for British consumers when they buy their jeans, cars and other products. It will primarily benefit not big corporations, but small businesses—the businesses that we have in our constituencies. TTIP will made trade easier with the most easy market to trade with—that which speaks our language—the United States of America. I say to the hon. Gentleman that this is a ridiculous motion. He should focus on the benefits of the partnership. It is a key part of this Government’s long-term economic plan and he should be celebrating this deal when it comes to a conclusion.
2015-01-15	CON	JulianSmith	There has been a House of Lords report on TTIP and a Government response to it. The Select Committee on Business, Innovation and Skills has interrogated Ministers about TTIP. The all-party group on European Union-United States trade and investment, of which I am the deputy chair and which the right hon. Member for Wentworth and Dearne (John Healey) chairs, has had multiple meetings, in Brussels, London and America, with the negotiator, with Members of Congress, with members of the US Administration and with the EU trade negotiator, Ignacio Garcia. There has been nothing but engagement, both from Brussels and from our Government on TTIP.
2015-01-15	CON	MargotJames	At present, a lot of non-tariff barriers, as well as tariffs, are making it impossible for some companies—and far too difficult for others—to export to the US. The food and drink industry is our largest manufacturing sector, but many of its brands are too little seen in American supermarkets. The cost for food and drink companies in complying with US tariffs and regulations is equivalent to a tax of 13%. That is the tip of an iceberg that the trade negotiations are seeking to address. As other Members have said, if successful the trade agreement will generate GDP growth of £10 billion a year to the UK
2015-01-15	CON	MargotJames	Many of my constituents travel to the US for work and pleasure, and they often express frustration at how much cheaper consumer goods in many sectors are there. So far, I have talked about the benefits in terms of increased exports, but there are benefits for consumers from the potential removal of EU tariffs on American goods in that cars imported from the US would be 10% cheaper and jeans would be 12% cheaper. A free trade agreement, properly negotiated, will improve people’s standards of living in many ways, so it is very important to overcome any barriers to its successful conclusion
2015-01-15	CON	MatthewHancock	This is what it means. Let us picture a small business owner who, five years ago, might nearly have gone under through no fault of his own thanks, in part, to the economic circumstances. Like so many smaller business owners, he did not give up and recently things have got better. The recovery might have delivered for him here, but he might want to expand and take on more staff and he might find people in America who want to be customers. He wants to sell his product to more people, but if margins are tight the prohibitive extra cost of the trade barriers means that that simply is not an option. Now, let us picture a post-TTIP world in which those costs do not exist. We have not only increased the UK’s GDP but managed to ensure that someone can trade, creating an apprenticeship or a job to fulfil those orders, and in America somebody can get a product that they could not get before. That reciprocity—that “something for something”—explains why free and fair exchange makes us all better off
2015-01-15	CON	RobertStewart	May I clarify one thing? It is probably not as important as the whole thrust of this debate, but when I was badly hurt in the Army and the NHS took responsibility for helping me get better, we used an American system to put me back on my feet. I hope, and assume, that use of American techniques and systems by the NHS is still allowed.
2015-01-15	CON	RobertWalter	Today’s debate should be about the substance of the transatlantic trade and investment partnership. It provides a once-in-a-lifetime opportunity to enhance the economic security and prosperity of the British people while at the same time making a real contribution to the welfare of the peoples of Europe, north America and beyond. I wholeheartedly believe in free trade, and I subscribe to the goal of global trade that is both free and fair. However, achieving that goal is a slow and grinding process. In my view, it will be many decades before there is any meaningful World Trade Organisation-led, top-down framework that we can call global free trade. That is because the parties involved range from the richest nations on the planet to the poorest, and from the prairie farmers of north America to the subsistence agriculture of sub-Saharan Africa
2015-01-15	CON	ZacGoldsmith	So why are we moving heaven and earth for this vast trade deal? We are told that it is about jobs and growth, and that Europe might benefit by £100 billion. But there are any number of reports that say the opposite. But it is all nonsense. We have no idea. The history of these sorts of predictions in relation to big free trade deals is pretty woeful. We were told that the north American free trade agreement, for example, would create a million new jobs. There is more or less a consensus now that it cost America 870,000 jobs
2015-01-15	CON	ZacGoldsmith	The ISDS is not, as many hon. Members have pointed out, a new concept. It exists in other free trade agreements. There are many examples of countries having been sued successfully for policy changes they have made: limiting coal mining in sensitive areas in Indonesia; attempts to raise standards for coal power plants in Germany; attempts to impose oil spill controls in South America and so on. The best known example, which we have already heard about, relates to Australia being sued by tobacco giants for taking measures to dissuade people from smoking. There are many other examples. Canada has been sued 35 times under current ISDS mechanisms. In one appalling case, Canada was sued by Ethyl Corporation for $250 million, via an ISDS mechanism, after it banned the highly toxic chemical MMT, which is an additive for fuel. Despite unequivocal evidence of harm—no one disputes the scientific case—Canada not only had to settle with Ethyl but reverse its ban. I accept that the ISDS has a role to play in limited circumstances. It exists to help companies do business in volatile countries with unreliable judiciaries, but the mechanism being proposed in TTIP will apply here, not in Venezuela or the Democratic Republic of the Congo
2015-01-15	LAB	DavidAnderson2	Two years later in Qatar there was no such hope. Two years later, in the aftermath of 9/11, there was only one game in town—George W. Bush wanted to go through Pakistan to Afghanistan to chase al-Qaeda. Nothing else mattered. The Pakistanis, who were crucial to a discussion on core labour standards, did not engage at all with anybody. Because they did not engage, the Americans did not engage. That led to the failure of that round, which has resulted in the stalling of world trade discussions ever since
2015-01-15	LAB	JeremyCorbyn	What is the objective of TTIP? It is to increase trade between Europe and north America, but that trade is not without a cost. It benefits the companies that undertake it and, yes, that could be beneficial if it means more jobs. But let us look at other trade agreements that claimed in advance that they would offer the same great advantages. An example is the North American Free Trade Agreement between Canada, the United States and Mexico. Severally, companies in those countries were all told that free trade would increase trade and opportunities and help to eliminate poverty. Who have been the losers? Those who have been de-industrialised in what is now, unfortunately, known as the rust belt in the USA; those who have seen their working conditions damaged in Canada; and those working for companies that have been set up in Mexico in a virtual tax haven zone on the border, who are paid disgracefully low wages and have appalling working conditions. Has NAFTA actually benefited any of the people it was claimed it would benefit, or has it in fact enriched those who were already doing very nicely, thank you very much? There are some serious questions to be answered there
2015-01-16	CON	ChristopherChope	There is actually a mass of evidence. I have a great volume of material, largely from America, because that is where most of the data come from—
2015-01-16	CON	PhilipDavies	The right hon. Member for Delyn (Mr Hanson), speaking on behalf of the north Wales economy, rather led with his chin when he mentioned how wonderful offshore wind farms are for manufacturing industry. There is a lot of manufacturing industry in my constituency. I am delighted that, under this Government, manufacturing is thriving again, unlike under the previous Government, but the one thing manufacturing is most concerned about is high energy bills. The fact is that wind energy does not help manufacturing industry. All it does is make it even more uncompetitive against businesses in China and America, which benefit from much cheaper energy bills. The extension of wind energy that the right hon. Gentleman wants to see is not helping manufacturing industry in this country; it is the death knell for manufacturing industry in this country. That is why it is so important that we stop this ridiculous expansion of wind energy
2015-01-16	LAB	MarkTami	America?
2015-01-20	CON	BernardJenkin	If France, Britain and America do not dominate the P5, who does? There is always talk about other powers joining the P5. If India, or perhaps less savoury countries, joined the P5, that would not be good for British security and the democratic world. We are there for a purpose, which is to serve the democratic world, and we do it very well.
2015-01-20	CON	BernardJenkin	Let us deal with the fantasy that we could create joint-role submarines. The Americans may have them but they have 12 submarines. For them to maintain a continuous at-sea deterrence, they can have some submarines doing completely different tasks while some of their nuclear ballistic missile submarines are carrying out the deterrent role. They have a completely different force concept from us, and it would be improper to import it. They do not understand how we can manage continuous at-sea deterrence with just four submarines and they admire the resilience of our system. We should not fiddle with it, or we will disturb its resilience
2015-01-20	CON	BernardJenkin	There is another question that we keep hearing: “Is this really an independent deterrent?” I have spent plenty of time around a deterrent and around people who know about the deterrent, and if the Americans had some secret switch in some bunker in the United States that could disable our deterrent and prevent us from firing it, I think that we would know about it. That switch does not exist. The fact is that once the submarine is at sea, the command and control of the firing of the weapons system is completely autonomous. One of the factors that give us leverage over American policy is that if this country were in trouble, or if Europe were in trouble, America too would be in trouble, because the possibility of a nuclear exchange would bind it inextricably into the conflict. Europe and the United States have many mutual interests, and there are many reasons why we should support each other’s security policies, but, in extremis, we can strengthen that position by means of the capability that we possess
2015-01-20	CON	CrispinBlunt	Frankly, I am not sure that the Americans place very much value on a separate source of nuclear deterrence decision making in London. I think that they would prefer us to bring such resources to the table in the form of deployable conventional forces. The United States Government will not of course take a public view that embarrasses the UK Government, but if we scratched them, we would find that they would rather we had more effective conventional forces
2015-01-20	CON	CrispinBlunt	I am perfectly content to continue to shelter under the American nuclear umbrella. I accept that the decision matrix would be profoundly different if the United States of America was not a rock-solid ally, the Atlantic alliance was not extremely important to the Americans or we could not place the same degree of reliability on their support as we now do. If we had good reason to believe that the United States was not going to be intimately tied into the defence of ourselves and Europe, the decision would be different. I happen to believe, however, that our interests are so closely intertwined, as they have been in all sorts of ways, that we can continue to rely on that alliance
2015-01-20	CON	CrispinBlunt	It is a pleasure to follow the part-polemic by the hon. Member for Perth and North Perthshire (Pete Wishart). He was unable to answer a question put to him when he was challenged by Opposition Front Benchers about the extent to which his party, as the head of an independent Scotland, would be prepared to shelter under the American nuclear alliance. That is an important question that his party has to answer
