2017-03-02	M5S	PagliniSara	Ci troviamo in questa legislatura a lavorare sul tema (secondo noi) più pressante per il Paese: ci troviamo ad affrontare il tema del contrasto alla povertà. In Italia esiste un divario tra flessibilità del lavoro e sicurezza sociale. Il sistema dell'indennità di disoccupazione è complesso e frammentato, disorganizzato e non in grado di sostenere adeguatamente tutti i disoccupati. È aumentata la disuguaglianza con l'aumento della flessibilità e della precarietà. Il sistema di welfare è un fallimento! Leggiamo dati agghiaccianti, oggi, sul disagio dei nostri concittadini. Dal 2008 ad oggi, addirittura il numero di bambini sotto la soglia di povertà è triplicato: siamo a oltre un milione, e la vulnerabilità dei minori è ovviamente legata alle difficoltà dei giovani adulti. Lottare contro la povertà significa contrastarla e vincerla. Contiamo poveri in tutte le fasce d'età, dai giovani che ormai sono rassegnati ad emigrare, (visto il tasso di disoccupazione è al 40 per cento) ai pensionati in difficoltà che sono un esercito. Oggi contiamo due milioni di pensionati costretti a vivere con pensioni da 500 euro al mese, e da ciò deriva il fenomeno dei «nonni in fuga», costretti ad emigrare da anziani per non morire di stenti nel loro Paese. Ma quando si è considerati poveri? Nel provvedimento in esame non lo dite! Non si sa. Non ci date i parametri. Eppure Eurostat ci fornisce l'indicatore ufficiale di povertà che considera a rischio di indigenza la persona che non raggiunge 9.360 euro all'anno (780 euro al mese), ovvero che non percepisce almeno sei decimi di 15.514 euro, che è il reddito mediano, la linea di reddito raggiunta dalla metà delle famiglie italiane. Quindi cosa ci aspettavamo da questa maggioranza? Una terapia d'urto, una terapia d'urto in un Paese come il nostro che ha sempre investito male e troppo poco per l'inclusione sociale e per il contrasto alla povertà. Da questa legge ci aspettavamo qualcosa di importante, tenuto conto che, insieme alla Grecia, siamo l'unico Paese che non ha ancora adottato un reddito di cittadinanza, che tra l'altro è la prima proposta del Movimento 5 Stelle. Cosa è stato fatto nel corso di questa legislatura per tutti questi cittadini? Nulla. Oggi, dopo quattro anni di legislatura, permettetemi di definire ridicolo, ridicolo al limite dell'indecenza ciò che dichiara, in una trasmissione televisiva, il signor Renzi, cioè colui che ha avuto per tre anni in mano il Paese Italia, che ha detto che oggi serve il "lavoro di cittadinanza" anziché il "reddito di cittadinanza" in quanto è lo Stato che dovrebbe occuparsi di formare ed introdurre i cittadini in difficoltà nell'ambito lavorativo. Ridicolo in quanto si parla senza conoscere il nostro disegno di legge, ridicolo perché la nostra misura passa soprattutto attraverso una continua formazione e nell'inserimento nel tessuto sociale in modo da attivare la persona e l'economia interna. Forse Renzi non sa leggere o fa finta di non saperlo. È ridicolo perché continua a parlare per slogan, vendendo altro fumo agli italiani, che comunque hanno capito la schizofrenia di un personaggio che in tre anni nulla ha fatto per garantire i diritti dei cittadini e che, con la strategia della mancetta degli 80 euro (per accaparrarsi un voto), si è mangiato di nuovo la reputazione visto che oggi li riprende a due milioni di cittadini. Li richiede indietro, soprattutto se sono diventati poverissimi! Renzi è il vero Superciuk! Ruba ai poveri per dare ai ricchi e ancora spera di comandare il Paese. Il signor Renzi deve fare solo una cosa, così come aveva promesso: sparire dalla scena politica italiana dopo i fallimenti collezionati dalle sue riforme giudicate incostituzionali, fino al miserevole tentativo di «colpo allo Stato», che doveva passare attraverso la riforma costituzionale. Torniamo, però, alla delega in questione. Ribadisco: è un disegno di legge delega e, quindi, per conoscere i particolari della misura bisognerà attendere comunque l'arrivo dei decreti legislativi, che dovranno essere varati dal Governo entro sei mesi. Bisognerà, quindi, attendere i decreti attuativi per capire con esattezza la platea dei beneficiari, i requisiti per poter accedere al beneficio, nonché come intende il Governo riordinare le prestazioni assistenziali e altro. Prevedete un investimento di 1,6 miliardi per l'anno 2017 e 1,8 miliardi per il 2018. Lo sapete, sono briciole. Le misure pensate non si riferiscono al cittadino singolo, non sono legate alla persona. Ponete l'attenzione prioritaria solo alle famiglie, lasciando indietro l'individuo. Qui devo essere chiara con chi ascolta da fuori: è grave, gravissima, la scelta della maggioranza di rinunciare al contributo delle opposizioni durante la fase in Commissione. La maggioranza, esprimendosi con parere contrario su tutti gli emendamenti, ha svilito la stessa funzione del Parlamento. È stata per noi una forzatura intollerabile. Lasciatemi dire che costituisce un episodio surreale il commento della maggioranza che ha valutato la proposta di reddito di cittadinanza «altamente pericolosa», in quanto una famiglia di due adulti e due bambini potrebbe addirittura percepire 1.630 euro al mese. Avete gridato allo scandalo. Peccato che sono misure e tabelle Eurostat, roba seria e coscienziosa. Forse per qualcuno è meglio continuare a tener in pugno un bel bacino elettorale mansueto e servile. Chissà se la maggioranza si è così sconvolta quando ha regalato miliardi alle banche private o quando Renzi ha bruciato dieci miliardi per la sua marchetta elettorale degli 80 euro che ora si sta riprendendo. Questa misura - non ci stancheremo mai di ribadirlo - appare dopo oltre due anni di voluta giacenza del nostro disegno di legge sull'istituzione del reddito di cittadinanza in Commissione lavoro, una misura shock veramente volta a risolvere il problema di milioni di cittadini che vivono al di sotto della soglia di povertà, atta all'inserimento lavorativo e, al contempo, all'innalzamento dell'economia e al consumo interno. Anziché giocare sulle coperture dei nostri emendamenti facendo melina nelle Commissioni, dovevate unirvi al nostro sforzo e trovare la strada migliore per attivare da subito il nostro disegno di legge. Invece avete perso tempo, a cominciare dal 2014 quando l'Italia aveva adottato il programma pilota per il sostegno per l'inclusione attiva (SIA). Nel SIA si prevedeva un progetto di reinserimento nel mondo del lavoro, nel tessuto sociale. Non avendo dati certi del monitoraggio, come Movimento 5 Stelle abbiamo cominciato autonomamente a contattare i Comuni per conoscere appunto l'andamento di questi progetti sociali. Abbiamo saputo che è tutto in panne. I Comuni ci hanno risposto dicendo che avevano accumulato diversi ritardi e che, quindi, era tutto fermo. Si sono rivelate, quindi, misure palliative fallibili, non monitorate e non strutturate. È logico: se non si investe non si può sperare nei miracoli. Le nozze con i fichi secchi non si possono fare. La vostra linea di risoluzione alla povertà e disagio ricalca il SIA, ma senza investimenti adeguati tutto si svilisce. La vostra proposta l'avete farcita di buoni propositi copiando alcuni «obblighi» del nostro reddito di cittadinanza, ma svuotandoli di risorse e, quindi, rendendoli vani. È una misura palliativa perché l'assegno mensile per famiglia potrà variare dai 320 euro ad un massimo di 400 euro, ma solo se si vive in condizioni allucinanti: famiglie con minori a carico o disabili, con l'ISEE all'osso. Si prevede una gamma di requisiti all'estremo ribasso. Manca l'individuazione della soglia del bisogno. La misura così pensata riteniamo sia totalmente inefficace per contrastare veramente la povertà. Con questo disegno di legge delega si passa la patata bollente ai Comuni. Gli stessi portavoce dell'ANCI in Commissione hanno chiarito le difficoltà eventuali a causa dell'insufficienza di personale e dei limiti alla spesa imposti dalle norme. Le persone hanno annotato che tutti i vostri fallimenti, dalla scuola, alla sanità, al jobs act, che si è bruciato 20 miliardi per dare precarietà, voucher e insicurezza, sono sulle vostre spalle. Ricordiamo che i provvedimenti da attuare inseriti nel jobs act per incentivare le politiche attive del lavoro e per le politiche sociali li stiamo ancora aspettando. I dati diffusi da Eurostat hanno certificato che il nostro Paese è quello che ha più poveri di tutta l'Europa: è una situazione drammatica, signora Presidente. I cittadini che vivono in conclamate condizioni di povertà in Italia sono circa l'11,5 per cento della popolazione, ovvero un totale di sette milioni di persone che vivono in condizioni di miseria. Ecco, queste per noi erano le priorità, signora Presidente, che andavano subito risolte. In Europa ci sono 123 milioni di poveri, troppi e in aumento. In questo scenario, se non viene regolato velocemente il tutto in un'ottica redistributiva, si andrà verso una crisi umanitaria e un notevole aumento delle disuguaglianze. Lo stanziamento di risorse che investite è assolutamente insufficiente. Gli italiani stanno chiedendo risposte. Le persone che usufruiranno della vostra misura sono pochissime: appena 280.000 famiglie, che avranno briciole che non li metteranno davvero in condizione di vivere una vita dignitosa e libera. Diteci come si può sopravvivere con cifre di 320-400 euro al mese con due figli a carico. Signora Presidente, la gente dice che ha fame e qualcuno gli risponde: «Ma dov'è il problema? Dategli al limite un po' di fritturina di pesce!». Questo è il problema.
2017-03-08	LN	CentinaioGianMarco	Le chiediamo di raccontare che nonostante le finte riforme dei mille giorni precedenti del dottor Renzi, la disoccupazione giovanile in Italia è al 40 per cento; le chiediamo di ricordare ai suoi colleghi che ci sono 4.200.000 italiani sotto la soglia di povertà assoluta, nonostante i mille giorni. Le chiediamo ancora di ricordare che ci sono 150.000 italiani che ogni anno varcano i nostri confini e se ne vanno all'estero a cercare un posto di lavoro; che negli ultimi quattro anni dei vostri Governi l'Italia ha perso 194.000 imprese e 800.000 addetti; che nell'ultimo anno sono stati chiusi 19.000 esercizi commerciali, che la crescita dell'1 per cento, con cui alcuni si riempiono la bocca facendo un po' di propaganda nei confronti degli italiani più disattenti, è la peggiore dell'Europa.
2017-03-08	M5S	LezziBarbara	E con la decontribuzione che avete tolto e con quella mancia elettorale, che c'è costata oltre 12 miliardi, siete riusciti ad aumentare il divario della media della disoccupazione tra noi e il resto d'Europa.
2017-03-08	M5S	LezziBarbara	Nel 2014 la differenza tra il dato relativo alla nostra disoccupazione e la media europea era dello 0,8 per cento e ora è arrivata all'1,6 per cento. Andatevene a casa!
2017-03-08	LN	StefaniErika	Signor Presidente, parlare dell'8 marzo sembra quasi retorico, ma penso ai primi movimenti femministi, alle prime donne che, combattendo contro la morale del tempo, cercavano di difendere dei diritti che allora sembravano essere un'utopia come il diritto di voto e di decidere. E pensare che il diritto di voto l'abbiamo conquistato come donne da pochi anni, considerando la storia della nostra civiltà e del nostro diritto. Eppure oggi, fuori da quest'Aula, è in atto uno sciopero, che è non solo italiano ma di interesse sovranazionale, quasi a voler dire di prestare attenzione, perché oggi le donne non stanno festeggiando con la mimosa o con la rosellina, ma stanno valutando qual è la loro condizione. Bisogna ricordare che in questo momento vi sono un rilevante problema di disoccupazione, un grandissimo precariato nel lavoro, il problema dell'inserimento dei giovani nel mondo del lavoro, il problema delle famiglie e del loro mantenimento, il problema di un enorme calo democratico. Stiamo parlando di una grandissima crisi della società nella quale le donne oggi dicono che non ce la fanno. È una crisi della società che sicuramente non dipende dalla condizione femminile; ma dove c'è la crisi la condizione femminile emerge e ci si rende conto degli ulteriori vulnus della nostra società e un vulnus è proprio quello della figura della donna. In quest'ultima legislatura abbiamo parlato più volte del femminicidio. Alcuni hanno anche criticato il fatto che si parli di femminicidio e che l'uccisione di una donna non può essere un reato più grave dell'uccisione di un uomo. Ma noi parliamo di femminicidio come di una violenza sulla donna e purtroppo di violenze sulle donne ve ne sono. Ci sono le violenze sulle donne, quelle sui bambini e nei confronti di tutti coloro che sono deboli nella nostra società. Capire il perché c'è la violenza nei confronti della donna è un passaggio molto difficile. Viviamo in un mondo in cui parliamo di informatica, di telematica e dove possiamo addirittura pensare alle realtà virtuali: eppure, ci sono delle carenze culturali enormi, anche e soprattutto nei confronti della figura femminile. C'è chi ritiene che la causa sia la crisi dell'identità dell'uomo oppure la crisi economica. Eppure, vengono ad essere toccate le donne, che spesso subiscono, e le violenze non sono sempre e solo le percosse: grandissime violenze sono anche le pressioni psicologiche o la forma di sudditanza che esiste all'interno di alcuni contesti, soprattutto familiari. E ogni qualvolta la donna insorge, in quel momento sembra sollevare la rabbia e l'astio dell'uomo che le sta accanto e che dovrebbe amarla, ma che può giungere addirittura ad ucciderla. Dobbiamo investire di più sulla cultura, affinché la parificazione tra uomo e donna riguardi tutti i diritti e anche le retribuzioni, perché esiste un grosso problema di divario retributivo tra uomo e donna. Le donne ormai hanno avuto la possibilità di penetrare in alcuni settori del lavoro: nella magistratura e nell'avvocatura vi sono moltissime donne. Eppure, quando si parla di lavoro autonomo e subordinato, troviamo differenze retributive, che dobbiamo assolutamente affrontare. In conclusione, dobbiamo ricordare che educare un bambino significa creare un uomo, ma educare una bambina significa creare un popolo.
2017-03-08	M5S	MontevecchiMichela	Signora Presidente, vorrei partire da un po' di numeri, per renderci conto di cosa stiamo parlando quando festeggiamo il giorno della donna, giustamente preoccupandoci che non si esaurisca tutto in una retorica finta. Vorrei dunque partire dal fatto che le donne italiane ottengono i risultati migliori a scuola e nelle università, ma poi sono penalizzate sul lavoro. Sono penalizzate per quanto riguarda le possibilità di avanzamento sul lavoro, da salari più bassi e anche quando decidono di intraprendere la meravigliosa avventura della maternità. Nell'ultimo trimestre del 2016, secondo l'ISTAT, le donne disoccupate sono 1.383.000 e il tasso di disoccupazione delle donne è del 12,7 per cento, cioè 1,9 per cento in più di quello maschile. Per quanto riguarda invece il tasso di occupazione, c'è un divario a favore degli uomini di 12,2 punti percentuali. Ha un contratto a tempo indeterminato il 48 per cento delle donne, rispetto al 58 per cento degli uomini. Le donne dirigenti sono ancora una rarità: è donna un dirigente su quattro. l'Italia è al quarantanovesimo posto su 145 Paesi analizzati dal World economic forum nell'indice di disparità di genere. Se tutte le donne in Italia incrociassero però le braccia, andrebbero in fumo 2 miliardi di euro, senza considerare il lavoro in casa e la cura dei figli. Oggi in Italia le donne devono ancora lottare per vedere riconosciuti i propri diritti e per combattere la violenza contro le donne. Ricordiamo che nel 2016 ci sono stati 116 casi di femminicidio. Ricordiamo anche che la Convenzione di Istanbul, in vigore in Italia dall'agosto 2014, ha ancora molti aspetti disattesi e tanti, quindi, rimangono ancora inchiostro su un foglio di carta. Lo sciopero globale delle donne oggi, lanciato in Argentina e che riguarda non solo l'Italia, ma anche 40 Paesi, vuol coinvolgere tutte le donne e lanciare questo grido d'allarme. La politica lo deve ascoltare agendo e facendo cose efficaci. Perdonatemi, ma in questo Parlamento non avemmo la sensibilità di dedicare il decreto per il contrasto al femminicidio del 2013 solo alle donne in quanto ci mettemmo dentro altro. Questa è una ferita che non possiamo dimenticare.
2017-03-09	M5S	CatalfoNunzia	Brava! CATALFO (M5S). Ma non è tutto: i cittadini che potranno usufruire di questo bonus - non si può parlare di vero sostegno al reddito, ma del solito bonus - continueranno a restare poveri, mentre i cittadini poveri che ne saranno stati esclusi continueranno a non avere alcun aiuto, abbandonati ancora una volta da uno Stato ipocrita, che fa finta di pensare alla povertà in Italia. Con questo provvedimento si continuerà a negare qualsiasi tutela - per esempio - ai giovani o ai pensionati, proprio mentre voi state aspettando di concludere questa legislatura per avere diritto al vitalizio (quella che chiamate «pensione» altro non è che un vitalizio mascherato, e lo sapete benissimo); alla povertà in Italia, però, possiamo destinare il niente. Eppure, signor Ministro, i dati relativi alla povertà, alla disoccupazione e alla mancanza di opportunità nel nostro Paese sono sotto gli occhi di tutti. La situazione è critica, per usare una parola carina: la disoccupazione giovanile ha superato il 40 per cento e in alcune Regioni del Sud addirittura sfonda il tetto del 60 per cento. Venga al Sud, signor Ministro. Facciamo un giro insieme e le mostrerò cosa accade ai giovani di quelle zone: ogni anno 100.000 persone abbandonano il nostro Paese, un terzo dei quali sono giovani, quei giovani a cui lei ha dedicato parole infelici. Più di un milione e mezzo di pensionati percepisce una pensione inferiore ai 500 euro. Negli ultimi anni 400.000 pensionati hanno abbandonato il nostro Paese per andare all'estero e cercare una vita dignitosa. La povertà è esplosa, raggiungendo i livelli del 2005; 17 milioni e mezzo di persone sono a rischio povertà o esclusione sociale, il 28 per cento della popolazione, per non dimenticare gli 11 milioni di cittadini, signor Ministro, che non riescono più ad accedere a cure mediche per mancanza di risorse. Siamo tra i Paesi con il tasso di povertà infantile più elevato; il 17 per cento della popolazione minorile, pari a 1.700.000 minori che vivono al di sotto della soglia di povertà. Noi qua stiamo facendo un provvedimento «topolino» che non aiuterà tutte le famiglie italiane e tutti i minori italiani. Mi spieghi: quale minore ha diritto e quale non ha diritto? Discutiamolo qui. Qual è il minore che ha diritto e qual è il minore che non ha diritto? Facciamo come la SIA? Se hai un figlio minore che ha due anni, ne hai diritto; se tuo figlio ha compiuto tre anni e mezzo, mi spiace, ma non ne hai più diritto. Muori di fame. Era difficile, ma ci siete riusciti. Avete fatto una legge che doveva servire per aiutare i più deboli, dimenticando i più deboli, dimostrando una vergognosa e totale mancanza di interesse nel risolvere il problema. Cosa fate peraltro? Cosa avete fatto? Avete anche eliminato e tagliato 211 milioni dal Fondo per le politiche sociali che sono comunque fondi per il sostegno al reddito che dovrebbero erogare i Comuni e 50 milioni dal Fondo per la non autosufficienza. Spiegatemi qual è il gioco? Togliamo di qua, mettiamo qualcosa di là, poi riordiniamo le prestazioni, colleghiamo all'ISEE e tutto cambia per non cambiare nulla e non abbiamo risolto il problema della povertà in Italia. Signor Ministro, fossi in lei mi vergognerei. È chiaro a tutti che in questa occasione quello che manca è la volontà politica e ciò si evince soprattutto dalle pochissime risorse economiche che vengono destinate a finanziare questo provvedimento. Stiamo parlando di poco più di un miliardo di euro di fronte, come minimo, a 7 miliardi per contrastare la povertà assoluta, ai 15 che sarebbero necessari per contrastare la situazione di tutte le persone che in questo momento vivono a rischio di povertà in Italia. Si parla quindi soltanto di circa l'8 per cento di quanto occorrerebbe stanziare; risorse del tutto insufficienti. Siete però stati sordi, con la fretta di far arrivare questo provvedimento in Assemblea, dove poi è rimasto perché anche qui si tergiversa; prima c'è la discussione generale, poi si interrompe, ci sono gli emendamenti, poi si interrompe di nuovo, dobbiamo ascoltare le vostre esigenze perché non bisogna portare certi provvedimenti in Aula, e poi si interrompe di nuovo e si fa la discussione; adesso, bene, giusto, cosa fate? Proprio per la fretta che avevate, avete dichiarato inammissibili tutti gli emendamenti del Movimento 5 Stelle. In Aula, nel corso del mio intervento di replica quale relatore di minoranza - l'ho voluto depositare, perché noi chiaramente abbiamo un'idea precisa e seria per contrastare la povertà in Italia - ho chiesto alla Commissione bilancio per quale motivo avessero dichiarato l'inammissibilità all'emendamento 1.57. Questo emendamento, che avrebbe destinato 2 miliardi in più al Fondo per l'esclusione sociale, è stato dichiarato inammissibile. Era un emendamento, signor Ministro, che andava a ridurre la percentuale di deducibilità di interessi passivi per le banche e le assicurazioni (insomma gli amici del Governo). Avevamo quantificato questo emendamento in 2 miliardi, ma dalla relazione del Ministero delle finanze addirittura veniva quantificato in 2.183.000.000, 2.838.000.000 per il 2018 e 2.838.000.000 per il 2019. Quindi, volutamente in quest'Aula non si sono voluti destinare 2 e quasi 3 miliardi in più per la povertà in Italia.
2017-03-28	LN	CentinaioGianMarco	In un momento in cui abbiamo il 40 per cento di disoccupazione giovanile, anche grazie a voi e alle vostre politiche scellerate, non si può dire che, anziché fare un curriculum, bisogna andare a giocare a calcetto. Mi piacerebbe vedere il ministro Poletti giocare a calcetto e osservarlo correre leggiadro con i tacchetti in un campo di calcetto invece di invitare i ragazzi italiani ad andare a giocare! Presidente, per questo motivo regaliamo al ministro Poletti il piccolo pallone che ho in mano per andare a giocare a calcetto.
2017-04-12	PD	AlbanoDonatella	Certo, è forte oggi la domanda di sicurezza. E questa domanda è forte e crescente per una serie di motivi. La crisi economica e la disoccupazione che diminuisce a fatica rendono tutti più poveri e più insicuri. Il fenomeno migratorio aumenta il numero di stranieri nelle nostre città, nelle periferie che diventano dormitorio e nei centri, dove molti di essi trascorrono le giornate alla ricerca di un lavoro o di un gesto caritatevole. Gli atti di terrorismo internazionale, infine, con gli ultimi episodi in Belgio, Russia, Svezia instillano un continuo timore e una continua preoccupazione nei cittadini, portandoli a guardare con paura ogni straniero e ogni atteggiamento non comune come una possibile minaccia.
