2017-05-03	LN	ConsiglioNunziante	Signor Presidente, ancora una fiducia: non che non ne l'aspettassimo, chiaramente, ma resta il rammarico che, nonostante l'ottima collaborazione con i due relatori e con il sottosegretario Gentile e i buoni rapporti che hanno caratterizzato il lavoro in Commissione in tutti questi mesi, sia stata posta un'altra fiducia. Una fiducia che non dà spazio al lavoro emendativo che è stato fatto in Commissione, volto esclusivamente a migliorare il disegno di legge, affinché il tema potesse essere definitivamente sviscerato, per consentire ai cittadini - che devono essere sempre al centro del lavoro parlamentare - di godere di condizioni economiche migliori, ma soprattutto per affermare il principio che chi produce e chi vende deve essere assolutamente tutelato. Non so a cosa porterà questa fiducia, perché il provvedimento passerà alla Camera e vedremo se anche lì sarà posta la questione di fiducia, sempre per velocizzare l' iter lentissimo di questo provvedimento, o se saranno introdotte delle modifiche: lo scopriremo - come diceva qualcuno - solo vivendo. Non siamo stati capaci di interpretare in modo sempre positivo questo provvedimento: un disegno di legge sulla concorrenza che nasce con buoni auspici, ma che poi si è insabbiato per motivi che ancora ci sfuggono o forse per la capacità di alcuni poteri forti e di alcune lobby di fare pressione. Il termine « lobby » viene sempre inteso in senso negativo, forse perché strumentalizzato, ma fare lobby non è una brutta cosa, perché significa tutelare i propri interessi. Ma noi siamo il Parlamento e dovremmo legiferare in modo tale da tutelare, oltre alle lobby, i cittadini intesi come consumatori e fruitori di servizi. Sono intervenuti molti colleghi in sede di discussione generale - e stiamo intervenendo ancora sulla questione di fiducia - ma vorrei ringraziare il ministro Finocchiaro per aver ascoltato, almeno in parte, il dibattito: ci fa molto piacere, visto che con il ministro Boschi non eravamo abituati. Forse alcuni considerano le liberalizzazioni come la panacea di tutti i mali; non so quanti punti di PIL pensino di recuperare e se si ritenga di incrementare la forza lavoro, gli occupati e gli stabili. So solamente che gli ultimi dati dell'ISTAT sono abbastanza impietosi, visto che la disoccupazione è ferma al 12-13 per cento (più di tre milioni di disoccupati). Non parlo poi della questione legata a quelle che vengono chiamate, in senso negativo, corporazioni. Non capisco come si possa dare un'accezione negativa al termine «corporazione» in un Paese come il nostro, con la sua storia e la sua cultura, dove il piccolo è bello, come il fatto di tramandare il lavoro di padre in figlio. Non capisco davvero cosa ci sia di negativo. Di liberalizzazioni abbiamo parlato spesso e abbiamo dato la colpa - per qualcuno i meriti - all'Europa. La mamma di tutte le liberalizzazioni è stata per noi un boomerang tremendo, la famosa Bolkenstein, una direttiva forse erroneamente chiamata così, perché ha scatenato l'ira di ambulanti, tassisti, operatori balneari e una marea di altri operatori economici. L'applicazione di questa direttiva, già all'atto della sua presentazione, suscitò un mare di polemiche e un vespaio di proteste da parte di tutti gli Stati. I Governi condivisero però la visione del signor Bolkestein. Secondo il suo pensiero, i servizi in Europa dovevano essere sottoposti a una drastica liberalizzazione. Questo avrebbe portato più concorrenza, maggiori opportunità per le imprese, minori costi per i consumatori. Diventò famoso l'esempio dell'idraulico rumeno. Infatti, in base al cosiddetto principio del Paese di origine o di stabilimento se un'azienda rumena vuole proporre i propri servizi in tutta Europa, può farlo seguendo la legge rumena anche se lavora in Italia. In effetti, un'azienda rumena se venisse in Italia a proporre i propri servizi mantenendo la legge rumena potrebbe trovarsi in una posizione di vantaggio sleale rispetto alle aziende indigene. Il senatore Gasparri prima ha fatto l'esempio delle pizzerie. Diversi sono i contributi, le prestazioni previdenziali nei confronti dei dipendenti, i requisiti e gli stipendi. Nel 2004 Bolkestein tornò in Olanda perché cambiarono il Parlamento e la Commissione. Il nuovo Parlamento rimise mano a quella bozza per modificarla significativamente. Il principio del Paese di origine sparì e si stabilì che non bisognava interferire con i Paesi che garantivano maggiore sicurezza sociale, condizioni di lavoro e occupazione discrete. Fu approvata la proposta dell'eurodeputata Evelyne Gebhardt, e forse la legge dovrebbe portare il suo nome. Si trattò di un compromesso tra i liberali, che ebbero la libertà di operare in tutta Europa con la caduta dei confini, e i socialisti, che videro protetti lavoratori e impiegati di ciascuno Stato dal rischio di una concorrenza al ribasso da parte di operatori esteri. Secondo me, furono entrambi dei grandi illusi. Sembrava una soluzione bilanciata, ma certamente alcune categorie e alcuni Stati subirono maggiormente l'impatto della novità e, tra questi Stati, sicuramente ci fu e c'è l'Italia, con le sue tradizioni, l'economia e la cultura nazionale. L'Italia è il Paese dove «piccolo è bello»; è anche - vorrei dirlo - il Paese dei campanili e delle corporazioni. Non sempre il termine corporazioni va inteso in senso negativo, se il trasferimento del lavoro da padre in figlio lo consideriamo un fatto positivo. Si è notato che certe categorie in Italia sono particolarmente in affanno ad aprirsi all'Europa per le piccole dimensioni dell'azienda familiare, che le rendono inadatte a competere e per natura molto vulnerabili. I tassisti, i balneari, gli ambulanti e tanti altri ancora sono spaventati dal dover competere sulle licenze con aziende di più grandi dimensioni e dotate di capitali e competenze. Quale effetto avrà sull'economia questo disegno di legge? Avremo un effetto sul PIL? Avrà un effetto reale sui cittadini, sui contribuenti e sui consumatori? Soprattutto, quale pensiero positivo possono avere i produttori? Produrre non è abbastanza perché chiaramente bisogna anche vendere. Quanti punti di PIL recuperiamo? Si parla di unità o rimaniamo ai decimali? Quanti nuovi assunti ci saranno? Per quanto riguarda l'apertura dei mercati, se la facciamo solo noi continuiamo a essere depredati. Ci sono aziende che chiudono e delocalizzano. Non ho capito bene a che cosa servano queste liberalizzazioni: forse sarebbe stato meglio occuparsi del taglio del cuneo fiscale. Piantiamola di parlare sempre di un taglio del cuneo dello 0,1 o dello 0,2 per cento, che non dimostra altro che la nostra incapacità di mettere mano alla questione delle tasse. A volte il PD e il Governo sono un po' come la luna, che vive di luce riflessa. Anche il lupo ulula alla luna e quante poesie e quanti scritti le sono stati dedicati! Il problema è che, comunque, come la luna vivete di luce riflessa e quando si mette in mezzo la Lega andate in eclissi e tornate ad essere politicamente bui.
2017-05-09	M5S	MoroneseVilma	Signora Presidente, intervengo per dire al Governo: bravi, ci state riuscendo! Potete ritenervi soddisfatti. È iniziato il declino degli istituti scolastici in provincia di Caserta. Oggi sono stata contattata da diversi alunni dell'Istituto tecnico «Buonarroti» di Caserta che, in seguito a un articolo di oggi su «Il Mattino» di Caserta, erano preoccupati che la loro scuola stesse per chiudere e per la conseguente perdita dell'anno scolastico. Allarmata da questa situazione e per le opportune verifiche, ho contattato la scuola, giusto due ore fa, e ho parlato con la dirigente e, mentre ero al telefono con lei, mi ha comunicato che in quel momento i carabinieri stavano disponendo il sequestro della scuola perché priva delle certificazioni sulla sicurezza, quindi relativamente al rischio sismico e alla normativa antincendio. Sono mesi, ormai, che intervengo in quest'Assemblea per denunciare la grave situazione degli istituti scolastici in provincia di Caserta. Gli istituti sono tutti a rischio chiusura perché sono di pertinenza della Provincia di Caserta, che però ha dichiarato il dissesto finanziario a dicembre 2015. Il dissesto ha provocato l'impossibilità a provvedere a tutte quelle funzioni che ancora le spettano, come la manutenzione delle strade, dei musei, la manutenzione ordinaria e straordinaria degli istituti scolastici. Da aprile è anche nell'impossibilità di pagare gli stipendi ai propri dipendenti. Situazione causata dalla finta e scellerata legge sulle Province di Delrio. Situazione causata dal fatto che il contributo annuale che la Provincia di Caserta dà allo Stato è uno dei più alti d'Italia, nonostante sia una delle Province con la più alta percentuale di disoccupazione: sì, perché anche la desertificazione industriale di Caserta è colpa vostra. Ricordate gli operai ex Indesit-Whirpool e tutti gli altri, vero? Ho fatto, qui in Aula, innumerevoli interventi per chiedere l'attenzione del Governo; ho depositato più di una interrogazione; ho presentato emendamenti (sempre bocciati); abbiamo cercato di coinvolgere la Regione Campania; come Movimento 5 Stelle ci siamo uniti alle proteste degli studenti, dei lavoratori e dei dirigenti scolastici. Nulla, non avete fatto nulla! Anzi, una cosa l'avete fatta: li avete illusi, tramite i vostri rappresentanti politici locali, che avreste salvato la Provincia di Caserta grazie alla cosiddetta manovrina, ed invece avete destinato solo 110 milioni, ma per tutte le Province italiane: sono risorse ridicole, che non risolveranno nulla. L'Istituto Buonarroti oggi chiude ed è una vergogna per tutta l'Italia. Ma questo è solo il primo degli istituti casertani costretti a chiudere, perché a ruota seguiranno gli altri. Fanno capo alla Provincia di Caserta 93 istituiti, pari a 83.000 studenti e ora, ad uno ad uno, chiuderanno tutti. Con l'anno scolastico in corso, come si farà? Cosa ne sarà di questi alunni? Cosa accadrà all'apertura dell'anno scolastico, considerato che la maggior parte delle scuole si trovano di fatto ad essere illegittime e non a norma? Statene certi, noi non lo permetteremo: se il Governo non interverrà per scongiurare questa vergogna e questo dramma, perseguiremo qualsiasi strada per denunciarvi e per far sì che i responsabili paghino per i danni causati ai cittadini casertani, ai genitori e soprattutto ai nostri studenti. Vergognatevi!
2017-05-09	PD	AngioniIgnazio	Signora Presidente, colleghi senatori, dopo la seconda lettura della Camera, io mi auguro che finalmente il Senato possa concludere definitivamente l' iter di questo provvedimento, consentendo al nostro ordinamento di avere, dopo diversi decenni, una disciplina organica per il lavoro autonomo. Nella prima lettura abbiamo già sottolineato come negli ultimi decenni, di fatto, la richiesta di nuove figure professionali da parte del mercato, accompagnata dall'introduzione di norme che hanno fatto nascere nuove tipologie di contratti di collaborazione, hanno reso la categoria del lavoro autonomo molto diversa dal passato e certamente non meno degna di protezione di quella del lavoro dipendente. Anzi, è certo che gli effetti della crisi economica degli ultimi anni si sono abbattuti in particolare su di essi e solo negli ultimi anni ci si è posti veramente il problema del loro riconoscimento come categoria di lavoratori bisognosi di attenzioni e di tutele, anche per la debolezza, se non l'assenza, per molto tempo, di strumenti associativi identificabili come credibili sostenitori delle loro rivendicazioni. Ecco perché abbiamo parlato di crisi di rappresentatività del mondo del lavoro, in particolare riferendoci al lavoro autonomo. Ed ecco perché è così importante che oggi il nostro Paese si occupi del loro riconoscimento, del riconoscimento di una categoria di lavoratori che ha bisogno di nuove norme di protezione e di tutele oggi per loro assenti. È stato ricordato, giustamente, che l'Italia è, tra i Paesi europei, quello, dopo la Grecia, con il più alto numero di lavoratori autonomi: tra il 23 e il 26 per cento, ci dicono le statistiche, sul totale degli occupati. Una percentuale che ci fa dire che non sempre si tratta di vero lavoro autonomo, ma spesso si tratta di forme di lavoro sostanzialmente subordinato, mascherato soltanto da lavoro autonomo. Tra le altre cose, quindi, noi dobbiamo comprendere come le nuove norme possano scoraggiare quelle forme distorsive di lavoro autonomo. E io penso che esse, le nuove norme, limitino l'utilizzo di questi rapporti per finalità distorsive. Lo fa innanzitutto l'articolo 3, quando definisce abusive e prive di effetto le clausole che attribuiscono al committente la facoltà di modificare unilateralmente le condizioni del contratto o, nel caso di contratto a prestazione continuativa, di recedere da esso senza un congruo preavviso. Ma uno degli aspetti più positivi del disegno di legge mi sembra quello di porsi l'obiettivo di costruire, per i lavoratori autonomi, finalmente un sistema di garanzie e tutele che io definirei anche un aggiornamento del nostro welfare, capace di dare delle prime importanti risposte alle loro esigenze. Lo fa, per esempio, questo provvedimento, prevedendo che i centri per l'impiego e gli organismi autorizzati alle attività di intermediazione in materia di lavoro si dotino di uno sportello dedicato al lavoro autonomo. Mi sembra, poi, certamente una conquista di civiltà l'articolo 12, che introduce una norma richiesta da tempo, in particolare dalle lavoratrici autonome. Si prevede che l'indennità di maternità venga riconosciuta a prescindere dalla effettiva astensione dall'attività lavorativa. C'è, inoltre, finalmente il riconoscimento dei congedi parentali anche per i padri che svolgono un lavoro autonomo. Importantissimo, poi, è l'articolo 13: la gravidanza, la malattia e l'infortunio dei lavoratori autonomi che prestano la loro attività in via continuativa per il committente non comportano l'estinzione del rapporto di lavoro, la cui esecuzione, su richiesta del lavoratore, rimane sospesa senza corrispettivo per un periodo non superiore ai centocinquanta giorni l'anno. Purtroppo, anche la Camera ha confermato la disposizione che questo principio è condizionato al fatto che il committente non abbia interesse a uscire dal contratto. Dico «purtroppo» perché personalmente avrei preferito che la Camera avesse superato questa disposizione. Molto importante è, a mio avviso, la disposizione che prevede la possibilità di sostituzione per la lavoratrice autonoma da parte di un proprio familiare. È prevista, tra l'altro, anche la compresenza della lavoratrice con il suo sostituto. Altrettanto rilevante è l'articolo 12, che formalizza in maniera chiara il fatto che la collaborazione si intende coordinata soltanto quando il collaboratore organizza autonomamente l'attività lavorativa. La Camera, in buona sostanza, ha, a mio giudizio, migliorato il testo così come lo avevamo licenziato in prima lettura al Senato. Voglio citare in particolare due disposizioni: anzitutto, quelle dell'articolo 5, che ha significativamente modificato le disposizioni votate in Senato, circoscrivendo l'oggetto dell'articolo previsto alla sola possibilità di rimettere alle professioni organizzate in ordini e collegi atti di pubbliche amministrazioni laddove sia assicurata la terzietà dei professionisti incaricati e l'esclusione di potenziali situazioni di conflitto di interessi, nonché il rispetto della tutela dei dati personali nell'esercizio di queste funzioni. È altresì di grande rilevanza l'introduzione da parte della Camera dell'articolo 7 che rende strutturale la cosiddetta DIS-COLL, ossia l'indennità di disoccupazione per i lavoratori con contratti di collaborazione continuata e continuativa. È un fatto di giustizia per quei lavoratori che non toglie nulla alle giuste riflessioni - che sentivo fare poco fa - su un futuro incerto, soprattutto da un punto di vista di trattamento pensionistico, per quei lavoratori. Si tratta di un primo passo, comunque molto importante, per il riconoscimento di una piena dignità di questi lavoratori. Infine, le disposizioni del Capo II del disegno di legge in esame disciplinano il lavoro agile chiarendo che questo istituto non costituisce una nuova tipologia contrattuale ma una particolare modalità di svolgimento della prestazione di lavoro subordinato, basata sulla flessibilità di orari e di sede e caratterizzata innanzi tutto da una maggiore utilizzazione degli strumenti informatici, telematici e delle altre possibilità che la tecnologia oggi offre per l'espletamento dei compiti lavorativi. Il lavoro agile si caratterizza per l'assenza di una postazione fissa durante i periodi di lavoro svolti fuori dai locali aziendali. Al lavoratore che svolge le proprie attività mediante modalità di lavoro agile si applica un trattamento economico e normativo - credo che questo punto sia da chiarire con assoluta certezza, anche per ribattere ad alcune considerazioni che non mi sembrano corrispondere alla realtà di quanto scritto nel testo al nostro esame - non inferiore a quello di chi svolge la propria attività in maniera ordinaria per le stesse mansioni. A quel lavoratore il datore di lavoro deve garantire - la norma è chiara sul punto - il diritto alla salute e alla sicurezza secondo «i rischi generali e specifici connessi alla particolare modalità di esecuzione del rapporto di lavoro». Concludo, signora Presidente, dicendo che con questo provvedimento non risolviamo certamente tutti i problemi legati al lavoro autonomo e alcune perplessità sull'applicazione delle norme riguardanti il lavoro agile probabilmente resteranno. Ma io credo che oggi facciamo un passo importante nel riconoscimento di nuove tutele a dei lavoratori che per troppo tempo sono stati privati di diritti fondamentali. La strada è ancora lunga, ma penso che con questo provvedimento noi rendiamo giustizia a quei lavoratori e facciamo per loro una cosa importante.
2017-05-09	PD	FaveroNicoletta	Signor Presidente, gentili colleghe e colleghi, torna oggi all'attenzione dell'Assemblea il provvedimento che è stato definito il jobs act degli autonomi, approvato lo scorso 3 novembre 2016 qui in Senato e poi alla Camera il 9 marzo e attualmente al nostro esame, ci auguriamo per una sua definitiva approvazione in legge. Secondo i dati Eurostat riferiti al terzo trimestre 2016, che ci dicono chi sono i lavoratori dipendenti, emerge che nella popolazione in età lavorativa compresa tra i quindici e i sessantaquattro anni nel nostro Paese gli occupati indipendenti sono 4,7 milioni; il 59 per cento circa di questa cifra sono lavoratori in proprio, ovvero artigiani, commercianti ed in generale quelli che la legge considera dei piccoli imprenditori. In percentuale gli indipendenti italiani sono il 21,1 per cento degli occupati complessivi, quindi circa 2,5 milioni di lavoratori autonomi che non hanno tutele né rappresentanza sindacale. Esso, inoltre, è sostenuto da un fondo ad hoc previsto nella legge di stabilità che quest'anno stanzia 50 milioni. Nel corso dell'esame presso l'altro ramo del Parlamento, il provvedimento ha subito ulteriori modifiche e limature, che hanno migliorato il testo. In questo breve intervento, voglio quindi evidenziare alcune novità introdotte e che reputo importanti in tema di lavoro autonomo, segnalando però anche delle contraddizioni esistenti sul tema della gestione separata, già ripreso dal presidente Sacconi, ed in conclusione una riflessione sul modello del lavoro agile e il mondo della disabilità. Tra le misure contenute in tema di lavoro autonomo, voglio evidenziare, in materia di sicurezza, la delega al Governo finalizzata al rafforzamento delle prestazioni di sicurezza e protezione sociale dei professionisti iscritti ad ordini e a collegi. L'articolo 6, comma 1, consente agli enti di previdenza di diritto privato, anche in forma associata, ove autorizzati dagli organi di vigilanza, di attivare, oltre alle prestazioni complementari di tipo previdenziale e sociosanitario, anche altre prestazioni sociali, finanziate da apposita contribuzione. A chi è rivolta, allora, questa formula? È rivolta a quegli iscritti che hanno subito una significativa riduzione del reddito professionale per ragioni non dipendenti dalla loro attività o che siano stati colpiti da gravi patologie. Il comma 1- bis aggiunto durante l'esame del provvedimento alla Camera reca un'altra delega finalizzata ad incrementare ulteriormente le prestazioni sociali per maternità e malattia riconosciute agli iscritti alla gestione separata INPS, prevedendo che, per assicurare il finanziamento, possa essere aumentata in misura non superiore a 0,5 punti percentuali l'aliquota contributiva di riferimento. Tali disposizioni si accompagnano ad un'altra misura approvata qui in Senato, su cui avevo presentato una specifica proposta emendativa, accolta, che prevede, all'articolo 8, per le lavoratrici ed i lavoratori che devono sottoporsi a trattamenti oncologici, e dunque sono inabili anche per un lungo periodo, il riconoscimento della degenza ospedaliera come per altre patologie gravi ed invalidanti. Stiamo parlando, oltre che dei malati oncologici, anche di chi soffre di diabete, di sclerosi, di morbo di Parkinson, di insufficienze cardiache, respiratorie e renali, di Alzheimer, di fibrosi cistiche e di altro ancora. Un'altra opportuna modifica approvata alla Camera ha reso permanente l'indennità di disoccupazione per i lavoratori con rapporto di collaborazione coordinata e continuativa (la cosiddetta DIS-COLL), introdotta in via sperimentale dal decreto legislativo n. 22 del 2015, attesissima ed estesa fino al 30 giugno 2017 dal recente decreto-legge di proroga termini. Certo, rimangono ancora degli argomenti da affrontare, come ad esempio la gestione separata. In questa legislatura, dopo dieci anni dal riconoscimento, attraverso la legge finanziaria per il 2007, dell'indennità di malattia e del congedo parentale di tre mesi, siamo riusciti, con la legge di bilancio per il 2017, a consentire il cumulo dei contributi della gestione separata con tutti gli altri contributi, per poter avere una pensione unica. Rimangono ancora tante altre contraddizioni, che non consentono alla gestione separata di avere pari dignità rispetto ad altre gestioni o ad altri fondi. Ma ecco allora un obiettivo che ci dobbiamo porre noi, come legislatori: arrivare a un testo unico della previdenza sociale, che potrebbe sanare tali difficoltà. Infine, il provvedimento in esame offre un'interessante opportunità anche per il mondo della disabilità, di cui mi sono occupata in questa legislatura, grazie proprio al modello dello smart working. Questo modello, secondo una stima dell'Osservatorio del Politecnico di Milano, già riguarda 250.000 lavoratori dipendenti di aziende con più di 10 addetti, che svolgono questo lavoro in modalità agile; tale numero è cresciuto del 40 per cento negli ultimi due anni. Si tratta di un fenomeno diffuso, soprattutto nelle grandi imprese. Diverso è il caso invece per le piccole e medie imprese, dove solo il 5 per cento dei lavoratori lavora in tale modalità. Ecco quindi che per i disabili la modalità organizzativa del lavoro agile si presta a interpretare - oserei dire quasi come fosse un abito cucito su misura - il ruolo assegnato dalla normativa europea e internazionale dell'accomodamento ragionevole in tutte le sue declinazioni. Ma ciò riguarda anche la situazione femminile, dove l'Italia ha un tasso di disoccupazione pari al 14 per cento, superiore alla media europea che è del 10 per cento. Nel 22 per cento dei casi le donne che lavorano al momento della gravidanza non lavorano più a due anni dalla nascita del figlio, mentre quasi la metà di coloro che continuano a lavorare riscontrano dei problemi di conciliazione tra vita privata e vita lavorativa. Se si desse loro la possibilità di gestire in modo più flessibile e intelligente il proprio orario di lavoro o di lavorare talvolta anche a casa, una parte di coloro che hanno lasciato la propria occupazione rientrerebbe nel mondo del lavoro e sarebbe più facile quindi conciliare lo status di madre con quello di lavoratrice. Un accomodamento è un adattamento alla situazione concreta delle normali procedure, dei processi o delle infrastrutture idoneo a consentire al disabile di accedere, partecipare o progredire all'impiego e nella carriera. Il lavoro agile, così come delineato in questo provvedimento, rappresenta la forma per antonomasia di accomodamento ragionevole nelle situazioni in cui ci sono delle difficoltà a raggiungere il posto di lavoro. Esso infatti non riguarda solo l'adattamento della posizione lavorativa come ambiente fisico, di ergonomia, di dispositivi e ausili, ma ancor più esso rappresenta un modello di riconciliazione del ciclo di vita, di cura e di lavoro. Quindi noi, come Partito Democratico, ci apprestiamo a votare a favore di questo provvedimento e ci auguriamo che esso arrivi molto rapidamente alla conclusione del suo iter, in modo che possa essere fruibile da tutti i lavoratori autonomi che lo stanno aspettando e che dia finalmente loro quella dignità e quelle opportunità che finora non ci sono state, conciliandole con quelle approvate già nel jobs act.
