2017-01-10	LN	DivinaSergio	Signor Ministro, le dobbiamo dire che una relazione come la sua informativa odierna ci lascia disarmati, nel senso che, se aveva qualcosa da dire, toccato nella sua sensibilità, ci saremmo aspettati una dichiarazione coram populo, non dico a braccio, ma almeno con un po' di sentimento. Arriva, invece, con una nota predisposta di cui da lettura, dove si tenta di ingarbugliare e di far passare delle azioni delle quali davvero il Governo dovrebbe vergognarsi. Signor Ministro, parliamo solo di quanto tocca lei e delle sue responsabilità: i dati di oggi, che non risalgono a un anno fa ma che abbiamo letto questa mattina, dicono esattamente il contrario, cioè che c'è una disoccupazione arrivata al 12 per cento e non può essere letta con il dato che ci ha dato lei, di qualche mese fa, che sembrava tendenzialmente di segno contrario. È di oggi la relazione della Camera di commercio di Bolzano, secondo la quale, tutto sommato, sono state gestite bene le politiche del lavoro, con una disoccupazione attuale del 3,2 per cento. Non diciamo che tutti possono trovarsi nella situazione della Provincia di Bolzano, ma forse bisognerebbe pensare che se decentrassimo le politiche del lavoro, dove forse si conoscono meglio le questioni, dove si hanno gli strumenti e non ci sono gli sprechi presenti in altri settori, probabilmente le cose andrebbero meglio. Il livello di disoccupazione dei giovani, che arriva attorno al 40 per cento, è una bomba innescata e non possiamo continuare a dire che con il jobs act abbiamo tentato di risolvere il problema. Non abbiamo tentato di risolvere niente e ve lo abbiamo detto a tutte le latitudini (tranne che la sua maggioranza, che per pudore ha dovuto votare il jobs act punto e basta): sul jobs act andava fatto il punto, la verifica, dopo tre anni. Era inutile dire che vi sono state assunzioni, perché ora si manifesta tutto l'aspetto negativo: sono finiti gli incentivi, le imprese non hanno più interesse e non si assume più nessuno e i dati purtroppo, non ne siamo felici, ma dobbiamo leggerli per quelli che sono. Signor Ministro, noi sappiamo delle cose e ci chiediamo: ma il Governo lo sa? Prendiamo quelle politiche sciocche, fatte per i giovani, come i 500 euro dati ai maggiorenni: sapete che fine hanno fatto? Lo sappiamo noi: c'è il mercatino dell'usato, si vendono i bonus al 50 per cento!
2017-01-10	M5S	GirottoGianniPietro	Grazie, signora Presidente. Mentre accade questo, il ministro allo sviluppo economico Carlo Calenda pensa di far riscrivere le regole della strategia energetica nazionale dagli stessi attori che quegli aumenti stanno determinando. Su questo punto, il Movimento 5 Stelle ha presentato un'interrogazione su cui chiediamo una risposta al più presto. Nello specifico cosa è successo? È successo che il ministro Calenda ha scelto di coinvolgere nella consulenza per lo studio di revisione della strategia energetica nazionale la società privata statunitense Boston Consulting Group, da cui arriva Francesco Cuccia, attualmente capo della segreteria tecnica dello stesso Ministro. Quindi, una persona che ha lavorato alla Boston Consulting Group fino a poco tempo fa adesso è capo della segreteria tecnica, e alla sua ex azienda viene conferito questo prestigioso incarico. Insomma, qualche dubbio ci sorge. Sarebbe utile che il Ministro venisse in Parlamento a riferire, invece di affidare a un brevissimo tweet le proprie intenzioni. Ora, noi verificheremo se sulla vicenda esista o no un conflitto di interessi, ma ci preme di chiarire un altro aspetto fondamentale: chi paga quella consulenza. Infatti, cari italiani, dovete sapere che questi soldi non li tirerete fuori direttamente attraverso il Ministero dello sviluppo economico, perché non li paga il Ministero, ma li mettono Terna e Snam, quindi, indirettamente, sempre voi italiani. Terna e Snam perché, evidentemente, hanno un futuro legato mani e piedi proprio al destino della strategia energetica nazionale. Quindi, i due attori principali sono quelli che pagano lo studio su cui andrà basata la modifica della strategia energetica nazionale. Tra l'altro, due aziende che prevalentemente sono ad azionariato straniero e, quindi, potrebbero tranquillamente non fare gli interessi nazionali. Ma perché questo studio non è stato affidato i nostri bravissimi tecnici, veramente bravi, presso il Gestore dei servizi energetici, ricerca di sistema energetico e l'ente nazionale per le nuove tecnologie, l'energia, e lo sviluppo economico sostenibile? Perché continuare a fare decidere sulla strategia energetica nazionale e su aspetti strategici investitori stranieri? Cari italiani, siamo passati, negli ultimi anni, da un controllo strategico pubblico sull'energia ad uno al servizio di interessi particolari privati i cui obiettivi, però, temo non coincidano con un modello di sviluppo sostenibile cui dobbiamo puntare con la strategia energetica nazionale, cioè il raggiungimento dei target e degli obiettivi 2030 sulla riduzione delle emissioni, sull'incremento della produzione di energia rinnovabile e di efficienza energetica, in una parola: lotta al cambiamento climatico e alla disoccupazione. Sì, disoccupazione, perché efficienza energetica e fonti rinnovabili significano centinaia di migliaia di nuovi posti di lavoro.
2017-01-10	M5S	MontevecchiMichela	Lei fa però un altro scivolone nel mentre ricerca le ragioni della situazione in cui ci troviamo oggi. È giusto ripercorrere l' excursus, però lei parte con la crisi del 2008, la riforma delle pensioni del 2011 e lo scollamento tra scuola e impresa, perché c'è l'urgenza di creare dei giovani che abbiano delle capacità, delle competenze e del saper fare. Per noi, invece, bisogna creare degli adulti che sappiano essere cittadini attivi e partecipi in questa società, i quali sappiano quindi pensare e ribellarsi, quando è giusto, con la critica costruttiva. Poi continua raccontandoci - e qui sta lo scivolone - la sua favola, la favola di un Ministro nel Paese delle meraviglie. Io, invece, la vorrei risvegliare da questa favola perché in questo mondo delle meraviglie che lei ci ha raccontato snocciolando qualche dato, in realtà, non vivono tanti giovani e adulti. Infatti, sono proprio di ieri i dati dell'ISTAT che ci ricordano che in questo Paese la disoccupazione giovanile è aumentata di due punti percentuali solo nell'ultimo mese, attestandosi al 39,4 per cento, e il tasso di disoccupazione generale è all'11,9 per cento se non consideriamo gli inattivi perché, Ministro, tante persone hanno perso lo spirito e la voglia di cercare lavoro, sono frustrate e depresse perché non vedono prospettive. Allora, se noi aggiungiamo queste persone e le contiamo arriviamo ad un tasso di disoccupazione che sfiora il 20 per cento. Il mondo del lavoro non è certo migliorato, mi scusi, con le sue politiche perché il jobs act ha fatto tutto tranne che dare più stabilità e meno precarietà al mondo del lavoro in questo Paese. Partiamo con i voucher che sono esplosi. Nel 2016 abbiamo avuto più di 145 milioni di voucher e questo grazie anche alla sue politiche che hanno ampliato la platea di coloro che ne potevano usufruire e hanno alzato il tetto. Abbiamo quindi un aumento dei voucher, rispetto al 2015, del 30 per cento e del 70 per cento in più rispetto al 2014. Gli sgravi contributivi che erano stati previsti per favorire le assunzioni a tempo indeterminato, mi scusi Ministro, sono serviti a creare una narrativa, una bolla occupazionale che fa parte solo della vostra narrativa politica più che di dati reali, una narrativa politica, uno slogan che voi avete utilizzato variamente per tentare di portare a casa altri obiettivi politici che non fossero quello di dare veramente stabilità e di combattere la precarietà in questo Paese. Allora perché se ne vanno questi giovani? Glielo diciamo noi perché se ne vanno: se ne vanno innanzi tutto perché si sentono ignorati e abbandonati da una politica autoreferenziale che in questa legislatura ha dimostrato di avere maggiore attenzione per gli interessi delle lobby, delle banche, delle assicurazioni e dei propri interessi in campo piuttosto che per varare veramente delle politiche a favore dei giovani e meno giovani per non subire la precarietà quotidiana non solo materiale ma anche emotiva, che deriva dal non poter contare su un lavoro o sul potersi ricollocare in un mondo del lavoro veramente flessibile e che funzioni. Abbiamo il 28,7 per cento degli italiani a rischio povertà o esclusione sociale. Il reddito di cittadinanza, la nostra proposta, giace da due anni e più nella Commissione di competenza perché voi non volete ragionare e siete ciechi su questo. Il 47,3 per cento delle persone dichiara di non potersi permettere una settimana di vacanza, il 17 per cento di non poter riscaldare adeguatamente le proprie case, l'11,8 per cento delle persone dichiara di non riuscire a fare un pranzo adeguato e il 15 per cento delle persone dichiara di avere avuto arretrati per mutui, affitti o bollette. Chiudono 390 imprese al giorno e 11 milioni di persone rinunciano alle cure e questo perché voi avete portato avanti delle politiche, e lei ha portato avanti delle politiche nel mondo del lavoro che non solo hanno tradito le attese dei giovani e dei loro genitori, ma hanno tradito anche i principi sanciti dalla nostra Carta costituzionale perché l'articolo 3 impone alla Repubblica di portare avanti delle politiche che assicurino pari opportunità a tutti ed uno sviluppo della persona pieno attraverso la garanzia anche dei diritti economici
2017-01-10	PD	ParenteAnnamaria	Noi abbiamo bisogno di affrontare il tema della fuga dei cervelli sotto vari aspetti. In primo luogo, noi viviamo oggi in un mondo che offre molte più opportunità rispetto alle generazioni precedenti. Quindi la fuga dei cervelli dovremmo ribattezzarla come una grande opportunità. Chi sceglie di fare un'esperienza all'estero è più libero di farla rispetto al passato. In un mondo globale, sono molte di più le équipe internazionali, soprattutto in campo scientifico, ed è fondamentale la collaborazione fra talenti. In Italia ci sono molti esempi di eccellenza: abbiamo cartelline piene di nostri giovani che vengono premiati e di nostri centri di eccellenza che sono all'avanguardia nel mondo. Questo significa che noi dobbiamo badare alla storia delle generazioni. Parliamo tutti di giovani: invito chi non l'avesse ancora fatto ad andare a vedere una bellissima mostra dell'ISTAT che parla della storia delle generazioni dal 1926 ad oggi. Pensiamo solo a quanto è cambiata l'aspettativa di vita: la nonna Maria, che è descritta in questa mostra, aveva un'aspettativa di vita di cinquantadue anni, mentre sua nipote Giulia ha oggi un'aspettativa di vita di ottantaquattro anni. Pensiamo a quanto è cambiata la storia delle generazioni. Il mondo in cui viviamo è un mondo globale, in cui i nostri figli hanno il sapere in tasca ed hanno accesso al mondo. Questo è. E quando il senatore Quagliariello parla di circolarità del lavoro, si riferisce esattamente a questo. In secondo luogo, per chi vuole tornare in Italia, ci deve essere qui una politica pubblica che aiuti il rientro dei nostri giovani che scelgono di rientrare in Italia. Nella legge di stabilità abbiamo inserito un aiuto sostanzioso, dal punto di vista fiscale, per i nostri ragazzi (i cosiddetti "cervelli in fuga") che hanno voglia di tornare in Italia. Infine il nostro impegno è come tutti possono accedere a questo mondo aperto, e quindi costruire una società in cui ci siano pari opportunità di accesso, e come il nostro Paese diventa attrattivo (sviluppare e creare posti di lavoro). Ricordo che nella legge di stabilità è contenuto un pacchetto di misure, che non vi è mai stato prima (Industria 4.0), per rendere il nostro Paese attrattivo. Rispetto molto il dibattito sui voucher, e il Ministro ha appena annunciato che ci saranno ulteriori correttivi, di cui nessuno parla, con misure sostanziose per rafforzare le competenze dei nostri giovani. Ma la politica pubblica vera è quella che rafforza e mira a sostenere le competenze dei giovani in un mondo aperto e globale. Quindi, il tema della politica oggi è costruire opportunità in Italia per chi vuole rimanere e sviluppare un sistema che riesca ad attrarre anche chi vuole entrare nel nostro Paese. Faccio una osservazione sui dati, come ho fatto già in altre occasioni. Noi possiamo dividerci, maggioranza e opposizione, sulla qualità e sui tipi di interventi da fare sul lavoro, ma dobbiamo parlare di dati con l'accortezza necessaria, perché i dati fotografano una realtà. L'aumento su base annuale degli occupati è indice del fatto che andiamo verso una stabilizzazione dell'occupazione, anche in presenza di una notevole crisi economica, pur nella flessione dei dati occupazionali del mese di novembre. E l'aumento della disoccupazione giovanile indica la diminuzione degli inattivi. I nostri giovani, cioè, hanno più fiducia nel presentarsi e nel cercare lavoro. Poi ci divideremo sulle politiche, ma sui dati, per favore, cerchiamo di fare ragionamenti concreti. Come il Ministro sa, quanto è ancora necessario fare è sostenere una vera politica attiva, perché solo così noi potremo intercettare il senso di scoraggiamento e di solitudine dei nostri giovani. L'ANPAL, infatti, sta partendo. Questa è una politica di verità, e decidere misure pubbliche per aiutare i giovani fa parte della responsabilità di tutti. Concludo dicendo che non è tollerabile, né giustificabile, né pensabile l'attacco che il Ministro e la famiglia del Ministro hanno subito in queste ore. La nostra solidarietà è piena.
2017-01-18	M5S	PagliniSara	Signor Presidente, la previdenza è uno dei nervi scoperti di questo Paese e le soluzioni messe in atto dal Governo non sono assolutamente soddisfacenti. Diciamolo chiaramente: avete perso anni preziosi nei quali si potevano dare risposte concrete per i nostri cittadini più fragili e disagiati. I vari Governi di questa legislatura hanno voluto ignorare i pensionati, una categoria sempre più abbandonata. Essere qui oggi per discutere di una mozione sulle pensioni minime (cioè di un impegno che il Governo dovrebbe prendersi per questa fascia di cittadini) è già una specie di presa in giro per loro. Un Paese strano questo, dove i giovani devono essere giovani fino ad età inverosimili e restare a vivere con i genitori e i nonni perché sono senza lavoro e dove i vecchi devono restare per forza giovani per poter lavorare fino allo sfinimento delle loro forze. I dati riguardo la povertà ascoltati anche ieri in Commissione lavoro dal presidente dell'INPS Boeri sono preoccupanti e disastrosi. Dal 2014 ad oggi la povertà è in continuo aumento. Un Paese che si sta sempre più avvitando e che vara misure di sostegno al reddito farlocche, come l'ASDI (assegno di disoccupazione), per il quale si è speso meno del 3 per cento delle risorse messe in campo, e il SIA (sostegno per l'inclusione attiva), che ha lasciato fuori tanti, visto che il tasso di accoglimento è meno di un terzo (si parla del 29 per cento). E abbiamo avuto la notizia, sempre nell'audizione di ieri dei rappresentanti dell'ANCI, che non è ancora partita ad oggi l'assegnazione di tale beneficio. Nessuno, cioè, sta percependo ancora nulla. Questo per l'estrema burocratizzazione e per le misure troppo restrittive per accedere a queste elemosine di Stato; una burocrazia mescolata spesso ad annunci spot. Cosa dire di Renzi, che il 14 novembre 2016 si ricorda delle pensioni minime, volutamente a ridosso del più importante referendum costituzionale di sempre, annunciando un aumento fra i 30 e i 50 euro al mese per i pensionati sotto i mille euro. Poco prima si era lanciato con il solito bonus di 80 euro, ma poi ci ripensò. Misure che, comunque, non portarono i risultati desiderati. Forse il disagio e la povertà sono veramente al limite, e sono sempre meno le persone che credono agli annunci finalizzati al consenso elettorale. I dati di oggi ci dicono che sei pensionati su dieci percepiscono una pensione inferiore a 750 euro al mese. E vorrei vedere come potreste voi vivere con 750 euro al mese. E qualcuno noi lo conosciamo da vicino!
2017-02-15	PD	ParenteAnnamaria	Il mio intervento si concentrerà soprattutto sulle disposizioni in favore dei giovani. In primo luogo, abbiamo prorogato i termini e trovato risorse per l'indennità di disoccupazione per le lavoratrici e i lavoratori con rapporto di collaborazione coordinata e continuativa, la cosiddetta Dis-Coll. Ricordo che nel jobs act abbiamo introdotto, per la prima volta nella storia, un ammortizzatore sociale per le lavoratrici e i lavoratori, soprattutto ragazze e ragazzi, con contratto di collaborazione coordinata e continuativa iscritti alla gestione separata. L'articolo 15 del decreto legislativo n. 22 del 2015, in attuazione del jobs act, ha istituito la copertura della disoccupazione per questi lavoratori, in via sperimentale, per il 2015. Con la legge di stabilità dell'anno scorso abbiamo prorogato i termini di tale misura sperimentale. Come ha ricordato la collega Pezzopane, quest'anno, grazie all'impegno del mio partito e del Governo, prorogheremo i termini per il 2017 fino a giugno. Come sapete, l' iter parlamentare non è stato semplice, ma ce l'abbiamo fatta. È stato accolto un emendamento a mia prima firma, frutto dell'impegno e del lavoro del Gruppo, della Commissione lavoro, previdenza sociale e di altre colleghe, a partire dalla capogruppo in Commissione affari costituzionali, Doris Lo Moro. Ce l'abbiamo fatta e ciò migliorerà la condizione di 300.000 lavoratrici e lavoratori del nostro Paese, grazie all'impegno del Governo e del sottosegretario Pizzetti, che è qui presente in Aula. Non era facile, ma ce l'abbiamo fatta, per non lasciare scoperti nessuna ragazza e nessun ragazzo in presenza di eventi involontari di perdita di lavoro. Ma non ci fermiamo qui: l'indennità di disoccupazione per i collaboratori deve essere resa misura stabile e non più sperimentale. Per renderla stabile dobbiamo intervenire sulla copertura contributiva, ritoccando le aliquote assistenziali della gestione separata. In Senato, in sede di discussione del provvedimento sul lavoro autonomo, abbiamo approvato un ordine del giorno che impegna il Governo ad intervenire sulla gestione separata. Alla Camera dei deputati, grazie anche all'impegno di colleghe giovani su questo tema, nella discussione sul provvedimento in materia di lavoro autonomo, sarà contenuta una delega in cui si interverrà su questo tema, al fine di rendere stabile la misura per coprire i lavoratori coordinati e continuativi. Un'altra misura in favore dei giovani riguarda i cosiddetti precari dell'ISTAT. Non mi piace usare termine «precari», perché si tratta di 350 giovani ricercatori qualificati, che hanno partecipato al censimento 2011 dell'ISTAT e che, grazie a questa misura, si accingono a partecipare al censimento del 2018. Anche in questo caso, nonostante non sia stato facile, abbiamo dato una risposta doverosa alle lunghe giornate di tensioni e proteste che hanno coinvolto i lavoratori dell'istituto e, grazie al nostro emendamento e all'impegno del relatore Collina (come ricordava nella sua relazione), i 350 lavoratori, soprattutto giovani, potranno partecipare al concorso interno dell'ISTAT per l'assunzione. Si tratta di un risultato atteso da anni, che dimostra che la buona politica può rispondere anche alle esigenze dei nostri giovani. Nel mondo del lavoro, con l'aumento dell'età pensionabile, in attesa dei decreti attuativi su APE e APE sociale che potranno consentire l'uscita dal lavoro, noi dobbiamo assolutamente premiare i giovani, i giovani ricercatori, i giovani qualificati che per lavorare in ISTAT hanno superato prove difficili e molto qualificanti. Per agevolare il lavoro dei giovani dobbiamo rafforzare la rete dei servizi per l'impiego e il provvedimento che stiamo per approvare consentirà alle Province e alle Città metropolitane, nelle more dell'attuazione del processo di riordino delle funzioni connesse alle politiche attive del lavoro e al solo fine di garantire la continuità dei servizi erogati dai centri per l'impiego, di stipulare contratti di lavoro a tempo determinato con scadenza non successiva al 31 dicembre 2017, anche nel caso di mancato rispetto degli obiettivi di finanza pubblica per l'anno 2016, purché venga garantito l'equilibrio di parte corrente nel periodo interessato dai contratti stessi. Questo al fine di rafforzare la rete dei servizi per l'impiego e intercettare quel senso di solitudine che molti giovani trovano nella ricerca del lavoro. Anche in questo caso il nostro impegno non si esaurisce qui. Ora abbiamo l'Agenzia nazionale per le politiche attive del lavoro (ANPAL), che è stata resa operativa a gennaio di quest'anno, e Italia Lavoro SpA che si è trasformata in ANPAL Servizi e anche lì ci sono 700 persone, soprattutto giovani, che non hanno un contratto di lavoro stabile e che sono risorsa preziosa per rafforzare i servizi per l'impiego e le politiche attive. Rafforzare la rete dei servizi per l'impiego, sia quantitativamente che qualitativamente, con l'apporto qualificato di persone che ci lavorano, introducendo livelli essenziali delle prestazioni per garantire servizi per tutti i disoccupati è il senso della riforma più grande del Governo Renzi e dell'impegno del Governo Gentiloni Silveri. Ora garantire servizi per tutti i disoccupati da Nord a Sud è l'obiettivo prioritario, al fine di rafforzare le competenze di lavoratori e lavoratrici e quindi far nascere davvero luoghi di incontro di domanda e offerta di lavoro e agevolare il dialogo tra sviluppo o occupazione. Nel corso della discussione odierna, soprattutto in interventi dell'opposizione, si è detto che il decreto-legge milleproroghe contiene elementi disomogenei, tuttavia vi si possono rintracciare norme fondamentali. Abbiamo fatto una discussione paradossale poc'anzi, in sede di esame delle questioni pregiudiziali: andiamolo a raccontare ai 300.000 giovani precari che questa norma non era necessaria; andiamolo a raccontare ai 350 ragazzi e ragazze dell'ISTAT che queste norme non erano necessarie o non erano urgenti! Queste misure non erano di carattere urgente? L'impegno del mio Gruppo, del Partito Democratico e del Governo va in questa direzione, perché ci accingiamo ad approvare provvedimenti che vanno nel senso di migliorare la condizione dei giovani e rafforzare le politiche attive del lavoro. Questo è il nostro impegno, lo abbiamo messo in questo provvedimento e continueremo a assolverlo. Tutti quelli che sono in questi condizioni e anche il nostro Paese giudicheranno da questo qual è la bontà del provvedimento.
2017-02-16	FI	AmideiBartolomeo	AMIDEI (FI-PdL XVII). Per una cosa positiva ce ne sono però troppe che non condividiamo: si proroga l'emergenza rifiuti in Campania e, solo all'ultimo momento, ci si ricorda che l'indennità di disoccupazione per i collaboratori è scaduta il 31 dicembre e, quindi, si mette l'ennesima pezza. Insomma si fa un autentico «minestrone» made in Italy, che purtroppo non ci fa onore quando questo brand diventa esempio di qualità per il mondo. La qualità nel milleproroghe non c'è: anzi, si mostra quanto questo Paese sia lontano dall'essere stato riformato e sia completamente imbrigliato. Voglio anche citare velocemente il problema delle banche. PRESIDENTE. Deve concludere, avendo superato gli undici minuti. AMIDEI (FI-PdL XVII). Ci sono i temi della direttiva Bolkestein e del commercio ambulante. È possibile che un individuo con un banco sia costretto a osservare dei bandi? Presidente, mi dia un altro minuto, e le chiedo l'autorizzazione a consegnare il testo del mio intervento. Dove siamo arrivati? I tassisti onesti vivono un momento difficile con le loro imprese private familiari e, se vanno male, non chiedono niente a nessuno. Invece di metterli in difficoltà, dobbiamo aiutarli.
2017-02-16	PD	PagliariGiorgio	Può esserci qualcosa che non soddisfa nelle misure, però vorrei ricordare, prima di tutto, quello che è stato fatto in termini positivi andando avanti col milleproroghe. Ci sono misure sulla rivalutazione delle pensioni; ci sono misure che agevolano il rientro dei cervelli e che allungano le abilitazioni universitarie per consentire a chi ne ha ottenuta una di avere un'aspirazione di cattedra che le contingenze finanziarie nell'immediato non consentono; ci sono misure per le fondazioni sinfoniche, per i distretti turistici, per i terremoti dell'Emilia e dell'Abruzzo, con misure, le più variegate, per le alluvioni di Olbia, di Nuoro, dell'Ogliastra; ci sono misure di lotta all'evasione e assunzionali, proroghe di graduatorie e stabilizzazioni, e l'introduzione per la prima volta, sia pure fino al giugno 2017, di un'indennità di disoccupazione per i co.co.co.
