2017-07-25	LN	ConsiglioNunziante	Forse è urgente che il Governo avvii un piano straordinario per il lavoro che viene invocato da tempo da più parti, indispensabile per far ripartire l'intero sistema economico in maniera strutturale e duratura. In Calabria vi è circa il 59 per cento di disoccupazione giovanile, in Sicilia il 57 per cento e la Sardegna è solo un punto dietro. A ciò si aggiunge un quadro in cui il Mezzogiorno è sempre più pericolosamente lontano dal resto del Paese e soprattutto dall'Europa. A tal proposito le politiche sino ad oggi adottate dal Governo non hanno certamente aiutato a migliorare la situazione del Sud, portando a un suo serio riscatto, e a garantire un futuro alle nuove generazioni.
2017-07-26	LN	ComaroliSilvanaAndreina	La disoccupazione è un problema serio e reale di questo Paese! Per le imprese si è pensato di prorogare il superammortamento per aiutare le imprese. Peccato che questa proroga è di un mese: anziché essere al 30 giugno 2018, è al 31 luglio 2018. È questa la grande strategia? Sulla questione degli enti locali si dice: «andiamo a favorire tali enti» e «li facciamo aiutare dal supporto tecnico-amministrativo delle prefetture». Peccato che poi sia arrivata addirittura l'ANCI a dire di lasciar perdere l'aiuto delle prefetture. Forse in questo caso abbiamo ragione noi della Lega quando sosteniamo che le prefetture andrebbero abolite.
2017-07-26	LN	ComaroliSilvanaAndreina	Signor Presidente, sembrerebbe che questo decreto-legge debba risolvere il grave problema del Mezzogiorno. Però l'impressione è che si voglia curare un malato grave con l'aspirina. Se noi andiamo a vedere gli enormi problemi che ha il Sud, non si può pensare di risolverli, anche solo in minima parte, con questo decreto-legge (che, ricordiamolo, non è il primo decreto-legge di questo Governo sulla materia, avendone fatto un altro un paio di mesi fa). Pensiamo solo ai tassi di disoccupazione, al lavoro giovanile che assolutamente non c'è, alle imprese che devono sempre combattere - oltre a dover sopravvivere a causa della fiscalità che impone questo Governo - anche contro il fenomeno mafioso, che purtroppo c'è al Sud. Pensiamo allo stato in cui versano i servizi pubblici al Sud, dalle scuole agli ospedali, dalla pubblica amministrazione alle stesse infrastrutture, alle periferie delle città. Nonostante tutto i fondi ci sono; pensiamo solo ai fondi FAS, a questi enormi fondi che vengono destinati. Ma purtroppo non si riesce a concretizzare la ripresa del Mezzogiorno. Guardi, signor Presidente, le parlo da persona del Nord, da leghista: sarebbe tutto interesse anche della questione settentrionale risolvere il problema del Sud. Invece non ci si riesce e sicuramente non ci si riuscirà con questo decreto-legge. Pensiamo a un problema attualissimo, quello dell'acqua. Se andiamo a vedere le infrastrutture, notiamo che al Sud la dispersione degli acquedotti e delle tubature raggiunge livelli del 70 o dell'80 per cento. Penso che siano questi i problemi che dovrebbe risolvere un Governo serio. Prima è stata citata la famosa Salerno-Reggio Calabria, che il presidente Renzi si è vantato di aver completato. Ma io vi chiedo di andare a parlare con i cittadini del Sud, che usano questa strada e che si lamentano, dicendo che è impossibile, perché mancano tutte le infrastrutture di collegamento. Dicono che è ugualmente un'impresa percorrere quella strada. Oppure pensiamo alla sanità (sono questi i veri problemi dei cittadini); pensiamo a tutti i cittadini del Sud che per farsi curare devono venire al Nord. Oppure pensiamo al problema delle scuole: probabilmente a settembre le scuole al Sud in molte Province non riapriranno. Questa è la politica del Governo: cercare di rattoppare con delle piccole toppe i gravi problemi. Il Governo si è vantato di aver fatto la famosa riforma delle Province, ma tutte le volte si evidenzia il problema che è stata una riforma disastrosa e incomprensibile, che va a sfavore dei cittadini. Si è evidenziato il problema che le Province non riescono a garantire i servizi fondamentali che comunque ancora hanno in carico. E tutte le volte si mette qualche soldino, fare di qui, fare di là, senza capire qual è il vero problema e come risolverlo. Ma questo è l'atteggiamento del Governo. Si cerca, di fronte al problema del lavoro, di fare questo «Resto al Sud» per i giovani. Ma è poca roba, signor Presidente, e sicuramente non si risolverà così il problema. È stato evidenziato come la problematica sia seria; si consideri la mortalità di queste imprese, che partono, ma poi muoiono subito, giusto per prendere qualche soldino all'inizio e poi basta. Oppure si pensi alla criminalità stessa, cui ho già accennato. Al Sud, nel caso in cui ad esempio una famiglia voglia rifarsi il bagno, c'è il problema che magari è la stessa mafia a dirgli a quali imprese rivolgersi. La questione delle ZES è positiva e importantissima, ma purtroppo anche in questo caso si è pensato solo alla loro istituzione in zone importanti, dove ci sono i porti, senza pensare invece, affinché esse abbiano veramente successo, che bisogna creare tutta l'infrastruttura sul territorio di riferimento: è inutile avere una zona franca, una zona speciale dove sono i porti, se poi si fa fatica ad arrivarci. Veniamo al tema dell'occupazione. Anche in questo caso si pensa alla disoccupazione del Sud, ma è solo un contentino: dare un contributo a giovani disoccupati. Innanzitutto non capisco perché il giovane disoccupato del Sud debba essere trattato in modo differente dal giovane disoccupato del Nord. Per me questo è quasi incostituzionale: se sei un disoccupato del Sud sei di categoria «A»; se sei un disoccupato del Nord sei di categoria «B».
2017-07-26	M5S	PugliaSergio	Se volessimo realmente affrontare la questione meridionale, in maniera seria e definitiva, il provvedimento in discussione rappresenterebbe veramente una goccia. Ovviamente qualcuno potrebbe osservare che il mare si fa con tante gocce. Tuttavia, quando si può tranquillamente fare molto di più, perché accontentarsi di una goccia? Il provvedimento non tocca diverse problematiche, a partire da quelle riferite alla tassazione delle imprese e alla fortissima disoccupazione, che si sarebbero potute affrontate senza abrogare una legge del 1990 che dava la possibilità di usufruire di benefici previdenziali importanti. Avete voluto abrogare questa legge e l'avete sostituita con una norma che abbiamo visto aver fatto acqua.
2017-08-01	M5S	BlundoRosettaEnza	Secondo i dati ufficiali dell'ISTAT, a giugno la disoccupazione si attesta all'11,1 per cento: una percentuale che, pur essendo leggermente in calo, è ancora elevata e risente del numero molto alto di disoccupati, soprattutto nella fascia d'età tra i venticinque e i trentaquattro anni.
2017-08-02	LN	ConsiglioNunziante	Signora Presidente, siamo di fronte all'ennesima fiducia - ormai abbiamo perso il conto - che svilisce ulteriormente il ruolo del Senato e ci fa arrabbiare inutilmente, perché il rapporto franco e onesto, certamente mai accomodante, che ci ha contraddistinto in Commissione, non meritava questo ulteriore epilogo. Sono stati presentati pochissimi emendamenti, neppure uno ostruzionistico, tutti insistenti nel merito. Eppure il Governo manca di rispetto soprattutto ai cittadini, umiliandoli, perché priva la loro rappresentanza politica della possibilità di esprimersi. Se dovessimo prestare attenzione ai lavori parlamentari, non si può non costatare la presenza di un ricorso alla questione di fiducia, che è a dir poco astuto. Tale atteggiamento è talmente frequente, che ormai la posizione della questione di fiducia è percepita come un'effettiva e costante procedura legislativa nazionale. Questo massiccio abuso della fiducia parlamentare fa cessare quel carattere positivo e nobile di garanzia dell'azione governativa, sostituendosi con una forma negativa e sprezzante, tanto da sfociare in atteggiamenti di arroganza e superbia del potere esecutivo nei confronti di quello legislativo. Viene da pensare che ci sia un imbarazzante ricatto politico nei confronti dell'Assemblea parlamentare, perché dal voto sul provvedimento in esame dipende la vita dell'intero Esecutivo. Questo è estremamente chiaro ed è altrettanto chiaro che negli ultimi mesi non ci siano stati rapporti sereni, all'interno della maggioranza, per ciò che riguarda tale provvedimento. Il provvedimento è all'esame del Parlamento ormai da due anni e mezzo. Si sarebbe potuto fare sicuramente meglio e prima. Di sicuro questa farraginosità e questa lungaggine dovrebbero fare scuola per le prossime leggi sulla concorrenza. Un esame parlamentare durato quasi due anni e mezzo ha portato a far perdere l'idea che quella in esame sia una legge annuale sulla concorrenza, perché è diventata biennale, quasi triennale. Il provvedimento in esame non è più una legge organica, frutto delle segnalazioni dell'Autorità garante della concorrenza e del mercato e quella che nel testo originale sarebbe dovuta essere una sorta di legge di manutenzione annuale, in effetti è diventata un contenitore in cui è stato infilato di tutto. Signora Presidente, se la concorrenza è quella condizione nella quale più imprese competono nello stesso mercato, producendo gli stessi beni o servizi, per soddisfare una pluralità di acquirenti in concorrenza e nella quale nessuno degli operatori è in grado di influenzare, con le proprie decisioni, l'andamento delle contrattazioni, ciò pare forse l'obiettivo che ci si era prefissati, ma certamente, guardando il risultato della legge che ci apprestiamo a votare, tale obiettivo non è stato né rispettato né raggiunto. Le liberalizzazioni sono molto spesso considerate necessarie, strategiche e utili per uscire dalla recessione. Oltre alle indicazioni provenienti dall'Autorità antitrust e dalle direttive europee, nel provvedimento in esame si vende una ricetta per uscire dalla crisi e non fa nulla se l'articolato del disegno di legge non sempre abbia basi solide e determinate da considerazioni tecniche, ma sia legato alle grandi lobby, ai grandi gruppi e alle immancabili ideologie politiche di cui le due Camere non sembrano poter fare a meno. Verrebbe allora da pensare che, in base al colore politico del Governo in carica in un dato momento, si tira e si stiracchia la legge n. 99 del 2009 alla bisogna e come meglio si crede. L'introduzione di una maggiore concorrenza all'interno di un sistema può scardinare le varie lobby e i trust, per fare in modo che si obblighino i produttori unici di un dato servizio a stare sul mercato e a confrontarsi con i diritti dei consumatori. Un regime concorrenziale è favorevole a tutti, ai consumatori e ai produttori, che avrebbero tutto da guadagnare da un adeguamento della loro offerta e della loro competitività: questa è la base del ragionamento. Dunque, signora Presidente, abbiamo sbagliato comunicazione; o meglio, tutti coloro che hanno manifestato e scioperato in questi mesi lo hanno fatto senza sapere che perdere il lavoro o quello che hanno costruito negli anni sarebbe stato solo l'inizio del loro nuovo benessere. Chiediamo scusa per non essere stati capaci di trasmettere questa sensazione bellissima. Molto cattivi samaritani considerano oggi il libero scambio e le politiche di libero mercato come la panacea di tutti i mali. La Banca mondiale, secondo i suoi studi sulla facilità di fare business, colloca il nostro Paese all'87º posto su 183: l'Italia ha dunque perso quasi quattro posizioni rispetto all'anno scorso. Nella velocità dei permessi edilizi siamo al 96º posto, nell'allacciamento alle reti elettriche al 109º posto, per l'accesso al credito al 98º posto. Non brilliamo per nulla per i tempi di apertura delle imprese. Siamo al 134º posto per facilità di pagare le tasse, anche se sembra un po' troppo. Si impiegano duecentottantacinque ore all'anno per adempimenti fiscali. Non siamo in grado di gestire i nostri rifiuti, le nostre carceri, il nostro approvvigionamento energetico e abbiamo visto anche cosa succede con l'acqua dopo soli due mesi che non piove. Non siamo in grado di gestire i conflitti con le grandi opere e non siamo neppure capaci di fare una politica industriale. Siamo alla politica industriale 4.0 e non ho visto la fine della 2.0; mi sono perso probabilmente per strada la 3.0. L'abbiamo saltata a piè pari. Non abbiamo voluto o saputo cambiare la scuola. Le privatizzazioni sono state fatte male e le liberalizzazioni le stiamo facendo anche peggio. Si è parlato di presenza di barriera alla competizione, di insufficienza di trasparenza, di raccomandazione della Commissione europea per quanto riguarda ciò che dovevamo fare. Per la verità, questo provvedimento interviene in merito solo a qualche punto segnalato dall'Autorità. Si tratta di punti certamente importanti come la RC Auto, i fondi pensioni, i servizi postali e le questioni legate alle comunicazioni. Per quanto ci riguarda, forse le cose potevano essere fatte un pochino meglio, ascoltando anche le minoranze, che non è una bruttissima cosa. Voi della maggioranza avreste dovuto cercare di mettervi davvero dall'altra parte del tavolo, dove si siedono i cittadini, che notoriamente sono anche i consumatori e i fruitori di servizi. Aboliamo questa benedetta Bolkestein e rivediamo tutto il Trattato. L'Italia ha le sue tradizioni, la sua economia e la sua cultura nazionale ed è il Paese dove il piccolo è bello; è anche - occorre dirlo - il Paese dei campanili e delle corporazioni, che non è sempre un termine negativo se si fa riferimento alla trasmissione di un lavoro dal padre al figlio. Si è, infatti, notato che certe categorie in Italia erano particolarmente in affanno ad aprirsi all'Europa. Ciò è avvenuto perché le piccole dimensioni dell'azienda familiare la rendono inadatta a competere perché, per natura, molto venerabile. I tassisti, i balneari e gli ambulanti e tanti altri sono spaventati dal dover competere sulle licenze con aziende più grandi. Sono certamente più grandi per dimensioni, ma non so se dotate di competenze e capacità. La grandezza, però, li ha sicuramente spaventati. Questo disegno di legge quale effetto avrà sull'economia, sui cittadini, sui contribuenti, sui consumatori e produttori? Quanti punti di PIL pensate di recuperare? Quanti nuovi assunti? L'apertura dei mercati ci sarà per gli altri, probabilmente. La Bolkestein ha creato solamente uno sfacelo sotto questo aspetto. Ci sono aziende che chiudono e delocalizzano e poi smettetela di parlare del cuneo fiscale. Ci venite ancora a raccontare che lo 0,1-0,2 per cento sono qualcosa di positivo. Su questo disegno di legge è intervenuto a vario titolo il sottosegretario allo sviluppo economico Antonio Gentile, che è qua ad ascoltarci e di questo lo ringraziamo. Gli ha fatto eco il primo ministro Gentiloni Silveri. Entrambi hanno chiesto un'approvazione rapida e non sono stati, forse, grandi profeti: pensiamo di dover e poter chiudere con un passaggio rapidissimo in Commissione. In Commissione abbiamo svolto circa due anni di discussione ed abbiamo perso il conto delle audizioni. Pensavamo che, dopo otto o nove mesi dalla sua approvazione in 10ᵃ Commissione, il provvedimento fosse maturo, ma magari non lo è, e allora lo farete maturare come le banane nella cella della fiducia. E così è stato. L'articolo 47 della legge n. 99 del 2009 prevede che annualmente ci sia un provvedimento per il mercato e la concorrenza: si tratta di una finalità che pare sicuramente ottima e dovrebbe risolvere e rimuovere i tanti ostacoli, i freni che restano nei mercati dei prodotti e dei servizi. Ma questa legge di annuale ha ben poco. È un provvedimento che ha palesato molte contraddizioni nell'approccio che la maggioranza ha avuto nel venire a capo di un testo condiviso. L'esame svolto ha chiaramente messo a nudo i vari portatori di interesse e soprattutto le grandi lobby. Come dicevamo, c'è stata una serie infinita di audizioni, certamente necessarie, ma a volte in limpida divergenza, in base agli interessati e agli auditi che venivano in Commissione. Si è detto che questo disegno di legge sulla concorrenza è stato rimesso sui binari: è come dire che era abbondantemente deragliato e quindi aveva perso quella linea guida che la legge n. 99 aveva fissato. Nei quattro passaggi presso le due Aule parlamentari abbiamo espresso voto contrario e faremo lo stesso anche in questo passaggio. Concludo con una chiosa. Visto che mancano alcuni mesi alla fine di questa legislatura, chiediamo che, finito l' iter di questo disegno di legge, si riprendano i temi principali: la disoccupazione è al 13-14 per cento mentre quella giovanile è al 42-43 per cento; vi sono i problemi del lavoro e dell'immigrazione. Inoltre, vi chiedo di farmi un favore: cercate di dire a Boeri di stare zitto, perché quando parla fa solamente casino. Con questo, ho terminato il mio intervento.
2017-09-13	M5S	LezziBarbara	Signora Presidente, questa mattina ho avuto modo di ascoltare sia i relatori, che il vice ministro Morando. Tuttavia, per molti aspetti ho avuto la sensazione di riascoltare sempre la solita propaganda, come quando si scrivono i tweet e si fa il solito gioco con i numeri, prendendo soltanto quelli che più convengono alla maggioranza e al Governo per ostentare capacità e successi che di fatto noi riteniamo non ci siano. Perché dico questo? Perché, ogni volta, c'è un autoincensarsi, soprattutto da parte dell'elegante ex Premier, ora segretario del Partito Democratico, che incensa i suoi 1.000 giorni di Governo e le riforme adottate. Vorrei ben capire di quali riforme si parla, perché la riforma della pubblica amministrazione è stata parzialmente bocciata, quella della scuola ha costretto a imbarazzanti migrazioni la maggior parte dei docenti, per non parlare della scarsa gratificazione per quanto riguarda gli studenti e, quanto alle riforme istituzionali, e abbiamo la riforma costituzionale, anch'essa bocciata. Rimarrebbe magari il jobs act. Anche qui, si rimpallano i successi da Gentiloni Silveri, a Padoan, a Poletti, Calenda e Renzi. Tutti sono impegnati a scrivere tweet, ma nessuno ci dice che la misura contenuta nella legge di bilancio, legata al jobs act, che ci è costato oltre 20 miliardi di euro, ha portato il livello di disoccupazione a un gap maggiore rispetto alla media europea. Cosa voglio dire? Quando il Governo Renzi si è insediato, in Italia il tasso di disoccupazione era pari al 12,9 per cento, mentre la media europea era del 12 per cento; quindi, il differenziale era pari allo 0,9 per cento. Ora, invece, il differenziale è del 2,2 per cento. Sto dicendo che il gap è più che raddoppiato, a fronte di oltre 20 miliardi di spesa pubblica, perché, chiaramente, tutti abbiamo pagato lo spot della decontribuzione, che, peraltro, è stato fatto a fronte dell'abolizione di una norma strutturale. Ritornando alla riforma del jobs act, questa avrebbe dovuto eliminare il precariato, eppure i dati del secondo trimestre ci dicono che, con riferimento ai nuovi assunti, otto su dieci sono a tempo determinato: questo non è altro che la certificazione dell'unica riforma di Renzi rimasta in piedi. Magari si parla anche della produzione industriale. Ricordo che nel giugno scorso in una serie di tweet si è scritto che c'era, finalmente, un dato significativo e decisivo, pari a un aumento dell'1,1 per cento. Giusto. Tale dato si riferiva a un incremento rispetto al maggio del 2017, quindi da un mese all'altro. Qualche giorno fa sono usciti i nuovi dati dell'INPS e sento tuonare Gentiloni Silveri, Renzi, Calenda e compagnia cantante rispetto a un +4,4 per cento. Ebbene, rimango basita, mi chiedo: dove prendono questo dato? È giusto +4,4 per cento, ma è un dato tendenziale luglio 2016 su luglio 2017. Allora, sarebbe stato interessante dire che a giugno 2017 rispetto a giugno del 2016 la crescita era del 5,2 per cento, quindi siamo scesi al 4,4. Sarebbe più responsabile e più maturo fare i conti come si devono fare, quindi mese con mese. Allora, se a giugno abbiamo avuto un +1,1, che è un dato significativo, un incremento deciso che ha portato un buon contributo alla produzione industriale (ma bisogna considerare anche la componente energetica perché, volenti o nolenti, è così, signori, e basta andare a leggere anche il rapporto Terna per sapere il perché), arriviamo a luglio e la crescita congiunturale, ossia mese su mese, è dello 0,1 per cento. Allora, signori, dal momento che siete così affezionati agli "zero virgola" perché l'elegante ex Premier non ha twittato che la crescita della produzione industriale è stata dello 0,1 per cento? Ma voglio scendere ancora più nel particolare, rispetto alla produzione industriale, perché è molto interessante valutare anche l'indice dei dati destagionalizzati. Sono dati che si trovano facilmente sul sito dell'ISTAT e ci dicono che, considerato 100 il dato 2010, che è l'anno di riferimento, siamo a 96,9. Quindi, siamo ancora distanti però stiamo cercando di avvicinarci al 100 del 2010. Ma se guardiamo un po' tutta la progressione, vediamo che a dicembre 2016 - e di questo devo rendere merito, purtroppo, a Renzi - eravamo già a 96,2, e a gennaio c'è stata una contrazione decisiva e poi c'è stata una contrazione in aprile che ci aveva portato a 94. Allora, pian piano stiamo recuperando questo indice, ma siamo sempre ai dati di partenza: c'è poco da twittare! Almeno in questo caso, quando andiamo a discutere del rendiconto, sarebbe molto più maturo e più responsabile guardare ai numeri per quello che sono e decretare i fallimenti per non farne degli altri, cosa che invece, purtroppo, non è. Un dato che da parte del Governo non ho assolutamente ascoltato, purtroppo, è che abbiamo raggiunto un nuovo record, decisivo anche questo: quello del debito pubblico. Sì, perché abbiamo toccato i 2.281 miliardi di debito pubblico, e la cosa più sconcertante, però, è che c'è un bel gap, anche in questo caso, tra l'aumento del PIL e l'aumento del debito pubblico: il debito pubblico galoppa e il PIL affanna rispetto al debito pubblico. Questo è sbagliato, è una distorsione che bisogna evidenziare, perché altrimenti non si va avanti. Leggendo il rendiconto, magari qualche dato positivo c'è, ma dobbiamo anche valutare il perché. C'è perché, in realtà, c'è il quantitative easing che ci ha fatto risparmiare 10 miliardi di euro di interessi passivi e non è un'azione del Governo e c'è un taglio feroce a carico delle amministrazioni locali, le quali pagano il debito, quando invece quello delle amministrazioni centrali non fa altro che aumentare. E qui veniamo al sentiero stretto di cui ha parlato il vice ministro Morando. Sì, perché dal debito pubblico per forza si deve parlare di sentiero stretto, che sembra una poesia, sembra che arrivi chissà da dove, ma arriva dal Governo Renzi, che, dopo le clausole di salvaguardia del Governo Letta di 3, 7 e 10 miliardi, arriva quasi a 30 miliardi di clausole di salvaguardia: sono quegli aumenti dell'IVA e delle accise che non ci permettono di agganciare la vera crescita, quella europea. Se ci andrà bene, all'Italia toccherà una crescita dell'1,5 per cento contro una media del resto d'Europa del 2,2. Noi siamo sempre dietro, altro che locomotiva d'Europa! E lo dobbiamo al fatto che sono state compiute scelte non di politica economica, ma di bonus. E per quei 10 miliardi di euro dati per gli 80 euro, è inutile che twittate sul rapporto della BCE: leggetelo bene. È una spesa fatta a deficit, che ancora dobbiamo saldare e che ancora oggi non ci consente di dare man forte neanche a quella produzione industriale fatta con gli sgravi, perché anche quella è una norma spot, è una droga, come ha detto il vice ministro Morando. Non ci permette di andare oltre e di quei 10 miliardi spesi solo 3,5 miliardi sono stati spesi al consumo e questo è un dato agghiacciante, preoccupante: non c'è niente di cui essere contenti rispetto a questo. Adesso siamo qui ad incartarci per cercare un miliardo o 1,5 miliardi per prorogare gli iperammortamenti, norma spot, eppure erano stati promessi 13 miliardi. È stato detto in tutte le salse che la decontribuzione doveva essere strutturale, e invece è stata uno spot e vediamo quali risultati sta portando, basta leggere i rapporti dell'INPS ed incrociarli. Per queste ragioni, per il fatto che sono stati spesi male i soldi, per il fatto che magari nell'evasione fiscale, nella semplificazione, c'è stata una serie di avvicendamenti di proroghe su scadenze già trascorse, dove è stata magnificata la vostra incompetenza - e le aziende, le imprese ed i professionisti che in questi giorni hanno a che fare con questi rinvii e con la comunicazione dei dati IVA sanno benissimo di cosa sto parlando e mi auguro che se ne ricordino quando sarà il momento - noi voteremo no a questo rendiconto, per una questione di maturità e di responsabilità e perché i numeri noi li leggiamo tutti e per bene.
