2017-01-12	M5S	BertorottaOrnella	Signor Presidente, voglio dire due parole in merito all'Accordo in esame, partendo dalla crisi siriana, che può essere definita, senza ombra di dubbio, la madre di tutte le emergenze migratorie in Europa dal 2011 in poi, oltre alla crisi libica, che sarebbe meglio definire l'aggressione militare a un Paese sovrano con l'obiettivo di annientare le istituzioni e favorire il caos. Entrambe le crisi influiscono sui flussi migratori, ma in questo caso mi riferirò alla crisi siriana per ovvie ragioni di geografia dei flussi migratori verso l'Europa. Questa crisi ha generato un enorme flusso di profughi, dei quali un numero sempre maggiore si dirige in Europa. Di fronte alle problematiche generate da quanto appena illustrato, la posizione politica della Croazia e degli altri Paesi dell'Est Europa è stata di totale contrasto alla ripartizione delle quote migranti, facendo di fatto pesare l'accoglienza su Paesi come il nostro e la Grecia. La Croazia, inoltre, ha più volte chiuso le proprie frontiere, creando di fatto situazioni di emergenza significative sia per gli Stati limitrofi, che per l'Europa in generale. Il problema, signor Presidente, non è dunque l'accordo in sé, ma il segnale politico che diamo alla Croazia, in un momento in cui questo Paese, in contrasto con altri, attua frequenti chiusure delle sue frontiere e a livello europeo gioca in un campo avverso al nostro interesse nazionale, dato che una chiusura generalizzata delle frontiere dei Paesi europei (come - voglio ricordarlo - Zagabria auspica) lascerebbe i migranti sul territorio italiano e quindi aggraverebbe il sistema di accoglienza che fa già acqua da tutte le parti ed è stato più volte terreno di corruzione e malaffare, come ben sappiamo e come molti colleghi del PD ben sanno, con i casi di mafia capitale e del CARA di Mineo. Signor Presidente, parliamo tanto di immigrazione irregolare dal Mediterraneo (circa 150.000 arrivi in media all'anno) quando dalle Repubbliche dell'Est Europa ogni anno milioni di persone si spostano da aree dove il salario di un operaio è di circa 200 euro: mi pare chiaro che qualcosa non funzioni. Voi la chiamate integrazione, ma a mio avviso siamo di fronte ad un processo migratorio ben più imponente che sta abbattendo, una dopo l'altra, tutte le conquiste sociali e lavorative faticosamente raggiunte con la lotta dei nostri nonni e dei nostri padri. Le reiterate azioni di chiusura della frontiera da parte della Croazia e il sostegno ad una proposta politica europea di gestione delle quote di redistribuzione dei migranti che danneggia in maniera sia diretta che indiretta l'interesse italiano sono le ragioni che portano il Movimento 5 Stelle a votare contro questo Accordo e invito i colleghi degli altri Gruppi politici a unirsi e dare un segnale politico inequivocabile a chi lavora per bloccare i migranti nei Paesi di primo approdo come il nostro.
2017-01-12	PD	PegorerCarlo	Signor Presidente, il disegno di legge all'esame dell'Assemblea reca ratifica ed esecuzione dell'Accordo sottoscritto tra l'Italia e la Croazia sulla cooperazione transfrontaliera di polizia. L'intesa sancisce l'impegno dei due Paesi a sviluppare una più efficace azione di contrasto al crimine transfrontaliero, con particolare riferimento all'immigrazione illegale, alla tratta degli esseri umani e al traffico di sostanze stupefacenti. L'intento è di creare uno strumento giuridico per regolamentare la collaborazione di polizia sul piano strategico e operativo, nonché di intensificare i rapporti tra gli omologhi organismi dei due Paesi preposti alla pubblica sicurezza.
2017-01-12	PD	SangalliGianCarlo	Signor Presidente, annuncio il voto favorevole del Partito Democratico. Per giustificare il nostro voto, richiamo l'articolo 1, su cui vi è stata un'ampissima convergenza: i temi che si trattano tra i due Stati sono la collaborazione contro il traffico illecito di sostanze stupefacenti, il terrorismo, la criminalità organizzata, tutti i tipi di contraffazione e di contrabbando, il riciclaggio, i reati connessi alle carte di credito, i reati informatici e suInternet, i reati commessi nei porti, aeroporti e altri varchi e l'immigrazione clandestina. Mi pare utile che questo Memorandum di intesa venga adottato e pertanto sul provvedimento il voto del Partito Democratico sarà favorevole.
2017-01-17	LN	StefaniErika	Noi solleviamo umilmente una piccola puntualizzazione e ci poniamo alcune domande, al di là del titolo che sembra evidentemente condivisibile. Ad esempio, all'articolo 4 vi è una misura molto particolare, perché si prevede che il Ministero dell'istruzione, dell'università e della ricerca stabilisce le direttive per il coinvolgimento delle scuole e in tal senso viene deputata alla realizzazione di queste iniziative l'Associazione nazionale vittime civili di guerra Onlus, che svolge gran parte della sua attività nella difesa di persone deboli. Tuttavia dal suo stesso sito Internet si evince benissimo che tale associazione ha delle particolari preferenze nella trattazione delle questioni che la coinvolgono. Oltre ad avere una decisa spinta fortemente europeista, possiamo vedere che lo stesso sito Internet di tale associazione incentiva la lettura di alcuni articoli dove si parla, in particolare, della situazione dell'immigrazione. Sembra che anche la rivista deputata alla promozione e distribuzione delle attività riguardanti la Onlus, intitolata «Pace & solidarietà», parli di immigrazione e di rifugiati, classificati come una crisi da affrontare tutti insieme, con un'impostazione per cui l'immigrazione non viene vista come a volte la dipingiamo anche noi del nostro movimento. Ci si riferisce all'immigrazione classificandola in maniera quasi indistinta, parlando di coloro che scappano dalla guerra, di coloro che si trovano in situazione di assoluto bisogno. Non se ne parla però solo in un articolo, ma in quasi tutta la rivista almeno un paio di articoli sono deputati alla trattazione di questa materia. Vi richiamo a fare una semplice visita al sito Internet dell'associazione.
2017-01-17	LN	StefaniErika	Pertanto, visto che si intende chiamare tale associazione a svolgere questa attività, ci chiediamo se le vittime di cui si tratta nel disegno di legge in esame siano le vittime civili delle guerre o se vi si voglia ricomprendere tutto il fenomeno dell'immigrazione? Lo chiedo perche sappiamo bene che nel fenomeno migratorio non vi sono solo vittime di guerra; vi è una migrazione che può essere anche semplicemente di natura economica e che può nascondere in alcuni suoi anfratti anche un altro tipo di immigrazione. Sappiamo benissimo qual è il problema del terrorismo e di come deve essere gestito il fenomeno dell'immigrazione, degli spostamenti di persone straniere del nostro Paese.
2017-01-18	LN	StefaniErika	Signor Presidente, abbiamo udito la replica del signor Ministro e apprezziamo soprattutto la serietà e la professionalità con le quali ha risposto alle nostre considerazioni e osservazioni. La giustizia - come ha detto lo stesso onorevole Orlando - deve essere gestita a prescindere dal consenso dell'elettorato. La giustizia è una materia estremamente seria, che certamente non può essere vittima né di populismo, né della ricerca del consenso popolare. Purtroppo la giustizia prevede una norma classicamente impopolare che è il reato, per cui è previsto un giudizio in tribunale e l'applicazione di una pena. È per questo che l'amministrazione della giustizia deve essere seguita con particolare serietà. Tuttavia, la sua Relazione e la sua replica non ci hanno convinto su quelle tematiche che, come Gruppo della Lega Nord, abbiamo sottolineato e riportato con particolare evidenza negli ultimi anni. C'era il problema - lo ricordiamo, perché ormai sembra non fare più notizia sui giornali e sugli altri media - del sovraffollamento carcerario, per il quale sono stati adottati veri provvedimenti che - lo si voglia o no - sono definibili come "svuota carceri". Con quelle norme si sono previste, in alternativa alla reclusione, pene alternative al carcere, soluzioni che permettono a un criminale di non accedere immediatamente alla misura della detenzione. Non li vogliamo chiamare svuota carceri? Definiamoli comunque dei benefici che sono stati concessi con la finalità di evitare che si riproponga il problema del sovraffollamento carcerario. Sembra un argomento passato di moda in questo momento, ma invece noi vogliamo continuare a ricordarlo: erano misure emergenziali. Se viene meno l'emergenza, dobbiamo ristrutturare il sistema penale. Crediamo che in sede di esame di riforma del processo penale - è stata cominciata, ma è stata sospesa - si dovrebbero adottare dei provvedimenti in tal senso. Per questo nella nostra risoluzione chiediamo che vengano previsti aumenti delle pene per quanto concerne - ad esempio - i furti in abitazione e le rapine. Come abbiamo anche noi suggerito, vogliamo che siano inasprite altresì le misure per lo spaccio di sostanze stupefacenti lievi e che sia ripreso quel disegno di legge, approvato alla Camera, che precede l'esclusione per i reati più gravi della possibilità di accedere al giudizio abbreviato; provvedimento approvato dalla Camera e poi arenato al Senato probabilmente per una volontà politica diversa. E, infatti, nella riforma del processo penale questa parte è sparita. Noi speriamo che possa essere reintrodotta e lo chiediamo anche nella nostra risoluzione. Un'altra tematica che si è arenata riguarda la riforma dell'istituto della legittima difesa: la discussione è cominciata alla Camera; se ne è parlato e la nostra proposta iniziale prevedeva sostanzialmente una forma di presunzione di legittima difesa ogni qual volta venga violato il domicilio nel momento in cui qualcuno entra in casa, in possesso di armi o in gruppo. Anche in quel caso la nostra proposta iniziale è stata depotenziata: la soluzione proposta alla Camera ha inteso svilire completamente il nostro intento di modificare questo istituto. Anche in quel caso, comunque, il discorso si è arenato e noi, invece, riteniamo che debba essere ripreso e non per far sì che ogni cittadino si doti di armi fino ad arrivare a una sorta di far west per difendersi, ma per far arrivare ai criminali il messaggio che la proprietà è sacra e che nel momento in cui si entra in una abitazione si pagano conseguenze gravi. Per quanto riguarda l'istituto della previsione del reato, è corretto quello che dice il Ministro, e cioè che non è vero che più reati prevedi più sei punito, anzi, talvolta un'inflazione della misura del reato o anche la gravità stessa del reato non sortisce gli effetti che si vorrebbero. Noi intendiamo che la previsione del reato e la certezza della pena debbano indurre il criminale a compiere o no delle scelte e l'Italia non deve certo diventare un luogo nel quale egli possa pensare di avere una soglia di minore punibilità rispetto ad altre realtà. La questione grave che continuiamo a rimarcare e sulla quale insistiamo è relativa all'immigrazione, problematica che riguarda anche il settore della giustizia e che, anzi, deve essere trattata come un unicum dai Ministeri della giustizia e dell'interno. Per fare una battuta, si può dire che ormai l'Italia ha quasi perso l'appannaggio della criminalità: di criminali italiani, ormai, ce ne sono pochi. Dobbiamo cercare di lavorare anche sulla questione dell'immigrazione e quindi degli stranieri che sfuggono al controllo della nostra realtà territoriale e commettono reati. Relativamente alla questione degli accordi con Paesi stranieri, mi permetta di farle soltanto un appunto, signor Ministro: a noi risulta che anche il ministro Castelli stipulò un accordo con l'Albania proprio al fine di effettuare il rimpatrio dei detenuti albanesi condannati in Italia che avrebbero scontato la pena nel loro Paese d'origine. Anche su questo profilo ci permettiamo di fare questa considerazione. Lo stesso si fece anche con la Romania, anche se con un profilo diverso. Per queste ragioni noi insistiamo sulla nostra risoluzione, affinché possa essere accolta da tutti, perché contiene alcuni punti fondamentali in assenza dei quali riteniamo di dover respingere, con tutto il rispetto, la Relazione da lei fatta.
2017-01-18	LN	StefaniErika	Signor Presidente, ribadiamo in questa sede le argomentazioni che abbiamo già illustrato in sede di discussione generale. Vorrei richiamarne qualcuna, perché effettivamente del fenomeno del femminicidio si sta parlando molto sui media, ma forse a volte se ne comprendono poco o male quali sono le ragioni. Di femminicidio si parla quando si ammazza una donna proprio in quanto donna, ma bisogna comprendere come mai in alcune situazioni si giunga a un tale livello. Facciamo riferimento al fatto che attualmente le gravi forme di violenza vengono perpetrate nei confronti di donne che si trovano sottomesse in virtù di irragionevoli dettami fanatico-religiosi. Stiamo parlando di un fenomeno che sta aumentando, frutto di un'immigrazione consistente, che ormai è cosa ben nota. Ricordiamo che l'86 per cento delle donne islamiche presenti in Italia sono analfabete e non conoscono neppure il sistema alfanumerico. Stiamo pensando che l'80 per cento di queste donne non esce di casa se non accompagnate. Pertanto, ci troviamo di fronte a una realtà di donne che vivono segregate in casa o comunque segregate in un microcosmo culturale dove esse credono che quella sia la verità. E non hanno nemmeno la capacità o gli strumenti per poter ribellarsi alle violenze commesse in casa; violenze che non sono solo fisiche, ma anche psicologiche. Purtroppo, come testimoniano i casi che leggiamo sui giornali o ascoltiamo, donne e ragazze vengono ammazzate magari perché non ottemperano o non si sottomettono all'obbligo di un matrimonio combinato. Sono queste le tragedie femminili che dobbiamo evitare e che non si evitano semplicemente prevedendo fattispecie di reato o istituendo Commissioni d'inchiesta. Occorre incidere sul panorama culturale, perché queste donne devono essere istruite a difendersi. Solo quando una donna è istruita a difendersi e quando una ragazzina sa che cosa c'è fuori dalla sua casa esse hanno la possibilità di difendersi. Ricordiamo - e purtroppo c'è chi ha avuto la possibilità, anche professionale, di conoscerle - che sono moltissime le donne che hanno subito violenze in casa e non hanno potuto ribellarsi perché non avevano il coraggio di farlo. Voteremo a favore dell'istituzione di questa Commissione d'inchiesta, affinché vengano reperiti i dati, ma soprattutto affinché vengano capite le ragioni per le quali si arriva a siffatti fenomeni. Solo conoscendone le ragioni ci si può dotare di strumenti per combattere, debellare, ove mai fosse possibile, o ridurre questo spiacevolissimo fenomeno.
2017-01-26	PD	MattesiniDonella	Anche solo pochi giorni fa la Camera (lo faremo anche noi nelle prossime settimane) ha approvato il disegno di legge sulla protezione dei minori non accompagnati, dando vita, entro il complesso fenomeno dell'immigrazione e dell'accoglienza dei migranti, ad uno specifico provvedimento dedicato ai minori, proprio perché c'è una specificità che riguarda l'infanzia e l'adolescenza. Una specificità che tiene conto della complessità di vita dei minori e della complessità dell'evoluzione dall'infanzia all'adolescenza e all'età adulta, che necessita di specifica attenzione da parte degli adulti e quindi anche del legislatore.
2017-02-21	PD	PaduaVenera	Il simbolo concreto più eclatante ed evidente che il Governo Gentiloni, in continuità con quello Renzi, punti a dare la massima attenzione per il Sud può essere desunto dall'istituzione di un Dicastero apposito per la coesione sociale, territoriale e il Mezzogiorno. Questo Ministero ha un compito fondamentale, importantissimo: deve vigilare sull'applicazione e sul buon esito dei patti per il Sud, sulla base di un piano d'azione generale (il cosiddetto masterplan ) fondato sul dialogo e sull'ascolto dei bisogni primari dei cittadini e delle comunità locali e, quindi, per fare poi delle scelte condivise. Infatti, è con l'interazione continua e costante tra Roma e le amministrazioni territoriali che possono raggiungersi quegli obiettivi fondamentali che passano dall'individuazione delle priorità alle concrete capacità di risposta che possono essere date ai problemi dei diversi territori. Si parte proprio da lì: dal dialogo con Regioni, Città metropolitane e Comuni, ovvero gli enti che sono più vicini ai cittadini, quegli enti di prossimità così importanti. È con loro che il Governo centrale, e in particolare il Ministero affidato all'onorevole ministro De Vincenti, deve trovare quell'interazione indispensabile per compiere scelte opportune. Mi pare, comunque, data la rilevanza del decreto-legge in discussione, che si sia partiti con il piede giusto, nell'ottica di un intervento che tocca molti aspetti essenziali per la coesione sociale e territoriale. Mi piace sottolineare questo punto. È un cambio di sguardo: non più quei provvedimenti che cadevano dall'alto e che, in qualche modo, erano spesi in maniera strana o, comunque, emergenziale anche a livello degli enti locali, ma qualcosa di concertato, di condiviso, in termini di ascolto e di accoglienza. Comincio solo con brevi cenni, perché il provvedimento è molto importante, da ciò che riguarda l'ILVA. Innanzitutto, vorrei ricordare come nel decreto-legge varato dall'Esecutivo vi sia uno stanziamento di 70 milioni specifici, che si aggiungono agli altri già destinati alla sanità e all'ambiente per la città di Taranto, dedicati all'acquisto di apparecchiature medico-diagnostiche avanzate che consentono di far fronte ai bisogni della sanità locale. Sono stati anche riservati 100 milioni per tutte le Regioni del Sud - Abruzzo, Molise, Puglia, Campania, Calabria, Basilicata, Sicilia e Sardegna - per le apparecchiature di radiologia e di diagnostica oncologica. Tramite l'approvazione di interventi che puntano all'ammodernamento tecnologico delle dotazioni delle strutture sanitarie, come quelli previsti dagli articoli 1 e 5- bis del decreto-legge in conversione, si intende anche consentire una più efficace e utile organizzazione dei servizi, con particolare riferimento, anche, ad interventi che dovranno riguardare la formazione e l'aggiornamento professionale del personale sanitario. In questo modo, potranno essere rese più omogenee le terapie utilizzate anche al Sud, secondo le ultime evidenze scientifiche, riducendo, peraltro, i viaggi della speranza che costano tanta fatica ai pazienti e alle loro famiglie e determinano tanto sperpero di denaro pubblico per la mobilità interregionale. Ancora: 30 milioni sono destinati a programmi di sostegno e supporto per le famiglie disagiate dell'area tarantina: sono interventi di inclusione e di integrazione in territori cui lo Stato deve guardare con un'ottica duplice: risanamento ambientale dell'ILVA e riqualificazione ambientale della città di Taranto, con particolare riguardo alla salute dei cittadini, e mantenimento dei livelli occupazionali. È questa, certo, una delle sfide principali che si pone il provvedimento in esame. Sono risorse queste, conviene ribadirlo, che si aggiungono a una serie di interventi, come peraltro è stato ricordato da alcuni colleghi in Aula, già attuati da questo Governo, dal precedente e dal Parlamento, durante questa legislatura. Voglio ora fare un cenno, come hanno fatto altri colleghi, alle acque reflue. Come ben sappiamo, purtroppo, da procedure d'infrazione europee, è fondamentale che il provvedimento tratti della questione dei ritardi del nostro Paese in materia di depurazione: ci sono serie criticità in molte zone del Sud e, come è ben noto, esistono, purtroppo, conseguenze molto negative a questo correlate in ambito sanitario e, quindi, sulla qualità della vita dei cittadini e delle cittadine. Mi è piaciuta anche molto la parte relativa all'utilizzo dei beni confiscati e la loro messa a disposizione da parte degli enti locali per fini sociali. Molto spesso gli enti locali, i Comuni, non hanno spazi a disposizione e devono affrontare ulteriori spese per le emergenze sociali che sono sempre in aumento. Ebbene, questo provvedimento permetterà l'utilizzo anche dei beni delle aziende che sono in odore di malavita organizzata. Infine, ultimo ma non per valenza, vale la pena sottolineare l'articolo 7 del decreto-legge sul prossimo G7 da tenersi a Taormina ai fini dell'accelerazione delle procedure amministrative necessarie all'organizzazione dell'evento, nel rispetto completo del principio di trasparenza. Attrezzare in modo idoneo Taormina per ospitare il G7 è una questione che investe non solamente la Sicilia ma tutta l'Italia. Che un simile evento avvenga in Sicilia evidenzia la volontà chiara del Governo di dare all'isola, e quindi all'intero Sud, una nuova e rinnovata centralità, nel contesto europeo e internazionale. Infatti, senza una ripartenza del Sud, in prima linea quotidianamente, per esempio - voglio ricordarlo - sull'emergenza immigrazione e gravato oggi da una non meno seria emergenza occupazionale soprattutto fra i giovani, non riparte il nostro Paese, il quale non può prescindere da una politica generale per il Mezzogiorno. Voglio evidenziare che tale politica ha preso forma con il masterplan lanciato dal Governo Renzi un anno e mezzo fa che ha fatto nascere i patti per il Sud con le otto Regioni e le sette Città metropolitane coinvolte, cui va aggiunto poi il contratto istituzionale di sviluppo per Taranto. Bene, colleghi, non voglio aggiungere una nota polemica, ma ho ascoltato il dibattito in quest'Aula e tanti di voi si sono lamentati di questo provvedimento. Mi chiedo allora: nei vent'anni passati chi ha governato questo Paese che cosa ha fatto dato che si è dimenticato completamente del Sud? E adesso ci si scandalizza perché non sono sufficienti questi provvedimenti. Intanto sono un inizio e ci sarà un continuum. Ho detto all'inizio del mio intervento che il provvedimento al nostro esame riguarda alcune emergenze territoriali del Sud, alcune: non è il piano del Mezzogiorno, riguarda alcune urgenze. Veramente mi stupisco se penso che chi per tanti anni è stato seduto in questa come nell'altra Aula, rappresentando il Paese per tanti anni con le maggioranze più ampie possibili, non si è proprio mai preoccupato di questo Sud. Dico, allora, che il passo è cambiato; si è visto che c'è un'attenzione del Governo precedente e di quello attuale, del Governo Renzi come del Governo Gentiloni: la presenza del Ministro che rappresenta la coesione territoriale e il Mezzogiorno mostra un cambio di passo. È una volontà diversa e mi piace che questo sia coniugato all'ascolto, all'attenzione e al monitoraggio, perché quello che viene scritto nel masterplan non è il libro dei sogni ma realtà concrete che debbono attuarsi e concretizzarsi. In tal senso sta a tutti noi stimolare i rappresentanti dei nostri Comuni, la nostra parte politica. Tutti, a livello istituzionale, dobbiamo andare a verificare le grandi potenzialità che possono esserci in questo atto come in altri provvedimenti che hanno riguardato il Sud. Gli stessi 100 milioni di cui si è parlato prima vanno a revisionare, ad arricchire quelle tecnologie spesso obsolete che ci sono al Sud. È vero che ci sono difficoltà nella sanità; lo sappiamo o lo abbiamo verificato in Commissione sanità tante volte; ci sono ancora, purtroppo, gravi disparità tra Nord e Sud, un divario che aumenta. Questo, però, è un segno, l'inizio di un percorso. Prendiamo, allora, il bene che vediamo anche in questo provvedimento e continuiamo a lavorare con impegno e determinazione, senza recriminazioni ma guardando avanti.
2017-02-23	M5S	AirolaAlberto	Signor Presidente, desidero solo rammentare all'Assemblea che, poiché, come diceva la collega Puglisi, abbiamo bisogno di regole certe, questa discussione andrebbe però posposta alle dimissioni di un Sottosegretario, l'onorevole Castiglione, ancora presente nel Governo, che, insieme a Odevaine, gestisce il CARA di Mineo. È inutile, andrebbe posposta la discussione: siete degli ipocriti a venire qua a parlarci di buona accoglienza, regole certe e Paese civile... PRESIDENTE. Senatore Airola, adesso l'ha detta, questa cosa, e ha fatto il suo richiamo, che però non era sull'ordine dei lavori. Proseguiamo con la discussione, prego. AIROLA (M5S). Gestiscono l'immigrazione e fanno capo ai vostri partiti.
