2017-07-05	PD	MinnitiMarco	Abbiamo inviato l'ambasciatore a Bruxelles presso la Commissione europea, per dire con grande chiarezza che, di fronte a quello che stava avvenendo nel Mediterraneo centrale e poi in Italia, l'Europa doveva assumersi maggiori responsabilità. Nelle ore successive, abbiamo chiesto un incontro con i principali Ministri dell'interno dell'Europa (il francese e il tedesco), al quale ha partecipato anche il commissario europeo Avramopoulos. È stato un incontro importante, molto impegnativo e - dobbiamo dirci la verità tra di noi - in alcuni momenti anche difficile. Tuttavia, era ed è molto importante che da quell'incontro sia venuta una posizione comune tra i principali Paesi europei e la Commissione, che potesse consentire di far arrivare chiaro un messaggio al vertice che domani si terrà a Tallin. Abbiamo fatto, quella domenica, un primo passo, ma comunque un passo, confermato poi dalla Commissione europea attraverso la predisposizione dell' action plan. Considero veramente importante che la Francia, la Germania e la Commissione abbiano in qualche modo avuto una convergenza su una serie di nostre proposte. La prima è quella di un codice di comportamento per le organizzazioni non governative che operano nel Mediterraneo centrale. Non si tratta di una iniziativa estemporanea del Governo. C'è stato un intenso lavoro parlamentare di varie Commissioni, tra cui la Commissione difesa del Senato, che si è pronunciata con un documento approvato all'unanimità. Ed io che conosco le dinamiche parlamentari so perfettamente quanto sia impegnativo e soprattutto quanto sia forte il messaggio di un documento approvato all'unanimità. Il Governo aveva e ha il dovere di ascoltare il Parlamento e di prendere su questi temi un'iniziativa. È evidente e chiaro che non ci sono alcun pregiudizio e alcuna generalizzazione. Tuttavia, dal lavoro parlamentare emerge con evidenza che vanno poste due grandi questioni. La prima questione è quella relativa alla necessità di avere un coordinamento tra le attività delle organizzazioni non governative, tra le numerose navi che agiscono nel Mediterraneo centrale, nelle acque costiere libiche, con la Guardia costiera libica. E quello è un punto cruciale, perché è del tutto evidente che nelle acque territoriali la Guardia costiera libica deve operare secondo il principio di piena responsabilità. Tra mille difficoltà e con tantissimi problemi, negli ultimi mesi la Guardia costiera libica ha operato 10.000 salvataggi in mare. E queste cose le dice non il Governo italiano, ma l'Organizzazione mondiale per le migrazioni, la quale proprio ieri, nel riconoscere gli sforzi e i passi in avanti fatti sul terreno dell'iniziativa di salvataggio in mare - search and rescue - ha anche detto che la Guardia costiera libica ha salvato dalla morte sicura moltissime persone. Voi comprendete che, nel momento in cui una Guardia costiera agisce, è fondamentale stabilire che ci deve essere un'azione della Guardia costiera nelle acque territoriali e tutte le altre attività, ivi comprese quelle delle navi delle organizzazioni non governative, devono svolgersi fuori dalle acque territoriali. La seconda questione che sarà posta nel codice di regolamentazione riguarda il coordinamento con l'attività di polizia giudiziaria nei confronti dei trafficanti di esseri umani. Faccio rilevare che le altre navi presenti nel Mediterraneo sono militari. Nel momento in cui operano numerose navi civili, un Paese serio prende tutte le misure per coniugare la salvezza della vita con le esigenze della propria sicurezza e l'assoluta necessità di essere inflessibili nel contrasto ai trafficanti di esseri umani. Allora, come voi comprenderete - lo capirete ancora meglio quando leggerò dei dati - ci troviamo di fronte a una questione non di piccolissimo conto. Nei primi sei mesi di quest'anno, di fronte a 85.000 persone salvate, i numeri sono i seguenti: il 34 per cento è stato salvato dalle organizzazioni non governative; il 28 per cento dalla nostra Guardia costiera; il 9 per cento nell'ambito della missione Sophia; l'11 per cento nell'ambito della missione Frontex; il 7 per cento da navi mercantili che operavano nel Mediterraneo centrale. Di fronte a questa iniziativa del Governo, che oggi è diventata della Commissione europea e dei principali Paesi europei, una volta si sarebbe parlato di una bella pagina di cooperazione tra Parlamento e Governo. Il Parlamento fa un'indagine e propone; il Governo si muove in sintonia e la presenta in Europa, diventando così quella una posizione europea. Spero che sia così anche oggi, in questo Parlamento. Se non così fosse mi taccio, un po' stupito, ma mi taccio. È importante che, accanto a questa misura, l'Unione europea abbia impegnato la Commissione e due importanti Paesi europei siano impegnati a un rafforzamento dell'attività e dell'impegno finanziario dell'Unione europea in Libia. E la Libia è un Paese chiave in questa partita; lì si gioca una partita cruciale: il 97 per cento delle persone arrivate nei primi sei mesi di quest'anno viene dalla Libia - lo sottolineo - e la cosa più singolare è che non c'è nessun libico. Comprenderete allora che è lì che si gioca una partita cruciale. La Libia non è la Turchia, con la quale l'Europa ha fatto un negoziato per chiudere di fatto o, in ogni caso, tenere fortissimamente sotto controllo la rotta balcanica. I dati del 2016 sono chiarissimi: rotta balcanica, -72 per cento; rotta balcanica occidentale, -84 per cento; rotta del Mediterraneo centrale, +18 per cento. In questi dati sta un problema gigantesco, che non ha soltanto l'Italia - sarebbe sbagliato crederlo - ma l'Europa intera. In Libia dobbiamo misurarci con la fragilità e l'instabilità del Paese, ed è tutto molto più difficile. Tuttavia, c'è un nesso evidente - vorrei non sfuggisse a nessuno - tra la stabilizzazione della Libia e la lotta senza quartiere ai trafficanti di esseri umani, perché questi, per poter fare quello che fanno, hanno bisogno di istituzioni fragili e deboli e di controllare il territorio. Combattere il traffico di esseri umani significa di fatto aiutare la stabilizzazione della Libia. Naturalmente non è solo questo il problema - ci sono altre questioni che riguardano iniziative di carattere internazionale e diplomatico - ma è uno dei punti, il cuore dell'accordo che l'Italia ha firmato con la Libia, fondato su tre capisaldi di cui più volte abbiamo e ho ampiamente parlato in Parlamento, per cui mi consentirete di non ritornarci, per ragioni di tempo. Consentitemi però di trasmettervene lo stato d'avanzamento. Il suo primo caposaldo, il controllo delle acque territoriali libiche, passa attraverso il rafforzamento, l'addestramento e l'accresciuta capacità d'iniziativa della Guardia costiera. Abbiamo formato gli equipaggi nei mesi scorsi; abbiamo consegnato quattro motovedette alla Guardia costiera libica e altre ne consegneremo nelle prossime settimane e mesi. Nei prossimi giorni, andrà a Tripoli per supporto logistico un pattugliatore della Guardia di finanza. Comprenderete, quindi, che vi sono un investimento e una cooperazione veri: i numeri dell'OIM, che vi ho dato prima, testimoniano che c'è un'attività. È molto importante che ci sia stato e ci sia l'impegno da parte della Commissione europea di finanziare e costruire - cosa che dev'essere fatta al più presto - un centro di coordinamento del soccorso marittimo a Tripoli. L'obiettivo è farlo entro la fine dell'anno, al massimo entro l'inizio dell'anno prossimo. Un centro di coordinamento per l'attività di soccorso a Tripoli costituisce un elemento importante, perché in questo momento, nel Mediterraneo centrale, agisce soltanto il centro di coordinamento e soccorso marittimo italiano. Avere un centro di soccorso marittimo a Tripoli, che quindi consenta alla Guardia costiera di poter operare nelle acque territoriali e, contemporaneamente, di riportare in Libia le persone che vengono salvate nelle acque territoriali, è un punto cruciale. Il secondo caposaldo è il seguente: poiché l'obiettivo è avere una Guardia costiera che controlli i flussi che partono dalla costa settentrionale della Libia per riportarli in Libia, è fondamentale non aprire nuovi centri di accoglienza, perché in Libia ce ne sono tantissimi, ma garantire il rispetto dei diritti umani, e su questo io penso che il Parlamento italiano non possa che essere profondamente intransigente. A tale proposito, però, facciamo fra di noi un discorso di verità: in questi mesi l'Organizzazione internazionale per le migrazioni è tornata a Tripoli e l'UNHCR, che gestisce dette questioni per le Nazioni Unite, è andata per la prima volta a Tripoli. Ora, naturalmente si tratta di implementare tutto questo lavoro. Si tratta di trovare un più forte e significativo sostegno e il fatto che l'Europa investa di più al riguardo - voi comprendete - significa affrontare un altro piccolo tassello del progetto Mediterraneo centrale. Il terzo caposaldo è relativo al tema del controllo dei confini sud della Libia. Si tratta di una questione cruciale. Il confine subsahariano è un elemento fondamentale per il controllo del traffico di esseri umani e l'attività antiterrorismo. Il confine Sud della Libia è il confine Sud del Mediterraneo centrale e, quindi, è il confine Sud dell'Europa. Non è il confine Sud dell'Italia. Se qualcuno pensa che il Sub-Sahara sia il confine Sud dell'Italia, fa un drammatico errore. Il Sub-Sahara è il confine dell'Europa. Sulla sua sicurezza si gioca una partita fondamentale per il futuro dell'intero continente europeo. Nelle settimane scorse sono venute a Roma le tribù principali, i cosiddetti guardiani del deserto - i Tebu, i Tuareg, i Suleiman - che erano in guerra tra di loro e hanno firmato la pace di fronte al Governo italiano. E l'hanno fatto al Ministero dell'interno, al Viminale, esprimendo una fiducia molto forte nei confronti del rapporto con il nostro Paese. Quelle tribù potranno costituire, domani, la spina dorsale di una moderna guardia di frontiera libica per tutelare i confini meridionali della Libia, insieme con altri due Paesi chiave con i quali abbiamo chiuso un accordo di cooperazione, il Niger e il Ciad. Voi comprendete, quindi, che incomincia a vedersi una prospettiva di intervento organico dall'altra parte del Mediterraneo. Nei prossimi giorni andrò a Tripoli per incontrare i sindaci libici e discutere con loro di progetti concreti di sviluppo e cooperazione. Nel momento in cui ci poniamo l'obiettivo di stroncare il traffico di esseri umani - cosa assolutamente indispensabile e immediata, perché si tratta di una guerra senza quartiere e poiché in questo momento il traffico di esseri umani è forse l'unica industria che funziona in Libia, forse l'unica realtà che produce, in modo criminale e nella maniera più distorta possibile, una redistribuzione del reddito - si deve costruire, insieme con le comunità, un circuito economico alternativo. Il consenso delle comunità locali è fondamentale nella lotta contro i trafficanti di esseri umani, per l'accoglienza in Libia e nella lotta contro il terrorismo. Il 24 luglio a Tunisi faremo la seconda riunione - la prima si è fatta a Roma - del gruppo di contatto tra Europa e Africa settentrionale. Sarà un momento importante per fare il bilancio di questa complessa strategia. La Commissione europea ha messo a bilancio 153 milioni per quest'anno e 200 milioni per l'anno prossimo, ma non bastano. C'è bisogno di un impegno diretto dal punto di vista finanziario dei singoli Stati membri. C'è una sproporzione evidente tra quello che si è investito sulla rotta balcanica e quello che si sta investendo nel Mediterraneo centrale. Per me non è comprensibile e accettabile. È importante che vi sia una strategia comune dell'Europa sui rimpatri. I rimpatri sono un punto cruciale e fondamentale per ogni politica di immigrazione. In questo momento l'Italia ha prodotto un più 26 per cento per quanto riguarda gli allontanati e un più 16 per cento per quanto riguarda i rimpatri. Se mi chiedeste se sono contento, risponderei di no. Ma so perfettamente che, nel momento in cui l'Europa decide di adottare una strategia comune per quanto riguarda i rimpatri, accoglie una richiesta storica che l'Italia ha sempre avanzato. Soprattutto c'è un'altra questione: accanto ai rimpatri l'Europa è disponibile - vedremo domani a Tallin - ad applicare una politica comune dei visti. È una questione cruciale, perché riguarda un problema evidentissimo che viviamo nelle ultime ore e in questi giorni. Noi abbiamo flussi notevoli e significativi da Paesi che vengono considerati assolutamente sicuri. Le persone che vengono da Paesi sicuri vanno rimpatriate. C'è bisogno di accordi di riammissione e di disponibilità nella riammissione. Se un Paese non ferma i flussi e poi non accetta i rimpatri di coloro che sono entrati illegalmente in Italia e in Europa, ciò comporta il blocco immediato dei visti legali di quei Paesi. Vi posso garantire che questa è una spinta straordinaria affinché i rimpatri si facciano. È chiara la questione? Infine, per quanto riguarda la relocation, alla fine del 2016 avevamo ricollocato 2.600 persone; adesso sono 2.500, a cui si aggiungono altre 400 che sono nella fase conclusiva della relocation. Anche a tal proposito si è fatto un passo avanti, ma è decisamente insufficiente. Il fatto che Francia e Germania, domenica scorsa, abbiano inteso comunicare la loro intenzione di aumentare le relocation verso i propri Paesi non lo considero assolutamente risolutivo, ma è un piccolo passo in avanti. Si tratta di piccoli passi, che reputo però decisamente in avanti. Dalla Commissione europea sono state fatte, poi, delle sollecitazioni e, in qualche modo, anche delle raccomandazioni, di cui terremo buon conto, di cui terrò buon conto. D'altro canto, se si dice a uno che si chiama Minniti che deve fare di più per implementare le riforme di Minniti - così c'è scritto nel documento - comprenderete che per Minniti non è una mission impossible. Tuttavia, in questi giorni si è posta un'altra questione di assoluto rilievo, che è giusto affrontare apertamente in Parlamento. Negli ultimi anni l'Italia ha dato una straordinaria prova di accoglienza: lo ha fatto, lo sta facendo e lo farà. L'accoglienza è scritta nel DNA del popolo italiano e del Paese. Tuttavia, mi chiedo e vi chiedo se si può separare la salvezza in mare dalla terra che accoglie. Se non ci sono la terra e l'approdo, la salvezza è soltanto provvisoria. Separare la salvezza e l'accoglienza rischia di apparire una gigantesca ipocrisia. È difficile pensare che ci possano essere una missione internazionale di salvataggio e un solo Paese che accoglie le persone che sono salvate: questo è il cuore della questione che abbiamo posto.
2017-07-05	PD	MinnitiMarco	L'Europa che non comprende questo è un' Europa che rischia di perdere se stessa. Per queste ragioni ho chiesto un'esplicita discussione e ho dato mandato al prefetto Pinto, che è il capo della Direzione centrale dell'immigrazione del Dipartimento di pubblica sicurezza, di inviare una lettera a Frontex, per chiedere un'immediata e urgente riunione, per ridefinire le regole della missione Triton, affrontando il tema della regionalizzazione dei soccorsi, con pazienza, con capacità di ascolto delle ragioni altrui, e con la fortissima convinzione delle nostre ragioni, così come abbiamo fatto ieri, quando a un certo punto è apparso sulle agenzie di stampa che il Ministro della difesa austriaco aveva minacciato di schierare truppe ai confini con il nostro Paese. Di fronte a quelle dichiarazioni abbiamo risposto dicendo fondamentalmente tre cose. La prima è che non c'era alcuna emergenza al Brennero. La seconda è che la cooperazione tra le forze di polizia italo-austriache era ottima. La terza è che Italia e Austria avevano una lunga tradizione di amicizia e di cooperazione.
2017-07-05	PD	MinnitiMarco	Ma per me, proprio perché dico questo, c'è un punto cruciale che è il seguente. Ho detto più volte, in varie sedi parlamentari, che ritengo sbagliata l'equazione tra terrorismo e immigrazione. Tuttavia, se guardiamo l'Europa degli attacchi terroristici, da «Charlie Hebdo» in poi, noi abbiamo squadernato di fronte ai nostri occhi un evidente rapporto tra terrorismo e mancata integrazione
2017-07-25	LN	ConsiglioNunziante	Il rilancio per il Sud non può passare se non attraverso una riduzione delle tasse, ma questo deve valere per tutto il Paese e non può essere semplicemente limitato ad alcune zone, come previsto dagli articoli 4 e 5 del decreto-legge, con cui si prevede l'istituzione di Zone economiche speciali: un tentativo nobile di mettere queste zone in condizione di potersi rilanciare economicamente. Le Zone economiche speciali sono volte a favorire l'insediamento di imprese o le imprese di nuova istituzione, ma una flat tax al 15 per cento sarebbe auspicabile in tutto il Paese. Come dicevamo, non è previsto alcun piano industriale, ma l'ex presidente Renzi aveva presentato un masterplan per il Sud. Lo stesso leader dei giovani industriali chiedeva di coinvolgere nel progetto che riguardava il Sud chi effettivamente al Sud lavorava e faceva impresa. Gli stessi imprenditori auspicavano di essere coinvolti per poter portare la propria esperienza in un territorio che conoscevano molto bene e chiedevano un progetto di impatto forte e di shock positivo. Nulla di tutto questo. E che dire dell'articolo 11, recante «Interventi urgenti per il contrasto della povertà educativa minorile e della dispersione scolastica nel Mezzogiorno»? È un bellissimo titolo. L'articolo è molto ben scritto, ma è poca cosa individuare aree di esclusione sociale per prevedere e promuovere progetti, altri tavoli e altre concertazioni che non servono a nulla e che probabilmente non porteranno da nessuna parte. Tutto questo senza nessuna risorsa. Signor Presidente, ero rimasto a Industria 2.0. Abbiamo saltato a piè pari Industria 3.0, di cui non ho avuto notizia, probabilmente per colpa mia, e siamo ora alla versione 4.0. Ho capito che, probabilmente, usiamo solo i numeri pari: la prossima versione sarà la 6.0. Probabilmente mi sono perso qualche passaggio, per colpa mia. Il ministro Calenda l'ha raccontata bene in Commissione e anche in tutte le riunioni che ha fatto con gli industriali: certo è che non abbiamo risolto grandi problemi. Signor Presidente, mai avrei pensato che la crescita economica del Mezzogiorno potesse passare per l'azzeramento, attraverso un emendamento, dei rifiuti pericolosi. Tutto questo lo troviamo infilato nell'articolo 9 del provvedimento in esame, che magicamente fa uscire violette e margherite dai rifiuti, che solo poco prima erano considerati pericolosi. Forse in tale articolo si cerca di bypassare tutte quelle promesse, che negli ultimi vent'anni sono state fatte sul risanamento del territorio, soprattutto al Sud e in particolare nella cosiddetta terra dei fuochi. Forse è il caso di ricordare il rapporto annuale sulle mafie e sui crimini ambientali. Forse lo sviluppo del Sud passa, invece, da una seria attenzione a queste enormi problematiche, che nuocciono sicuramente all'agricoltura, alla salute e al turismo, in piena contrapposizione, in termini di risultati, con gli articoli 2 e 3 del decreto-legge in esame. Come dicevo in precedenza, probabilmente mi sono perso qualcosa per ciò che riguarda la questione industriale, ma forse il Sud dovrebbe concentrarsi su altre questioni, legate magari alla capacità di fare agricoltura e turismo. La proroga di un mese della misura agevolata, introdotta dalla legge di stabilità per il 2017, in materia di investimenti in beni materiali e strumentali ad alto contenuto tecnologico, potrebbe essere a tutti gli effetti una buona cosa, se non fosse che poi la gran parte di questi investimenti non viene fatta certamente al Sud. Non potevano certo mancare alcuni articoli sull'ILVA, eterno problema irrisolto, che ormai conta più commissari che operai. Speriamo che i soldi sequestrati alla famiglia Riva vengano effettivamente utilizzati per pagare i creditori e per la bonifica ambientale. Signor Presidente, si figuri poi se poteva mancare, nel provvedimento in esame, un articolo sugli immigrati e l'immigrazione. L'articolo 16 riguarda infatti alcune aree degradate, con la massima concentrazione di stranieri. Si prevedono uno o più commissari straordinari del Governo, nominati tra i prefetti: si aggiunge però che svolgeranno tale attività in modo gratuito. Il loro compito - udite udite- sarà quello di favorire la graduale integrazione dei cittadini stranieri regolarmente presenti nei territori interessati. Potrei fare anche qualche nome della provincia di Bergamo, come la zona di Castione della Presolana e quello di altri Comuni, come Botta di Sedrina, dove ne è arrivato qualche centinaio anche in questi giorni. Poi però, signor Presidente, diversamente dall'articolo di cui ho parlato in precedenza, per tale misura sono stati trovati 150 milioni di euro solo per il 2018: potere dell'accoglienza. Signor Presidente, mettiamoci anche la questione della valorizzazione dei terreni incolti e degli immobili inutilizzati e mettiamoci pure la creazione di Zone economiche speciali, per aumentare l'occupazione al Sud. Credo però, in cuor mio, che l'idea del posto di lavoro pubblico debba essere un po' abbandonata e debba diventare meno attrattiva e che la società debba essere ben orientata a comprendere che il problema principale resta il lavoro, seriamente, soprattutto quello femminile e giovanile. La soluzione è la compattezza e ci vuole serietà: non ci può essere responsabilità senza potere e non ci può essere potere senza responsabilità. Credo che di questo i nostri parlamentari del Sud dovranno sicuramente farne tesoro. L'approccio positivo verso la libera imprenditoria e verso la produzione deve essere estremamente serio. Signor Presidente, a volte ci dimentichiamo della produzione e pensiamo di poterla importare da altre parti del mondo. La partenza o la ripartenza non possono non inglobare l'idea che bisogna passare dalle parole ai fatti, da strumenti spot, tipo questo decreto-legge, a interventi strutturali. Basta con la Terra dei fuochi, con le crisi idriche e con tutto ciò che fa del Sud una caricatura di se stesso. Signor Presidente, non si fanno mai certi esempi, ma si parla sempre di una Lombardia che è la locomotiva del resto Paese. È una tesi probabilmente inconfutabile, ma penso che non possa più funzionare come metafora: una locomotiva guida un treno in cui tutti i vagoni procedono alla stessa velocità. È vero, si fanno trainare, ma hanno la stessa velocità della locomotiva. Questo non succede perché, comunque, se non c'è un'inversione di tendenza in questo Paese si rischia che i vagoni rimangano sganciati. Rivolgo, allora, un appello al Sud perché sono veri i detti «aiutati che Dio ti aiuta» e «largo agli uomini di buona volontà» che mettono in condizione il Sud di avere una locomotiva propria che faccia dei giovani i veri attori protagonisti, che aiuti loro a pensare che si può fare impresa nell'assoluta legalità, stando fuori da questioni legate a rapporti con mafia e via dicendo. Questo decreto-legge, probabilmente, scontenta un po' tutti: quelli del Nord si lamentano perché non hanno avuto qualche attenzione; quelli del Centro già si lamentavano prima e, pertanto, è cambiato poco, e si lamentano sicuramente anche quelli del Sud, che forse si aspettavano qualcosa di più sotto l'aspetto economico, che non è stato proprio soddisfatto. Presidente, chiudo con una chiosa. È bellissimo vedere scritto che l'obiettivo è rimanere al Sud perché la vera fortuna è stare a casa propria e vivere nella terra in cui si è nati senza dover giocoforza emigrare per il lavoro e per necessità. Se questo decreto-legge pensava di arrivare a un risultato del genere, credo che sia un pannicello caldo. Se l'idea è che possa innescare un meccanismo per cui il Sud faccia una sorta di autocritica e prenda d'esempio alcuni territori del Paese che ben funzionano, allora può raggiungere un risultato che va dal cinque al cinque e mezzo, come forma di incoraggiamento. Presidente, noi siamo stati critici sul provvedimento. I 17 articoli non hanno sempre compreso appieno i bisogni del Sud e mettono in condizione questo Gruppo di non essere positivo non sull'attenzione al Sud, ma sul provvedimento che consideriamo addirittura insufficiente per risolvere problematiche estremamente serie.
2017-07-26	LN	CalderoliRoberto	Signora Presidente, concordo con il collega Di Maggio e chiedo al Presidente del Consiglio di venire a riferire, ma non tanto e non solo sulla questione libica, bensì sull'operazione Sophia dato che sembra vi sia in essere una sua proroga che, per quanto ne sappiamo, invece che contrastare l'immigrazione clandestina l'ha favorita. Rispetto alla questione libica, invece, più che il presidente Gentiloni Silveri, che è stato tagliato fuori da tutto, inviterei in Aula il presidente Macron, che sicuramente ne sa qualcosa in più.
