2017-03-08	PD	GuerrieriPaleottiPaolo	Si potrebbe dire che i veri sovranisti, chi vuole riacquistare la capacità di controllo e di gestione, sono oggi coloro che sono a favore e si battono per un rilancio dell'Europa, per un rilancio della sua integrazione; certo, un'Europa che decida di andare avanti, di rilanciare il suo processo di integrazione. E una via percorribile - come lei oggi ha detto - per avanzare effettivamente è un'Europa cosiddetta differenziata, a più velocità, che introduca tra i Paesi maggiormente integrati forme più avanzate di soggettività politica e di accountability democratica. Tra l'altro, è una situazione - come sappiamo - che esiste già. Ma un'Europa differenziata per fare cosa? Questa è la domanda fondamentale. Qui va ribadito: per dare risposte concrete ed efficaci ai bisogni reali dei cittadini europei, che si possono riassumere proprio nei tre principali problemi che lei ha ricordato: la sfida dell'immigrazione, una maggiore assunzione di responsabilità in materia di difesa e politica estera, un rilancio della crescita inclusiva, attraverso un miglioramento della governance dell'eurozona. Certo, ci sono anche altri problemi accanto a questi, ma credo che quelli che ho appena citato possano essere considerati fondamentali, perché sono sfide esistenziali per la sopravvivenza e il rilancio della costruzione europea. In materia di sicurezza e difesa è difficile ricordare un periodo recente in cui un salto di qualità nella cooperazione europea sia stato così necessario come lo è oggi. Di qui il rilancio che si propone del progetto di difesa comune europea, del piano di azione per la difesa europea, perché i Paesi membri possano mettere insieme le loro capacità di difesa sotto forma di una cooperazione strutturata permanente, che deve mirare a sviluppare cooperazione e a garantire un utilizzo più efficiente e coerente dei piani di spesa per la difesa. Del resto, tutte le inchieste e i sondaggi ci dicono che l'auspicio di progressi in questo campo è ai primi posti nelle preferenze dei cittadini europei. Sul piano economico c'è poi il tema del rilancio della crescita, di una crescita che sia inclusiva, cioè che offra opportunità al più ampio spettro possibile di cittadini europei. Naturalmente questo chiama in causa il tema della cosiddetta governance dell'area dell'euro. Ora - come sappiamo - l'Eurogruppo è già una cooperazione rafforzata, che comprende 19 Paesi, e dovrà naturalmente essere la colonna portante di qualunque possibile rilancio del processo di integrazione. L'unione monetaria è un risultato fondamentale che l'Europa ha raggiunto, ma è un processo che si è fermato a metà e che quindi così rischia nuove fragilità. Per poterla completare, vanno realizzati tre tasselli fondamentali: in primo luogo, una capacità fiscale, perché si possano effettuare, a livello dell'eurozona, quegli investimenti richiesti per poter rilanciare la crescita ben oltre il Piano Juncker, che resta un primo risultato positivo; in secondo luogo, un ministro europeo delle finanze, che abbia capacità di gestione del budget comune a livello europeo; in terzo luogo, un'unione bancaria - per noi molto importante - che sia completata e un'integrazione finanziaria che sia a essa associata. Anche l'unione bancaria è stata lasciata a metà. Abbiamo fatto una sorveglianza comune, ma dobbiamo ancora completarla con un processo di risoluzione delle crisi efficace e un'assicurazione comune dei depositi. Ma perché non si riesce ad avanzare in questo disegno? Il problema è il seguente. Credo che sia oggi dovuto a una sorta di sfiducia e diffidenza reciproca che divide i Paesi dell'eurozona, che si può sintetizzare in due narrazioni diverse - oggi si usa questa parola - che si scontrano proprio sulla riforma dell'eurozona. C'è una prima narrazione, da parte di molti Paesi del Nord Europa, che sottolinea che l'area dell'euro è oggi più resiliente e la crescita è soddisfacente. Ma una seconda narrazione, in cui ci ritroviamo come Paese, mette l'accento sul fatto che in realtà la crescita è insufficiente, non ha raggiunto ancora e non è in grado di assicurare livelli di benessere che siano, in qualche modo, comparabili a quelli precedenti alla crisi. C'è un aumento della povertà e delle disuguaglianze che noi riteniamo intollerabile. Ecco, signor Presidente, se questo contrasto si trasformasse in un dialogo tra sordi, significherebbe una nuova paralisi dell'iniziativa europea e il rischio di frantumazione della stessa Europa. Non deve essere così. E io credo che sia l'incontro di domani e dopodomani, sia gli incontri che avverranno a Roma per ricordare i sessant'anni siano molto importanti per cominciare a lavorare a questo compromesso, che è possibile ed utile a tutti i Paesi, a entrambi i gruppi di Paesi, e che credo passi attraverso uno scambio tra un'assunzione di maggiore responsabilità nei processi di riforma e di disciplina fiscale da un lato e, dall'altro, un'offerta di maggiore solidarietà e condivisione dei rischi da parte dei Paesi del Nord Europa. Ora, ovviamente noi come Paese siamo interessati. Il futuro della nostra economia è legato al futuro dell'eurozona e dell'Unione europea. Per il nostro ruolo, noi come Paese abbiamo più di ogni altro da perdere da una disintegrazione dell'Europa. Io credo che, ai fini di questo compromesso essenziale, che può rilanciare il processo di integrazione, il nostro ruolo, il ruolo del nostro Paese, possa essere decisivo, proprio come Paese di cerniera tra i due gruppi di Paesi cui ho fatto riferimento. Quindi, il Governo sta portando avanti un duplice impegno: l'elaborazione di proposte molto ragionevoli e costruttive a livello europeo su temi specifici e un'assunzione piena di responsabilità sulla soluzione di problemi che sono specificamente nostri e che solo noi possiamo risolvere. Da questo punto di vista, quindi, per noi l'Europa è non solo importante, ma anche decisiva come contesto di riferimento. Per concludere, signor Presidente, credo che con questo spirito, da un lato, si potrà affrontare il 60° anniversario della firma dei Trattati di Roma e, dall'altro, ribadire, come Gruppo del Partito Democratico, la piena convinzione che il rilancio dell'integrazione europea sia un progetto da perseguire e consolidare anzitutto nell'interesse primario del nostro Paese, ma io direi dell'intera Unione europea.
2017-03-08	PD	SangalliGianCarlo	Non ho sentito termini vuoti dietro le tre linee che sono state tracciate. L'Italia rispetta le regole ma vuole cambiare le politiche dell'Unione europea: rispettare le regole vuol dire darsi un modo per stare assieme sapendo che non si può tornare al piccolo mondo antico delle monete nazionali e degli staterelli, perché quello non è un mondo romantico ma, come ci è stato giustamente ricordato dal presidente Napolitano, è quel mondo che sta ricostruendo le proprie frontiere attraverso il filo spinato, le muraglie antiuomo e i corpi di polizia speciale; il piccolo mondo antico non è un mondo in cui è bello tornare, perché è il mondo degli anni Trenta ed è quello che ha introdotto l'Europa alla guerra mondiale. L'Italia rispetta le regole perché stare con gli altri significa rispettare le regole, ma chiediamo politiche differenti. Nella nostra proposta di risoluzione che sostiene la politica del Governo chiediamo politiche per la crescita, mettiamo in evidenza la necessità di una politica economica europea che privilegi la crescita, l'occupazione, l'innovazione e la competitività del sistema europeo, anche attraverso un'azione economica basata sull'emissione di bond a sostegno di queste scelte. La seconda linea è che noi condividiamo gli impegni in termini di sicurezza e difesa. È poca cosa? Non lo so. Penso che forse la sicurezza e la difesa comuni sia uno dei temi su cui si risveglia la tensione europeista di tutti i Paesi europei; questo perché c'è la minaccia terroristica, perché c'è una grande instabilità mondiale, perché, come diceva il presidente Hollande alla fine del vertice di Versailles, vi sono certezze che vengono messe in discussione come non avremmo creduto potesse accadere. Viene messa in discussione l'idea di Stato di diritto, l'idea di solidarietà, l'idea di apertura e la pace stessa: sono fondamenti che vengono messi inopinatamente in discussione. Non lo si può fare, quindi bisogna ripensare l'Europa. Certo, l'Europa che abbiamo visto sessant' anni fa era ricca di valori, veniva dalla guerra mondiale e aveva di fronte a sé la necessità di ricostruirsi e di non ricreare più le condizioni di conflitto tra i diversi Paesi. Quelle condizioni sono mutate per tanti motivi, ma certamente la crisi del 2008 è stata un detonatore del mutamento delle condizioni economiche dei diversi Stati e ha accresciuto il differenziale interno tra Stati finanziariamente più forti e Paesi che avevano sulle proprie spalle un'eredità consistente di debito pubblico. Sembrano messi in discussione principi fondamentali. Ebbene, noi non possiamo metterli in discussione, allora abbiamo bisogno, per esempio, di una politica comune sulla difesa e forse su questo potremmo ottenere quel livello di efficienza che è necessario nella coalizione internazionale, nonché quelle economie che consentano anche a noi di fare investimenti nel nostro Paese, spostando risorse da un settore verso la creazione di occupazione, verso ambiti a maggiore intensità di lavoro, verso settori che si possono rendere ancora più competitivi. Le politiche comuni sull'immigrazione devono accostare, come si è detto giustamente, la necessità di governare i flussi migratori e non di sbarrarli, sulla base del fatto che siamo in un mondo globalizzato per tanti aspetti, ma anche sulla base di quel sentimento del popolo italiano che vuole il governo di processi di questo tipo, ma non richiede che una per una si ripuliscano le strade dall'umanità e dalla povertà.
2017-03-08	PD	VerducciFrancesco	I due relatori, i senatori Vattuone e Sangalli, e diversi colleghi hanno sottolineato il punto fondamentale della discussione che oggi affrontiamo in Aula: discutiamo di missioni internazionali affrontando per la prima volta la nuova legge quadro. Voglio sottolineare anche io questo aspetto non solo perché si tratta di una nuova legge e di una nuova procedura, ma perché questa nuova procedura, che nel suo articolo 1 richiama (non a caso) l'articolo 11 della Costituzione e il rispetto del diritto internazionale, consente al Parlamento di avere un ruolo più forte nella sua attività di controllo nei confronti del Governo su un settore così importante. Nel passato c'era un'assenza di riferimenti normativi stabili. Abbiamo avuto una varietà di percorsi: missioni autorizzate dalle Commissioni, missioni autorizzate dall'Assemblea, missioni autorizzate a posteriori - dopo cioè che erano partite - e anche missioni, purtroppo, che non sono state oggetto di discussione e di voto da parte del Parlamento. Ma oggi le cose cambiano, e con la legge quadro il Governo interviene - come è già stato ricordato - con due diverse procedure, a seconda che si tratti dell'autorizzazione di nuove missioni o della proroga di missioni esistenti. E il Parlamento si pronuncia - questo è un punto fondamentale - anche sugli aspetti finanziari: il Parlamento può prevedere una vera e propria sessione parlamentare sulle missioni, sulla falsariga di quello che avviene per l'esame di documenti di finanza pubblica, che potrà essere l'occasione di una riflessione di alto livello sulle linee generali della nostra politica estera. Questo avviene, signora Presidente, perché le missioni internazionali sono un pezzo fondamentale e qualificante della nostra politica estera. È con le missioni internazionali che il nostro Paese ha migliorato la sua immagine internazionale, perché ha dato contributi sostanziali a processi di stabilizzazione in tante parti del mondo e anche perché nel corso degli anni si è affermato un modello italiano di peace keeping, a partire dalla missione in Libano nel 1982 e poi con le missioni in Albania, in Somalia, in Mozambico, fino alle prove più recenti. C'è un tratto italiano da rivendicare, che in larga misura deriva anche dalle sollecitazioni del Parlamento, che affianca le capacità prettamente militari a una specifica modalità operativa contraddistinta non solo da imparzialità nei confronti delle parti, ma anche e soprattutto da attenzione e sensibilità alle esigenze della popolazione civile, agli aspetti umanitari, ai diritti in particolare delle donne e dei bambini. E vorrei ricordare questo qui, signora Ministro, non solo perché l'8 marzo è una data simbolica per le donne e le nostre conquiste civili, ma anche perché tutto questo mette il nostro impegno nel solco della risoluzione n. 1325 del 2000 del Consiglio di sicurezza ONU dedicata al tema «Donne, pace e sicurezza», richiamata significativamente nell'articolo 1 della legge n. 145 del 2016. Noi possiamo oggi sottolineare che l'incremento delle dotazioni per gli interventi di cooperazione umanitaria e per il sostegno ai processi di pace e di stabilizzazione è fondamentale: ci sono fondi che arrivano a 295 milioni di euro e che contemplano interventi qualificanti in aree per noi essenziali. Vorrei citare la Tunisia, la Libia, la Siria e Paesi anche maggiormente interessati all'assistenza dei rifugiati nell'area mediterranea come il Libano e la Giordania. Si tratta dunque di Paesi che, a vario titolo, sono coinvolti nelle emergenze in atto nel Mediterraneo - a questo voglio dedicare soprattutto il mio intervento - e possono contribuire, attraverso aiuti mirati, ad assicurare maggiore stabilità a quell'area e, quindi, al nostro Paese. L'aumento di risorse si pone nell'indirizzo più generale di un incremento che degli ultimi anni dei fondi per la cooperazione allo sviluppo; un impegno che proseguirà nel prossimo futuro anche grazie alle disposizioni della nuova legge di settore, nella convinzione che, per scongiurare nuove emergenze e fronteggiare possibili e nuove crisi umanitarie anche nell'area a noi più vicina, è indispensabile avvalersi di tutti gli strumenti di cooperazione esistenti, per sradicare quelle condizioni di miseria e di insicurezza che attanagliano molti Paesi dai quali hanno origine i flussi migratori. Si tratta di ragioni fondamentali non solo di solidarietà e di umanità, ma anche di opportunità politica ed economica, nonché dell'esigenza sempre più forte di sicurezza, perché sappiamo che molto spesso instabilità e insicurezza sono legate a dinamiche migratorie fuori controllo. Vorrei ricordare l'impegno del nostro Paese per sostenere e definire le iniziative europee e internazionali, per rafforzare il Fondo europeo di emergenza per la stabilità e la lotta contro le cause profonde della migrazione irregolare e del fenomeno degli sfollati in Africa, istituito dal vertice di La Valletta nel novembre 2015. Sono strumenti che connotano in positivo l'azione che il nostro Paese sta compiendo a livello internazionale. Signora Presidente, lo sforzo del nostro Paese negli ultimi anni è stato rivolto a far prendere consapevolezza anzitutto ai partner dell'Unione europea che il fenomeno dell'immigrazione non riguarda solamente i Paesi di primo approdo e va affrontato insieme con strumenti nuovi che, accanto alla dimensione della sicurezza, comprendano la cooperazione con i Paesi di provenienza e transito. Fatemi dire - come ha detto stamattina in Aula il presidente Gentiloni Silveri - che ciò avverrà a maggior ragione in un momento così importante come quello attuale, visto che tra pochi giorni celebreremo il 60° anniversario della firma dei Trattati di Roma. Questo processo di integrazione troverà uno slancio ancora maggiore nella costruzione della difesa europea e di politiche comuni per l'emigrazione e nel rafforzamento di una comune politica estera. Concludo, signora Presidente, sottolineando i pregi dell'azione svolta negli ultimi anni, ma anche osservando che oggi viviamo un momento di grande difficoltà, caratterizzato da tante crisi, focolai di instabilità e minacce, a partire da quella del terrorismo internazionale e dal rischio dell'espansione di Daesh. C'è una missione in particolare che lo fronteggia. Penso al nostro impegno nel Kurdistan iracheno, alla nostra presenza militare e civile, all'addestramento delle forze dei peshmerga e alla messa in campo di azioni per la ricostruzione della diga di Mosul. Si tratta di interventi di assoluto rilievo geopolitico in un quadro dove le incertezze sono enormi, a partire da quelle che gli studiosi chiamano la distribuzione internazionale del potere, la perdita di orientamento della leadership americana e un'incertezza spesso traumatica anche a livello regionale. Qui c'è anche il ruolo dell'Italia, chiamata ad agire in un contesto così difficile, tenendo insieme la garanzia del rispetto degli impegni già assunti in passato e la necessità di far fronte ai nuovi scenari che si vanno profilando. In questo senso, il nostro impegno deve essere sempre maggiore e riorientato verso le politiche e gli interessi del Mediterraneo che - come sappiamo - è il luogo da cui arrivano i principali rischi per la nostra stabilità e la sicurezza dell'Unione europea. Esso è però anche il luogo dove noi possiamo risolvere il dilemma di Braudel e fare del Mediterraneo il luogo non più dello scontro tra popoli, ma quello dell'incontro di civiltà per contribuire a sanare una delle fratture più pericolose per la pace e la sicurezza nostra e delle generazioni future.
2017-03-09	PD	FasioloLaura	Signor Presidente, ringrazio anzitutto il Sottosegretario delle informazioni. Non posso far altro che compiacermi per la diffusa risposta che si avvale, tra l'altro, anche del decreto-legge n. 13 del 2017, che lei ha illustrato e che fornisce risposte compiute alle esigenze degli immigrati. L'incremento c'è sempre nei nostri territori. Per quanto infatti non ci sia più una vera e propria rotta balcanica significativa, quotidianamente dall'area tarvisiana pervengono dal resto d'Europa dei flussi che sono piccoli, ma costanti; mediamente su Gorizia, dai 7 di ieri ai 14 di oggi; quotidianamente, una decina. Sicuramente pertanto la risposta che lei ha dato, l'offerta SPRAR, l'attenzione sempre più viva da parte dei Comuni allo SPRAR, all'accoglienza diffusa, è un aspetto fondamentale, che è stato peraltro richiamato anche dalle disposizioni urgenti di cui al citato decreto-legge n. 13. Questo è un elemento fondamentale e mi rammarico che alcuni Comuni - pochi in verità - abbiano negato l'accoglienza, soprattutto per motivazioni significative, per la mancanza reale di ambienti di ospitalità. Quanto poi ad altri aspetti, quali quello della progressiva eliminazione dei CARA, sarebbe davvero un segno di civiltà non averne assolutamente più. Ritengo altresì positiva l'attività che si sta svolgendo in alcuni Comuni del nostro territorio, i quali si rivolgono ai migranti affinché producano delle attività ad esempio di giardinaggio o di vario tipo in modo da poterne valorizzare le competenze. Questo dovrà essere un impegno anche per il prossimo futuro. Forse permangono ancora alcuni aspetti critici, ma di certo il quadro, che ormai si sta delineando, è volto ad affrontare questo problema considerandolo come una reale opportunità e non in una logica di tipo emergenziale. Una fase è finita e se ne sta aprendo un'altra: proprio per questo motivo voglio esprimere il più mio vivo apprezzamento. Allo stesso modo, esprimo l'auspicio che, laddove vi sia già la presenza di un centro di accoglienza per richiedenti asilo (CARA), come nella realtà di Gradisca, si cerchi di non dar vita a centri per il rimpatrio, perché c'è una sensibilità territoriale che - a mio avviso - va assolutamente rispettata. Il contrasto all'immigrazione illegale è l'altro grande impegno che ci si propone di perseguire attraverso il testo normativo, che convertiremo in legge. Ringrazio dunque nuovamente il rappresentante del Governo per la sua risposta esaustiva, apprezzando peraltro anche quanto è stato fatto dalla nostra Prefettura e dalla commissione territoriale, che opera senza limiti temporali e in maniera davvero straordinaria. È dunque importantissimo che anche le commissioni territoriali vengano rafforzate, viste le 250 unità di personale specializzato che ci si predispone ad impiegare e che dovranno costituire un'altra risorsa e un altro elemento di arricchimento.
