2017-01-10	LN	DivinaSergio	I ragazzi vendono il bonus libro e il bonus cinema. Dove sono andati a finire tutti quei denari e quelle risorse? Si poteva anche immaginare che sarebbero finiti così. Credo abbia letto anche lei il dato dei patronati svizzeri: il suo Ministero eroga tra i 35 e i 40 milioni l'anno. Siamo sorpresi che un direttore del patronato CGIL-INCA di Zurigo si sia potuto appropriare di cifre che sorpassano i dieci milioni e infatti il tribunale di Zurigo, nel 2015, lo ha condannato a nove anni di carcere. Ebbene, mi pare che in quest'Aula sia giunta una relazione pesantissima del Comitato per le questioni degli italiani all'estero, presieduto dal collega Claudio Micheloni, votata nel 2016 all'unanimità, che evidenziava queste storture: non si è fatto assolutamente nulla. Signor Ministro, lei ha annunciato che vi saranno delle ispezioni, ma le ispezioni non servono adesso, servivano prima: l'ispezione non la si annuncia, si compie, punto e basta, i controlli si fanno senza avvertimento. Adesso si fanno le constatazioni: a danno avvenuto, si fa la constatazione, anche in termini di RCA. Se uno si chiede come sta andando questo Governo, basta prendere due spot. La scuola: i ragazzi vengono invitati ad andare a scuola con berretti, sciarpe e guanti, perché qualcuno si è dimenticato che a gennaio potrebbe anche far freddo e magari il riscaldamento andrebbe acceso con qualche giorno di anticipo, rispetto al giorno di apertura. La sanità: non so se sia normale leggere che in Campania i ricoveri addirittura vengono fatti per terra, perché non si sa dove mettere i ricoverati Ma la sanità non si gestisce in modo ragionieristico, la sanità va gestita in base a domande, a richieste e a statistiche diverse e non tagliando, tagliuzzando e recuperando in modo che i soldi possano essere dati ai giovani perché vadano al cinema. Non so se lei ha mai dormito in una roulotte, quando fuori ci sono dieci gradi sotto zero. Il sottoscritto lo può dire, perché in occasione del terremoto in Irpinia siamo intervenuti come volontari e le assicuro che dormire con i ghiaccioli fuori, ancorché con il riscaldamento all'interno, con un'umidità del cento per cento, non è dormire, è passare la notte in qualche maniera. Mi fermo qui. Signor Ministro, quei poveri ragazzi che non hanno alternative e che decidono di arrangiarsi senza chiedere niente allo Stato, come hanno fatto i migranti nell'Ottocento e all'inizio del Novecento che hanno deciso di trovare la loro strada, devono sentirsi anche umiliati da un rappresentante del Governo? Questa è la goccia che fa traboccare il vaso. Ci siamo sentiti in dovere di firmare - non è un'iniziativa nostra, ma dei colleghi di SEL - una chiamata di responsabilità diretta da parte sua. Non sarebbe male se ogni tanto, all'interno del Governo, quando succedono queste cose, qualcuno dicesse: «non mi giustifico, ho delle colpe, ho fatto degli errori», come si fa in tutti i Paesi normali e democratici.
2017-01-10	M5S	MontevecchiMichela	Lei fa però un altro scivolone nel mentre ricerca le ragioni della situazione in cui ci troviamo oggi. È giusto ripercorrere l' excursus, però lei parte con la crisi del 2008, la riforma delle pensioni del 2011 e lo scollamento tra scuola e impresa, perché c'è l'urgenza di creare dei giovani che abbiano delle capacità, delle competenze e del saper fare. Per noi, invece, bisogna creare degli adulti che sappiano essere cittadini attivi e partecipi in questa società, i quali sappiano quindi pensare e ribellarsi, quando è giusto, con la critica costruttiva. Poi continua raccontandoci - e qui sta lo scivolone - la sua favola, la favola di un Ministro nel Paese delle meraviglie. Io, invece, la vorrei risvegliare da questa favola perché in questo mondo delle meraviglie che lei ci ha raccontato snocciolando qualche dato, in realtà, non vivono tanti giovani e adulti. Infatti, sono proprio di ieri i dati dell'ISTAT che ci ricordano che in questo Paese la disoccupazione giovanile è aumentata di due punti percentuali solo nell'ultimo mese, attestandosi al 39,4 per cento, e il tasso di disoccupazione generale è all'11,9 per cento se non consideriamo gli inattivi perché, Ministro, tante persone hanno perso lo spirito e la voglia di cercare lavoro, sono frustrate e depresse perché non vedono prospettive. Allora, se noi aggiungiamo queste persone e le contiamo arriviamo ad un tasso di disoccupazione che sfiora il 20 per cento. Il mondo del lavoro non è certo migliorato, mi scusi, con le sue politiche perché il jobs act ha fatto tutto tranne che dare più stabilità e meno precarietà al mondo del lavoro in questo Paese. Partiamo con i voucher che sono esplosi. Nel 2016 abbiamo avuto più di 145 milioni di voucher e questo grazie anche alla sue politiche che hanno ampliato la platea di coloro che ne potevano usufruire e hanno alzato il tetto. Abbiamo quindi un aumento dei voucher, rispetto al 2015, del 30 per cento e del 70 per cento in più rispetto al 2014. Gli sgravi contributivi che erano stati previsti per favorire le assunzioni a tempo indeterminato, mi scusi Ministro, sono serviti a creare una narrativa, una bolla occupazionale che fa parte solo della vostra narrativa politica più che di dati reali, una narrativa politica, uno slogan che voi avete utilizzato variamente per tentare di portare a casa altri obiettivi politici che non fossero quello di dare veramente stabilità e di combattere la precarietà in questo Paese. Allora perché se ne vanno questi giovani? Glielo diciamo noi perché se ne vanno: se ne vanno innanzi tutto perché si sentono ignorati e abbandonati da una politica autoreferenziale che in questa legislatura ha dimostrato di avere maggiore attenzione per gli interessi delle lobby, delle banche, delle assicurazioni e dei propri interessi in campo piuttosto che per varare veramente delle politiche a favore dei giovani e meno giovani per non subire la precarietà quotidiana non solo materiale ma anche emotiva, che deriva dal non poter contare su un lavoro o sul potersi ricollocare in un mondo del lavoro veramente flessibile e che funzioni. Abbiamo il 28,7 per cento degli italiani a rischio povertà o esclusione sociale. Il reddito di cittadinanza, la nostra proposta, giace da due anni e più nella Commissione di competenza perché voi non volete ragionare e siete ciechi su questo. Il 47,3 per cento delle persone dichiara di non potersi permettere una settimana di vacanza, il 17 per cento di non poter riscaldare adeguatamente le proprie case, l'11,8 per cento delle persone dichiara di non riuscire a fare un pranzo adeguato e il 15 per cento delle persone dichiara di avere avuto arretrati per mutui, affitti o bollette. Chiudono 390 imprese al giorno e 11 milioni di persone rinunciano alle cure e questo perché voi avete portato avanti delle politiche, e lei ha portato avanti delle politiche nel mondo del lavoro che non solo hanno tradito le attese dei giovani e dei loro genitori, ma hanno tradito anche i principi sanciti dalla nostra Carta costituzionale perché l'articolo 3 impone alla Repubblica di portare avanti delle politiche che assicurino pari opportunità a tutti ed uno sviluppo della persona pieno attraverso la garanzia anche dei diritti economici
2017-01-10	PD	RicchiutiLucrezia	Signora Presidente, onorevoli colleghi, lo scorso 5 gennaio 2017 si è spento, per molti aspetti in modo improvviso, Tullio De Mauro. Penso sia importante ricordarlo anche in quest'Assemblea dopo che in modo ampio e informato è stato ricordato pubblicamente, anche sulla stampa, da Giuliano Amato (che lo volle Ministro nel suo ultimo Governo), Alberto Asor Rosa, Francesco Erbani, Paolo di Paolo, e tanti altri. I motivi per cui penso sia essenziale tener sempre presente il contributo di De Mauro, per me che sono figlia di immigrati del Meridione, venuti a cercare una vita migliore nella grande periferia di Milano, sono due. Anzitutto, De Mauro ci ha spiegato che la lingua è un luogo. La lingua, i suoi linguaggi, le sue parole, i suoi lessici sono una grande piazza alla quale si accede e dove si abita. Chi non sa parlare, non sa farsi capire e non capisce, quindi non ha accesso. Non ha accesso ai diritti, non ha accesso alle opportunità, non ha accesso all'emancipazione. Quindi la lingua è un fattore di sviluppo e di uguaglianza. C'è un nesso stretto tra lingua, istruzione e democrazia. In questo primo insegnamento, peraltro, De Mauro ci ha mostrato la sua passione per la conoscenza dei dialetti, per i modi di dire, per i neologismi. Egli svecchiò, anzi forse fondò, la linguistica italiana, ma ne fece una scienza sociale, che esigeva il possesso dei tecnicismi ma poi andava oltre, cercando profondità storica e proiezione futura. Non c'è bisogno qui di ricordare le sue due storie linguistiche: la «Storia linguistica dell'Italia unita» del 1963, e la «Storia linguistica dell'Italia repubblicana», la cui seconda edizione è del 2015. Insomma, per De Mauro la lingua italiana è proprio un "posto bellissimo", in cui possono abitare le città e le campagne, i centri e le periferie, i giovani e i meno giovani. L'altro motivo per cui ricordo De Mauro è collegato al primo e ha un connotato eminentemente politico: la lingua, che è un fattore di sviluppo e di emancipazione, deve quindi contare su una scuola efficace, ricca e stimolante. La sua ultima battaglia, quella sull'analfabetismo di ritorno, nasceva dalla riflessione che la scuola deve insegnare a imparare, a interessarsi sempre di tutto, al gusto della lettura. De Mauro era anche molto ironico, ma la sua ironia era sempre mirata a smontare i luoghi comuni: diceva che leggere è un piacere solo per pochi, più spesso è una fatica, un'operazione intellettuale complessa. Allora ecco che la scuola è un momento fondamentale per l'individuo ma anche per la collettività. La lingua e la cultura sono profili politici. De Mauro spiegava che se, viceversa, dalle conoscenze e dalle capacità acquisite a scuola si regredisce invece di avanzare, ci si perde e si smarrisce la strada per quella piazza così bella che è la nostra lingua, quella stessa lingua in cui è scritta la Costituzione. In un'introduzione a una pubblicazione della nostra Carta costituzionale dell'UTET del 2006, De Mauro esaltava «l'italiano degli italiani», la lingua chiara e profonda in cui sono scolpiti i nostri diritti e i nostri doveri, e dove la dignità della persona è così ben rappresentata.
2017-01-17	LN	StefaniErika	Va da sé che quando parliamo dell'istituzione di una Giornata nazionale delle vittime civili delle guerre e dei conflitti nel mondo si potrebbe pensare di trovare tutti palesemente d'accordo. Ad ogni modo stiamo parlando dell'istituzione dell'ennesima giornata e del fatto che vengono previste delle attività di promozione all'interno delle scuole; ci piacerebbe forse sapere quante giornate ormai vengono deputate a particolari argomenti e ci domandiamo se questi ragazzi a scuola, magari, hanno anche il tempo di studiare qualcos'altro.
2017-01-17	PD	AngioniIgnazio	Signor Presidente, nel nostro Paese sono oltre cinque milioni gli stranieri residenti e gli alunni stranieri presenti nelle nostre scuole sono quasi il 10 per cento del totale di tutti gli alunni italiani. Nelle sole Emilia-Romagna e Lombardia sono rispettivamente il 15 e il 14 per cento. Questi dati ci parlano di una società molto diversa da quella che ha ispirato la riforma del 1992, che oggi disciplina il diritto di cittadinanza in Italia. Come è noto, la Camera dei deputati ha approvato, nel 2015, una nuova proposta di legge sulla cittadinanza. Il testo prevede l'estensione dei casi di acquisizione della cittadinanza per nascita e una nuova forma di acquisto in seguito al percorso scolastico. Oggi quella proposta di legge fa parte del disegno di legge n. 2092, che è in Commissione affari costituzionali in Senato. Certamente molti disegni di legge sono importanti, ma alcuni rivestono un'importanza particolare, direi strategica, per il futuro del nostro Paese: questo disegno di legge è certamente uno di questi. Sono centinaia di migliaia i bambini e gli adolescenti, figli di famiglie di immigrati, che sono nati o stanno crescendo nel nostro Paese, che vanno a scuola, giocano e si confrontano quotidianamente con i loro coetanei italiani. Tra gli uni e gli altri non c'è, già oggi di fatto, alcuna distinzione. Entrambi fanno già parte della nuova generazione italiana ed europea. Ecco perché credo che sia molto importante dare seguito all'appello di questi giorni, rivolto dai due colleghi presentatori della proposta di legge alla Camera, Khalid Chaouki e Milena Santerini, al Presidente del Senato, nel rispetto ovviamente del suo ruolo e di quello della 1ª Commissione, di adoperarsi affinché il provvedimento possa arrivare in Aula ed essere approvato in tempi certi, per consentire di avere, entro questa legislatura, una nuova legge sulla cittadinanza della quale il nostro Paese ha urgente bisogno.
2017-01-17	PD	DeBiasiEmiliaGrazia	Allora c'è qualcosa di più che credo dovrebbe interessare l'educazione, invece di tanta inutile ideologia sul gender, tante parole a vuoto, tanto «bla bla» per fare accuse sul piano ideologico. Forse varrebbe la pena ragionare su che cosa significa educare i bambini alla cultura del rispetto reciproco e che cosa vuole dire essere oggi genitori di questi bambini, che magari crescono e che per 80 euro fanno ammazzare da un amico il genitore. Qualcosa non funziona, Presidente: è qualcosa di molto, molto più profondo. Questa problematica riguarda molto da vicino la sanità e i temi della salute e non solo della salute mentale. Io sono di vecchia scuola e non ritengo che vi sia la sindrome del mostro, perché la nostra non è una società piena di mostri, ma una società piena di gente convinta evidentemente che certe cose si possano fare e che non succeda niente se si fanno. Quella ragazza contro cui il fidanzato ha gettato l'acido, una candidata a miss Italia, una ragazza bellissima - poteva essere anche bruttissima, nel caso era bellissima - ha fatto solo l'errore di fidarsi e di essere d'accordo ad eliminare i 50 metri di distanza imposti dalla legge sullo stalking. Il prezzo di questo atto di fiducia è stato probabilmente la sua vita. Tutto questo riguarda sicuramente la sanità. Pensiamo a tutte le donne che passano da un pronto soccorso, perché è questo che succede. Le donne vanno in un pronto soccorso, dove non sempre c'è la formazione che dovrebbe esserci: molti sono per fortuna gli esperimenti in campo, ma bisogna fare molto di più per formare gli operatori sanitari sul tema dell'emergenza affinché possano individuare il caso di violenza - infatti non è neanche detto che il caso di maltrattamento o di violenza venga individuato - e poter inviare così la donna ai centri antiviolenza. Il passo precedente è quello che oggi manca ufficialmente. Spero che la Commissione d'inchiesta possa aprire una finestra anche su questo per verificare lo stato dei pronto soccorso, dell'emergenza e urgenza esattamente sul piano della formazione degli operatori, perché questa è la strada. L'ISTAT ci dice che solo il 5 per cento delle donne si rivolge a un centro antiviolenza, ma sappiamo anche che nei pronto soccorso le donne maltrattate hanno delle caratteristiche comuni: hanno crisi di panico, cefalee croniche, dolori pelvici cronici. È una statistica brutale, ma anche questa è una statistica. Non sempre queste donne raccontano le storie di violenza, ma la formazione degli operatori potrà fare in modo che il fenomeno emerga nel modo più umano possibile, perché qualcosa si sta facendo con le Forze dell'ordine, nei pronto soccorso e nell'emergenza e urgenza. Forse dobbiamo potenziare di più gli interventi. Signor Presidente, i dati offerti dal Policlinico e dal pronto soccorso della clinica Mangiagalli a Milano rilevano che dal 2015 al 2016 c'è stato un incremento dei casi di violenza e maltrattamenti domestici da 304 a 1.037. Al pronto soccorso del Policlinico si è passati dai 178 del 2015 ai 419 del 2016. È un'enormità, e parliamo di un luogo in cui c'è monitoraggio. Ma in tutti quei luoghi in cui il monitoraggio invece non c'è? Che cosa sappiamo? Che cosa sarà di queste donne? Non sono d'accordo nel dire che la donna è un soggetto debole. Non è così. Però le donne vengono brutalizzate con una violenza fisica e psicologica, ma questo non vuol dire debolezza. Ciò può forse significare debolezza e sordità della società, della politica e anche un po' delle istituzioni. Signor Presidente, è per questo che mi auguro che questa Commissione di inchiesta possa avviare una fase di monitoraggio. Penso che il Ministero della salute debba fare la sua parte e occuparsi molto della formazione degli operatori. Infine, vorrei dire che questa Commissione di inchiesta ha anche il dovere, secondo me, di indagare sulla parte maschile, rispetto alla quale non si fa proprio niente. Cosa succede a un uomo che commette un femminicidio? Che tipo di trattamento gli viene applicato in carcere? Ci sono metodiche e studi straordinari che sarebbe ora che entrassero a pieno titolo nelle istituzioni. È un problema che riguarda la sanità, le donne e profondamente anche gli uomini perché quella violenza, quella forza brutale - che è peggio di quella animale perché è ancestrale - è un fenomeno rispetto al quale, se non lo combatteremo, faremo fatica a dirci un Paese civile.
2017-01-17	PD	MaturaniGiuseppina	Penso che dobbiamo sottolineare un tema che è stato citato da chi mi ha preceduto. Le questioni sono tante. Noi cerchiamo di individuare le cause della violenza drammatica che nel nostro Paese viene perpetrata contro le donne e giustamente affermiamo che dobbiamo lavorare nell'ambito dell'educazione dei giovani, a partire dai nostri bambini e bambine, affinché si comprenda che il rispetto della differenza di genere è la realtà del mondo, è la realtà del nostro Paese. Ma credo che dobbiamo insistere molto, con il coinvolgimento delle famiglie, della scuola e delle istituzioni, affinché si comprenda l'importanza di riprendere e dare valore al tema della relazione tra uomo e donna, del senso e del significato della relazione sentimentale. Occorre soprattutto riconoscere che nella nostra società l'individualismo e l'egoismo hanno tolto dal centro dell'attenzione sociale collettiva il tema dell'educazione affettiva. Si deve porre, infatti, il tema dell'educazione sentimentale e affettiva. Ritengo elementi di povertà effettiva la violenza drammatica messa in atto e il ricorso a strumenti che ogni giorno sembrano affinarsi nella ricerca di una aggressività sempre più efferata e che faccia notizia e cronaca, fra le tante altre questioni in maniera puntuale rappresentate in questa discussione.
2017-01-17	PD	PaduaVenera	Bisogna lavorare e prevedere rapporti di collaborazione, protocolli, non solo con le forze di polizia, che hanno fatto un lavoro straordinario in questi anni anche di formazione, ma, come è stato detto, con gli operatori del pronto soccorso e io dico anche con i pediatri, perché i primi segni di allarme possono venire proprio dai bambini. Un bambino può reagire in modo ambivalente: intanto si sente responsabile e vive un senso di colpa, come se la responsabilità di ciò che vive in quella famiglia fosse sua, e quindi può avere un atteggiamento di silenzio e di chiusura, può diventare taciturno all'improvviso, oppure può esprimere violenza egli stesso in un altro ambiente, ad esempio quando va a scuola, e quindi assumere atteggiamenti di pseudobullismo o di bullismo vero e proprio che vanno approfonditi per trovarne la vera matrice.
2017-01-24	PD	MicheloniClaudio	Signor Presidente, intervengo con profondo rammarico per annunciare l'improvviso decesso, il 21 gennaio 2017 a San Paolo del Brasile, dell'esponente della camera di commercio italo-brasiliana (Câmara Ítalo-Brasileira de Comércio, Indústria e Agricultura), il senatore Edoardo Pollastri. Edoardo Pollastri, nato ottantaquattro anni fa ad Alessandria (27 agosto 1932), si è laureato in Italia in economia e commercio ed è stato economista, docente universitario, imprenditore e politico, oltre che senatore della Repubblica italiana dal 2006 al 2008, eletto nella circoscrizione Estero, ripartizione America meridionale. Sposato con quattro figli, ha guidato diverse istituzioni operanti nell'ambito sociale ed economico italo-brasiliano ed ha seguito con molta passione e tenacia la camera di commercio per più di venti anni, diventando Presidente della Câmara Ítalo-Brasileira de Comércio, Indústria e Agricultura a San Paolo del Brasile e Presidente vicario dell'associazione delle camere di commercio all'estero. Commendatore all'ordine del merito della Repubblica italiana, ha svolto la sua attività per anni in Etiopia, come fondatore e presidente della Cooperativa agricola di Agordat. È stato il titolare del maggior studio commercialista di Asmara (sino al 1974), con l'80 per cento delle imprese italiane del territorio come clienti, e professore della cattedra di economia aziendale dell'Università degli studi di Asmara. In Brasile è stato il fondatore e presidente della Visconti (sino al 2002). Da sempre impegnato politicamente, indipendente di area Margherita, alle elezioni del 2006 si candida al Senato per l'Unione in America meridionale ed è eletto senatore della XV legislatura. Dal 2006 al 2008 in Senato, aderisce al Gruppo L'Ulivo è membro della 3ᵃ Commissione permanente e del Comitato per le questioni degli italiani all'estero, nonché presidente della scuola Eugenio Montale di San Paolo e membro della Società italiana di beneficienza di San Paolo. Dopo essere stato senatore di centrosinistra, Pollastri non ha mai smesso di impegnarsi in prima persona, con passione ed entusiasmo, a fianco della grande comunità degli italiani all'estero e del mondo delle camere italiane di commercio. Abbiamo voluto ricordare questi dati concreti per chi non lo ha conosciuto. Ma insieme al collega Renato Turano, con Edoardo Pollastri, nel 2006-2008, abbiamo vissuto la prima esperienza come senatori, eletti all'estero, nel Senato della Repubblica. Abbiamo conosciuto in quell'occasione un grande italiano, che alla politica era arrivato con lo spirito che hanno quasi tutti gli eletti all'estero: con il senso di servizio. Abbiamo cercato di servire l'Italia nel mondo e Edoardo ha cercato di servire l'Italia in questo Senato, rappresentando certamente la comunità degli italiani in America Latina, che lo aveva letto, ma pensando sempre e prima di tutto all'interesse dell'Italia. Abbiamo perso un amico, abbiamo perso un vero italiano.
2017-01-25	PD	PezzopaneStefania	Per gli studenti che hanno perso molti giorni di scuola, serve un decreto del Ministro dell'istruzione affinché non perdano l'anno scolastico e servono le risorse che il Presidente del Consiglio ha annunciato.
2017-01-25	PD	PezzopaneStefania	Signor Presidente del Consiglio, lo dico con molta fermezza: ho trovato davvero inopportune le esternazioni del Presidente della Commissione grandi rischi. Egli è tenuto a fare gli approfondimenti scientifici, così come tutta la comunità scientifica; ma è giusto che esterni, così brutalmente, una notizia come quella di un terremoto di 6,5-7 gradi, che significa 30 volte il terremoto di Amatrice? È giusto buttare lì questa notizia a popolazioni già disperate e distrutte? È giusto dirci che la diga di Campotosto può rompersi e produrre una tragedia come quella del Vajont? È giusto dire ai sindaci che se hanno le scuole insicure non devono far entrare i ragazzi a scuola? Questo non è giusto ed è in netto contrasto con gli esempi di quelle persone che ho citato poco fa.
