2017-09-14	PD	FasioloLaura	Concludo esprimendo una soddisfazione viva per la realizzazione di un importante risultato, che vedrà l'aumento delle risorse del FUS, l'instaurarsi di forti collaborazioni con il mondo della scuola, l'estensione dell' art bonus a tutto il mondo dello spettacolo, il riconoscimento giuridico a tante manifestazioni che prima non erano riconosciute. La qualità del provvedimento è davvero un grande e responsabile investimento che ci assumiamo nei confronti delle generazioni future.
2017-09-14	PD	FasioloLaura	Nei mesi scorsi le numerose audizioni della 7ᵃ Commissione hanno portato alla luce problemi, limiti e difficoltà dei lavoratori dello spettacolo. Molte sono state le testimonianze di organismi, gruppi di professionisti e associazioni che hanno chiesto - e a ciò il disegno di legge ha dato risposta - promozione e sostegno ai vari mondi dello spettacolo e alle diverse espressioni artistiche, ritenute indispensabili allo sviluppo della nostra cultura e alla coesione della nostra identità, alla diffusione e promozione europea e internazionale della nostra arte, veicolo della nostra offerta turistica. Lo spettacolo dal vivo è però anche occasione formativa fondamentale e - come detto poc'anzi - di contrasto a situazioni di disagio psicologico e sociale, presenti nel complesso e variegato mondo della scuola. Esso rappresenta altresì occasione di integrazione di soggetti con difficoltà e disabilità, ma anche e soprattutto di valorizzazione di talenti. Non a caso si prevede che le attività dello spettacolo siano realizzate con il diretto coinvolgimento dei giovani fin dall'infanzia e che una percentuale dei flussi sia destinata alle attività nella scuola; ciò a suggellare il valore educativo, formativo e sociale dello spettacolo, un valore sostenuto con tutti i mezzi.
2017-09-14	PD	PezzopaneStefania	Questa è la legislatura dell' art bonus, in cui 4.250 mecenati hanno donato circa - il Sottosegretario mi perdonerà se non sono precisa - 158 milioni e hanno finanziato 1.150 interventi. Sono numeri rappresentativi di un valore culturale, sociale, innovativo. Da segnalare, ancora, sono la rivoluzione dei musei - anche quella tanto contestata, ma i numeri danno ragione a questo Governo - le domeniche gratuite, il record degli oltre 45 milioni di ingressi nei musei, i 500 euro per i diciottenni, l'integrazione della politica culturale con la politica dell'educazione e della nuova scuola. La cultura per noi è una sfida che il Paese deve affrontare fino in fondo e all'interno della quale c'è l'ulteriore lavoro prezioso che abbiamo fatto per la riforma del cinema, attesa da cinquant'anni, dai tempi del Nuovo cinema italiano. Dopo di allora, mai più ci si era cimentati in questo senso. Quella che noi vediamo nella cultura, quindi, è una grande potenzialità di sviluppo economico e occupazionale, e non solo un pregio del cuore, dell'anima e della mente. Continuiamo allora, anche con questo provvedimento, a scommettere sulla cultura, come chiave per costruire il futuro. E, nel merito, questo provvedimento va in quella direzione. Le istituzioni culturali e lo spettacolo dal vivo avevano bisogno di una riorganizzazione e di una riforma strutturale. Le leggi di settore, che avevano ovviamente negli anni Ottanta istruito e promosso positivamente determinati settori, venivano sfiancate dalle successive modifiche e integrazioni e anche da un'ovvia e naturale innovazione, la cui necessità dai territori e a livello centrale veniva avvertita. Ecco, quindi, che con le disposizioni in materia di spettacolo dal vivo contenute nel provvedimento in esame entriamo nel cuore di un'area importantissima di sviluppo culturale ed economico. Sono importanti persino i primi articoli, quelli in cui si specifica quali sono gli obiettivi dello Stato e della Repubblica, che promuovono la cultura come fattore indispensabile per lo sviluppo e come elemento di coesione e di identità nazionale. Questo è giusto e necessario perché il riordino dello spettacolo dal vivo non sia un fatto burocratico, ma rientri in una coscienza collettiva del Paese, in cui l'identità nazionale diventa un obiettivo importante e veda la cultura come importante soggetto di promozione e coesione. L'articolato è stato ben illustrato dalla relatrice, che ovviamente si è avvalsa di un lavoro prezioso della Commissione, nell'ambito della quale molti hanno dato un contributo e vanno naturalmente ringraziati. Ci sono poi degli aspetti molto innovativi che desidero sottolineare, come l'integrazione con il mondo della scuola, con il 3 per cento del Fondo che entra in gioco non solo per sostenere le attività culturali nella scuola, ma anche per creare un pubblico intelligente, che sia non solo nascosto dietro lo schermo di un personal computer o di uno smartphone, ma sappia anche innamorarsi di uno spettacolo teatrale, di un film al cinema, sia cosciente. E se non si fa nelle scuole, non lo si fa. E, se lo facciamo, vuol dire - come ho già detto all'inizio - che c'è un disegno che si conferma anche in queste scelte molto importanti, così come in quelle di natura più organizzativa e per le fondazioni liriche; e la delega al Governo è opportuna e necessaria, perché diventano idrovore che assorbono troppe risorse rispetto alle aspettative del territorio. La necessità, quindi, di riorganizzare la spesa e le competenze esiste ed è giustamente confermata nel provvedimento in esame. Vi è poi la necessità di ampliare le fattispecie di spettacolo dal vivo e anche in questo campo ci sono innovazione e volontà di percepire quanto nel territorio, nelle nostre belle città, ricche peraltro di grandi patrimoni culturali, è cresciuto e vissuto, e proprio in questo strumento legislativo può trovare la sua occasione. Il consiglio superiore dello spettacolo - come ha detto la relatrice - è un organismo nuovo, parallelo ad altri, per cui non vi è disorganicità nei diversi settori ma finalmente un'organicità degli strumenti consultivi che devono essere effettivamente di supporto e oggettivamente quei luoghi in cui si elabora un discorso di identità e promozione nazionale. Inoltre voglio sottolineare - e per questo ringrazio particolarmente la relatrice e naturalmente il Governo che è stato d'accordo - l'intervento inserito nell'articolo 4, che contiene disposizioni di natura finanziaria per l'incremento del Fondo unico per lo spettacolo e misure in favore di attività culturali nei territori colpiti dal terremoto. Questa è la prima volta che in uno strumento non realizzato per l'emergenza, e quindi in uno strumento di altra natura, in uno strumento organico sullo spettacolo, si pensa alle aree terremotate e si dice che la ricostruzione non è solo ricostruzione delle case e delle strade, ma passa anche attraverso la cultura. E, quindi, la ricostruzione del patrimonio culturale e delle attività culturali diventa essenziale per uscire da uno stato di emarginazione, di solitudine e di rincrescimento nei confronti dello Stato che sembra tanto lontano. Ringrazio, quindi, per questo provvedimento perché non ci sarà mai rinascita dei territori se pensiamo solo alle case e non alle anime, ai cuori, alle teste che hanno bisogno di rivedere i loro teatri e le loro sale di spettacolo. Ed è ora il momento di fare ciò in quei luoghi, nei borghi antichi, spettacolari, dove oggi va pensato un progetto di sviluppo che non può essere avulso dal contesto paesaggistico e culturale, dalla antica storia che riemerge. Concludo dicendo che investire in cultura fa bene non solo - come già detto - alle teste, ai cuori e alle anime, ma anche all'economia del Paese. In questo mondo globalizzato siamo riconosciuti come superpotenza solo sulla cultura. E, allora, giochiamoci fino in fondo questa carta, e dimostriamo al Paese, anche con questi gesti importanti, che vogliamo non solo riorganizzare la burocrazia, che comunque è importante, ma anche ridare slancio e possibilità di intravedere un'uscita dallo stato di malessere profondo in cui versa il nostro Paese. E siffatta visione è presente nel provvedimento e sono felice di poterlo dire oggi in questa sede, di poterlo dire al Paese e di condividere con tanti colleghi e con il Governo una importante iniziativa per l'Italia.
2017-09-19	M5S	EndrizziGiovanni	Signor Presidente, se suo nipote le portasse una pagella dove in Geschichte avesse come voto befriedigend, lei lo elogerebbe o lo rimprovererebbe? E, se le consegnassero un referto medico con scritto Ruckenschmerzen, lei si preoccuperebbe o tirerebbe un sospiro di sollievo? Vede, mentre a lei queste ipotesi possono sembrare assurde, per un padre italiano che ci ha scritto sono la normalità. Sarebbe un fatto normale se parlassimo di un emigrante a Francoforte, ma questo accade su territorio italiano, a Bolzano, dove la scuola alla quale il figlio è iscritto - scuola dell'obbligo, ci tengo a precisare - consegna pagelle completamente scritte in tedesco. Non solo: la medesima persona si è visto consegnare anche la cartella clinica del figlio in lingua tedesca. E, purtroppo, si tratta non di un caso isolato, ma di una problematica diffusa. «Siamo una scuola di madrelingua tedesca e quindi niente italiano né con i bambini né con i genitori italiani. Si può parlare in italiano semmai con i genitori di bambini extracomunitari che, essendo in Alto Adige da poco tempo, non hanno avuto la possibilità di imparare il tedesco»: queste sono parole non raccolte da un avventore al bar, ma di una dirigente scolastica citate dal quotidiano «Alto Adige». E c'è di più: nella stessa intervista viene riportato anche un episodio accaduto a Terenten in Pustertal; alla richiesta degli stessi genitori di parlare qualche volta ai bimbi anche in italiano, reputandolo opportuno, non avendo altre occasioni di imparare la lingua, in risposta l'assessore si raccomandava invece di non esagerare a farlo, come se stesse raccomandando di non esagerare col bere. Se non ricordo male, fu il Presidente Mattarella lo scorso anno a celebrare a Trento l'accordo De Gasperi-Gruber sull'uso paritario della lingua italiana e tedesca nelle pubbliche amministrazioni. La tutela delle minoranze linguistiche in Italia va giustamente in difesa dei cittadini di lingua tedesca, ma in Trentino-Alto Adige le minoranze linguistiche da tutelare sono due: l'italiano e il ladino. Chiediamo quindi che sul territorio italiano, dal Brennero a Lampedusa, l'accesso alle informazioni, tanto più se riferite a dati rilevanti come l'andamento scolastico di un figlio o le condizioni di salute di un familiare, debbano essere garantite sempre anche in lingua italiana, ferma restando, sicuramente, la tutela del bilinguismo, come recita la nostra Costituzione.
2017-09-19	PD	CirinnaMonica	CIRINNA' (PD). Signor Presidente, prendo brevemente la parola, avendo sottoscritto anche io l'emendamento 2.325, per rivolgere un appello al Ministro e alla Commissione istruzione pubblica, beni culturali. Se di cultura stiamo parlando - ed è appunto di spettacolo che stiamo discutendo - dobbiamo renderci conto che, a oggi, fare cultura e spettacolo con lo sfruttamento degli animali non ci porta da nessuna parte. Abbiamo la possibilità di far vedere ai nostri figli gli animali in libertà attraverso migliaia di possibilità (penso a tanti canali televisivi, anche specifici, che entrano nelle nostre case tutti i giorni). Vi ricordo, colleghi, che l'unico circo del mondo in attivo che viene in tutte le città d'Italia, tra cui Roma, che fa overbooking di biglietteria e non riesce a soddisfare tutte le prenotazioni è il Cirque du Soleil, un circo nel quale esistono solo umani. Ebbene, io penso che l'uomo debba stupire l'uomo con le sue capacità: non c'è una tigre che salta nel fuoco che mi stupisce più di un trapezista o di un giocoliere o comunque di chi ha capacità fisiche anche per il suo allenamento. Mi domando, allora, per quale motivo, signor Ministro, mantenere il gioco di parole con «spettacolo viaggiante». Sono stata consigliera comunale a Roma per ventidue anni: capitano quei grandi camion, dove dentro c'è uno squalo o una tartaruga d'acqua, che si appostano nelle grandi periferie delle nostre città chiedendo un biglietto ridicolo, di uno, due, cinque euro, per tenere quell'animale in una sofferenza perenne. Mi domando, allora, perché noi che stiamo discutendo di un immenso cambiamento, finalmente con un nuovo regolamento, non vogliamo mantenere la barra dritta su ciò che nel mondo è ormai in via di superamento. Hanno parlato alcune colleghe prima di me, ma io vi dico che anche i nostri sindaci sono in grande difficoltà: ci sono decine di sindaci che non concedono più l'occupazione di suolo, che non danno le aree ai circhi che hanno animali. Poi ci sono i ricorsi al TAR. Pertanto, veniamo incontro a chi fa uno sforzo eliminando gli animali dal suo spettacolo, facendo, per esempio, una politica di incentivazione fiscale, prevedendo alcuni sgravi, concedendogli gratuitamente le aree nei Comuni a fronte della dismissione degli animali. Allora sì, signor Ministro, potremmo mantenere un supporto e un aiuto ai circhi che, rinunciando allo sfruttamento, all'ostentazione degli animali in cattività, mantengono la parte preponderante del loro spettacolo dove è l'uomo che stupisce, l'uomo con le sue capacità. Questo potrebbe incentivare e non abolire una tradizione circense, che è quella, per esempio, della grande scuola di Verona, dove i nostri giovani imparano a diventare trapezisti piuttosto che giocolieri o acrobati. Proviamo in questo modo a mantenere una tradizione con un aiuto concreto, ma diamo finalmente un segnale e allineamoci all'Europa. Colleghi, i bambini capiscono che la tigre che salta nel fuoco non lo farebbe mai per sua libera scelta, e se dobbiamo fare cultura facciamola veramente.
2017-09-19	PD	MattesiniDonella	Signor Presidente, con questo intervento di fine seduta continua oggi, qui in Senato, la staffetta con cui, insieme a tante senatrici e a tanti senatori, ricordiamo ogni donna che viene uccisa per mano di un uomo a cui è o è stata legata da relazione amorosa. Lo faremo sino a che sarà necessario ricordare al Parlamento e al Paese tutto l'urgenza di arginare la violenza nei confronti delle donne. Sono ad oggi 79 le donne che abbiamo ricordato e, dal 2 luglio, data del nostro ultimo intervento, sono state uccise altre 10 donne. Le ricordo: il 31 luglio Alba Chiara Baroni, di ventiquattro anni, è stata uccisa in provincia di Trento dal proprio compagno, che poi si è suicidato. Sempre 31 luglio a Palmanova, in provincia di Udine, Nadia Orlando, di ventuno anni, è stata strangolata dal suo fidanzato, che ha poi vagato tutta la notte con il suo corpo accasciato sul sedile del passeggero. Il 4 agosto a Ferrara, Mariella Mangolini, di settantasette anni, è stata uccisa con un colpo di pistola dal marito, che ha poi ucciso allo stesso modo il figlio di quarantotto anni. Il 17 agosto, a Dogaletto di Mira, in provincia di Venezia, Sabrina Panzonato, di cinquantadue anni, dopo essere stata ferita con una coltellata al fianco, è fuggita in strada, dove l'ha raggiunta il marito e l'ha uccisa con un colpo alla testa, per poi suicidarsi. La coppia lascia soli due figli. Il 21 agosto, a Bressanone, in provincia di Bolzano, Marianna Obrist, di trentanove anni, è stata uccisa a coltellate dal compagno, mentre faceva il bagno. Laura Pirri, di trentuno anni, è invece morta in ospedale il 25 marzo scorso, dopo diciotto giorni di agonia, per ustioni gravi su tutto il corpo. Ma non si trattava di un incidente domestico: il 6 settembre il marito è stato arrestato con l'accusa di omicidio, per avere dato fuoco volontariamente alla moglie, come ultimo atto di una lunga serie di maltrattamenti e violenze nei suoi confronti. Decisiva è stata la testimonianza del figlio di dieci anni. Il 3 settembre, a Specchia, in provincia di Lecce, Noemi Durini, di sedici anni, è stata uccisa dal fidanzato di diciassette anni. Il ragazzo era stato denunciato alla procura dalla mamma di Noemi per violenze nei confronti della figlia. Erano, infatti, in atto due procedimenti, uno penale e uno civile, nei suoi confronti. L'8 settembre, il gip del tribunale di Napoli Nord ha convalidato l'arresto dell'ex fidanzato di Alessandra Madonna, di ventiquattro anni, accusato di averne provocato la morte, trascinandola con l'auto nel parco in cui risiede, a Mugnano di Napoli. Il 9 settembre a Donoratico, in provincia di Cagliari, Joelle Demontis, di cinquantotto anni, è stata uccisa a coltellate nella sua abitazione. La donna portava ancora i segni di percosse probabilmente subite nei giorni precedenti la morte. Per l'omicidio sono stati arrestati il compagno della donna e una ragazza di ventisei anni che abitava con loro. Il 15 settembre, a Casale Monferrato, in provincia di Alessandria, Elena Seprodi, di quarantotto anni, è stata uccisa a coltellate dall'ex marito nella sua abitazione al culmine di un litigio. La donna lascia un figlio. Mi sono sempre chiesta cosa succede nella testa di quell'uomo che trasforma quasi in una sagoma di cartone, contro cui scagliare la propria furia omicida, la donna con cui ha condiviso passione, amore, sogni, progetti e magari ha generato figli. Questa domanda è importante, ma è bene ricordare che noi donne siamo persone, non semplici cose di cui disporre a proprio piacimento. Abbiamo buone leggi: il Governo e il Parlamento, nel corso del tempo, hanno fatto molto e molto stanno facendo. Sto pensando al rafforzamento della rete delle case rifugio, all'introduzione del congedo retribuito per le donne lavoratrici, comprese quelle autonome, quando devono allontanarsi da casa, per la loro sicurezza. Sto pensando all'educazione di genere inserita nella legge sulla buona scuola. E dovremo sicuramente lavorare per fare ancora di più sul versante della certezza della pena. E l'auspicio che faccio è che il Parlamento e il Governo rafforzino, anche nella prossima legge di stabilità, risorse importanti utile alla lotta della violenza sulle donne. Allo stesso modo, spero che approveremo rapidamente il disegno di legge sugli orfani di femminicidio. Le leggi, quindi, sono importanti, ma tutto questo non basta, perché il problema è culturale. Il problema sono quegli uomini, sempre più numerosi, che, non essendo capaci di ritrovare dentro se stessi un nuovo equilibrio, scelgono di uccidere piuttosto che accettare la fine di una relazione amorosa. Il problema sono quelli uomini che di fronte - ad esempio - agli stupri e alle violenze, dicono che le donne devono essere più caute. Quando una relazione amorosa finisce, può aprirsi il baratro dell'abbandono e si deve sicuramente imparare ad andare avanti lo stesso, anche se talvolta può essere doloroso e può sembrare impossibile. Ma tutto questo dolore non può assolutamente giustificare mai la violenza e mai la violenza omicida. È davvero drammatico che tanti uomini oggi non riescano ancora a capirlo né a farsene una ragione, arrogandosi il diritto di strappare alla vita chi da quella relazione vuole uscire. E allora l'impegno e la battaglia sono sicuramente quelli che ho detto prima, ma devono essere anche sul piano culturale ed è su questo piano che dobbiamo lavorare tutti insieme, uomini e donne. Da questo ramo del Parlamento, dal Senato, io mi sento di rivolgere un appello in modo forte in via principale agli uomini dicendo loro: prendete parola, anche autonomamente; organizzatevi; dite no alla violenza sulle donne; raccontate agli altri uomini, voi che siete quella parte capace di apprezzare la differenza e di stare in modo paritario e rispettoso all'interno di una relazione, quanto sia bello essere persone libere; amateci per quello che siamo, e cioè persone libere capaci di rispetto anche all'interno di una relazione amorosa. Ditelo, perché l'amore è sicuramente l'energia più potente, ma così, come ci si innamora in modo naturale, è altrettanto naturale e normale che quell'amore sfumi, senza che ci siano vinti o vincitori. La violenza non è una variante dell'amore: è violenza e basta. Nasce, si sviluppa e si nutre dentro una cultura o sottocultura che ancora oggi ha come contesto lo svantaggio sociale per le donne. Per tutto questo, ripropongo il nostro appello a tutto il Paese e ai media dico: smettete di giustificare, anche solo con un linguaggio sbagliato, gli assassini. Smettete di chiamarli, come ad esempio in tutte le trasmissioni televisive in cui si parla di Noemi, «il fidanzatino». Non sono fidanzatini o altro: sono assassini. E smettete di colpevolizzare le donne.
2017-09-20	M5S	DonnoDaniela	Signor Presidente, sono passati pochissimi giorni dalla drammatica morte di Noemi Durini, la ragazza di Specchia che è stata barbaramente uccisa. Oggi ci troviamo, ancora una volta, davanti a un altro tragico episodio, che ha ridotto una giovane donna in fin di vita, veramente in condizioni disperate. È successo stamattina. Si tratta di una ragazza di quindici anni di Ischitella, in provincia di Foggia, ferita brutalmente da un uomo che poi si è suicidato: ferita da un colpo di pistola in pieno volto. Parliamo quindi di un altro episodio che apre uno scenario veramente macabro di violenza e di paura. È evidente che ci troviamo davanti a un allarme veramente importante, che deve trovare i giusti strumenti per essere finalmente placato. Non possiamo assolutamente continuare a piangere vittime e abusi continui. Quante altre morti serviranno per prendere atto di questa situazione e di questa emergenza, perché ormai si tratta di una vera e propria emergenza? Quante altre volte, quanti altri giorni, mesi, anni dobbiamo aspettare perché questo Governo intervenga finalmente, facendo delle buone azioni, tutelando il territorio, aiutando i cittadini? Stiamo parlando di stragi senza arresto, che giorno dopo giorno hanno assunto una portata veramente spaventosa. La violenza di genere infatti rappresenta la prima causa di morte tra le donne. Il Governo dov'è, mentre si compie questo massacro? Perché le reti territoriali non vengono rafforzate e messe nella condizione di lavorare in sinergia con le altre? Perché non c'è una lungimirante programmazione degli interventi e lo stanziamento di adeguati fondi e risorse? Domande a cui segue un silenzio imbarazzante, perché l'Esecutivo è assente. Non dimentichiamo che lo scorso luglio è scaduto il piano d'azione straordinario contro la violenza sessuale e di genere e il fatto che le istituzioni temporeggino sull'argomento è a dir poco scandaloso. Ormai anche uscire dalla porta di casa per andare a scuola, per fare acquisti, per fare semplicemente una passeggiata significa esporsi a un pericolo concreto per la propria incolumità. Tutto questo è davvero inaudito per una società che si definisce evoluta. Non c'è più tempo, non si può aspettare ancora, non si può indugiare su un tema così delicato. Una cosa è certa: in questa situazione ogni altra vittima ricadrà sulla responsabilità dello Stato e di chi non interviene, cioè voi.
