2017-05-18	PD	RussoFrancesco	Inizio questa relazione dicendo che, con questo provvedimento il Senato, e spero presto anche la Camera dei deputati, chiedono scusa alle persone con disabilità uditiva del Paese e provano ad abbattere una barriera che nega ancora a tanti, nel 2017, il pieno diritto di cittadinanza. Lasciatemi ripetere quest'ultima frase rivolgendomi a coloro che non hanno capito le mie parole, ma che spero possano cogliere i gesti che farò in questo momento. (Il senatore Russo si esprime nuovamente utilizzando la lingua dei segni italiana). Entrando nel merito del disegno di legge in esame, lasciatemi dire che è difficile negare il ritardo, che ho ricordato, con cui si arriva a discuterne in Aula legato anche alle polemiche e al dibattito che hanno attraversato il mondo della sordità in Italia negli ultimi anni. Si tratta di un dibattito che credo approfondiremo anche nella discussione che faremo e che vorrei potessimo sviscerare e risolvere, per poterlo superare finalmente, dopo tanti e tanti anni; un dibattito che, se vogliamo, affonda le radici addirittura in un congresso che parlava di questi temi a Milano nel 1880. Sono davvero troppi anni e sarebbe bello che questo provvedimento riuscisse, tra le altre cose, a contribuire a superare una volta per tutte le divisioni del passato. Voglio dirlo con forza: il testo di cui stiamo discutendo non vuole dare ragione agli uni o agli altri, favorire qualche presunta lobby o un'associazione a discapito di un'altra. È finalizzato soltanto alla tutela delle persone sorde e non di uno o dell'altro operatore del settore. Insieme, in un lavoro molto bello di Commissione, abbiamo avuto l'ambizione di far fare un passo in avanti al nostro Paese nel più generale campo dell'inclusione di tutte le persone con disabilità auditiva, garantendo più diritti e cercando di ottenere più attenzione per chi convive con questo limite e posso dire che, grazie al contributo di tutti, credo si sia fatto davvero più di qualche passo avanti. Abbiamo ascoltato in questi mesi, anche attraverso decine di audizioni che ci hanno aiutato a capire bene e ad ascoltare davvero tutte le diverse posizioni - qualche volta anche a farle incontrare - le ragioni di ognuno: dagli esponenti della cosiddetta comunità segnante a quelli che difendono le buone ragioni dell'uso della lingua parlata e scritta per le persone sorde. Negli articoli di questo provvedimento non ci si è posto il problema di chi avesse più ragione fra oralisti e segnanti, anche se più e più volte questo ci veniva chiesto, ma credo che il compito del legislatore sia diverso: quello che abbiamo provato ad assolvere è di alzare il livello di tutela e di garanzia per tutti, sperando di aver contribuito così al superamento di antichi pregiudizi e di divisioni non più attuali e certamente poco utili alla causa delle persone sorde. Nell'ambito del principio, che abbiamo più e più volte ribadito, dell'assoluta ed inderogabile libertà di scelta da parte delle famiglie, senza dubbio questa norma introduce una novità che vuol essere un allargamento di opportunità. Come dicevo prima, dopo vent'anni una legge arriva al pieno riconoscimento della lingua italiana dei segni, o della lingua dei segni italiana, come è più giusto chiamarla, ed accanto a questa della LIS tattile, per le persone che hanno un'ulteriore difficoltà, le persone sordocieche. La LIS come strumento di piena cittadinanza, con la dignità di essere diventata negli anni vera e propria lingua, non semplice linguaggio, dotata di un suo specifico lessico, di una sintassi, di una grammatica, che permettono a chi la usa il medesimo livello di raffinatezza espressiva di una lingua parlata. Negli ultimi anni - è esperienza di molti - ci siamo fortunatamente abituati sempre più all'uso pubblico della LIS: alcuni, anche se troppo pochi telegiornali, il discorso di fine anno del Presidente della Repubblica, grandi eventi in cui sul palco compare il traduttore in lingua dei segni, la possibilità per gli studenti di usare questo strumento nelle università. E a testimonianza della ricchezza espressiva della LIS, sappiamo che sono sempre maggiori anche le occasioni in cui le persone sorde segnanti sono diventate protagoniste di eventi artistici legati alla poesia, al teatro, al cinema e ad altre arti espressive. Il provvedimento fa dunque un primo grande passo, sottolineando la necessità di offrire servizi di qualità e di investire, ad esempio, sulla decisiva qualità degli interpreti, mettendo il nostro Paese al passo con la Convenzione delle Nazioni Unite che, parlando dei diritti delle persone con disabilità, approvava nell'Assemblea generale dell'ONU una dichiarazione del 2006 che riconosceva il ruolo della lingua dei segni «come forma di comunicazione, come mezzo di inclusione, come garanzia di libertà di accesso alle informazioni, come strumento di educazione, infine come espressione di identità culturale». Ma - è bene sottolinearlo proprio per cominciare a smussare e a smontare alcuni pregiudizi che ancora ci sono - fin dalla lettura del titolo appare chiaro che questo provvedimento non si limita al pur doveroso riconoscimento della lingua dei segni. Questa, anche perché elaborata nell'ambito della 1ᵃ Commissione, affari costituzionali, è una legge cornice, che punta ad allargare il campo dei diritti per il più pieno esercizio del diritto di cittadinanza da parte di tutti i sordi italiani, oralisti e segnanti. Una norma che ribadisce l'impegno della Repubblica ad utilizzare tutti i canali comunicativi e linguistici: la sottotitolazione, le nuove tecnologie, i servizi di interpretariato in LIS e LIS tattile, per eliminare tutte le barriere alla comprensione della comunicazione, per promuovere la piena inclusione scolastica ed universitaria, l'accessibilità ai luoghi di lavoro, alle strutture preposte alla salute, al patrimonio storico, artistico e culturale, ai trasporti, alle strutture ed ai servizi della pubblica amministrazione. Diciamolo con assoluta chiarezza: il richiamo alla LIS non è in alcun modo in contraddizione con la consapevolezza che il presente, e ancor più il futuro di chi nasce con ipoacusia, anche nelle forme di sordità profonde, è e dovrà essere sempre più quello di tendere alla padronanza della lingua scritta e parlata. Non mettiamo in contraddizione le due cose perché non lo sono. Se lo sono state in passato non è questo il tema che dobbiamo sottolineare. Ho avuto la fortuna di visitare in questi mesi strutture di eccellenza nel nostro Paese, in cui i bambini nati sordi profondi, per i quali vi era stata una diagnosi tempestiva, l'immediato utilizzo delle protesi, l'impianto di moderni dispositivi cocleari nei primissimi mesi di vita, si sono visti restituire dalla tecnologia e dalle cure di personale specializzato, in modo praticamente integrale, ciò che la natura aveva loro tolto. Questo è l'obiettivo a cui dobbiamo mirare, lo sappiamo. Contemporaneamente, questo disegno di legge dà una risposta che ovviamente non è ancora quella ottimale, per la quale dobbiamo lavorare in futuro. A questo obiettivo, ovvero al recupero di una piena padronanza linguistica scritta e orale - si dice nel disegno di legge - deve tendere l'intervento di tutte le strutture pubbliche: da quelle sanitarie, chiamate ad attivare, attraverso lo screening neonatale, come richiamato nell'articolo 3, tempestivi interventi che evitino di consegnare nei primi decisivi mesi di vita i bambini a un isolamento che inciderebbe pesantemente sui futuri percorsi cognitivi; fino alle istituzioni scolastiche e universitarie, in cui si gioca, come sappiamo, la chance di piena cittadinanza di ciascuno di noi. Lasciatemi dire una parola in più proprio sull'investimento in formazione, cui sono dedicati gli articoli 5 e 6 in particolare. Il nostro Paese fa già molto e in questo provvedimento si richiamano le tantissime azioni positive che già si esercitano in questo campo. L'Italia è stata pioniera nel superamento delle scuole speciali - lo so anche per esperienza professionale; da pedagogista me ne sono occupato in maniera particolare - nell'integrazione dei bambini e ragazzi con disabilità nel gruppo classe, insieme a tutti gli altri coetanei normodotati. Ma l'esperienza di questi anni e le eccellenze che abbiamo incontrato, anche con il lavoro della Commissione - penso alla scuola di Cossato o all'istituto «Magarotto» di via Nomentana a Roma - ci dicono che forse è possibile fare ancora di più, e che i percorsi sperimentali di bilinguismo LIS-italiano, con l'ambizione di farli gemmare in almeno ogni Provincia italiana, possono garantire maggiormente la valorizzazione della diversità come reciproco arricchimento e concentrare su un numero limitato di classi risorse, innovazione didattica e collaborazione con la ricerca universitaria. Lasciatemi ricordare a questo proposito - è un piccolo inciso, ma ci tengo perché so che qualche collega ha anche presentato alcuni ordini del giorno ed è comunque un impegno che abbiamo presentato anche al Ministro competente - la grave situazione dell'istituto per sordi di via Nomentana. Non era possibile intervenire in questo provvedimento per affrontarla, ma davvero auspichiamo che si possa quanto prima risolvere i problemi di una struttura che si è distinta per esperienza e competenza di assoluto livello, anche per i suoi dipendenti che in questo momento vivono una situazione difficile. Concludo riservandomi di ascoltare e di rispondere puntualmente agli interventi che in discussione generale sicuramente ci saranno e che spero ci aiutino a sviscerare fino in fondo i dubbi legati a questo provvedimento, se ancora ce ne fossero. Faccio due ultime sottolineature che spero servano proprio a facilitare lo scioglimento di questi dubbi, anche perché mi auguro davvero che alla fine di questa discussione la votazione su un tema così sensibile sia ampia, trasversale, di tutto il Parlamento italiano, proprio perché l'attesa fuori da qui è molto grande. È un tema su cui credo la politica possa provare a non dividersi. Il principio fondante di questo disegno di legge - l'ho ricordato ma voglio ripeterlo - è la libertà di scelta: delle persone sorde e delle loro famiglie. L'obiettivo che abbiamo perseguito è quello di allargare le opportunità, non certo di ridurle. Ed è evidente dalla lettura di ciascuno degli articoli del provvedimento. Ma lo voglio dire con ancora più precisione: chiunque pensi che riconoscere la LIS significhi imporla anche a chi ha scelto altri percorsi può davvero essere certo che non è così, non solo perché sarebbe contrario a questa norma e alla Costituzione, ma perché l'obiettivo del nostro lavoro va esattamente nella direzione opposta. Vogliamo che in futuro le nuove tecnologie permettano a tutti i bambini nati sordi in Italia di superare pienamente il loro deficit, e la legge va in questa direzione, ma crediamo sia giusto riconoscere che per decine di migliaia di persone adulte oggi la LIS sia uno strumento fondamentale di cittadinanza attiva e che studi scientifici italiani e internazionali confermano che il bilinguismo LIS-italiano può essere un valore aggiunto anche per i più giovani. Un ultimo riferimento all'articolo 15 ed al finanziamento di questo provvedimento. La stesura delle relazioni tecniche dei Ministeri ha permesso di ridurre di molto la previsione di spesa iniziale, ma penso sia importante sottolineare che i 2 milioni di euro, che probabilmente verranno individuati e allocati, saranno destinati alla copertura della previsione dell'articolo 3 relativa alla previsione ed alla diffusione dello screening neonatale nei Livelli essenziali di assistenza (LEA) su tutto il territorio nazionale. Proprio lo screening neonatale, quello che abbiamo individuato come lo snodo decisivo per un precoce ed efficace percorso di acquisizione della lingua parlata e scritta oggi, purtroppo - ed è un'ulteriore vergogna - è un diritto accessibile solo a chi vive in quattro o cinque Regioni del nostro Paese; questa è forse la principale ingiustizia da superare e noi vorremmo farlo per dare piena attuazione alle previsioni di questa legge. Concludo con una citazione. Un autore che mi è caro, Elias Canetti, nel romanzo «La Lingua Salvata» racconta in modo mirabile quale sia il peso ed il condizionamento, positivo e negativo, delle lingue nella vita di ciascuno di noi: «Io credo infatti che faccia parte del sapere il volersi rendere manifesto e non contentarsi di un'esistenza nascosta». È questa davvero l'ispirazione di questa legge e l'auspicio che ci regaliamo sperando di portare a compimento un provvedimento molto atteso al di fuori di questa Aula.
2017-05-18	PD	RussoFrancesco	Lo dico in particolare a coloro che sentono più da vicino questa situazione - e sarebbe ora che anche in quest' Aula fosse possibile farlo in modo comprensibile per tutti coloro che hanno una disabilità uditiva, grazie ad un interprete LIS o ad una sottotitolazione - e che sanno bene cosa significhi non poter partecipare pienamente alla vita della propria comunità a causa dell'impossibilità di comunicare, per i quali le pari opportunità educative a scuola e all'università, ascoltare un telegiornale, spiegare ad un medico il malessere proprio o dei propri figli, ricevere informazioni in una stazione, ottenere un certificato da una pubblica amministrazione, far comprendere senza timore di essere fraintesi le proprie ragioni, davanti ad un giudice o ad un poliziotto, rischiano di essere ancora diritti negati.
2017-05-31	LN	StefaniErika	C'è un passaggio che mi permetto di sottolineare - ritengo sia di particolare significato - di chi ha scritto in questa materia che il territorio dello stesso dominio, in questo caso collettivo, è una scuola di democrazia per le forme di gestione e di fruizione. È una cultura in materia di protezione della natura, una scuola di economia in materia di patrimonio civico esistente.
2017-06-14	LN	ArrigoniPaolo	Fa specie che il relatore e alcuni colleghi della maggioranza abbiano parlato del provvedimento in toni trionfalistici, di manovra complessa e importante a cui è affidato il compito di sviluppare la crescita del Paese. Non ci saremmo dovuti trovare in questa situazione, anche perché, quando c'è una manovra correttiva, ci sono soprattutto tagli e un inasprimento della pressione fiscale, perché è evidente che i soldi da qualche parte si devono trovare. E i cittadini devono sapere che variamo questa manovrina certamente obbligati dall'Unione europea, ma anche per il fatto che la legge di bilancio per il 2017, dal chiaro profilo elettorale-referendario voluto da Renzi, si scostava nettamente dagli obiettivi di indebitamento di medio termine. Renzi, insomma, ha cercato di finanziare le misure pro domo sua e del Partito Democratico, scaricando tutto sul debito pubblico, peraltro fallendo clamorosamente, come è successo per quasi tutte le riforme che ha varato: la legge Delrio, la buona scuola, il decreto salva banche, l'Italicum e in ultimo, per l'appunto, la riforma costituzionale. L'entità della manovra è pari allo 0,2 per cento del PIL, cioè 3,1 miliardi di euro che - come abbiamo letto - sono rappresentati da ben 2,8 miliardi di euro di maggiori entrate e da 0,3 miliardi di euro di tagli alle spese. Si vanno a recuperare i soldi nelle tasche dei cittadini e delle imprese, colpendo dunque l'economia reale e la gravissima situazione economico-sociale, che oramai nel Paese vige da troppo tempo. Lo fate tagliando i servizi ed estendendo lo split payment, creando ulteriori problemi di liquidità alle imprese che lavorano per la pubblica amministrazione e che stanno ancora aspettando i pagamenti promessi da Renzi. Lo fate tagliando gli investimenti; lo fate con ulteriori tagli agli enti locali; lo fate aumentando le accise sui tabacchi e sul prelievo erariale unico sui giochi, di cui peraltro diminuite il pay out, ovvero la percentuale di vincita. Lo fate in tanti altri modi, sino ad arrivare alla cifra di 3 miliardi e 100 milioni di euro richiesta dall'Europa. In questo contesto è grave che il Governo abbia comunque trovato 15 milioni di euro per superare criticità igienico-sanitarie e sanare insediamenti illegali di stranieri residenti sul nostro territorio, molto probabilmente campi rom. Questa è una grave discriminazione nei confronti delle centinaia di migliaia di famiglie italiane che, non per loro colpa, abitano in quartieri dove mancano totalmente fogne o qualsiasi opera infrastrutturale e di urbanizzazione per rendere degna la propria abitazione. Anche in questo caso emblematico avete confermato la vostra politica, che è tutt'altro che basata su rigore e legalità. In questo Paese, conosciuto negativamente al mondo per la sua tolleranza e per il buonismo imperante, possono starci comodamente i delinquenti, gli irregolari, gli immigrati clandestini e le cose irregolari, tanto arrivate voi a sanare tutto. Altro che rimpatri! Una protezione umanitaria non la negate quasi mai, così come non negate un provvedimento svuota carceri, una sanatoria o un condono di insediamenti abusivi.
2017-06-14	LN	ConsiglioNunziante	Signora Presidente, con questo intervento faccio seguito a una lettera che il sindaco di Valbondione ha già mandato al Ministro dell'interno lo scorso 27 maggio. Con tale lettera non faceva altro che porre l'attenzione su un forte dissenso espresso al prefetto di Bergamo per la scelta di collocare nuovi immigrati proprio in questo Comune di poche anime. Questo Comune ha poco più di 1.000 abitanti, è situato in un'area montana della Provincia di Bergamo ed è già in condizioni di forte svantaggio sotto l'aspetto di un'economia estremamente fragile, che ne ha caratterizzato gli ultimi decenni. Il prefetto ha comunicato al sindaco che verranno messe a disposizione da privati tre case vacanza, per un totale di circa 150 posti liberi. Questo mio intervento è proprio volto a significare come il business dei privati legato alla questione dei migranti sia arrivato anche in un paese dell'alta Val Seriana, con una totale mancanza di rispetto nei confronti dei residenti, che si trovano costretti a convivere quotidianamente con le problematiche generate dalla convivenza quotidiana. Dov'è l'impiccio, signora Presidente? Già dal giugno 2014 si sta vivendo una situazione di emergenza, tanto che attualmente nel Comune di Valbondione sono presenti 60 migranti nella piccola frazione di Lizzola, costituita da un nucleo di circa 200 abitanti, e altri 22 migranti nella frazione di Gavazzo, ove risiedono solo 31 persone. Quindi c'è uno sbilanciamento enorme nell'ambito di un sistema che ci vede assolutamente contrari, proprio come principio primo di attuazione di un sistema di accoglienza diffusa che è tale solamente sulla carta. Poi mi chiedo, signora Presidente, dove sia l'integrazione e se questi giovanotti, che bighellonano tutto il giorno, facciano parte di un programma serio di inserimento. Se il lavoro e la scuola sono qualcosa di importante per l'integrazione, credo che siamo completamente fuori strada. Ha fatto bene il sindaco; questo sindaco probabilmente sta a testimoniare anche l'opportunità che una serie di soggetti che fanno amministrazione con passione scrivano al Ministro dell'interno per denunciare queste situazioni. Se ne arrivano 2.000 al giorno, io non so come faremo a sistemarli. Non vorrei che l'idea di aumentare la percentuale di atrazina nell'acqua per sistemare la questione della potabilità fosse applicata anche al caso dei migranti: appena si saranno superate le quote per ogni 1.000 abitanti, si modificherà la percentuale, in modo tale da poterne mettere ancora nei Comuni. Quindi non credo ci sia una soluzione di sorta a questa problematica. Bene ha fatto il sindaco a scrivere ed è un problema che deve essere assolutamente collegato alla questione dello ius soli, che arriverà in questi giorni in Aula e su cui noi saremo sicuramente molto contrari.
2017-06-14	M5S	MontevecchiMichela	Anche laddove sembra che piovano soldi in realtà scopriamo che si tratta, né più né meno, della famosa gag : se mi presti dieci euro, ti rendo i dieci euro che mi hai prestato ieri. Vi spiego il perché: ad esempio, all'articolo 22, comma 7- ter, è previsto lo stanziamento di cinque milioni per la tutela e la valorizzazione del patrimonio culturale: bellissimo, applausi. La copertura prevede però una riduzione dell'autorizzazione di spesa per l'assunzione a tempo indeterminato dei famosi 500 funzionari per il Ministero dei beni e delle attività culturali. Anche qui dobbiamo fare a capirci: quindi i funzionari non li assumiamo più a tempo indeterminato o forse sovrastimavamo quei soldi? Bah. Sempre articolo 22, commi 7 -quater e 7- quinquies : al comma 7- quater viene istituito uno specifico fondo per il funzionamento dei sistemi bibliotecari locali. Che bello! Valorizziamo la lettura: bene. Ma al comma 7- quinquies istituiamo un'unità dirigenziale di livello generale, che da sola, non si capisce come, dovrebbe accelerare il coordinamento di tutte le attività per la ricostruzione dei beni artistici lesionati durante i tragici sismi avvenuti lo scorso anno e anche all'inizio di quest'anno, ma la copertura per istituire questo organo dirigenziale viene individuata riducendo l'autorizzazione di spesa per il funzionamento degli istituti afferenti al settore archivi e biblioteche. Anche qui dobbiamo deciderci: la lettura la vogliamo promuovere e valorizzare o no? Sono due esempi e ne potrei portare altri, ma il tempo è tiranno. Mi addentro ora nelle pieghe della manovrina per quanto riguarda il Ministero dell'istruzione e della ricerca e il Ministero dei beni e delle attività culturali. Per quanto riguarda l'AFAM, l'Alta formazione artistica e musicale, vi risparmio tutta la vicenda che ha dell'incredibile, per non dire del tragico, perché oggi ci ritroviamo ad avere una norma che avrebbe l'ambizione di portare finalmente alla statizzazione degli ex licei musicali e quindi sanare le problematiche legate a questi istituti; peccato però che questa norma, a differenza di un disegno di legge che ancora marcisce in Commissione al Senato, forse dal 2014, è una norma generica, non prevedendo infatti i termini per l'emanazione dei decreti ministeriali, cioè quelli che dovranno poi descrivere come si dovrà fare questa statizzazione, secondo quali criteri e con quale procedimento. Tale norma non individua nemmeno le modalità di questa gradualità e quali saranno quindi i criteri per cui si statizzeranno prima certi istituti piuttosto che altri (magari in base alla simpatia del sindaco, non si sa). La norma prevede addirittura la razionalizzazione, e noi ormai, in quattro anni di legislatura, abbiamo capito che quando si parla di razionalizzazione si parla di tagli. Questo non era previsto nel disegno di legge dedicato a questo procedimento. In più da dove sono prelevati i fondi? Dai soldi destinati alla ricerca di base, dalle accademie non statali e anche dai fondi che erano stati destinati alla legge sulla buona scuola, con buona pace del segretario PD Renzi e della ex ministra Giannini. Questo chiaramente non vuol dire che siamo contro questo provvedimento parziale, ma che dietro a questa parzialità si nascondono molti rischi. Vi è poi l'ennesima proroga dei servizi di pulizia e dei servizi ausiliari in quelle Regioni in cui è stata risolta la convenzione con la Consip. Anche qui, allo scadere di ogni rinnovo e di ogni proroga, abbiamo detto come l'esternalizzazione non produca alcun risparmio e come, anzi, produca un aumento della precarizzazione sia nel personale amministrativo, tecnico e ausiliario, sia nei lavoratori socialmente utili, e come legate alla Consip ci siano inchieste che sono finite anche nel filone della scuola, come quella del 2012 che riguarda un presunto cartello per dividersi un appalto di 1,6 miliardi. Per i beni e le attività culturali dico solo due cose. Per il Teatro Eliseo abbiamo introdotto il metodo Marchionne della contrattazione privata: se conosci il ministro giusto puoi contrattare sui soldi. Evviva!
