2019-04-18	PD	MisianiAntonio	I numeri del DEF certificano il fallimento della politica economica del Governo. Il 27 settembre, quando è stata presentata la Nota di aggiornamento, prevedevate una crescita dell'1,5 per cento. Tre mesi dopo il Governo ha ridimensionato le sue previsioni all'1 per cento e oggi leggiamo nel DEF che la crescita tendenziale quest'anno sarà dello 0,1 per cento e quella programmatica dello 0,2. Non è crescita; è stagnazione. Dalla metà del 2018 l'Italia ha perso 116.000 posti di lavoro e nel 2019 l'Italia sarà ultima per crescita tra i 39 Paesi avanzati. Siamo l'anello debole dell'Europa. Nel 2019 peggiora, rispetto alle previsioni di tre mesi fa, il deficit (che sale al 2,4 per cento); peggiora il debito: era stimato al 130,7 per cento e toccherà, secondo i numeri del Governo, il 132,6 per cento. È il record dal 1924 ed è una stima ottimistica perché incorpora privatizzazioni per un punto di PIL che non verranno mai fatte. Peggiora la disoccupazione: doveva attestarsi al 10,3 per cento e toccherà l'11 per cento. Certo, pesa la congiuntura internazionale su queste previsioni, la guerra commerciale tra Stati Uniti e Cina, il rallentamento della zona euro, la frenata della Germania; molto, però, è dovuto a fattori nazionali. Ce lo hanno spiegato la Banca d'Italia, l'Ufficio parlamentare di bilancio e tutte le forze economiche e sociali che abbiamo udito. L'Italia, signor Presidente, cresce meno della zona euro da più di vent'anni. Quel gap di crescita, però, si era progressivamente ridotto ed era sceso a 0,7 punti nel 2017. Dal 2018 ha ripreso a crescere e quest'anno tornerà ad 1,1 o 1,2 punti percentuali. Questo è accaduto perché è crollata la fiducia dei consumatori, delle imprese e dei risparmiatori nei confronti del nostro Paese e quando crolla la fiducia si bloccano gli investimenti, si rinviano gli acquisti di beni durevoli e si tirano i remi in barca, in attesa di tempi migliori. Il motivo principale del crollo della fiducia è dato dall'incertezza politica e dai dubbi degli operatori economici sulle intenzioni di fondo del Governo e della maggioranza. Signor Presidente, lo spread è il termometro finanziario della crisi di fiducia nel nostro Paese. Prima delle elezioni era inferiore a 130 punti, nei momenti più tesi dello scontro con la Commissione europea ha superato i 300 punti e da settimane è stabilmente superiore a 250 punti. Si tratta di una vera e propria stretta monetaria, che ci siamo autoimposti e che sta costando carissima al nostro Paese, in termini di maggiori interessi, che la Banca d'Italia ha quantificato in 1,5 miliardi di euro in più per quest'anno, in 3,5 miliardi di euro in più nel 2020 e in 6 miliardi di euro in più nel 2021 e che ci sta costando cara in termini di mancata crescita, con una riduzione di 0,7 punti nel triennio, sempre secondo la Banca d'Italia. Badate che questa situazione è figlia di una politica economica sbagliata e di una legge di bilancio, che ha concentrato tutte le risorse disponibili su due misure - quota 100 e reddito di cittadinanza - che costeranno 44 miliardi di euro in tre anni e 125 miliardi di euro in dieci anni. Sono due interventi finanziati in deficit, sottoscrivendo a nome di tutti gli italiani la maxicambiale degli aumenti IVA dal 2020 in avanti. Intendiamoci: rafforzare le misure contro la povertà era necessario in questo Paese e lo si poteva fare potenziando quello che c'era, ovvero il reddito di inclusione, evitando di ripartire da zero, ma avete fatto una scelta diversa. Ampliare i margini di flessibilità del sistema pensionistico era sicuramente opportuno. Lo si doveva fare in modo strutturale, però, non per tre anni, magari spendendo meno, ma concentrando le risorse sulle categorie più fragili e sui lavori usuranti, introducendo una pensione di garanzia per i giovani, andando avanti sulla strada avviata dal precedente Governo. Avete fatto le vostre scelte, avete impegnato soldi che il Paese non aveva e avete caricato di debiti le generazioni future. Lo avete fatto, sapendo che non ce lo potevamo permettere e azzerando ogni margine di manovra per le politiche di sviluppo. Avete guardato al presente, alle prossime elezioni, ma così facendo avete drasticamente ridotto i margini di intervento per il futuro. La vostra legge di bilancio ha ridotto le risorse per gli investimenti pubblici, ha smantellato gli incentivi per gli investimenti privati, ha aumentato la pressione fiscale sulle imprese. Avete bloccato i grandi progetti infrastrutturali, avete archiviato la revisione della spesa e non avete messo un euro in più sulla scuola e sulla ricerca. Non avete messo soldi sul futuro, ma avete badato soltanto alle immediate scadenze elettorali. Questi errori li stiamo pagando oggi, con un rallentamento nettamente superiore a quello che sta avvenendo negli altri Paesi avanzati. Signor Presidente, l'aspetto più preoccupante di questo DEF, però, riguarda il futuro e la prospettiva del Paese. Il quadro programmatico per il triennio 2020-2022 è sconfortante, con una crescita sistematicamente inferiore all'uno per cento annuo, ovvero la metà di quanto il Paese cresceva con i da voi tanto vituperati Governi Renzi e Gentiloni Silveri. GARAVAGLIA , vice ministro dell'economia e delle finanze. E Monti! MISIANI (PD). Nel 2020 è previsto un aumento della disoccupazione e sono previsti in peggioramento i conti pubblici, con stime - lo ripeto - che sono peraltro ottimistiche, perché incorporano privatizzazioni che non farete e un azzeramento dell'effetto palla di neve sul debito, che non abbiamo mai registrato negli ultimi dieci anni e quindi verificheremo se effettivamente ci sarà. Per questi motivi consideriamo il DEF al nostro esame una dichiarazione di impotenza, perché il Governo non ha una strategia, non ha una visione di politica economica e non ha un orizzonte temporale che vada al di là delle prossime elezioni europee. Vi siete chiusi in una dimensione di campagna elettorale permanente, ma così facendo avete rinunciato ad ogni ambizione di promuovere un nuovo modello di sviluppo sostenibile dal punto di vista ambientale e sociale. E sull'ambiente, il vostro DEF, che incorpora un piano energia e clima ben poco ambizioso, gioca al ribasso; Lo fa sugli obiettivi di riduzione delle emissioni, sulle fonti rinnovabili, sullo sviluppo dell'energia solare e soprattutto non mette soldi sull'obiettivo dello sviluppo sostenibile. Il vostro DEF parla di mobilità sostenibile, certo, ma poi taglia 300 milioni di euro al trasporto pubblico locale, mettendo a rischio un servizio essenziale per i cittadini e andando nella direzione esattamente opposta a quella dello sviluppo e della mobilità sostenibile che pure declamate nel DEF. Questa è la situazione, signor Presidente. Il Governo non ha una politica economica e non ha la più pallida idea di come impostare la manovra di bilancio del 2020. L'UPB ha fatto due conti sui soldi che servono: 25 miliardi nel 2020, 36 nel 2021 e 45 nel 2022 solo per lasciare le cose come stanno. Sono 106 miliardi in tre anni che dovete trovare solo per non aumentare la pressione fiscale e non fare altro. È uno scenario drammatico quello che abbiamo di fronte, è come scalare l'Everest con le mani legate dietro la schiena ed è questa difficoltà che spiega la scelta del ministro Tria nel DEF di confermare l'aumento dell'IVA previsto dalla legislazione vigente. Quello che avete scritto, infatti, non è una mera formula lessicale. Nel DEF 2017 - l'ultimo programmatico dei Governi del centrosinistra - noi avevamo scritto delle cose chiare; avevamo scritto nero su bianco: «si prevede la disattivazione delle clausole di salvaguardia». Voi scrivete una cosa diversa, ovvero che la legislazione vigente in materia fiscale viene confermata nell'attesa di definire misure alternative: lo scrivete tre volte (a pagina 7, a pagina 39 e a pagina 48). Chi ha orecchie per intendere intenda, signor Presidente. Queste parole vogliono dire un'operazione verità (meglio tardi che mai): vogliono dire che l'IVA aumenterà fino a prova contraria, fino alla definizione di misure alternative che il vostro Governo non ha la più pallida idea di come definire. Questo è il punto che è emerso nel audizione del ministro Tria. C'è anche una seconda certezza, al di là delle chiacchiere dei due Vice Premier: il taglio da subito di due miliardi di euro che avevate accantonato nella legge di bilancio. Lì dentro, signor Presidente, ci sono i 300 milioni di euro per il trasporto pubblico, ma ci sono anche 100 milioni di euro per l'università, per il diritto allo studio e per la ricerca, che tagliate subito, al di là dei proclami del Documento di economia e finanza. È inammissibile che questo Governo da una parte discuta di come ridurre le tasse a chi sta meglio con la flat tax e poi tagli i fondi per il trasporto pubblico e progetti di aumentare l'IVA. Questa è la cifra di fondo del Documento di economia e finanza: la reticenza, la rinuncia e l'attendismo nell'attesa di improbabili tempi migliori. Bisogna cambiare rotta, signor Presidente, e noi nella nostra risoluzione indichiamo alcune proposte nell'immediato e nel medio termine. Proponiamo di fare chiarezza sull'IVA (no all'aumento dell'IVA senza se e senza ma, perché è una misura depressiva e regressiva che colpisce il ceto medio e i ceti più deboli), di rimettere il debito pubblico su un sentiero discendente (altrimenti rischiamo grosso), di spendere le risorse già stanziate (220 miliardi) per gli investimenti pubblici. Proponiamo inoltre, nel medio periodo, di trovare risorse per la scuola, per la sanità, per le urgenze vere di questo Paese, per il taglio del cuneo fiscale, facendo quello che finora non avete fatto: la revisione della spesa, le agevolazioni fiscali, i sussidi ambientalmente dannosi. Lo dico nel giorno in cui Greta Thunberg ha parlato al Senato della Repubblica: con sedici miliardi di euro noi finanziamo le fonti fossili, che danneggiano il clima del nostro pianeta e che voi non avete ancora avuto il coraggio di tagliare. Noi vi proponiamo di intervenire su questi punti e ci auguriamo che su di essi il Senato possa discutere con un dibattito costruttivo, lontano dalle demagogie e, una volta tanto, mettendo al centro l'interesse generale del Paese.
2019-04-18	PD	ParriniDario	Signor Presidente, il fatto saliente del Documento di economia e finanza al nostro esame, a mio avviso, ha a che vedere con l'andamento previsto per le principali grandezze macroeconomiche, di cui forse non si è parlato abbastanza. Prendiamo il tasso di disoccupazione: si prevede che nel 2019 sarà più alto rispetto al 2018. La pressione fiscale: si prevede che nel 2019 sarà più alta rispetto al 2018. Il debito pubblico: si prevede che nel 2019 sarà più alto rispetto al 2018. Il deficit nominale: si prevede che nel 2019 sarà più alto rispetto al 2018. Il deficit strutturale: si prevede che nel 2019 sarà più alto rispetto al 2018. Allora viene da dire che questo, più che un DEF, ovvero un documento di economia e finanza, è un DFE, ovvero un documento di fallimento economico.
2019-04-18	PD	StefanoDario	La prima riguarda la non coerenza dei quadri macroeconomici con i quadri di finanza pubblica. Nel DEF si indica un tasso di crescita del PIL per il 2019 pari allo 0,1 per cento, che sale - se così si può dire - allo 0,8 per cento nei prossimi anni e fino al 2022. Di conseguenza, salirebbe anche il tasso di disoccupazione all'11,1 nel 2020, e solo nel 2022, forse, tornerebbe ai livelli di inizio 2018: lo scrivete voi.
2019-04-18	PD	StefanoDario	Non sorprende più, è vero, perché arrivate a fare anche di peggio. Questo minuscolo ed effimero impatto sulla crescita, che ha lo scopo di gonfiare ancora per un po' le vele del consenso, in realtà sgonfierà le tasche degli italiani, perché costa il peggioramento delle condizioni di deficit e debito pubblico: il primo è stato pressoché raddoppiato dalla vostra legge di bilancio e, di conseguenza, il debito crescerà di altri 150 miliardi di euro da qui al 2022: dico 150 miliardi. Di fronte all'avanzare di un vero e proprio deserto economico, l'unico alibi che vi rimane è la scelta di aver presentato un DEF con un quadro di politiche invariate, lasciando l'aspetto programmatico ai provvedimenti da inserire nella prossima legge di bilancio, indicati ora nel DEF solo con generici titoli e senza alcuna quantificazione. Anche qui, però, se il buongiorno si vede dal mattino, sappiamo cosa ci aspetta: sono mesi infatti che vediamo licenziare decreti «salvo intese». Tornando ai vostri fiumi di parole, però, ci sono dati che indicano il netto peggioramento della crescita e dell'occupazione, il grave pericolo sul fronte dei conti pubblici e una prospettiva che a settembre richiederà una manovra di molte decine di miliardi di euro. Mi chiedo allora se valeva proprio la pena fare tutto questo, ponendo a serio rischio la finanza pubblica, per ottenere un effetto sulla crescita dello 0,1 o dello 0,2 per cento, per avere un aumento della disoccupazione che forse tornerà al livello del 2018 solo fa quattro anni. Sappiamo bene di vivere una fase di rallentamento dell'economia mondiale ed europea, ma non può essere questa una giustificazione, perché tali analisi sono riferite esclusivamente al quadro interno e rispecchiano le vostre scelte di politica economica. Mi sia permesso qui, a conclusione, un breve accenno al Sud. Il rallentamento e la profonda incertezza della dinamica dell'economia nazionale diventano per il Mezzogiorno una grande frenata. Non sono mie queste parole, ma dei rappresentanti dello Svimez in audizione: si tratta di un vero e proprio allarme. Dopo un quadriennio di sostanziale allineamento delle dinamiche economiche tra Nord e Sud, al Mezzogiorno tocca un peggioramento dello scenario di previsione, con una sensibile divergenza rispetto al Centro-Nord. La vostra tassa piatta, inoltre, è paradigmatica, perché avrebbe una ricaduta territoriale fortemente asimmetrica, a tutto svantaggio del Sud, l'area con i redditi più bassi. Stesso effetto avrebbe l'aumento dell'IVA: la scelta di lasciare il Mezzogiorno privo di politiche di sviluppo, quindi, è l'ennesima conferma dell'inutilità del vostro Ministero per il Sud, senza portafoglio né - cosa ben peggiore - uno straccio di progettualità per un bel pezzo d'Italia. Era e resta solo pura propaganda elettorale.
2019-05-14	PD	FerrariAlan	Signor Presidente, anche questa volta proviamo a convincere la maggioranza a cambiare idea su questo programma di lavori. Abbiamo tempo per discutere le cose importanti che vanno inserite in calendario anche per rispetto della portata di queste proposte. In particolare, mi riferisco alle due proposte illustrate dal presiedente Marcucci, la mozione di sfiducia al Governo e la mozione su Radio Radicale. Sulla mozione di sfiducia al Governo aggiungo molto brevemente queste parole a quelle del presidente Marcucci: è chiaro che la maggioranza, il presidente Conte, Lega e MoVimento 5 Stelle non sono voluti venire in Aula a discutere se il loro Governo ha ancora la fiducia in questo Parlamento perché sono in chiara difficoltà. Forse hanno scelta questa strada per tre ragioni. Vediamo quale scegliete. La prima possibilità è che non vogliono discutere questa mozione di sfiducia per evitare che questo Parlamento metta gli occhi, ponga attenzione e punti i riflettori sui danni economici e sociali che sta producendo questo Governo a questo Paese. La realtà è questa e, quindi, non ci impediranno di denunciare che la pressione fiscale, come abbiamo scritto nella nostra mozione di sfiducia, tenderà al 42,7 per cento nel 2020 e nel 2021, che la disoccupazione tenderà all'11 per cento nell'anno prossimo, che sarà necessaria una manovra correttiva di 25 miliardi di euro nei prossimi mesi, che è decisamente diminuita - come ci ha ricordato l'ABI questa mattina - la richiesta di prestiti e, quindi, le aziende hanno diminuito le proprie richieste di prestito per investire, che questo Governo è totalmente sordo rispetto a ciò che oggi Confindustria ha detto, ovvero che le imprese italiane, dopo il provvedimento industria 4.0 dei Governi Renzi e Gentiloni Silveri, hanno saputo investire 10 miliardi in questo Paese. Voi siete sordi di fronte a tutto ciò. La verità è che chi di cifre e numeri ferisce, in realtà poi viene colpito perché il vero scambio non è tra il 2,4 e il 2,04, su cui voi avete giocato nei precedenti mesi, ma è tra l'1 per cento di PIL che avevate promesso a questo Paese e lo 0,1 per cento di PIL che questo Paese si ritroverà, con tutte le difficoltà conseguenti.
2019-06-11	FI	MalanLucio	Tuttavia, in parallelo, abbiamo il mondo reale. Non ci sono solo le cifre dello 0,1, 0,2, 2,1 o 2,4; ci sono anche tutte le cose che vengono portate avanti ogni giorno, anche in questi giorni, che non sono precisamente di vigilia della legge di bilancio. Il vice primo ministro Salvini ribadisce oggi che bisogna inserire la flat tax in manovra. Cerchiamo di fare una previsione ottimistica: 20 miliardi? Probabilmente 30? Diciamo 20, 30 miliardi. C'è l'IVA di cui nessuno parla: non né parlano il Presidente del Consiglio, né i Vice Presidenti del Consiglio e neppure, purtroppo, il Ministro dell'economia e delle finanze, che è lei, ed è qui presente. Si tratta di 23 miliardi di euro, che, se non si trovati, faranno alzare l'IVA e i prezzi e causeranno un'immediata e drammatica contrazione dei consumi, nonché una sfiducia nel nostro Paese, dopo che per anni si è detto che non la si sarebbe fatta aumentare. Bisogna parlare con urgenza di quanto è già nella legge: senza un intervento normativo, il prossimo 1° gennaio - tra pochi mesi - l'IVA salirà e non certo di poco. Il vice presidente del Consiglio Di Maio dice che bisogna trovare un miliardo per le famiglie; il Presidente del Consiglio dice che sono irrinunciabili misure come il reddito di cittadinanza e quota 100. E si potrebbe ancora andare avanti. Questo è il punto. Che pensate di fare per il Paese reale? Come pensate di agire non soltanto nei rapporti con gli organismi europei, per accrescere i like e magari le adesioni nei sondaggi, ma anche per far crescere il Paese? Se il Paese non cresce, tutti i calcoli e le trattative sono inutili: la disoccupazione non scenderà - anzi, aumenterà - e le nostre imprese tenderanno ancora di più a chiudere o spostarsi altrove. Questi sono i problemi reali e ciò da cui dipendono la possibilità, per giovani e non, di trovare un lavoro - e, per chi lo ha, di non perderlo - e la certezza di percepire le pensioni (tagli a parte, che voi avete inserito - questi sì - con una certa tempestività). Bisogna almeno dare la certezza che il nostro sistema regga e, a tal fine, è necessaria la crescita. Se si continua con delle misure basate sul brevissimo termine, sul populismo penale - come è stato autorevolmente descritto negli ultimi giorni che spaventa gli imprenditori e su misure che soffocano l'economia, anziché rilanciarla, non possiamo avere una visione serena del futuro. Questa visione ce la dovete dare voi; ce la deve dare lei, signor Ministro. Benissimo i rapporti con l'Unione europea, ma c'è il rapporto con il Paese reale che deve crescere. Noi siamo disposti a sostenervi se fate delle scelte per la crescita. Siamo disposti a sostenervi anche rispetto a uno sforamento delle cifre che vengono imposte a livello europeo, ma solo se c'è un convincente piano di rilancio e non in presenza di un piccolissimo cabotaggio e di un atteggiamento teso a guardare ai sondaggi di domattina e ai like di questa sera.
2019-06-11	PD	MisianiAntonio	Signor Presidente, abbiamo ascoltato con attenzione e rispetto l'intervento del ministro Tria e con lo stesso rispetto vorremmo dirgli che siamo sconcertati dallo spettacolo che il Governo e la maggioranza stanno mettendo in scena da settimane: un teatrino di litigi, paralisi e parole totalmente difformi tra quello che dicono il Ministro e il Presidente del Consiglio, da una parte, e le parole dei due Vice Premier, dall'altra. Pochi giorni fa, questo Governo ha compiuto un anno, per cui si può iniziare a fare un bilancio, che è disastroso, signor Ministro. Un anno fa l'Italia era un Paese che indubbiamente si trascinava molti problemi, ma aveva imboccato un sentiero virtuoso, fatto di crescita, di consolidamento dei conti pubblici e di fiducia. Avete abbandonato quel percorso e in un anno avete forzato i conti pubblici, incrinato la fiducia delle imprese e dei consumatori, aumentato la spesa corrente e bloccato gli investimenti. Quali risultati abbia prodotto questa politica ce lo dicono non l'Unione europea, ma i dati, che sono impietosi: stagnazione economica; disoccupazione giovanile che è tornata a crescere; spread più che raddoppiato rispetto al livello precedente alle elezioni; deficit e debito nuovamente in aumento. Certo, la congiuntura internazionale è peggiorata, come ci ha ricordato anche il Ministro, che però nel 2019 non ha ricordato che il divario di crescita tra l'Italia e il resto della zona euro si è aggravato, e questo vuol dire una cosa precisa: è la vostra politica economica la prima causa della stagnazione.
