2019-07-30	M5S	MarilottiGianni	Dicevo che alla base del patto europeo è il principio di sussidiarietà, quasi che l'Unione si sia ormai di fatto trasformata in una federazione di singoli egoismi. Mi soffermerò su alcuni punti che ritengo particolarmente importanti, ad esempio nell'ambito delle attività per la politica marittima integrata, il cui pilastro ambientale è costituito dalla direttiva n. 56 del 2008: è prevista una strategia integrata di pianificazione e gestione delle aree marittime, con l'obiettivo di favorire lo sviluppo ecosostenibile dei mari e degli oceani e sviluppare un processo decisionale coordinato e coerente con riguardo alle politiche settoriali dell'Unione, che interessano i mari, le isole, le Regioni costiere e ultraperiferiche. Il Governo si impegnerà allo sviluppo ed all'aggiornamento delle normative relative alla riduzione dell'impatto di materiali inquinanti nell'ambiente marino e darà risalto alle attività di sostegno al riciclaggio ecocompatibile dei mezzi navali, nell'ottica della strategia dell'economia circolare. Le politiche settoriali dell'Unione che interessano i mari e chi vi abita non possono però soffermarsi solo sugli aspetti ambientali; qui si tratta di considerare problemi importanti per l'economia e la crescita civile di una parte considerevole di europei, quelli delle grandi e delle piccole isole; vale a dire gli impegni mai mantenuti sul principio di insularità a me ben caro come sardo. Le politiche di concorrenza dell'Unione europea garantiscono che le imprese competano in modo leale e in condizioni di parità nel mercato interno europeo: questo principio sta a fondamento delle regole sulla concorrenza e la crescita comune, ma è ampiamente disatteso. Come si fa infatti a sostenere che le Regioni operino su un piano di parità? Prendiamo il costo dei trasporti: quello su ferro praticato nella penisola italiana o nel continente europeo ha un costo unitario a chilometro; quello su nave da e per la Sardegna ha un costo unitario assai maggiore e questo surplus va a maggiorare il costo finale con conseguente riduzione del profitto. Altro che parità di condizioni! Lo stesso discorso vale per l'energia, che costa di più per i maggiori costi di trasporto o per l'assenza di una rete, quella metaniera, notoriamente meno costosa. Accade così che quando - per inerzia o cecità delle autorità europee - realtà regionali dotate di poteri costituzionali (come nel caso della Sardegna) si trovano costrette ad adottare provvedimenti eccezionali volti al riequilibrio, sugli stessi si abbatta il maglio della procedura di infrazione per violazione dei princìpi di concorrenza, quasi che le condizioni infrastrutturali di Maracalagonis possano essere parametrate con quelle di Parigi o che le possibilità degli imprenditori di Serrenti siano le stesse di quelli di Francoforte. Le Regioni insulari, ma anche le aree di montagna, non vogliono condizioni di favore, ma di riequilibrio. Vogliono competere alla pari, e questo è un diritto sancito, oltre che dalla nostra Costituzione, dalle norme europee. Un disegno di legge di iniziativa popolare, che ha raccolto 120.000 firme, depositate qui al Senato, chiede il reinserimento in Costituzione del principio di insularità, troppo frettolosamente tolto con la riforma del Titolo V. A nome anche degli altri senatori sardi, chiedo sia calendarizzato al più presto in modo da dare più forza al nostro Governo in sede di trattativa con Bruxelles. In una risoluzione del 4 febbraio 2016 il Parlamento europeo chiedeva che la Commissione avviasse uno studio/analisi approfondito sui costi supplementari che la condizione di insularità determina a livello dei sistemi dei trasporti di persone e merci e dell'approvvigionamento energetico, nonché di accesso al mercato, in particolare per le piccole e medie imprese. Risoluzione rivelatasi, per ora, lettera morta. Ecco perché è importante avviare una trattativa subito. Oggi discutiamo la legge delega e la relazione programmatica sulla partecipazione dell'Italia alle politiche dell'Unione europea. Questo ci aiuta forse a fare una riflessione, necessaria soprattutto oggi, rispetto a quelli che sono i nostri rapporti con l'Unione europea, perché proprio oggi necessitiamo di riflettere maggiormente su questo tema. Ebbene, signor Presidente, noi abbiamo criticato in maniera aspra le politiche di austerità dell'Unione europea e riteniamo che l'Unione europea debba perseguire politiche ampie, espansive e politiche fiscali, economiche e sociali comuni, per cercare di affrontare e superare la crisi e le difficoltà di milioni di cittadini europei; di superare il problema della disoccupazione e della rimozione delle disuguaglianze sociali ed economiche troppo presenti ancora oggi. Crediamo in un'Europa realizzata sulle diversità culturali, economiche, quindi vicina alle realtà regionali e locali; un'Europa dei popoli e delle Regioni, fondata sul principio di sussidiarietà, appunto. Il MoVimento 5 Stelle ha come idea base il rispetto delle autonomie, della sussidiarietà e dell'autogoverno. Da qui sorge la nostra idea di un'Europa diversa, un'Europa dei popoli, delle autonomie locali, delle Regioni, un'Europa delle culture e delle lingue; un'Unione europea, in breve, che faccia derivare la sua legittimazione dal popolo. Il Parlamento europeo e il Consiglio hanno adottato - il 3 ottobre 2018 - il regolamento che istituisce lo sportello digitale unico. Cittadini e imprese dell'Unione europea, a partire dal 2020, potranno fruire di servizi di assistenza, consulenza e risoluzione dei problemi transfrontalieri grazie a un'interfaccia comune disponibile in tutte le lingue ufficiali dell'Unione. Tra queste, vanno tutelate quelle riconosciute dalla Carta di Strasburgo nel lontano 1992 (mi riferisco alle lingue regionali o minoritarie); Carta sottoscritta dall'Italia, ma non ancora ratificata, nonostante ripetute sollecitazioni da almeno quattro legislature. È il momento di sanare questa anomalia e di calendarizzare al più presto la discussione sui disegni di legge depositati in Senato, tra cui quello che io stesso ho depositato a inizio legislatura. Concludo, signor Presidente, riandando con il pensiero a un grande europeista: «La federazione europea (...) non si proponeva di colorare in questo o quel modo un potere esistente. Era la sobria proposta di creare un potere democratico europeo». Così Altiero Spinelli commentava causticamente la sconfitta della sua idea d'Europa; ma egli non si arrese fino alla fine dei suoi giorni. A noi il compito di proseguire questo difficile, ma necessario cammino.
2019-08-05	PD	GaraviniLaura	Già all'epoca di sicurezza non se ne è vista e anche adesso, dentro questo secondo decreto, misure per la sicurezza non vi sono. Certo, c'è la solita propaganda antiimmigrati ed è in abbondanza: porti chiusi; possibilità di sequestrare le navi a chi salva vite umane; il solito ritornello che serve ad alimentare lo show dell'uomo forte al comando, con il pugno di ferro, salvo poi essere totalmente ininfluente e assente ai tavoli che contano. Si tratta dell'ennesimo strumento di distrazione di massa, che cerca di distogliere l'attenzione dai problemi veri, a partire da quelli legati allo stesso Ministro dell'interno, che usa la Polizia per far giocare il figlio in vacanza; che non spiega dove sono i 49 milioni sottratti dalla Lega; che si sottrae al Parlamento e alle legittime domande della stampa e tratta i giornalisti come se vivessimo in un regime. Con questo nuovo provvedimento si continua ad alimentare ad arte un'emergenza che non c'è, il tutto allo scopo di nascondere emergenze vere, vuoi la stagnazione economica in cui versa il Paese, la disoccupazione giovanile crescente o l'esodo dall'Italia, ormai superiore agli anni del boom economico. La cosa più grave è che, nel tanto declamato decreto-legge, non si affrontano questioni urgenti, che andrebbero invece trattate in fretta laddove si volesse tutelare davvero la sicurezza del Paese. Penso - ad esempio - alla delicatissima questione antiterrorismo, per la quale serve un celere aggiornamento della nostra legislazione. Infatti, già a partire dal 1° settembre verrà istituito presso Eurojust un registro giudiziario europeo antiterrorismo, dove confluiranno una serie di dati per tutelarsi al meglio contro possibili attentati. Tuttavia, se non si interviene in fretta con una legge apposita, l'Italia rischia di restarne totalmente fuori ed essere dunque particolarmente vulnerabile. Ma al Governo, chiaramente, la questione non interessa. E dire che non si tratta di una qualsiasi ONG o di una decina di migranti: stiamo parlando di terrorismo internazionale, un pericolo attuale e di estrema gravità, che si contrasta solo con lo scambio di informazioni; con una stretta collaborazione internazionale tra forze inquirenti e, appunto, con una legislazione aggiornata che ne consenta la realizzazione. Ma le relazioni internazionali non sono il forte dell'attuale Governo. D'altra parte, perché stupirsi? Così come disertava il Parlamento europeo quando era deputato, adesso Salvini snobba sistematicamente tutte le riunioni dei Ministri dell'interno europei a Bruxelles, perdendo di vista gli interventi utili e strategici per il Paese. Forse dovremmo chiedere che tali riunioni si tengano all'hotel Metropol o forse direttamente al Papeete di Milano Marittima, così potremmo provare il brivido di vedere finalmente comparire il Ministro dell'interno, lo stesso Ministro che in questi giorni dispensa da lì le sue interviste a torso nudo e in costume da bagno. Al di là del folklore, quando si tratta di prevedere misure concrete, il Governo - ahimè - latita, come su un'altra partita cruciale in materia di sicurezza che si sarebbe potuta e dovuta affrontare seriamente in questo decreto-legge, quella relativa alle Forze dell'ordine. L'Esecutivo, infatti, fa grandissimi proclami, ma poi, nonostante i corpi di polizia siano fortemente sottodimensionati, quando ne avrebbe l'occasione si guarda bene dal realizzare quel piano di assunzioni che avevamo previsto e finanziato con i nostri Governi del PD. Dunque, non solo si riducono esponenti del comparto sicurezza a passatempo per i familiari del Ministro; non solo vengono scimmiottati indossando le loro divise e le loro felpe, ma soprattutto vengono totalmente disattese le loro richieste. E non lo diciamo solo noi dell'opposizione; lo ha dichiarato un paio di giorni fa il capo della polizia, il prefetto Gabrielli, che ha denunciato come gli attuali 99.000 uomini risultino fortemente sottodimensionati rispetto ai 117.000 che avevamo previsto di raggiungere con la nostra legge Madia; legge con la quale abbiamo creato i presupposti per il completamento degli organici del comparto sicurezza e ordine pubblico nel giro di cinque anni. Per non parlare della questione salariale: questo decreto-legge non fa alcun passo avanti, né rispetto all'aumento degli stipendi, né rispetto alla defiscalizzazione degli straordinari; non rinnova l'incremento di 104 euro mensili netti che noi del Partito Democratico abbiamo introdotto nell'ultimo contratto triennale con i nostri Governi, aumento che sarebbe doveroso rinnovare anche per la nuova contrattazione triennale. Con il decreto sicurezza- bis l'unica cosa certa sono le promesse disattese, quelle fatte da Salvini alle donne e agli uomini delle Forze dell'ordine. Tra l'altro, questo decreto non risolve neanche tutta una serie di problemi provocati dal Governo col primo decreto sicurezza: penso alle restrizioni introdotte per le macchine con targa straniera in circolazione in Italia, restrizioni che stanno mandando in tilt tutta una serie di lavoratori artigiani frontalieri, che operano a San Marino o in Südtirol o in altre località di confine. Ma il Governo resta sordo alla questione e tutti i nostri emendamenti in materia alla Camera - qui non sono stati neppure trattati - sono stati sistematicamente bocciati. Con questo provvedimento si continua a gridare «al lupo, al lupo» rispetto alla questione migratoria, come se fosse l'emergenza numero uno del Paese, mentre l'emergenza non c'è più, già da quando l'allora ministro Minniti ha introdotto una politica chiara, basata sulle regole, ma al contempo anche sull'umanità. L'attuale Ministro dell'interno, invece, con la sua politica sta isolando l'Italia a livello internazionale e sta compromettendo alleanze storiche con i nostri vicini più stretti, senza rendersi conto che non solo questa modalità è estremamente nociva per il Paese a livello geostrategico, ma offre anche una visione totalmente distorta della realtà e dei problemi, rischiando di sbagliare clamorosamente politica. Infatti, se c'è una vera emergenza migratoria in Italia non è l'immigrazione, ma semmai l'emigrazione, come ha giustamente rilevato l'istituto di ricerca Svimez soltanto alcuni giorni fa con un dettagliato studio. In quindici anni se ne sono andati dall'Italia 2 milioni di persone, spesso le più istruite e più del 60 per cento giovani, un terzo dei quali laureati: un capitale umano enorme, regalato; un investimento sprecato, anche solo per i percorsi formativi finanziati per oltre 42 miliardi di euro. Su questo servirebbe un decreto-legge, signor Presidente, e poi un altro e un altro ancora, per contrastare tali fenomeni - questi sì - emergenziali. Servirebbe una serie di misure, vuoi per favorire l'occupazione, vuoi per favorire l'imprenditoria giovanile; un piano di investimento nella cultura, nella formazione; interventi per la conciliazione tra carriera professionale e natalità; aiuti alle amministrazioni locali; misure per l'integrazione. Insomma, servirebbe l'esatto contrario di ciò che si sta mettendo in campo con questo provvedimento; un provvedimento imbarazzante, inadeguato, sul quale esprimeremo convintamente un voto contrario.
2019-09-10	LN	BagnaiAlberto	L'Unione europea ha demonizzato a lungo le politiche di bilancio espansive, per il semplice fatto che un sistema che si era privato del meccanismo di aggiustamento del cambio aveva necessità di scaricare gli shock esterni, il calo della domanda di altri Paesi sul mercato del lavoro: dalla svalutazione competitiva siamo passati alla disoccupazione competitiva, necessaria per abbassare i salari e rendere competitivi, cioè - traduco - convenienti in termini di prezzo, i beni nazionali. Questo scellerato gioco al ribasso inizialmente ha schiacciato i Paesi deboli: artefice di questo periodo è stato il collega Monti Questo, però, era anche il ramo su cui era seduta la possente e miope Germania. Segato questo ramo, la Germania si confronta oggi con una triste verità: chi vive esportando beni agli altri muore importando i problemi altrui. Quando la crescita non è sostenuta dalla domanda interna (dagli investimenti in infrastrutture, da salari decenti che garantiscano livelli di consumo adeguati), ogni starnuto in Cina o negli Stati Uniti può trasformarsi in un uragano in casa propria; che poi è quello che sta succedendo alla Germania, e di ricasco a noi. Tutta la politica economica europea è stata piegata all'esclusivo interesse della potenza egemone per sottrarla al pantano in cui si è cacciata. Quindi - e questo è il punto politicamente rilevante per noi e per lei - Draghi ha stampato moneta perché faceva e fa comodo alla Germania, non a noi (motivo per il quale trovo un po' fuori luogo, oltre che vagamente iettatorio, il suo processo di canonizzazione ante mortem ). Ma la politica monetaria è una corda: puoi usarla per tirare, non per spingere. La liquidità non serve se il cavallo dell'economia non beve. E allora, finalmente, l'Unione europea cambierà le regole fiscali per consentire al settore pubblico di fare quegli investimenti che il settore privato non può o non vuole fare, e lo farà perché fa comodo alla Germania, non certo perché soggiogata dalla statura intellettuale - che non metto in discussione - dell'onorevole Gentiloni Silveri. La esorto, signor Presidente, soprattutto ora che è esplicitamente e fieramente Premier di un Governo di ex marxisti
2019-10-09	FI	PichettoFratinGilberto	Signor Presidente, onorevoli rappresentanti del Governo, colleghe e colleghi, questo è il primo documento di politica economica e, peraltro, il primo disegno triennale della nuova maggioranza, del nuovo Governo del Paese. E cade in un momento in cui l'analisi di scenario internazionale è abbastanza inquieta, con venti di crisi un po' in tutto il mondo; con i Paesi che crescevano a doppia cifra che stanno rallentando; con l'Europa e con la locomotiva dell'Unione europea - la Germania - che stanno perdendo colpi e addirittura con la Confindustria dell'Unione europea che mette in discussione le scelte politiche di otto anni or sono e degli ultimi dieci anni del Governo tedesco e dell'Unione europea. L'Italia subisce, naturalmente, questa regressione del Continente europeo con il calo degli ordini e i primi segnali stanno venendo dall'industria manifatturiera del Nord. Certo, resiste l'occupazione ma con una inadeguata produttività: emerge da tutti i dati. Continuiamo ad avere una disoccupazione giovanile molto alta e manca completamente fiducia da parte dei cittadini. L'indicatore citato da alcuni colleghi di crescita del risparmio è indicatore della sfiducia verso il futuro. C'è inoltre la grande questione demografica delle nascite e dell'immigrazione. Sono tanti temi che hanno portato anche il presidente uscente della BCE, Mario Draghi, a dichiarare quanto mai necessarie delle grandi riforme strutturali che riguardino produzione, lavoro, giustizia e scuola nel nostro Paese. Certo - come ha avuto modo di dire il Sottosegretario, che ringrazio per la sua esposizione e anche per la chiarezza delle sue posizioni - i tassi sono in discesa per maggior fiducia da parte dei grandi finanzieri, ma anche perché sono molto in negativo quelli di altre realtà europee. Abbiamo il problema dei dazi, ma abbiamo anche il problema del non funzionamento di sanità e scuola. Dall'Unione europea - l'ultimo atto è del 2 luglio 2019 - ancora ci dicono che basterebbe far scattare la clausola di salvaguardia e tassare gli immobili. La musica non è ancora cambiata. Il Governo che cosa propone? Il Governo indica investimenti per circa 40 miliardi, ma vorrei ricordare che in questo Paese ci sono 110 miliardi di investimenti previsti nel precedente decennio che non riescono ad attivarsi. Il Governo non ci dice in che modo, con quali atti regolamentari e con quali norme intende sbloccarli, perché i 40 miliardi previsti per il 2020 avranno un effetto, con questi meccanismi, nel 2030. Possono avere, al limite, un effetto di fiducia nell'immediato, un effetto di annuncio, visto che annunci ne vengono fatti tanti. Il Governo prevede interventi sulle tasse e parla di cuneo fiscale, per il quale prevede uno stanziamento di 2,7 miliardi, per metà anno e naturalmente per 40 euro: praticamente due Renzi dimezzati o un Renzi dimezzato due volte, questo è. E gli autonomi? E gli oltre 2 milioni di lavoratori autonomi professionali e imprese (SNC, SRLS, o società semplici)? Questi devono continuare a pagare. Non si cita alcuna riforma fiscale e i dati sono all'evidenza di tutti, come la necessità di un intervento che modifichi la struttura fiscale degli anni Settanta. Anzi, l'altro messaggio sul fiscale, a nove mesi dalla comunicazione che la flat tax fino a 65.000 euro sarebbe stata portata con la seconda fascia da 65.000 a 100.000, con l'aliquota del 20 per cento, viene tolto. Ma quale fiducia può avere il popolo italiano in questo meccanismo di annunci e di cambiamento? Serietà istituzionale significa anche avere almeno uno spazio di raccordo e continuità: poi naturalmente è diritto di tutti i Governi e di tutte le maggioranze cambiare direzione e andare in quella opposta. Oppure parliamo dell'IVA: il nuovo termine del Devoto-Oli è rimodulazione, che significa aumento. Basta leggere gli organi di stampa oggi, che cominciano a parlare di aliquota del 22 per cento su hotel e ristoranti, nonché sul settore turistico, che è uno di quelli trainanti del Paese, che crea, aumenta ed efficienta l'occupazione.
