2019-01-28	FI	VitaliLuigi	Prenderò allora altri trenta secondi, me ne faccia grazia, per dire che questo provvedimento, purtroppo, seguirà la sorte di tutti gli altri. Il decreto dignità avrebbe dovuto procurare lavoro: è vero che c'è stato un aumento delle occupazioni a tempo indeterminato, è però aumentata la disoccupazione, perché gli imprenditori sono stati disincentivati dall'assumere a tempo determinato. La legge di stabilità ha dimenticato il Mezzogiorno: meno investimenti, meno credito d'imposta, meno superammortamento, meno ammortamento e lo spazzacorrotti non è altro che un provvedimento a favore dei corrotti. Non devo citare quello che vi è stato detto all'inaugurazione dell'anno giudiziario, dove non c'è stata una parola a favore di questo provvedimento. Mai, come in questo caso, tutto il mondo giudiziario, giurisprudenziale, dei professionisti del diritto e degli avvocati è stato unanime nel dire che questa è ed è stata una porcheria! E non basta la norma per snellire le procedure per le carceri, perché servono i denari. Di qui a qualche anno, con tutte le eccezioni che avete creato e con tutta l'inaccessibilità che avete creato nei confronti delle forme alternative alla detenzione, avremo 30.000-40.000 detenuti in più, che non sapremo dove collocare e credo che voi non abbiate idea di come si faccia ad affrontare questo problema. Comunque, noi siamo qui, in attesa che il popolo italiano - sovrano, come sempre - si decida e possa finalmente dare un giudizio definitivo su questo Governo e su questa maggioranza. Buona fortuna.
2019-01-28	FdI	UrsoAdolfo	(ore 11,50) ( Segue URSO). Quindi, cosa accadrà in queste ore? Accade innanzitutto che stiamo discutendo di un testo e di emendamenti che probabilmente saranno a loro volta ritirati, dopo intese in qualche stanza o bagno di questo Palazzo tra i Gruppi della maggioranza, per evadere un avvertimento significativo della Presidenza della Repubblica. Siete stati colti con le mani nella marmellata. Siete stati colti in flagranza, come ladri di Pisa, mentre imbarcate nei vagoni di tutto, talmente di tutto che il provvedimento - come dicevo prima - potrebbe chiamarsi più legittimamente "complicazioni" o "correzioni", perché correggete una serie di provvedimenti che avete fatto male, da quello sulla tassazione per il volontariato al provvedimento sui taxi, dal provvedimento sulla rottamazione alla nuova web tax. Avete modificato, pochi giorni dopo la loro approvazione, provvedimenti che voi stessi avete realizzato: una confusione assoluta, in cui voi stessi apparite più che confusi, direi smarriti. Potrebbe chiamarsi anche "decreto omnibus ", perché nel frattempo avete aggiunto a questo decreto semplificazione la proroga del provvedimento di commissariamento e di finanziamento dell'Alitalia. Che c'entra con la semplificazione? E con quale piano? Senza un piano: proroga e basta, altro denaro pubblico senza dirci in quest'Aula, in sette mesi, cosa volete fare dell'Alitalia. Avete inserito il provvedimento sulle trivelle, che secondo le associazioni di imprese (leggete il comunicato di quella dell'Emilia-Romagna) è un suicidio industriale, perché bloccate per diciotto mesi ogni cosa, in attesa di fare il piano definitivo, e - come sanno tutti coloro che lavorano, che producono, che hanno un'impresa - la cosa peggiore è dire che tra diciotto mesi si cambieranno le norme. È meglio cambiarle subito, perché, se rinviate i cambiamenti di diciotto mesi, nel frattempo si blocca ogni cosa. Lo dico ai parlamentari della Lega: l'associazione degli industriali ha definito questa vostra decisione un suicidio industriale, che permette sostanzialmente alle imprese straniere di guadagnare di più sul nostro approvvigionamento energetico. Avete inserito un provvedimento sulla Xylella. Noi siamo d'accordo, ma vorrei capire se anche il MoVimento 5 Stelle è d'accordo (dato che lo ha inserito anche il MoVimento 5 Stelle). Vorrei capire cosa ne pensa il senatore Lello Ciampolillo, che aveva posto la sua residenza parlamentare su un campo agricolo per impedire che fosse abbattuta una pianta di ulivo che poi ha creato contagio. Il senatore Lello Ciampolillo ha addirittura utilizzato le sue prerogative parlamentari per tutelare quella pianta malata e impedire che fosse tagliata; per questo gli atti sono stati trasmessi alla procura della Repubblica. Con questo provvedimento - e non c'entra nulla - voi prevedete un nuovo reato, punito con il carcere da uno a cinque anni, per chi non abbattere gli ulivi colpiti dalla Xylella. Ma, insomma, poi darete l'immunità al senatore del MoVimento 5 Stelle, che già è incorso nel reato che avete inserito in questo provvedimento, con una pena da uno a cinque anni? Pertanto, se faccio l'elenco di quello che avete inserito, dalle farmacie alle RC auto, dal DURC all'idroelettrico e alle concessioni autostradali (un regalo!), è evidente che questo provvedimento si può chiamare in tutti i modi, ma certamente non "semplificazione". Si può chiamare "complicazione", si può chiamare "correzione", si può chiamare "tappabuchi", si può chiamare "elettorale" (perché ciascuno vi ha inserito qualcosa che ritiene possa produrre un risultato elettorale), si può chiamare "decreto figuraccia", perché tra poche ore dovrete cambiarlo di fronte al richiamo del Capo dello Stato. Voi giocate con le parole, come avete fatto nel caso del decreto dignità, in riferimento al quale faccio notare che nel mese di novembre dello scorso anno, secondo gli ultimi dati disponibili, le domande di disoccupazione sono aumentate di 223.728 unità rispetto all'anno precedente, con un più 5,2 per cento. Effetto del decreto dignità? Forse. Effetto dell'annuncio del reddito di cittadinanza, perché ciascuno si sta collocando in una posizione tale per poi ottenere il reddito di cittadinanza? Forse. Voi avete creato un pasticcio parlamentare e una confusione legislativa tali per cui ora ne pagherete le conseguenze, con la figuraccia che farete nelle prossime ore per ritirare gli emendamenti che avete già presentato e per snellire questo provvedimento. Credo che questo sia l'esempio più classico di quanto non avreste dovuto fare, mentre per confusioni interne - siete entrati nella paranoia elettorale per cui ciascuno insegue l'altro - avete consentito al Parlamento di creare questo obbrobrio. Noi non lo permetteremo più.
2019-01-28	PD	MancaDaniele	Abbiamo apprezzato la proposta del presidente Patuanelli di eliminare dal decreto semplificazione la questione riguardante la modifica del codice degli appalti. Tuttavia, riteniamo che siano tante le materie che sono state introdotte, a cominciare da quelle più delicate e pertinenti per lo sviluppo economico e sociale del nostro Paese: mi riferisco alle grandi questioni energetiche che avete deciso di affrontare nel provvedimento. Insomma, l'Italia richiede una politica energetica nazionale ed è proprio nella riconversione in chiave ecologica dell'economia che si genererà nuova occupazione e nuovo sviluppo. Questo avrebbe richiesto una misura organica e non misure, come quelle contenute nel decreto semplificazione, finalizzate ad aprire conflitti più che a risolvere problemi: conflitti tra lo Stato e il mercato o tra il pubblico e il privato, tendenti tutti, sia per quello che riguarda la grande questione delle trivelle che per la grande questione dell'idroelettrico, a produrre recessione e disoccupazione, non a promuovere le fonti rinnovabili e costruire nuova occupazione e nuovo futuro.
2019-01-28	PD	MancaDaniele	Onorevoli senatori, come già è evidente, aumentano le domande di disoccupazione. Veniamo via via spinti verso una nuova recessione e il decreto semplificazione si trasformerà in nuove complicazioni per famiglie ed imprese, anche perché è stato riempito in maniera assurda, a volte anche abnorme e in contrapposizione con l'entità stessa del provvedimento, da innumerevoli iniziative legislative. Ne parleremo più approfonditamente nella discussione in merito agli emendamenti.
2019-02-05	FI	MalanLucio	Non abbiamo bisogno di qualcuno che dice di non aver bisogno della democrazia, perché tanto interpreta lui quello che vuole il popolo, eventualmente con la mediazione dei social media e di consultazioni referendarie dove dominerà chi ha il potere, chi ha il possesso o il controllo dei mezzi di informazione, su cui l'attuale maggioranza si sta dando molto da fare. Se fosse così efficiente sul rilancio dell'economia come sull'occupazione sistematica dei posti, in particolare nei mezzi di informazione, avremo un tasso di crescita da fare invidia al resto del mondo invece di essere in recessione, con l'aumento della disoccupazione.
2019-02-06	FI	CausinAndrea	Abbiamo una Costituzione molto bella e non poteva essere altrimenti: la sua genesi e i suoi protagonisti hanno fatto sì che, dopo la Seconda guerra mondiale, l'Italia avesse una Carta costituzionale di altissimo livello e qualità, sicuramente superiore a quelle di tantissimi altri Paesi. È anche vero, però, che la Costituzione non è un totem e il Parlamento ha il diritto e il dovere di cimentarsi in un tentativo di cambiamento, soprattutto perché i tempi cambiano. È di tutta evidenza che il Paese sta molto peggio rispetto a dieci - quindici anni fa e che sicuramente c'è una responsabilità diretta, in alcuni casi legata all'inefficacia della nostra democrazia. Sono stati commessi errori soggettivi e imputabili alle forze politiche, ma sicuramente anche errori di sistema, nel funzionamento della nostra democrazia, che in questi anni si è dimostrata troppo lenta nel leggere i problemi ed articolare risposte, ma anche incoerente nel verificare se le risposte che aveva dato alle nuove questioni sociali erano efficaci e capaci di migliorare la vita dei cittadini o meno. Il 40 per cento dei cittadini italiani non sta bene: lo sapete, perché avete vinto le elezioni per questo; avete cavalcato tale situazione, agitando le loro paure e difficoltà. Penso ai temi della sicurezza, della disoccupazione giovanile, alle prospettive di reddito individuale o delle famiglie e alla maggiore inefficienza e inefficacia dei servizi pubblici legati ai Comuni o ai servizi sanitari. Al riguardo il Parlamento e la funzione legislativa hanno una responsabilità e, se non si danno le risposte, vuol dire che essi non hanno funzionato. Quando si mette mano a una riforma costituzionale, quindi, lo si fa con l'intento di migliorare la situazione. Salvador Giner, politologo brasiliano, qualche anno fa, scandalizzando l'occidente libero, scriveva che la democrazia non è la miglior forma di Governo in assoluto, ma è sicuramente quella che garantisce il miglior compromesso tra le libertà individuali e la sicurezza del cittadino. L'Europa democratica e liberale è fondata su questo modello democratico, per cui c'è il dovere di approfondire il tema in ambito parlamentare. Chiedo a me e a voi se questa volta si tratti solamente di un esercizio o di un tentativo vero, perché il contesto, cari colleghi, è assolutamente diverso. È palese che oggi i cittadini siano al limite: non hanno perdonato e non perdoneranno un ulteriore fallimento nella capacità di articolare risposte sulle grandi questioni sociali emergenti. Penso alla sicurezza, alla disoccupazione giovanile, al degrado delle città e al governo dei flussi migratori, su cui tutte le forze politiche - compresi noi che abbiamo governato in questi vent'anni - hanno gravissime responsabilità. Nel 1992 in Italia c'erano 52.000 immigrati: oggi, nel 2019, abbiamo 6 milioni di regolari e 700.000 di irregolari. Si tratta di un fenomeno epocale, che la politica non è stata in grado di governare e sul quale vanno date sicuramente risposte. Siamo inoltre all'indomani della bocciatura sonora di un referendum costituzionale, che ha dimostrato che i cittadini non hanno l'anello al naso
2019-02-21	FI	MallegniMassimo	Allo stesso tempo, però, Presidente, ci consenta una riflessione: lei purtroppo non esercita, in base all'articolo 95 della Costituzione, le sue prerogative. Lo sappiamo perfettamente che il 4 marzo è venuto fuori un risultato che non ha permesso la formazione di una maggioranza che potesse governare in funzione del risultato elettorale stesso e sappiamo bene che a giugno è venuto fuori un Governo che ha prodotto qualcosa di diverso da quello che gli elettori avevano deciso, cioè ha prodotto lei, signor Presidente del Consiglio. Che lei non sia nelle condizioni di poter svolgere il suo ruolo lo si vede dalle sue dichiarazioni, dalle sue prese di posizione, dalla questione del rapporto deficit -PIL della manovra economica (il 2,4 per cento invalicabile che poi è diventato il 2,04 andando in ginocchio davanti alla Commissione europea), dalla sua dichiarazione dopo l'approvazione della legge di bilancio: «il 2019 sarà un anno bellissimo», per chi ancora non l'abbiamo scoperto, sicuramente non per gli italiani. Ci dovevano essere meno tasse e non ci sono state, ci dovevano essere detrazioni per le imprese e non ci sono state, la disoccupazione galoppa e la produzione industriale cala dell'8 per cento. E allora a noi viene spontanea una domanda, che è simile a quella del collega Steger di poco fa. Noi vogliamo sapere se la manovra economica- bis, che l'altro giorno il sottosegretario alla Presidenza del Consiglio Giorgetti ha evocato, per poi rimangiarsela dopo qualche minuto, è una cosa che sarà all'attenzione del Parlamento, o se invece la scopriremo attraverso un tweet o un comunicato stampa. Come farete a sanare la questione dei 23 miliardi di clausole IVA per il 2020, visto che le azioni vanno messe in campo prima della fine dell'anno? Insomma, signor Presidente del Consiglio, io non voglio parafrasare colui che abbiamo detto aver svolto una funzione sbagliata nei suoi riguardi al Parlamento europeo. Però le dico: faccia il Presidente del Consiglio, eserciti i suoi ruoli e ci dica finalmente come stanno le cose.
2019-02-21	PD	MarcucciAndrea	Cosa voleva dire allora, sostenendo che sarà un anno bellissimo? A pensar male, in questo caso, forse si fa la cosa giusta: può darsi che stiate realizzando gli obiettivi vostri e di questa maggioranza, ossia avere un Paese più insicuro, con più disoccupazione e che va verso la decrescita felice.
2019-02-25	FI	BinettiPaola	Siamo sbalorditi dal fatto che, davanti al fallimento dei centri per l'impiego, davanti al fallimento di persone che non sono state in grado di aiutarne altre a trovare un lavoro, noi diciamo loro che le teniamo in servizio perché non possiamo licenziarle ma diciamo anche che non siamo affatto soddisfatti del lavoro che hanno svolto finora e quindi assumeremo qualche migliaio di navigator. Non si capisce, poi, navigatori per andare dove? Per andare tra Scilla e Cariddi, perché si sfracellino sul fronte o della povertà o della disoccupazione?
2019-02-25	FdI	LaPietraPatrizioGiacomo	Chi pensa che il reddito di cittadinanza possa dare una spinta all'occupazione dimostra di non conoscere né come funziona il sistema produttivo italiano, né, tanto meno, le regole del mondo del lavoro. La disoccupazione, cari colleghi, si combatte solo creando nuovi posti di lavoro e mettendo le aziende in condizione di assumere. Sarebbe stato, quindi, utile proporre politiche fiscali vere per chi assume.
2019-02-25	FdI	LaPietraPatrizioGiacomo	Potenziate i centri per l'impiego con 4.000 assunzioni. Ricordo comunque al Governo che si devono ancora stabilizzare i 1.600 assunti un anno fa. Assumete 6.000 navigator per indirizzare le persone alla ricerca di un lavoro e questi saranno gli unici posti di lavoro che riuscirete a creare; saranno gli unici posti di lavoro che questo provvedimento creerà. Se, poi, è vero che si parla di una potenziale platea di 5 milioni di persone che potrebbero richiedere il reddito, significa - vorrei fare una riflessione insieme a voi - che ogni navigator dovrà occuparsi di circa 800 persone: una follia. Profili diversi, situazioni diverse, esigenze diverse, criticità diverse, gestiti da persone che non avranno un formazione adeguata in riferimento ai tempi di attuazione, così brevi, e che non sappiamo ancora come e da chi saranno assunti. La ricerca del lavoro verrà fatta da chi ora sta cercando un lavoro, ma che da marzo verrà chiamato navigator; in questo modo non funzionerà, perché per trovare un lavoro ad altri bisogna avere competenze tecniche e conoscenze del territorio e del sistema economico di riferimento. Ma poi tutto è concentrato - permettetemi - su chi chiede lavoro, e non c'è niente su come saranno acquisite le richieste di manodopera. Come faranno i centri per l'impiego a sapere qual è l'offerta di lavoro delle aziende? Quale strumento si metterà in campo per sapere di che tipo di manodopera e, soprattutto, quale azienda ne ha bisogno? Di tutto questo non c'è traccia nel testo. Molte realtà non si rivolgono ai centri per l'impiego. In agricoltura, ad esempio, solo il 2 per cento delle aziende si rivolge a questo tipo di centri per cercare manodopera. Bene, cosa volete fare per convincere l'altro 98 per cento? Noi non lo vediamo in questo provvedimento e forse neanche voi lo sapete. Ma almeno lo sapete quanto guadagna un bracciante agricolo stagionale? Guadagna tra gli 800 e i 900 euro al mese. E voi ne date 780 a chi sta comodamente a casa aspettando che qualcuno al suo posto si adoperi per cercargli lavoro. E se una persona ha l'obbligo di accettare l'offerta, vi siete posti il problema che l'azienda non ha l'obbligo di accettare chi gli verrà mandato? Se una persona non verrà accettata da nessuna azienda per la sua incapacità, cosa facciamo? Come ci si dovrà comportare? In tutto questo, vengono dimenticati i giovani italiani disoccupati che, magari, non hanno i requisiti per ottenere il reddito di cittadinanza, ma hanno necessità di essere accompagnati al reinserimento lavorativo. Il problema della disoccupazione può essere risolto, oltre che con minor tasse e minor burocrazia per le aziende, iniziando da una politica integrata del sistema scuola-lavoro, con una politica apposita volta a formare figure professionali necessarie alle aziende: questa è la strada giusta. Invece, è stato proposto un testo inefficace, lacunoso, scritto in fretta (così da essere approvato prima delle elezioni europee) e che dà mance elettorali senza creare occupazione. Il reddito di cittadinanza è per noi una forma di assistenzialismo che aiuta immigrati e furbi, dimenticando i veri poveri, le famiglie numerose, gli invalidi, e i più deboli. In questo modo, gli unici che non verranno aiutati sono gli italiani onesti che hanno veramente bisogno. Fratelli d'Italia ha proposto decine di emendamenti per limitare i danni del reddito di cittadinanza e per migliorare quota 100. Abbiamo, però, trovato un muro di arroganza politica che non ha voluto nessun confronto concreto. Per questo siamo dispiaciuti: non perché non siano stati accettati i nostri emendamenti, ma per la nostra Nazione.
2019-02-25	LN	PizzolNadia	Il provvedimento oggi in esame si è reso necessario, alla luce degli effetti distorsivi della legge Fornero nei confronti del mercato del lavoro e dell'aumento della disoccupazione giovanile. Infatti, negli ultimi anni abbiamo assistito a un progressivo allungamento dell'età pensionabile per adeguarla alla speranza di vita dei lavoratori. La legge Fornero con il tempo è diventata una diga di contenimento a un grosso bacino di lavoratori anziani che la percepiscono con sempre maggiore insofferenza, in particolare nella pubblica amministrazione, dove il blocco del turn over e l'aumento dell'età pensionabile hanno aumentato l'età media dei lavoratori a cinquantacinque anni, un po' troppo elevata rispetto alla media europea. Per risolvere questo problema, si è già intervenuti con il provvedimento concretezza, per sbloccare il turn over e consentire un rapporto di uno a uno fra lavoratori in entrata e in uscita. Quota 100 continua in questa direzione e consentirà ulteriormente il ricambio generazionale attraverso l'assunzione di giovani in sostituzione di lavoratori che andranno in pensione. Nell'arco dei prossimi tre anni, si cercherà di far defluire da questo collo di bottiglia un certo numero di lavoratori anziani, così da rendere successivamente più agevole il raggiungimento del vero obiettivo che si è posto il Governo: quarantuno anni di servizio indipendentemente dall'età. Questo provvedimento sperimentale bloccherà momentaneamente l'adeguamento dell'età pensionabile alla speranza di vita e il primo scatto ci sarà soltanto nel 2021. Nel rapporto privato probabilmente non ci sarà un sicuro ricambio di uno a uno, ma si è voluto contribuire fornendo alle aziende un impulso positivo che può renderle più economiche, agili e più appetibili sul mercato del lavoro. L'opportunità di andare in pensione è stata già accolta favorevolmente da decine di migliaia di lavoratori in possesso dei requisiti e avrà un impatto positivo sul mondo del lavoro.
2019-02-25	M5S	GiannuzziSilvana	Oggi a noi italiani piace distinguerci gli uni dagli altri, ma perché non ci è stato lasciato molto altro, oltre la distanza che mettiamo gli uni verso gli altri, per consentirci di innalzare noi stessi. Questa componente culturale - che chiamerei «il piacere delle differenze» - si porta dietro, purtroppo, come suo logico compagno il disprezzo per l'altrui caduta sociale e come suo naturale corollario la disoccupazione indicata come colpa evidente e la povertà come destino meritato. Ma quanto è colpevole colui che non trova lavoro in un Paese in cui nessuno mai si è preoccupato di rendere evidente il lavoro? In quanta parte è responsabile per il suo destino un uomo inginocchiato nella depressione e nella rassegnazione all'interno di un sistema economico-produttivo dichiaratamente e matematicamente costruito a ingresso limitato? Ai nostri provincialismi si aggiunge poi una difficoltà oggettiva: che sia difficile e quasi innaturale per coloro che fortunatamente continuano a godere di protezione e benessere, in una società in cui povertà e disoccupazione crescono esponenzialmente, riuscire a figurarsi l'ombra infinita che intanto attraversa in quella stessa società chi è senza mezzi e senza lavoro; l'infinita sequela di umiliazioni e la conseguente discesa interiore fino alla certezza, in se stessi per primi, di essere indegni di benessere e meritevoli di fallimento.
2019-02-25	M5S	PellegriniMarco	Il reddito di cittadinanza cambierà radicalmente la situazione, perché non sarà solo un sussidio, ma verrà affiancato da un sistema efficiente e articolato di politiche attive del lavoro, incentrato sui centri per l'impiego. Come sapete, in essi è prevista l'assunzione di 4.000 nuovi operatori qualificati, che si aggiungeranno agli attuali 8.000 (che sono davvero pochini, se li confrontiamo con quelli di Francia e Germania, come ha detto poc'anzi il collega Romagnoli); altri 6.000 saranno assunti da ANPAL come navigator, che prenderanno in carico i beneficiari del reddito di cittadinanza per accompagnarli passo passo verso un nuovo impiego. Per diventare navigator occorrerà avere una formazione, quindi una laurea magistrale in economia, giurisprudenza, sociologia, scienze politiche, psicologia o scienze della formazione. Inoltre, altro aspetto molto importante, si realizzerà il sistema informativo unitario delle politiche del lavoro, che sarà collegato al sistema informativo unitario dei servizi sociali, il che permetterà di interconnettere tutte le banche dati esistenti, in modo tale che si conoscano formazione e competenze di ogni lavoratore, sì da incrociarle con le esigenze e le richieste delle aziende presenti su tutto il territorio nazionale. L'investimento complessivo nelle politiche attive del lavoro sarà di 2 miliardi nel biennio 2019-2020. Questi investimenti aiuteranno a colmare il gap che in questo settore esiste tra il nostro Paese e tutti gli altri Paesi europei e che è figlio delle politiche miopi dei Governi precedenti, che non hanno mai preso seriamente la questione delle politiche attive del lavoro. Come dicevo prima, noi del MoVimento 5 Stelle in campagna elettorale avevamo promesso di superare la famigerata legge Fornero, istituendo quota 100, favorendo il ricambio generazionale, liberando posti di lavoro per i giovani, rinnovando e migliorando le competenze della forza lavoro e quindi, in definitiva, avviando a soluzione quel conflitto generazionale che ha costretto centinaia di migliaia di ultrasessacinquenni a rimanere sul posto di lavoro e, nel contempo, altrettanti giovani alla disoccupazione o all'emigrazione. Manteniamo anche questa promessa in soli otto mesi di lavoro: l'avevamo promesso e lo stiamo facendo.
2019-02-25	M5S	PirroElisa	Ma parliamo dei numeri di questo provvedimento, visto che tante polemiche sono sorte intorno a questi. Si dice che sia una misura fatta a beneficio del Sud, ma in realtà il 47 per cento dei beneficiari vive al Centro-Nord. Il reddito è atteso da tutti, da Nord a Sud. Parlo ad esempio della mia Regione, il Piemonte, che ha subito molto più di altre aree del Nord la crisi degli anni passati; i tassi di disoccupazione sono ancora oggi per circa un terzo superiori rispetto a queste. Chi crede che al Nord il reddito vedrà poche richieste si sbaglia o vive in un altro mondo. Ovunque c'è bisogno di un sostegno che aiuti chi si è trovato in difficoltà, di centri per l'impiego efficienti e di figure in grado di aiutare nel percorso di riqualificazione. Per questo l'introduzione del reddito di cittadinanza è accompagnata dalla riforma delle politiche attive del lavoro che passa anche per l'assunzione di 10.000 nuove unità di personale presso i servizi per l'impiego.
