2019-03-27	FI	ToffaninRoberta	TOFFANIN, relatrice di minoranza. Grazie Presidente. Sappiamo benissimo tutti che in questo passaggio al Senato il «decretone» dovrà essere solo ed esclusivamente convertito in legge così come ci è arrivato dalla Camera dei deputati, ovvero blindato, pena la decadenza del decreto stesso e la conseguente fine del Governo giallo-verde. La forzatura è stata evidente a tutti i livelli, a partire dalla scelta di procedere per decreto pur in assenza dei requisiti - lo ricordiamo - di straordinaria necessità e urgenza, al ricorso alla fiducia alla Camera dei deputati per limitare la discussione e l'emendabilità del provvedimento e riuscire così a rispettare la scadenza dettata dalle norme relative alla conversione in legge. Vi è stata una forzatura persino nella comunicazione istituzionale effettuata attraverso la pubblicità in Rai. Dal 5 febbraio scorso si è venduto il reddito di cittadinanza come legge vigente mentre, in realtà, non è ancora legge, nemmeno in via provvisoria. Non solo si tratta di una comunicazione illegittima e non veritiera, a proposito di onestà e trasparenza, ma anche di una palese, inaccettabile svalutazione del ruolo del Parlamento. In sede di prima lettura, avevamo evidenziato come il testo presentasse carenze e ambiguità macroscopiche non solo formali ma anche sostanziali. In generale, le modifiche introdotte alla Camera dei deputati, numerose e complesse, tanto che gli articoli da 29 sono passati a 44 e le norme attuative da 24 a 38, impattano su un'operatività che è già stata avviata almeno dal 6 marzo scorso, generando delle criticità notevoli. In effetti, essendo stati modificati tra gli altri anche i requisiti e le condizioni per accedere al beneficio, sono state necessariamente introdotte delle norme transitorie all'articolo 13, comma 1- bis, ovvero per far salve le richieste presentate prima dell'entrata in vigore della legge di conversione, viene comunque riconosciuto il beneficio erogato per almeno sei mesi, pur in assenza di una eventuale ulteriore certificazione, documentazione o dichiarazione sul possesso dei requisiti. Quindi, a tutte le richieste accettate precedentemente alla conversione in legge del decreto, verrà in ogni caso corrisposto il reddito di cittadinanza per almeno sei mesi, indipendentemente dal fatto che i richiedenti risultino poi rispondenti ai requisiti. Ma questo è grave, vuol dire erogare il beneficio anche a chi, magari, non ha i requisiti necessari per richiederlo. Pensate forse che dopo averne certificato il diritto o meno, le somme erogate a titolo di reddito cittadinanza possano tornare indietro, se i richiedenti non posseggono i requisiti richiesti? Ma è una follia! Alla Camera dei deputati, il Gruppo Forza Italia ha presentato emendamenti migliorativi che sono stati però accolti solo eccezionalmente e in ridottissima parte: l'emendamento per cui si deve denunciare non solo il valore del patrimonio immobiliare posseduto in Italia ma anche quello posseduto all'estero, l'emendamento che specifica che il reddito di cittadinanza è compatibile anche con l'indennità di disoccupazione per i lavoratori con rapporto di collaborazione coordinata ed infine quello che prevede il termine entro cui adottare il decreto ministeriale che disciplina il contributo INPS a copertura dei periodi contributivi scoperti per i lavoratori in somministrazione. Altri emendamenti sono stati invece assorbiti, così come era successo in sede di prima lettura in Senato, per esempio l'aumento dei limiti del patrimonio immobiliare per i nuclei familiari con componenti disabili. Coerentemente con la nostra attenzione verso le fasce più deboli della popolazione abbiamo presentato fin dall'inizio degli emendamenti a favore delle persone con disabilità e dei nuclei familiari più numerosi, perché «il decretone» non lo prevedeva fatto. Tali richieste si sono tradotte, però, in modifiche insufficienti rispetto a quanto da noi ritenuto indispensabile; anzi, per i nuclei familiari numerosi non si è previsto proprio nulla, a parte un aumento della scala di equivalenza di 0,1 punto percentuale per i componenti con disabilità grave o non autosufficienti, ma è giusto un contentino, è ben poco. La maggioranza ha voluto di fatto essere impermeabile alle molteplici proposte migliorative della minoranza e non ha dedicato attenzione e risorse a coloro che ne hanno veramente bisogno, a quanti hanno difficoltà anche ad accedere all'iscrizione perché in effettive condizioni di disagio sociale e che questo provvedimento rischia invece di escludere. Altro che abolire la povertà! Finalmente alla Camera dei deputati è stato posto rimedio, anche su nostra sollecitazione, ad una grave lacuna preesistente, escludendo l'erogazione del reddito di cittadinanza a chi sia stato sottoposto a misura cautelare personale o abbia avuto condanne definitive nei dieci anni precedenti la richiesta, sempre che qualcuno in questa situazione non abbia già provveduto a fare richiesta del beneficio e, per via della norma transitoria che ricordavo prima, possa quindi percepire il reddito per i famosi sei mesi, salvo poi magari restituirvelo. Il provvedimento, da un lato, mira a sostenere i poveri, dall'altro, pretende di avviare i disoccupati alla formazione e all'inserimento nel mondo nel lavoro. Chi dovrebbe principalmente prendere in carico queste attività sono i centri per l'impiego e i Comuni, anche se i Comuni non sono pronti per le attività loro assegnate da questo provvedimento. Si tratterà infatti per loro di un onere enorme, che intaserà letteralmente la loro attività amministrativa e che dovrà essere fronteggiato con risorse proprie - già troppo scarse, soprattutto per i Comuni medio-piccoli - nei limiti delle risorse disponibili sul Fondo per la lotta alla povertà e all'esclusione sociale. Ma sapete quanti Comuni hanno a disposizione questi fondi e in che misura? Colleghi della Lega, preparatevi bene, ma molto bene, a spiegare tutto ciò ai vostri sindaci nel territorio perché lo dovrete giustificare: è troppo comodo, infatti, demandare compiti ai Comuni senza prevedere maggiori oneri per la finanza pubblica.
2019-03-27	LN	PizzolNadia	Il provvedimento oggi in esame si è reso necessario alla luce degli effetti distorsivi e devastanti della cosiddetta legge Fornero nei confronti del mercato del lavoro e dell'aumento sempre più preoccupante della disoccupazione giovanile. Negli ultimi anni abbiamo assistito a un progressivo allungamento dell'età pensionabile per adeguarla alla speranza di vita dei lavoratori. La legge Fornero col tempo è diventata una diga di contenimento a un grosso bacino di lavoratori da tempo in età pensionabile, che la percepiscono sempre con maggiore insofferenza, in particolar modo nella pubblica amministrazione, dove il blocco del turnover, abbinato al prolungamento dell'età pensionabile, ha aumentato l'età media dei lavoratori a cinquantacinque anni: un'età esageratamente elevata rispetto alla media europea. Al fine di ovviare a questo problema si è già intervenuti con il cosiddetto provvedimento concretezza che, sbloccando il turnover e consentendo un rapporto paritario fra lavoratori in entrata ed uscita, permetterà sicuramente un significativo e auspicato ricambio generazionale attraverso l'assunzione di giovani che sostituiranno i lavoratori che andranno in pensione.
2019-03-27	M5S	CatalfoNunzia	Quanto stiamo per approvare oggi in terza lettura - lo ripeto - è un provvedimento storico, doveroso e necessario per salvaguardare la coesione sociale di questo Paese. Si tratta di una misura che tanti altri Paesi europei hanno messo in atto da tempo e che viene proprio dall'esigenza di contrastare una situazione aggravatasi negli anni e precipitata durante la crisi economica internazionale che ha portato l'Italia a possedere il non invidiabile record del più alto tasso di incremento dei soggetti a rischio di esclusione sociale in Europa (un dato statistico che - di fatto - si tramuta in milioni di persone in povertà assoluta e in circa 10 milioni in povertà relativa). L'urgenza del provvedimento è confermata non solo dai dati ISTAT, ma anche e soprattutto dalle tantissime domande per accedere al reddito e alla pensione di cittadinanza che sono arrivate fino ad ora tramite Poste italiane e attraverso i Centri di assistenza fiscale (CAF). Per la precisione, gli ultimi dati di Poste italiane ci parlano di oltre 220.000 domande. Le domande presentate tramite i CAF, invece, risultano essere oltre 500.000. Le richieste arrivano indistintamente da Nord a Sud. Le città ove vi è un numero maggiore di richieste sono Milano, Torino, Roma, Napoli e Palermo. Si tratta di un provvedimento necessario anche - lo ribadisco - alla luce del pilastro europeo dei diritti sociali che all'articolo 14 statuisce: «Chiunque non disponga di risorse sufficienti ha diritto a un adeguato reddito minimo che garantisca una vita dignitosa in tutte le fasi della vita e l'accesso a beni e servizi. Per chi può lavorare, il reddito minimo dovrebbe essere combinato con incentivi alla reintegrazione nel mercato del lavoro». E appunto queste sono le finalità e la ratio del provvedimento, quindi perfettamente in linea con il pilastro europeo dei diritti sociali. Si tratta di una misura di sostegno al reddito, ma non solo: una misura proattiva collegata all'inserimento nel contesto sociale e lavorativo del cittadino, un grande investimento nei centri per l'impiego, nell'interoperabilità delle banche dati e nelle politiche attive del lavoro. Il reddito di cittadinanza costituisce dunque anche una grande innovazione delle politiche attive del lavoro e un importantissimo e necessario investimento nell'interoperabilità delle banche dati. Vengono, tra l'altro, istituite due piattaforme digitali propedeutiche al funzionamento della misura: il Sistema informativo unitario delle politiche del lavoro e il Sistema informativo unitario dei servizi sociali per il coordinamento dei Comuni. Queste due piattaforme formeranno un grande portale unico per permettere la comunicazione e lo scambio di informazioni tra Comuni, Centri per l'impiego, Agenzie per il lavoro, ANPAL, Ministero del lavoro e INPS. Il lavoro parlamentare ha permesso di perfezionare un testo che era già efficace. Gli emendamenti approvati, sia al Senato che alla Camera, mirano a facilitare ancor di più l'accesso al reddito e alla pensione di cittadinanza. Inoltre, vanno incontro ad alcune categorie che più di altre in questi anni hanno subìto la crisi e le politiche di austerity, come i pensionati, le persone diversamente abili e i cosiddetti working poor, ossia persone che pur lavorando guadagnano talmente poco da non potersi permettere una vita dignitosa. Illustro brevemente alcuni degli interventi introdotti nel corso dell'esame in Senato. È stata prevista la definizione di offerta congrua fatta a un percettore di reddito di cittadinanza, che dovrà prevedere una retribuzione di importo uguale o superiore al 10 per cento in più di 780 euro. È stato introdotto un tetto temporale di trentasei mesi entro il quale il datore di lavoro che licenzia un percettore di reddito di cittadinanza, che ha assunto e per il quale ha ricevuto il bonus, deve restituire l'incentivo. È stata data la possibilità di esonero contributivo anche in caso di assunzione di persone in contratto di apprendistato. È stata disposta, in caso di dimissioni volontarie, la perdita del beneficio solo e unicamente da parte del dimissionario e non da parte di tutto il nucleo familiare. È stata prevista una modifica delle sanzioni ai CAF in caso di trasmissione infedele delle pratiche. Si è introdotta la previsione secondo cui i datori di lavoro che non sono in regola con la legge n. 68 del 1999 sul collocamento dei disabili, che determina le quote obbligatorie dedicate ai disabili, non potranno godere dell'incentivo. Infine, è stato previsto che le competenze acquisite dai beneficiari del reddito di cittadinanza saranno registrate sulle piattaforme. Si tratta quindi di uno storico delle competenze acquisite dal beneficiario del reddito in precedenti esperienze lavorative o percorsi di formazione e istruzione, che andrà inserito nelle suddette piattaforme completandone il profilo. Nel corso dell'esame alla Camera è stato previsto che il reddito di cittadinanza assuma la denominazione di pensione di cittadinanza oltre che nel caso di nuclei familiari composti esclusivamente da uno o più componenti di età pari o superiore a sessantasette anni, anche nell'ipotesi in cui uno o più componenti del nucleo possiedano il suddetto requisito anagrafico e convivano esclusivamente con una o più persone in condizione di disabilità grave o di non autosufficienza. La Camera ha altresì elevato i limiti massimi del valore del patrimonio mobiliare con riferimento ai nuclei in cui siano presenti soggetti in condizione di disabilità grave o di non autosufficienza portando l'incremento da 5.000 a 7.500 euro per ogni componente in condizione di disabilità grave o di non autosufficienza. È stato introdotto, inoltre, uno specifico innalzamento del parametro della scala di equivalenza (fino a 2,2) per l'ipotesi in cui nel nucleo familiare siano presenti membri in condizione di disabilità grave o di non autosufficienza. Inoltre, nella nozione di stato di disoccupazione è stata introdotta la possibilità che rientrino anche i soggetti il cui reddito da lavoro dipendente o autonomo corrisponda a un'imposta lorda pari o inferiore alle detrazioni relative ai redditi da pensione o da lavoro. È stato previsto l'incremento di cento unità della dotazione organica degli ispettori della Guardia di finanza e un incremento di 65 unità del contingente di personale per la tutela del lavoro dell'Arma dei carabinieri. Sono state introdotte diverse altre modifiche che riguardano le assunzioni da parte di Regioni, Province autonome, agenzie ed enti regionali: per la precisione, un aumento della dotazione organica fino a 3.000 unità con decorrenza dal 2020 e fino a 4.600 unità a decorrere dal 2021 del personale dei centri per l'impiego. Le quote inoltre includono la stabilizzazione delle unità di personale reclutate mediante procedure concorsuali bandite per le assunzioni con contratto a tempo determinato. Sempre con riferimento alle modifiche operate dalla Camera all'articolo 12, si ricorda che le risorse finanziarie in favore di ANPAL Servizi SpA, inerenti sia alla selezione di soggetti e alla conseguente stipulazione di contratti di collaborazione per concorrere all'organizzazione dell'avvio del reddito di cittadinanza, sia alla gestione delle spese, sono state previste in 90 milioni di euro per l'anno 2019, 130 milioni di euro per l'anno 2020 e 50 milioni di euro per l'anno 2021. Si è precisato inoltre che la pensione di cittadinanza potrà essere ritirata alle Poste o in banca anche in contanti e non necessariamente essere caricata sulla carta del reddito. Numerose altre sono le proposte effettuate dai Gruppi di maggioranza e dai Gruppi di opposizione inserite all'interno del disegno di legge che quindi modificano il decreto: il passaggio parlamentare è stato quindi completo, consentendo di modificare il testo e migliorandolo laddove c'era possibilità di farlo o dove vi erano delle carenze. Reputo pertanto che il lavoro parlamentare sia stato svolto in modo efficace.
2019-03-27	M5S	PellegriniMarco	In buona sostanza, con il provvedimento in esame si compie il primo passo per risolvere quello spaventoso conflitto generazionale, che ha costretto migliaia di ultrasessantacinquenni a continuare a lavorare e che ha causato la disoccupazione o l'emigrazione di centinaia di migliaia di giovani. Grazie al provvedimento in esame, fortemente voluto dal MoVimento 5 Stelle, un milione di lavoratori nel prossimo triennio potrà anticipare la pensione fino a cinque anni rispetto ai requisiti della legge Fornero.
2019-03-27	M5S	PellegriniMarco	Per fortuna degli italiani, il MoVimento 5 Stelle è diverso, non dimentica gli impegni elettorali, anzi li mantiene, e in questo caso li tramuta in provvedimenti di legge in solo otto mesi di Governo. Il reddito di cittadinanza cambierà radicalmente la vita e il futuro di milioni di italiani che oggi soffrono, perché non sarà un sussidio assistenziale - come ancora oggi abbiamo sentito - ma sarà implementato da un sistema efficiente e articolato di politiche attive per il lavoro, basato sui centri per l'impiego che saranno finalmente messi in condizioni di ben operare anche grazie alle migliaia di nuove assunzioni di operatori, a cui si affiancheranno i navigator che prenderanno in carico i beneficiari del reddito di cittadinanza e li accompagneranno, passo dopo passo, fino al nuovo impiego. Inoltre, si realizzerà il sistema informativo unitario delle politiche del lavoro, che sarà collegato al sistema informativo unitario dei servizi sociali, il che permetterà di interconnettere tutte le banche dati esistenti, in modo che di ogni lavoratore si conoscano la formazione e le competenze, da mettere a disposizione delle aziende presenti sul territorio nazionale. L'investimento complessivo nelle politiche attive del lavoro sarà di circa 2 miliardi nel biennio 2019-2020. Questi interventi aiuteranno a colmare il gap che in questo settore esiste tra il nostro e gli altri Paesi europei, che è figlio di politiche del lavoro sbagliate dei precedenti Governi. A titolo di paragone, si pensi che nei centri per l'impiego di Germania e Francia lavorano rispettivamente 100.000 e 54.000 addetti: sono numeri enormi rispetto ai nostri attuali (8.000). Non è un caso che i tassi di disoccupazione di questi due Paesi siano del 5 per cento in Germania e dell'8,9 per cento in Francia, mentre in Italia in questo momento sono superiori al 10 per cento. A volte capita, infatti, che l'offerta di lavoro esista, ma che non venga soddisfatta perché non sono stati mai approntati strumenti per incrociare domanda e offerta. Basti pensare che, attualmente, i centri per l'impiego non comunicano tra loro e che, addirittura, alcuni sono sprovvisti di un proprio sito Internet. Ma tutto questo cambierà. La riforma strutturale che oggi approviamo definitivamente aiuterà a rimettere nel circuito della formazione e della ricerca attiva del lavoro anche una parte di quegli oltre 3 milioni di inattivi che, da anni, non cercano più fattivamente lavoro. E questo aspetto importantissimo della nostra riforma, ossia il previsto afflusso di questi scoraggiati e inattivi presso i centri per l'impiego, permetterà di rivedere al rialzo il tasso di partecipazione alla forza lavoro che, per il metodo di calcolo adottato in Europa, contribuirà alla crescita del PIL potenziale, il che migliorerà i conti pubblici. Del resto, oltre a queste considerazioni, ce ne sono tante altre di natura strettamente economica, che dovrebbero far riflettere chi, continuamente, parla di mercato, di liberismo e di crescita. Infatti, continuare ad avere 5 milioni di poveri, che inevitabilmente rimangono ai margini della società, costituisce un vero e proprio danno economico per l'intero Paese, perché questi nostri connazionali sfortunati non hanno potuto contribuire, fino ad oggi, al progresso e al benessere collettivo e, ad esempio, si sono ammalati in misura maggiore rispetto agli altri e quindi hanno usufruito in misura maggiore del Servizio sanitario nazionale, costituendo dunque un ulteriore costo per lo Stato. In definitiva, i vantaggi che porterà al nostro Paese il reddito di cittadinanza non li vede solo chi si copre gli occhi, perché non li vuole vedere. Per ciò che riguarda la famigerata legge Fornero, in campagna elettorale noi del MoVimento 5 Stelle avevamo preso l'impegno di superarla, istituendo la cosiddetta quota 100, favorendo il ricambio generazionale, liberando posti di lavoro per i giovani e, in tal modo, ringiovanendo e migliorando le competenze della forza lavoro.
2019-03-27	M5S	PellegriniMarco	Soprattutto, c'è chi, come noi del MoVimento 5 Stelle, vuole dare attuazione, dopo settant'anni, all'articolo 38 della nostra amata Costituzione, il quale statuisce che «i lavoratori hanno diritto che siano preveduti ed assicurati mezzi adeguati alle loro esigenze di vita in caso di infortunio, malattia, invalidità e vecchiaia, disoccupazione involontaria». Ripeto: mezzi adeguati alle loro esigenze di vita in caso di disoccupazione involontaria. La risposta a questo problema è nel reddito di cittadinanza e nelle politiche attive del lavoro, che noi oggi approviamo definitivamente.
