2019-10-30	PD	ZandaLuigi	Signor Presidente, dico subito che i senatori del Partito Democratico approvano la posizione del Governo italiano sull'aggressione della Turchia al Nord-Est del territorio siriano e ringraziano molto il ministro Di Maio per la ricca esposizione dei fatti con la quale oggi ci ha informato e ancor di più per la sua replica, politicamente più interessante. Se avevamo bisogno di altre conferme della denuncia di Papa Francesco sulla nuova guerra mondiale a pezzi che sta insanguinando il pianeta, è proprio la guerra in Siria a darcela. L'ultimo atto di questa vasta guerra, cioè l'invasione della Siria da parte del presidente Erdoğan, è stato reso possibile dalla decisione di Trump di ritirare le sue truppe dal Nord della Siria, così lasciando campo libero all'esercito turco e alle sue milizie criminali; difficile pensare che il ritiro e la successiva invasione non siano stati in qualche modo concordati. Questa è la verità, perché, senza il sostanziale lasciapassare degli Stati Uniti, la Turchia non si sarebbe certamente mossa. Le conseguenze dell'offensiva della Turchia in Siria sono note: stragi di civili e militari curdi, distruzione di decine di villaggi, assoluta insicurezza delle strade, impossibilità delle comunicazioni nel Nord-Est della Siria e, soprattutto, la prospettiva della spartizione di quel territorio tra la Turchia e la Siria, con la regia della Russia. Oggi noi, sentito il ministro Di Maio, siamo qui per cercare di interpretare politicamente fatti così gravi, comprenderne le implicazioni internazionali, inquadrarli nei possibili futuri scenari e, infine, per esprimere un'opinione sulla posizione del Governo italiano. Ho già detto di approvare la posizione del nostro Governo e a breve questo giudizio positivo sarà confermato dal voto dei senatori del PD in favore della proposta di risoluzione della maggioranza. Adesso mi preme tentare di allargare l'orizzonte e cercare di dar conto del senso geopolitico di quanto sta accadendo in Siria, come seguito della rivolta del popolo siriano contro la durezza del regime di Assad. Un tempo la letteratura mondiale chiamava "grande gioco" l'intreccio di guerre, rivolte, colpi di stato, sfide economiche di potenza, fatti di spionaggio e attentati sanguinosi che determinavano le rotture e le ricomposizioni degli equilibri nel quadrante di terre, straordinarie per storia, per cultura e per tradizioni secolari, che dalla Siria e dal Libano vanno verso il Pakistan e l'India, verso l'Iran e l'Arabia Saudita, verso l'Iraq e la Giordania, sino al territorio di quello che oggi è lo Stato di Israele. Da quando è iniziato questo grande gioco, cioè dall'Ottocento ad oggi, sono passati due secoli e nel mondo i rischi per la pace si sono moltiplicati. Tutti sappiamo quante, quali e quanto pericolose siano le tensioni in quel quadrante del mondo. Ma i rischi sono visibili ad occhio nudo nell'intero pianeta, non solo osservando la dinamica di quelle che noi chiamiamo riduttivamente guerre commerciali, ma pensando alle guerre vere e ai rischi militari. La Corea del Nord e l'Ucraina sono i due casi macroscopici, ma la verità è che oggi la guerra mondiale a pezzi, come la chiama Papa Francesco, vede in corso nel mondo una cinquantina di guerre locali e di focolai di guerra, mentre le Nazioni che posseggono la bomba atomica sono ormai una decina e non tutte danno sufficienti garanzie. Ebbene, nonostante il rischio che si scatenino guerre abbia dimensioni planetarie, la regione del pianeta dove maggiori sono le possibilità che gli equilibri militari ed economici si alterino sino a innescare scontri diretti tra le grandi potenze è proprio il territorio del grande gioco, che - lo ripeto - ha oggi un epicentro proprio in Siria. La Siria e la vasta Regione che la circonda sono troppo contigue all'Europa e all'Italia, troppo vicine ed hanno troppi interessi comuni con noi per non destare la nostra preoccupazione e per ben interrogarci su tutto quello che doveva essere fatto o non è stato fatto, chiedendoci in primo luogo se siamo uno degli attori o solo dei semplici spettatori degli eventi internazionali di quell'area. La prima domanda che dobbiamo porci riguarda il popolo curdo. Non solo l'Europa, ma il mondo intero deve ricordarsi che nessuna pace può essere duratura quando si basa sul tradimento e sull'umiliazione di un intero popolo. In questo caso sull'umiliazione e sul tradimento del popolo curdo.
2019-11-06	LN	CentinaioGianMarco	In seconda istanza, è vero, nessuno dice che siamo stati noi a far partire le esportazioni, ma molto semplicemente, in un momento di crisi economica, nel momento in cui si sono messe le sanzioni alla Russia e tutta una serie di Stati a livello europeo ha chiuso ai prodotti italiani, il prodotto italiano ha continuato a crescere, e non grazie al ministro Centinaio o a questo Parlamento o a quel Governo, ma grazie alle imprese italiane che vanno in Europa.
2019-11-07	FI	AimiEnrico	La situazione nazionale, ma anche quella internazionale, è aggravata oggi dalla presenza di due elementi di novità coi quali dobbiamo fare i conti: il primo è la tecnologia 5G e l'altro è rappresentato dai big data. Noi dobbiamo tenere in considerazione il fatto che si tratta di elementi di vantaggio e di sviluppo, ma possono diventare anche di criticità per i nostri dati sensibili. Ieri in 1ᵃ Commissione, dove sono stato invitato da alcuni componenti perché, pur non facendone parte, ero interessato all'argomento, si è parlato lungamente di ciò che sta accadendo. Vorrei ricordare che gli attacchi cibernetici, che comportano dei disastri non solamente perché vengono sottratti dati personali, ma anche dati estremamente importanti come quelli militari, hanno riguardato almeno per un quarto, cioè il 24,9 per cento, gli Stati Uniti d'America, per il 9,1 per cento la Cina, per il 5 per cento la Russia e allo stesso tempo anche il Brasile, per il 4 per cento la Germania. L'Italia non è non è stata esente da questo tipo di attacchi, quindi siamo di fronte a una situazione di estremo pericolo che dobbiamo valutare con grande serietà. L'Italia non può quindi prescindere da una concreta difesa, attraverso l'individuazione di un perimetro di sicurezza nazionale. Un tempo l'attore preminente nei conflitti, quando la politica aveva esaurito le sue parole e le carte bollate della diplomazia avevano finito la propria funzione, era la forza; oggi le nazioni sono rafforzate e fortificate dall'ottenimento di dati importanti, strategici, economici e - lo ripeto ancora una volta - militari, per questo abbiamo la necessità di approntare una difesa di questo tipo. Mi permetto di ricordare, infine, che dobbiamo dotarci di difese immunitarie efficaci sotto questo profilo, contro la penetrazione di multinazionali straniere che hanno le proprie radici anche in regimi illiberali. Proprio in questo momento, in cui anche a livello planetario assistiamo alla sfida globale tra due grandi superpotenze, gli Stati Uniti e la Cina, è compito nostro effettuare una scelta. Non possiamo rimanere nel girone degli ignavi, non possiamo rimanere tra color che son sospesi; dobbiamo scegliere da che parte stare e noi lo abbiamo fatto: quella della libertà. Noi siamo con l'Europa, anche se può non piacere nel suo complesso; un'Europa che può essere migliorabile, emendabile, ma siamo eurocritici e non euroscettici. Siamo all'interno della NATO e dobbiamo proteggerla, con le responsabilità che essa stessa comporta, anche di carattere militare. Noi siamo dunque dalla parte della democrazia e soprattutto della libertà e abbiamo fatto la nostra scelta di campo decisiva una volta per tutte. Credo che queste siano le ragioni per le quali è importante dotarci di queste difese. Spiegherà meglio il collega che interverrà in dichiarazione di voto quali sono le criticità che abbiamo osservato nel provvedimento in esame, soprattutto alla luce di alcuni nostri emendamenti importanti, che non sono stati accolti. Queste sono le ragioni per le quali, signor Presidente, ritengo che il Gruppo Forza Italia abbia fatto il proprio dovere anche su questo argomento nell'interesse dell'Italia e degli italiani
2019-11-20	FI	TiraboschiMariaVirginia	Signor Presidente, colleghi, ho stimolato varie volte il Ministro - come il Ministro ben sa - sulle questioni della finanza e anche la scorsa settimana, in sede di question time, le ho posto il relativo problema. Farò quindi riflessioni non sul decreto-legge in esame - anche perché non faccio più parte della Commissione ambiente e i miei colleghi lo sapranno fare molto meglio - ma sul comparto finanziario che non possiamo ritenere scollegato da una serie di misure da lei individuate all'interno del provvedimento e che certamente, se si attuassero, sarebbero da accogliere favorevolmente. Questo è sicuro, perché tutti conosciamo l'emergenza climatica. Ma temo che tutte quelle misure rimangano sulla carta. Sa cosa direbbero gli imprenditori? Direbbero: come cala lei, signor Ministro, a terra queste misure? È la domanda che gli operatori, quelli concreti, e gli imprenditori - appartengo a questa categoria - porrebbero a lei come Ministro. Nell'autunno del 2018 i climatologi hanno dichiarato che, per raggiungere gli obiettivi ambiziosissimi del Trattato di Parigi del 2015, dovremmo dimezzare l'uso dei combustibili fossili entro il 2030 e addirittura azzerarli entro il 2050. Questo per evitare che il riscaldamento globale del Pianeta salga di altri tre gradi entro la fine del secolo, provocando un danno che è stato quantificato dagli esperti - riporto quello che leggo su certe riviste - in 550.000 miliardi di dollari, ossia un danno che sarebbe molto, molto più grave di quello che è stato quantificato nel 2015 dal direttore della Bank of England in 20.000 miliardi, nell'ipotesi in cui bloccassimo le risorse di gas, di petrolio e di carbone. La prima domanda che a me viene - la pongo proprio a lei, signor Ministro, in qualità di componente del Governo - è la seguente: in un mondo che è dominato da Trump, da Bolsonaro, da Putin, dalle aziende petrolifere, dai grandi fondi di investimento, dalle grandi banche e dalle grandi compagnie di assicurazione, come si possono raggiungere gli obiettivi così ambiziosi indicati nel Trattato di Parigi? Io temo che sia estremamente complicato. È arrivato il momento in cui - secondo me - la politica dovrebbe dettare l'agenda alla finanza. È arrivato altresì il momento in cui il cambiamento climatico, di cui tutti noi ci riempiamo la bocca, deve essere necessariamente accompagnato da altri due tipi di cambiamento, che devono avere un profilo mondiale e planetario. L'ambiente è infatti un problema non solo dell'Italia e non solo dell'Europa, ma mondiale; quindi dovremmo anche affrontare i cambiamenti culturali e politici. È per questo che dico che la politica dovrebbe tornare a essere protagonista - non so quanto lo sia la politica italiana, ho dei seri dubbi - proprio per dettare l'agenda alla finanza. Un dato: nei tre anni successivi alla firma del Trattato di Parigi, il cui obiettivo era proprio quello di incoraggiare il mondo ad allontanarsi dai combustibili fossili, i prestiti delle più grandi banche, così come le assicurazioni - come lei sa, signor Ministro, devono per forza rilasciare le polizze per le grandi opere, e mi riferisco non solo agli oleodotti, ma anche alle opere estreme - sono aumentati in una maniera incredibile verso questo settore. La conclusione che io traggo è che tutto il comparto finanziario abbia una responsabilità enorme in termini di crisi climatica, pur conoscendo tutte le conseguenze della crisi. Prima le ho fornito un dato che è stato riferito dal Governatore della Banca d'Inghilterra. Analogamente, se lei fa un'analisi sulle compagnie di assicurazione, noterà che queste, fin dagli anni Settanta, avevano valutato i rischi connessi al clima, al punto che ritenevano che fosse estremamente rischioso andare ad assicurare dei territori, perché le polizze non sarebbero state sufficienti a coprire il rischio derivante dalle crisi climatiche. Un'altra riflessione: mi chiedo se - chiaramente dobbiamo andare per forza sul fronte internazionale - se ci sia qualche possibilità che la Chase, una delle più grandi banche al mondo, smetta di finanziare i combustibili fossili. Forse questo, signor Ministro, è praticamente impossibile, perché questa banca è diventata un colosso mondiale sotto la guida di Rockefeller, colui che ha creato la sua prima fortuna petrolifera statunitense fondando la Standard Oil Company. Dico questo semplicemente per porre in termini molto concreti un problema che ha così tante relazioni che io temo - ripeto - che quello che è stato scritto in questo provvedimento sul clima sia da ritenere come qualcosa scritto sulla carta ma estremamente difficile da attuare. In Europa ci sono dei casi virtuosi di banche: Crédit Agricole ha dichiarato che non avrebbe più fatto affari con aziende che espandono la loro attività nel settore del carbone e subito dopo delle banche giapponesi e di Singapore hanno seguito questo messaggio. Mi chiedo, allora, qual è il messaggio che la politica italiana dà alle più grandi banche del nostro Paese, come Intesa o Unicredit. Non lo so, perché non ho visto nulla in tal senso. Ministro, per molti cittadini è difficile abbandonare in maniera veloce i combustibili fossili, perché magari manca il tratto ferroviario che consente loro di poter andare a lavorare e, quindi, devono usare la macchina. E anche la politica delle micro-tasse, adottata in maniera coercitiva per affrontare da un punto di vista culturale il cambio di paradigma, che vede l'ambiente come elemento centrale, non so se sia la strada giusta. Se però si desse un segnale forte alle banche, credo che per i cittadini sarebbe molto più semplice cambiare e spostare il conto corrente magari verso gli istituti di credito più piccoli, quelli dei territori, che non investono certamente nelle aziende petrolifere. Un altro segnale importante chiaramente non può non arrivare dai grandi fondi di investimento. A me viene in mente BlackRock, che è la più grande società di investimento nel mondo. E lo dico per far capire che la portata di questo fenomeno non può essere nazionale, ma è internazionale. Si pensi che BlackRock, se fosse uno Stato, sarebbe il terzo più grande dopo gli Stati Uniti e la Cina. Quindi, basterebbe un messaggio di BlackRock agli azionisti, a quel mondo di persone che investono di investire nelle energie non fossili ma rinnovabili. In questo senso, non ho visto nulla di tutto ciò, nonostante l'amministratore delegato di BlackRock abbia partecipato a quel round table mondiale dove 150 aziende hanno detto che bisogna andare sempre più verso un equilibrio ecosostenibile e verso aziende etiche. Sa, però, cosa ha fatto l'amministratore delegato di quella società? Ha mandato a tutte le imprese una lettera in cui ha detto che il mondo delle aziende deve pensare non solo ai profitti dei propri azionisti, ma anche al benessere del Pianeta, e l'ambiente è sicuramente un tema centrale. Peccato, però, che poi continui a investire nelle aziende petrolifere. Colleghi, Ministro, dobbiamo renderci conto con obiettività di quanto sta succedendo anche al di fuori del nostro Paese. Se noi dirottassimo le nostre risorse verso le energie rinnovabili, probabilmente i quattro quinti della popolazione mondiale che stanno in Paesi che oggi devono pagare per importare le energie fossili sarebbero molto più contenti e se ne gioverebbero anche le economie. Si potrebbe elevare il valore della manifattura e di tutte le industrie ad alta intensità. Che cosa succederebbe, però, Ministro, in Paesi come l'Iran, l'Iraq, l'Arabia, la Russia, il Canada o l'Australia? Qualche dubbio lo avrei sulla loro sostenibilità economico-finanziaria che inevitabilmente vedrebbero abbassato il rating dei loro titoli di Stato. Quanto lei ha indicato nel provvedimento in esame penso rimarrà sulla carta e non sarà un insieme di azioni che concretamente aiuterà a raggiungere quegli obiettivi ambiziosi dei quali dobbiamo essere responsabili nei confronti delle future generazioni.
2019-11-20	FdI	NastriGaetano	Signor Presidente, il decreto-legge cosiddetto salva clima in esame si prefigge - almeno stando a quanto riportato nella relazione - di realizzare misure positive e concrete destinate a coinvolgere l'amministrazione a più livelli, al fine di realizzare obiettivi che - sempre secondo la relazione - sembrano poco concreti e molto vaghi, secondi i quali occorre realizzare un green new deal che comporti un radicale cambiamento di paradigma culturale e inserire la protezione dell'ambiente e della biodiversità tra princìpi fondamentali del nostro sistema costituzionale. Tuttavia, anche in questa occasione non si può non constatare come questo Governo, come quello precedente, abbia imposto anche in tema ambientale le sue politiche esclusivamente con degli spot. Francamente noi ci attendevamo di più, soprattutto in seguito alle dichiarazioni del ministro Costa che, rispetto all'approvazione del decreto-legge in esame, ha parlato di atto storico per la nostra Repubblica e, commentando il disastro di Venezia, ha affermato che servono scelte politiche coraggiose. Ebbene, signor Ministro, mi chiedo dove sia il coraggio nel decreto-legge in esame e quali scelte coraggiose siano state prese. La verità è che il provvedimento in discussione è l'ennesimo annuncio, un insieme di slogan, così come dall'inizio della legislatura ci ha ormai abituato soprattutto il MoVimento 5 Stelle. Pensate davvero di avviare il green new deal spazzando via le agevolazioni e mettendo le piante sui balconi delle case? Credete veramente che basti rifare le facciate dei palazzi? La verità desolante è che purtroppo in questo modo voi eliminate il bonus verde per trovare le risorse per rifare soltanto le facciate dei condomini. Forse questa sarebbe stata un'occasione importante per rispondere alle emergenze climatiche che sempre più spesso devastano le nostre città. Visto che bisogna mettere in piedi iniziative serie e concrete, mi chiedo se non sarebbe stato meglio ridurre le risorse del reddito di cittadinanza per investirle magari sulla prevenzione e sul contrasto al dissesto idrogeologico. Come il signor Ministro ben sa, proprio l'impotenza del nostro sistema a cui assistiamo quotidianamente - ancora oggi giornali parlano delle devastazioni climatiche - dà il senso dell'inadeguatezza non soltanto del decreto-legge in esame, ma forse anche dello stesso Esecutivo, che forse è sempre più succube del furore ideologico del MoVimento 5 Stelle. Da un lato, si blocca qualsiasi opera - come vediamo con quanto accaduto a Venezia col Mose - e, dall'altro, non si offrono soluzioni capaci di affrontare veramente le emergenze del Paese: lo abbiamo visto in economia e lo vediamo oggi anche sulle questioni ambientali. Scopriamo che vengono previsti soltanto 30 milioni di euro per il biennio 2020-2021 per gli interventi di riforestazione nelle aree urbane, che coinvolgono però gli enti locali e - guarda caso - non i singoli cittadini. Per entrare nel merito del provvedimento, inizio con i commi 5 e 6 dell'articolo 4 del decreto-legge. Inizialmente era prevista la semplificazione per l'espianto e il reimpianto degli alberi di ulivo ai fini anche paesaggistici. Sono poi stati eliminati all'ultimo momento senza alcun motivo. Questa decisione la dice lunga anche sull'attenzione di questo Governo soprattutto verso alcune zone del Meridione (pensiamo alla Puglia e allo stesso Salento). La tragedia ambientale e anche sociale e culturale, in considerazione degli enormi danni al patrimonio della città di Venezia - in questi giorni è sommersa dall'acqua e la laguna è ormai completamente devastata - imporrebbe e impone decisioni politiche rigorose, scelte forti, fermezza e lo stanziamento di importanti risorse che - secondo noi - questo Governo non è grado di realizzare. In sostanza, nel decreto-legge in esame - l'ho già detto in precedenza - si evidenzia un quadro normativo nettamente insufficiente rispetto alle reali esigenze del Paese. Signor Ministro, ricordo bene che la prima volta che si è presentato in Commissione era intenzionato a intraprendere relazioni vere e concrete per incentivare chi investe nel verde, specialmente in città. Tutto questo, purtroppo, non è stato fatto. Aggiungo, inoltre - come detto da altri colleghi - che anche l'ONU ha più volte evidenziato, da un lato, l'importanza di emettere meno CO₂ e, dall'altra, l'esigenza di creare delle realtà che potessero assorbirla. In Paesi come Canada, Cina e Russia sono state costruite apposite centrali, mentre in Italia non si parla di tutto questo. Non solo: si mette a rischio anche un comparto importante, che, oltre al verde, vale complessivamente 2,5 miliardi di euro e conta circa 100.000 addetti in 27.000 aziende. Stiamo parlando delle categorie del florovivaismo che - lo ricordo - rappresenta un settore di produzione di eccellenza del nostro Paese. Il valore della produzione delle aziende florovivaistiche rappresenta oltre il 5 per cento della produzione agricola totale. In sostanza, il decreto-legge in esame non ci soddisfa affatto, non affronta i danni e i dati drammatici dell'Agenzia europea che, soltanto poche settimane fa, ha stabilito per l'Italia un nuovo record negativo, quello di primo Paese dell'Unione europea per decessi prematuri di biossido di azoto, con 14.600 persone vittime dell'inquinamento atmosferico. È inaccettabile che, di fronte a una tale tragedia, non sia esperito alcun tentativo all'interno della maggioranza di fare qualcosa contro lo smog. Del resto, basta vedere le risorse stanziate nella manovra di bilancio 2020 in tema ambientale, che sono sicuramente risibili. Si tratta di misure e scelte di politica ambientale che vanno, in realtà, in senso esattamente opposto rispetto a quello che pensa Fratelli d'Italia. Basti vedere, a titolo esemplificativo, l'introduzione della cosiddetta plastic tax. Non è sicuramente questo il momento in cui discuterne, ma sicuramente lo faremo durante l'esame del disegno di legge di bilancio. Tuttavia, non possiamo non pensare che la plastic tax mette in mezzo alla strada circa 162.000 lavoratori. A dire questo sono non io, ma i dati de «Il Sole 24 Ore». Si tratta di una tassa - l'ennesima - che rischia di colpire gli stessi consumatori, penalizzati dall'aumento dei prezzi che ne deriverà. Sa qual è la beffa, signor Ministro? Dal 2021 la plastica monouso sarà bandita dall'Unione europea, il che conferma che la plastic tax serve soltanto per finanziare, alla fine, le politiche assistenzialistiche e i deficit di questo Governo. Altro che tassa contro la plastica per l'ambiente: fate tutto questo sempre per il cosiddetto reddito di cittadinanza. Affrontiamo in questa occasione l'esame di un impianto normativo che rappresenta per Fratelli d'Italia un provvedimento di bandiera, un testo che nel cui titolo si parla di necessità e urgenza ma, analizzando bene il suo contenuto, in pratica non dice nulla e soprattutto non fa nulla. Per quanto riguarda l'articolo 1 risultano del tutto trascurati i profili attinenti al raccordo, che non potrà verificarsi, tra il nuovo Programma strategico nazionale per il contrasto ai cambiamenti climatici e il Piano nazionale integrato. Vorrei poter citare nel breve tempo a disposizione che mi è rimasto - ma lo faremo nuovamente in dichiarazione di voto - gli articoli 2 e 7. Questo provvedimento sicuramente non ci soddisfa, perché è poverissimo di contenuto dal punto di vista degli interventi necessari al cambiamento - per noi era fondamentale - del paradigma culturale, indispensabile per l'avvio di qualcosa di completamente diverso. Sicuramente abbiamo utilizzato parole anglosassoni molto seducenti, che possono destare interesse e curiosità, annunciate dal Governo e presentate anche sui giornali e ai telegiornali in pompa magna, ma di fatto all'interno del provvedimento non c'è assolutamente nulla. Il giudizio di Fratelli d'Italia è sicuramente negativo. Per l'ennesima volta mi permetto di dire che prendete in giro gli italiani, soprattutto perché avevate annunciato, nell'ultimo anno e mezzo, che la povertà sarebbe stata sconfitta e che il 2020 sarebbe stato un anno bellissimo. Avevate assicurato che la vicenda dell'ex Ilva sarebbe stata risolta. Non vi abbiamo creduto allora e non vi crediamo sicuramente adesso. Lo stesso faremo oggi in quest'Aula per il decreto-legge in esame. Non avete avuto il coraggio di annunciare veramente qualcosa di importante e diverso. Avete annunciato il Green new deal giusto per dare qualche incentivo. PRESIDENTE. La invito a concludere, senatore Nastri. NASTRI (FdI). Avete parlato della rottamazione delle auto più inquinanti. Avete dato qualche migliaio di euro ai Comuni, che potranno spenderli per piantare alberi e potenziare le corsie riservate, e qualche incentivo ai negozi che allestiranno il banco per i detersivi alla spina. Fratelli d'Italia non sarà vostro complice in quella che altro non è che l'ennesima farsa giocata sulla pelle e sul futuro degli italiani. Signor Ministro, ci ha completamente deluso. Ci aspettavamo sicuramente qualcosa di diverso. Avremo poi il tempo per approfondire tutti quegli articoli che sono il vuoto assoluto.
2019-12-11	FI	MalanLucio	Le chiediamo poi una posizione appropriata sulla Russia, come hanno già detto i colleghi che sono intervenuti, perché abbiamo tutti l'interesse, in particolare l'Italia, a superare l'attuale situazione di contrasto tra l'Unione europea e la Russia, e le chiediamo di difendere gli interessi dei nostri cittadini nel Regno Unito.
