2019-07-17	FI	CanginiAndrea	Signor, Presidente, ci tenevo ad associare il nome del Gruppo Forza Italia e il mio personale al ricordo del maestro Camilleri. Egli è stato tante cose: uomo di teatro, uomo di televisione, uomo di cinema e letterato. È stato soprattutto un cantastorie, l'erede diretto della tradizione popolare dei cantastorie, che giravano per le fiere paesane, narrando storie più o meno avvincenti. Era questa probabilmente la sua cifra, la cifra di un grande siciliano, che ha fatto della "sicilianitudine" e della lingua siciliana, che è lingua nazionale, la propria cifra caratterizzante. È stato tra gli ultimi testimoni di quando la Rai era davvero la principale industria culturale del Paese. Si paragonava a Tiresia, l'indovino cieco che nell'Odissea indica la retta via ad Ulisse. Egli non aveva un buon rapporto con la nostra parte politica, non aveva simpatia per Forza Italia e non aveva simpatia per Silvio Berlusconi. Credo che proprio per questo sia nostro dovere rendere omaggio al suo talento, facendo di lui anche, tutto sommato, un modello non soltanto per la sua qualità letteraria, ma perché la sua biografia artistica ricorda a tutti noi che non c'è un limite anagrafico per scoprire e valorizzare una parte di sé. Camilleri è diventato il Camilleri a noi tutti noto all'età di sessantasette anni, quindi ha coltivato e ha continuato a coltivare il proprio talento letterario aspettando il momento che la storia gli riconoscesse i suoi meriti. Quel momento fatalmente è arrivato, perché il talento c'era e perché evidentemente ci sono stati anche quegli altri elementi che fanno del successo una realtà: la fortuna o, come diceva Federico II di Prussia, sua maestà il Caso. Fatto sta che Camilleri è entrato nel pantheon dei grandi italiani ed è nostro dovere e nostro piacere riconoscerne il genio. Camilleri è morto. Lunga vita al commissario Montalbano!
2019-07-17	LN	RomeoMassimiliano	Quante storie ci avete raccontato sullo spread, sugli interessi e quant'altro. Oggi questi argomenti non li avete più, tanto è vero che potete solo parlare della Russia, che è l'unico argomento che vi è rimasto disponibile, altrimenti non sapete cosa dire ai vostri elettori, non sapete cosa proporre.
2019-07-17	PD	FerrariAlan	Aggiungo che non permettiamo a nessuno di usare strumentalmente un fatto, soprattutto se non è accaduto, per deformare agli occhi dell'opinione pubblica l'opinione del Partito Democratico su un tema un tema così delicato come quello di promuovere iniziative a favore della protezione delle donne. Concludo dicendo che certamente mi sarei aspettato la stessa tempestività dal Gruppo Fratelli d'Italia in una settimana in cui si è discusso di una questione che lega la Russia al partito della Lega e sulla quale non hanno proferito nemmeno una parola!
2019-07-17	PD	StefanoDario	Ricordo a me stesso il primo stop, che è diventato un'operazione di grande camouflage (un'accortezza che potrebbe tornare utile magari in qualche viaggio futuro più avveduto in Russia), del deficit passato dal 2,4 per cento al 2,04: non si era mai data lettura del secondo decimale in nessuna Aula, non solo del Parlamento, non solo di una Commissione, ma di un qualsiasi istituto di secondo grado: una vera e propria creatura uscita fuori dalla Casaleggio e associati. Oggi, invece, abbiamo in Aula un pezzo della manovra correttiva che voi, maggioranza, voi, Governo, vi affaticate a non voler chiamare così. Ma è la stagione dei nomi nuovi; l'avete avviata più di un anno fa, quando il Governo inciucio è diventato «contratto di Governo»; quando il Presidente non eletto è diventato «avvocato del popolo»; quando i condoni hanno iniziato a chiamarsi «pace fiscale». Per cui, bando alle polemiche sull'attuale nominalismo. Oggi siamo davanti ad un provvedimento che fa parte di un insieme di misure adottate nell'ambito della negoziazione avviata dal Governo italiano con la Commissione europea in merito al rispetto della regola del debito pubblico e del patto di stabilità e crescita per l'anno 2018 e che, al momento, ci consente di dichiarare come scampata la procedura di infrazione nei nostri confronti per il 2019; mentre è bene ricordare che per il 2020 rimane sulla testa del Governo l'impegno ad una riduzione strutturale del deficit per rispettare le regole del patto di stabilità e di crescita. Ci troviamo, dunque, a votare oggi la conversione in legge di un decreto-legge, e prossimamente un disegno di legge che affondano le loro radici e le loro ragioni nella inesattezza delle previsioni, non solo del quadro macroeconomico ma anche di quello di spesa. A questa inesattezza si associa anche un severo errore di programmazione, che nei fatti si può leggere come una vera e propria resa incondizionata, come lo sventolio di una bandiera bianca. Il comma 4 dell'articolo 1 abroga, infatti, quelle norme della legge di bilancio 2019 finalizzate a destinare gli eventuali risparmi del reddito di cittadinanza e di quota 100, rispettivamente, a misure in favore delle famiglie e per l'assunzione di giovani. Con questa abrogazione il Governo archivia i sogni di gloria e ammette tutto il limite di una politica economica che non sta in piedi e non può stare in piedi solo grazie ai desiderata propaganda. Insieme a quella bandiera bianca da voi sventolata, consegniamo, infatti, anche quei due miliardi di euro congelati per migliorare i tendenziali di finanza pubblica. Quel che si vede emergere da questo vostro anno di gestione economica del Paese è una profonda difficoltà nell'affrontare i problemi reali, i problemi strategici, ai quali rispondete con una continua gragnola di annunci, che lasciano, come ben vediamo anche oggi, il tempo che trovano. Credo che non sia questo il modo di governare, tantomeno la base su cui innestare un circuito di crescita che - lo ricordo prima a me stesso - si basa sulla fiducia. La fiducia presuppone serietà e credibilità, che guarda caso sono proprio le prime vittime della vostra propaganda. Una propaganda che vede sempre più i Ministri di questo Governo impegnati a svolgere ruoli non propri alla loro delega e che creano confusione e disagio nel Paese. Credo che questo decreto-legge vi richiami alla dura realtà dei numeri. Spero che da oggi il vostro approccio al governo del Paese e al bilancio dello Stato cambi profondamente, perché stiamo giocando sulla pelle degli italiani.
2019-07-18	PD	MancaDaniele	Presidente Romeo, chiediamo la presenza in Aula del presidente Conte - e avremmo atteso con interesse anche la relazione del ministro e vice premier Salvini - non perché disponiamo di idee per il futuro del Paese ma, in modo particolare, per chiarire le relazioni tra l'Italia e la Russia. Non tocca a noi accertare se ci sono illegalità e irresponsabilità: tocca a un tribunale.
2019-07-24	FI	CraxiStefaniaGabriellaAnastasia	, che da mesi non fa altro che litigare su tutto, condannando il Paese alla paralisi, al declino e all'irrilevanza. Semmai avrebbe dovuto riferire oggi, in questa sede, sulla crisi di Governo in atto. Lei si stupisce, ma secondo alcuni la sua presenza qui oggi è funzionale a coltivare le sue ambizioni personali, indebolire il suo Ministro dell'interno e accreditarsi come l' homo novus di una nuova e diversa stagione. Signor Presidente, le istituzioni non sono un campo di battaglia e un terreno di conquista. Lo diciamo a lei e lo vogliamo ricordare a tutti noi, forze di maggioranza e anche a certa opposizione smemorata. Lo dico, perché si è invocata in questi giorni una Commissione parlamentare d'inchiesta sul Russiagate, ma voglio ricordare agli amici del PD che, se mai una Commissione d'inchiesta deve esserci, questa non può affrontare il tema dei finanziamenti esteri solo nell'arco temporale, nell'orizzonte e nella direzione di propria convenienza.
2019-07-24	FI	CraxiStefaniaGabriellaAnastasia	Ma che cos'è il Russiagate? Allo stato francamente è difficile dirlo, perché è nulla. Affermiamo questo non solo perché Forza Italia è oggi, come ieri, l'unica forza autenticamente garantista, che non ha mai agitato cappi, né tirato monetine.
2019-07-24	FdI	CirianiLuca	La posizione di Fratelli d'Italia su questo cosiddetto scandalo della Russia è molto semplice. Noi abbiamo a cuore l'interesse del nostro Paese e il fatto che la politica estera, sulla quale il Parlamento dovrebbe essere tendenzialmente sempre unito, non sia oscurata o macchiata da ricatti, da congiure o da altre questioni a noi non note. Con altrettanta chiarezza dobbiamo però dirle che la vicenda di cui abbiamo conoscenza ci appare onestamente come il copione di un film spionistico di serie B, con protagonisti alcuni personaggi di dubbia levatura, che non sapremmo come definire, se faccendieri, millantatori, gente spregiudicata, che comunque a me pare più in grado di mettere a repentaglio la propria sicurezza che quella del Paese.
2019-07-24	LN	RomeoMassimiliano	Non vi sarete mica dimenticati del compagno Mitrokhin e del famoso dossier sbianchettato, secondo alcuni membri dell'allora Commissione di inchiesta, per nascondere, forse, possibili finanziamenti dalla Russia a Botteghe Oscure?
2019-07-24	M5S	PatuanelliStefano	Quello che ho visto e che ho potuto capire anche dalle sue parole, signor Presidente, è che forse c'è stata una certa superficialità nel consentire l'accesso ad alcune persone, che hanno portato avanti in modo totalmente indipendente considerazioni e questioni che però hanno una ricaduta politica di un certo peso. Le sue parole finali, quando ha detto che dovrà attivare meccanismi di più stretta vigilanza rispetto alla partecipazione da parte degli invitati anche e soprattutto a consessi internazionali, credo diano un segnale giusto, che non vale soltanto per uno dei Ministri, ma certamente per tutte le persone che a tali consessi possono accedere. Parlo di superficialità, che molto spesso capita anche ad altri esponenti politici, soprattutto a quelli più in vista; può essere la presenza a una cena sbagliata o un selfie sbagliato: è capitato a tanti e potrà ancora succedere, ma quest'elemento non deve passare in secondo piano, perché - e mi riferisco ad alcune parole del presidente Casini - la ricaduta di questi accadimenti sul piano internazionale può essere di un peso rilevante. Voglio dirlo chiaramente: la mia forza politica ed io - e sono certo che lo faccia anche tutto il Governo - consideriamo il Patto atlantico e gli Stati Uniti alleati imprescindibili. Dall'altra parte, abbiamo partner commercianti come la Russia - e com'è stato per la Cina, quando abbiamo parlato della via della seta - con i quali è normale e giusto interloquire sul piano commerciale. È chiaro però che in questi consessi è l'interesse del nostro Paese, soprattutto economico, a dover essere portato avanti, certamente non altri, privati o di singoli soggetti. Non ruberò altro tempo, perché credo che molto sia stato detto. Voglio solo concludere con un riferimento alla Commissione d'inchiesta: ritengo che sia necessaria e sono molto contento che sia tutta la maggioranza a portare avanti la richiesta in tal senso. La Commissione dovrà certamente mettere in luce un sistema di finanziamento ai partiti senza limiti temporali, non c'è alcun problema; dovrà però trovare anche soluzioni e occuparsi delle fondazioni. Ritengo che questo sia un problema che dovremmo nuovamente affrontare e lo faremo certamente.
2019-07-24	PD	ParriniDario	Ma c'è qualcosa di più grave: lei trova normale che a provocare la presenza di Savoini alla cena con Putin sia stato il signor Claudio D'Amico, consigliere per le attività strategiche di rilievo internazionale del Presidente del Consiglio, ma anche socio in affari di Savoini e suo stretto collaboratore nell'Associazione Lombardia Russia? D'Amico è pagato dai contribuenti italiani con 65.000 euro di stipendio l'anno.
2019-07-30	FI	GalloneMariaAlessandra	A testimonianza di ciò è sufficiente provare a contare l'altissimo numero di procedure di infrazione ancora pendenti sulle nostre teste e che nessuno dei due Esecutivi è stato in grado di ridurre significativamente, ma noi confidiamo sempre nel Governo del cambiamento. Oggi, poi, con un Governo che ha come priorità quella di tenersi attaccato con lo scotch, abbiamo un'Italia calpestata, derisa e isolata nel contesto europeo, anche alla luce delle votazioni separate per la Presidenza della Commissione europea e che ancora non è riuscita a produrre una candidatura autorevole per un ruolo di Vice Presidenza della Commissione europea, che Forza Italia auspica fortemente per l'Italia, perché non avere neanche una Vice Presidenza sarebbe un'umiliazione che il nostro Paese francamente non merita. D'altronde, le recenti elezioni europee ci hanno consegnato uno scenario in cui le attuali forze di maggioranza sono e saranno assolutamente irrilevanti nel prossimo Parlamento. Tornando al tema dei nostri lavori, i distinti documenti in esame fotografano quanto è stato fatto e cosa l'Italia vorrebbe fare in Europa l'anno prossimo; un complesso articolato di norme all'apparenza generiche, che andrà invece a incidere concretamente, in maniera consistente e vincolante, sulle nostre attività economiche e sociali e, quindi, sulla vita dei nostri enti, delle nostre imprese e, a cascata, dei cittadini italiani tutti. Ci saremmo quindi aspettati un po' più di coraggio nell'apportare osservazioni e suggerimenti, soprattutto in tema ambientale, per realizzare quel new green deal efficiente ed efficace, alla luce del nostro essere tra i Paesi più preparati e più attivi in tema ambientale, nonostante la lentezza e la scarsa lungimiranza del Ministero e di questo Governo. Ciò avviene perché la viviamo dal punto di vista delle imposizioni e non dei benefici. Il lavoro di recepimento adeguato alle differenze tra Paese e Paese dovrebbe e deve essere il lavoro centrale del nostro Governo nelle interlocuzioni. Non abbiamo dubbi sul fatto che l'Unione europea sia necessaria - ha portato pace, stabilità e benessere - ma non può essere percepita esclusivamente come sistema di sole regole asettiche, come limitazione delle azioni dei Paesi membri che crea iniquità, bensì come una turbina per innestare un'accelerazione al motore economico e sociale di ogni singolo Stato. I dati e le statistiche parlano chiaro. Troppo spesso, anche da noi, l'Europa viene percepita come un'istituzione lontana, come altro da noi, mentre, al contrario, dovremmo sentirla come madre di ogni Stato e aggregatrice. Dobbiamo sempre tener ben presente la centralità della legge di delegazione, in quanto è costituita da una moltitudine di deleghe legislative che il Parlamento cede, trasferisce al Governo per adeguare l'impianto normativo agli atti europei. La normativa europea diventerà quindi legge in Italia e andrà a incidere su molti - forse troppi - settori, ma soprattutto - come dicevo - sulla vita quotidiana di tutto il sistema Paese. Ricordo a me stessa e a quest'Assemblea che in questo testo vi sono direttive che disciplinano, tra le altre cose: meccanismi di risoluzione delle controversie in materia fiscale, riduzione delle emissioni, attuazione dell'accordo sul lavoro nel settore della pesca, lotta alle frodi lesive degli interessi finanziari dell'Unione mediante il diritto penale, gestione dei rifiuti e quant'altro. A proposito della gestione dei rifiuti, non torno ancora una volta sulla questione dell' end of waste e della necessità di fare presto, presto, presto. È infatti ancora bloccato il riciclo dei rifiuti inerti da costruzione e demolizione, di pneumatici fuori uso, dei rifiuti da spazzamento stradale, dei RAEE, degli olii, dei grassi animali e vegetali, del tetrapak e di molto altro. Come vedete, stiamo parlando di temi centrali: giustizia, ambiente, industria, salute, economia, agricoltura, pesca. Milioni di italiani dovrebbero fare necessariamente i conti con queste nuove disposizioni. Tale è l'impatto di queste norme che si rende quanto mai indispensabile la celere individuazione di modelli che rendano possibile anticipare ex ante l'impatto di tale legislazione sul tessuto socioeconomico che lo subisce. È auspicabile, inoltre, che vi sia una decisa semplificazione nell' iter di formulazione delle direttive, perché la contemporaneità richiede risposte serie, in tempi brevi, alle sfide che il mondo ci impone. Forza Italia - lo sapete - è intimamente europeista e, quindi, è per noi impensabile votare in contrasto a direttive europee. È tuttavia giunto il tempo che cessi il ruolo di mero recepitore di decisioni altrui. Dobbiamo e possiamo essere più incisivi nella fase di elaborazione delle direttive, prevedendo un maggior coinvolgimento di associazioni di categoria, di parti sociali e, più in generale, di tutti gli attori interessati. È per questo che noi chiedevamo non soltanto il coinvolgimento dello Stato e delle Regioni, ma anche la partecipazione dei Comuni alle riunioni. Dobbiamo fare ciò per avere una negoziazione in sede comunitaria realistica, finalizzata a uno scopo, che deve essere quello del bene comune della nostra Nazione. È da questo tipo di meccanismi che l'Unione europea dovrebbe ripartire; da quello spirito iniziale che poneva il focus sui benefici da portare ai propri cittadini e non dall'essere un super Stato, che tende a regolare ogni aspetto della produzione e della vita. L'Italia, Paese fondatore, deve recuperare il ruolo centrale che le è stato assegnato dalla storia e anche dalla geografia, e non soltanto nei casi negativi dovuti alla sua collocazione al centro del Mediterraneo. Per noi questo percorso virtuoso dovrebbe iniziare smettendola di accusare l'Europa di tutte le nefandezze possibili. Lo abbiamo detto più volte: questa Europa non è perfetta, ma certamente rappresenta l'unica possibilità che abbiamo per contare qualcosa in un mondo dominato da giganti, quali gli Stati Uniti, la Cina e la Russia. Dobbiamo e possiamo incidere di più, ma per farlo è indispensabile regolarizzare i nostri rapporti con i partner comunitari, distendendo le relazioni, che oggi sono troppo tese con tutti. Si deve stravolgere il paradigma attualmente in voga e riprendere una normale dialettica politica, che deve necessariamente lasciare spazio a una più ampia condivisione di tutto ciò che riguarda l'Italia. Si deve rendere tale negoziazione in Europa pienamente legittimata e interamente funzionale, affinché le direttive vengano preventivamente costruite insieme e condivise e soprattutto adattate alle caratteristiche economiche e sociali di ogni Paese, per diventare indirizzi migliorativi e non penalizzanti; un protagonismo fertile, caratterizzato non da pericolosi atteggiamenti muscolari, ma da una seria e strutturata proposta politica, manifestata con una dialettica adeguata, per rendere la negoziazione in Europa pienamente legittimata, più forte, e far valere l'importanza delle differenze e valorizzare le nostre specificità. Per quanto espresso in questo mio intervento, con il rinnovato auspicio che le direttive europee derivino sempre più dal dialogo e dalla condivisione, nella precisa consapevolezza che l'Europa è formata da Stati con proprie caratteristiche peculiari, che devono essere rispettate, e con l'auspicio che l'Italia torni a essere protagonista, dichiaro il voto di astensione del Gruppo Forza Italia sulla votazione sul disegno di legge di delegazione europea e il voto contrario sulla relazione consuntiva e su quella programmatica.
2019-07-30	FI	GiammancoGabriella	Ci sono potenze come gli Stati Uniti, la Russia, la Cina, cui piacerebbe vedere un'Europa debole e divisa, sprovvista delle diverse risorse necessarie per poter svolgere adeguatamente il suo ruolo a livello mondiale. Al contrario, noi di Forza Italia riteniamo necessaria l'unità dei Paesi europei per potere fronteggiare sullo stesso piano queste grandi Nazioni.
2019-07-30	PD	GinettiNadia	Certo, ci dovrebbe dire il Governo come mai proprio gli alleati di questa maggioranza in sede di Consiglio europeo hanno votato contro la proposta di riduzione delle emissioni di carbonio entro il 2050. Di certo, la posizione del Partito Democratico è chiara; era scritta nella mozione che abbiamo proposto all'Assemblea, che voi avete bocciato, con la quale impegnavamo il Governo a dichiarare lo stato di emergenza ambientale e climatica, al fine di adottare subito misure concrete ed efficaci verso un green new deal di vero disarmo ecologico. È evidente, infatti, quanti cambiamenti climatici compromettano anche l'equilibrio economico e sociale nel mondo e determinino equilibri geopolitici. Noi, per questo, vogliamo l'Europa protagonista tra le grandi potenze, tra i nuovi giganti e i nuovi rapporti di forza, ma è evidente che questo orizzonte non appartiene alla maggioranza di Governo, che va esattamente nella direzione opposta. In particolare, ci sembra andare verso Est, verso la Russia; confine incerto che voi delineate tra politica estera, politica energetica e ipotesi al vaglio della magistratura, di fondi da corruzione internazionale. Ombre pesanti oscurano la credibilità del nostro Paese e minano l'indipendenza e la tenuta della nostra democrazia; ombre su cui questo Parlamento avrebbe diritto a un definitivo chiarimento da parte del ministro Salvini
2019-08-05	FI	AimiEnrico	Recentemente abbiamo avuto un altro allarme (è di qualche ora fa). È stata proprio l'Organizzazione delle Nazioni Unite a dire che probabilmente entro la fine dell'anno l'Europa subirà un altro attentato ad opera dell'ISIS. Se siamo dunque in queste condizioni, dobbiamo adottare il primo criterio importante della politica, che è quello della precauzione e della sicurezza. Se vogliamo davvero fare l'interesse del popolo italiano, dobbiamo guardare con grande attenzione a quello che potrebbe verificarsi anche qui. È vero che il califfato sta dando gli ultimi colpi di coda e che ormai è sconfitto, ma è altrettanto vero che ci sarebbero circa 10.000 foreign fighter pronti a rientrare, molti dei quali (almeno 3.000) in Europa, e cento - ci hanno indicato i Servizi segreti nella loro relazione - in Italia. Un numero esorbitante, se pensiamo al modo di agire di questi lupi solitari. Dobbiamo, allora, renderci conto di quello che stiamo facendo in relazione al controllo sui natanti in particolare, sui gommoni che arrivano, di questi che non sono naufraghi - ricordiamolo - ma trasbordati, che è cosa diversa perché noi siamo collaterali agli interessi degli scafisti. L'Italia, in questo momento, non è in grado di accogliere una persona in più; anzi, come dicevamo prima, dovremmo incominciare piuttosto a effettuare i respingimenti: 600.000 clandestini. Con questo ritmo - perdonatemi - se il Governo precedente con il ministro Minniti era arrivato a espellerne 18 ogni giorno, siamo al numero di 13 ogni giorno; il che significa che impiegheremmo, rebus sic stantibus, circa centoventi anni, un tempo molto lungo che sappiamo di non avere a disposizione, nonostante tutti gli auguri che possiamo rivolgere a noi stessi. Quindi, dobbiamo iniziare con un piano di interventi di espulsioni in un programma organico. Immaginate voi se altre Nazioni - penso all'Australia, agli Stati Uniti d'America, alla Russia, o a qualsiasi altra Nazione che pretende di avere una propria sovranità sul territorio - possano permettersi una politica come quella che stiamo facendo in Italia. Bene, quindi, i porti chiusi, ma iniziamo con le politiche dei respingimenti, altrimenti non avremo realizzato assolutamente nulla. Voglio poi ricordare ancora - rifacendomi a quanto abbiamo indicato, che alcuni colleghi che mi hanno preceduto hanno evidenziato a quest'Assemblea - che non si può disobbedire a un ordine delle Forze di polizia così come ha fatto Carola Rackete.
