2019-08-05	M5S	MarilottiGianni	La parola chiave per farlo accettare come desiderabile e politicamente corretto è stata l'introduzione del concetto di interdipendenza: Paesi ricchi e Paesi poveri risulterebbero complementari; gli uni desiderosi delle materie prime degli altri, gli altri delle tecnologie e del know-how dei Paesi dominanti. Interdipendenza! Quanta ipocrisia dietro la parola interdipendenza che tutte le forze politiche hanno ripetuto come un mantra per decenni nei loro programmi e che, ancora oggi, l'Unione europea pone alla base dei suoi rapporti con l'Africa. Noi sappiamo che l'interdipendenza può funzionare in un rapporto paritario. Ma, se i divari sono così evidenti, l'interdipendenza a senso unico produce soltanto subalternità. È ciò che è avvenuto in Africa a partire dai programmi della Banca mondiale e del Fondo monetario internazionale (FMI), che hanno imposto monocolture, latifondo e una industrializzazione forzata, orientando le economie di tali Paesi verso le esportazioni per recuperare i dollari necessari a ripagare i debiti contratti. Nasce da qui, oltre che per inseguire modelli di benessere e illusioni di crescita personale, il fenomeno migratorio moderno, accentuato dalle innumerevoli guerre che nella maggior parte dei casi sono il frutto dello scontro delle potenze dominanti per il controllo delle risorse energetiche e naturali del Continente africano. Se consideriamo oggi i due punti più critici da cui si origina l'emigrazione verso l'Italia, ossia la Libia e la Siria, ciò appare di un'evidenza lampante. Negli anni Novanta l'Unione europea, seppur tardivamente, con la Conferenza di Barcellona aveva intrapreso coraggiose politiche di cooperazione euromediterranea, premessa per un nuovo approccio col Continente africano. Tale Conferenza aveva avviato una politica di cooperazione fondata su tre pilastri: cooperazione per la pace, per la sicurezza e per lo sviluppo comune, ipotizzando perfino la realizzazione entro il 2020 di un'area di libero scambio. È stata una stagione ricca di speranze ma troppo breve, infrantasi dopo 1'11 settembre nel mutato quadro geopolitico e nei venti di guerra che ne sono conseguiti. Da allora l'Europa si è come ritirata, lasciando campo libero ai conflitti e alle sole forze che potevano gestirli - si trattasse degli Stati Uniti o della Russia - in contrasto coi fondamentalisti islamici. L'Unione europea si è ripiegata su politiche di vicinato, nell'illusione di negoziare accordi per contrastare le partenze dei migranti verso l'Europa e garantirsi contratti per il suo fabbisogno energetico. Non è un caso che, a partire dal terzo millennio, tutto il Mezzogiorno d'Italia, isole comprese, ma anche tutta la vasta area del Sud-Est del Mediterraneo hanno subito, a causa dei mutamenti geopolitici, un cambio di rotta che, da una prospettiva di cooperazione, si è tramutato in diffidenza e in pur legittime politiche di contrasto all'immigrazione incontrollata. Il problema che dobbiamo onestamente porci è, a parere mio, il seguente: tali flussi migratori potranno essere credibilmente contrastati solo con misure amministrative e di minuzioso controllo degli sbarchi? Non sarebbe più efficace che esse siano accompagnate da accordi bilaterali, ma, ancor più, multilaterali, nella prospettiva della promozione di progetti di cooperazione tecnica, scientifica, economica e di formazione che aiutino i popoli africani a interrompere l'esodo e a favorire occasioni di sviluppo economico e sociale? È sufficiente chiedere all'Europa una condivisione e una equa ripartizione dei migranti o non sarebbe molto più ragionevole pretendere che si riavviino quelle politiche euromediterranee colpevolmente abbandonate? Inoltre, data l'entità del fenomeno migratorio e al fine di contrastare lo sfruttamento da parte di organizzazioni criminali del traffico di esseri umani, non sarebbe molto più efficace istituire un'agenzia europea dell'immigrazione con sedi operative in Africa, per la migliore gestione del fenomeno per quanto riguarda sia i corridoi umanitari sia la politica dei rimpatri? Avviandomi alla conclusione, mi sono permesso di suggerire alcune linee d'azione in questo mio intervento perché il decreto-legge ci è giunto dalla Camera senza possibilità di essere emendato. Confido che esse possano essere prese in considerazione ed è con questo spirito, forse illusorio, che preannuncio, pur con le riserve di cui ho parlato, il mio voto favorevole.
2019-08-05	PD	FaraoneDavide	Dico questo perché nei giorni passati, prima che fosse approvato il decreto sicurezza- bis, è accaduto che l'ambasciatore russo Razov ordinasse al caro Matteo, ministro dell'interno, di non far manifestare nessuno nei pressi della Lukoil di Priolo. È bastato questo perché il Ministro dell'interno scrivesse al prefetto di Siracusa per dirgli di impedire qualunque tipo di assembramento nei pressi della Lukoil di Priolo, perché non doveva essere consentito a nessuno di manifestare e doveva essere data la possibilità a quell'azienda di poter operare, come se il diritto alla manifestazione e il diritto allo sciopero fossero sanciti dalla Russia.
2019-08-05	PD	FaraoneDavide	Parliamo di un altro Paese sovrano che ha ordinato a questo Paese sovrano di impedire lo sciopero e la manifestazione, negli stessi giorni in cui si scopriva che Salvini percepiva risorse economiche dalla Russia per pagarsi la sua campagna elettorale.
2019-08-05	PD	RossomandoAnna	Signor Presidente, colleghi, interveniamo ovviamente, in tema di pregiudiziale, sulla necessità, sull'urgenza e sull'emergenza. È già stato detto molto bene perché, stando proprio al rigore legislativo, non ricorrono i caratteri della necessità e dell'urgenza. Lo stesso Governo ci ricorda un giorno sì e l'altro pure che gli sbarchi sono diminuiti (il Ministro dell'interno dice per merito suo), ma stiamo al dato oggettivo. C'è un altro dato oggettivo, sono aumentati i morti: uno ogni otto migranti salvati. È un dato oggettivo. Però, come in questa sede si discute di scelte politiche, di priorità politica, il tema della necessità e urgenza ci riporta allora alle priorità. È evidente che la priorità non sono i numeri. Se parliamo di immigrazione, la priorità è il governo del fenomeno in Europa, con l'Europa e non isolandosi dall'Europa. Vorrei restare alle priorità: il padre di questo provvedimento, il ministro dell'interno Salvini, non ha avvertito con la stessa urgenza ed emergenza la necessità di venire a rispondere al Parlamento - rispettando questo luogo fondamentale della democrazia dove il popolo, che viene spesso evocato, ha eletto i propri rappresentanti - sul tema, che investe la sicurezza e la nostra collocazione internazionale, del cosiddetto Russiagate. Stiamo ancora aspettando anche con la mozione di sfiducia che abbiamo presentato, certi che in mancanza di questa il Ministro non verrebbe a riferire. Siamo appesi alle baruffe del Governo del baratto, che è una forma arcaica di contratto, ancora più rozza, e ad un Governo, che è politicamente finito, perché non sta dando le risposte alle emergenze del Paese e continua a produrre provvedimenti di propaganda. Restiamo però al tema del governo del fenomeno dell'immigrazione. Se c'è un'emergenza, o comunque un'urgenza, di governare questi fenomeni, perché la Lega, quando in Europa si vota per cambiare il Trattato di Dublino, è contraria, come i suoi alleati di Visegrad? Perché, quando ci sono i vertici in Europa sulle scelte di politica dell'immigrazione, il ministro Salvini non c'è, ma c'è la fotografia di una sedia vuota e, insieme alla fotografia della sedia vuota, c'è la foto del ministro Salvini su una torretta col filo spinato, che scruta trucemente l'orizzonte, insieme ad Orban?
2019-08-20	FI	BerniniAnnaMaria	Lei ha avuto diverse occasioni per dimettersi e anche recentemente - a giugno, se non sbaglio il 3 - ha avuto una giustissima impennata di dignità, quando, di fronte a due Vice Premier che non facevano altro che litigare, ha detto che, se avessero continuato, non avrebbe potuto fare altro che rassegnare le sue dimissioni. L'ho apprezzato e l'ho trovato molto dignitoso, nonché in linea con la sua caratura e il suo standing professionale e umano: le sue parole, però, signor Presidente del Consiglio, sono evaporate al sole, perché non l'ha fatto, almeno in altre due altre occasioni che hanno risuonato in quest'Aula. Ad esempio, non l'ha fatto in occasione del Russiagate, in cui una parte dell'Emiciclo che oggi l'applaudiva freneticamente era assente, cosa che in un mondo normale e in una politica normale significa crisi di Governo: se la sua maggioranza la abbandona in Aula, forse «Houston, abbiamo un problema».
2019-08-20	FI	GasparriMaurizio	Ci sono state vittorie e sconfitte, aggressioni mediatiche e giudiziarie. Non sto qui a rifare la storia, però gloriosa, con tante affermazioni e anche un prestigio internazionale, signor presidente Conte. Infatti, ricordo che allora con la Russia si parlava per portarla a Pratica di Mare a fare gli accordi con la NATO.
2019-08-20	FdI	LaRussaIgnazio	Caro Presidente, ti sei accorto con molti mesi di ritardo che chi ti stava seduto a fianco era incapace, irresponsabile, vacanziero, irrispettoso del Parlamento, nemico della Costituzione, irriguardoso verso i Ministri, irriguardoso verso il popolo, disertore della verità sul Russiagate, autoritario - non hai detto fascista, te lo sei risparmiato, ma quasi - usurpatore dei simboli religiosi, opportunista elettorale e animato da tornaconto personale.
2019-08-20	PD	MarcucciAndrea	Lo dobbiamo ricordare e l'ho già detto al senatore Salvini: non so assolutamente se egli ha delle responsabilità penali rispetto ai collegamenti con la Russia, agli affarucci che sono stati ricercati, alle supposte tangenti, se ci sono. Non lo so e non è il mio compito stabilirlo, ma egli aveva il dovere di informare il Paese e il Parlamento e non l'ha fatto.
2019-08-20	PD	MirabelliFranco	Questo Governo non è stato nulla di tutto ciò, non è stato all'altezza. D'altra parte, non può esserlo alcun Governo con Matteo Salvini che occupa il Ministero dell'interno per fare una permanente campagna elettorale e umilia le istituzioni non venendo qui a spiegare le cose che gli chiediamo sul Russiagate, oppure non venendo qui o in Commissione antimafia a spiegare che politiche sta facendo contro la mafia e come risponde su altri casi che hanno coinvolto il suo partito. Matteo Salvini è venuto qui soltanto in un caso, soltanto una volta, a chiedere l'immunità parlamentare per evitare di essere processato sulla vicenda della nave Diciotti.
2019-08-20	PD	RenziMatteo	Il punto però è un altro: nell'uno e nell'altro caso, ministro Salvini, faccia chiarezza sulla vicenda dei rapporti con la Russia.
2019-09-10	LN	RomeoMassimiliano	Vogliamo poi pensare ai 14 voti che sono stati determinanti per l'elezione di Ursula von der Leyen, la famosa rigorista che indubbiamente non c'entrava nulla con la politica di sfida all'Europa iniziata col Governo gialloverde? C'è stata poi l'elezione di Sassoli come presidente del Parlamento europeo e del vicepresidente Castaldo; ancora, pensiamo alla richiesta da parte del Partito Democratico affinché sul presunto Russiagate venisse a riferire in Aula qui al Senato non Salvini, ma il presidente Conte: il che vuol dire che certi ammiccamenti c'erano già prima, visto che lo stesso presidente Conte poi è venuto in Aula, acconsentendo subito alla vostra richiesta.
2019-09-10	PD	ZandaLuigi	Signor Presidente, il nuovo Governo Conte nasce dalla crisi dello scorso agosto, voluta dal senatore Salvini. Sul piano politico l'ha aperta immaginando grandi profitti elettorali e per se stesso i pieni poteri. Sul piano personale, invece, hanno probabilmente pesato i viaggi del suo ex portavoce in Russia, dove, come sappiamo, nulla accade all'insaputa di Putin. Salvini conosce tutto questo e ne ha tenuto conto.
2019-09-25	PD	AlfieriAlessandro	Signor Presidente, esprimo il voto favorevole del Partito Democratico ad un accordo che, leggendo il titolo, può sembrare di minore importanza, ma che in realtà è lo strumento principale di collaborazione e cooperazione fra i Paesi dell'Unione europea nella sua interezza e l'Armenia. Si è dovuti ricorrere a tale accordo per ovviare al fatto che l'Armenia, trovandosi all'interno dell'Unione economica eurasiatica, e quindi in una cooperazione rafforzata con la Russia, la Bielorussia, il Kazakistan e il Kirghizistan, non permetteva di utilizzare strumenti di accordi di libero scambio ampi e approfonditi, quelli classici di cui in sostanza l'Unione europea si avvale. L'accordo è quindi importante e, insieme agli strumenti bilaterali che abbiamo con l'Armenia, permette di rafforzare i rapporti, che sono proficui, dal punto di vista economico, sociale ed anche culturale. La settimana scorsa la Commissione affari esteri, emigrazione del Senato ha incontrato il Presidente della Commissione affari esteri dell'Assemblea Nazionale della Repubblica di Armenia accompagnato da una delegazione. Da questo punto di vista, quindi, è bene ratificare anche uno strumento come questo, che ci permette di collaborare con quell'area, con cui ci sono rapporti molto intensi, ma c'è anche una relazione privilegiata nei confronti della Russia. Guardando con favore a tale strumento e al lavoro che si potrà fare con l'Armenia, esprimo il parere favorevole del nostro Gruppo.
2019-10-08	FI	FerroMassimo	Signor Presidente, la settimana scorsa a Verona è venuto a mancare l'onorevole professor Valentino Perdonà, classe 1915, centoquattro anni di età; era il più longevo degli ex parlamentari. È mancato a Verona, sua città di origine. È stato deputato per la Democrazia Cristiana per ben quattro legislature, la seconda, la terza, la quinta e la sesta. Veniva da una famiglia modesta, composta di dodici figli. Non poté completare la maturità magistrale perché non avevano risorse in casa e prese la maturità andando a scuola di sera; nel 1934 consegue anche la maturità classica. Si laurea in lettere all'Università di Padova e durante la guerra, tra il 1942 e il 1945, consegue la seconda laurea in giurisprudenza presso l'Università di Bari, durante il servizio militare. Conseguirà altresì la terza laurea in farmacia all'Università di Parma nel 1948. È sotto le armi durante la Seconda guerra mondiale come ufficiale di fanteria. Passerà sei anni sotto le armi, alcuni dei quali sul fronte occidentale, altri in Russia e in Jugoslavia. Dopo l'8 settembre aderisce al Corpo di liberazione nazionale. Terminata la guerra, si dedica all'insegnamento in varie scuole superiori della provincia di Verona, fino ad arrivare ad essere prima vice preside e poi preside di un istituto magistrale. Ma la politica era la sua vera passione. Ha sempre, fino all'ultimo e con assoluta coerenza, ispirato tutta la sua azione politica alla dottrina sociale della Chiesa: presidente provinciale dell'Azione cattolica, eletto consigliere comunale e poi assessore del Comune di Verona, dal 1954 al 1980 è ininterrottamente presidente dell'Unione Comuni veronesi. È stato sindaco del Comune di Soave dal 1956 al 1970 e dal 1970 al 1985 consigliere comunale di Caldiero, paese dove ho ricoperto il ruolo di sindaco. In Parlamento, durante le sue quattro legislature, fu componente delle Commissioni istruzione, finanze e bilancio. È stato altresì il primo presidente dell'Unità sanitaria locale dell'est veronese e, fino a pochi anni fa, componente del consiglio di amministrazione della Cattolica assicurazioni. Era un galantuomo con la schiena dritta, intransigente con se stesso ma anche con chi si trovava a collaborare con lui. La fedeltà agli insegnamenti della dottrina sociale della Chiesa era la linea guida che ispirava tutta la sua azione politica. Con il professor Vecchiato contribuì alla nascita dell'Università di Verona, appoggiando con convinzione l'Istituto superiore di scienze storiche «Ludovico Antonio Muratori». Se posso riassumere in poche parole tutto ciò che è stato l'onorevole Valentino Perdonà direi che era un uomo dalla fede incrollabile, aveva un altissimo valore della famiglia, riconosceva un'importanza fondamentale allo studio e credeva nell'impegno personale per far andare meglio tutte le cose. Grazie, onorevole Perdonà, per quanto hai fatto al servizio delle istituzioni, della nostra città e della nostra Provincia. Grazie, Presidente, per avermi dato l'opportunità di ricordarlo.
2019-10-09	FI	PerosinoMarco	Bisogna allora togliere di mezzo questa mentalità, che cerca di estrinsecarsi in attività persecutorie. Credo che sia necessario, anche nella prospettiva della legge di bilancio, dare uno shock all'economia, che restituisca voglia e libertà di intraprendere. Troppe regole fiscali, nella loro complessità, si prestano ad interpretazioni; invece, se si consolidano, danno tempo all'economia di assestarsi e di produrre i suoi effetti, di lavorare e creare quella ricchezza che giustamente vogliamo redistribuire. Le scelte dell'Italia, in presenza del mastodontico debito pubblico, ci costringono purtroppo ad avvitarci su di esso e allora, quando andiamo in Europa, indipendentemente dal tipo di trattativa, siamo già più deboli. Occorre forse cambiare mentalità e - ripeto - dare uno shock. Al Sottosegretario presente in Aula, dal quale ho sentito nei giorni scorsi dichiarazioni sensate, dico che nel bilancio c'è un sacco di residui di impegni per opere e stanziamenti non attuati e non realizzati. Una bella pulizia che punisca chi è stato inattivo - perché non ha senso che rimangano fermi dei fondi per anni - costituirebbe secondo me già una finanziaria (così si chiamava una volta) di tutto rispetto. C'è poi la questione dell'IVA, per cui sono stati sterilizzati la clausola di salvaguardia e quindi l'aumento per il 2021, anche se mi pare di aver capito che sarà attuata, seppur dimezzata, negli anni successivi del pluriennale. Abbiamo poi sentito parlare di rimodulazione e di aumenti selettivi, che mi preoccupano non poco, anche se ieri il Ministro ha detto che forse non ci sarà aumento. Agire sull'aumento dell'IVA ha un effetto inflazionistico, come ci insegnano i padri dell'economia sin dalla sua introduzione nel 1973, quando si diceva che essa ha un effetto inflazionistico per sua natura. Oggi ricerchiamo l'inflazione. Anche Draghi e la BCE, dopo averla perseguita e punita per anni, hanno capito che un'inflazione - che anni fa, in base a vecchie teorie economiche, era considerata fisiologica fino al 2 per cento - oggi molto più bassa, in presenza di interessi più bassi, avrebbe un effetto positivo. Non sono favorevole, perché complicherebbe la vita e porterebbe ad una diminuzione dei consumi, ma proporrei comunque al Governo, che poi deciderà come fare, una forma di ricerca di un tasso di inflazione entro i limiti fisiologici, ma con qualcosa in più, che aiuti a ridurre il debito. Ho sentito parlare di ecobonus, che saranno materia della legge di bilancio, nella misura di 1.500 o 2.000 euro secchi, come credito fiscale o in altra forma, per la rottamazione dei veicoli fino ad euro 4. Se è una misura sostenibile - e a mio avviso lo è - la giudico una norma positiva. Ho sentito parlare di revisione catastale, di cui però non c'è più traccia, perché lo stesso Sottosegretario qui presente ha dichiarato in televisione che non se ne parla e consiglierei di non parlarne. Sarebbe bello fare la revisione catastale, ma in questi tempi assistiamo ad aste di immobili, per azioni intentate dai creditori o dalle banche, che vengono assegnati a cifre irrisorie. Con l'eccezione del centro di Roma e di altre grandi città e alcune località turistiche, nel resto d'Italia purtroppo il mercato immobiliare è di nuovo - o forse lo è sempre stato - in forte crisi. Devo purtroppo avviarmi alla conclusione del mio intervento. Della revisione della spesa parliamo da tempo: possibile che non l'abbiamo fatta o che non sia fattibile? Troppa revisione e troppa competitività portano, però, ad un calo della qualità e a ritardi nell'esecuzione dei lavori. A mio avviso occorre usare la più ampia discrezionalità. Signor Sottosegretario, cosa dite poi delle trivellazioni per l'estrazione di gas in Puglia, che non effettuiamo, ma che lasciamo effettuare ai greci, che succhieranno anche il nostro gas e ce lo venderanno ad un prezzo molto caro? Cosa diciamo dei dazi statunitensi alla Cina, senza citare i dazi europei alla Cina, che già esistono? Se essi possono arrecare danni - anche se, a mio avviso, nella perequazione del mercato, non ce ne saranno - essi potrebbero però essere compensati dall'eliminazione delle sanzioni alla Russia. Cosa dite degli interessi negativi sui depositi e anche sui mutui (una banca danese ha iniziato a stipulare mutui a tassi negativi)? Come faranno le banche ad avere dei bilanci che abbiano ancora dell'utile e a non avere problemi? Ciò detto, occorre una visione generale, a mio avviso liberale e contemperata dalle giuste esigenze ambientali (oggi molto di moda, ma reali), se realistiche, e redistributive, secondo la dottrina sociale della Chiesa. Bisogna però produrre ricchezza, per dividerla, mentre qui mi pare che, purtroppo, dividiamo i debiti e la povertà. Questi sono i consigli di un senatore, affinché se ne tenga conto nella legge di bilancio.
2019-10-16	FdI	FazzolariGiovanbattista	Soprattutto, purtroppo, non ci si può improvvisare Ministro degli affari esteri, perché, con tutto il paterno affetto per un ragazzotto che prova a fare bella figura alla Farnesina, le questioni sono un po' più complesse. Conte, per favore, mi ascolti perché è una questione importante. Noi abbiamo scritto in un decreto del Governo che l'Ucraina è un Paese sicuro, ma lei si renderà conto che non possiamo fare questa affermazione e contestualmente mantenere le sanzioni contro la Russia per l'invasione dell'Ucraina, lei se ne renderà conto: un domani sui tavoli internazionali si rischia che la Russia o qualunque altro Paese portino all'ONU o in qualunque contesto internazionale il decreto di un membro NATO e dell'Unione europea che scrive nero su bianco che in Ucraina non c'è nessuna guerra. Non si può fare, per favore, lei si scusi a livello internazionale e dica che purtroppo c'è uno stagista alla Farnesina che sta imparando il suo lavoro e che ha sbagliato, e che quindi l'Ucraina verrà tolta dall'elenco degli Stati sicuri.
2019-10-16	LN	RomeoMassimiliano	Eppure, quando si trattava di sanzionare la Russia per la vicenda ucraina, tutti correvano in quella direzione, mentre per quel che riguarda la Turchia qualche problemino c'è e adesso vi spiego il perché.
2019-10-16	LN	RomeoMassimiliano	Quello è solo un grande bluff, lo hanno capito tutti. Sul tema della Turchia abbiamo sentito grandissimi interventi, importanti e belli, pieni di indignazione, in cui si è detto che bisogna condannare e fermare la guerra. Esponiamo pure tutti gli striscioni e tutte le bandierine della pace possibili e immaginabili, ma è con i fatti che si ottengono i risultati. Da quello che abbiamo letto sui giornali, di fatti c'è l'embargo militare nei confronti della Turchia, però per le sole forniture future e non per quelle esistenti, e quindi già questo è un limite clamoroso. Sapete cosa farà Erdoğan? Chissà come sarà spaventato da questa misura, visto che già da un po' di anni sta aumentando la produzione interna di armi e che, nello stesso tempo, avvicinandosi alla Russia e ad altri Paesi, le comprerà semplicemente da qualche altra parte; gli facciamo un male tremendo, quindi.
