2019-01-30	PD	AlfieriAlessandro	Davanti a questa situazione così maledettamente complicata noi dobbiamo dire da che parte stiamo; non si può tentennare: o si sta dalla parte di Russia, Cuba e dei loro amici o si sta dalla parte della comunità internazionale e delle democrazie liberali.
2019-01-30	PD	AlfieriAlessandro	È vero o non è vero, signor Ministro, che, dopo le elezioni del maggio 2018, elezioni contestate con forza dall'Unione europea per l'assenza di osservatori internazionali, vi eravate trovati al Consiglio affari esteri e avevate detto in maniera netta che bisognava prendere misure restrittive, mentre al contempo la Russia - che sembra essere diventata un punto di riferimento di una parte della maggioranza - riconosceva Maduro, gli faceva i complimenti e lo invitava al Cremlino? È vero o non è vero che a dicembre, quando lei ha appoggiato con il suo autorevole parere, il parere del Governo italiano, le misure dell'alto rappresentante dell'Unione per gli affari esteri e la politica di sicurezza Mogherini per la conferma dell'embargo delle armi al Venezuela, nonché le misure restrittive nei confronti di 18 personaggi del Governo di Maduro - gli stessi responsabili delle repressioni nei confronti delle manifestazioni legittime e democratiche dell'opposizione - nello stesso momento Mosca inviava due bombardieri strategici Tupolev 160 a Caracas? E nel momento in cui, a gennaio, la Mogherini riconfermava la sua preoccupazione per la situazione in Venezuela, «Reuters» e «The Guardian» pubblicavano articoli in cui dicevano che mercenari russi legati al gruppo Wagner arrivavano al fianco di Maduro in Venezuela.
2019-02-12	FdI	UrsoAdolfo	Noi stiamo con le Nazioni libere e democratiche, non con i dittatori e gli Stati autoritari, che per loro interesse petrolifero acquistano dal Venezuela a basso prezzo il petrolio, che va in Cina, in Russia e tra breve andrà in Turchia. Il dittatore si sta comprando il voto e il veto di quei Paesi e sta vendendo la libertà del proprio popolo. Sono denutriti 300.000 bambini, che rischiano malformazioni per la denutrizione e il dittatore Maduro vieta ai soccorsi umanitari di entrare nel proprio Paese.
2019-02-12	FdI	UrsoAdolfo	Signor Presidente, è la quarta volta che in quest'Aula, nell'arco di pochi giorni, si discute del Venezuela e del ruolo dell'Italia. E al quarto dibattito lei, ministro Moavero Milanesi, viene in Aula con una posizione che definire pilatesca è davvero poco. Da questo momento noi siamo sempre più preoccupati per il Venezuela. Ricordo ai parlamentari di quest'Assemblea che proprio ieri il Presidente ad interim Guaidó ha lanciato un appello al nostro Paese, chiedendo accoratamente il riconoscimento perché questo potesse scongiurare la reazione armata del regime dittatoriale di Maduro. E a questo appello accorato lei risponde in tal modo, ossia non risponde. Da questo momento noi, ministro Moavero Milanesi, siamo molto preoccupati anche per l'Italia e dovrebbe esserlo anche e soprattutto lei, alla luce della sua storia personale e politica, per dove ha spinto il nostro Paese. Con la risoluzione di maggioranza che vi apprestate a presentare anche qui, mi sembra di riascoltare quello che venti, trenta anni fa si sentiva in questo Paese, quando eravamo sotto attacco da parte dei gruppi terroristici. Chi allora era connivente con i terroristi, e oggi è presente nel Governo, ripropone la stessa posizione: né con le BR, né con lo Stato. Questo ci ha detto lei, al momento: né con la dittatura, né con la libertà; né con gli aguzzini, né con chi è torturato; né con gli Stati Uniti, né con la Russia. La sua posizione è esattamente quella di chi, connivente con i terroristi, allora ribadiva nelle piazze e nelle aule: né con le BR, né con lo Stato.
2019-02-12	M5S	FerraraGianluca	Cari supporter del Venezuela, se davvero volete il bene del popolo evitate di spingere il Paese verso la guerra civile. Per una volta imparate dai vostri errori e lavoriamo tutti insieme per evitare che il Venezuela diventi la Libia dell'America latina. Contrariamente al passato, quando i Governi italiani si accodavano acriticamente al gregge, seguendo gli ordini di scuderia, anche quando contrari ai nostri interessi nazionali, oggi il Governo italiano sta responsabilmente cercando di scongiurare il peggio fino all'ultimo, continuando a lavorare per promuovere il dialogo tra le parti, per arrivare a un accordo e a una soluzione politica e pacifica. Gli schieramenti in Venezuela sono chiari, si è già pronti a spartirsi le sue membra. Avere una posizione di non ingerenza significa, verosimilmente, poi non sedere a questo macabro banchetto. Ma è giunto il momento, per il nostro Paese, di avere il coraggio di stare dalla parte giusta della storia. Il MoVimento 5 Stelle è convinto che, per il bene dei venezuelani e dei nostri concittadini che vivono in Venezuela, la soluzione non sia quella di accentuare le divisioni, gettando benzina sul fuoco, ma di cercare di riconciliare le parti e di avviare un processo che consenta ai venezuelani, non ad altri, di decidere il loro futuro. Attenzione: devono essere davvero liberi di decidere, senza ricatti come sono le sanzioni e altri tipi di pressioni esterne. Stiamo realizzando il cambiamento in tutti gli ambiti. Lo stiamo facendo anche in questo ambito, delicato e complesso, della politica estera. E qui sento di ringraziare davvero il Governo. Il nostro Paese, a settanta anni dalla fine della Seconda guerra mondiale, ha il diritto di avere autonomia e maturità decisionale. Purtroppo, ho trovato ancora una volta pavida la posizione dell'Europa. Se questa Unione vuole avere un senso, si dovrebbe iniziare ad avere un'unica voce, una voce matura e indipendente. Il ruolo dell'Europa è fondamentale per mitigare la crescente conflittualità tra Russia e USA e instaurare un rapporto proficuo con la Cina. Dall'Europa dovrebbe partire una nuova idea di politica internazionale, basata non sul vigente darwinismo sociale tra Stati, ma sulla cooperazione e la fratellanza. Concludo dicendo che il MoVimento 5 Stelle ha le mani libere, perché è portavoce dei cittadini e non di potentati economico-finanziari.
2019-03-07	M5S	FerraraGianluca	Signor Presidente, i due accordi con la Bielorussia oggetto della presente ratifica, rispettivamente in materia di cooperazione scientifica e tecnologia e di cooperazione culturale, definiscono il quadro giuridico entro cui far crescere la collaborazione bilaterale e offrono all'Italia l'opportunità di avere un interlocutore privilegiato e un mercato di sbocco importante per i nostri prodotti e servizi. Noi del MoVimento 5 Stelle da sempre siamo favorevoli agli accordi di cooperazione culturale con altri Paesi, perché crediamo che siano le basi per una reciproca conoscenza e collaborazione e permettano la creazione di un contesto favorevole per promuovere il nostro ruolo economico. Credo pure che quando parliamo di mondo della cultura in crisi, in Italia dobbiamo tener conto dell'opportunità di diffondere la nostra cultura, il nostro stile di vita e i nostri prodotti e servizi nel mondo, a partire dalla grande competenza dei nostri Atenei, che - permettetemi di dirlo - sono all'avanguardia. Accordi di questo tipo sono uno strumento privilegiato, al quale dobbiamo ricorrere in maniera ancora più frequente in questa legislatura. Nello specifico, l'accordo di cooperazione nel campo della scienza e della tecnologia permetterà certamente di produrre buoni risultati insieme ai partner bielorussi. In particolare, noi siamo tra i primi posti al mondo per ricerca e tecnologia e possiamo cogliere appieno i benefici di questa cooperazione, dando anche ai nostri docenti la possibilità di far conoscere il know how italiano all'estero, aumentando così il prestigio dei nostri centri di ricerca. Il secondo Accordo sulla cooperazione culturale permetterà di dare vita a collaborazioni proficue e a nuove forme dell'organizzazione di manifestazioni culturali e artistiche, della promozione di contatti tra enti e associazioni culturali, della traduzione di opere letterarie e dell'intensificazione dei rapporti fra istituzioni museali. Mi sembra molto interessante, poi, il richiamo alla tutela del patrimonio culturale, che potrebbe aprire la strada a ulteriori collaborazioni future anche in campo economico. Signor Presidente, ci auguriamo che possano aumentare le opportunità di collaborazione con il popolo bielorusso, ma soprattutto che la via della promozione del nostro ruolo culturale e scientifico diventi uno degli strumenti della nostra cooperazione internazionale, anche in considerazione della nostra grande esperienza. Mi permetto di dire, in conclusione, che la cooperazione culturale con altri popoli va vista sempre come un ponte, una mano tesa alla società con cui ci relazioniamo, ancor prima di un accordo con questo o quel Governo. Lo dico perché è importante comprendere il nostro ruolo internazionale, che non può più essere quello del passato. In questo nuovo contesto multipolare, l'Italia deve essere protagonista della mediazione, deve promuovere la pace e il benessere e proporsi nello scambio di conoscenze e nella tutela del patrimonio umano in tutte le sue forme. Per questo il Parlamento, nell'espletamento del suo lavoro, deve essere scevro da pregiudizi e pragmatico nell'agire, avendo sempre a cuore l'interesse del nostro Paese. Facendo ciò, dobbiamo inevitabilmente valorizzare le nostre peculiarità; e la promozione della cultura e della ricerca è una di queste. Annuncio quindi il voto favorevole del Gruppo MoVimento 5 Stelle al Senato su questa ratifica.
2019-03-07	M5S	PacificoMarinella	Signor Presidente, l'Assemblea è chiamata a esaminare il disegno di legge di iniziativa parlamentare recante ratifica ed esecuzione di due accordi, rispettivamente in materia di cooperazione scientifica e tecnologica e di cooperazione culturale, sottoscritti dall'Italia e dalla Bielorussia nel giugno 2011. Mi preme sottolineare che il testo in esame ripropone, sia pure parzialmente e limitatamente ai soli due accordi con la Bielorussia, il testo del disegno di legge di ratifica di numerosi trattati internazionali bilaterali proposto dal Governo nel corso della XVII legislatura, con atto del Senato n. 2812 che, presentato il 4 maggio 2017, fu esaminato ed approvato dalla Commissione affari esteri del Senato in data 11 ottobre 2017, senza peraltro poter vedere completato il proprio iter di esame parlamentare per la chiusura della legislatura. I due accordi con la Bielorussia oggetto della presente ratifica rispettivamente in materia di cooperazione scientifica e tecnologica e di cooperazione culturale sono composti ciascuno di 11 articoli e definiscono il quadro giuridico entro cui far continuare e far crescere la collaborazione bilaterale anche attraverso il coinvolgimento della società civile.
2019-03-19	PD	AlfieriAlessandro	Desidero trasmetterle tre messaggi. Il primo ha a che fare con quello che ha detto prima il presidente Monti. Lei, presidente Conte, ha misurato, anche recentemente, nelle sedi europee la diffidenza nei confronti dell'Italia, a volte marcata anche da stereotipi. Non voglio alimentare un dibattito che rischia di essere esagerato, ma quella diffidenza va dissipata, perché attraverso l'Europa passano le sfide principali. Pertanto, il primo invito che vogliamo farle, presidente Conte, è quello di provare faticosamente a ricucire lo strappo che è avvenuto con alcuni Paesi storicamente alleati con noi nelle sfide principali. Se ci sarà un fuori sacco sul Venezuela o si parlerà di Russia, è importante mantenere il consenso europeo, essere compatti e dare l'idea che noi investiamo sulla dimensione comunitaria. È importante perché, se lo facciamo su quei dossier, è più facile affrontare anche il tema della gestione dei flussi migratori. Presidente Conte, l'ho ascoltata con grande attenzione quando ha detto che il problema non è permettere sbarchi senza limiti. Qui nessuno vuole permettere sbarchi senza limiti; qui siamo tutti convinti che in Europa vada trovata una soluzione strutturale. Mi deve però dare una risposta. Il 7 e 8 marzo scorsi, quando a Bruxelles si è discusso di temi importanti quali la riforma del Regolamento di Dublino, il resettlement e la redistribuzione dei rifugiati (laddove in passato noi avevamo ottenuto la redistribuzione obbligatoria, oggi è su base volontaria), dov'era il nostro Ministro dell'interno in questo passaggio fondamentale e importante? Era a fare un comizio a Potenza.
2019-04-02	PD	GaraviniLaura	Signor Presidente, sono appena rientrata da una missione in Argentina e da una missione precedente in Spagna. In entrambi i Paesi ho avuto occasione di incontrare cittadini venezuelani di origini italiane, che mi hanno raccontato come, negli ultimi mesi, migliaia di cittadini venezuelani, molti dei quali nostri connazionali, da un lato stiano cercando rifugio nei Paesi limitrofi al Venezuela, come ad esempio la stessa Argentina, il Brasile o la Colombia, e dall'altro cerchino addirittura la via dell'Europa, in particolare attraverso la Spagna. Cittadini che mi hanno raccontato delle attuali condizioni in Venezuela e di come sia impossibile trovare medicinali. Alcuni di loro sono venuti in Europa proprio per cercare di procurarsi i medicinali da riportare ai loro congiunti, ma spesso viene loro impedito di rientrare. Ci hanno raccontato le tensioni che ci sono, anche alla luce della recente destituzione unilaterale, da parte del presidente Maduro, del presidente dell'Assemblea Guaidó. Signor Presidente, il nostro Paese non può continuare a non prendere posizione. Ha ragione il senatore Casini quando parla delle recenti introduzioni di truppe e dei finanziamenti della Russia (dunque le ingerenze straniere ci sono, sono ancora più preoccupanti e rendono la situazione della cittadinanza ancora più drammatica). Mi unisco quindi al senatore Casini, anche come espressione del Gruppo Partito Democratico, nel chiedere che il Governo prenda finalmente posizione e si unisca all'importante risoluzione assunta dal Parlamento europeo nel chiedere che ci siano nuove elezioni in Venezuela. Non è accettabile che il nostro Paese, ancora una volta, si isoli a livello internazionale dopo che l'intera Unione europea e tutta una serie di Paesi del Sudamerica e gli stessi Stati Uniti chiedono fortemente che ci siano nuove elezioni. Non è tollerabile che da parte dell'Italia ci sia ancora una volta questo isolamento a livello internazionale, che non solo nuoce fortemente al nostro Paese, ma, in questa situazione drammatica, può segnare anche ulteriori difficoltà in un Paese come il Venezuela, che vede una forte presenza di nostri concittadini. L'inerzia e l'incapacità del Governo di assumere una posizione chiara non è più accettabile, Presidente. Esprimiamo quindi anche noi l'invito che il Governo assuma finalmente una posizione chiara.
2019-04-18	FdI	UrsoAdolfo	In questo contesto, il Governo si è diviso e ha diviso le sue alleanze internazionali. In questo contesto, il nostro Governo, consapevole di quello che stava accadendo nel principale Paese di interesse strategico dell'Italia, si è diviso al punto che il Ministro della difesa, il Ministro dell'interno, l'uno e l'altro Vice Premier hanno fatto e dichiarato cose diverse, rendendo afono il Ministro degli affari esteri, che non è nemmeno presente in quest'Aula accanto a lei. Ciò al punto che lei è stato costretto ad accentrare tutti i poteri e tutta la rappresentanza a Palazzo Chigi ed ha fatto bene. Il Governo si è anche diviso dai suoi alleati internazionali. Aveva ottenuto da Trump nel primo colloquio a Washington una sorta di protezione sui nostri interessi in Libia. Nel frattempo, ci siamo divisi dagli Stati Uniti su Venezuela, ci siamo divisi dagli Stati Uniti sulla Cina e in maniera avventata abbiamo annunciato il ritiro dall'Afghanistan. Nel contempo ci siamo isolati in Europa; nel contempo siamo apparsi strani alla Russia, a cui avevamo promesso addirittura che ritirassimo le sanzioni; nel contempo abbiamo messo un dito nell'occhio ad al-Sisi; nel contempo abbiamo attaccato la Turchia di Erdogan. Non so se sia stata una politica saggia quella di dividersi e dividerci rispetto al nostro contesto internazionale, mentre era in palio proprio la Libia, Paese per noi prioritario. Signor presidente Conte, noi parliamo a tutti, certo: l'Italia è l'Italia, soprattutto in Libia e nel Mediterraneo; ma temo che non ci ascolti più nessuno. E anche le indiscrezioni che sono uscite ieri dal colloquio che lei ha finalmente avuto col presidente Trump sono inquietanti, perché mettere sullo stesso podio, nello stesso colloquio telefonico, il Venezuela e la Libia ci fa capire qualcosa, almeno per chi conosce questo Paese e la sua politica estera. Cosa dobbiamo fare? Esattamente il contrario di quello che abbiamo fatto in questi mesi. Innanzitutto, ci vuole l'unità del Governo. Non è ammissibile che vi siano dichiarazioni difformi da campagna elettorale in un Governo che è alla guida di un Paese, l'Italia, che rischia di subire la più grave sconfitta della sua storia repubblicana, pregiudicando i propri interessi al punto da rischiare una crisi umanitaria, politica, economica, emergenziale alle sue porte, in Libia. Non sono ammissibili divisioni nel Governo. Dico di più. Lei dovrebbe fare appello all'unità del Paese, perché quello che noi rischiamo è davvero troppo rispetto a quello che il Governo ha messo in campo. In questi momenti è assolutamente necessario esprimere la massima unità nazionale. Poi giudicheremo l'operato del Governo, ma oggi occorre agire in fretta per recuperare quello che non si è fatto in questi mesi, in cui si è passati dalla foto idilliaca di Palermo, in cui l'Italia era tornata in campo, al punto in cui in Libia non c'è più l'Italia, non ci sarà più l'Europa, ma ci sarà una guerra civile tra potenze sunnite fondamentaliste che alimentano il terrorismo islamico.
2019-04-18	M5S	TavernaPaola	Signor Presidente, signor presidente Conte, il Governo italiano, l'Unione europea, l'ONU, gli Stati Uniti, la Russia (mi riferisco a tutti i principali attori della comunità internazionale), ebbene tutti, seppur non con la stessa forza e convinzione, hanno chiesto al generale Haftar di fermare immediatamente la sua offensiva militare. Questi appelli sono rimasti inascoltati. Appare ormai evidente che Haftar, rinnegando gli impegni precedentemente assunti per favorire un processo politico di riconciliazione e riunificazione nazionale, punti a conquistare con la forza Tripoli, abbattendo il Governo di al-Sarraj riconosciuto dalla comunità internazionale.
2019-04-18	M5S	TavernaPaola	È necessaria una grande operazione di soccorso umanitario che coinvolga ONU, Unione europea, Stati Uniti, Unione africana, Lega araba e Russia per attivare dalle coste libiche un ponte aereo e navale che consenta di portare in salvo i profughi libici in tutti i Paesi europei, nessuno escluso, così come in tutti i Paesi africani e arabi in grado di garantire rifugio anche solo a una piccola frazione di cittadini libici. Se la comunità internazionale non sarà in grado di impedire che la Libia risprofondi nel caos dovrà almeno farsi carico delle conseguenze umanitarie del suo fallimento. Tale fallimento non potrà essere imputabile al Governo italiano, che sta facendo ogni sforzo possibile per salvare la Libia e porre rimedio agli errori di altri Paesi e di precedenti Governi. Presidente, la ringrazio per quanto sta facendo.
2019-06-05	FI	BeruttiMassimoVittorio	Sebbene due tra i maggiori Paesi al mondo (Stati Uniti e Russia) abbiano espresso notevoli perplessità sulle scelte da assumere in relazione al futuro del pianeta, sono state adottate delle decisioni tecniche sul modo in cui i diversi Paesi, a seconda del proprio livello di sviluppo, dovranno ridurre le proprie emissioni di anidride carbonica.
2019-07-09	FI	MinutoAnnaCarmela	Permettetemi di fare alcune piccole precisazioni in merito: la prima è riferita al fronte orientale e riguarda il confine della NATO con la Russia. Sul caso nutriamo forti dubbi come Gruppo con riguardo alle scelte che l'Unione europea e la NATO stanno mettendo in atto nei confronti di un grande attore della politica internazionale, qual è appunto la Federazione Russa. Forza Italia è stato il primo partito ad opporsi alle politiche di sanzioni discriminatorie che sono indubbiamente uno strumento tutt'altro che efficace, sia dal punto di vista della diplomazia, sia dal punto di vista economico. Le nostre aziende colpite da dazi sanno bene quante sono le perdite giornaliere che continuano ad accumulare nei loro bilanci.
2019-07-10	FI	CaliendoGiacomo	Non sarò mai d'accordo, perché voglio difendere i più deboli di questo Paese. Non potrò mai essere d'accordo con chi propende per una democrazia dei pochi. Infatti, è una falsa idea la democrazia diretta con sistemi di controllo. Ciò significherebbe - né più, né meno - avere quella democrazia oppressiva che fu realizzata in Paesi come la Cina o la Russia di un tempo. Voi volete portare quel sistema. Non c'è nulla di nuovo sotto il sole. Come diceva Mao, c'è grande confusione sotto il cielo. Ed era questa la logica di legittimare una democrazia, con ordini di scuderia su come comportarsi. E voi, con nonchalance, volete introdurre qualcosa di questo tipo nel nostro Paese. Signor Ministro, c'è necessità di un dibattito e di un ascolto anche da parte dei Ministri. Perché l'ascolto è necessario? Che cosa avviene? Ogni giorno, quando vengo in Senato, su alcune questioni vado a rileggere la raccolta dei verbali delle sedute dell'Assemblea costituente. Perché? Sono istruttivi e vi consiglio di leggerli. Qual è la ratio della previsione di 315 senatori? I Padri della Patria hanno discusso a lungo della necessità di un equilibrio tra il numero dei cittadini e la rappresentatività all'interno delle Camere, perché se non c'è quell'equilibrio... FARAONE (PD). Abbiamo un Ministro nuovo! PRESIDENTE. Per cortesia. Prego, senatore Caliendo, non si interrompa. CALIENDO (FI-BP). Dicevo che c'è quell'equilibrio che, alterato, porta a una preponderanza del potere esecutivo rispetto a quello legislativo. Ho applaudito la collega Nugnes, che - probabilmente è una che ha letto, come me - ha colto l'esigenza di un equilibrio, che è necessario. Sono amante della vera democrazia rappresentativa e devo avere la possibilità di parlare liberamente in quest'Aula. Ho parlato quando mi si diceva che, se la riforma costituzionale di Renzi fosse stata bocciata, avremmo avuto immediatamente le elezioni anticipate. Non me ne è fregato nulla e con molti di voi, del MoVimento 5 Stelle e della Lega, abbiamo girato le piazze per difendere quella Costituzione. E oggi dovrei preoccuparmi, oppure sentirmi garantito dal vice presidente Di Maio, che stamattina, sui giornali, ci dice che se viene approvata la riforma avremo garanzia della legislatura? Non ci credete, perché è veramente la promessa di un marinaio, di colui che, in occasione delle elezioni amministrative e politiche nel nostro Sud, caro senatore Segretario, garantiva grandi cose.
2019-07-11	PD	FerrariAlan	Signor Presidente, intervengo richiamando l'articolo 145 del Regolamento. Alcuni fatti di cronaca di ieri dai risvolti potenzialmente molto gravi ci impongono di chiederle un definitivo ed essenziale chiarimento a tutela di questa Camera. Come è ormai noto, il sito «Buzzfeed» ha pubblicato la registrazione di una riunione segreta tenutasi all'Hotel Metropole di Mosca in cui si sarebbero incontrati esponenti della Lega e uomini del Cremlino, con lo scopo di escogitare il modo di far arrivare al partito del Ministro dell'interno e vice premier italiano Matteo Salvini decine di milioni di dollari. Il Ministro dell'interno non era presente, ma proprio il giorno prima aveva detto che le sanzioni contro Mosca sono socialmente, economicamente e culturalmente folli. Il sito «Buzzfeed» non ha potuto identificare i russi presenti, ma sostiene che si tratti di alti esponenti che dicono di sperare nel via libera da parte di Pligin, membro influente dello stesso partito del presidente Putin. Negli spezzoni audio pubblicati si sente inoltre che i partecipanti sostengono l'importanza dell'operazione per aiutare la Lega, in particolare durante la campagna elettorale per le consultazioni europee. Più volte viene affermata la volontà di cambiare l'Europa e testualmente si dice che una nuova Europa deve essere più vicina alla Russia. Signor Presidente, qui sta il punto. Questi fatti non sono nuovi per il Senato. Tre interrogazioni, due del senatore Parrini e una del senatore Stefano, tra il febbraio e il maggio di quest'anno trattavano i legami tra persone vicine al Ministro dell'interno e alla Lega e importanti dirigenti russi legati al partito del presidente Putin. In una delle tre addirittura si chiedevano informazioni sulla vendita di un consistente quantitativo di carburante ad un'azienda italiana da parte di una società petrolifera e sul potenziale legame con il finanziamento della campagna elettorale della Lega per le elezioni europee. Queste tre interrogazioni avevano ad oggetto la sicurezza nazionale, l'indipendenza del nostro Paese da quelli che appaiono come inaccettabili condizionamenti esterni
2019-07-11	PD	MancaDaniele	Gli interessi reali degli italiani si tutelano incrementando la qualità e la quantità dei servizi alle persone, molto di più rispetto al cedere ai sovranisti russi e di Visegrad pezzi della nostra sovranità nazionale; se poi il tutto avviene nel torbido e all'interno di accordi con la Russia che si stanno rilevando di cattivo colore e sembrano coinvolgere la Lega Nord, la trasparenza diventa indispensabile per salvaguardare la credibilità delle Istituzioni.
