2019-04-03	M5S	CastelloneMariaDomenica	Signor Presidente, onorevoli colleghi, membri del Governo, oggi è già stato detto tutto dai miei colleghi, io però vorrei esplorare con voi il complesso e per molti versi sconosciuto universo dei disturbi dello spettro autistico in maniera diversa, con l'ausilio di un racconto; un racconto scritto da un educatore e da un artista. Questo racconto parla di un cucciolo di lupo, che nasce in una notte di nebbia fitta, in cui non si distingue il confine tra la terra e il cielo. Come nella nebbia si perdono i contorni esatti delle cose, allo stesso modo la mancanza di conoscenza dell'autismo impedisce di "vedere" i bambini che ne sono affetti e spinge a relegarli in un angolo grigio, dove vengono sviliti da quella dolorosa etichetta che è la diversità. Il piccolo lupo di fatto è diverso dagli altri cuccioli, perché non sa ululare e dunque non si esprime attraverso il linguaggio tipico del branco; ha paura delle farfalle, cioè ha delle fobie atipiche per la sua specie; non guarda alla luna, ma non riesce a staccare gli occhi dalle ciliegie. La sua diversità diventa un motivo di esclusione dal branco perché non sarà mai un vero lupo. Solo la madre non abbandona il cucciolo; così restano soli, avvolti nella nebbia che ruba tutti i colori alle cose. È in quel mondo grigio purtroppo che si ritrovano spesso le famiglie con un figlio affetto da autismo. Provate ad immaginarvi come genitori che si stringono al proprio figlio nella nebbia. Provate ad immaginare il terrore che vi investe, mentre lo chiamate, senza ottenere risposta; provate a capire cosa si prova, di fronte a un bambino che vi guarda con lo sguardo assente, che non si appassiona ai giochi, che non familiarizza con gli altri bambini, che non reagisce ad alcun vostro tentativo di portarlo nel vostro mondo, questa "normalità" che all'improvviso diventa una maledizione, in netto contrasto con tutta questa "diversità". Senza nessun preavviso, senza possibilità di difesa, arriva la diagnosi: disturbo dello spettro autistico. Qualche genitore, raccontando della propria esperienza, ha paragonato questo momento a uno sconvolgimento di tutti gli equilibri: all'inizio è tutto nuovo, bisogna imparare tanti termini mai sentiti prima e modificare tutti gli atteggiamenti, alla scoperta di quelli che possano aprire un varco nella nebbia. È uno stravolgimento doloroso, in cui si passa dalla disperazione all'accettazione e dall'accettazione alla necessità assoluta di reagire. Sono un pugno allo stomaco le testimonianze dei genitori con figli autistici. Lasciati totalmente soli nella gestione di questa diversità per cui ancora troppo poco si è fatto. Nel racconto alla fine sarà un'oca a salvare il piccolo lupo dall'esclusione; lo fa guardando al di là delle apparenze, indagando la sensibilità del cucciolo, che per salvarla da una volpe, finalmente lancia un ululato da vero lupo. A quel punto anche il capo branco comprende che la diversità non è insuperabile: accetta il lupo e assaggia le ciliegie per capire come mai per il piccolo siano così appetibili; a riprova del fatto che la diversità può essere fonte di arricchimento. Da tempo nel nostro Paese si sta sperimentando un approccio multidisciplinare, finalizzato a fornire tutti gli strumenti per capire e gestire al meglio la disabilità, per offrire a chi è affetto da disturbi dello spettro autistico la concreta speranza di un'esistenza che sia il più vicino possibile al concetto di normalità. Le terapie somministrate sono di tipo psicologico e comportamentale, di tipo prettamente cognitivo, e solo in minima parte farmacologico. Si punta molto anche sullo sport, sull'arte-terapia e sulla pet therapy. Qualsiasi sia il metodo messo in atto, resta fondamentale il coinvolgimento dei familiari e di persone strettamente legate al mondo di chi soffre di autismo. I risultati derivanti dall'applicazione di queste metodologie sono sempre più sorprendenti. Quella nebbia gelida e informe in parte comincia a diradarsi e molti bambini, soprattutto se diagnosticati precocemente, riescono ad uscirne. Non è così per tutti però, perché ancora una volta in tanti sono penalizzati dall'area geografica di appartenenza. So bene che ripeto spesso questo concetto ed io per prima vorrei non ci fosse più bisogno di ribadirlo sempre, qualunque sia la disciplina, qualunque sia la patologia, qualunque sia la terapia; per ora però è così, le differenze territoriali ci sono e valgono anche per chi soffre di disturbi dello spettro autistico. Ci sono anche in questo caso numeri e dati inconfutabili. I numeri di una recente ricognizione nazionale realizzata dall'Istituto superiore di sanità sulle unità operative di neuropsichiatria dell'infanzia e dell'adolescenza, terminale sanitario dell'utenza con disturbi dello spettro autistico dei sistemi sanitari regionali, indicano che in Italia 300.000-400.000 persone convivono con un disturbo dello spettro autistico, tra bambini, adolescenti e adulti; ciascuna unità operativa di presa in carico di questi soggetti è composta in media da due neuropsichiatri infantili, due psicologi, un terapista della neuropsicomotricità dell'età evolutiva, due logopedisti, un educatore, un infermiere e un assistente sociale. Secondo quanto dichiarato da chi ha curato questa indagine, questo dato presenta però un'altissima variabilità tra le Regioni e tra le aziende sanitarie, che si evidenzia anche dall'analisi delle distribuzioni del numero di operatori per ciascuna Regione; esistono infatti più del 50 per cento delle unità operative dove i profili potenzialmente coinvolti nel trattamento o sono assenti o sono presenti in part-time e dove non si garantiscono diagnosi e presa in carico in tempi consoni. Sono state attivate al Nord l'83 per cento delle unità operative previste, al Centro il 69 per cento, nelle isole il 61 per cento e al Sud il 51 per cento, evidenziando quindi come la capacità di erogare i livelli essenziali di assistenza previsti per l'autismo presenta una forte eterogeneità geografica. I dati che vi sottopongo sono supportati anche da una valutazione effettuata dal Ministero della salute, in collaborazione con il gruppo tecnico interregionale salute mentale, dalla quale emergono un diverso grado di recepimento e differenti implementazioni a livello regionale e locale. Proprio in conseguenza del modesto approccio, su base territoriale, delle linee d'indirizzo definite nel 2012, si è stabilito che la loro attuazione costituisca adempimento per il comitato permanente per la verifica dell'erogazione dei LEA. Nel settembre 2018 l'Istituto superiore di sanità ha ufficializzato l'obbiettivo di redigere le linee guida sul disturbo dello spettro autistico, finalizzate a supportare i professionisti sanitari nella definizione del percorso diagnostico e terapeutico più appropriato, attraverso la creazione di una rete di sostegno e assistenza per i familiari e i caregiver nella presa in carico integrata del minore, che deve coinvolgere l'intero contesto di vita (famiglia, scuola, luoghi di aggregazione, servizi territoriali sociali e sociosanitari). Se ne deduce che in questi anni il nostro Paese si sia dotato di tutti gli strumenti e delle norme necessari a garantire livelli omogenei di presa in carico e trattamento su tutto il territorio nazionale sulla base dei fabbisogni. Parliamo di provvedimenti tesi a garantire la tutela della salute, il miglioramento delle condizioni di vita e l'inserimento nella vita sociale. II Servizio sanitario nazionale deve infatti garantire alle persone con disturbi dello spettro autistico prestazioni di diagnosi precoce, cura e trattamento individualizzato, con metodi e strumenti basati sulle più avanzate evidenze scientifiche. Serve, piuttosto, attivarsi affinché sia data piena attuazione a quanto già definito dall'attuale quadro normativo. Con questo ordine del giorno unitario, che il MoVimento 5 Stelle voterà favorevolmente, impegniamo il Governo a: istituire una rete scientifica ed epidemiologica, come già sperimentato in altri Paesi, con l'obiettivo di promuovere studi e ricerche finalizzate ad assicurare che il sistema informativo fornisca sui disturbi dello spettro autistico stime affidabili; definire un sistema di valutazione secondo indicatori oggettivi e misurabili; perfezionare tramite l'Istituto superiore di sanità, l'elaborazione delle linee guida; garantire la diffusione di campagne d'informazione e sensibilizzazione; promuovere collaborazioni sociali e assistenziali a supporto delle famiglie. Abbiamo il dovere di adottare tutte le misure necessarie per garantire una vita normale ai soggetti affetti da disturbo dello spettro autistico. Abbiamo il dovere di operare per definire un percorso collettivo conforme per ciascun territorio, per fornire a tutti ogni strumento disponibile per diradare quella nebbia incolore che crea una barriera e segna un confine doloroso tra normalità e diversità. Abbiamo il dovere di fare in modo che sia possibile per chiunque uscire da questa nebbia e tornare a vedere i meravigliosi colori del mondo.
2019-04-03	M5S	SileriPierpaolo	La legge dispone anche l'aggiornamento da parte dell'Istituto superiore di sanità delle linee guida sul trattamento dei disturbi dello spettro autistico in tutte le età della vita, sulla base dell'evoluzione delle conoscenze fisiopatologiche e terapeutiche derivante dalla letteratura scientifica e dalle buone pratiche nazionali e internazionali.
2019-04-03	M5S	SileriPierpaolo	Successivamente, il decreto del Presidente del Consiglio dei ministri datato 12 gennaio 2017, concernente l'aggiornamento dei livelli essenziali di assistenza, ha recepito, all'articolo 60, le disposizioni della legge n. 134 del 2015, prevedendo peraltro che il Servizio sanitario nazionale garantisca alle persone con disturbi dello spettro autistico specifiche prestazioni di diagnosi precoce, cura e trattamento individualizzato, mediante l'impiego di metodi e strumenti basati sulle più avanzate evidenze scientifiche. Nel decreto l'autismo rientra nell'elenco individuato all'allegato 8, cui fa rinvio l'articolo 53, che garantisce il diritto all'esenzione dal ticket sanitario per le persone affette da malattie croniche ed invalidanti. Più nello specifico, il disturbo autistico è fatto rientrare tra le condizioni di psicosi per le quali lo stesso allegato 8 riporta l'elenco delle prestazioni sanitarie (tra cui visite e sedute psicoterapiche, dosaggi di farmaci, esami clinici e quant'altro) in esenzione dalla partecipazione al costo per i soggetti interessati. Il 10 maggio 2018 la Conferenza unificata ha approvato l'intesa sul documento recante «Aggiornamento delle linee di indirizzo per la promozione ed il miglioramento della qualità e dell'appropriatezza degli interventi assistenziali nei disturbi dello spettro autistico». Secondo quanto emerge da tale documento, il Ministero della salute, in collaborazione con il gruppo tecnico interregionale salute mentale, ha condotto una valutazione sul recepimento delle precedenti linee d'indirizzo (del 2012), dalla quale è emerso un diverso grado di recepimento e differenti implementazioni a livello regionale e locale. Purtroppo, tali esperienze - si sottolinea - non sono ad oggi ancora uniformemente diffuse nel territorio nazionale, generando disparità di approccio alla gestione dei bisogni delle persone con spettro autistico. Proprio in conseguenza del modesto recepimento delle linee d'indirizzo del 2012, l'intesa medesima ribadisce quanto previsto all'articolo 4 della menzionata legge n. 134 del 2015, ossia che l'attuazione delle linee d'indirizzo, come aggiornate, costituisce adempimento ai fini della verifica del Comitato permanente per la verifica dei LEA, tuttavia inserendo nel medesimo documento l'invarianza finanziaria secondo la quale all'attuazione dell'intesa si provvede nei limiti delle risorse umane, finanziarie e strumentali disponibili a legislazione vigente e comunque senza nuovi o maggiori oneri per la finanza pubblica. Nel settembre 2018 l'Istituto superiore di sanità ha ufficializzato l'obiettivo di redigere le linee guida sul disturbo dello spettro autistico finalizzate a supportare i professionisti sanitari nella definizione del percorso diagnostico e terapeutico più appropriato ed a creare una rete di sostegno e assistenza per i familiari e caregiver nella presa in carico integrata del minore, che deve coinvolgere l'intero contesto di vita (famiglia, scuola, luoghi di aggregazione, servizi territoriali sociali e sociosanitari), al fine di offrire un insieme di risposte mirate agli specifici bisogni individuali di natura abilitativa ed educativa e garantire altresì livelli omogenei di presa in carico e trattamento su tutto il territorio nazionale. In conclusione, con la nostra mozione chiediamo al Governo: di attivarsi per l'istituzione di una rete scientifica ed epidemiologica, anche in raccordo con analoghe esperienze in ambito europeo o internazionale, al fine di promuovere studi e ricerche finalizzate a raccogliere dati di prevalenza nazionale aggiornati e a censire le buone pratiche terapeutiche ed educative a questo dedicate; di definire, in attuazione dell'intesa sancita in sede di Conferenza unificata del 10 maggio 2018 nell'ambito della stipula del nuovo Patto per la salute 2019-2021, un sistema di valutazione secondo indicatori oggettivi e misurabili di garanzia del puntuale adempimento delle linee di indirizzo su tutto il territorio nazionale, a valere come obiettivo strategico del nostro Servizio sanitario nazionale, per la promozione ed il miglioramento della qualità e dell'appropriatezza degli interventi assistenziali nei disturbi dello spettro autistico con uno specifico riconoscimento dello 0,5 per cento delle maggiori risorse vincolate, ad ogni conseguente effetto all'esito del prescritto monitoraggio del Comitato permanente per la verifica dell'erogazione dei LEA, deducendone le coerenti previsioni nella suddetta adottanda intesa, in sede di Conferenza permanente per i rapporti tra lo Stato, le Regioni e le Province autonome di Trento e Bolzano. Chiediamo inoltre di perfezionare, per il tramite dell'Istituto superiore di sanità, l'elaborazione delle linee guida sul trattamento dei disturbi dello spettro autistico in tutte le età della vita, ai sensi di quanto previsto dalla legge n. 134 del 2015 e del decreto ministeriale 30 dicembre 2016, entro e non oltre un anno dalla data di approvazione del presente atto di indirizzo, con obbligo di conforme rendiconto in relazione annuale al Parlamento.
2019-04-16	FI	MinutoAnnaCarmela	Avviandomi a concludere, credo semplicemente che occorra una cura liberale, fatta di investimenti mirati allo sviluppo della competitività, delle infrastrutture e soprattutto, signori, della sanità. Non abbandonate il Mezzogiorno, la sanità ha seri problemi. La gente non sa dove curarsi e io, ogni volta che prendo la parola, non faccio altro che parlarvi della sanità: intervenite.
2019-04-16	FI	ModenaFiammetta	Signor Presidente, ho chiesto di intervenire a fine seduta perché vorrei far presente quello che sta accadendo nella mia Regione. È una questione che non voglio toccare dal punto di vista degli atti e delle azioni che vengono poste in essere dalla magistratura. Voglio tuttavia parlarne perché il popolo dell'Umbria è estremamente scosso in questo momento ed è un popolo che ha scoperto con shock quello che si è sempre saputo e che è sempre stato oggetto di tante battaglie. Devo dire che forse ci sono state delle generazioni che hanno combattuto queste battaglie; ma sono comunque scioccanti le cose riportate dalla stampa. È soprattutto scioccante (perché ha girato dappertutto) vedere raffigurato nero su bianco, nelle ordinanze e nei provvedimenti, un sistema in base al quale l'accesso ai concorsi pubblici della sanità era nella sostanza ingessato e soprattutto frutto di un accordo di carattere e di natura politici. Vorrei parlarne perché credo sia giusto, in un momento come questo, mandare alcuni messaggi. Un messaggio a cui tengo molto riguarda il fatto che quanto accaduto non deve mai comunque far ritenere ai nostri ragazzi, alle persone che hanno bisogno di lavorare e alle persone che si sono trovate tante volte davanti a un muro che non esista una strada attraverso la quale i risultati si raggiungono con il merito. Questa è un'idea che credo sia giusto far transitare, quantomeno per riprendersi dallo shock di quello che si è visto e di quello che si è letto. È giusto anche pensare che le persone che operano all'interno delle strutture sanitarie, al di là dei singoli casi che ci potranno essere o meno, siano comunque al di sopra di tutte le vicende legate o connesse all'esercizio del potere politico, perché ovviamente parliamo di situazioni dove le persone si vanno a curare (noi paghiamo le tasse per avere la copertura della sanità pubblica). Da questo punto di vista, io credo che sia giusto tutelare in prospettiva coloro i quali operano ogni giorno, sempre e comunque, nell'interesse dei nostri malati e tranquillizzare la struttura e tutti coloro che svolgono questo mestiere per le persone che stanno male. PRESIDENTE. Devo invitarla a concludere, senatrice Modena. MODENA (FI-BP). Ho finito. Il terzo messaggio è che in questi giorni è come se si fosse consumata la vita di persone che per anni hanno fatto delle battaglie contro un sistema di cui parlavano, ma che non si era mai visto concretamente in azione. Mi auguro che giovani, ragazzi, persone nuove e persone che hanno voglia di fare possano cancellare questo tipo di sistema e ridare un'aria di alternanza e di libertà alla Regione che ho l'onore di rappresentare.
2019-04-18	FI	PichettoFratinGilberto	Il Governo e questo Parlamento devono rendersi conto che abbiamo un Sistema sanitario nazionale che non regge più e che rischia di diventare una sanità solo per ricchi e raccomandati, devono capire che le famiglie sono massacrate dalle tasse e dalle tariffe, che le imprese, con il cuneo fiscale attuale, hanno costi sempre più alti mentre, dall'altra parte, i salari sono sempre più bassi.
2019-04-18	FI	SiclariMarco	Ad oggi, nel 2019, siamo costretti a prendere atto soltanto dei fallimenti economici e finanziari e delle vostre misure, dei vostri spot. La quota 100 sta provocando la fuga di molti dipendenti dagli enti locali e anche e soprattutto dalla sanità, già in ginocchio perché sotto organico e nel DEF non è previsto alcun aumento del Fondo sanitario per sbloccare il turnover. La flat tax è rivolta a una platea ridottissima, perché si rivolge soltanto a chi fattura meno di 65.000 euro. Cosa diciamo a tutti coloro che oggi non lavorano, a tutti quei medici, parlando di sanità? Sono oltre 30.000 gli specialisti, che hanno studiato più di 25 anni e che non hanno un lavoro: cosa diciamo loro, che non sblocchiamo il turnover ? Fate la domanda per avere il reddito di cittadinanza? È questo ciò che propone il Governo? Oltretutto, il reddito di cittadinanza inizia a smascherare la propria natura: gli stessi cittadini postano sui social l'elemosina di Stato, i 20, 30, 40 euro di reddito ottenuti dopo che sono stati ammessi al beneficio, cioè hanno avuto la triste sorpresa di apprendere che l'importo del sussidio è di poche decine di euro. Di sussidio, infatti, si tratta e non, come avete detto e stradetto, di una misura per abbattere la povertà: non si abbatte la povertà con questo reddito di cittadinanza!
2019-04-18	FI	SiclariMarco	Colleghi, il Paese ha bisogno che si affrontino i temi del lavoro, dell'impresa, del Sud, delle infrastrutture, della sanità, del welfare, ma in maniera seria e concreta. Voi colleghi del MoVimento 5 Stelle, avete le competenze più importanti in seno al Governo: il lavoro, lo sviluppo economico, le infrastrutture, la salute e il Sud; permettetemi di dire che avete preso in giro noi meridionali, perché avete creato un Ministero che, oltre a non avere il portafoglio, non ha prodotto alcun progetto di investimento al Sud. E ancora oggi venite a riunirvi, come Consiglio dei ministri, a Reggio Calabria, ma per annunciare cosa? Che avete partorito il topolino dalla montagna, mentre la gente muore, perché non ha assistenza sanitaria e continuerà a non averla per il decreto-legge salute che è stato proposto oggi in Consiglio dei ministri? La Calabria è una terra commissariata da 12 anni e lo sarà per i prossimi 10, secondo quanto stabilito dal decreto-legge. Per non parlare del fallimento assoluto della politica sanitaria nazionale. Per l'anno corrente ci preoccupa che per la spesa sanitaria si prevedano 118 miliardi di euro, un aumento di soli 2,5 miliardi rispetto all'anno precedente, quando nella legge di bilancio ne avete previsto soltanto uno: dove prendere il miliardo e mezzo che avete aggiunto? Per gli anni successivi ci preoccupano le revisioni al ribasso del PIL rispetto a quanto avete preventivato sei mesi fa, quando avevate previsto un aumento del 3,1 per cento nel 2019 e invece siete precipitati a oltre la metà, cioè all'1,2 per cento; avevate previsto il 3,5 per cento nel 2020 e siete scesi al 2,6 per cento; per il 2021 avevate previsto il 3,1 per cento e siete scesi al 2,5 per cento. Ci preoccupa ancora il fatto che la spesa sanitaria resti inferiore all'inflazione. Anche se le vostre stime fossero corrette, la spesa sanitaria non potrà nemmeno coprire l'aumento dei prezzi, sia perché cresce meno del PIL nominale, sia perché l'indice dei prezzi del settore sanitario è superiore all'indice generale dei prezzi al consumo. Insomma, per i prossimi anni in Italia non avremo la sanità garantita, secondo i numeri presentati nel DEF. Ci preoccupa il rapporto della spesa sanitaria con il PIL indicato nel DEF, perché rimane identico al 2018, mentre addirittura si prevede una diminuzione gravissima che lo porta al 6,4 per cento nel 2022. In conclusione, permettetemi di dire che è ancora più grave l'ipotesi di utilizzo della clausola di salvaguardia dell'aumento dell'IVA: ciò significa usare parte della spesa sanitaria, oggi destinata all'assistenza sanitaria, per pagare l'aumento dell'IVA e non le prestazioni che già mancano, come dimostrano le lunghe liste d'attesa. La vostra politica economica ci dice che se hai bisogno di curarti o hai i soldi o muori; che se vuoi avere un lavoro o vai all'estero o vieni mortificato da poche decine di euro; che se hai un'impresa o ipotechi tutto con le banche, sperando che il prossimo DEF preveda una vera e propria flat tax, oppure vendi la tua azienda per pagare i debiti. Questa è l'Italia che avete disegnato nel vostro DEF: se non siete in grado di affrontare i problemi chiave dell'Italia in maniera seria e concreta, lasciate il Governo, lasciateci liberi, lasciate liberi gli italiani.
2019-04-18	FI	SiclariMarco	Signor Presidente, Vice Ministro, colleghi, nel Documento economico-finanziario del 2018 avevo dichiarato, nella mia prima esperienza parlamentare, il mio dispiacere, come italiano, nel prendere atto della lontananza del DEF rispetto ai veri problemi del Paese. Oggi, che discutiamo del DEF del 2019, non solo sento un dispiacere maggiore rispetto ad allora, ma sento di dover affermare che state mettendo in atto verso gli italiani e verso il nostro Paese un vero e proprio bluff politico istituzionalizzato. Questo DEF, colleghi, è sostanzialmente inutile per il nostro Paese, perché è privo di contenuti reali. Dice poco sulla sanità, non vi è traccia sulla rendicontazione della quota 100 e del reddito di cittadinanza, utile a comprendere se gli impegni di spesa vengono rispettati. Non vi è traccia delle grandi opere, della TAV, necessarie per rendere competitivo il nostro Paese e creare occupazione. L'unica certezza riportata virgolettata nel DEF è l'aumento delle accise dell'IVA che possono scattare dal 22 per cento al 25,5 per cento.
