2019-09-10	M5S	BotticiLaura	È tempo di abbandonare gli slogan per passare a una politica dei fatti. Abbiamo tanto da fare. Ci aspettano sfide epocali in Italia e in Europa: dalla salvaguardia dell'ambiente al futuro dei giovani 2050. Dagli anni Ottanta in poi l'Italia non è stata capace di cogliere le sfide che la globalizzazione e le nuove tecnologie hanno lanciato. Oggi non possiamo permetterci di non coglierle. Occorre una pubblica amministrazione efficiente e tecnologica che diventi il motore del Paese. Bisogna investire nella scuola, nella ricerca, nella sanità, nella famiglia. La collega Tiziana Drago mi ha insegnato che i figli non sono un costo, ma un investimento, ed è verissimo. Quale investimento più sano se non il futuro generazionale dell'Italia? Ben venga, allora, una riforma fiscale: pagare tutti per pagare meno. È necessario un riordino del sistema delle agevolazioni fiscali, sempre salvaguardando l'importante funzione sociale e redistributiva. Occorre un sistema sempre più semplificato e premiante: chi inquina paga. Bisogna puntare ancora di più sulle energie rinnovabili; non possiamo più attendere. Siamo in un ritardo spaventoso. Un'altra sfida che ci attende è l'Unione europea. I nostri figli, anche tramite i programmi Erasmus, hanno sviluppato una cittadinanza europea. Perché non offrirgli una vera Europa unita? Anche il presidente Mattarella ha ribadito che il necessario riesame delle regole del Patto di stabilità può contribuire a una nuova fase rilanciando gli investimenti in infrastrutture, reti, innovazione, educazione e ricerca. Non possiamo avere un'Europa unita se i cittadini degli Stati membri si sentono tanto diversi gli uni dagli altri. Abbiamo bisogno di politiche economiche espansive che tutelino il cittadino e l'ambiente. Concordo con il collega Bagnai quando sostiene che sia necessario coinvolgere il Parlamento nei rapporti con l'Europa. Confido, infatti, nella prosecuzione del percorso iniziato dando attuazione alla fase ascendente stabilita dalla legge n. 234 del 2012. Con la stima che nutro nei confronti del Presidente e del lavoro fatto in questi sedici mesi, sono sicura che andremo avanti. Dobbiamo pensare alle imprese italiane, specialmente alle più piccole, che fanno tanta fatica a stare a galla: hanno bisogno di un sistema bancario e del credito che le aiuti, che le faccia crescere. Sono la spina dorsale dell'Italia e possono, attraverso i nuovi canali commerciali, diventare il motore economico dell'Europa. Serve rilanciare il Paese con un progetto di ampio respiro, coraggioso, visionario e acuto. Dobbiamo realizzare una politica di sviluppo strategica: non possiamo pensare limitatamente al prossimo anno, ma prefissarci obiettivi che guardino al 2050, fissando un cronoprogramma, passo dopo passo. Non ci siamo tirati indietro nel 2018 e non lo faremo nemmeno oggi.
2019-09-10	M5S	GranatoBiancaLaura	Tutti i temi hanno uguale dignità e rilevanza per lo sviluppo sano di un Paese come l'Italia e devono essere trattati con lo stesso riguardo e la stessa attenzione attraverso un'efficace sinergia tra Governo e Commissioni competenti. Lo dico perché nella precedente esperienza alcune materie, tra cui istruzione e beni culturali, sono state toccate solo marginalmente dall'azione sinergica di Governo e Commissioni, eppure in queste noi ritroviamo gli asset strategici naturali per lo sviluppo ottimale e sostenibile del nostro Paese. Partiamo dai nostri beni culturali, che sono il cuore pulsante della millenaria civiltà occidentale. In Italia c'è la più alta concentrazione al mondo di beni culturali, eppure oggi questo settore strategico è in sofferenza per politiche che hanno aperto alle privatizzazioni, a tagli e speculazioni che pregiudicano la salvaguardia del nostro patrimonio. Ancora oggi destiniamo a questo fondamentale settore meno dell'1 per cento del PIL; tanti operatori culturali e tanti intellettuali ci chiedono di porre rimedio a tutto ciò, per cui dobbiamo farlo necessariamente rimpiazzando innanzitutto tutto il personale andato in quiescenza anche con quota 100, indispensabile a presidiare e valorizzare tutto il nostro patrimonio e a consegnarlo alle generazioni future così come lo abbiamo ricevuto. Non dobbiamo dimenticare che è per tutti i nostri beni culturali che siamo apprezzati in tutto il mondo e che intorno a questo patrimonio può svilupparsi il circuito del turismo e della ricerca scientifica, con un'attrattiva internazionale tale da colmare, se non tutto, parte considerevole del nostro deficit occupazionale. Il nostro patrimonio culturale costituisce la principale e identitaria vocazione naturale del nostro territorio: ancora non si capisce perché o nell'interesse di chi guardiamo sempre oltre, dimenticandocene. Forse perché i beni culturali sono il patrimonio inviolabile dei cittadini liberi, nonché un pericoloso concorrente per la spartizione della torta del bilancio dello Stato rispetto a privati sempre più avidi e meno inclini alla solidarietà? Forse perché un corretto e democratico uso di tutte le risorse del nostro Paese può regalare un futuro libero ai nostri giovani, tenendoli lontani dalle forme di sfruttamento che oggi soffocano ogni loro prospettiva? Cosa dire poi dell'istruzione, che è la premessa imprescindibile di questa economia circolare della cultura? Dobbiamo necessariamente fare passi indietro rispetto alle politiche degli ultimi venti anni, quando qualche sedicente progressista ha deciso che la scuola potesse essere gestita più efficientemente come un'azienda, un po' come la sanità e abbiamo visto com'è finita. Da quel momento i livelli di apprendimento dei nostri studenti hanno iniziato una discesa costante che è diventata presto crollo verticale. Il Governo Berlusconi ha sottratto ben otto miliardi di euro alla scuola pubblica, mai più rimessi nel capitolo di spesa del bilancio. Aziendalizzazione ha significato stravolgimento delle priorità delle scuole, per cui ormai alle esigenze della didattica si sono sovrapposte quelle delle attività extracurricolari attorno alle quali ruotano interessi economici che di fatto ostacolano il consolidamento degli apprendimenti fondamentali e negano la possibilità di acquisire conoscenze e competenze agli studenti che hanno tempi di apprendimento diversi. Siamo sostanzialmente tornati alla scuola per i pochi che hanno capacità di apprendere anche nei ritagli di tempo, mentre cresce il numero degli studenti che acquisiscono i titoli di studio senza i corrispondenti requisiti culturali. Lei, signor Presidente, ne avrà certamente avuto riscontro durante la sua esperienza di docenza universitaria. L'aziendalizzazione della scuola, che ne ha abbattuto progressivamente la qualità, ha favorito di fatto il mercato della formazione privata, che ingrassa fuori da ogni controllo qualitativo, dagli asili nido, in cui il personale viene retribuito anche 50 centesimi all'ora, alle università. L'idea strisciante sottesa a tale progetto di approdare ad un sistema integrato anche per l'istruzione, come per la sanità, va scongiurata a qualunque costo, se si guarda alle diseguaglianze che quest'ultimo ha generato nei vari territori spaccando letteralmente in due l'Italia. La scuola si può salvare con interventi di buonsenso, con un reclutamento selettivo e trasparente del personale, garantendo continuità didattica anche e soprattutto ai disabili, assegnando ai ruoli tutte le cattedre vacanti e disponibili anche di sostegno, gestendo in modo sostenibile la mobilità del personale, restituendo centralità alla didattica e la governance delle scuole agli organi collegiali, ripristinando le priorità coerenti con gli obiettivi delle scuole, retribuendo adeguatamente tutto il personale scolastico. Anche per l'università, per la ricerca e per l'AFAM bisogna avere il coraggio di cambiare, a cominciare dal reclutamento trasparente e meritocratico, passando per l'estensione del diritto di accesso alle università a numero programmato, garantendo una tassazione più equa, maggiore riguardo all'inclusione per i ragazzi con disabilità e disturbi specifici di apprendimento, investimenti pubblici nella ricerca e nel personale che vi opera. Le ho brevemente elencato le priorità di settori fondamentali per la vita dei cittadini, che costituiscono le basi dell'economia circolare della cultura, un'economia sostenibile che non contempla sfruttamento e disagio sociale, che è portatrice di benessere, progresso, civiltà e democrazia. Una ricetta alla portata del nostro bel Paese che richiede il coraggio e la determinazione al cambiamento rispetto alle politiche degli ultimi venti anni, doti che l'hanno contraddistinta, presidente Conte, nell'esperienza di governo che ci siamo lasciati alle spalle. Auguri.
2019-09-10	M5S	LomutiArnaldo	Credo che mai come questa volta questi aggettivi superlativi li dobbiamo lasciar perdere, perché bisogna riservarli - di questo sono convinto - per il momento in cui questo Governo nascente saprà realmente varare leggi importanti per il bene collettivo e non personale o di partito o - peggio ancora - lobbistico. E ciò anche perché il compito cui siamo chiamati oggi, nel dare il voto di fiducia al nuovo Esecutivo guidato dal professor Conte, non è quello di far credere agli italiani di andare verso Lamerica, come era convinto di fare Spiro, il personaggio del bel film di Gianni Amelio, intendendo per Lamerica non un luogo fisico e reale, ma il luogo ideale della perfezione amministrativa. Votando sì al nuovo Governo guidato dal premier Conte, non aspiro a realizzare un paradiso, perfetto e impeccabile e magari utopico. Per noi italiani, che veniamo da centocinquant'anni anni di storia travagliata - prima la colonizzazione dell'Italia meridionale, poi il fascismo, poi la Repubblica in tutte le sue fasi, che ha alternato grandi leggi, come quelle sui diritti dei lavoratori, a pessime espressioni di inciuci politici lobbistici - aspiro a ben altro, che già nel suo termine è devastante, innovatore e rivoluzionario. Come senatore e come cittadino di questa nuova avventura governativa aspiro a dare il mio contributo affinché questo bellissimo Paese, che si chiama Italia, diventi finalmente normale; un Paese normale dove io, in qualità di cittadino, non debba aver paura di un semplice e quotidiano gesto come quello di prendere qualcosa dallo scaffale di un supermercato; dove non devo temere i tempi della giustizia e la qualità della sanità pubblica; non devo temere l'ambiente in cui vivo e non devo temere di essere europeo; un Paese in cui non devo esporre la funzionalità del mio fegato a un costante travaso di bile, perché in centocinquant'anni anni non siamo riusciti a collegare la burocrazia alle esigenze reali del Paese, la pubblica amministrazione alle necessità del cittadino, il lavoro al futuro dei nostri figli, perché magari, mentre in Inghilterra trovano i finanziamenti per le start up innovative di tanti giovani laureati, in Italia è più facile che si trovino per i figli e i nipoti dei baroni dell'università. Ritengo che nessun Governo che nasca da una folle legge elettorale, un sistema maggioritario che si comporta da proporzionale, possa aspirare a realizzare in Italia Lamerica, un Paese ricco, bello e pure nobile, perfettissimo, dove tutto funziona come un orologio svizzero. Chiedo scusa ai colleghi, ma oggi vado forte con i luoghi comuni. Credo però che, se ci impegniamo verso noi stessi e verso i nostri figli, può invece essere alla nostra portata la possibilità di trasformare finalmente l'Italia in un Paese normale, dove fondamentalmente il cittadino si fida dello Stato e lo Stato dei suoi cittadini. Sembrerà strano, ma siamo una Nazione che non si fida delle sue istituzioni e - quel che è peggio - l'impressione diffusa è che le nostre istituzioni vessino i cittadini. Non rinnego nulla del precedente accordo di Governo, ma dico che non può nascere mai una nuova e normale Italia se solo penso all'articolo 12 contenuto nel testo dell'autonomia regionale presentato dalla Lega, articolo fatto poi cassare dal MoVimento 5 Stelle e dal premier Conte; o se penso alla dichiarazione dell'altro giorno del Governatore lombardo, Attilio Fontana: «O ci danno la scuola o facciamo una legge tutta nostra». Benvenuti in Italia! Se dai diamanti non nasce nulla - cito Fabrizio De André - nessuna Italia normale può nascere dai ricatti o da una compagine di Governo che, con la richiesta di autonomia regionale avanzata, in realtà, non pensa a ciò che consente la Costituzione italiana, ma guarda ad altri Paesi - penso alla Slovenia o alla Croazia - in barba a centocinquant'anni di lotte, dolori, dispiaceri, ma anche sentimenti, amori e vittorie per realizzare uno Stato unitario dove l'identità italiana trovi il suo naturale rifugio. Cari colleghi, signori Ministri, permettetemelo, senza alcuna voglia di fare polemiche in questo giorno importante: non può nascere alcuna Italia normale nemmeno con il protagonismo di chi in questa maggioranza sperabile esterna soluzioni, critiche e scenari futuri, che - a mio avviso - sono di divisione e non di marcia in comune.
2019-09-10	PD	BiniCaterina	Signor Presidente, in questo poco tempo purtroppo non ho modo di parlare di contenuti come vorrei, ma la invito a occuparsi della vera emergenza del Paese, che non è l'immigrazione, ma è il lavoro. Saremo al suo fianco per individuare le risposte migliori per i nostri giovani, per i precari, per i disoccupati. Inoltre dobbiamo essere vicini agli ultimi (questa è l'ultima sollecitazione che voglio fare) con politiche per il sociale e per la sanità, perché ci sia davvero un'uguaglianza di diritti e una piena accessibilità nella vita. Non dimentichiamo il passato, ma oggi diamo una fiducia sul futuro, perché pensiamo che sia più utile soffermarci non su da dove veniamo, ma su dove vogliamo andare. Su questo, su dove vogliamo andare sta la misura della nostra alleanza e su questo ci confronteremo con lealtà.
2019-09-24	PD	TariccoMino	Signor Presidente, il Gruppo PD condivide il provvedimento in esame e la decisione di permettere a tante piccole imprese di gestire determinate produzioni locali in modo semplificato (in un contesto di grande garanzia sulla qualità, offerto dalla collaborazione con il mondo della sanità locale) e con un marchio che le caratterizzi, nonché di offrire a tanti piccoli agricoltori e produttori la possibilità di valorizzare al meglio le loro produzioni. Crediamo che questo sia un dato positivo, come già detto in altri interventi, soprattutto tenendo conto del contesto territoriale nel quale siamo inseriti, fatto di tante aree interne, montane, collinari e pedemontane, che con il testo in discussione possono veramente esprimere delle produzioni piccole ma assolutamente significative per i consumatori e per la tenuta economica di queste aziende e di questi territori. Esprimeremo quindi un voto favorevole sul provvedimento in discussione anche per il clima di grande collaborazione vissuto in Commissione nei lavori relativi a questo provvedimento, che per inciso ha fatto sì che dei trenta emendamenti da noi presentati tutti sono stati o approvati o assorbiti in altri emendamenti. Crediamo sia un dato significativo di come bisognerebbe sempre lavorare su provvedimenti che reputiamo utili per il territorio. Come detto, il testo in esame dà alle aziende la possibilità di confezionare particolari produzioni, con deroghe sul piano amministrativo e della semplificazione sotto il controllo delle ASL. È prevista un'etichettatura e la promozione di questi prodotti attraverso un paniere che sarà poi garantito da un marchio che sarà portato avanti dal Ministero delle politiche agricole alimentari, forestali e del turismo. Tutto questo in un ambito di assoluta compatibilità con la protezione delle denominazioni d'origine, con le indicazioni geografiche protette, con le specialità tradizionali garantite e con i regolamenti comunitari che sovrintendono la materia, come il regolamento n. 852 del 2004 e tutti gli altri. Sono garantiti da apposite linee guida che verranno varate da un decreto i requisiti strutturali, le garanzie di sicurezza del prodotto e le attività di prevenzione e di formazione; è previsto un sistema di controllo e di sanzioni molto puntuale e preciso. Come si diceva prima, stiamo parlando di piccole produzioni locali che saranno commercializzate nella provincia di produzione e in quelle contermini. Anche alla luce delle esperienze delle Regioni che lo hanno già sperimentato, riteniamo che questo meccanismo possa dare risposte interessanti per tutta una serie di reti d'imprese che potranno veramente valorizzare al meglio le loro produzioni. Crediamo possa essere un provvedimento molto utile. Ci sarà ancora da lavorare perché è previsto un decreto che vada a definire, insieme alle linee guida, le quantità, le modalità e le prescrizioni previste per garantire queste produzioni. È, quindi, previsto un lavoro che coinvolgerà ancora le Commissioni per definire in modo puntuale tutte le regole del gioco, ma vogliamo scommettere sul provvedimento proprio per creare condizioni migliori che permettano di valorizzare al meglio tante nostre produzioni. Proprio per questo motivo, il voto del Partito Democratico sarà favorevole e vogliamo scommettere con fiducia sulle opportunità che daremo a queste imprese.
2019-09-25	FI	RizzottiMaria	Comunque in Commissione avevamo lavorato molto bene. Ringrazio il sottosegretario Sileri al quale vanno tutti i miei auguri. In Commissione sanità abbiamo sempre cercato di operare non in funzione delle nostre idee politiche, ma nel senso di un interesse comune per il benessere e la salute dei cittadini.
2019-09-25	FI	RizzottiMaria	Signor Presidente, colleghi, il fenomeno delle intimidazioni e degli atti di violenza nei confronti degli operatori sanitari, medici, paramedici, veterinari, farmacisti e talora di altri pazienti, in costante e preoccupante aumento, conferma che siamo in uno stato di vera e propria emergenza. Le cronache giornaliere registrano che gli episodi di violenza avvengono in contesti variegati, isolati in seno a realtà notoriamente critiche o in aree del Paese con una forte presenza della criminalità organizzata. In tutte le situazioni, tuttavia, l'operatore è solo. Nel corso dell'attività lavorativa gli operatori sanitari sono esposti a numerosi fattori che possono essere dannosi, come aggressioni, omicidi o altri eventi criminosi, che rendono non più procrastinabili misure di prevenzione e protezione dei lavoratori. Sono in media tre al giorno le aggressioni denunciate in Italia dagli operatori sanitari e soltanto nell'ultimo anno le violenze ammontano a circa 1.200 casi. A subire la violenza fisica sono soprattutto le donne. Ricordo ancora la mia esperienza di giovane medico, quando facevo guardie mediche in avamposti isolati, ovviamente con turni festivi o notturni: ogni volta che suonava il campanello mi assaliva uno stato d'ansia, perché all'epoca non c'erano certamente né i videocitofoni, né i telefoni cellulari. È stata ricordata la dottoressa Labriola, uccisa sei anni fa in Puglia, quando la politica iniziò a interrogarsi su cosa avrebbe potuto fare per questi fenomeni in costante crescita. Certo, quel caso in particolare aveva reso drammaticamente evidente la mancanza di un organismo preposto alla tutela della sicurezza e alla prevenzione e aveva mostrato come le non poche difficoltà operative penalizzino gravemente lo svolgimento del lavoro degli operatori del settore. Per queste ragioni e per assolvere alle esigenze di sicurezza provenienti dagli accorati appelli di tutti gli operatori sanitari, all'inizio della legislatura presentai uno specifico disegno di legge che non aveva lo scopo di osservare quanto quello di intervenire a tutela della sicurezza del personale e dei pazienti negli ospedali. In una sanità intesa come impresa in cui l'erogazione di servizi e prestazioni viene equiparata alla produzione delle merci, si annida anche la crisi del rapporto fiduciario medico-paziente, con le sue conseguenze più preoccupanti come il dilagare di fenomeni di violenza e il diffondersi di un'informazione sanitaria non attendibile. Laddove il paziente è un consumatore, il medico perde automaticamente autorevolezza e diventa detentore di un sapere da scaffale. Occorre dunque impegnarsi per recuperare questo rapporto e spero che l'accorato appello giunga al Ministro, che aspettiamo presto in Commissione per conoscere dettagliatamente le sue linee programmatiche anche in questo senso. Monitorare è importante. Compito dell'Osservatorio è monitorare episodi di violenza ed eventi sentinella e promuovere la diffusione delle buone pratiche in materia di esercenti le professioni sanitarie. Certo è bello monitorare, ma la prevenzione vera sarebbe pensare seriamente alla situazione del nostro sistema sanitario, sempre meno finanziato, sempre più a macchia di leopardo, con personale sottoposto a turni massacranti per il blocco del turnover, con liste d'attesa inaccettabili, con attese al pronto soccorso inimmaginabili. La mancanza di fiducia nel medico deriva anche dal fatto che si consulta più facilmente il dottor Wikipedia che non il professionista. Sono le false informazioni sulla Rete che rendono sempre più critico il rapporto di fiducia medico-paziente-operatori sanitari.
2019-09-25	FdI	ZaffiniFrancesco	Signor Presidente, innanzitutto rivolgo al sottosegretario Sileri un in bocca al lupo per il lavoro che l'aspetta. Quello in esame è un testo su cui in Commissione abbiamo lavorato alacremente e che abbiamo cercato, per quanto possibile, di migliorare. Rispetto all'attenzione nei confronti delle professioni in generale, dei vari ordini professionali e delle categorie, nella nostra Italia per troppo tempo si è trascurato di rappresentare degnamente un mondo intero di gente che, sin dalla mattina, fa il suo dovere, e lo fa con dedizione e abnegazione. È un mondo che lo Stato non vede, non riconosce e non qualifica degnamente. Questo, però, è un discorso più ampio e vasto. Per quel che attiene le professioni sanitarie, c'è tutto un universo di motivazioni che induce a prestare una maggiore attenzione nei confronti degli operatori della sanità. Il Gruppo Fratelli d'Italia ha depositato, insieme alla senatrice Rauti e ad altri firmatari, una propria proposta che conteneva, come punto saliente, il riconoscimento della qualifica di pubblico ufficiale agli operatori sanitari in generale, per quanto ci riguardava, e in particolare per quelli del servizio pubblico e ancora più in particolare per quelli dell'emergenza-urgenza che, nell'esercizio delle loro funzioni, per l'appunto, espletano un pubblico servizio. Questo universo avrebbe rappresentato in modo migliore la necessità di coprire e garantire, nell'esercizio delle loro funzioni, detti professionisti. Il testo non prevede questo, ma contiene una serie di inasprimenti di pene per i reati commessi a danno di tali operatori. Noi ovviamente ne condividiamo profondamente lo spirito e non possiamo, evidentemente, che votare a suo favore e, quindi, annuncio il voto favorevole del Gruppo di Fratelli d'Italia. È però del tutto evidente che siamo veramente solo all'inizio di quel percorso da intraprendere per una degna e completa protezione degli operatori della sanità, a cominciare da quelli della sanità pubblica. Non abbiamo grande fiducia nell'ennesimo osservatorio - siamo tutti profondamente osservati - e riteniamo che quello previsto dal provvedimento non verrà realizzato. L'invarianza di spesa, rispetto a questo, ci dà quasi una certezza rispetto a quanto accadrà, e cioè che tale osservatorio resterà solo sulla carta e non produrrà alcunché. A prescindere da questa che è una facile profezia, noi reputiamo che ci sarebbe veramente molto altro da fare. Volendo però vedere la bottiglia mezza piena, auspichiamo che ci si lasci quantomeno la possibilità di migliorare e lavorare sulla bottiglia mezza vuota, con il nostro consueto spirito che ha dettato anche la scelta di votare a favore del provvedimento in esame. Gli operatori da tempo attendono che lo Stato si manifesti in termini di protezione nei loro confronti, rispetto a quanto accade loro nelle lunghe nottate di servizio presso le strutture ospedaliere del Paese e anche nel corso delle loro uscite: basti pensare alla guardia medica, che si inerpica per le strade buie della campagna della nostra bellissima Italia, o al veterinario pubblico che si trova a dover ispezionare la stalla di un agricoltore armato di forcone - come ci è stato raccontato - assolutamente contrariato dall'Ispezione stessa. È tutto un mondo - come ho già detto all'inizio del mio intervento - di seri professionisti, di grandi operatori, di gente che noi abbiamo formato e qualificato e che paghiamo, anche se poco, e alla cui protezione evidentemente dobbiamo provvedere. Per tutti questi motivi, il voto del Gruppo Fratelli d'Italia sarà complessivamente favorevole e aggiungo che riproporremo il nostro testo di legge per ottenere finalmente quella che noi reputiamo debba e possa essere veramente la soluzione, e cioè il riconoscimento della qualifica di pubblici ufficiali nell'esercizio delle loro funzioni agli operatori della sanità quantomeno pubblica, ma - per quanto mi riguarda - in generale agli operatori del Servizio sanitario nazionale.
2019-09-25	LN	ArrigoniPaolo	Allora non c'erano i servizi, c'era la volontà di comprimere la sanità, non c'erano manutenzioni; sono passati dodici anni e da parte della Giunta regionale e della Provincia di Pesaro e Urbino non è stato fatto assolutamente nulla.
