2019-01-15	M5S	GallicchioAgnese	Colleghi, è così evidente quanto queste nomine, in questo settore e in questo periodo di proroga forzata del mandato, siano solo espressione della necessità di riempire gli organigrammi e, anzi, di occupare in fretta le ultime poltrone. È una vergogna! Siamo di fronte quindi ad una nomina politica in danno al merito? Siamo addirittura contro l'interesse della salute pubblica? Sorge quindi il dovere di denunciare con forza e ci confronteremo anche con il nostro Ministro della salute, Giulia Grillo, che sta portando avanti tante battaglie in merito. Ciò in quanto è assolutamente necessario porre in essere ogni iniziativa che possa fare luce su tali eventi e monitorare continuamente l'evoluzione della gestione sanitaria lucana, che è e deve rimanere una sanità di eccellenza per la collettività lucana e non solo. Se posso aggiungere, ogni azione delle istituzioni pubbliche fatta non nell'assoluto rispetto del diritto della salute del cittadino e in danno del merito e dell'efficienza deve essere sempre verificata, contrastata e vanificata.
2019-01-15	M5S	GallicchioAgnese	Grazie, signor Presidente, Abbiamo appreso nei giorni scorsi, dal telegiornale e dalle prime pagine dei quotidiani regionali, una denuncia che ha lasciato sgomenti i cittadini lucani, me compresa. C'è stata infatti la nomina del direttore generale dell'ospedale San Carlo, la più grande realtà ospedaliera lucana, che rappresenta un'eccellenza in Basilicata, nella persona di Massimo Barresi, che nella graduatoria espressa dalla commissione valutatrice del concorso è risultato arrivare dietro l'altro concorrente, Giuseppe Spera, che risultava avere un curriculum migliore e che, pur essendo più meritevole, è rimasto escluso. È stato invece dichiarato meritevole, tra i due, il candidato con la valutazione più bassa. Stiamo parlando della nomina del direttore generale di un grande ospedale. Inoltre il contratto è stato sottoscritto in tutta fretta, con una delibera di designazione ancora non pubblicata, né nel bollettino ufficiale e neanche sul sito on line della Regione. Tale emergenza è tra l'altro immotivata, perché ci sono i commissari in carica e sono arrivate ben due diffide alla stipula. Tale fretta, quindi, sembra mirata solo a disarmare il ricorrente al TAR, per non permettere l'ottenimento della sospensione urgente delle procedure di assunzione. Ancora più grave è che stiamo parlando di una Regione in cui i pubblici ministeri hanno indagato su concorsi pilotati nella sanità, i vertici della sanità sono stati gravemente coinvolti, il Governatore, come sappiamo, è stato arrestato, è ora in divieto di dimora ed è stato sospeso dal suo incarico. Abbiamo inoltre la Giunta, scaduta da tempo, che fa nomine dell'ultimo minuto e la facente funzione che trattiene la poltrona e rimanda le elezioni a maggio. Voglio però ricordare che il MoVimento 5 Stelle ha presentato ricorso al TAR, che l'altro giorno ci ha dato ragione, obbligando la Giunta regionale ad indire a breve tempo le elezioni e ad uscire di scena al più presto.
2019-01-17	M5S	GranatoBiancaLaura	Signor Presidente, la Calabria, la cui sanità è commissariata ormai da un decennio, dopo la sciagurata parentesi del governo di centrodestra a guida Scopelliti, tuttora in carcere, sta vivendo un'altra stagione politica nefasta, stavolta grazie all'attuale presidente Mario Oliverio, del Partito Democratico. A seguito di un'inchiesta coordinata dal procuratore Gratteri è stata disposta per Oliverio dal GIP, confermata dal tribunale del riesame, la misura cautelare dell'obbligo di dimora a San Giovanni in Fiore, suo Comune di residenza. Tuttavia, né la presenza dei commissari alla sanità nominati da circa un mese dal ministro Grillo, né la misura restrittiva che gli impedisce di recarsi nelle sedi istituzionali di Reggio Calabria e Catanzaro per svolgere il suo mandato politico, sono riusciti a dissuaderlo dal procedere imperterrito alla nomina di ben sette dirigenti su dieci alla sanità. Il tutto senza alcun passaggio, se non meramente informativo, dai commissari ministeriali. Accadeva lo scorso 14 gennaio che la giunta calabrese procedesse alla nomina, nonostante le diffide del Ministro della salute, di alcuni degli artefici del dissesto finanziario e di una new entry, la moglie del consulente di Oliverio. Come al solito, a pagare saranno i calabresi, rei di aver incautamente dato fiducia nel 2014 ad un governatore che sta usando la Regione come cosa sua, nel disperato tentativo di mantenere in piedi la propria carriera politica, attraverso prebende e incarichi ai suoi fedelissimi, in spregio a qualsiasi principio di buon andamento e di disciplina ed onore prescritti dalla nostra Costituzione. Dal 2014 ad oggi il disavanzo sanitario della Calabria è passato da 30 a 160 milioni di euro. Una cifra spaventosa, in larga misura determinata da una gestione disinvolta delle aziende sanitarie da parte proprio di quei direttori generali nominati da Oliverio, che egli stesso avrebbe dovuto sottoporre alla procedura di decadenza imposta dalla legge regionale n. 11 del 2004. Nonostante le denunce dei parlamentari del MoVimento 5 Stelle ciò, ovviamente, non è mai avvenuto. Anzi, i direttori generali in questione, malgrado le perdite milionarie provocate, sono stati perfino premiati con bonus di migliaia di euro. Alcuni di loro, addirittura, sono stati riconfermati alla guida di aziende sanitarie in veste di commissari. Nel frattempo, nonostante un disavanzo in esponenziale aumento, la sanità calabrese ha toccato vette da terzo mondo, fino alle ingessature effettuate con cartoni da imballaggio. A fronte di questa mala gestio, ovviamente, l'emigrazione sanitaria dalla Calabria raggiunge i 320 milioni di spesa all'anno, facendo registrare il peggior dato in Italia. E cosa dobbiamo dire delle immancabili regalie ad alcuni privati interni al sistema politico, con rischio di infiltrazioni mafiose e interessi delle cosche sempre dietro l'angolo? Un quadro drammatico, le cui responsabilità sono, chiaramente, politiche. In considerazione dei danni incalcolabili della gestione Oliverio, messo in un angolo e ormai fuori controllo, auspico da calabrese e da parlamentare eletta in Calabria che, finalmente, abbia un sussulto di orgoglio personale e si dimetta. In alternativa, sarebbe opportuno valutare la possibilità di sospenderlo dal suo incarico in applicazione della legge Severino, in quanto gli effetti delle restrizioni del suo provvedimento cautelare sono identici a quelli per i quali la legge contempla la pena della sospensione dalla carica. La Calabria, dopo il cambiamento di rotta del 4 marzo, non chiede soldi ma solo di essere salvata dalla sua classe dirigente e politica con interventi che mettano in primo piano l'onestà, la lealtà istituzionale, la giustizia e il lavoro.
2019-01-28	FI	BinettiPaola	Delle mie ne ho raccolte almeno venti, e trattano problemi molto concreti che riguardano: bambini che sono stati - a mio avviso - ingiustamente allontanati dalla famiglia; alcuni aspetti profondamente problematici nella gestione della Croce Rossa; le dinamiche concrete della scuola e anche in ordine a una serie di figure professionali; la sanità, la gestione di farmaci e, in particolare, di farmaci orfani che risultano introvabili sul territorio.
2019-01-28	FdI	ZaffiniFrancesco	Signor Presidente, colleghi, rappresentante del Governo, io parlerei dell'articolo 9, quello che tratta i temi della sanità, sempre che non rientri nei 40 emendamenti che voi vi accingete a cassare, nel qual caso avremo fatto un minimo di esercizio dialettico. Parliamo però di argomenti che comunque stanno in campo in modo pressante. È stimata una deadline al 2025, dove autorevoli fonti parlano della mancanza di circa 15.000 medici per effetto di una sorta di tempesta perfetta che mette insieme numerose cause, tutte comunque che contribuiscono a creare un potenziale gigantesco pericolo per il nostro Servizio sanitario nazionale, che proprio quest'anno celebra i suoi quarant'anni, tra pregi e difetti. L'articolo 9 del decreto semplificazioni tratta questa materia altamente complessa in modo tale - per rimanere in termini medico-sanitari - da curare sintomi ma non la causa, il malessere di fondo. Viene aperta all'esercizio della professione medica una sorta di deregulation che risponde certamente, a modo suo, a l'esigenza reale di garantire i numeri al Servizio sanitario nazionale, ma che crea dei problemi enormi in termini di competenze e di tranquillità dell'utente del Servizio stesso. Provate, colleghi, a immaginare un vostro accesso al pronto soccorso di un ospedale - può accadere ogni giorno a tutti noi - e di trovarvi di fronte un medico non specializzato. L'accesso al pronto soccorso è uno dei momenti maggiormente critici nella vita di ognuno di noi, perché si denuncia un malessere e molto spesso non si ha una diagnosi precisa. Provate a pensare alla necessità di diagnosticare nei tempi utili, e cioè azzerando la latenza, un infarto: è evidente il bisogno di avere più medici dell'emergenza-urgenza e certamente aprire questa professione a medici non specializzati nell'emergenza è una vicenda che crea non poche perplessità, anzi desta una sincera preoccupazione. Oltretutto, tutta questa partita è gravata da una malinterpretazione: il problema della disponibilità di specializzati fa riferimento alla necessità di ampliare i numeri delle scuole di specializzazione. Aprire una materia così delicata a persone non specializzate dovrebbe, quantomeno, imporre l'obbligo che esse ottengano una specializzazione. Sarebbe anche possibile fare ciò a costo zero, visto che quelle persone, comunque, sarebbero pagate dal Servizio sanitario nazionale e dovrebbero essere obbligatoriamente inserite, magari in soprannumero, nei corsi di specializzazione specifica, ma questo passaggio non è previsto. Questa non è, colleghi, una questione di lana caprina tecnica: stiamo parlando di vita concreta e di pericolo concreto per la vita dei nostri concittadini. È una materia enorme, gigantesca, che viene trattata per spunti. Io spero che questo sia solo un primo passo, nel senso che si cura con l'aspirina una grave malattia in attesa di individuare, magari, la terapia antibiotica giusta - uso sempre termini utili allo scopo - ma questo non c'è nel testo. Non c'è una promessa di provvedere con un provvedimento di sistema a colmare le lacune dei medici, a spazzare via la follia del numero chiuso, aprendo magari a un rapporto virtuoso col privato, rispondendo alla necessità di aumentare i posti delle scuole di specializzazione. Non vi è niente di tutto questo. Il provvedimento in esame è un insieme di norme che sono - ripeto - opinabili e non anticipa niente di concreto. Credo e spero che il Parlamento riesca a intervenire - faccio appello ai colleghi, anche a quelli della Commissione sanità - nella sua autonomia nei prossimi giorni, andando a colmare un problema che di per sé, da solo, è in grado di far saltare il Sistema sanitario nazionale.
2019-01-28	LN	CampariMaurizio	Il decreto-legge semplificazioni vuole andare incontro alle esigenze delle imprese e delle pubbliche amministrazioni in vari campi: dalle agevolazioni economiche per l'accesso al credito alle semplificazioni procedurali per la gestione dei rifiuti, dalle regole per la partecipazione agli appalti pubblici all'accessibilità delle piattaforme digitali ministeriali, dalla semplificazione del campo delle assunzioni nel mondo della sanità e dell'istruzione ad una migliore normativa per gestire l'edilizia penitenziaria sia quella esistente, che quella necessariamente programmata.
2019-01-28	M5S	ColtortiMauro	COLTORTI, relatore. La ringrazio, Presidente. Personalmente è il mio primo decreto-legge e me lo ricorderò sicuramente, anche perché sono stati presentati 970 emendamenti. Il lavoro è stato dunque molto complesso e articolato: da una parte, rispetto alle norme contenute nel decreto-legge si impone una ristrettezza di temi; dall'altra, tutto il Parlamento vuole contribuire al miglioramento del Paese e quindi ciascun parlamentare, sia di maggioranza che di opposizione, vorrebbe inserire nel provvedimento emendamenti che, a parere dei singoli, contribuiscono a migliorare le condizioni del Paese. Se c'è tanto da migliorare, arrivano tanti emendamenti: su questo non credo ci siano da fare grandi osservazioni. Ho anche sentito pareri negativi sul decreto-legge e c'è chi dice che non semplifica nulla. Invito chi dice questo a leggere con attenzione il provvedimento, perché ci sono tantissimi emendamenti, anche quelli passati al filtro delle Commissioni riunite, che apportano notevoli miglioramenti: il primo e importantissimo è che si instaura un fondo di garanzia per le piccole e medie imprese che hanno debiti consolidati verso lo Stato. Si introducono norme per cui chi fallirebbe viene invece assistito dallo Stato. Se questa non è una semplificazione che migliora la vita dei cittadini, ditemi voi cosa si deve fare. A mio avviso, quindi, l'articolo 1 affronta questioni di fondamentale importanza per il Paese. Cosa vogliamo dire di Alitalia? Non è una questione importante? Alitalia ha oltre 11.000 dipendenti e, se non si approva la proroga proposta nel testo, fallisce. Alitalia ha una storia pregressa che, come maggioranza, non abbiamo controllato. Tutte le compagnie aeree mondiali sono andate in attivo negli ultimi cinque o sei anni del 5, 6, 8 per cento, mentre la nostra compagnia di bandiera ha debiti cospicui ed è stata sull'orlo del fallimento. Questo fallimento è stato gestito in maniera oculata? La situazione è quella che è, mentre tutte le compagnie hanno avuto profitti sul volo, la nostra non li fa. Vuol dire che è stata gestita male. Se vogliamo stare accanto alla compagnia di bandiera, e sappiamo che il trasporto aereo è un punto fondamentale del Paese, se vogliamo che il turismo e il trasporto aereo italiani non siano gestiti da compagnie straniere, da Lufthansa o da Air France, dobbiamo recuperare questa compagnia, darle ossigeno e pensare alle persone che vi lavorano e che, se Alitalia fallisse, sarebbero sul lastrico. Penso che questo sia estremamente importante. L'articolo 3 affronta vari temi, come la soppressione del Sistri, che non è mai stato attivato e non è mai decollato. Forse i colleghi non sanno che è stato proposto un emendamento per la registrazione informatica degli stessi dati in capo a un Ministero. Il Sistri viene soppresso perché finora non ha funzionato. C'è, poi, un intervento che riguarda il programma della pesca, che è una risorsa importantissima del Paese. Tantissime persone vivono di pesca: potenziare, anche solo di poco, questo settore è una semplificazione e un aiuto al Paese. L'articolo 3 si occupa, inoltre, dell'agibilità delle strutture in cui operano i lavoratori dello spettacolo. Dove non ci sono le condizioni, queste persone non dovrebbero lavorare, in funzione della non agibilità delle strutture. Sappiamo che gli incidenti sul lavoro sono una delle questioni più importanti in questo Paese, quindi affrontiamo questo argomento cercando di evitare che si verifichino. Sulla regolazione dell'omesso versamento delle ritenute previdenziali (DURC), abbiamo allungato i tempi. Le persone in difficoltà nel regolarizzare queste posizioni e che vedono fallire la ditta, magari, se possono disporre di tempi più lunghi, non falliscono. È una semplificazione che va incontro alle piccole e medie imprese. Abbiamo cercato di semplificare la concessione di zone logistiche semplificate (ZLS) alle piccole e medie imprese, pur mantenendo clausole rigide; attualmente, infatti, se un'impresa vuole intraprendere la propria attività in una ZLS, incontra una serie di contrasti burocratici e amministrativi veramente complessi. Andiamo loro incontro. Vogliamo dire che l'etichettatura dei prodotti agricoli non è una semplificazione, non è un aiuto per questo Paese? Tutti sappiamo che il made in Italy è una delle cose più importanti per l'Italia, per il nostro bilancio e per i fondi che giungono in questo Paese; sappiamo di essere conosciuti in tutto il mondo per il made in Italy e finalmente mettiamo delle etichette facilmente leggibili, che permettono di tracciare i prodotti e sapere se ciò che mangiamo è prodotto in Cina, in Uzbekistan o chissà dove e che può essere composto da organismi geneticamente modificati. Non è importante questo? Il provvedimento reca poi regole per il pignoramento degli immobili, andando incontro alle esigenze delle persone che si vedono togliere la casa perché hanno debiti, magari con lo Stato, e nel momento in cui arriva il pignoramento sono costrette a lasciare la casa, anche se per due o tre anni non viene venduta. Introduciamo quindi delle regole affinché queste persone possano continuare a vivere in quella casa finché non viene venduta. A mio parere queste sono certamente semplificazioni. Tutti sappiamo che quella avvenuta a Rigopiano è una tragedia. Spesso gli eredi delle persone che vi sono morte non hanno denaro per costituirsi parte civile e avanzare le proprie rivendicazioni. Non sono quindi importanti i provvedimenti per Rigopiano? Vorrei ben vedere che qualcuno dica di no. Il provvedimento reca poi norme per far fronte al sovraffollamento carcerario. Sappiamo che le carceri sono sovraffollate, abbiamo avanzato delle proposte per costruirne di nuove, ma c'è bisogno di norme e di attività in questa direzione. Conosciamo altresì l'importanza del contenimento dei costi del Servizio sanitario nazionale, perché molte Regioni stanno barcollando sotto le spese immense fatte in tale ambito. Non occorre poi che dica come la sanità è stata trattata in questo Paese: nelle Regioni sono stati chiusi i centri di primo soccorso, sono stati chiusi moltissimi ospedali. L'articolo 10 reca norme sui noleggi con conducente (NCC). Siamo andati incontro a una normativa che era bloccata da anni; abbiamo fatto delle scelte, certamente molti NCC non ne saranno contenti, ma sappiamo che c'erano delle irregolarità per alcune Province e per alcune Città metropolitane e Roma è una di queste. Sicuramente a livello nazionale con queste regole non andremo incontro a tutte le esigenze specifiche, ma bisognava compiere delle scelte e lo abbiamo fatto. L'articolo 11 reca disposizioni su un concorso per assunzioni nell'area militare. Duole anche a me non poter ammettere dei giovani che prima avevano i requisiti, ma ricordo, in particolare all'opposizione che mi sta davanti, che si tratta di una legge introdotta dal Partito Democratico. Certo, noi ora potremmo non ottemperare a questa legge, ma sembra difficile poter non seguire una legge dello Stato. Sulle trivelle credo che larga parte di questo Parlamento sia d'accordo. Abbiamo fatto un'opera d'arte accettando le esigenze del MoVimento 5 Stelle, delle forze ambientaliste di questo Paese, che erano stanche di vedere puntare tutto sul fossile e, come abbiamo dimostrato anche per quanto riguarda l'energia elettrica, ci stiamo spostando verso le rinnovabili, in maniera decisiva. Qualcuno ci accusa di bloccare il programma energetico. Innanzitutto lo ridefiniamo e ci diamo del tempo per verificare. Colleghi, non so se avete visto cosa è successo con le auto elettriche: dal momento in cui abbiamo approvato norme in favore del settore, le case automobilistiche hanno iniziato a puntare sull'elettrico. Quindi puntiamo sulle rinnovabili e facciamo delle scelte importanti per questo Paese. Sono in atto dei cambiamenti climatici epocali, in tutto il mondo, a cui deve conseguire un maggiore utilizzo delle energie rinnovabili. Il Governo del cambiamento sta andando dunque verso questa direzione, verso un mondo più pulito, che veda un minor numero di morti per inquinamento.
2019-01-29	FdI	ZaffiniFrancesco	Signor Presidente, non mi iscrivo all'elenco degli interventi da lectio magistralis, perché sono una persona pratica che spesso si intrattiene sui problemi della sanità, però la trasformazione di questo emendamento in ordine del giorno non arriva allo scopo, senatore Romeo, se non ci si scrive ciò che ha detto il senatore Errani: se non scriviamo che dobbiamo togliere il tetto dell'1,4 per cento, sono chiacchiere inutili e anche abbastanza incomprensibili. ROMEO (L-SP-PSd'Az). Se la Ragioneria dice che va bene, va bene. ZAFFINI (FdI). Se si tratta di un ordine del giorno, non serve la Ragioneria generale dello Stato. PRESIDENTE. Se volete fare una chiacchierata tra di voi, la potete fare anche fuori dall'Aula.
2019-01-29	PD	BoldriniPaola	Signor Presidente, intanto devo ancora metabolizzare quello che è stato detto e sono ancora esterrefatta per il fatto che un emendamento importantissimo per la sanità diventi un ordine del giorno, anche perché abbiamo passato giorni e giorni nelle Commissioni riunite per capire che cosa portare a casa per il comparto sanità e credo che questa notizia davvero sia ferale. Ritengo si debba intervenire il più presto possibile attraverso un emendamento, come detto dai colleghi, per sanare una situazione che ormai è insanabile, anche perché su questo provvedimento, il decreto semplificazioni, ne abbiamo viste davvero di tutti i colori. Devo ringraziare il Presidente del Senato che ha fatto ritirare emendamenti che andavano a toccare la vita delle persone come anche la libertà individuale: ricordo a tutti che abbiamo rischiato di complicare ulteriormente le dichiarazioni anticipate di trattamento, che avevamo portato a termine nella precedente legislatura, perché una mano, nella notte, voleva approvato un emendamento per complicarle ulteriormente. Grazie a Dio l'emendamento è stato ritirato, ma era un altro rischio per la libertà fondamentale delle persone e noi avevamo presentato, per questo, un emendamento. Vengo però al nostro emendamento, che tratta di un'altra questione, che riguarda tutti noi: i medici di medicina generale. Abbiamo un'altra urgenza importante, è vero che il provvedimento tocca questo tema, ma lo tocca semplificando, a mio parere, ed ecco perché questo emendamento. Fino al 2021, è possibile dare incarichi a chi sta facendo formazione, ancorché non abbia terminato la sua formazione completa, dandogli la possibilità di accedere ad un bando di concorso per medici in formazione. Il fine di questo emendamento, è di avere un decreto che stabilisca un'omogeneità di formazione in tutto il Paese, ovviamente in accordo con le Regioni, perché la formazione per i medici di medicina generale è a carico delle Regioni. Dico questo perché noi abbiamo bisogno che tutti i medici di medicina generale, come in tutte le specializzazioni, abbiano un unicum, un core business, un curriculum, in modo tale che tutti abbiano lo stesso tipo di formazione. Questa è una cosa importante che non è stata considerata. È stato approvato un mio ordine del giorno in Commissione sanità, perché tutti eravamo d'accordo sul punto, ma su questo emendamento, bellamente, è stato dato parere contrario. Anche quello della medicina di emergenza-urgenza è un tema importantissimo, che tocca tutti noi in quest'Aula: senza medici in pronto soccorso noi non possiamo essere sicuri in nessun luogo, neanche qui dentro. È un allarme che arriverà sicuramente da questo comparto e, come è stato detto circa la trasformazione in ordine del giorno di un emendamento che ribadiva la necessità di concorsi, credo che davvero sia un allarme che dobbiamo sentire, tutti, molto alto.
