2019-06-18	M5S	AuddinoGiuseppe	È noto a tutti come la sanità calabrese sia allo sbando. In più occasioni ho avuto modo di visitare gli ospedali a me vicini - quelli di Locri e Polistena - e mi sono reso conto personalmente di quanto la situazione nei due presidi sia drammatica. Oltre alla strumentazione obsoleta e spesso inadeguata, è riscontrabile una significativa carenza di organico (personale medico e infermieristico e OSS). Nei reparti si lavora in condizione di stress psicofisico altissimo. Medici, infermieri e operatori sociosanitari sono mortificati nella loro professionalità e costretti a turni massacranti. Inoltre, l'esiguo numero di personale non consente a questo di prestare le giuste cure ai pazienti. L'ospedale di Locri, peraltro famigerato in questo periodo, è anche interessato da gravi carenze infrastrutturali relative alla staticità della struttura, allo stato di manutenzione e al funzionamento degli ascensori. Pare che la regione Calabria, però, abbia messo a disposizione, per l'adeguamento di entrambi i presidi, ben 15 milioni di euro da più di dieci anni per l'uno e circa 10 milioni per l'altro. Tuttavia, i lavori di ristrutturazione e manutenzione strutturale non sono mai stati eseguiti. Mi chiedo, e vi chiedo, che fine abbiano fatto. Lo scopriremo, a breve. La sanità calabrese è caratterizzata da gravissime mancanze strumentali, strutturali e di personale medico sanitario. A fronte di tutto ciò, però, vi è stata una spesa scriteriata di centinaia di milioni di euro all'anno di soldi pubblici. Il disavanzo sanitario della Regione Calabria ammonta a ben 170 milioni di euro, mentre il punteggio LEA si attesta a 136, ben al di sotto della soglia di sufficienza, che è pari a 160. Abbiamo il disavanzo delle casse pubbliche più alto d'Italia. A fronte di cosa? A fronte di livelli essenziali di assistenza più bassi della Nazione! È evidente la grave inefficienza nell'utilizzo delle risorse economiche disponibili, che si ripercuote automaticamente sulla adeguatezza e sulla qualità dei servizi offerti ai cittadini calabresi, in palese violazione dell'articolo 32 della Costituzione. In spregio ai diritti fondamentali dell'ordinamento italiano, un'intera classe dirigente che, con diverse Giunte regionali, si è alternata negli ultimi decenni nel mio territorio, ha utilizzato la sanità come strumento di clientela. Anni di utilizzo politico-elettorale dell'organizzazione dei servizi e della gestione del personale hanno determinato una situazione insostenibile, che ora richiede questo intervento straordinario del nostro Governo. Il gravissimo disordine amministrativo e gestionale, con una sovrapposizione di interessi della criminalità organizzata, giustificano, senza ombra di dubbio, tale azione politica coraggiosa, ma assolutamente necessaria e urgente. In merito ai dubbi di costituzionalità avanzati, nei confronti del decreto in esame, da molti dell'opposizione, se è vero che la tutela della salute rientra, ai sensi dell'articolo 117 della Costituzione, nelle materie di legislazione concorrente, per cui la potestà legislativa (lo ricordo a chi lo sa meglio di me) spetta alla Regione, è vero anche che l'articolo 120 della stessa Costituzione legittima l'intervento sostitutivo del Governo in casi straordinari e molto gravi come la «tutela dei livelli essenziali delle prestazioni concernenti i diritti civili e sociali». Ed è palese quanto straordinaria ed estremamente grave sia attualmente la situazione della sanità calabrese. Il sistema sanitario regionale è stato sottoposto da tempo a un'azione di risanamento attraverso piani fallimentari di rientro e gestioni commissariali, con la nomina a commissario di Scopelliti nel 2010 e di Scura nel 2015. Ricordo a tutti, anche a me stesso, che Scopelliti, allora governatore della Calabria ed ex sindaco di Reggio Calabria, è stato condannato l'anno scorso a quattro anni e sette mesi per fatti riconducibili a quando era sindaco della città dello Stretto. Cosa potevamo aspettarci, dopo aver consegnato in queste mani la sanità della mia Regione? Dopodiché, si passa all'epoca Scura, nominato dal Governo Renzi, con una Regione ancora oggi in mano al Partito Democratico. E anche oggi il governatore Oliverio si permette di criticare queste azioni. L'opposizione, in quest'Aula, ha fatto finta troppo spesso di dimenticare di aver governato la mia Regione negli ultimi decenni. Quindi, il Consiglio dei ministri, tenutosi a Reggio Calabria il 18 aprile scorso, con il decreto-legge in esame, ha dimostrato ancora una volta che la Calabria, da troppo tempo dimenticata dagli Esecutivi che si sono succeduti negli anni addietro, è oggi ai primi posti nell'agenda di questo Governo! Finalmente, abbiamo un Governo in grado di valorizzare l'enorme potenziale che la mia amata e complicata Regione ha: potenziale, purtroppo, lasciato per troppi anni inespresso! L'attenzione riposta sulla sanità calabrese dall'inizio del nostro mandato sta dando i suoi frutti; ed è necessario continuare su questa strada, al fine di raggiungere i primi risultati necessari a migliorare la qualità della vita dei calabresi. A marzo, l'ASP di Reggio Calabria è stata sciolta per infiltrazioni mafiose. Le ragioni che hanno portato alla decisione di scioglimento ed al conseguente commissariamento sono molteplici: presenza di parenti di personaggi di spicco della malavita, pregiudicati con incarichi nella stessa azienda, mancanza di procedimenti regolari nell'affidamento di appalti e lavori, mancata approvazione dei bilanci a decorrere dal 2013, mancata tenuta di scritture contabili. Un elenco lungo e dettagliato di ipotesi di reato che rivela una situazione molto compromessa e che richiede questo intervento urgente del Governo. È notizia di dieci giorni fa la delibera dei commissari prefettizi con la quale essi hanno proposto di disporre la gestione straordinaria dell'ente. Gli approfondimenti fatti dai commissari hanno confermato la grave situazione di irregolarità e di squilibrio del bilancio aziendale: ritengono accertato un buco di 400 milioni di euro, che peraltro si aggiunge a pignoramenti mobiliari e presso terzi per altri 250 milioni circa, raggiungendo un totale di 650 milioni. Dal decreto-legge Calabria si dovrà partire con un percorso di risanamento della sanità calabrese. Sono convinto che si tratta di un provvedimento valido, necessario e urgente che crea, per la prima volta, i presupposti di un controllo efficace e costante da parte dello Stato della gestione manageriale, arginando l'imperante potere politico sulla sanità nella Regione. Il decreto Calabria contribuirà a mettere sui binari della legalità e della trasparenza il settore sanitario calabrese. Lo dico oggi a malincuore da calabrese, ma con grande interesse e grande fiducia in questo Governo. È evidente che con il MoVimento 5 Stelle al Governo non sono più ammesse le logiche che in passato hanno caratterizzato la gestione sanitaria della mia Regione. È ora di restituire ai cittadini calabresi il diritto ad avere cure adeguate e un servizio sanitario degno di questo nome. Signor Presidente, onorevoli colleghi, permettetemi di ricordare, a proposito di cambiamento (mi onoro di sostenere questo Governo del cambiamento), una frase che ho ritrovato nel cassetto della memoria poco fa. È una frase bellissima del cardinale Pappalardo di Palermo: chi crede che le cose vadano lasciate così come sono, perché crede che non possano essere cambiate, accetta di fatto che la politica sia scissa dall'etica o, peggio, fusa con il malaffare. Quindi, viva il cambiamento e andiamo avanti in questa opera di reale cambiamento della qualità della vita dei cittadini.
2019-06-18	M5S	EndrizziGiovanni	Lo Stato deve intervenire, perché in questo sfacelo le organizzazioni mafiose sono penetrate anche nella sanità. L'attuale Consiglio dei ministri, sulla base della relazione prefettizia, ha sciolto l'Azienda sanitaria provinciale (ASP) di Reggio Calabria per infiltrazioni della 'ndrangheta e numerosi altri fascicoli sono nelle mani dei procuratori di Reggio Calabria, Palmi e Locri. Se la Regione non sa gestire la sanità, se non sa trattenere gli interessi partitocratici e anche i propri interessi clientelari, né le trame mafiose, se causa dissesto, sprechi, corruzione e malasanità, il commissario ad acta non può essere il Presidente della Regione. Invece abbiamo visto questo, in Campania e in Calabria, fino al 28 novembre scorso, quando l'emendamento del MoVimento 5 Stelle ha cancellato questa assurdità. Ora ne cancelliamo un'altra: in Commissione, il collega senatore Siclari ha sostenuto che il commissariamento non funziona, perché non c'è collaborazione tra il Presidente della Regione e il commissario. Stiamo scherzando? A questo punto lo chiedo a lei, signor Presidente, ma anche a tutti i cittadini: se la partitocrazia locale ha causato il disastro e se ancora oggi si mette di traverso, sabotando la soluzione, la soluzione può mai essere quella di rimettere tutto in mano ai soliti noti? Il decreto-legge in esame interviene proprio dove la partitocrazia locale ha fallito. In primo luogo, esso prevede che il commissario ad acta per la Regione Calabria verifichi ogni sei mesi l'attività dei direttori generali delle ASP - i quali, ricordiamolo, sono nominati dalla politica regionale - e che, qualora non abbiano adottato azioni coerenti oppure se risultino responsabili di inerzia, questi vengono rimossi. Al loro posto verranno nominati commissari straordinari, scelti - udite udite! - tra persone di comprovata competenza ed esperienza di organizzazione sanitaria e gestione aziendale (una cosa mai avvenuta prima), che dovranno elaborare un piano aziendale, supportati da una unità di crisi che effettuerà visite ispettive utili proprio ad elaborare quel piano.
2019-06-18	M5S	EndrizziGiovanni	Questo chiedono i cittadini, ovvero che chi ha potere sulle loro vite abbia una responsabilità: chi sbaglia paga e lo Stato deve essere garante verso tutti i cittadini. In secondo luogo, si affronta la gestione degli appalti e vengono sgombrate le ragnatele di interessi e malaffare. Sopra le soglie comunitarie, gli acquisti e gli approvvigionamenti di beni e servizi dovranno avvenire attraverso le procedure centralizzate della Consip o avvalendosi di strutture di altre Regioni. Anche sotto queste soglie, però, il commissario ad acta stipulerà una convenzione con l'Autorità anticorruzione. « Reset »: questa è la parola chiave. Un reset è quello che si aspettano i cittadini e a chi teme che questo riordino miri solo agli aspetti di rientro finanziario ricordo che il decreto-legge prevede una serie di misure per una più attenta e costante verifica del rispetto del livello delle prestazioni erogate, perché questo intervento, prima e più che a tutelare le finanze pubbliche, punta a risolvere la drammatica situazione della sanità calabra e a ripristinare il diritto alle cure. Qualche detrattore vede nel decreto-legge in esame una contraddizione con il percorso delle autonomie regionali. Penso invece che il principio del monitoraggio delle responsabilità e il regime sanzionatorio introdotto siano la migliore garanzia: proprio in presenza di uno Stato vigile e attento, che interviene tempestivamente e anche a livello preventivo contro la cattiva gestione, il regionalismo differenziato può non essere un azzardo. Parlavo di prevenzione perché, cari colleghi, dopo lustri e consiliature di degrado e decomposizione del sistema sanitario calabrese, nel decreto-legge in esame viene disposta un'anticipazione sul disegno di legge riguardante le nomine di dirigenza sanitaria, che per la prima volta in Italia verranno sottratte agli interessi estranei della partitocrazia e finalmente basate sul merito. È una rivoluzione: l'Italia che diventa normale. Spiace che alcuni siano schermati dietro il timore di incostituzionalità nell'emendamento votato alla Camera: hanno perso l'occasione di dimostrare coraggio. Lo stesso che abbiamo avuto nella soppressione dei vitalizi: anche in quel caso ci dicevano che era impossibile. Cambiamento significa fare qualcosa che altri ritenevano impossibile: avremo, dunque, dirigenti sanitari scelti da un apposito elenco, con competenze chiare e documentate, individuati da commissioni imparziali, dove sia abbattuto il rischio di manipolazioni ed accordi, come quelli che abbiamo visto emergere dalle intercettazioni che coinvolgono l'ex ministro Lotti, addirittura nel cuore dell'amministrazione della giustizia, per condizionare una nomina che riguardava le sue personali vicende giudiziarie. Questo ha colpito drammaticamente l'opinione pubblica, ha mostrato nudi i sistemi di potere che hanno governato fino a oggi. È un qualcosa che offende e mortifica moralmente, ma quando si parla di sanità fa letteralmente morire. Comincia invece a prendere forma l'Italia che può essere. Davvero, signor Presidente, l'Italia può.
2019-06-18	M5S	GranatoBiancaLaura	Il regime commissariale, finché non si è insediato l'attuale Governo, non ha prodotto risultati, anche perché le nomine dei direttori generali delle aziende sanitarie provinciali (ASP) sono rimaste sempre saldamente nelle mani del Governatore di turno e con esse il reclutamento del personale. Così si sono mantenuti aperti serbatoi di voti clientelari, canalizzati verso i vari patroni della politica locale, che ovviamente se ne sono sempre serviti per mantenere in piedi lo status quo, mentre le migliori competenze in campo medico sono dovute migrare altrove. Non è raro che noi calabresi, quando andiamo a curarci nei grossi centri specializzati fuori Regione, ci imbattiamo nel compaesano specialista, fuggito da una Regione la cui classe politica è nemica giurata del merito, perché nel merito c'è la libertà dallo stato di bisogno ed è proprio lo stato di bisogno ad essere indispensabile a quella classe politica corrotta e incapace, per mantenersi saldamente avvinghiata al potere con lo strumento del favore. Ebbene sì, la politica regionale ha sempre fatto da padrona, nel vero senso della parola, sulla vita e sulla morte dei calabresi e sui soldi destinati alle loro cure, consentendo alla malavita organizzata di mettere le mani indisturbata sul flusso di beni e servizi legati alla sanità. Basti pensare al debito contratto dall'ASP di Reggio Calabria, ammontante almeno a 400 milioni di euro, con bilanci spariti per ben quattro anni di attività, doppie e triple fatture e strumenti obsoleti acquistati e lasciati nel cellophane nei magazzini degli ospedali. Mentre si realizzano ingessature di cartone e si muore in pronto soccorso, i dirigenti generali vengono confermati dal governatore di turno e sistematicamente premiati. Il governatore Oliverio, nonostante fosse addirittura soggetto a una restrizione di domicilio, a seguito di un'indagine della magistratura che lo aveva visto coinvolto per abuso d'ufficio, ha inteso fino all'ultimo avvalersi della sua prerogativa di nomina dei direttori generali, rifiutandosi di coordinarsi con il commissario Cotticelli, mandato dal Governo. Da qui la giusta reazione della ministra Grillo e la decisione di staccare finalmente la spina. In tutta fretta, dopo la nomina, i direttori generali di Oliverio si erano già apprestati al colpo di coda finale, in vista delle imminenti elezioni regionali, aprendo procedure concorsuali finalizzate al posizionamento di nuovi primari e di altro personale medico, infermieristico, paramedico e amministrativo, certi che, come al solito, nessuno avrebbe osato mettere loro i bastoni tra le ruote. La prassi della corruzione e del familismo amorale, ormai divenuta legge in Calabria, si accingeva a perfezionare per l'ennesima volta il suo iter, ma stavolta è arrivato l'alt del Governo del cambiamento: per la prima volta in quasi venti anni di autonomia regionale, un Governo ha dato una battuta di arresto decisiva a questo sistema consolidato, nell'incredulità di tutti questi personaggi, che già si facevano beffe di noi, facendo spallucce a chi li ammoniva, convinti che l'avrebbero fatta franca anche questa volta, come d'altronde era sempre avvenuto con tutti gli altri Governi. L'intervento del commissario Cotticelli, con cui è stato interdetto il reclutamento di figure apicali, ha suscitato reazioni di sbigottimento e di panico, del tipo: adesso chi glielo dice ad Oliverio? In quasi venti anni di autonomia regionale, la sanità in Calabria è stata azzerata. Allo svantaggio dovuto ai criteri di riparto del Fondo per la spesa sanitaria nazionale sfavorevoli, perché non tengono conto dei numerosi casi di comorbilità presenti nella Regione, che incidono sulla spesa sanitaria più dei casi di morbilità distinte, si è aggiunta questa gravissima mala gestio, che ha ridotto le prestazioni sanitarie pubbliche, ha consentito il proliferare di prassi come l' intramoenia, convenzioni con le strutture private con annessi contenziosi milionari e infine ha dato vita a una gigantesca migrazione sanitaria, per un ammontare di 320 milioni di euro all'anno, a decine di ospedali chiusi, a posti letto tagliati e ai ticket più alti d'Italia. Tuttavia chi non può migrare, in Calabria muore di malasanità; pertanto ben vengano i controlli sistematici e ricorrenti sulle attività dei direttori generali e dei commissari straordinari; ben venga la possibilità di sostituire tali figure in tempi rapidissimi ad opera del commissario straordinario, come prevede il decreto-legge; soprattutto ben venga il progetto del MoVimento 5 Stelle di sottrarre definitivamente alla politica le nomine dei direttori generali. Che questa che stiamo inaugurando possa essere veramente una stagione di rinnovamento per la nostra Regione e una opportunità di recupero del gap che ci tiene in un limbo dal quale abbiamo un disperato ed urgente bisogno di uscire.
2019-06-18	M5S	GranatoBiancaLaura	La Calabria subisce piani di rientro dal 2009 ed è commissariata, senza soluzione di continuità, dal 2010 ad oggi. Da quando la materia sanitaria è entrata nel regime di concorrenza Stato-Regione, a seguito della riforma del Titolo V della Costituzione, la politica locale è entrata a gamba tesa nella sanità, declassando i cittadini calabresi al rango di sudditi di serie C, consentendo un punteggio sui livelli essenziali di assistenza (LEA) di appena 136, su un minimo di 160.
2019-06-18	M5S	GranatoBiancaLaura	Signor Presidente, parlo da cittadina calabrese, prima che da parlamentare. Per la prima volta nella storia tormentata della sanità regionale, lo Stato interviene direttamente a difesa del diritto alla cura, sancito dalla nostra Costituzione.
2019-06-18	M5S	MautoneRaffaele	Signor Presidente, membri del Governo, onorevoli colleghi, l'insufficienza generalizzata della sanità calabrese, il gravissimo disordine amministrativo e gestionale, rappresentano le motivazioni dell'intervento straordinario che andiamo ad approvare e segnano un'inversione del percorso e una decisa discontinuità, sia delle regole che dei soggetti espressione della governance sanitaria in Calabria, al fine di traghettare la sanità regionale verso situazioni di normalità amministrativa. L'obiettivo del provvedimento è quello di far uscire il sistema sanitario calabrese dalla grave situazione di stallo, se non di peggioramento progressivo, che fin dal 2007 ha prodotto un abbassamento sempre maggiore degli indici di misurazione dei servizi erogati. A nulla è servito l'avvicendamento dei commissari straordinari fatti dai Governi precedenti; le connivenze politico mafiose, la gestione clientelare, l'incapacità gestionale hanno prodotto lo scempio che è sotto gli occhi di tutti. Il provvedimento legislativo mira, nelle difficoltà, a rimettere ordine nell'organizzazione sanitaria regionale per ridare ai cittadini calabresi una loro dignità e per far loro rialzare la testa. Io che sono cittadino campano e medico pediatra comprendo perfettamente il loro disagio e le loro enormi difficoltà nel trovare una risposta alla domanda di salute che spetta loro di diritto. Nella mia Campania viviamo tutt'oggi una situazione di commissariamento della sanità regionale, dove l'assenza di programmazione e le scelte, a mio avviso, spesso sbagliate del governatore commissario, hanno prodotto una chiusura forzata di diversi nosocomi, sottraendo posti letto e lasciando diverse aree della Regione scoperte per quanto attiene l'assistenza ospedaliera. Il miglioramento tanto sbandierato della qualità delle prestazioni erogate e dei conti in ordine è ancora un miraggio. Ne è dimostrazione il fatto che già ad inizio anno, e in diversi periodi successivi, le strutture accreditate che forniscono prestazioni diagnostiche strumentali hanno sospeso in maniera unilaterale le stesse, con un danno economico enorme per i cittadini e per i malati che non possono permettersi le spese esose necessarie per usufruire di tali esami diagnostici. Questo è il frutto ed il risultato di una cattiva programmazione. Per non citare, infine, l'assenza ormai completa di attenzione dei vertici regionali alla prevenzione e alla riabilitazione. Lo dimostrano, ad esempio, le lunghissime liste di attesa dei centri di riabilitazione neuropsicomotoria e sensoriale per i bambini con spettro autistico. Finalmente questo Governo del cambiamento va ad intervenire su una situazione critica ormai decennale per apportare dei cambiamenti radicali nella gestione e nella programmazione della sanità in Calabria. Questo sarà l'inizio di un percorso di trasparenza e legalità all'interno delle strutture sanitarie non solo calabresi, ma su tutto il territorio nazionale.
2019-06-18	M5S	PisaniGiuseppe	Signor Presidente, colleghe senatrici, colleghi senatori, signori rappresentanti del Governo, l'articolo 12 del decreto-legge oggi in discussione affronta, il grave problema della carenza di personale medico specialistico che sta mettendo in ginocchio la sanità ospedaliera del nostro Paese.
2019-06-18	PD	CollinaStefano	Ci ho tenuto a utilizzare questo tempo in discussione generale perché spesso parliamo nel merito, ma sembra che in questa sede ci misuriamo su emendamenti che cercano di modificare la virgola o il periodo, aggiungere un «anche» anziché un «esclusivamente»; invece qui ci sono visioni diverse, a fronte di un approccio che, a mio avviso, sarebbe stato molto più positivo ‑ e insisto perché ci sono molto legato ‑ e molto più determinante e incisivo se la riforma costituzionale fosse passata, nella parte legata al Titolo V. Lì c'era la soluzione agli aspetti di sistema a monte; lì si ponevano le premesse costituzionali per poter agire a livello centrale rispetto ai dissesti che avvengono nelle Regioni, ad esempio riguardo la sanità.
2019-06-18	PD	CollinaStefano	Posto che i problemi da gestire in Calabria riguardo la sanità sono grandi, questo provvedimento non ha né capo, né coda: non dà garanzie su nessun tipo di esito positivo. Infatti, mancando i requisiti che ricordavo prima, ossia la progettualità, la capacità di prefigurare un modello per il futuro, non offre garanzie su alcun tipo di esito positivo. Affronta le emergenze con scelte discutibili, soprattutto in mancanza di fondi che rappresentino strumenti credibili per fare interventi efficaci. Senza i fondi questa materia come si raddrizza? Ci sono, è vero, anche altri fatti accaduti nel frattempo. La collega Boldrini citava quota 100, ma questo è un altro intervento populista, in cui non c'è alcun tipo di progettualità, di cui non avete saputo neanche immaginare gli esiti, in cui l'impatto di determinati interventi lo scopriamo vivendo ed è drammatico.
2019-06-18	PD	CollinaStefano	È chiaro che questo è un decreto‑legge populista, perché non c'è niente di progettuale rispetto al futuro. Quando è venuto il ministro Grillo in Commissione a riferire sul federalismo fiscale ha detto di aver incontrato i rappresentanti delle Regioni Lombardia, Veneto ed Emilia-Romagna e di non aver riscontrato problemi rispetto alla questione della sanità. Ministro Grillo, ti piace vincere facile. Affronta il problema della sanità italiana nella prospettiva del regionalismo differenziato partendo, invece, dai posti in cui ci sono gli squilibri e dicci un po' quale nuovo equilibrio, quale nuova dimensione possiamo trovare per dare omogeneità al Servizio sanitario nazionale nelle gestioni regionali.
2019-06-18	PD	MagornoErnesto	Questo decreto-legge io non lo posso votare, non solo da senatore del Partito Democratico, ma nemmeno come uomo del Mezzogiorno, che appartiene a questa sfortunata, bella ma amara Regione del Mezzogiorno d'Italia. E vi chiedo di fermarvi e di cominciare a concertare per poter vedere come dare a questa emergenza della sanità, straordinariamente importante e mortificante per questo popolo che soffre, la risposta che si deve dare e che il popolo calabrese deve avere. Fermatevi ed insieme apriamo il ragionamento sulla sanità. Fermatevi ed apriamo tutti i ragionamenti che volete rispetto alla Calabria e al Mezzogiorno. Voi avete un grande dovere; avete avuto un grande consenso e avete il dovere - ne hanno diritto i cittadini del Mezzogiorno - di dare a questa nostra terra le risposte che i calabresi meritano.
