2020-11-09	CON	ThrseCoffey	I am conscious that we did boost the local housing allowance to the 30th percentile, which cost more than £1 billion, and I am sure that that may have helped some of the hon. Gentleman’s constituents. One thing we must recognise—we are working across Government on this—is what we can do to try to help reduce the cost of living. An interesting paper by the University of Bristol talks about the poverty premium, half of which is energy related—about £250 out of the £490 it identified. That is why I am working with people such as the Under-Secretary of State for Education, my hon. Friend the Member for Chelmsford (Vicky Ford), the Minister for Business, Energy and Clean Growth, my right hon. Friend the Member for Spelthorne (Kwasi Kwarteng) and a wide range of people in this Government to tackle issues that face not only the poorest in society, but other households as well. We will continue to do that and I look forward to ongoing activity in and out of Government in order to ensure that we reach as many people as possible and make their lives better.
2020-11-09	LAB	DianaJohnson	As the shadow Chancellor pointed out in her excellent remarks, the United Kingdom, under successive Tory Governments over the past decade, has pumped £6 billion into climate-damaging fossil fuel projects overseas via UK Export Finance. Will the Chancellor now commit to ban this activity immediately and make it a priority to invest in British green energy industries in places such as the Humber estuary and to create the future jobs we need for a real green northern powerhouse?
2020-11-10	CON	AlexanderStafford	Recent commentary has highlighted the role of the North sea as a strategic asset for net zero. It could deliver one third of our energy needs via offshore wind, which could increase the utilisation of carbon capture and storage and green hydrogen. What is the role of a carbon pricing mechanism in delivering this?
2020-11-10	CON	AlokSharma	My hon. Friend is a great champion of manufacturers in his constituency. As he will know, the Government are committed to helping businesses to reduce their costs through resource and energy efficiency. We have established a package of compensation exemptions from electricity costs worth more than £470 million, which will of course benefit businesses in energy-intensive sectors such as ceramics, which is a particularly important industry for Stoke-on-Trent.
2020-11-10	CON	DanielPoulter	Undoubtedly, Sizewell C can bring many benefits to Suffolk in terms of increased employment opportunities, and it is an important part of decarbonising and improving our energy security. However, it is not a case of Sizewell C being built at any cost, and many people in Suffolk have concerns about the failure of EDF properly to engage with the consultation process. More than 50 outstanding concerns have been raised by Suffolk County Council. What reassurances can the Minister provide to me and my constituents, particularly those in the Wickham Market and Hacheston areas, that EDF will be held to account, will properly engage with the consultation, and will implement the changes that are needed to improve road and rail infrastructure?
2020-11-10	CON	ElliotColburn	I know that Carshalton and Wallington residents, particularly those living in New Mill Quarter in Hackbridge, will be very grateful that the Government are consulting on regulating a district energy scheme network to prevent residents from being ripped off without any consumer protection. Will the Minister outline when he expects to report back on the consultation on district energy schemes, and can we have a timeline for implementation?
2020-11-10	CON	JackBrereton	Many manufacturers, especially those in Stoke-on-Trent, face high energy costs, and there is little incentive to switch to cleaner electricity because of the higher cost. Will my right hon. Friend look at what additional support can be offered to energy-intensive industries so that our manufacturers remain competitive and can invest in improved efficiency?
2020-11-10	CON	KwasiKwarteng	I thank my hon. Friend for raising this issue; I know that she is a tireless champion for her local high street. She knows that click and collect and delivery services are still possible, as are takeaway services for the hospitality sector. The Under-Secretary of State for Business, Energy and Industrial Strategy, my hon. Friend the Member for Sutton and Cheam (Paul Scully), is working tirelessly with retail to make sure that once the lockdown is over, we can bounce back more strongly and take on board much of the important advice that she has been giving us.
2020-11-10	CON	KwasiKwarteng	I thank the hon. Lady for raising this. Obviously, this is a critical issue. We are working through the cases as expeditiously as we can. I am happy to meet the APPG in my capacity as Energy Minister and resolve what has been a difficult issue—I do not deny that.
2020-11-10	CON	KwasiKwarteng	My hon. Friend, as he often does, raises a pertinent question relating to our energy strategy. Obviously, carbon pricing is at the centre of any move to try to decarbonise our energy mix. We have a track record on this, and we have also committed to 40 GW of offshore wind by 2030, which, through the auction process, is critical to delivering our net zero ambitions.
2020-11-10	CON	KwasiKwarteng	On 6 October, the Prime Minister announced new plans to build back greener, which included boosting the Government’s previous offshore wind target from 30 gigawatts to 40 gigawatts. The hon. Lady will also be interested to hear that the Marine Energy Council is looking at funding models for early tidal projects, and that is something in which the Government are very interested.
2020-11-10	CON	NadhimZahawi	The hon. Lady makes an important point about the labour market statistics released this morning. The Government are committed to helping the most vulnerable, as was demonstrated with the £2 billion kickstart scheme for young people, who have in many ways been heavily impacted by the challenge of covid. She will see from this Government a green industrial strategy. As the Secretary of State has already set out—judge us by what we do—36% of the world’s offshore energy is produced by this country, and we will go much further.
2020-11-10	LAB	AlanWhitehead	Surely the Minister must understand that fire and rehire tactics are not part of a negotiating tactic: they are a gun to the head of every worker in the organisation. It has nothing to do with negotiation: it says, “You will accept lower terms—otherwise we will chuck you out.” British Gas has recently become one of a number of large companies threatening their workforces in this way with this medieval tactic. I think the Minister must agree that it is not only a terrible way to reward the thousands of energy workers who have worked day and night to keep our energy supply constant and reliable during the covid crisis, but must be seen as a completely unacceptable way to conduct industrial negotiations. Will he join me in condemning the use of this practice and, specifically, write to British Gas demanding that it withdraw its threats to its employees?
2020-11-10	LAB	RuthJones	UK maritime energy is seeing seismic changes, as is so much of the economy in all parts of the nation. Workers skilled in vessels and rigs offshore are being moved to new renewable industries, but—as is always the case with this Government—some are being left behind. This Government cannot be allowed to make the same mistakes that they made in the 1980s, when they left coal workers and entire communities devastated and unsupported. Will the Minister tell the people of Newport West how the Government plan to avoid those mistakes in the new energy transition?
2020-11-10	LAB	RuthJones	What steps he is taking to support the development of marine renewable energy.
2020-11-12	CON	JacobReesMogg	As regards the questions about the vaccine and the vaccine tsar, and the money spent on publicity, may I say from this Dispatch Box what a fabulous job Kate Bingham has done? She deserves credit, plaudits and praise—paeons of praise—for what she has done for free. She has been working for free. She has not been charging the British taxpayer. She has brought her energy and her enterprise to ensure that we are one of the best-placed countries to have supplies of the vaccine when it comes through
2020-11-12	CON	JacobReesMogg	Wednesday 18 November—Motion to approve the draft Ecodesign for Energy-Related Products and Energy Information (Amendment) (EU Exit) Regulations 2020, followed by a motion to approve the Construction Products (Amendment etc.) (EU Exit) Regulations 2020, followed by, if necessary, consideration of Lords amendments, followed by a general debate on covid-19
2020-11-12	CON	OliverDowden	I thank the hon. Lady for her question. We are working very well with the Welsh Government and my officials are in close contact. I have written to my opposite number in Wales. On her point about St David’s Day, there are many calls for bank holidays, and I am sure those will be considered through the normal process, which is overseen by the Department for Business, Energy and Industrial Strategy. On where the medal will be minted, she has made a strong case and I will take that into consideration.
2020-11-12	CON	RobertHalfon	During the Brexit campaign, my right hon. Friend wrote an article in The Sun stating that we would be able to reduce VAT on energy bills, saving the taxpayer a considerable amount of money per year. Can he set out the progress we are making on that and confirm that we will be able to cut VAT on energy bills, therefore cutting the cost of living for hard-pressed families across the country?
2020-11-12	LAB	AlexanderNorris	My hon. Friend the Member for Blaydon (Liz Twist) also made a strong case. I was particularly struck by the points made about smoking in pregnancy and with regard to those with mental health issues. We know from Pareto’s law that on any great journey the last 20% takes as much energy as the first 80%, and that is definitely the case with smoking cessation, so we will have to take a granular look at which groups are still disproportionately affected and target resources specifically in a way that works for them
2020-11-12	LAB	ChristopherBryant	I am sorry to say that it feels as if the Government have given up on this, to be honest. They did not choose to make a statement on this; they had to be dragged to the House by an urgent question. Frequently, it is Back Benchers in this House who are dragging the Government to make more categorical statements and to stand up to the cross words, which is so far all we have had. They have devoted next to no energy to pursuing this in the vast majority of international forums. The one thing that they could do they repeatedly refuse to do, which is to implement Magnitsky-style sanctions against Carrie Lam and others. I do not know what more the Minister needs to know. We have a country that has millions of people in concentration camps. We have people who are being refused the right to their own religion, and women who are having forced abortion and sterilisation. We have the whole of democratic systems being suppressed, and, frankly, communism today looks remarkably like fascism. Every single time he says, “I can’t speculate,” he is actually announcing that he is not implementing sanctions. Please, please take the whole of the House seriously on this. We must not give up.
2020-11-12	LAB	PreetGill	Over the coming decades, we are likely to see a huge increase in climate refugees. The UN has estimated that there will be 200 million people fleeing environmental disasters by 2050. Those disasters include the cyclones that we have all seen, but also droughts, floods, land degradation, rising sea levels, and ocean acidification, which directly and indirectly impact lives and livelihoods. Despite that, over the past decade, the UK Government have directed billions of pounds of public money into fossil fuel projects around the world, through UK Export Finance and the aid budget, including CDC investments. Some 90% of the £2 billion invested in energy deals after the UK-Africa investment summit last year went on fossil fuel projects, and the Minister’s Government are funding fossil fuel projects in Mozambique using more than $1 billion of public funds. COP26 has been delayed for a year; we are looking to build back better, and ensure a safer, fairer world after the pandemic, and there are still opportunities for the Government to act and show clear leadership before they host that meeting. Will the Minister today commit to ending support for fossil fuel projects overseas, both from the aid budget, including the CDC investments, and from UK Export Finance, as a matter of urgency
2020-11-12	LAB	ValerieVaz	I do not know whether the Leader of the House is aware of the interactive map, “My Little Crony”, which has been created by Sophie Hill. I raised last week all the contracts that have been handed out to those connected to the Tory party and I did not get an answer, but it is well worth a look. He will know that I think it might be time for a public inquiry, particularly on the £670,000 that has been allocated by the vaccine tsar for public relations. If you look at the My Little Crony interactive map, it links directly to the special special adviser’s relation. I do not know whether that is because they are essential workers, to enable them a visit to Barnard Castle, but it would be interesting to know what they do, because they are actually based in the Department for Business, Energy and Industrial Strategy, where there are 100 comms staff. But if it is something about a vaccine, I would rather Dr Van-Tam told me about it, instead of a public relations so-called expert
2020-11-16	CON	ChristopherPincher	I am obliged to my hon. Friend. She is a doughty campaigner for her constituents in Dover, and particularly, in this case, in Deal. She will know that the national planning policy framework makes it clear that local authorities should make provision for infrastructure, including water supply and energy, through their strategic planning authorities. As to what further we can do, our White Paper on planning reform proposes an infrastructure levy that will get that sort of infrastructure that she refers to in place at the get-go so that communities get not just the housing they need but the infrastructure to go with it.
2020-11-16	CON	GarethDavies	The last point that I will make in concluding is around this point on focus. In my experience, it is not the fund managers or the trustees whom we need to persuade or to make do anything, but the middle men and women—the gatekeepers, the investment consultants —who typically require a five-year track record and £100 million in assets held by fund managers and managed by fund managers. In my experience, that was always the issue. We were running money in a way that was really pushing things forward in terms of our climate targets. We knew that the pension clients really wanted to invest with us, but, because we could not meet the requirements of the investment consultants, we could not marry the two together. If we use the combined intellect, passion and energy of this House, from all parties, to come up with a solution to that, we could make great progress.
2020-11-16	CON	RobertMoore	In September, I was delighted to welcome the Pensions Minister to Haworth in my constituency to visit Airedale Springs, a fantastic local manufacturing business in the Worth valley. It supplies mechanical springs to UK manufacturers such as Brompton Bikes. Crucially, it is innovative, and a green business, too. The roof of its factory has more than 100 solar panels, helping to supply its energy needs and power the business, and I want to see firms across our country adopting those kinds of innovative practices
2020-11-16	CON	ShaunBailey	Many of the organisations that perhaps would be impacted by this are actually the organisations that we need to lead on these new green challenges. As part of my research, I looked at some of the organisations that we might think of as ones that may need to be divested from. We looked at the oil companies like Shell, BP, Texaco and so on, and the work they have done—for example, that of Shell on biofuels, or BP on renewable energy in homes. I claim no interest—people can google it, see it and find it—but I think we risk a real unintentional consequence here of actually going backwards and almost shooting ourselves a bit, because by divesting from those schemes we inhibit the work that we need to solve this climate crisis
2020-11-16	LAB	JonathanReynolds	What is more, today’s amendment was developed and backed by a whole host of organisations across the public and private sectors, with dozens reiterating their support in a letter to the Prime Minister last week. These include ClientEarth, Make My Money Matter, ShareAction, E3G, Christian Aid, West Yorkshire Pension Fund, Good Energy, Ecotricity, the Aldersgate Group, the Climate Coalition, the Carbon Tracker Initiative, Friends of the Earth, Greenpeace, Business in the Community and the TUC. I would like to thank all those organisations for the work they have done in getting us to this point. However, I will also say to the Minister that this is not a top-down initiative. The evidence shows that Members themselves want their funds to start taking this seriously
2020-11-17	CON	AlexanderStafford	The same can be said of TikTok, a Chinese-owed app, which has enjoyed explosive growth in the west among teenagers. It is not all fun and games though, with the company being accused of having close links with the Chinese regime and of gathering data on our young people. Indeed, we heard from representatives of TikTok on the Business, Energy and Industrial Strategy Committee a couple of weeks ago, and we heard their protestations saying that they had no connection almost and that they were not passing over data. However, how can that be true when TikTok is owned by China—a state that is naturally hostile to human rights and many other aspects
2020-11-17	CON	GeorgeDuncanSmith	I thank my right hon. Friend the Secretary of State for his deliberations on the Bill, which I will support tonight. It is long overdue. The debates around the Huawei stuff at the beginning of the year really exposed the fact that the UK had lost its way in this area in terms of threats and so on. We were behind the others—Australia, the United States; some of our big Five Eyes compatriots—but at least my right hon. Friend has grasped the nettle and brought this Bill forward, which is laudable. I also thank him for his courtesy in the course of this, in the sense that he spoke to me and, I know, to others. I particularly commend the courtesy of his Minister, the Under-Secretary of State for Business, Energy and Industrial Strategy, my hon. Friend the Member for Stratford-on-Avon (Nadhim Zahawi), who is a very good friend. He went out of his way to talk this through with colleagues on both sides of the House
2020-11-17	CON	GregoryHands	I thank my right hon. Friend for his interest in this area. The UK’s new independent trade policy is designed to be very environmentally friendly. That occurred in the Secretary of State’s speech to the World Trade Organisation in the spring. The UK global tariff that we have published reduces import tariffs, or eliminates them entirely, on 104 environmental goods entering the UK, including things such as steam turbines. We have gone significantly further than the common external tariff of the European Union. When it comes to our negotiations with future trade partners, the US, New Zealand and Australia, we have committed to promoting trade in low-carbon goods and services, as well as supporting R&D, innovation and science in sectors such as offshore wind, smart energy, low-carbon advisory services and energy from waste.
2020-11-17	CON	JohnHayes	The point was made earlier that the national interest and national security are not identical. But they are coincidental—they do overlap—as there is a point at which national resilience, or its absence, compromises national security. The Government acknowledge that in the scope of the Bill. They talk about critical national infrastructure, as well as technology sectors of various kinds. By the way, I first looked at this issue, Madam Deputy Speaker—this is not a widely known fact, but I am happy to share it in the privacy of this intimate gathering—as a Cabinet Office Minister, with the former Member for West Dorset, Sir Oliver Letwin. We looked particularly at the threats posed to core infrastructure, such as the energy sector. By the way, that threat is posed not only by hostile state actors, but other players who might choose to disrupt core activities, with extraordinarily damaging consequences for our citizens. The Government do look at those things, but historically I do not think they have done so systematically enough. I know my right hon. Friend the Member for Tunbridge Wells, who has a distinguished record in this area, will have had similar experiences to me when we, in turn, looked at energy as part of our ministerial responsibilities
2020-11-17	CON	NicolaAiken	I am pleased that the Bill’s focus is on national security concerns and that it will not enable the Government to intervene for wider economic reasons. This appears to remove the potential for any political interference when reviewing mergers and acquisitions. I would welcome assurances from my hon. Friend the Minister that it is the Government’s intention to take the politics out of that as much as possible. Furthermore, I am reassured that the new investment security unit will be within the Department for Business, Energy and Industrial Strategy, rather than across Government—although I take the point made by my hon. Friend the Member for North West Norfolk (James Wild)—meaning greater consistency and potential speed in decision making. It is about that speed. As has been said already today, 30 days should really mean 30 days if we are to ensure that we do not block investment
2020-11-17	CON	NusratUlGhani	From the moment that this Bill was started to now, we have learnt a lot more about security and infrastructure. Does my right hon. Friend share my concerns that the Chinese national intelligence law requires Chinese firms to assist with state intelligence work? This was brought to light for me when TikTok gave evidence to the Business, Energy and Industrial Strategy Committee. I am incredibly anxious about the data that it could potentially be harvesting and sharing back with its parent company, ByteDance.
2020-11-17	CON	RobertSeely	The next amendment relates to CFIUS, the Committee on Foreign Investment in the United States. That is a more transparent process and, if I understand it correctly, more people have to sign up to agree, so it is not just sitting within their version of the Department for Business, Energy and Industrial Strategy. Defence, the Secretary of State and other players get to sign off on funding for companies. In many ways, CFIUS has a higher threshold than we will have in this country. I do not think anyone is accusing the United States of being less free marketeer than we are, but in this area, they are more conservative. I am not saying they are right or wrong, but I think that it is an important point to note
2020-11-17	CON	ThomasTugendhat	Here I declare that my entry in the Register of Members’ Financial Interests shows that I, too, invest in businesses across the UK, and the reason why is that I think, as a Conservative, that if someone believes in business, they should put their money where their mouth is. I am proud to support some young people who have come up with some ideas, some of which may succeed and one of which may even make me as rich as the Under-Secretary of State for Business, Energy and Industrial Strategy, my hon. Friend the Member for Stratford-on-Avon—[Laughter.] This Bill looks at the challenge that such businesses are starting up with, and here I pay tribute to my constituency neighbour and right hon. Friend the Member for Tunbridge Wells (Greg Clark) who spoke about the de minimis clause—the minimum amount that should be called in. Of course, it is absolutely right that companies can evolve. Technology can adapt very quickly, and ideas that one thought were insignificant can become very significant
