2020-07-08	CON	JohnRedwood	This week, we have had the summer forecasts from the European Union for the economies of the European Union, and it has still done a UK forecast. It is worrying, because the forecasts say that the French, Italian and Spanish economies will lose more than 11% of their economic output and income this year. They say Britain will be in high single figures—a bit better than those three—although not as good as Germany, which has come through it the best so far. However, the figures are not acceptable, and most people feel that the United States figures will be considerably better, because the US response to this crisis has been on a far bigger scale, both fiscally and in terms of monetary policy, than the European response. The UK needs to be closer to the American example in this case, because this very severe hit to major economies requires something very big to try to carry them through and rescue those jobs. I hope that the Government will look at the opportunities for sourcing more in the United Kingdom through its purchasing programmes as we leave the European Union. I am all in favour of strong competition, value for money and good pricing, but I think we have had examples of our not having enough national resilience. We found that we could not buy the things abroad that we needed for our health service, because we were relying on others’ goodwill and they needed it for themselves. We are finding that buying things from China comes with all kinds of difficulties. We will find, if we go down the route of importing more and more electricity, that we have strategic weakness in depending on Russian gas, which is the main source of continental energy. I urge the Government to use their purchasing intelligently to give us resilience and more British jobs. Value for money and competition are good, but let us make sure that the purchasing goes to home purposes, just as they do in other countries abroad, where they look after themselves first.
2020-07-08	CON	JulieMarson	Right now, the FTSE 100 is stacked with establishment companies that will rally once the covid crisis eventually subsides, but it will not be those industries that provide the high-growth success stories of the next 10 or 20 years. The highest growth will come from fledgling, disruptive sectors just entering their growth phases now or not even yet created. The development of our highly successful start-up ecosystem, which houses the world-leading sectors of tomorrow, such as FinTech, green energy and automation, will be essential to our long-term global competitiveness and prosperity. I would love to see an extension of the Government’s existing commitment to support those industries, at the pre-seed, seed and series A levels
2020-07-08	CON	MariaMiller	I initially presented this Bill in 2019, on the heels of the consultation by the Department for Business, Energy and Industrial Strategy that looked at extending the existing protections to six months after maternity leave has ended. The current protections mean that if a woman’s job is at risk of redundancy during her maternity leave, she must be offered any suitable alternative vacancy that is available. She should in theory be given priority, but both the Equalities and Human Rights Commission and the Maternity Action helplines show that, in practice, that is woefully inadequate. Employers continually confuse their legal obligations, ignore them or insist that women on maternity leave compete for an alternative post when they are giving birth, have just given birth, or have been out of the workplace for many weeks
2020-07-08	CON	RishiSunak	As well as investing in infrastructure, we want to create green jobs. This will be a green recovery, with concern for our environment at its heart, and as part of that, I am announcing today a new £2 billion green homes grant. From September, homeowners and landlords will be able to apply for vouchers to make their homes more energy efficient and create local jobs. The grants will cover at least two thirds of the cost—up to £5,000 per household—and for low-income households we will go even further, with vouchers covering the full cost, up to £10,000
2020-07-08	CON	RishiSunak	It is a record to be proud of. We have cut carbon emissions by 40% in the last few years. We are now a world leader in offshore wind and, for the first time ever last year, we generated the majority of our energy from zero carbon sources. We are building on our progress. That has happened under a Conservative Government, and whether it is through our nature for climate fund, our measures to tackle air quality, or new technologies such as direct air capture or carbon capture and storage, this Government will ensure that we meet our net zero obligations and do so in a way that creates jobs in every part of our United Kingdom.
2020-07-08	CON	RishiSunak	On top of the £2 billion voucher scheme, I am releasing £1 billion of funding to improve the energy efficiency of public sector buildings, alongside a £50 million fund to pilot the right approach to decarbonise social housing. Taken together, we expect these measures to make more than 650,000 homes more energy efficient; to save households up to £300 a year on their bills; to cut carbon by more than half a megatonne per year—equivalent to taking 270,000 cars off the road; and, most importantly right now, to support around 140,000 green jobs. A £3 billion green jobs plan to save money, cut carbon and create jobs
2020-07-08	CON	RishiSunak	The measures we have announced today represent some of the most far-reaching measures any country has taken to tackle energy efficiency. They will provide thousands of pounds of grants for homeowners up and down the country to create local jobs and ensure we can reduce carbon emissions from our housing stock, which today account for almost a fifth of all our emissions. The Committee on Climate Change has said we must address that. In our manifesto, we committed to addressing it. Rather than waiting to get started and rather than the five-year plan outlined in our manifesto, we are getting on with it today
2020-07-08	CON	RishiSunak	The right hon. Gentleman asked about the self-employed; he will know that our self-employment scheme is without doubt one of the most comprehensive and generous—if not the most comprehensive and generous —anywhere in the world. That is considerable support that has already been provided. Also, 40% of those in the construction sector are self-employed. Many of the people installing the new energy-efficiency measures will be in that category and will benefit from that increased demand for their services—something that I am delighted will happen. Lastly, the right hon. Gentleman talks about Germany, as do other Members; it is important to remember that Germany’s plan for this €50 billion is one with unspecified dates stretching over five years. In March, we unveiled a £640 billion investment plan for the next five years.
2020-07-08	CON	RishiSunak	We have questions from the hon. Lady, We have opinions from the hon. Lady, and last week, we even had tests from the hon. Lady. The one thing we do not have from her is a plan. I closed my statement by saying that this Government were making an unambiguous choice to make this moment meaningful for our country. Now, Labour Members must choose. Do they believe, as we do, that Britain has the energy and power to bounce back? Do they have confidence, as we do, in our incredible public services? Do they believe, as we do, in the enterprising spirit of British business? If they do, then they should do what is right and back our plan for jobs.
2020-07-08	CON	SimonFell	It has been said, I hope not uncharitably, that my right hon. Friend has never met a bridge that he did not want to build. Off the Cumbrian coast, we have an opportunity to steal a march with a tidal barrage that would supply 5% of the UK’s energy needs in a green, sustainable way. It would leave a legacy of jobs in Copeland, Barrow-in-Furness and Workington—7,000 jobs. It would allow us to connect communities that have a terrible transport network at the moment with a shiny new bridge and it would allow us to build, build, build our way into a green revolution. Will the Prime Minister agree to meet me and my Cumbrian colleagues to explore this deal further?
2020-07-08	CON	SimonHart	I am pleased to report that we have had regular conversations with Airbus throughout the pandemic and very recently, as well as with Welsh Government and stakeholders in the north Wales and Broughton area. Airbus has reported that the industry has had between £6 billion and £10 billion-worth of UK Government support so far. Discussions with the Department for Business, Energy and Industrial Strategy are ongoing about other areas where help can be provided. My colleagues, led by my hon. Friend the Member for Delyn (Rob Roberts), have been at the front of that, looking at any other areas in which we can help the industry to remain in Broughton not just now but in five and 10 years’ time. We are open to further discussions.
2020-07-08	CON	StephenBarclay	We have announced today £2 billion of green homes grants, which will save energy and, just as importantly, save households money on their bills. Finally, our £40 million green jobs challenge fund will invest in shovel-ready natural capital projects, such as creating new parks and open spaces, cleaning rivers, restoring peatland and helping to plant many more trees during this Parliament. Taken together, these measures will help to ensure that the future is not only more prosperous but happier, healthier and greener too
2020-07-08	CON	StephenCrabb	Wales desperately needs new projects to deliver growth and better quality work, so may I ask my hon. Friend if he will look at the proposals coming from the joint venture based in Pembrokeshire between Total and Simply Blue Energy for deploying floating offshore wind technology in the Celtic sea? I also ask him to use his office to ensure that Treasury and BEIS stay fully involved, because it is a serious project that is worth backing.
2020-07-08	LAB	EmmaHardy	The good news is that the Chancellor could use this as an opportunity to build back better, build back brighter and improve the lives of everyone across the city and in Hessle, if he so chooses. We could look to clamp down on poor working conditions and poor tax practices, and encourage businesses to hit environmental targets. Our city does not want charity; we want the help to help ourselves and fulfil our huge ambitions, including that of being the green energy capital of the UK. The alternative is yet another lost decade
2020-07-08	LAB	FeryalClark	What recent discussions he has had with the Secretary of State for Business, Energy and Industrial Strategy on support for Welsh businesses affected by the covid-19 outbreak.
2020-07-08	LAB	MatthewWestern	The Chancellor also referenced fixed costs, and business rates have been mentioned widely this afternoon. Our business rates are 60% more than in, say, France and other countries, which is a huge disadvantage to our businesses. Likewise, our energy costs are 68% higher than the European average, putting our businesses at a huge disadvantage to our European neighbours. It is not just businesses that are affected; there are also costs to home owners and residents
2020-07-08	LAB	OliviaBlakeDagnall	Nothing the Chancellor has said today addresses these issues. We were promised a green new deal. The £3 billion for home retrofits and energy efficiency in public buildings is welcome, but it is not a green new deal. It falls well short of the funding we need to kick-start a faltering economy and deliver the growth and green jobs that are vital for our recovery. We will see Governments across the globe act on a green recovery, and I am afraid that this will be a missed opportunity for the UK to help with a future crisis in the wake of this pandemic. We know that we are not out of the woods yet and we may be facing further hardship as a result of coronavirus. The medium to long-term impacts could be felt for generations. We need the Government to forge a path from which we can emerge with greater opportunities and a greener economy
2020-07-08	LAB	WesleyStreeting	It seems to me that people who have been excluded require exactly the same sort of assistance as people who have been included, which is direct support to protect their incomes. We would be very happy to sit down with the Treasury to discuss how to bring that about. Turning to climate change, the Chancellor promised a green recovery with concern for the environment at its heart. What we actually got today was a scaled-back ambition that fell well short of what the Committee on Climate Change and climate change justice campaigners were looking for. The Conservative manifesto promised £9 billion for energy efficiency. Today the Chancellor announced just £2 billion, which is about a fifth of what they promised people before the election. If the crisis has taught us anything, it is that there is such a thing as too late. It is this decade to 2030 where action will really count if we are to prevent catastrophic climate breakdown —not the next 30 years to 2050, but the next 10 years to 2030—so where was the green new deal? A green industrial strategy will get our country back on track to meet its climate obligations in the longer term, but it can also be the shot in the arm our country needs in the shorter term, creating new jobs and delivering improvements to our quality of life.
2020-07-09	CON	JacobReesMogg	I am very sympathetic to what my hon. Friend says. I think all of us have had constituents come to us who have bought new homes that have not been up to standard. I have one constituent whose home was actually unsafe in the way that it was delivered to him. It is important that we build more homes, and we need to be Macmillanesque in our ambition, but they need to be good-quality homes. They need to be safe, comfortable and energy-efficient but also beautiful, in the hope that they will survive through the generations in the way that some of the houses we have in this country have survived. Those living in new build homes must feel confident that their property is safe and of high quality. We will ensure that a new houses ombudsman is established and legislate to require developers to belong to it. That will offer better protection for homebuyers, resolve disputes and improve quality. The Government have taken bold steps to reopen the housing market safely in recent weeks following the crisis, and we are taking a number of legislative measures to make construction easier and quicker and to bring forward transactions by suspending stamp duty for house sales under £500,000 until next March.
2020-07-09	CON	JacobReesMogg	My hon. Friend makes his case as always with passion and energy. One of the manifold advantages of leaving the European Union is that we will be able to make these types of laws for ourselves, and we will not have to give way to a higher power. His energetic championing of these issues in Parliament will have its consequences.
2020-07-09	CON	JacobReesMogg	Six billion pounds is an important amount of support, and my hon. Friend is right to highlight the work being done by the Department for Business, Energy and Industrial Strategy and HM Treasury over the past week to support local jobs in his constituency. Aviation and aerospace companies are vital to the economy, which is why the support has already been there, including time to pay, support for employees and loans. These are designed to ensure that companies of any size receive the help that they need to get through this difficult time—airports, airlines and the wider supply chain. We will continue to work closely with the companies affected and we are open to offering further support, so long as all other Government schemes and commercial options have been exhausted, including raising capital from existing investors. We will consult on what we can do on aviation taxes. The Chancellor will say more on that in due course.
2020-07-09	CON	JacobReesMogg	Thanks to the Chancellor’s innovative scheme, we will all have a lot on our plate on some days in August—more on our plate than we might have been anticipating. As regards hydrogen, the right hon. Gentleman rightly raises an important point about an environmentally friendly source of energy. Yesterday’s statement was 20 minutes long and inevitably could not cover everything. As I said, there may possibly be a debate on matters to be considered before the forthcoming Adjournment, which will be an opportunity to raise the subject, but the right hon. Gentleman is an experienced parliamentarian and knows better than I do how to get things raised in this House.
2020-07-09	CON	NigelHuddleston	I fully agree with my hon. Friend. Tourism and hospitality businesses right across the country have invested an incredible amount of time and energy in getting ready to reopen. Tourism is vital to our economy. I, too, was delighted to see the sector take its first steps towards reopening last weekend and to hear the announcement yesterday of a cut in VAT. Earlier this week I participated in a roundtable organised by Cumbria Tourism, which I know he has been working closely with. I will continue to monitor the situation and engage closely with business.
2020-07-09	CON	OliverHeald	This history, which goes back 20 years, is something that I became involved in when Oxfam asked me to sit on its independent commission, looking into the events in Haiti. We were able to do a great deal of research, and we found that, in the in-depth research in three countries on women and girls in refugee camps, sexual harassment, exploitation and abuse was quite common and transactional sex was endemic in two of the three countries. There was even a lack of understanding both by aid workers and the recipients of where the line should be drawn in terms of sexual misconduct. For example, one older woman explained that she had to wait in line for food, because the younger women, who were prepared to be girlfriends of the people handing out food, took precedence. To be fair to those at Oxfam, they responded to the crisis with great energy, and they produced a 10 point plan and agreed to all our recommendations in our report. That resulted in a major overhaul of their systems to ensure that standards were maintained
2020-07-09	CON	RobertSeely	Secondly, when it comes to overseas spending, when I was writing the “Global Britain” document last year that the Prime Minister very kindly wrote the foreword for, we tried to understand where our overseas money was going. Some of it was being spent by the Department for International Development, some by the Department for Business, Energy and Industrial Strategy, some by the Home Office and some by the Foreign Office—quite badly, often. I can congratulate DFID on the quality of its spending, no doubt about it. We do not have an audit of our overseas spending, and I believe that we badly need one. There is no doubt in this House that poverty alleviation is critical—it is moral; it is right; it is good. Grassroots development is critical—it is moral, right and good
2020-07-09	LAB	MaryTwist	In addition, aid is paramount in tackling climate change in some of the world’s poorest countries, from small-scale renewable energy projects in Uganda to conservation in Latin America. Climate justice comes as a priority and must certainly be recognised. I worry that this merger will water down some of those rights and will detract from the use of our aid budget
2020-07-09	LAB	ValerieVaz	[That this House recognises the life-changing injustices experienced by subpostmasters throughout the Horizon scandal; notes with the deepest sadness that subpostmasters have served custodial sentences and suffered bankruptcy for offences they did not commit; recognises the role of the Government in prolonging this crisis through not fulfilling their role of shareholder representation on the board of Post Office Limited; expresses concern at the scope and formation of the inquiry currently outlined by the Department for Business, Energy and Industrial Strategy; and strongly urges the Government to institute a judge-led public inquiry into this matter at the earliest opportunity.] The Under-Secretary of State for Business, Energy and Industrial Strategy, the hon. Member for Sutton and Cheam (Paul Scully), said in the House that there would be an independent review on the Horizon IT scandal. It is now a month since he made that statement. The Government website said that the review would come “shortly”. The EDM is calling for a judge-led independent inquiry. People have served custodial sentences and gone bankrupt, and they were totally innocent. This is what the judge said when he gave judgment: “the Post Office…has resisted timely resolution of this Group Litigation”
2020-07-13	CON	GregoryHands	It is very important that we have a broad and deep relationship covering matters such as trade, defence, security, energy and regional issues. It is important that the UK maintains that relationship overall. It does not prevent us from being critical, as we have been on occasions, in relation to human rights.
2020-07-13	CON	JacobYoung	Long-awaited reforms of the planning system will make it easier for landlords to convert existing commercial property into housing and further stimulate the market, and our new green homes grant will mean that new home owners can increase the energy efficiency of their homes, creating more jobs for people who work in home improvement
2020-07-13	CON	JohnGlen	This stamp duty cut is one of several measures in the Government’s plan for jobs that will benefit families and businesses across the country. From September, homeowners and landlords will be able to apply for a green homes grant of up to £5,000 to make their homes more energy efficient. For low-income households, we will go even further, with vouchers covering the full cost up to £10,000. This, too, will support local jobs, as well as reducing carbon emissions and cutting energy bills for hard-pressed families.
2020-07-13	CON	MichaelGove	I am grateful to my hon. Friend for raising that issue. He has been a consistent opponent of modern slavery and human trafficking and has done an enormous amount to draw it to the attention of others and to demand and secure appropriate action. It is only right that Members across the House recognise the consistent campaigning energy that he has brought to this important issue. It is also important to say that, as we take back control of our borders and move to having greater data and a more effective approach to monitoring who and what comes into this country, we can play an even more prominent part in dealing with that evil trade.
2020-07-14	LAB	JonathanAshworth	All we need and want is clarity, so may we have it in other areas? What now is the position on workers returning to offices? Do the Government want them to return to offices, yes or no? Will the Health Secretary offer greater clarity to the people of Leicester, who are now in the 17th week of lockdown in my city? What metrics will be used to judge whether Leicester can ease out lockdown later this week? When will he make that decision? How will he communicate that decision to the people of Leicester? Will he clarify why the Under-Secretary of State for Business, Energy and Industrial Strategy, the hon. Member for Stratford-on-Avon (Nadhim Zahawi), has ruled out extra support for Leicester businesses and employers, contradicting the indications that the Health Secretary gave to the people of Leicester? When people are worried about their jobs this mixed messaging is the last thing they need
2020-07-15	CON	AlexanderJohnson	I will examine the idea of a scrappage scheme for old and highly polluting aircraft, but I can tell my hon. Friend that long before then, we are putting £3.9 billion into the Aerospace Technology Institute. As I am sure he knows, the Department for Business, Energy and Industrial Strategy has set up, with the Department for Transport, a joint taskforce to create “Jet Zero”, a zero-emissions passenger plane in which this country will lead the world.
2020-07-15	CON	AndrewStevenson	The Government want green energy. The Government want security of energy supply. The Government want to boost economic development in the regions. The Government want to encourage apprenticeships and youth employment. The Government want to increase innovation investment and to have a dynamic supply chain. That is all on offer in Cumbria. Will the Prime Minister support, with Government financial backing, the building of nuclear power generation facilities in Cumbria?
2020-07-15	LAB	DarrenJones	On 23 June, and again on 24 June, the Prime Minister said to the House in respect of financial support for businesses and workers during local lockdowns that “nobody should be penalised for doing the right thing.”—[Official Report, 23 June 2020; Vol. 677, c. 1178; Official Report, 24 June 2020; Vol. 677, c. 1307]Last week, the Secretary of State for Business, Energy and Industrial Strategy was unable to give any details to my Committee at all about this vital future local support. Can the Prime Minister today be crystal clear for the towns and cities preparing for local lockdowns about whether he will be penalising businesses and workers for doing the right thing, or not?
