2020-01-07	CON	AndrewBridgen	Does my hon. Friend agree that it is important that this Government do everything they can to help energy-intensive industries to reduce their carbon footprint and do not merely regulate and tax, as some would do, because that risks exporting not only the carbon, but the jobs?
2020-01-07	CON	MatthewOfford	In the last six months alone, Iran has disregarded four tenets of the JCPOA. In addition, Iran has refused to answer questions from the International Atomic Energy Agency about uranium particles found at a previously undisclosed location. We should not forget that the JCPOA allowed millions of pounds, in addition to manpower and resources, to pour into Syria to continue that war and kill thousands of people. Does the Secretary of State agree that it is simply incorrect for anyone to say that the JCPOA is alive and well?
2020-01-07	CON	RobertWallace	The Government will consider all options as they see the latest announcements from Iran, and in discussion with bodies such as the International Energy Agency.
2020-01-07	CON	SimonClarke	My hon. Friend is absolutely right to say that we must avoid shedding jobs as we change our energy mix. As I mentioned in an earlier answer, we got £350 million allocated to the industrial energy transformation fund. I am also a big supporter of new technologies such as carbon capture and storage, which can address the challenges of decarbonising energy-intensive industries.
2020-01-07	CON	SimonClarke	The Government take our environmental responsibilities very seriously, and the Prime Minister established the new Cabinet Committee on Climate Change for that very reason. The UK is, of course, the G20 leader in reducing our greenhouse gas emissions while growing our economy. Later this year, the Government will set out further plans to reduce emissions in key sectors such as transport, energy and building while seizing the economic benefits of clean growth. We have launched a review into the transition to a net zero economy and how that will be funded, and the review will publish its findings this autumn.
2020-01-07	CON	SimonClarke	The electorate obviously gave their verdict on the relative credibility of our manifesto. This Chamber, on a cross-party basis, should welcome the real consensus that the UK has done the right thing by becoming the first major western economy to commit to a net zero policy. We have allocated £1 billion for the take-up of ultra low emission vehicles, £350 million for the industrial energy transition fund, and £800 million in our manifesto for carbon capture and storage
2020-01-07	CON	SimonClarke	The most important thing to recognise is that last year was the first year on record in which renewable energy constituted more of our energy mix than fossil fuels. We also need to recognise that oil and gas support many thousands of jobs in the United Kingdom, and we must be careful not to jeopardise economic growth during the transition.
2020-01-07	CON	SimonClarke	The whole United Kingdom needs to work together to make sure that we deliver on our climate goals. We clearly need a diverse energy mix to help to deliver on that, and nuclear has a clear role to play within that settlement. We are very clear that we obviously monitor all projects to make sure they deliver maximum value for money, but we do need some baseload power.
2020-01-07	CON	StephenCrabb	The Minister is right about the growing role that renewables are playing in our energy mix, as 2018 was the greenest year on record for our energy system. Does he agree that the UK’s track record on cutting emissions, while maintaining jobs growth and economic growth, is remarkable at a global level and should be applauded?
2020-01-08	LAB	ChristopherElmore	The hon. and learned Lady is making an important contribution, as she often does. This is not just about the withdrawal process. We cannot even get discussions about what is happening with the shared prosperity fund. It is 19 or 20 months since the consultation should have ended. I understand from Welsh Assembly Members and Welsh Government colleagues that they cannot even get a discussion with the Treasury, the Department for Business, Energy and Industrial Strategy, the Wales Office or the Scottish Office. If we cannot even get what happens to our funding right, there is little hope of genuine consultation with the devolved Administrations on the process of leaving.
2020-01-08	LAB	GeorgeHowarth	(3) A Minister of the Crown shall lay before each House of Parliament a progress report on the objective in subsection (1) within 4 months of this Act being passed, and subsequently at intervals of no more than 2 months.” This new clause would require the UK Government to seek to maintain participation in the European medicines regulatory network as part of its negotiations for the future relationship with the EU. New clause 32—Maintaining the UK’s membership of Euratom— “(1) It shall be an objective of the Government to maintain the United Kingdom’s membership of the European Atomic Energy Community within the framework of the future relationship between the United Kingdom and European Union
2020-01-09	CON	HeatherWheeler	The hon. Gentleman makes a really interesting suggestion. Interestingly, DFID official development assistance money is being used particularly in Brazil to look at decarbonising its energy production. We cannot use ODA money for Australia because obviously it is a first-world nation, but perhaps we can find another way through the prosperity fund or something like that. We will take that idea away. We are always happy to receive good ideas.
2020-01-09	CON	HeatherWheeler	The hon. Lady asks a very intelligent question. The answer is that I cannot give her that assurance right now. We have green finance deals and ocean deals. We are so committed to helping countries around the world to move on to renewable energy projects, and I think that is the way forward.
2020-01-09	CON	HeatherWheeler	Those are wise words from my hon. Friend. The UK policy on climate change has been dramatic: we are setting out legally binding targets to eliminate climate change by 2050; we have been the fastest in the G20 to decarbonise since 2000; and since 1990 we have reduced our emissions by more than 40% while growing our economy by two thirds. We can get the message out to other countries that it can be done and it does not affect the economy. Exactly as my hon. Friend said, National Grid’s use of energy from renewable sources is leading the way as a great example to others.
2020-01-09	CON	HeatherWheeler	We have the chair of COP 26 with Italy, so we are absolutely taking climate change as the No. 1 priority. In every embassy around the world, every ambassador and every high commissioner has it as their No.1 priority to talk to other Governments and encourage greater and more ambitious targets for those countries. In particular, we will continue with the Paris agreement and make sure that those commitments are guaranteed going forward. President Claire O’Neill, late of this parish as the Member for Devizes, recently met other energy Ministers at COP25 in Madrid to bang the drum and make clear that this is our No.1 priority
2020-01-09	CON	JacobReesMogg	I was aware of that issue, and I know that Members throughout the House are concerned about the effect that it will have on their most vulnerable and least well-off constituents. I think that it is up to all of us to lobby British Gas to reconsider its decision. I will happily take up the matter with the Secretary of State for Business, Energy and Industrial Strategy and pass on the hon. Gentleman’s comments, because I know that it has attracted cross-party concern and is a matter of considerable seriousness. As the hon. Gentleman rightly says, we need to look after the least well-off the most.
2020-01-09	CON	JacobReesMogg	Obviously there are time slots available for Westminster Hall debates and Adjournment debates—they are in Mr Speaker’s hands—and I recommend that the hon. Lady applies for one of those. I also remind her that Business, Energy and Industrial Strategy questions are on Tuesday 21 January. This is such an important issue and it is well worth raising. If there is anything I can do to help to facilitate a debate—not, I am afraid, in Government time, but before the Backbench Business Committee is set up—I will look very sympathetically on it.
2020-01-09	CON	JacobReesMogg	This is obviously a very important issue, and very important for the people whose jobs are involved, for whom it must be a very troubling time. I reiterate that there are Business, Energy and Industrial Strategy questions on Tuesday 21 January, and an application for an Adjournment debate may see something discussed even sooner.
2020-01-09	CON	JamesCartlidge	We should remember that on new year’s day National Grid announced that this country just had the first ever year in which the energy from zero-carbon sources exceeded fossil fuels—it is the first time in our history—so we are doing our bit. Does my hon. Friend agree that we should not be lecturing Australia when it is in the middle of a national emergency if it is not yet doing the same? As she rightly says, we should be giving it all the support we can. Will she confirm that if the fires worsen, we stand ready to provide whatever help is needed, should the Australians request it?
2020-01-09	CON	StephenBarclay	Three years ago, Parliament entrusted the decision of our relationship with the EU to the British people. By passing the Bill, we will send a clear message that we have listened and we have acted. In doing so, we will restore trust in this House and in our democracy. Once Brexit is delivered on 31 January, we can turn our eyes towards our other national priorities: education and skills; making our country safer; investing in the future of our much-loved NHS; and levelling up all parts of the United Kingdom. This is what people care about. It is what this people’s Government cares about. Passing the Brexit Bill will unlock the time and energy to make those priorities a reality
2020-01-09	LAB	AnnaMcMorrin	The huge scale of the fires must leave us in absolutely no doubt of the urgent and radical action that is needed on climate change, so I was also absolutely shocked that I did not hear the Minister even mention the words “climate change” in her statement. Yet, behind the scenes, UK Export Finance schemes are handing out billions of pounds of taxpayers’ money to develop fossil fuel projects, locking countries into high-carbon energy for decades to come. Will this Government put their money where their mouth is and end UK Export Finance’s support for fossil fuels?
2020-01-09	LAB	FleurAnderson	The Government have made big promises over the days of the debate, which I do not believe, given their track record in the past nine years, but I hope they prove me wrong. For a start, there are promises that there will be no regression on environmental standards. We must have a UK version of dynamic alignment on environmental policies. I know that the Government do not want dynamic alignment because it means that we are in hock to the EU, but there must be a UK version, whereby we do not end up with zombie policies and stay backward while the EU moves forward. We must always vie to keep outdoing the EU on climate action. We must phase out diesel and petrol cars, bring in eco-friendly homes and achieve 100% clean energy. I hope that all those policies will be in the upcoming environment Bill. The measure must have teeth to match the European Court of Justice
2020-01-09	LAB	ValerieVaz	Another thing that the Government have announced outside the House but not to it is a review, to be concluded by mid-February, of the roll-out of the IR35 tax plan for the self-employed, which is due to take effect in April. May we have a statement on the exact terms of that review and the measures that will be put in place to support the self-employed? The Opposition called for a review during the general election. This is more chaos, and it is disgraceful—and so is the announcement on 23 December by the Secretary of State for Business, Energy and Industrial Strategy about the takeover of Cobham
2020-01-13	CON	AndrewStephenson	During my time as a joint Minister—I was only appointed in July, after leaving the Whips Office, briefly via the Department for Business, Energy and Industrial Strategy—I have seen for myself DFID and the Foreign and Commonwealth Office working together to bring operations closer, to share expertise and to better co-ordinate responses to current and emerging challenges around the world
2020-01-13	CON	AndrewStephenson	In conclusion, the Queen’s Speech lays out our ambitious, optimistic and bold vision for our new place in the world. This new vision builds on the work of the British people—their work in making our country world-leading, whether that is British medics who spent their Christmas fighting a deadly measles outbreak in Samoa, or our world-leading climate change scientists and clean energy pioneers whose endeavours will benefit from our new £1 billion Ayrton fund, or the brave men and women of our armed forces who, in 2019, were involved in 35 operations across 30 countries.
2020-01-13	CON	AndrewStephenson	We all know that UK aid works. To list just a few results achieved since 2015: more than 14 million children have gained a decent education, of whom almost 6 million are girls; 3.9 million people have been supported to raise their incomes or to maintain or gain a better job or livelihood; and over the past eight years, UK international climate finance programmes have supported 57 million people to cope with the effects of climate change and enabled 26 million to have access to clean energy. The crucial support our aid programmes provide at times of humanitarian crises is something we should be proud of. More than 32 million people have been supported with humanitarian assistance since 2015, including at least 10 million women and girls
2020-01-13	CON	ImranAhmadKhan	Speaking of shoe leather, I am mindful of all those who have graced this green leather, and have confidence that we will step up and meet the challenges promised by this privilege of public service. I am also aware of the energy and emotion that this House and the people whom it serves have invested in the Brexit debate. The underlying theme of unleashing our United Kingdom’s potential to innovate, adapt, overcome and triumph is not lost in the character of my constituency of Wakefield
2020-01-13	CON	RobertJenrick	The hon. Lady is absolutely right. We have committed to the future homes standard, which means that no new home will be built in this country from 2025 unless it has the highest levels of energy efficiency, and low or zero-carbon heating. We are consulting on that and further proposals will be brought forward shortly, meaning that planning applications will be made very shortly for those homes to be delivered post 2025. This will be a major change in the delivery of homes across the country, and a very welcome one.
2020-01-13	LAB	CatherineWest	The past decade has already seen anaemic growth in the domestic economy as a result of the disastrous policy of austerity and the self-inflicted wounds of Brexit. Just today, in the financial pages, there is much discussion about another rate cap by the Bank of England because of fears of another dip in our economy. Households are worse off now than they were in 2010—10 years ago. Simultaneously, there is a real risk that UK trade policy could erode standards on our trade in goods and lead to a diminishing of the ease of trading in services owing to the ridiculously short adjustment period that the Government have given themselves to achieve equivalence in financial services. The amount of political capital in energy required to negotiate a free trade agreement with the EU and the unrealistic timeframe of 11 months will mean that the UK is likely to reduce its influence in other crucial international relations issues
2020-01-13	LAB	ChinyeluOnwurah	And we can do it. We have the workforce in the north-east. We have 51,000 tech, engineering, maths and science students coming out of our universities every year, and we have great strengths in science, digital, energy, healthcare and business. But we need frictionless borders with our closest partners and agreed standards that define everything from the acceptable frequency of electromagnetic radiation to the atomic composition of a given chemical. Our relationship with the European Union is as much a matter of geography as it is of politics. The Prime Minister’s bad deal and the Conservatives’ recklessness over Brexit have already cost the region jobs, and I look forward to the new north-eastern Tory MPs joining me in ensuring that north-east manufacturing continues and stopping the Prime Minister as he breaks his promises on trade, standards, workers and environmental rights. We can perhaps start this by seeing the letter of reassurances given to Nissan over Brexit and asking whether the current deal meets them
2020-01-14	CON	AndrewBowie	The routes that Flybe operates out of Aberdeen International airport are vital to jobs and the local economy in West Aberdeenshire, connecting the energy capital of Europe, which is Aberdeen, to other energy hubs such as Teesside and Humberside. What work is being done in the Department to make sure that these economically vital routes are protected in future?
2020-01-14	CON	DominicRaab	Let me set out the pattern of non-compliance by the regime that left us with no credible alternative. Since last May, Iran has step by step reduced its compliance with critical elements of the JCPOA, leaving it a shell of an agreement. On 1 July 2019, the International Atomic Energy Agency reported that Iran had exceeded key limits on low enriched uranium stockpile limits. On 8 July, the IAEA reported that Iran had exceeded its 3.67% enriched uranium production limit. On 5 November, the IAEA confirmed that Iran had crossed its advanced centrifuge research and development limits. On 7 November, the IAEA confirmed that Iran had restarted enrichment activities at the Fordow facility—a clear violation of JCPOA restrictions. On 18 November, the IAEA reported that Iran had exceeded its heavy water limits. On 5 January this year, Iran announced that it would no longer adhere to JCPOA limits on centrifuge numbers
2020-01-14	CON	DominicRaab	My right hon. Friend, of course, knows a lot of the recent history of this situation as well as—if not better than—I do. As always, the answer is for Britain to exercise its judgment and the full energy of its diplomacy to ensure that we forge common purpose with our European and American friends. I have been in the US and Brussels over the last two weeks, and will continue that endeavour. The worst thing that we could do right now would be to allow or foment divisions in that partnership, because that would only encourage the hardliners in Tehran.
2020-01-14	LAB	RachelReeves	There is something of a pattern developing. We have had the collapse of Monarch and of Thomas Cook, and now the potential collapse of Flybe. When, in the last Parliament, the Business, Energy and Industrial Strategy Committee took evidence on the collapse of Thomas Cook, the evidence we heard from the business and the trade unions was the same; they said that the Government were asleep at the wheel. What lessons have the Government learned from that collapse? What are they doing to ensure that passengers are protected, that critical routes that connect regional towns and cities are supported and that the taxpayer does not end up footing the bill for another corporate failure?
2020-01-15	CON	AlexanderJohnson	The hon. Gentleman is right to say that the new Office for Environmental Protection will have powers to hold the Government to account, but let me draw his attention to the record of this Conservative Government. Under this Government, we have seen carbon dioxide emissions fall by 42% from 1990 levels, despite a 75% increase in GDP. On some days, most of our energy now comes from renewable sources. We will be leading the COP26 summit, where we will introduce enforceable limits not just for this country, but for the whole world.
2020-01-15	CON	AndreaLeadsom	Many of my new, true blue hon. Friends have green-collar jobs in their constituencies. The constituency of Sedgefield makes underwater-cable protection systems that are exported all over the world. Great Grimsby leads the world in offshore wind operations and maintenance, while in Blyth Valley, where I was proud to pay a visit to support our excellent new colleague my hon. Friend the Member for Blyth Valley (Ian Levy) during the general election campaign, our offshore renewable energy catapult recently tested the world’s longest offshore wind turbine blade. At over 100 metres, it would, if we stood it next to Parliament, be taller than Big Ben.
2020-01-15	CON	ClaireCoutinho	Our vibrant village spirit is evident in the communities of Tatsfield, Warlingham, Woldingham, Lingfield, Felbridge and many more besides. I hope to be a champion in this House for preserving and protecting this treasured way of life. In Outwood, near Godstone, work began in 1665 on one of the oldest working British windmills. The owner is said to have watched the great fire of London rage 25 miles away from its roof, and I am proud that what East Surrey helped to pioneer in the renewable energy sector in the 17th century has now become one of the most remarkable success stories in the UK today. Not only are we the world’s leader in offshore wind, but seven of the 10 biggest wind farms in Europe are right here in the UK. I commend the ambitious environment Bill proposed in Her Majesty’s Gracious Speech to forward this work, and I look forward to seeing the green measures in the upcoming Budget that will undoubtedly build on it
2020-01-15	CON	DerekThomas	I welcome the intention behind the green industrial revolution and the £22 billion that will be spent each year on green technologies for efficient homes, renewable energy, clean heating and electric vehicles. It will come as no surprise to anyone who has heard me speak on this subject before that I will discuss two areas: transport and housing
2020-01-15	CON	GillianKeegan	Chichester District Council is doing its part. It already operates two electric vehicles for its daily enforcement patrols, and I will have further cause to speak about its work as it implements a climate emergency action plan that aims to make a 10% carbon reduction in the district year on year from now until 2025. Again, we can go faster if many more councils follow this example. I am sure that the council will also consider the steps that we can and need to take to make existing and new homes more energy efficient as we move towards zero carbon housing, which will be vital
2020-01-15	CON	GillianKeegan	Government and business have driven these changes that have transformed our energy market. I believe that we need to do more to develop and invest in emerging technologies, particularly at sea, and as an island nation we are well placed to lead the way. I was particularly interested in my hon. Friend the Member for Barrow and Furness’s suggestions about investment in tidal technologies that could transform his constituency. Creating a renewable and diverse energy grid is crucial as we move into the next decade, when most of our nuclear power stations are set to be retired. Beyond this, the Government are rightly tackling emissions from cars and looking to phase out the internal combustion engine from our lives by 2040. To that end, electric vehicles are set to replace them, which will increase demand on the grid
2020-01-15	CON	GillianKeegan	However, we need a diverse energy mix to ensure our long-term energy security. I am concerned by reports of the wake effect, a process whereby turbines block one another, and of blockage, where the physical wind farm slows the wind down as it approaches. This, combined with the irregularity of the wind, means that the UK needs diversity in its energy output
2020-01-15	CON	GillianKeegan	Last year, we committed to continue this journey with our landmark commitment to a net zero carbon economy by 2050—or sooner; we are allowed to beat our targets, and as we are Conservatives, we often do. Wind power has played a significant role in our success thus far, and we are now the world’s biggest producer of power from offshore wind. Last year it contributed a fifth of our electricity generation, overtaking nuclear for the first time in our history. This is progress. I fully support the Government’s commitment to increase our output to 40 GW by 2030, and I fully anticipate that this will become a reality, given that the cost of wind energy has fallen year on year through contracts for difference
2020-01-15	CON	GillianKeegan	Solar has a huge part to play, and I am proud that 99% of all existing solar panels have been installed since 2010. Locally, West Sussex County Council is leading the way with a range of projects such as the development of two solar farms in my constituency at Tangmere and Westhampnett. The latter has been built on a former landfill site and was the first such public farm to be built without any central subsidy. I hope that Government colleagues will look to sites such as these that are inappropriate for alternative development and consider replicating these examples. The council also runs a solar schools programme, and 80 schools across the county now collectively produce the same energy as the Westhampnett solar farm, saving an average of £2,000 per school on bills. Altogether, the council’s renewable programme brings in a revenue stream that exceeds £1 million a year
