2020-03-12	CON	RichardBacon	Believe it or not—I can demonstrate it with evidence, which I am happy to share with the Minister—there are more people in this country who want to build their own homes than people who want to buy new ones. Only 33% of people in this country would prefer to buy a new home. Two thirds of people would prefer not to, and 61% of people in this country would like at some point the chance to build their own home. We have to take the energy that is there and turn it into something real, and we need radical changes in how we do things to make that happen
2020-03-12	CON	RichardBacon	Rod Hackney, who was the adviser to the Prince of Wales and is a renowned architect, once said: “It is a dangerous thing to underestimate human potential and the energy which can be generated when people are given the opportunity to help themselves.” That is what we have to make happen.
2020-03-12	CON	RobertJenrick	That is already a requirement and we are going to do work to see whether further action can be taken. The future homes standard, the final details of which we will announce shortly, will mean that from 2025 no new home is built in this country unless it has very high levels of energy efficiency and sustainability—at least a 75% reduction in CO2 emissions. If a council is in the process of making a plan, or will be soon, it will need to plan for all homes to be meeting that standard, or higher, in the years ahead.
2020-03-12	CON	RobertJenrick	We are committed to a green revolution in the housing industry. We are doing that in many different ways, most notably through the future homes standard, which we have just consulted on. We have received more than 3,000 responses and will bring forward our final proposals shortly. We have consulted on a substantial reduction in CO2 emissions in new homes of between 75% and 80%. I do not want to pre-empt what we might choose to do, having listened to the views in the consultation. However, the evidence that we saw prior to the consultation was that that was the most credible reduction in CO2 emissions that we could deliver across the whole of the country, although some parts could go further and faster if they chose to do so. We are listening to the responses, and I want to see the industry respond, change and have much higher levels of energy efficiency and to see new heating systems come in as quickly as possible.
2020-03-12	LAB	JohnMcDonnell	Let us not forget the third emergency we are facing today. Future generations will never forgive this Government for their failure to address climate change in this Budget. Infrastructure investment, if properly planned, could have been an opportunity to shift the tracks on which this economy runs towards a zero-carbon future. The Government have missed that opportunity. The Institute for Public Policy Research’s environmental justice commission said that £33 billion a year in green investment was needed for the Government to achieve only their weak target of net zero emissions by 2050. The Chancellor has fallen woefully short of that target. Instead, the Chancellor has opted for £27 billion to be spent roads, which currently contribute 90% of the UK’s transport emissions. They have committed less than one fifth of that to buses and cycling. Fuel duty is still frozen, with no effective assistance to encourage the shift from cars dependent on fossil fuel to less polluting cars and public transport. There is no new support for renewable energy sources such as wind and solar. In the year when we host COP26, this Budget will be seen as a betrayal of future generations
2020-03-12	LAB	PatrickMcFadden	The Secretary of State for Business, Energy and Industrial Strategy claims this is the most business-friendly Government ever. In truth, this is the first Government in living memory to relegate economic prosperity to behind issues of sovereignty. That is not a claim from me; it is a policy set out by the Prime Minister and his chief Brexit negotiator
2020-03-12	LAB	RebeccaLongBailey	On the social emergency, we live in a society in which life expectancy is actually falling for the poorest. We have rampant regional inequality, hunger in schools and public services pushed to breaking point by a policy that even the Chancellor now admits was a political choice all along—the choice of austerity. Is it not telling that this Budget was silent on social care and universal credit? Is it not telling that it backed away from the tax rises on the wealthiest floated by his predecessor, and that while the biggest firms will benefit from his spending plans, there will be little if any plans for truly redistributive spending that would benefit our society from the bottom up? The Government’s own analysis shows that the tax and benefit changes, excluding public service spending, make richer households better off and cut earnings for the poorest. As the Women’s Budget Group has stated: “We may have more roads and fewer potholes as a result of this budget, but the prospects for investing in social care and tackling child poverty remain bleak.” Turning to the emergency that will define our generation and those to come, the climate emergency, I would like to list those things on which this Budget was silent. On solar power, wind power and tidal power, there was nothing. On the Tory manifesto pledge to support hydrogen production—nothing. On the Tory manifesto pledge to spend £9.2 billion on energy efficiency and cut household bills—nothing. On the Tory manifesto pledge to support a gigafactory for electric vehicle batteries—nothing. On reducing emissions from agriculture—nothing. On making public transport more affordable—nothing. And on measures to support workers and communities to transition away from carbon-intensive industries—nothing
2020-03-12	LAB	ValerieVaz	The Leader of the House will know that it is British Science Week. I was delighted to welcome the Royal Society of Chemistry and Lab Tots. The Under-Secretary of State for Business, Energy and Industrial Strategy, the hon. Member for Derby North (Amanda Solloway) came to see experiments and how to make lava lamps. I am sure that the right hon. Gentleman will join me in thanking the dedicated scientists who are looking at research and development to find a cure for the virus, and developing the tests and interpretation of the tests. I place on record our thanks to Public Health England and the House staff, who are meeting daily to keep us safe. The Leader of the House will know that there is such a thing as society and community, and we will look out for each other.
2020-03-13	CON	DavidJohnston	Does my hon. Friend agree that one of the challenges for national treasures such as the British Library is that their buildings can often start to be unfit for the purpose of storing the great items that he is talking about? For example, parts of the building might be falling down or be energy inefficient. Perhaps they could show more of their collections to the public if they could simply borrow, as this Bill allows the British Library to do, in order to upgrade their facilities or build new parts of their buildings.
2020-03-13	LAB	TracyBrabin	The ability to borrow effectively reflects how cultural institutions now operate. Many of them need additional financial support to improve their digital systems, make their buildings and storage more energy efficient and develop their services. These are all issues that the British Library may choose to address with these new powers. Or it could follow in the footsteps of others by borrowing money to build new buildings, move staff to purpose-built spaces, construct new galleries, increase visitor footfall and make sure that wherever people live they can access the library’s extraordinary offer. There is something amazing about being a member of the library. Members can request the most extraordinary rare book, which is then, by the brilliant staff, brought to where they are studying, writing and researching. It is an incredible facility, and I recommend that anyone who does any research become a member
2020-03-16	CON	KwasiKwarteng	In Great Britain, cavity wall insulation is present in around 70% of the homes for which it is appropriate. It reduces energy bills and saves carbon. However, I fully accept that the insulation work carried out under the predecessors of the ECO scheme did not meet the standards that are now required—I am afraid most cavity wall insulation was installed under those schemes —which is why, from the start of ECO in 2013, the Government made clear guarantees and specific installation standards a requirement, to improve consumer protection. In addition, to monitor compliance, some 5% of all the measures taken are independently checked and the result is reported to the administrator, which is Ofgem. Installers of cavity wall insulation also now have to provide a 25-year guarantee for the measures that they install
2020-03-16	CON	KwasiKwarteng	Nevertheless, we know that standards and consumer protection can improve. The hon. Gentleman mentioned an independent review; we are implementing the recommendations of the comprehensive and independent Each Home Counts review of quality and standards. As I have mentioned, from 1 January this year all installers that work under ECO have to be registered with TrustMark, which is the new Government-endorsed quality framework for energy efficiency. Compliance with TrustMark leads to improved and comprehensive consumer protection, and that includes a clear route to the redress that the hon. Gentleman talked about for his constituents. We now have updated design and we have installation standards, so the picture today is far better than the one that he described
2020-03-16	CON	KwasiKwarteng	The Government acknowledge the charge that some companies have installed CWI in homes that were unsuitable for those measures and that they have done so using poor building practices. We also acknowledge that some of these companies have, as the hon. Gentleman suggested, gone into liquidation, which has meant that they have avoided any redress to former customers. But it is precisely for those reasons that from 1 January this year we introduced new design and installation standards into our main domestic energy-efficiency policy, the energy company obligation. I will talk a bit more about that in a moment
2020-03-16	LAB	ChristopherElmore	As Members will know, most homes built before the 1970s had no form of insulation, and many were instead built with vast cavities within the external walls. Throughout the 1990s, as our awareness of energy efficiency and environmental issues expanded, the practice of retrofitting insulation in those wall cavities began to expand. Various Government schemes have followed, encouraging people living in energy-inefficient properties to have that work undertaken at a reduced or no cost to the homeowner.
2020-03-16	LAB	ChristopherElmore	From the outset, I want to make it clear that I am not against cavity wall insulation. If done properly, it is an efficient means of making our homes and other buildings more energy efficient, saving us power and helping to make the way we all live more sustainable. It can also help to reduce people’s energy bills—something that we all welcome, of course. In the light of the climate and environment emergency that we must address, only a fool would suggest we should not use all the tools at our disposal to make the way that we live less environmentally damaging. Cavity wall insulation can and should form part of this; that much is clear. What is less clear is what happens when our interventions bring about unforeseen consequences—unforeseen consequences that cause damage to people’s homes and leave them with a hefty repair bill
2020-03-16	LAB	ChristopherElmore	If installed incorrectly or in inappropriate properties, insulation can act as a bridge for moisture to move from the external to the internal walls, which can result in high levels of damp. Not only can damp cause higher energy bills—which is totally counter to the purpose of such schemes—but it can cause significant health issues for residents. The science tells us that regions affected by high levels of wind-driven rain are subject to a much greater risk of damp and mould-related issues. Effective safeguards are therefore vital in such areas to ensure that any retrofitting work does not make the problems of homeowners and renters worse rather than better
2020-03-16	LAB	ChristopherElmore	It is clear that Miller Pattison is not an insignificant player in this: the company’s administrators have told Gavin that EDF Energy has made a claim against the company for faulty insulation work. Miller Pattison has previously disclosed that it applied for 800,000 CIGA guarantees, and commonly received a startling 40 to 50 complaints per month. The events I have described are all the more suspicious when we consider that—I have been informed—Miller Pattison’s managing director, Mike Dyson, was on the board of CIGA when the decision was made to grant the new firm, Novora Building Services Ltd, registered status. That means that Novora Building Services Ltd is now being used by CIGA to undertake remedial works in properties where similar problems to Gavin’s have occurred. Given that many of Novora’s assets were transferred from the defunct Miller Pattison, in effect the company responsible for the shoddy works is now being paid to correct some of its own mistakes
2020-03-16	LAB	ChristopherElmore	More recently, I was contacted by a constituent, Gavin Ward, who had cavity wall insulation fitted in April 2011. Gavin is in the Public Gallery this evening, so I would like to thank him for coming along today. Gavin owns his property and had lived there since 2001. Gavin maintains that prior to having the insulation fitted in 2011, there were no issues with damp in his property. He was door-stepped by Miller Pattison, which was installing cavity wall insulation locally, and was encouraged to have some fitted. Because he was in receipt of working tax credits the work was undertaken free of charge, with the install being funded by an energy company. Miller Pattison subsequently conducted a pre-installation survey, which proved that the property was free from damp and apparently suitable for the installation to take place. Luckily for Gavin, he retained a copy of the survey
2020-03-16	LAB	ChristopherElmore	The installation took place and Gavin thought all was well. He sat back and waited for the insulation to start reducing his energy bills, but in the following months and years the forecast reductions in energy bills did not transpire. In fact, his bills kept increasing and he found it increasingly difficult to keep heat within his home. During this period, Gavin’s young son frequently suffered from recurring ear infections, his wife became more susceptible to asthma attacks, and Gavin himself suffered from chest infections each winter—something he not fallen foul of previously
2020-03-16	LAB	CliveEfford	On a point of order, Mr Speaker. We all appreciate the work and the efforts of the Secretary of State for Health and his attempts to answer our questions this evening, but there were questions that he was not able to answer for several other Departments, such as the Treasury, the Department for Business, Energy and Industrial Strategy, the Department for Work and Pensions, the Department for Education, the Ministry of Housing, Communities and Local Government, the Department for Digital, Culture, Media and Sport and the Department for Transport. When will we get statements from other Secretaries of State, so that we can quiz them properly on the arrangements the Government are making on the very important issues we are raising on behalf of our constituents?
2020-03-17	CON	AaronBell	I am also pleased at the announcement that the Department for Transport has included improvements to the notorious M6 junction 15 in the second road investment strategy. I promised Newcastle-under-Lyme residents that I would call on the Government to act and am delighted that my concerns and those of my colleague and neighbour, my hon. Friend the Member for Stoke-on-Trent South (Jack Brereton), who has also been campaigning on this issue in his time in the House, have been heard. Work must now be done to see what a new junction 15 could look like and how quickly that much needed improvement can be brought forward. That will have important benefits for my constituents, particularly those in the southern suburbs of Clayton, the Westlands and Westbury Park. I hugely welcome the Government’s commitment to put 0.8% of GDP into research and development; it is particularly welcome that that would place us above countries such as the US, China and Japan as a proportion of GDP. I especially welcome the commitment that more R&D funding will go to universities outside London, the east and the south-east of England. World-class science is happening right across the country. For example, fantastic, innovative projects are taking place at Keele University science park in my constituency, such as the smart energy network demonstrator and the hydrogen project HyDeploy, which should provide greener energy from our gas network. We also have a number of world-class firms in our science park, such as the vaccine manufacturer Cobra Biologics and Pharmaceutical Services, whose skills and capacity will, I hope, be tested sooner rather than later
2020-03-17	CON	GregSmith	I warmly welcome the enormous package of measures outlined by the Chancellor. This morning, I spoke to Energy Generator Hire in Kimble Wick in my constituency, which has lost most of its order book and is uncertain about the future. Can he confirm whether event hire companies are included in the envelope of leisure and hospitality?
2020-03-17	CON	IanLevy	Blyth is, of course, the main town, which gives its name to the constituency. My family have farmed the land there for generations, and Blyth is part of my DNA. It is a town steeped in history, but one that is dynamic and forward looking. It was a submarine port during both world wars; the place where the world’s first purpose-built aircraft carrier, the Ark Royal, was launched in 1915; and, not forgetting, the home of Blyth Spartans football club. I am so proud to wear their tie today. Built on coalmining and shipbuilding, Blyth is now at the forefront of developing renewable energy technologies. The port of Blyth will continue to play an important role in trade after Brexit
2020-03-17	CON	KarenBradley	We can always do more. When the UK is responsible for less than 1% of global emissions, and China responsible for 25% of global emissions, it is important to consider the actions we can take in the UK to ensure global action. The action we take here will come to nothing if it is not replicated globally or if businesses try to get around our rules by moving production overseas, using third-party suppliers who are not as clean and green as our industries. I particularly want to reflect on energy-intensive industries such as ceramics—I declare my interest as a north Staffordshire MP—where more and more ceramics production takes place overseas to deal with such issues as the energy trading scheme and other matters. It is quite right that we have measures in place to ensure our industries are as clean as possible, but we cannot allow business to move overseas, affecting our highly skilled and excellent businesses in the UK, just to get around carbon emissions
2020-03-17	CON	SheryllMurray	T2. The International Atomic Energy Agency confirmed this month that Iran has nearly tripled its stockpile of enriched uranium since November, in flagrant violation of the 2015 nuclear deal. That puts it well within reach of the amount needed to produce a nuclear weapon. Does the Minister share my concern that further steps must be taken as a matter of urgency to stop Iran’s aggression, including the re-imposition of major sanctions?
2020-03-17	LAB	PeterDowd	Another problem with the Government’s levelling up agenda is that there is a series of one-off announcements without any coherent plan. For a start, the Government postponed their national infrastructure strategy. Again, they have cut skills funding in recent years. By the end of the last decade, spending on apprenticeships and work-based learning had fallen by a quarter since 2009-10 in real terms. That is according to the Institute for Fiscal Studies. The Budget was disappointing in relation to climate action. The environmental justice commission set up by the Institute for Public Policy Research said that £33 billion of green investment was needed a year to get to the Government’s weak target of net zero emissions by 2050. But there is £27 billion for road building, although nothing for renewable energy sources such as wind and solar. We have heard excuses over the years that they inherited a poor economy, but they have been in power for 10 years and the responsibility for the poor performance of our economy in the past 10 years lies squarely at the Government’s door. They did not believe that public investment could boost the economy. In a speech in 2009, George Osborne said that “fiscal policy is more or less powerless to affect output”
2020-03-17	LAB	StephenKinnock	Of course, any UK manufacturing renaissance must be underpinned by a thriving UK steel industry. Steel is the backbone of the British economy. It is not a sunset industry but a 21st century industry that continues to underpin our entire manufacturing base, from defence to aerospace, and our everyday lives, from the houses we live in to the offices we work in and the trains, buses and cars we travel in—including the electric vehicles of the future. Steel jobs are well-paid manufacturing jobs, offering people in so-called left-behind communities real opportunities in life, yet the Chancellor’s Budget did nothing to address the sky-high energy costs that are crippling the steel industry—UK steelmakers pay 80% more for their energy than their French counterparts —or to tackle the extortionate business rates that are crippling our industry
2020-03-17	LAB	StephenKinnock	The Government must also support the clusters of industries emerging around the UK—steel and clean energy in south Wales, tech in Cambridge, chemicals in Hull and metals in Yorkshire, for instance. We need a comprehensive and integrated policy agenda. Investing in transport is important, but it will not suffice. A continuation of the city-centric model will lead to more social damage and increasing travel congestion, and will do nothing to green our economy
2020-03-18	CON	LukeHall	I thank the hon. Lady for putting that point on the record. She is absolutely right to do so. I very much hope that we will outline imminently the steps that we are looking at taking to support councils further. Yesterday, the Chancellor announced in the House a series of measures to support communities in response to the crisis. The funding he announced amounted to more than £330 billion of financial support, equivalent to 15% of UK GDP. The £10,000 grants to small businesses that are eligible for small business rate relief and the £25,000 grants to retail, hospitality and leisure businesses operating from smaller premises will no doubt help to alleviate pressure on local businesses across the country, but we understand the pressures that are about to come. The Secretary of State for Business, Energy and Industrial Strategy will write to all local authorities in the coming hours to set out how exactly those are to be delivered and the mechanisms by which they can be administered.
2020-03-18	CON	RichardFuller	This is also a test in terms of the enlightenment we have in our social insurance system. I was moved by the contributions from the hon. Member for Leeds West (Rachel Reeves), the Chair of the Business, Energy and Industrial Strategy Committee, and the hon. Member for Ilford North (Wes Streeting). It is absolutely right that this is an opportunity for us to look at those things and to reflect. We may have different perspectives on it, and we will definitely have different politics, but only a fool would say that we should not look at this and learn lessons. This is no time for fools
2020-03-19	CON	JeromeMayhew	I conclude by imploring the Government not to hide behind the corporate veil. Albeit at arm’s length, the Post Office is a part of the Government—it is part of the Department for Business, Energy and Industrial Strategy. It was referred to earlier as an example of unaccountable power, and I fully endorse that statement. It is part of a wider problem with the lack of accountability in quangos throughout our society. That leaves open only one sensible solution: a judge-led inquiry that has the power to investigate who knew what and when, and to give justice to these people and award real compensation.
2020-03-19	CON	PaulScully	I will not, because I am running out of time. I stress that the Government have robust mechanisms in place to maintain oversight of the Post Office, and they are regularly reviewed. I have regular meetings with its chief executive officer and chair, and the Government have increased the frequency of wider shareholder meetings to make sure that, among other things, the actions arising out of the litigation can be tracked. UK Government Investments, as the shareholder representative for the Department for Business, Energy and Industrial Strategy, challenges the Post Office on its corporate governance and strategy, and on its stewardship of financial and other resources on behalf of shareholders, as well as holding a non-executive seat on Post Office Ltd’s board
