2020-07-22	CON	JohnHowell	My right hon. Friend may be aware that I have done more than most to try to stop the return of Russia to the Council of Europe, so I recognise the enduring threat that it poses. Does he share my belief that the Russia report largely underplays the bigger picture and that there is a distinct risk to the UK through the international institutions to which we jointly belong?
2020-07-22	CON	NusratUlGhani	This morning, on the radio, Commissioner Cressida Dick said that people should be concerned about “the threat from Russia”. Will the Minister assure me that our security services will work with our police services to make sure that they have the data, the information and the resources to deal with any local threats?
2020-07-22	CON	RichardHolden	As a former special adviser at the Ministry of Defence during both the Syrian and the Ukrainian conflicts, I am well aware of the threat that Russia continues to pose to the UK and our allies. Will my right hon. Friend clarify what immediate next steps the Government will be taking to counter the disinformation and cyber-attacks—including, at the moment, against the vital work on a coronavirus vaccine?
2020-07-22	CON	RobertButler	The report highlights concerning aspects of Russian interference in UK affairs with a sinister combination of 21st-century technology and tactics that are reminiscent of the cold war. Much of the report is redacted for obvious reasons, but can the Minister assure the House that he is satisfied that, where mistakes were made or threats were underestimated, they are already being put right to ensure that our democracy and economy are protected from nefarious influence, now and in future?
2020-07-22	CON	RobertSeely	I fully accept what the Minister says about this Government acting, and I give credit where credit is due. I have met folks in the Russia unit, and I thank them for their work. However, from 2007 to at least 2014, as the hon. Member for Rhondda (Chris Bryant) said so eloquently, we were hugely complacent and it damaged us. My question is about a foreign agent registration process, because I am unclear about it. Is the Minister talking about spies—making it illegal for the GRU to have people here—or is he talking about foreign lobbying? I have been calling for a foreign lobbying Act for two years now, and the foreign agent registration process in the US is about foreign lobbying, on which we badly need new and updated laws.
2020-07-22	CON	RobertStewart	It comes as no surprise to me that the Russian state seeks to infiltrate and influence so many aspects of our society, but I am particularly worried by Russian cyber-activity, especially attempts to steal our secrets, intellectual property and new technologies. I know that, in recent years, more resources have been given to the security and intelligence services, particularly GCHQ and the Army’s 77th Brigade, but does my right hon. Friend agree that our offensive cyber-capabilities may well have to be enhanced further given the persistent and increasing threats from Russia?
2020-07-22	CON	StevenBaker	In the urgent question earlier, I said something about Legatum’s work on Russia, which I think is honourable and noble. It would be strange indeed if Mr Chandler was connected to Russian intelligence, given that he has put so much investment into fighting the effects of Russian wrongdoing. I have already mentioned trade policy; it is rare indeed that one can say that somebody has facilitated so much benefit to so many people
2020-07-22	CON	StevenBaker	The ISC report rightly thanks five Russia experts from outside the intelligence community, two of whom have done some great work with the Legatum Institute. Will my right hon. Friend join me in thanking those individuals, the institute and, indeed, its visionary founder, Christopher Chandler, for having the courage and the commitment to expend the resources and take the risks to oppose Russian wrongdoing from the private sector?
2020-07-22	CON	TobiasEllwood	As a Select Committee Chair, may I welcome this report? Scrutiny is good. It helps to raise the bar and it is healthy for democracy. However, for those who follow such events, it has long been recognised that Russia poses a national security threat. It regularly buzzes our airspace with its MiGs, and the Foreign Affairs Committee “Moscow’s Gold” report highlighted many of the same issues as this report. Does the Security Minister agree that Russia’s cyber and disinformation actions are a reflection of the changing character of conflict, with calibrated state-sponsored attacks designed to interfere with our politics and economy, but beneath the threshold of any military response? Does he agree that we need to adapt quickly to that new form of political competition?
2020-07-22	LAB	BenjaminBradshaw	I was the first Member of this House to raise concerns about Russian interference in our democracy, four years ago. By blocking the publication of the Russia report before the election, on grounds that the Intelligence and Security Committee has said were spurious, and then trying to fix the Committee, is it not abundantly clear that this Prime Minister has knowingly and repeatedly put his own personal and party interests before the national security of our country?
2020-07-22	LAB	ChristopherBryant	I have been warning about Putin’s Russia for 19 years now, and calling for the Magnitsky sanctions for 10 years. What mystifies me is that Government Ministers still give out golden visas to dodgy Russian oligarchs, that Government Ministers still grant exemptions to dodgy Russian oligarchs so that they can hide their ownership of businesses in this country, and that Government Ministers still take millions of pounds from dodgy Russian oligarchs. We have to clean up our act, and it has to start with the Government.
2020-07-22	LAB	DanielJarvis	The ISC stressed the need to ensure that our response to the threat from Russia is not solely focused on national events and organisations. So what does the Minister intend to do to protect our public sector—our NHS and local government services, which he knows all about—from malicious Russian cyber-intrusion once funding for the national cyber-security programme comes to an end in March next year?
2020-07-22	LAB	DianaJohnson	For years, when I was campaigning for an infected blood inquiry, I was familiar with the “nothing to see here” response from Whitehall, until it was decided that there was something to see. If a chief constable played down a spate of local muggings because police chose not to investigate, any MP worth their salt would not accept that. It should not be any different when it comes to properly investigating and taking action to protect our national security and democratic institutions from those who wish to subvert those institutions, weaken or divide our country and break up our alliances. Should not any welcome measures taken to strengthen national security be taken in the full knowledge of what those weaknesses are by having an inquiry into Russian interference in 2016?
2020-07-22	LAB	JohnHealey	The coalition’s success so far is clear. Daesh no longer controls any territory, compared with its height six years ago, when it had sway over 8 million people and a land area the size of our own UK. However, it is also clear that Daesh is stepping up its insurgent attacks and must be at risk of gaining a foothold south of the Euphrates in the area controlled by the Syrian regime, backed by Iranian and Russian allies. The Secretary of State said this afternoon that the RAF has conducted 16 air attacks since July last year. Half of those have been in the past two months alone, so can the Secretary of State confirm how many air strikes have been carried out by the global coalition as a whole in the past two months, and is the number of such attacks rising
2020-07-22	LAB	KeirStarmer	I see the Prime Minister is already on his pre-prepared lines. This is a serious question of national security. He sat on this report for 10 months and failed to plug a gap in our law on national security for a year and a half. One of the starkest conclusions in the report is that the “UK is clearly a target for Russia’s disinformation campaigns”
2020-07-22	LAB	KeirStarmer	I stood up and condemned what happened in Salisbury, and I supported the then Prime Minister on record. I would ask the Prime Minister to check the record and withdraw that—I was very, very clear. The report was very clear that until recently the Government badly underestimated the Russian threat and the response that it required. They are still playing catch-up. The Government have taken their eye off the ball—arguably, they were not even on the pitch. After the Government have been in power for 10 years, how does the Prime Minister explain that?
2020-07-22	LAB	KeirStarmer	I was absolutely clear in condemning what happened in Salisbury, not least because I was involved in bringing proceedings against Russia on behalf of the Litvinenko family—that is why I was so strong about it. I spent five years as Director of Public Prosecutions, working on live operations with the security and intelligence services, so I am not going to take lectures from the Prime Minister about national security. [Interruption.]
2020-07-22	LAB	KeirStarmer	Pre-prepared gags on flip-flops. This is the former columnist who wrote two versions of every article ever published! In case the Prime Minister has not noticed, the Labour party is under new management. No Front Bencher of this party has appeared on Russia Today since I have been leading this party
2020-07-22	LAB	KeirStarmer	The High Court has ruled that Russia Today broadcasts pose actual and potential harm. Does the Prime Minister agree that it is time to look again at the licensing for Russia Today to operate in the UK?
2020-07-22	LAB	KeirStarmer	The Prime Minister says that he will introduce new legislation. I want to make it clear to him that we will support that legislation and work with the Government. It is not before time. The Prime Minister says that the Government are vigilant. Eighteen months ago, the then Home Secretary said that we did not have all the powers yet to tackle the Russian threat. He said that the Official Secrets Acts were completely out of date. Other legislation has been introduced in that 18-month period. This is about national security. Why have the Government delayed so long in introducing that legislation?
2020-07-22	LAB	KeirStarmer	There is a serious gap in our Official Secrets Act, laying bare for 18 months, and that is all the Prime Minister has to say about it. One way the Government could seek to clamp down on Russian influence is to prevent the spread of Kremlin-backed disinformation. Obviously, social media companies have a big role to play, but the report also highlights “serious distortions in the coverage provided by Russian state-owned international broadcasters such as RT”
2020-07-22	LAB	KeirStarmer	Under my leadership, national security will also be the top priority for Labour, so I want to ask the Prime Minister about the extremely serious report by the Intelligence and Security Committee, which concludes that Russia poses “an immediate and urgent threat” to our national security, and is engaged in a range of activities that include espionage, interfering in democratic processes, and serious crime. The Prime Minister received that report 10 months ago. Given that the threat is described as “immediate and urgent”, why on earth did he sit on it for so long?
2020-07-22	LAB	MohammedKhan	The ISC’s report states that Russian influence in the UK has become the new normal. Individuals with close links to Putin are now well integrated into the UK’s business and social scene and accepted because of their wealth. Surrounding these oligarchs is an industry of enablers who, wittingly or unwittingly, help to extend Russian influence and the nefarious interests of the Russian state in the UK. What steps will the Minister now take to tackle the growth of this industry and the ability of wealthy individuals to influence British politicians and parties and our democracy?
2020-07-22	LAB	NicklausThomasSymonds	(Urgent Question): To ask the Secretary of State for the Home Department, if she will make a statement on the Intelligence and Security Committee’s report into Russia.
2020-07-22	LAB	NicklausThomasSymonds	I thank our security services for the work they do, but they need help, and the report makes it clear that they have not received the strategic support, the legislative tools or the resources necessary to defend our interests. The report concludes that “recent changes in resourcing to counter Russian Hostile State Activity are not (or not only) due to a continuing escalation of the threat—but appear to be an indicator of playing catch-up.” When will the Government stop playing catch up? Anyone who saw the Prime Minister’s failure to engage on this at Prime Minister’s questions will be extremely worried. When will the Government treat this matter with the seriousness it deserves, act on the findings of the report and put the security of our country first?
2020-07-22	LAB	NicklausThomasSymonds	I thank the ISC past and present and all involved in producing the Russia report: “until recently, the Government had badly underestimated the Russian threat and the response it required.” Not my words, but the damning indictment of deep systemic failings in the Government’s approach to security that the Russia report sets out. It is not so much that the Government studied what was happening and missed the signs. The truth is that they took a conscious decision not to look at all, as in the case of the 2016 referendum. If there is any doubt about the failure of Ministers to look, let me tell the House what the report says: “The written evidence provided to us appeared to suggest that HMG had not seen or sought evidence of successful interference in UK democratic processes”
2020-07-22	LAB	NicklausThomasSymonds	We have no issue with the Russian people. It is the Russian state that is involved in a litany of hostile activity, cyber-warfare, interference in democratic processes, illicit finance and acts of violence on UK soil. The report finds a failure of security departments to engage with this issue to the extent that the UK now faces a threat from Russia within its own borders. Does the Minister accept that that is in a situation when the UK is, as the report says, a top target for the Russian regime? Does he also accept, on defending the UK’s democratic processes and discourse, that no single organisation was offering leadership in government? Instead, it was, in the words of the report, “a hot potato” passed from one to another, with no body taking overall responsibility
2020-07-22	LAB	StellaCreasy	The Minister has told us today that he is confident that there is no need for an investigation into any potential Russian interference in the EU referendum, because if there had been, it would have been detected by existing processes. Given that this report sets out that there was Russian interference in other referendums and that the Russians continue to be involved in British politics, why does he think that the Russians chose to sit that one out?
2020-07-22	LAB	TanmanjeetDhesi	Despite repeated requests and reminders from hon. and right hon. Members, this Government have dithered and delayed for 10 long months and tried their very best to suppress the Russia report, and now we all know why. Given the threat to our national security and the fact that it was about preserving and protecting our very democracy itself, how could this Government have been so incompetent, so asleep at the wheel, and not even asked the bare minimum obvious questions?
2020-07-22	LAB	WilliamEsterson	Let’s park the lines from Mr Cummings, shall we? The Conservative party takes money from the Russians, No. 10 suppressed the report, and the Prime Minister forgot that his first duty is the security of the British people. So will the Minister go away and tell the Prime Minister to investigate the Kremlin’s role in undermining our democracy?
2020-09-02	CON	DominicRaab	My hon. and learned Friend is absolutely right. I spoke to the president of the World Bank yesterday and I totally accept his case. One of the reasons that our vision for a truly global Britain will tilt, if you like, to the Indo-Pacific region is the scope for using liberal free trade, not just to benefit the businesses, the workers and the consumers of this country, but to lift living standards around the world. Of course, that could have no greater impact than in Africa, where we will combine a more liberal approach to free trade than, I venture, they would get from the EU—an approach to business investment with integrity, which I think is necessary, given some of the reports we have of Russian and Chinese investment, coupled with our development and our “force for good” agenda, which I think shows the triple whammy of the impact that this new merger can deliver.
2020-09-03	CON	AndrewBowie	Over the past six months, the focus of this Government, and, indeed, of most Governments the world over, has rightly been on fighting and defeating coronavirus—defeating this killer disease and dealing with the pandemic and the economic fallout from our necessary actions to limit the spread and to save lives. It is possibly for this reason that colleagues have been approaching me with puzzled looks today, asking me why I have chosen this issue, with so much else going on, to raise in the House this afternoon. I am raising it because I believe that this country has a right and, indeed, a duty to uphold international law and an obligation to protect the rules-based international order—a system that we see under attack and under threat like never before, be it by the Russian state poisoning opponents on British soil, such as we saw in Salisbury in 2018, or now in the South China sea, for our values and the values of the free world are very much under threat on those waters. This House should be under no doubt that the Chinese Communist party has used the cover of the global pandemic to step up its struggle for hegemony in the South China sea
2020-09-03	LAB	MohammedKhan	As we speak, Palestinian communities remain at risk of forcible transfer as a result of Israeli annexation. The UK prohibited all trade from Crimea after Russia’s illegal occupation and annexation in 2014, and we should follow that precedent when it comes to illegal settlements. Has the International Trade Secretary had discussions with her Israeli counterpart over the illegal annexation, and will she reconsider UK trade deals with settlement territories?
2020-09-08	CON	DavidDavis	The Bill’s explanatory notes try to justify the legislation on the basis that it is similar to powers introduced by our European neighbours, such as Spain. Let me give the House one example of that in operation. Members will know the name of Bill Browder, who campaigned on behalf of Sergei Magnitsky, the man who died in Russian imprisonment; in effect, he was killed by the Russian state. The Russians put out a red notice through Interpol for Mr Browder, and the Spanish Government executed it. Right enough, a judge subsequently released him, but I ask the House to think how Mr Browder would have felt, sitting in a Spanish prison considering the prospect of being extradited to be imprisoned in Russia and put into the hands of the people who had killed Magnitsky. These things are not without price
2020-09-08	LAB	LisaNandy	In the last six months, the Foreign Secretary has publicly reminded Iran, Israel, China and Russia of their obligations under international law. I agree with him, so does he agree with me and with the most senior legal official in Government, who has behaved with honour and principle this morning, that when the Prime Minister briefs that he will unilaterally tear up our international obligations under the withdrawal agreement, it undermines our moral authority, harms our national interest and makes a mockery of the Foreign Secretary’s attempts to stand up for international law? Will he assure the House that he, as the Foreign Secretary, will never vote for amendments that violate our international obligations?
2020-09-10	CON	HuwMerriman	Jobs and redundancies are a huge worry, and 30,000 jobs in the aviation sector have already been directly put at risk. Virgin and Ryanair have each suffered 3,500 job losses, and easyJet has lost 4,500. The Transport Committee report made clear that redundancies were inevitable with such a drop in passenger numbers, but I am afraid I must make a special mention of British Airways, our national flag carrier. Of its 42,000 staff, 12,000 jobs have been put at risk. Across the board, those members of staff were given the option of taking voluntary redundancy, and if they did not sign a settlement agreement they would lose their staff travel allowance, or they had effectively to reapply for their old jobs on terms that had not been set out. That was a big Russian roulette gamble for them and a big risk. If they did not agree to voluntary redundancy they could be looking at reductions in terms and conditions at more than 50%. For them not to even know those conditions when being given such a choice is, in my view, absolutely shoddy treatment, especially at a time when British Airways’ parent company, International Airlines Group, is looking to spend €1 billion on a new airliner, and 66% of its profits was put in by British Airways staff
2020-09-10	LAB	ValerieVaz	One care home manager said: “It’s like Russian roulette, people can be positive working for a week and no one knows.” May we have a statement on how many processing lab centres there are? Every single university and technical college that has a lab should be pressed into service to do the tests for us locally in the UK
2020-09-14	CON	BenSpencer	I know that my neighbour, the Chancellor of the Duchy of Lancaster, and the Government, are mindful of the issues I have raised about our international reputation and obligations, the difficulty we will have in calling out Russia and China when they breach their commitments, and the importance of squaring that with protecting our Union. I ask them to think again about a resolution to the issues we face. I hope they see the constructive nature and spirit of my words, and hear the concerns of many fellow Members across the House
2020-09-14	LAB	StephenDoughty	The other fundamental issue at stake is international law and the rule of law. I commend what the former Attorney General, the right hon. and learned Member for Kenilworth and Southam (Jeremy Wright), said. Clauses 42, 43 and 45 are, in his words, not a clarification, but a contradiction, not only of our commitment to international law, but of the very principle of the rule of law, for which Britain has stood as a beacon for many centuries. That saw us being instrumental in the founding of the United Nations, which has its 75th anniversary this year. The first General Assembly took place across the square from here. We stood for the rule of law in the establishment of the global human rights regime, the International Criminal Court and a rules-based financial and trading system, let alone the defence of our own interests from the Falklands to Gibraltar. We ask Iran to abide by its nuclear commitments, the Communist party of China to adhere to the Sino-British joint declaration and Russia to respect the territorial integrity of Ukraine or take responsibility for poisoning its citizens or using chemical weapons on the soil of this country, or when we rightly support the prosecution of those who committed genocide in Bosnia, Rwanda and now in the case of the Rohingya or the Uyghurs
2020-09-14	LAB	StephenKinnock	Our greatness as a country is built upon our values and the fact that we have long stood up for the rule of law. This Prime Minister wants to throw all that away. The UK needs to be standing up to the Chinese communist party’s breaches of international law and Russia’s foul play, but how can we do that with credibility if we are advocating breaking international law? With one stroke of his pen, this Prime Minister has torpedoed the painstaking work that our diplomats do every day. This is not just a question of trust or morality; it is also about our commercial and economic interests. We are going out into the world to negotiate new trade deals post Brexit, but how can any other country trust us to keep to those agreements? If this Bill passes into statute, the Prime Minister will be sending his trade negotiators naked into the conference chambers. This Bill is not only dismantling the manifesto pledge and our international reputation, but it is creating a constitutional crisis, trashing the common frameworks that are the basis for our devolved constitutional settlement and creating the conditions for a race to the bottom on standards, opening the door to chlorinated chicken and hormone-injected beef becoming the norm. Trade negotiations are never a walk in the park. Both sides will always defend their interests, and that is fair enough, but the rules are the rules. A commitment is a commitment. Our word is our bond. I therefore urge hon. Members to behave with honour and to join us in the No Lobby this evening.
2020-09-21	CON	AliciaKearns	My right hon. Friend will agree that many of our adversaries deploy mercenaries and private contractors as cartels to achieve their nefarious goals around the world, particularly in Libya, where the Wagner group acts as a proxy for the Russian state. What steps are being taken in the integrated review, and also multilaterally, to assess and combat this threat?
