2020-01-13	CON	AndrewStephenson	My hon. Friend the Member for Tonbridge and Malling (Tom Tugendhat), who so ably chaired the Foreign Affairs Select Committee for the past two years, spoke of the need to build new partnerships while remaining vigilant about the threat from China and Russia. He also reminded us that Britain will remain in Europe—Europe is not Brussels
2020-01-13	CON	DominicRaab	I agree with the right hon. Gentleman that watching the change in the public mood in Tehran and more broadly in Iran is very striking. He is also right to say that we need to work with all our partners. In fact, I would go further and say that, beyond our partners in the middle east, we also need to work with China, Russia and those closest to them to enhance and reinforce the solidarity and clarity of the message that we are sending to the regime in Tehran.
2020-01-13	CON	DominicRaab	We will call out those who flout international law, like the Russian Government, from its illegal annexation in Crimea and its chemical weapons attack in Salisbury to its cyber-attacks and its propensity for spreading fake news.
2020-01-13	CON	JohnWhittingdale	Coming back to the point made by my hon. Friend the Member for Beckenham (Bob Stewart) about the strength of our voice in international affairs, I understand that some of our partners in the European Union will miss our voice within the Council. We have been a strong voice on issues such as standing up to Russia and the imposition of sanctions, but there are many other opportunities for us to have a decisive influence. We are still a member of the United Nations Security Council, and we are the second biggest contributor to NATO. We will play an active role in the Council of Europe and in the Organisation for Security and Co-operation in Europe, where I am proud to be a member of the Parliamentary Assembly
2020-01-13	CON	JohnWhittingdale	I want to highlight one particular organisation— I happen to be the chair of the British group—and that is the Inter-Parliamentary Union. I would encourage new Members to get involved in the IPU. It was founded 130 years ago by Randal Cremer, a British statesman, and Frédéric Passy, a Frenchman, and we have recently celebrated that anniversary. It now comprises 179 countries, and its purpose is to strengthen relations between Parliaments. It is possible to pursue issues through parliamentary dialogue that are sometimes impossible to raise between Governments, and I will give one or two examples. It was in 1984 that the IPU invited a delegation to the UK from the Soviet Union. The delegation was led by a then pretty much unknown Russian politician called Mikhail Gorbachev. That led to the meeting between Margaret Thatcher and Mikhail Gorbachev and, as a result, it eventually led to the reform of the Soviet Union. Indeed, it led to the collapse of communism and the break-up of the Soviet Union.
2020-01-13	CON	JohnWhittingdale	I wish quickly to mention one other issue. As I think you know, Madam Deputy Speaker, I also chair the all-party group on Ukraine. I was delighted to meet the Ukrainian ambassador earlier today, and I am grateful to colleagues from all parties who came and signed the book of condolence for the families of those who died in the plane crash. It is now nearly four years since Russia illegally occupied part of the sovereign state of Ukraine—Crimea—and since the fighting broke out in the east of Ukraine. It is plain that those actions by Russia were in breach of all international law. We have taken sanctions, but they have proved ineffectual so far: the Russians are still in occupation in Crimea and the fighting in Donbass continues. Just last week, another three Ukrainians died in that fighting
2020-01-13	CON	RobertSeely	Following up on the point made by the right hon. Member for Leeds Central (Hilary Benn), who is no longer in his place, is there a case for the Foreign Office to do some useful and valuable work on updating the Geneva conventions or, working with others, updating the rules around civilian airliners to do more to ensure that civilian airliners are not, on a semi-regular basis, being shot out of the sky using, often very improperly, poorly made Russian kit? We have had hundreds of people killed, including Britons but also from many other countries, in the past few years.
2020-01-13	CON	RobertSeely	On a more tactical level, we need much more joint effects working across Government Departments—what, in the Army, we might have called joint effects teams—to encourage integrated working. At embassy level, this should include integrated line management. UK ambassadors and high commissioners should have line management of all their staff. There should be a single legal chain for decision making, and a common set of pay and conditions, which there is not at the moment. That can cause friction, especially because folks in the FCO, who are hugely qualified, generally earn less than civil servants in other Government Departments. My hon. Friend the Member for Romford (Andrew Rosindell) said that we should deepen our ties with Canada, New Zealand and Australia in the new CANZUK alliance covering trade, defence, academia and research. That is part of, but not instead of, a renewed commitment to multilateralism. An important part of our overseas strategy is the ability to see issues holistically, whether that is Nord Stream 2—a new pipeline in the Baltic that is one of Russia’s key strategic aims in Europe—or, in our own country, the issue of the Chinese tech giant Huawei and its potential involvement in our 5G network. This is an extraordinarily important issue—one of the major issues of the 21st century—but sadly there has been little debate about or parliamentary scrutiny of the matter in this country
2020-01-13	CON	ThomasTugendhat	Forgive me, Madam Deputy Speaker; I will wrap up very quickly. Our role should be to build on the insurance model that we had, and to remember that we can underwrite many of the ways that the world has traded in looking at the norms that we set out. Just as we sailed the seas, we must sail the new accountancy, looking at ways to create entities that share the responsibility that we expect of companies with aspiration and innovation. We need a revolution in thinking, and we need to experiment with regulations that promote growth and opportunity. This will not work as long as the rules are regularly flouted. That is why China’s adherence to the rule of law is of great concern. State-owned and state-subsidised business such as Huawei not only use data from police states where human rights are regularly violated—such as Xinjiang—but seek a market dominance that we should resist. Urging South Korea’s Samsung and Japan’s Fujitsu to bid in the 5G world would make more sense than deepening our dependence on the Chinese Communist party. This is a 70th birthday gift that it does not need. Closer to home, Russia’s rhetoric and aggression are a reminder that we need to remain vigilant, and our nuclear fleet remains an essential part of our defence. It is to this world that the Government’s new foreign and defence review should respond, and it needs to be ambitious
2020-01-13	CON	ThomasTugendhat	Many ideas came out of our inquiries and some, I am glad to say, have been adopted. Others are enduring and could still be adopted, should the Minister wish to do so. The top five areas of work for me were defending democracy against autocracies such as China and Russia; building bridges with partners such as India and Japan; growing businesses in new markets such as South America; our own organisation and the skills we need in our own Department to succeed; and, of course, starting afresh in Europe. We addressed the dangers to democracy in many reports, but none more so than our two reports entitled “Moscow’s Gold”, about the price of Russian money, and “A Cautious Embrace”, about the way in which some autocracies prey on our educational and cultural institutions. We argued each time that the Government must stand up for the values that make us stronger
2020-01-13	LAB	ChinyeluOnwurah	Britain’s position in the world has been negatively impacted by the Brexit saga and shambles, but I believe we can and will recover. We are still looked to as one of the great democracies of the world. Our scientific influence, the advantage of our language and the budget the Department for International Development spends will all ensure that we have influence in the world. We can stand up for human rights in countries such as Saudi Arabia, Russia, Iran, Burma as well as in Kashmir and Palestine and many other countries and places, and we must do so. We should be under no illusion that democracy is embattled. Populism, xenophobia and electoral interference are both driving and a consequence of the challenges democracy faces. Cosying up to regimes such as the Hungarian Orbán and not standing up to President Trump does not put us on the right side of history when it comes to our position in the world. I want to see a stronger United Kingdom: strong on principles, with regionally successful economies, making its way on the global stage.
2020-01-13	LAB	EmilyThornberry	In closing—I will not take any further interventions—I said at the outset that I have been looking at my past debates with the current Prime Minister, and I note that he is to the art of prescience in foreign policy what Basil Fawlty was to customer service. I looked back at our Queen’s Speech debate in 2017—I believe it was the only one in which he took part as Foreign Secretary—and what is so depressing is that, just like today, I had to point out that there were no new policy initiatives to discuss: a total vacuum where British global leadership should be; no solutions on Iran, Yemen, Syria, North Korea or Libya; silence on Russia, China, Iraq, Afghanistan and the middle east; and a pathetic paucity of action on climate change
2020-01-13	LAB	EmilyThornberry	On a personal note, may I also say how delighted I am to be facing the Foreign Secretary today? In the national hunt season, it is apt to say that both of us got away quickly in our respective party leadership stakes. I joined him in making it over the first fence. I hope that, unlike him, I do not fall at the second, but I do hope that whoever wins, the outcome on our side will be better for the country than the outcome on his. I found myself at the weekend looking through some of my old exchanges with the Prime Minister at this Dispatch Box when he was Foreign Secretary and thinking about the chance of taking him on in the future. I want to read to the House one of the responses he gave to me in March 2017 when I asked our future Prime Minister about the Trump Administration’s reported desire to withdraw from the Paris climate agreement. I say this just to reassure every Member, especially the newer ones on both sides, that our country is in the safest of hands and in the care of the most insightful of minds. This is what he said in response to my concerns about Donald Trump, the Paris agreement and other issues: “With great respect, I must say that I think the right hon. Lady is again being far too pessimistic…. We were told that the JCPOA”— the nuclear deal with Iran— “was going to be junked; it is now pretty clear that America supports it.”— supports it!— “We were told that there was going to be a great love-in between the new US Administration and Russia; they are now very much…in line. As for climate change, I think the right hon. Lady is once again being too pessimistic. Let us wait and see. We have heard the mutterings of the right hon. Lady; let us see what the American Administration actually do. I think she will be pleasantly surprised, as she has been, if she were remotely intellectually honest, in all other respects.”—[Official Report, 28 March 2017; Vol. 624, c. 116.] That was the strategic genius who is now in charge of our country, the intellectually honest politician, who, to be honest, clearly has no intellect. After all, as I have just recounted, in the space of just one answer to one question from me, he made four catastrophic and careless misjudgments on foreign policy issues—and that is before we get started on the hopeless faith in Trump’s son-in-law to negotiate a middle east peace deal, his horribly reckless treatment of Nazanin Zaghari-Ratcliffe, his craven attempts to champion monsters such as Crown Prince Salman and President Sisi, his disgraceful jokes about clearing dead bodies to make way for golf courses in Libya, his leading role in the unlawful sale of arms for use in Yemen and his shameful inaction in holding Myanmar to account for its genocidal treatment of the Rohingya
2020-01-13	LAB	EmilyThornberry	Shortly before the election, the Foreign Secretary stood at the Dispatch Box and told us that the delay was perfectly normal because it usually took six weeks for ISC reports to be published, although this report had already been cleared in full by the Committee and the intelligence services, and just needed to be signed off by Downing Street. Most important, of course, it needed to be signed off by the two architects of the leave campaign and renowned friends of Russian oligarchs, the Prime Minister and Dominic Cummings
2020-01-13	LAB	EmilyThornberry	There is more: “My Government…will champion global free trade and work alongside international partners to solve the most pressing global challenges.” Waffle, waffle, waffle—nothing new, no substance behind it—[Interruption.] Unfortunately, I am quoting Her Majesty, who had those words written for her by the people at No. 10—nothing new, no substance behind any of it, and an insult, when we consider how this Prime Minister actively acquiesced when his friend and hero, Donald Trump, started ducking all those global challenges and actively making them all worse, and told me that I was being pessimistic for warning as much. Among all those vacuous, meaningless lines that Her Majesty was forced to read out, there is one of greater interest in the foreign policy section of the speech, which I would like to highlight: “My Government will take steps to protect the integrity of democracy and the electoral system in the United Kingdom.” Let us bear in mind that those words were drafted by Downing Street for our sovereign to read out in front of Parliament. That was a solemn promise from the Government, in Her Majesty’s name, to protect the integrity of democracy here in Britain. Yet here we are, still waiting—still waiting!—for the Government to publish the Intelligence and Security Committee’s report on Russian interference with our democracy
2020-01-14	CON	DominicRaab	I thank my hon. Friend for his question. He is right. The Prime Minister was there for the funeral of the Sultan, which was a valuable opportunity to engage in conversation with the new Sultan. We have had conversations with our partners right around the region. There is a clear commonality of view that we need to de-escalate the tensions but also hold Iran to account for its behaviour. Bearing in mind that we have to engage very carefully with Russia and China on this, the approach that we are taking in the context of the JCPOA is that, on the terms of the deal, clearly, plainly and squarely Iran has, in its own words, effectively left the agreement as a shell. The right thing to do, as envisaged by the agreement, is to take matters to the dispute resolution mechanism and use that to leverage, to bring some sense and clarity to the regime in Tehran and to encourage them to come back to full compliance.
2020-01-14	CON	DominicRaab	The hon. Gentleman is quite right, first, about the importance of having that sanctions capacity. As we leave the EU we will have more autonomy to do that. We are looking forward to bringing that forward. It was mentioned in the Queen’s Speech. He also made the point—I think we have always agreed about this since the campaign for a Magnitsky regime in this country—that such capacity certainly should not just apply to Russia, or to one country, but should be universal in geographic scope, and the approach that we are taking will be.
2020-01-14	LAB	ChristopherBryant	I certainly do not want to defend the actions of the Iranian regime on any count. The Foreign Secretary was instrumental, when he was on the Back Benches, in making sure that the Government introduced legislation known as the Magnitsky amendments, which were to enable the Government to have another tool in the box in relation to sanctions. They were primarily considered as relating to Russia, but would it not be a good idea to have them on the statute book in the UK now, as fast as possible, and would we not be considering using those sanctions in relation to Iranians as well?
2020-01-15	CON	AndreaLeadsom	In the first industrial revolution, our pioneers from Scotland to Cornwall forged their own path, and in so doing they became the envy of the world. James Watt’s Prussian rivals travelled hundreds of miles to sneak a glimpse of his steam engines in Birmingham. Richard Trevithick travelled as far as Peru to personally oversee his engines. Today, like them, we must be the first movers, not the last to act. From creating supply chains for electric vehicles to decarbonising our industrial clusters and designing low-carbon buildings, the opportunities of net zero are immense. In 2020, the first year of a new decade of decarbonisation, we must seize those opportunities.
2020-01-20	CON	FelicityBuchan	Kensington has a huge wealth of cultural sites. We have Kensington Palace, where Queen Victoria was born and where she lived until her accession to the throne. Our museums are truly remarkable—we have the Natural History Museum, the V&A and the Science Museum, to name but a few. We have many embassies in Kensington, including those of Russia and Israel
2020-01-23	CON	MatthewOfford	The Konzentrationslager of Dachau in 1933 was very different from the Konzentrationslager of Auschwitz in 1944. Initially, Dachau targeted political opponents of the Nazis, such as German communists, socialists, Roma, Jehovah’s Witnesses, homosexuals and persons accused of asocial or socially deviant behaviour. By contrast, Auschwitz was a sprawling death camp containing European Jewry, Gypsies and others. As Primo Levi wrote: “Trains heavily laden with human beings went in each day, and all that came out was the ashes of their bodies, their hair, the gold of their teeth.” Representation of these camps in films and popular culture depicts Auschwitz-Birkenau as the pinnacle of the death camps, but Treblinka was close behind it in the number of people who were murdered, alongside other camps such as Belzec, Chelmno and Sobibor. All those camps were devoted to killing. They were death camps, and anyone who went through their gates would not come out again. In 1967, the West German Ministry of Justice drew up a list of 1,200 camps that it said were sub-camps of the main ones. The Jewish Virtual Library has come up with the even greater figure of 15,000 camps that it says were effectively Konzentrationslager. To many of us, the representation of the camps through their names suggests a distant location and an otherness that is foreign and certainly not part of the British collective consciousness, but that is not the case. Last summer I was fortunate enough to sail to the Channel Islands, the only part of the British Isles to be inhabited by the Nazis during the second world war, and I visited Alderney. In January 1942, the Nazis built four camps in Alderney. There were two work camps, Lager Helgoland and Lager Borkum, and two concentration camps, Lager Sylt and Lager Norderney. Lager Norderney contained Russian and Polish prisoners of war, and the Lager Sylt camp held Jewish slave labourers. There are 397 graves in Alderney, out of a total population of about 6,000. On their return to Alderney, the islanders had little or no knowledge of the crimes that had taken place, because when they were finally allowed to return in December 1945, the majority of the senior German officers had left and no one really knew what had happened
2020-01-23	CON	PeterBottomley	About 15 years ago, Governments’ duty to protect was being established by the United Nations. Since then, we have gone backwards. There are too many leaders or rulers of countries who have lost the understanding that having a reasonably flexible liberal democracy—and, for that matter, a liberal economy—helps to improve people’s conditions and allows leaders to retire or to be defeated without having to hang on to office. Leaders fear being assassinated and fear having the wealth that they have stolen from their country stolen back from them. They ought to learn—this applies to our friends the Chinese, our friends the Russians, some in eastern Europe and people in South America—that if they are going to be a leader of a country, it is better to be in a democracy so that they can retire and take their pension in their own country, rather than trying to hang on for dear life, because they may lose their life and they will certainly lose their wealth, if they lose their power
2020-01-27	CON	GeorgeDuncanSmith	I congratulate my hon. Friend the Member for Tonbridge and Malling (Tom Tugendhat) on his urgent question. Given that we are, in a sense, at war—there is a cyber-war going on in which China is arguably the biggest participant; maybe Russia as well—the idea that we should think of giving a company that is heavily subsidised by China, a country that has set out to steal data and technology non-stop, the right to be in what is essentially a very delicate area of our technology seems utterly bizarre. I was led to believe that the Government would not make that decision. I hope that they will now reject Huawei immediately.
2020-01-28	CON	DominicRaab	To ensure the security of 5G and full-fibre networks it is both necessary and proportionate to place tight restrictions on the presence of any companies identified as high-risk. The debate is not just about the core and the edge of networks, nor is it just about trusted and untrusted vendors. The threats to our networks are many and varied, whether from cyber-criminals or state-sponsored, malicious cyber-activity. The most serious recent attack on UK telecoms has come from Russia, and there is no Russian equipment in our networks. The reality is that these are highly complicated networks, relying on global supply chains where some limited measure of vulnerability is almost inevitable. The critical security question is how to mitigate such vulnerabilities and stop them damaging the British people and our economy
2020-01-28	CON	GeorgeDuncanSmith	I say to my right hon. Friend that I am deeply disappointed by this decision. I have spoken at length to security officials, who will always say that defending in cyber-security is a game of catch-up—always catching up with the next algorithm change, and we can never guarantee that we spot it sometimes until too late. The reality of the 5G network is that it is fundamentally different. There will be less and less centralised function with more and more going to the periphery, which is exactly where Huawei will be. Given that he did not mention China as a threat to us in cyber-security—he mentioned only Russia—does he now believe that China is a threat to us in cyber-security; as he takes on those threats to us, does he think that he will now drive Huawei out of our future systems progressively, as quickly as he can?
2020-01-28	CON	JulianLewis	Do the Government accept something that I had difficulty getting their predecessor to accept—that Huawei should not be regarded as a private company because it is intimately linked with the Chinese communist state and its deeply hostile intelligence agencies? If they do accept that, as they should, are they confident that the safeguards that will be put in place will be sufficient to guard us against a deeply hostile intelligence agency, such as he implied in his statement we needed to do in relation to Russia ?
2020-01-29	LAB	JeremyCorbyn	I condemn human rights abuses in every country in the world, including Iran, Russia and anywhere else where such abuses are committed. My question was: what is being done to ensure that our future trade deals are dependent on good human rights in the countries that we deal with? Nine women are in Saudi prisons at the present time, merely for standing up for equal rights for women. Four of them have received electric shock treatment during interrogation. Is that the kind of human rights we tolerate? I sincerely hope not
2020-01-30	CON	PaulBristow	Last week I went to a meeting at which the representatives of each territory and dependency had a chance to speak. I left feeling very impressed by their ambition and loyalty to the UK, and very much more knowledgeable about them. One comment left a strong impression, and I thought it worth putting on the record in the House. What price would a country like China or Russia pay for a geographical network of territories of great strategic importance and with loyal local populations, like the one that the UK has and enjoys? Let us show those territories how much we value them
