2020-09-21	CON	DavidWarburton	Even a potential breach of international law is to be treated with the utmost seriousness, but to suggest, as some have, that the provisions of the Bill place us in some sort of moral equivalence with China or Russia really is risible. Degree and proportion matter. Clause 45, as I hope it will be amended by amendment 66, equips democratically elected Members of this House to decide whether or not to protect the powers outlined in clauses 42 and 43 in the case of need. Should this House decide to, it would mitigate the risk of the UK’s internal market splintering, with all the potential consequences that would flow from that
2020-09-21	CON	RobertWallace	My hon. Friend is absolutely right to point out the malign activity of the Iran state in using both proxies and, indeed, the IRGC directly either to harass shipping going about its lawful business or to enable terrorist groups in the region. It does not help any of the peace we seek in that region; nor does it help Iran to join the table of civilised nations, which it aspires to join. The IR will look exactly at those things—at threat; defined around threat—whether that is Iranian malign activity, Russian activity on Europe’s borders or, indeed, terrorist threats around the world. It is important that that leads the review. That is what I have committed to, and right in the middle of that will be Iran and the IRGC.
2020-09-21	CON	RobertWallace	Our adversaries’ use of mercenaries and proxies is growing and undermining stability in the middle east, north Africa and more widely. It is not just Russia’s widely reported use of the Wagner proxy military group in Libya, which of course we condemn, that is causing this instability. We see other actors such as Iran behaving in this way. The UK condemns all destabilising mercenary and proxy military activity. I am afraid I cannot comment on the individual actions we take to counter this threat, as to do so would prejudice their effectiveness.
2020-09-21	CON	TheresaMay	In 2018, when Russian agents used a chemical weapon on the streets of Salisbury to attempt to murder Sergei and Yulia Skripal—a nerve agent that led to the death of Dawn Sturgess and affected her partner, Charlie Rowley—I led the action. I called on our friends and allies to stand alongside the United Kingdom, and I led the action that resulted in 29 countries expelling an unprecedented 153 Russian agents from their borders. We were able to do that because those countries had trust in the United Kingdom. Where will that trust be in the future if they see a United Kingdom willing to break its word and international law
2020-09-21	CON	TheresaVilliers	Concern about the potential for the EU to adopt an unreasonable and absolutist approach to the question of goods at risk is, frankly, compounded by the Commission’s current refusal to list the UK as a country is deemed fit to export food to the EU. As Environment Secretary, I was able to secure that authorisation in the event that we had left at the end of January without an exit treaty, but I have to say that it was not an easy process. The UK’s compliance with all current EU laws, including on food and animals, should mean that giving us third country status is a straightforward administrative decision, so it is therefore very hard to understand why the EU is withholding consent, for example, for us to export products to the European Union, which it permits from countries with which it has far weaker links and which have, arguably, far less rigorous standards. They include, to take just a few, Russia, Serbia, Chile, Thailand, Ukraine and Cuba. Even the Republic of Iran is on the approved list for certain products.
2020-09-21	LAB	CharalambosCharalambous	The former Conservative leader Lord Howard was right when he asked how the UK could reproach Russia, China and Iran for their actions when the UK itself was willing to break international law, as he lamented the damage to Britain’s reputation for probity and respect for the rule of law. Perhaps the Bill’s intention is to ensure that we leave the transition period without an agreement. Perhaps it is a negotiation tactic, or perhaps it is designed to be a big distraction. Whichever one of those it may be, saying that the Bill breaks the law “in a very specific and limited way”—[Official Report, 8 September 2020; Vol. 679, c. 509.] has diminished Britain’s global reputation
2020-09-21	LAB	MargaretHodge	We are being asked tonight to support Great Britain breaking the law. The Vienna convention clearly states: “A party may not invoke the provisions of its internal law as justification for its failure to perform a treaty.” I put it to the Committee that it is the patriotic duty of each and every one of us to vote down this proposal. Great Britain’s global influence, our ability to hold our head up high and even our naked self-interest will all be wrecked by this disastrous proposal to deliberately flout international law. Our post-Brexit ambition to establish our country as global Britain, so that we can be an influential player in world affairs, would be fatally undermined. How could we challenge a corrupt Government or stand up to an aggressive dictatorship? Who would listen when we support the citizens of Hong Kong, challenge the Russians over the Skripal poisoning or defend the Rohingya people in Myanmar if we ourselves flout international law to suit the Prime Minister’s short-term whim
2020-09-22	LAB	MatthewWestern	Jaguar Land Rover has warned that it could be forced to close plants if the right Brexit deal is not agreed, jeopardising £80 billion of planned investment. Ford has said that no deal would be disastrous and would make it reconsider its investments in the UK. Nissan has said that its operations in Sunderland would struggle to survive the extra tariffs imposed by a no deal. Toyota has said it would be forced to halt car production in the UK, temporarily closing its plant in Derbyshire. BMW has said that it could shift production of the Mini from Cowley to the Netherlands if there is a no-deal Brexit. These are not idle threats; this is the reality faced by many multinational businesses. I am afraid that the Prime Minister is prepared to play Russian roulette—hardly a surprise, given the nature of his sponsors—with our businesses, our jobs and our prosperity in this country. That has to be our concern. Although there might be talk about the possibility of a US trade deal, we have heard in recent days that the passing of this Bill would jeopardise any UK-US trade deal. It is very unlikely to pass through Congress, such is the strength and purpose of the Irish caucus in Washington
2020-09-23	LAB	StephenMorgan	Great Britain has proudly stood and must stand against the use of torture and against the use of rendition. I urge the Minister: do not undo the work of Churchill, do not undo the work of Attlee and do not chip away at our nation’s proud reputation. I put it to the Minister: how can we expect Great Britain to speak with authority on international law to China, Russia and Iran if we go back on our own commitments? In years gone by, a commitment made by our proud nation meant something. Last week, the Government tarnished that reputation by breaking international law with the United Kingdom Internal Market Bill. I urge the Minister to commit to working with us to ensure that this Bill does not do the same
2020-09-24	CON	DominicRaab	I am not quite sure what action the hon. Gentleman would propose. We can certainly talk to our partners, including in the ILO, but the fact is, with an election having been rigged to stay in power and with all the authoritarian might of the Belarussian state having been exerted against the people because of that, we cannot in all honesty provide the support we would want to the workers, who among others will be those who will suffer as a result. What we can do is put the pressure on, try to support media institutions and try to press for a path towards a peaceful resolution so that Belarussians can elect their own leaders, who can provide economic support to the workers of that country.
2020-09-24	CON	DominicRaab	I thank my hon. Friend and pay tribute to him and the work of his Committee. I had a detailed discussion on this with Heiko Maas, my German opposite number, at Chevening, along with Jean-Yves Le Drian, my French opposite number. We have made it clear, as my hon. Friend will know, that we have our reservations and concerns about Nord Stream 2, both from the point of view of its encouraging European energy dependence on Russia, but also the impact on Ukraine. Equally, it is quite important, given the lead Germany has taken with Alexei Navalny and in relation to the work we need to do together on Belarus, that we maintain European solidarity. My hon. Friend’s points are well made and, of course, our European partners know the UK position.
2020-09-24	CON	DominicRaab	On the Baltic states, they are our friends and NATO allies, and I recently saw the Lithuanian Foreign Minister. We have been working closely with them because not only do we share the same values but they will feel under threat as close neighbours to Belarus and indeed Russia. They need stalwart support now from the United Kingdom.
2020-09-24	CON	DominicRaab	The hon. Lady is right to worry about the predatory approach of Russia, which has always regarded Belarus as a client state. We are watching that very carefully, along with our international partners, and that is one reason why we are taking the measures that I set out today.
2020-09-24	CON	ThomasTugendhat	It is a great pleasure to hear the statement from my right hon. Friend the Foreign Secretary, who has laid out an impressive, decent and strong series of proposals, and it is very pleasing to hear the Opposition agree as well. Building on the discussions that he has so clearly had with various of our allies, what conversations has he had with Germany? I raise Germany, in particular, because the Nord Stream 2 project that is currently going through is allowing the Russian Government to salami-slice our eastern neighbours and friends one by one, and what we are seeing in Belarus could easily happen in other countries. Although Belarus is the last country in the world still to have an active KGB, we hope that it will not become the first of many to have an active SVR base very soon.
2020-09-24	LAB	BarrySheerman	Can I push the Secretary of State a little harder? He said he wants to get to the bottom of all this, but at the bottom of all this we surely know is Russia, which is becoming almost a rogue state around the world. Russia only listens when we are tough with it. Can we not have sanctions against Russia and, in this country, clear out the nest of vipers who have taken up residence—Putin supporters and yes men and yes women—here in London? For goodness’ sake, can we not take on Russia, show it we mean business and start perhaps with the owner of the Evening Standard?
2020-09-24	LAB	LisaNandy	As the Foreign Secretary moves forward with sanctions, this underlines the importance of the UK safeguarding against the UK and our overseas territories providing a safe haven for money obtained through corruption and human rights abuse—blood money, as he called it. So what progress has been made in implementing the recommendations of the Russia report? The Government have been silent on that matter since it was published before the summer recess
2020-09-24	LAB	LisaNandy	The BBC Russian service is a key source of impartial information for the people of Belarus. I am very concerned about the potential for both funding cuts to the World Service and the targeting of its journalists. So will he commit to ensuring that Foreign, Commonwealth and Development Office funding for this service is protected in any upcoming spending review? What is his Department doing to support BBC journalists and protect them from attacks on them and their families? Has he had any discussions with the Home Secretary about provision for Belarusians seeking asylum in the UK? Will he take this opportunity to reiterate the UK’s support for free and fair elections around the world? I welcome his announcement about the OSCE today. Will he commit to ensure that we play our part in continuing to provide funding to uphold democracy abroad and security at home
2020-09-24	LAB	StephenKinnock	I believe that our defence of the rule of law matters more now than it has done at any time since 1945, because we stand today at a moment in history when the rule of law is under threat across the world. The Chinese Communist party has breached the Sino-British declaration on Hong Kong, the Russian Government annexed Crimea in 2014 and, deeply regrettably, even our own Government are willing to renege on their commitment to a legally binding treaty
2020-09-24	LAB	StephenKinnock	Secondly, the Government must ban all products that originate from Israeli settlements in the occupied territories. Profiting from such products is tantamount to profiting from the proceeds of crime, and it must stop. When we trade with these settlements, we are essentially telling the world that international law does not matter, and such trade legitimises and facilitates the existence and expansion of the settlements. In 2014, it was right that the UK, as part of the European Union, prohibited trade with Crimea following its illegal annexation by Russia. It is crucial that we are consistent in our application of international law
2020-09-29	CON	NusratUlGhani	The United Kingdom has a glowing reputation for democracy and the rule of law, which attracted my parents to migrate here. Reputation takes years to form but seconds to destroy. I support the Government in their quest to get the best possible deal from the European Union, which is why I want to give the Prime Minister the best possible negotiating hand, but when British Ministers give their word on the world stage, they are not only giving the word of the Government but that of the Crown. If the Government propose to break international law in extremis at a future date—I accept that it would only take place if the EU acted in extreme bad faith and undermined the integrity of the Union—that power must only be exercised by our sovereign Parliament, but of course I would prefer for us not to be in that situation at all. I would caution the Government against adopting a machismo, scorched-earth policy, and to remember that, as we emerge next year and continue to challenge countries such as Iran, Russia and China as they flout international law, we will need our international friends to stand tall with us. I look forward to hearing from the Minister his assurances on the amendments tabled to clause 45.
2020-09-30	LAB	MichaelAmesbury	The quality of housing—the minimum standards required from Government—should be guided by a moral compass, one that puts health and wellbeing at the heart of housing provision, rather than the profit margins of some of the more unscrupulous developers in our country. Rather than bypassing local residents and councils, why not resource and fund local planning authorities properly and maximise that civic voice to create healthy communities and housing that people are proud to call their home? Ministers wax lyrical about the need for more affordable housing, yet this massive extension of permitted development bypasses the requirement for section 106 contributions and in many cases community infrastructure levy payments too, robbing communities of decent affordable housing and local infrastructure. The Conservative-led Local Government Association estimates that 3,500 affordable homes have been lost due to the current regime of permitted development. This centralisation of our planning system is a Stalinist power grab, bypassing local democracy and creating a developer’s charter, while vandalising the character of our villages, towns and cities, hollowing out our high streets, flattening industrial estates and concreting over green space. It is ideological claptrap with bells on. I worry that the Secretary of State is spending far too much time with his Russian oligarch friends—Private Eye is even referring to him as “Moscow Bob”
2020-10-01	CON	RobertBlackman	I draw the House’s attention to my entry in the Register of Members’ Financial Interests. Since 1988 Armenia has illegally occupied Nagorno-Karabakh in Azerbaijan. That led to a war that took place between 1988 and 1994, when a ceasefire was agreed, backed up with a United Nations Resolution in 1993. On 27 September, Armenia mobilised forces and attacked Azerbaijan, and I understand that they are regularly launching rockets from Armenia into Azerbaijan to provoke Azerbaijan to react. All this has the potential for dragging both Turkey and Russia into a much more extended war. May we have a statement from the Foreign Secretary early next week on what actions the UK Government will take at the United Nations Security Council to broker a ceasefire and prevent Armenia from creating a potentially very serious war?
2020-10-06	CON	JeromeMayhew	I want to return to my first-hand experience of the impact of PIL agreements. I was the managing director of a UK-based SME that was entrepreneurial in its outlook, and we were doing pretty well in the UK, so naturally I looked to international markets as a means for expansion. In my time, I negotiated joint ventures in Russia, the United States of America, Australia and South Africa, as well as undertaking preliminary discussions in a number of other jurisdictions. It was noticeable that the only two joint ventures that we progressed to fruition were those in the United States of America and Australia, and the fundamental reasons that I felt unable to progress further in those other jurisdictions were the fears over the enforceability of contracts, particularly in relation to intellectual property, and the fears over the effectiveness of the rule of law in those jurisdictions. PIL agreements affect countless such economic decisions all around the world and in this country every day, so we must not underestimate their importance for economic decisions just like the ones that I took
2020-10-08	CON	GregoryHands	Sanctions are a matter for the Foreign, Commonwealth and Development Office, and I will pass on the hon. Member’s views to it. However, to answer the first part of her question, the UK has been absolutely robust in its approach to Russia on many fronts, not least the illegal annexation of Ukraine, which we have opposed at all points. We will continue to highlight that injustice at every international forum available.
2020-10-08	LAB	BethanWinter	  In response to Russia’s illegal annexation of Crimea, the UK has been at the forefront of EU sanction action against Russia, which this Government have reiterated their support for in two written statements to the House this year. Does the Secretary of State accept an obligation to operate the same principles in relation to trade with the illegal Israeli settlements in Palestinian territories?
2020-10-12	LAB	RichardBurgon	The Secretary of State should have seen the new analysis today that shows that infection rates on university campuses are up to seven times higher than those in surrounding areas. There are fears that this will spread the virus to higher-risk groups in the local community. The Government should have moved teaching online before term started, as the University and College Union recommended. Will the Minister accept the Government’s error in not doing so and instruct universities to move to online learning as the default? Or will she and the Government continue to play Russian roulette with the lives of students, staff and local communities?
2020-10-13	CON	KieranMullan	If we were to let the virus spread among the rest of the population, we can forget all of that. We would reach a point where, in every single one of those examples, the vulnerable person would stand a very real chance of catching the virus because it would be rampant. That is the reality of the strategy that some are proposing. We would effectively be telling 25 million people to play Russian roulette every time they step outside their door—they can hug their grandchildren, but they run a real risk of catching a deadly disease if they do that. They can go to work, but they run a very real risk of catching a deadly disease if they do that. Most importantly, if they go to their cancer screening, their radiotherapy or their chemotherapy, again, they run a very real risk of catching a deadly disease. That is no choice at all
2020-10-13	CON	WendyMorton	In terms of Turkey, the Defence Secretary discussed the conflict during a recent visit to Ankara and again agreed that de-escalation was the best option for all. I reiterate that, as the Foreign Secretary has said on previous occasions, we urge all external parties and friends of both states to redouble their efforts in support for an end to these hostilities and to refrain from taking actions that risk deepening the crisis. As co-chair of the Minsk group, Russia has a role in working to end the conflict too.
2020-10-13	CON	WendyMorton	The hon. Lady makes a very important point reinforcing the need for dialogue. The Foreign Secretary issued two statements with Canadian Foreign Minister Champagne, most recently on 6 October, calling for an immediate ceasefire and a return to the negotiating table under the auspices of the OSCE group. On 28 September, the Prime Minister spoke to President Erdoğan and discussed the recent escalation. On 2 October, I spoke to Turkish Deputy Foreign Minister Önal to register concerns at the military escalation. We have been engaging with the co-chairs of the Minsk group—the French, the US and Russia. I will continue to reach out to my counterparts—both the Armenian and the Azerbaijani Foreign Ministers—to reinforce the UK’s support for de-escalation and a return to dialogue.
2020-10-13	LAB	BarryGardiner	The Minister will know that there are more Azeris living in Iran than there are in Azerbaijan—some 50 million of them, who hold great sway and influence. Russia, on the other hand, is firmly committed to supporting Armenia in this conflict, and that could see the Russian and Iranian co-operation in the Syrian war come under severe strain. What concerns does the Minister have about the potential for Iran to become embroiled in the dispute, and what steps is her Department taking to avoid that situation?
2020-10-13	LAB	CatherineWest	Further to the question of Nagorno-Karabakh, obviously the ceasefire is very fragile, and with the use of foreign fighters from Iraq and Syria, there is a real risk of escalation. What steps are the Government taking to ensure a return to dialogue, as ultimately only through dialogue can this dreadful conflict come to an end? Specifically on Turkey and Russia, what urgent discussions are being carried out in order to try to get them to stop their arms sales so that that does not increase the militarisation and the number of civilians who are tragically being killed in the region?
2020-10-19	CON	NeilOBrien	I voted to leave in the referendum, and I strongly agree with my right hon. Friend that we have to have the right deal, but does he agree, given the economic challenges and the common security threats that we are facing from Russia, China and the middle east, that a deal is still the best outcome for both the UK and EU?
2020-10-20	CON	AdamAfriyie	The constitution of our country consists of waves of people coming and going over millennia—Romans, Anglo-Saxons, Vikings, Normans, Flemings, Huguenots, Indians, Kenyans, Russians, and, in more recent times, Americans, Australians and—soon—Hong Kong Chinese. Let us face it: at some point in the past 12,000 years, every one of our ancestors was an immigrant to these islands. If anyone is daring enough to take a DNA test, they might make some interesting discoveries. They might discover that, actually, we are all related. If we go back 70,000 years, we discover that modern human beings are all from the same stock. Black history is as rich and varied a part of our history as Asian, Jewish, Chinese and Mediterranean history, and the history of sex, gender, sexual preference, disability and class. I am delighted to see that the contribution of non-white Brits is increasingly recognised across society, and Black History Month is a good opportunity to make those recognitions
2020-11-02	CON	AlecShelbrooke	At the annual NATO Parliamentary Assembly in 2019, a report was published about the growing maritime threat from Russia. Will my right hon. Friend meet me and other members of the Assembly so that we may feed into the review of forward and ongoing naval demands for the foreseeable future?
2020-11-02	CON	AliciaKearns	What assessment has the Secretary of State made regarding recent revelations by Bellingcat that Russia continues to develop covert chemical weapons and targeted, more advanced delivery mechanisms in an enormous violation of the chemical weapons convention? What does that tell us about the threat we face, and what is he doing to keep us safe?
2020-11-02	CON	RobertWallace	I congratulate my right hon. Friend on his work in leading the UK delegation to the NATO Parliamentary Assembly. The UK, along with NATO allies, takes the maritime threat from Russia very seriously. This tempo and assertiveness of our operational output will continue for as long as Russia continues to pose a threat and challenge to freedom of navigation. My hon. Friend the Minister for the Armed Forces would be delighted to meet him and his colleagues to discuss it further.
