2013-04-16	M5S	CrimiVitoClaudio	Signor Presidente, colleghi senatori, interveniamo direttamente in dichiarazione di voto per semplificare la discussione. Abbiamo aderito senza indugio alla proposta di costituzione della Commissione straordinaria per la tutela e la promozione dei diritti umani condividendo l'idea che i diritti umani, intesi come rispetto dei diritti fondamentali della persona, sono materia estremamente complessa che richiede un'attività specifica, coordinata ed organica. L'obiettivo di questa Commissione, ripercorrendo i percorsi e l'esperienza delle legislature precedenti, dovrebbe essere la realizzazione di iniziative volte ad ottenere l'abolizione della pena di morte nel mondo, l'introduzione nel nostro ordinamento del reato di tortura, la tutela dei diritti del fanciullo, garanzie per chi si trovi privato della libertà, la promozione e l'attuazione del diritto d'asilo, la lotta alla tratta degli esseri umani, la lotta contro il razzismo, la xenofobia e la discriminazione delle minoranze, il divieto delle mutilazioni genitali femminili. Insomma, un percorso verso l'affermazione dei diritti umani come patrimonio e conquista dell'umanità. Vogliamo denunciare con forza, però, che la necessità di ricorrere ad una Commissione speciale per la tutela dei diritti umani è l'ennesima affermazione implicita del fallimento della politica. È singolare che sia necessario ricorrere ad istituire una Commissione speciale quando basterebbe garantire il rispetto delle leggi ordinarie esistenti e dei trattati internazionali. La Corte europea dei diritti umani ha diffuso un rapporto riguardante le condanne inflitte ai Paesi membri del Consiglio d'Europa che hanno violato i diritti umani. Da esso emergono dati sconcertanti e vergognosi, soprattutto per il nostro Paese, condannato al pagamento di 120 milioni di euro a titolo di risarcimento su un totale di 176 milioni di euro comminati in tutti i diversi Paesi membri. Al secondo posto tra gli Stati più sanzionati vi è la Turchia con 23 milioni di euro e al terzo c'è la Russia, con soli 7 milioni di euro. Si tratta di una questione di grave rilevanza istituzionale, oltreché sociale ed economica, che non può esimerci dal mettere al centro dei nostri dibattiti parlamentari la questione del diritto e dei diritti. A questo va aggiunta, a titolo di esempio molto specifico, ma significativo e di pubblico dominio, la grave situazione in cui versano gli istituti di pena nel nostro Paese, che ci vede nelle more di un altro, impellente procedimento da parte della Corte europea che il Governo ha avuto anche la sfrontatezza di impugnare, mentre è sotto gli occhi di tutti che nelle nostre carceri vi è un tasso di sovraffollamento record di quasi 70.000 presenze contro le 43.000 presenze regolamentari. Non è poi da trascurare, e deve essere inserita nell'agenda di questa Commissione, la grave situazione relativa alla legislazione che regola l'immigrazione in Italia, che ad oggi si configura nella pratica come creatrice di un immenso serbatoio di manodopera a basso costo per la criminalità organizzata. La tutela dei diritti umani, però, passa anche dal garantire l'accesso al credito a tutte le fasce di popolazione oggi in difficoltà: cosa che non avviene, mentre continuano ad operare e a prosperare le speculazioni finanziarie e il sistema criminoso dell'usura, incentivato di fatto proprio dall'attuale congiuntura bancaria. Premesso questo, passando invece ad una questione procedurale, ci siamo chiesti perché sia oggi necessario procedere alla costituzione di un'ennesima Commissione speciale nelle more della costituzione delle Commissioni permanenti. I temi di cui sopra sono importantissimi e delicati e riguardano una dimensione che va ben oltre il nostro Paese, ma quale Paese oggi può ergersi a difensore dei diritti umani se non è in grado di salvaguardare la dignità e prevenire le tragedie alle quali in questi giorni abbiamo assistito?
2013-04-16	PD	FattoriniEmma	Signor Presidente, signor rappresentante del Governo, onorevoli colleghi, il riconoscimento dei diritti umani è il punto di partenza di tutto il moderno costituzionalismo. Dal 1679, con la Carta dell' Habeas corpus, al 1789, con la famosa, fondativa Dichiarazione francese dei diritti dell'uomo e del cittadino, tutte le Costituzioni che si sono succedute fino all'età contemporanea li hanno sviluppati e integrati, con ispirazioni e accenti diversi. Nel Novecento riprendono corpo dalle macerie delle due guerre mondiali. Già dopo la prima, il cosiddetto wilsonismo e la Società delle Nazioni tentarono, pure se con assai scarsi risultati, una cultura della collaborazione, dell'aiuto economico e dell'autodeterminazione dei popoli. Ma è con la Dichiarazione universale dei diritti umani del 1948, che è stata precedentemente ricordata, che si trovano le risposte alle quattro libertà già enunciate da Roosevelt (di parola, di culto, dal bisogno e dalla paura). Sono d'accordo con il senatore Compagna sull'importanza delle altre grandi scansioni, come la Conferenza di Helsinki e i comitati Sacharov, ma quella Dichiarazione resta il fondamento cui noi ci riferiamo. E questo senza contraddire il ragionamento che egli ha fatto in precedenza, che valorizzava istituzioni come l'OSCE o il Consiglio d'Europa. La Dichiarazione del 1948 resta importante quella perché nasceva dalla preoccupazione di non consentire il ripetersi degli orrori dei totalitarismi, e sfidava in questo modo tutte le preoccupazioni e le tensioni della guerra fredda. Sanciva straordinari e altissimi principi, il cui valore, aumentato nel tempo, è diventato via via sempre più attuale - lo sappiamo, per averlo già sentito - fino agli anni seguenti la guerra del Kosovo e il genocidio in Ruanda. Per arrivare a noi, dopo questo rapidissimo e sintetico excursus storico, ritengo che un momento di crisi così acuta come quella che tutto l'Occidente sta attraversando, analogamente al dopoguerra novecentesco, a cui assomiglia moltissimo, investa purtroppo non solo il piano economico, ma i fondamenti stessi della nostra convivenza: in questo quadro così drammaticamente simile a quegli anni del '900, il tema dei diritti umani deve quindi uscire dalla retorica delle buone intenzioni. La priorità assoluta di ogni vita umana, da proteggere e salvaguardare per il solo fatto di essere al mondo, rende la comunità mondiale come una stessa, unica grande famiglia. In tal modo i diritti umani mettono in crisi la tradizionale e assoluta idea di sovranità nazionale, così come quella di un'unica e superiore identità culturale. Abbiamo già ascoltato questo ragionamento negli interventi dei colleghi che mi hanno preceduto. Vorrei solo aggiungere - per poi chiudere su questo punto - che se quella dei diritti umani diventa una possibile lettura della globalizzazione (questa è la novità, che ne cambia la natura) la cultura dei diritti umani non è solo giuridico-costituzionale, ma sempre di più anche storica, etica e politica. La questione dei diritti umani, infatti, è uscita ormai da tempo dall'ambito secondario e minore che riguardava casi estremi o di persecuzione limite, per toccare invece il cuore morale e politico delle convivenze nazionali e dell'intero pianeta. È diventata a tutti gli effetti - l'ha detto bene il senatore Tonini - il tema sul quale si è giudicati, sul quale un Paese è giudicato e sul quale si misura il livello di civiltà e di civilizzazione, non meno delle questioni economiche o angustamente nazionali. In questo senso, la sovranità è limitata e la legittimazione è reciproca: del resto, non c'è più accordo economico o politico internazionale che non contempli clausole condizionali, che non subordini cioè l'accordo stesso al rispetto dei diritti umani. Sono quindi molto contenta di questa concordia nel volere tutti che si continui la consuetudine di costituire una Commissione per i diritti umani, in quanto essa non interessa solo il piano internazionale, ma anche strettamente quello interno. Si è credibili nelle richieste che si avanzano all'esterno, se le si rispettano - noi per primi - all'interno: è questo che dà credibilità, e il nostro Paese Dio solo sa se ha assolutamente bisogno di credibilità, almeno quanto ne ha di ripresa economica. In conclusione, come far sì che queste parole non restino retoriche e che la Commissione non sia un puro fiore all'occhiello, che magari può anche essere considerato pletorico e costoso? Ci possiamo riuscire solo attraverso un approccio insieme realistico, ma anche largo, perché la natura propria dei diritti umani è quella di non identificarsi con quella dei diritti civili: vanno posti paletti, bisogna capire con più esattezza a cosa ci si riferisce, a quale natura essi si rifanno. Infatti, l'appannamento diventa assai improprio storicamente e molto inefficace politicamente, per cui occorre delimitare, precisare cosa si debba intendere oggi per diritto umano e se e come sia cambiata la sua natura, per capire cosa sia davvero essenziale in quella ricerca di un umanesimo laico e condiviso, di cui abbiamo sempre più urgente bisogno. Si tratta quindi di un discorso più largo di come lo abbiamo conosciuto dai nostri padri, insieme più realistico. Delimitare e precisare cosa s'intende per diritti umani è importante, perché essi non si identificano con i diritti civili tout court (e precedentemente ho sentito una gran confusione in merito): non tutto quello che è una causa giusta, è un diritto umano, e se lo identifichiamo nella sua verità, per com'è oggi, siamo anche in grado di difenderlo con più forza. Tornare, dunque, all'essenziale vuol dire tutelare in primo luogo la vita. Penso, per esempio, al genocidio dei feti femminili nel ventre materno in India e in Cina, che raggiunge proporzioni paurose. Penso alle condizioni materiali della vita, alla povertà devastante di vaste aree del mondo, ma penso anche alle forme di vera e propria - mi verrebbe da dire - animalizzazione delle nuove povertà urbane del nostro Paese: penso a quei padri di famiglia che vedo - come credo anche voi - come animali cercare nei cassonetti sotto lo sguardo dei figli. Questi sono i nuovi diritti. La sostanza dei diritti umani è e resta, prima di tutto, la dignità: la dignità nelle forme nuove in cui essa è calpestata. Essenziale è la dignità dell'essere umano, perché essa è fondativa dei diritti umani. Care colleghe e colleghi, questo è il fondamento del passato che resta attuale. Come è stato ricordato dai colleghi che mi hanno preceduto, il Senato ha una storia importante sul tema dei diritti umani per motivazioni di ampio respiro unite alla concretezza dei problemi affrontati e dai successi ottenuti, come quelli relativi alla pena di morte e al modo in cui sono cambiati i diritti del fanciullo. Penso alla pedofilia, tema già affrontato nella legislatura precedente, ma anche al commercio degli organi, alle case famiglia, a tutte le mutilazioni e agli altri orrori legati alla mercificazione del corpo. Poi c'è il tema complesso dell'immigrazione, diventato sempre più pressante, con le conseguenti modificazioni del tradizionale rapporto tra jus sanguinis e jus soli. Ve ne sono tanti altri che non ricordo, perché sono già stati accennati dai colleghi che mi hanno preceduto; intervenendo fra gli ultimi, molte cose sono già state dette. I diritti umani, dunque, oggi non riguardano solo i casi estremi, ma alludono alla costruzione di un nuovo umanesimo - insisto al riguardo - che abbia come punto di partenza e come punto di arrivo i diritti umani, diritti che salvaguardino la dignità dell'individuo e della persona: un nuovo umanesimo concreto e non retorico, laico e coraggioso, attento ai diritti non meno che ai doveri, sensibile alla loro dimensione personale e ai legami comunitari. Diritti umani intesi non in senso estensivo, eppure capaci di distinguere i nuovi, sempre in evoluzione. Violazioni che ricadono sui soggetti deboli da tutelare, come ci insegna la migliore bioetica: quella che non è accecata preventivamente da opposti e complementari integralismi, ma che con spirito collaborativo è capace di individuare le violazioni sul corpo della donna, dei bambini e degli anziani, là dove la vita, al suo sorgere e al suo terminare, è più vulnerabile. Chi come voi, cari colleghi, ha più esperienza di me di relazioni internazionali sa bene che su questi temi i Parlamenti possono essere più liberi dei Governi, possono trovare convergenze altrimenti impensabili, senza che questo debba significare poco realismo e troppa astrattezza di princìpi. In questo senso hanno ragione sia il senatore Tonini che il senatore Compagna: il primo quando diceva che è una proposta in controtendenza ma, come ha detto anche il senatore Compagna, in grande, bellissima continuità con il lavoro svolto dal Senato in passato. Vorrei concludere con un appello che non è assolutamente retorico e che mi viene dalla testa e dal cuore: diamo prova che le ostilità e le divisioni di cui dà spettacolo la politica possono placarsi in nome non di un conformistico politically correct, perché i diritti umani sono la patria del buonismo, ma di una fattiva azione sulle cose che ci uniscono e che sono davvero superiori rispetto a quelle che ci dividono.
2013-04-30	LN	BitonciMassimo	Presidente, la sicurezza, legata all'immigrazione clandestina, è un tema da non sottovalutare. Ha invece enumerato una lunga e seria lista di criticità, purtroppo ben conosciute: dalla crisi economica all'immenso debito pubblico, dal risanamento di bilancio alle misure necessarie per la crescita. Sì, perché senza crescita, senza sviluppo, senza lavoro, non si può sperare né di uscire da questa crisi né di assolvere agli impegni già presi in Europa. E siamo d'accordo sul fatto che ci vogliono politiche di ripresa urgenti, salvaguardando la tenuta dei conti pubblici.
2013-04-30	LN	BitonciMassimo	Signor Presidente, gentili colleghi, presidente Letta, abbiamo ascoltato con attenzione il suo intervento alla Camera e la replica di oggi. Un intervento alto e molto ampio. La Lega Nord ha sempre ribadito, dal giorno successivo alle elezioni, che il popolo avesse bisogno di un Governo, un Governo con pieni poteri, un Governo politico e non un Governo tecnico. Lei, però, nel suo discorso ha illustrato tutte le tematiche che tengono unite le varie coalizioni e partiti, strizzando l'occhio perfino ai Gruppi che avevano dichiarato già il loro voto contrario, ben guardandosi purtuttavia dall'affrontare i temi più spinosi. Vogliamo capire, ad esempio, cosa ne pensa, presidente Letta, delle tematiche legate all'immigrazione, dello ius soli e della paventata cancellazione della Bossi-Fini.
2013-06-19	LN	StefaniErika	Ricordo che la violenza sulle donne non è un fenomeno tipico degli ambienti degradati e nemmeno tipica solo dei nostri giorni, anche se i media ne hanno dato particolare risalto negli ultimi tempi. Si tende ad attribuire poteri e colpe ai legislatori, ma è bene ricordare anche sentenze come quella del 1° febbraio 2012, con la quale la Cassazione ha deciso che non è obbligatoria la custodia cautelare in carcere per coloro che, anche in gruppo, hanno stuprato o picchiato una donna, in quanto la Corte costituzionale, il 21 luglio 2010, aveva definito incostituzionale la disposizione approvata dal Parlamento con la legge n. 38 del 2009, di convenzione del cosiddetto decreto sicurezza, perché ritenuta limitativa del campo d'azione della magistratura. Queste sentenze colpiscono anche l'opinione pubblica, che ritiene invece assolutamente odiosi simili crimini. Nell'ambito della valutazione dei contesti in cui nascono molte violenze e discriminazioni non può essere taciuto, al di là di considerazioni retoriche e buoniste, ma anzi deve essere onestamente riconosciuto che l'aumento esponenziale del fenomeno dell'immigrazione da Paesi con radici culturali diverse da quelle nostre tradizionali ha messo a dura prova le politiche di integrazione e, nel contempo, ha evidenziato l'improcrastinabilità di interventi sul piano giuridico e culturale volti a garantire il rispetto della legalità e dei principi del nostro vivere civile da parte dì tutte le comunità, anche con radici culturali diverse, presenti sul territorio nazionale.
2013-07-02	M5S	CastaldiGianluca	Signora Presidente, qualora ci trovassimo in sede di recepimento della normativa comunitaria, in questo ennesimo decreto omnibus n. 63, ci troveremmo davanti a un cosiddetto effetto gold plating, cui si riferisce la raccomandazione a «prevenire sovraccarichi di regolazione rispetto a quella minima dalle fonti comunitarie», in particolare ad «evitare di introdurre o di mantenere adempimenti (...) non strettamente necessari per l'attuazione delle direttive». La fonte di questa definizione è sul sito del Governo italiano. Ora, ci troviamo in sede di conversione di un decreto che si prefigge l'obiettivo di promuovere il miglioramento della prestazione energetica degli edifici, favorire lo sviluppo, la valorizzazione e l'integrazione delle fonti rinnovabili, sostenere la diversificazione energetica, promuovere la competitività dell'industria nazionale attraverso lo sviluppo tecnologico e conseguire gli obiettivi nazionali in materia energetica e ambientale. Ci ritroviamo dunque, proprio in questo decreto omnibus, di fronte ad un classico effetto di gold plating. Anche il senatore Marinello, ad esempio, dopo aver respinto la mia richiesta di discussione della mozione sulle estrazioni di idrocarburi in Adriatico, oggi viene colpito dal virus dell' omnibus ed infila in questo decreto il suo emendamento 14.0.5, relativo al divieto di estrazione entro le dodici miglia. Nell'articolo 21 invece, al comma 1, si provvede ad incrementare, nell'ambito del Fondo sociale per l'occupazione e la formazione, le risorse destinate al finanziamento degli ammortizzatori sociali in deroga. Ai commi 2 e 3, si provvede al rifinanziamento del Trattato di amicizia, partenariato e cooperazione tra la Repubblica italiana e la Grande Giamahiria araba libica popolare socialista, fatto a Bengasi nel 2008. In particolare, viene rifinanziato l'articolo 5 della legge n. 7 del 2009 per ben 413 milioni di euro per il periodo 2014-2023, al fine di reintegrare le risorse necessarie all'attuazione della legge di ratifica citata, ovvero per la realizzazione di iniziative speciali a beneficio del popolo libico, nonché la collaborazione nella lotta al terrorismo, alla criminalità organizzata, al traffico di stupefacenti, all'immigrazione clandestina ed altresì per la realizzazione di progetti infrastrutturali di base che vengono concordati tra i due Paesi. Ora, non so chi tra i miei colleghi qui presenti conosce particolari di attuazione in merito a questo Trattato Italia-Libia, però forse l'ho trovato io (lo dico con estrema ironia) il nesso della collocazione in questo decreto del rifinanziamento di questo Trattato Italia-Libia: credo che il nesso sia l'articolo 18 del Trattato, denominato «Collaborazione energetica», cioè una norma sostanzialmente pro ENI, visto che la norma praticamente prevede il rafforzamento del partenariato in tale settore attribuisce particolare rilievo alle energie rinnovabili, incoraggiando la cooperazione tra enti ed organismi dei due Paesi, sia sul piano industriale su quello della ricerca e della formazione. Ma il punto specifico è il seguente: nell'articolo 21 si devono rilevare diversi aspetti problematici in relazione alle modalità utilizzate per la copertura finanziaria del decreto-legge in esame, soprattutto con riferimento alle disposizioni che rifinanziano gli interventi della legge di ratifica del Trattato con la Libia e, successivamente, riducono a copertura gli stessi stanziamenti recati dal medesimo Trattato. Si tratta di un'operazione contabile molto poco chiara. Si rappresenta, infatti, che, trattandosi di risorse in conto capitale, il loro utilizzo per finalità di natura corrente (minori entrate correnti) rappresenta una dequalificazione della spesa. Andrebbe poi chiarito più puntualmente l'impatto sull'indebitamento pubblico. Inoltre, si fa presente che le risorse in questione sono finalizzate all'adempimento degli obblighi assunti dall'Italia con il Trattato di amicizia con la Libia stipulato nel 2008: adempimento che lo storno delle relative risorse sembrerebbe rendere inevitabile rinviare. Appare infine evidente una cospicua insufficienza della copertura per circa 368 milioni di euro, in rapporto al 2024, in violazione al comma 3 dell'articolo 17 della vigente legge di contabilità, che impone la puntuale indicazione della copertura, con la specificazione, per la spesa corrente e per le minori entrate, degli oneri annuali fino alla completa attuazione delle norme. Dalla relazione tecnica si evince che le risorse utilizzate a copertura per 229 milioni di euro sarebbero insufficienti anche soltanto alla copertura dell'autorizzazione di spesa di 413 milioni di euro. I cittadini del Movimento, alla luce del fatto che parte cospicua degli oneri è configurata come previsione di spesa, evidenziano la necessità di corredare la clausola di copertura di apposita clausola di salvaguardia. Pertanto, crediamo sia il caso di inserirla.
