2013-07-18	PD	CorsiniPaolo	Ve ne poi è una seconda, un populismo identitario che cerca di rivolgersi a tutto il popolo con l'intendimento di rappresentarlo nelle sue istanze, non solo nei confronti delle élite politiche, ma appunto nei confronti di chi ci sta di fronte: lo straniero. La pretesa rappresentanza omogeneizzante degli interessi di tutta la comunità si caratterizza in un programma di contrapposizione all'immigrazione, per cui lo straniero diventa l'invasore. Queste sono le radici profonde in ragione delle quali il nostro Paese vede il diffondersi di pratiche e di esperienze di neorazzismo, spesse volte inconsce, spesse volte invece lucidamente perseguite in quanto remunerative sul piano del mercato della imprenditoria possibile, o meglio della imprenditoria politica che persegue i razzismi possibili. Ho fatto riferimento ai razzismi possibili, perché anch'essi hanno subito una metamorfosi. Ciò che sconcerta nelle dichiarazioni del senatore Calderoli è che egli va oltre la metamorfosi di questi razzismi di cui tra poco dirò, ma in qualche misura regredisce al vecchio razzismo biologico, che oggi viene surrogato da un sistema di motivazioni psicologiche e sociali che si nutrono di sentimenti di angoscia, di un sistema collegato a minacce sociali, a quel panico morale che, assommando paure personali e preoccupazioni collettive, obnubila le nostre capacità di giudizio e di discernimento. Quel razzismo biologico che era stato compiutamente stigmatizzato e che nessuno più aveva l'ardire di resuscitare. Ebbene, accanto al razzismo biologico, nei nostri comportamenti (anche di noi persone civili, bene educate, colte e progredite) spesso vengono praticate forme di razzismo neo-addizionale o d'allarme, cioè quell'atteggiamento discriminatorio che nasce dalla sovrapposizione o dall'addizione tra una differenza somatica, culturale o etnica a fattori di allarme sociale. Abbiamo dunque il razzismo biologico, il razzismo addizionale e il razzismo concorrenziale, che è diffuso nel costume delle nostre città. Signora Ministro, sono stato sindaco di una città di una certa importanza e ho conosciuto il razzismo concorrenziale che opera nei nostri quartieri. Il riferimento è quella disposizione offensiva che nasce dalla difesa e dall'esigenza del controllo simbolico o materiale del territorio e delle sue risorse: il rischio, insomma, della guerra tra poveri. Ed è per questo che preferisco alla parola «territorio», che rimanda al neotribalismo, la parola «terra», che è il segno della nostra più autentica appartenenza, che è il luogo dei nostri affetti, delle nostre relazioni, è il luogo in cui riposano i nostri cari. E c'è, infine, un razzismo differenzialista che - come scrive il senatore Luigi Manconi - assume a proprio fondamento il rifiuto dell'universale, la categorizzazione fissa degli individui, il postulato della differenza assoluta, e cioè la biologizzazione delle identità: quella identità, signora Ministro, che le viene imputata come una colpa, a lei che è nata in Congo. Perché esiste anche una intolleranza eurocentrica, cioè quell'attitudine discriminatoria che scaturisce dalla difesa di una cultura, di un sistema di valori, di uno stile di vita, che scaturisce dal rifiuto e dalla svalutazione di culture che appartengono, appunto, all'altro. Per concludere, questa mozione valorizza la dimensione della interculturalità perché tiene in conto che il multiculturalismo non è una risposta politica al problema della immigrazione: è semplicemente una descrizione sociografica della composizione demografica di una società. E tiene conto del fatto che l'assimilazionismo, in realtà, ha dichiarato la propria crisi quando abbiamo assistito alla rivolta nelle città francesi, mentre l'intercultura indica conoscenza e scambio reciproco e arricchimento culturale dei singoli gruppi nella società in generale, e non crea nuove apartheid. La prospettiva interculturale è caratterizzata dalla dinamicità, presuppone un incontro produttivo tra vari soggetti, un incontro nel quale le mutue identità siano ridefinite. E allora, vorrei chiudere questa breve riflessione con una dichiarazione di affetto, se mi è concesso, nei suoi confronti. A lei, a lei come simbolo dei tanti italiani nati in terra straniera e oggi italiani, a lei come simbolo dei tanti italiani stranieri nati in terra italiana, non voglio manifestare semplicemente la solidarietà. Vede, nel nostro Paese e nelle tradizioni politiche di questo Paese - e il PD trae linfa e alimento anche da questa tradizione - c'è una ispirazione cristiana che parla della dimensione della prossimità: dunque, mi sento suo prossimo.
2013-07-18	PD	MicheloniClaudio	Infatti, viviamo di cliché : noi siamo i più bravi, noi siamo i più integrati, noi abbiamo storie di successo. Sì, abbiamo storie di successo: oggi vivo in Svizzera, dove ho i miei figli e fra un mese sarò anche nonno, e abbiamo avuto una storia di grande successo. Ma fino alla metà degli anni Settanta abbiamo avuto storie di sofferenza, razzismo e xenofobia! Fino alla metà degli anni Settanta, nel dopoguerra, i nostri genitori erano chiamati Gastarbeiter, ossia lavoratori ospiti: venite, lavorate, realizzate le strade, costruite le case e poi andate via. Hanno impiegato più di vent'anni a capire che da lavoratori ospiti saremmo diventati i cittadini svizzeri di domani, e questo succederà anche in Italia, con buona pace di tutti gli xenofobi italiani. Signora Ministro, l'Italia è purtroppo un Paese normale, dove c'è il peggio ma anche il meglio. Mi fa piacere vedere seduto al banco del Governo l'amico Delrio: un paio di volte sono andato nella sua città, dove ho vissuto momenti di grande livello di integrazione e di alta qualità. Dunque siamo un Paese, ripeto, normale e con questa normalità dobbiamo confrontarci senza angelismi, senza pensare che bastino grandi dichiarazioni o che con le leggi si risolva il problema dell'integrazione. Voglio concludere con una mia strana visione dell'integrazione. Ho passato la mia vita a fare politica di integrazione in Svizzera, e non solo per le comunità italiane, e sono convinto che l'integrazione sia un'utopia, qualcosa che non raggiungeremo mai, ma un'utopia che dobbiamo rincorrere in permanenza. L'integrazione è uno stato d'animo, un modo di vivere, e funziona solo se questo stato d'animo lo si ritrova nelle due persone che devono vivere in modo integrato: colui che riceve e colui che arriva. Questo è il doppio senso, per me, della storia dell'integrazione. Dobbiamo viverla tutti i giorni, perché non si raggiunge mai in modo definitivo: basta una crisi economica per distruggere venti o trent'anni di integrazione. Concludo ricordando una bellissima preghiera che a mio avviso riguarda chi si occupa di immigrazione e integrazione, quella delle madri della Plaza de Mayo: bisogna sempre ricominciare, ricominciare, ricominciare. Buon lavoro, signor Ministro.
2013-07-19	LN	BitonciMassimo	sul cuneo fiscale che non volete abbassare, sulle pensioni d'oro che non volete tagliare, sul federalismo e i costi standard che avete messo nel cassetto, sullo svuota carceri, sulla modifica della cittadinanza, sullo ius soli che gli italiani non vogliono, sul reato di immigrazione clandestina che volete cancellare.
2013-07-19	M5S	GiarrussoMarioMichele	Signor Presidente del Consiglio, gli esperti delle Nazioni Unite hanno dichiarato il loro timore che si sia verificata una extraordinary rendition, ovvero un sequestro internazionale. In qualsiasi altro Paese, colleghi, già queste poche righe avrebbero determinato le immediate dimissioni del Ministro dell'interno e il suo definitivo allontanamento dalla politica. Sulla questione si è pronunciato anche il Consiglio italiano per i rifugiati, che ha reso noto che esiste il rischio molto concreto che la signora Shalabayeva possa subire nel suo Paese trattamenti disumani. Signor Presidente, il Movimento 5 Stelle ritiene che l'espulsione della signora Shalabayeva e della sua bambina siano avvenute nel più completo disprezzo di tutte le norme interne e internazionali che disciplinano e regolano lo status di un cittadino straniero in Italia. È particolarmente grave per noi del Movimento 5 Stelle la violazione dall'articolo 10 della nostra Costituzione ‑ proprio quella che in queste Aule si vuole cambiare a colpi di maggioranza ‑ il quale dispone che «Lo straniero, al quale sia impedito nel suo paese l'effettivo esercizio delle libertà democratiche garantite dalla Costituzione italiana, ha diritto» - signori: ha diritto - «d'asilo nel territorio della Repubblica». Non meno grave è la violazione dell'articolo 19 del Testo unico delle disposizioni concernenti la disciplina dell'immigrazione; ma addirittura è stata violata la stessa Carta dei diritti fondamentali dell'Unione europea, del 26 settembre 2000, che all'articolo 19 vieta - onorevoli colleghi: vieta - di allontanare, espellere o estradare uno straniero «verso uno Stato in cui esiste un rischio serio di essere sottoposto alla pena di morte, alla tortura o ad altre pene o trattamenti inumani o degradanti». La violazione di tutte queste norme, signor Presidente, è stata riconosciuta dallo stesso Ministero dell'interno che, purtroppo, soltanto tardivamente, ad oltre un mese dai fatti, ha revocato in autotutela il decreto di espulsione. Tutte queste circostanze, onorevoli colleghi, assumono un rilievo ancora più odioso, in quanto tali violazioni sono state commesse e perpetrate ai danni di una donna innocente e di una bambina di sei anni. Onorevoli colleghi, non possiamo nasconderci dietro tanti giri di parole e abbiamo il dovere di guardare in faccia la dura e terribile realtà. Il nostro Paese, signor Presidente del Consiglio, l'Italia che amiamo, ha consegnato con la forza e con l'inganno una donna e una bambina di sei anni ad un Paese il cui Governo è accusato da tutte le principali agenzie di tutela dei diritti umani di praticare la tortura, le sevizie, nei confronti degli oppositori, dei dissidenti e delle loro famiglie. Questo lo dice, da ultimo, il 18 aprile del 2013, il Parlamento europeo in una risoluzione in cui si affermava che il regime kazako limitava i fondamentali diritti civili e politici dei suoi cittadini, la libertà di assemblea, di espressione e di religione, imprigionando senza processo o dopo processi farsa leader dell'opposizione, difensori dei diritti dell'uomo, giornalisti, membri della società civile ed avvocati, procedendo altresì allo scioglimento dei partiti di opposizione e alla chiusura e al sequestro di tutti i mezzi d'informazione indipendenti. Questo quadro, già a tinte fosche, veniva altresì ulteriormente aggravato dalla constatazione del Parlamento europeo che il regime kazako praticava sistematicamente attività di ritorsione e persecuzione nei confronti delle famiglie degli oppositori politici. La risoluzione del Parlamento europeo - cito testualmente - invita «l'Unione Europea e gli Stati membri a cercare garanzie che proteggano i giornalisti, gli attivisti dell'opposizione e i difensori dei diritti umani e le loro famiglie», signor Presidente, contro ogni tipo di minacce personali, pressioni o azioni penali. Questa situazione era ben nota da tempo, perché non è la prima risoluzione del Parlamento europeo sui diritti umani nei confronti del Kazakistan. Ripeto, questa situazione era nota da tempo. Onorevoli colleghi, con questa azione riprovevole e vergognosa è stato gettato un enorme discredito sul nostro Paese e sulle nostre istituzioni. Signor Presidente, l'operato del Ministero dell'interno ci ha fatto vergognare di essere italiani. Non vorremmo dire queste parole, ma siamo costretti a farlo. Non ci sono giustificazioni plausibili per un'azione così feroce nei confronti di gente inerme e indifesa, accusata di nessun delitto, di nulla: una donna e una bambina, signor Presidente del Consiglio. Non possiamo accampare scuse di fronte a questo. Adesso, noi possiamo dire che l'articolo 95 della Costituzione stabilisce che: «I Ministri sono responsabili collegialmente degli atti del Consiglio dei Ministri, e individualmente degli atti dei loro dicasteri», ministro Alfano. Lei, per l'articolo 95 della Costituzione, è responsabile; a che titolo sarà sicuramente accertato in altre sedi, come è stato per Abu Omar, ma lei, qua dentro, in questa Aula, signor ministro Alfano, lei, per la nostra Costituzione è responsabile di quanto è accaduto. L'articolo 54 della Costituzione recita infatti solennemente che «Tutti i cittadini hanno il dovere di essere fedeli alla Repubblica e di osservarne la Costituzione e le leggi», signor Ministro dell'interno. I cittadini poi, come lei, cui sono affidate funzioni pubbliche, hanno il dovere di adempierle con disciplina e onore. Mi chiedo, signor ministro Alfano, quale disciplina, quale onore c'è nel rapire una donna indifesa e una bambina con tutto quel dispiegamento di mezzi. Ce lo spieghi in quest'Aula con parole sue. Non c'è bisogno, però, signor Ministro, di chiamare in causa queste norme per comprende che gli atti che sono stati perpetrati contro queste due povere donne da un potere forte, enorme, maschile, che continua sempre a opprimere le donne, sono atti ingiusti che vanno sanzionati. Adesso si dice che la nostra mozione di sfiducia è un atto politico e, come tale, è stato valutato dai partiti della maggioranza che lo dovrebbero rigettare. No, signor Presidente, non è un atto politico: è un atto per dare dignità a questo Paese e per cercare di dire che la barbarie non può albergare nel nostro Paese e che questa non è l'Italia che noi vogliamo. Vedete, signor Ministro, signor Presidente del Consiglio, onorevoli colleghi, noi oggi, in quest'Aula, abbiamo una possibilità di scelta. Possiamo scegliere se ratificare quanto è successo, confermando la fiducia dopo aver visto i fatti e assumendocene noi, con la nostra storia, individualmente, tutte le responsabilità, alla luce del sole, davanti ai nostri cittadini e alla comunità internazionale; oppure possiamo dire che questa non è l'Italia che noi vogliamo. Non è un atto politico, signor Ministro; non è un atto politico, signor Presidente del Consiglio: è mettere un freno alla barbarie. Il Presidente della Repubblica ha detto che ciò che è accaduto è una cosa indicibile. È una cosa che noi mai avremmo potuto immaginare potesse verificarsi; è una cosa che, qualcuno ha detto, non si deve mai più verificare. Noi oggi abbiamo la possibilità di scelta. Esercitiamo questa scelta, perché - guardate, colleghi - non ce ne chiederanno conto i nostri elettori (che pure lo faranno); non ce ne chiederanno conto gli iscritti ai nostri partiti (che pure ce ne chiederanno conto): di questa azione ne risponderemo, per tutti i giorni della nostra vita, di fronte alle nostre coscienze, nei confronti delle quali noi saremo soli a risponderne, e non si scappa. Questo non è un voto che sarà dimenticato tra qualche giorno, tra qualche mese o anno: qua scriveremo, oggi, una pagina orrenda della nostra storia; oppure possiamo scrivere una pagina bellissima, una pagina in cui noi diciamo che queste cose non possono accadere. Vi invito ad una riflessione. È stato detto che c'è uno stato di necessita, che c'è la crisi e che non possiamo compromettere il suo Governo. Ma voi vi rendete conto quale vaso di Pandora demoniaco si apre in questo modo? Se è stato fatto tutto questo nei confronti di una bambina e di una donna per mero interesse economico, che cosa potrà accadere all'aggravarsi della crisi? Noi questo lo dobbiamo impedire, perché questo non è uno stato di necessità, non è una cosa che possiamo accettare. Voi, onorevoli colleghi, avete oggi la possibilità di scegliere, di uscire da quest'Aula a testa alta, fieri di aver difeso il nome del nostro Paese e di aver messo un argine alla barbarie che un domani potrà colpire tutti noi. La signor Alma e sua figlia Alua non hanno avuto questa scelta.
2013-07-23	LN	BellotRaffaela	Guardate come esempio concreto ed efficace l'azione incisiva dell'allora ministro della Lega Nord Maroni: bloccare il problema prima che diventi tale. Interventi concreti in materia di sicurezza avevano fermato il fenomeno dell'immigrazione clandestina colpendo anche chi ha utilizzato questi immigrati per il proprio tornaconto, datori di lavoro che li hanno sfruttati ed emarginati.
2013-07-23	LN	BellotRaffaela	È la falsa illusione di un lavoro che non riescono più ad avere nemmeno i nostri figli e le nostre famiglie. Avete preso coscienza della reale situazione economica e sociale del nostro Paese? Occorrono pene più severe, certezza nella loro applicazione, il coraggio di affrontare il problema dell'immigrazione irregolare confermando l'aggravante legata alla condizione di clandestinità, per contrastare concretamente il nascere di sacche sociali di emarginati, ai quali come unica possibilità resta quella di delinquere.
2013-07-23	PD	LoGiudiceSergio	Ma questo è un passo. Altre norme attendono di essere approvate per restituire alle carceri italiane il profilo di luoghi di rieducazione, e non di violazione della dignità umana: la modifica della legge sugli stupefacenti; l'introduzione del reato di tortura; la revisione delle norme sull'immigrazione, con l'abolizione del reato di clandestinità; l'istituzione del garante dei detenuti.
2013-07-23	M5S	CrimiVitoClaudio	, ma dobbiamo misurare gli spazi affinché ci sia una detenzione dignitosa per tutti coloro che devono essere puniti per aver commesso un reato. Pertanto, piuttosto che dell'esecuzione della pena andrebbe effettuata una revisione sostanziale di alcuni reati minori che sono stati puniti con leggi varate da questo Parlamento come, ad esempio, sull'immigrazione e sulle droghe leggere. Ce ne sarebbero di argomenti da affrontare, i quali invece sono stati bypassati per andare a toccare l'argomento dell'esecuzione della pena al fine di aumentare le possibilità di uscire prima dal carcere, di libertà vigilata o di altro.
2013-07-25	LN	CentinaioGianMarco	Signor Presidente, signor Presidente del Consiglio, sulle politiche del lavoro lei si è presentato agli italiani a nostro parere illudendoli: illudendoli sul fatto che questo è il Governo del fare, mentre è il Governo del fare poco e niente. Ad oggi, infatti, da quello che emerge anche dai provvedimenti che arrivano al nostro esame, è stato fatto poco per i disoccupati (o quasi niente), nulla per i giovani, nulla per le aziende. Le proposte avanzate sono idee che creano tantissime aspettative in coloro che in questo momento ci guardano fuori dal confine e che ci vedono come il Paese di bengodi, dove tutto si può, tutto è possibile, tutto si potrebbe fare: la legge svuota carceri, la proposta di abrogazione del reato di immigrazione clandestina, la legge sullo ius soli (che in questo momento stiamo contestando). Ma la questione è un'altra: il Ministero del lavoro ci dica che in Italia ci sono 2 milioni di lavoratori stranieri, di cui 400.000 disoccupati. Sono veramente tanti, davvero tantissimi. Dunque, la novella che ci raccontavano fino a qualche anno fa, che gli immigrati vengono in Italia per svolgere quei lavori che gli italiani non vogliono più fare, in questo momento non regge più. Dobbiamo renderci conto che, cittadini italiani e immigrati regolari, siamo tutti sulla stessa barca: siamo in recessione, non c'è lavoro per nessuno. Quali sono i rischi? I rischi sono certamente due: ammortizzatori sociali insufficienti, perché non si riesce a pagare tutti, e rischio criminalità, perché in questo momento nelle zone, nei quartieri, nelle aree dove non c'è lavoro vi è un altissimo rischio criminalità. Chiediamo quindi di valutare nuove iniziative volte a contenere l'arrivo di mano d'opera immigrata. Non sarebbe più saggio (ed è ciò che chiediamo) farsi promotori, ad esempio, di un provvedimento d'urgenza finalizzato a sospendere temporaneamente, causa crisi economica (e lo proporremo), l'adozione dei decreti che determinano i flussi d'ingresso? Le chiediamo inoltre, signor Presidente del Consiglio, di valutare la possibilità di intraprendere iniziative volte a prevedere il rimpatrio dei cittadini extracomunitari non impiegati in attività regolari. Lo ribadiamo, signor Presidente del Consiglio, non siamo il Paese di bengodi. In questo momento non c'è lavoro ed è inutile - voglio evidenziarlo - che i suoi Ministri vadano in giro ad illudere gli italiani.
