2013-10-22	LN	StucchiGiacomo	Signor Presidente del Consiglio, noi riteniamo che alla riunione del Consiglio europeo del 24-25 ottobre ci sono altri temi da porre oltre a quelli di cui lei ha parlato, ad esempio l'economia digitale; l' e-commerce come possibilità di sfruttare dei canali nuovi per poter produrre reddito e quindi produrre occupazione; gli sforzi per la crescita e l'occupazione; rivedere ad esempio il sistema degli sgravi; aiutare quelle aziende che stanno soffrendo ma che hanno un futuro davanti; cercare di mettere in atto quelle iniziative che non vanno a cozzare con il concetto stesso di aiuti di Stato (e credo che debba essere rivisto a livello europeo ciò che è considerato aiuto di Stato, perché in altri Paesi vengono intraprese azioni rispetto alle quali l'Unione europea non cede quando queste vengono promosse dal nostro Paese). È necessario premiare la ricerca, premiando le vere università, i veri ricercatori e magari, con una scelta coraggiosa, chiudendo certe università che sono state aperte solo per motivi campanilistici e che forse non hanno ragione di esistere nel contesto europeo, in cui c'è una competizione territoriale anche in tema di ricerca e di innovazione. Il completamento dell'unione monetaria è un problema, perché dobbiamo valutare la situazione attuale dell'euro e il contenuto dei Trattati europei. Dobbiamo capire che il Trattato di Maastricht è stato scritto in un'altra era per quanto riguarda la situazione economica. Da qualche anno tutto è cambiato, quindi l'euro attuale deve essere rivisto e reso più democratico. Allo stesso modo, lei citava il ruolo dei Parlamenti nazionali, fondamentale e importantissimo, e il ruolo del Parlamento europeo, come unica istituzione realmente democratica, eletta direttamente dai cittadini. Occorre, quindi, passare a una sorta di Lisbona 2, superando un trattato che, seppur recente, palesa comunque molti limiti. Si è parlato, poi, della situazione drammatica di Lampedusa e delle politiche dell'immigrazione. La politica dell'immigrazione è contenuta nella proposta di risoluzione n. 4, a prima firma del senatore Calderoli, in cui si chiede sostanzialmente di dire che l'Unione europea deve seguire un concetto fondamentale: si viene in Europa se si ha un posto di lavoro e un'abitazione, ossia se si ha la possibilità di vivere dignitosamente. La proposta di risoluzione n. 4 prevede sostanzialmente che, oltre a quanto deve essere fatto per quanto riguarda i rifugiati, è necessario controllare l'immigrazione, non subirla. Si tratta di concetti che dovrebbero essere condivisi da tutti, eppure vedo che si fa fatica e, allora, accadono queste tragedie che mi auguro che con Frontex o con l'operazione Mare nostrum possano essere per lo meno limitate (temo che non possano essere evitate completamente). L'impegno ci deve essere. Mi fa piacere che oggi ci sia una consapevolezza diffusa a livello europeo sul fatto che le nostre sono frontiere europee. Per tanti anni lo si diceva, quando c'era il passato Governo, e si veniva derisi, perché il concetto non passava. Oggi c'è una sensibilità diversa, però servono sempre i morti per arrivare a questa sensibilità. Ma non vorrei che la sensibilità e i drammi facciano passare in secondo piano la necessità di mantenere una politica rigida per quanto riguarda l'immigrazione, i controlli sui clandestini e tutto ciò che ne può derivare anche in termini di sicurezza per il nostro Paese. Come dicevo prima, siamo in un'altra era economica, non ci sono più posti di lavoro per tutti. Credo che il Governo debba fare delle scelte e debba privilegiare in primis i nostri concittadini, cercando di occupare il massimo numero possibile di persone, facendo scelte che abbiano una priorità e, quindi, guardando direttamente alle esigenze della nostra gente, di coloro che finora hanno tirato la carretta in questo Paese e che - ahimè - si trovano in difficoltà. Signor presidente Letta, mi auguro che il Consiglio europeo non sia una riunione tra aruspici, come diceva Catone, in cui, poi, magari vi mettereste a ridere. Non è utilizzando quel tipo di strategia, quel metodo di lavoro che, come diceva il filosofo Manin Taccola, si possono realizzare risultati importanti per il nostro Paese. La nostra gente, infatti, vuole scelte concrete, vuole politiche che siano fruttuose, vuole che la nostra classe politica abbia un atteggiamento pragmatico; vuole, sostanzialmente, il contrario di quello che lei ha proposto dando un parere favorevole alla proposta di risoluzione della maggioranza. È per questo che noi non voteremo la proposta della maggioranza e voteremo tranquillamente e convintamente le nostre proposte di risoluzione, nn. 1 e 4.
2013-10-22	M5S	BotticiLaura	Signora Presidente, signor Presidente del Consiglio, prendiamo atto di come il Governo sia riuscito a far inserire nell'ordine dei lavori l'annosa questione dell'immigrazione, e vogliamo sperare che questo sia accaduto per senso di responsabilità politico-istituzionale, applicando e facendo applicare il diritto e non solo per sostenere la pietas o per assoggettarsi ad un altro Capo dello Stato, quello del Vaticano
2013-10-22	PD	ChitiVannino	L'ultima considerazione riguarda il tema dell'immigrazione. Già il collega Manconi ha detto che la tragedia del 3 ottobre e l'iniziativa del nostro Governo hanno posto tale tema all'attenzione delle istituzioni europee. Bisogna dunque riuscire a venirne fuori con alcuni risultati. Su questo tema è stata decisa la creazione di una task force congiunta per pattugliare le coste dei Paesi che si affacciano sul Mediterraneo e sono state proposte l'istituzione di corridoi umanitari e la revisione delle regole comuni sull'asilo, rivedendo anche i criteri di accoglimento e di distribuzione dei rifugiati. Sono contento che il Presidente del Consiglio l'abbia accolta, perché a me pare che l'Italia debba provare ad insistere sulla proposta che ha fatto di nuovo in questa sede il senatore Manconi, affinché la richiesta di protezione possa essere avanzata dalle persone che sono in fuga da disastri, guerre e distruzione già nei Paesi di origine o di transito e che qui possa intervenire una valutazione dell'Unione europea, con le sue rappresentanze, così da ridurre gli spazi ai mercanti di morte che preparano nuove tragedie. Non sarei però sincero se non lo dicessi: ho sentito toni diversi, ma per il Partito Democratico è invece un punto fondamentale che l'Italia, per essere credibile, debba anche apportare dei cambiamenti al suo ordinamento. Sì, io credo che si debba cancellare il reato di immigrazione clandestina
2013-10-22	PD	ChitiVannino	Signora Presidente, il Gruppo del Partito Democratico condivide i contenuti della relazione del Presidente del Consiglio e, ovviamente, la proposta di risoluzione di maggioranza. È stato notato - ed è vero - che i temi all'ordine del giorno di questo Consiglio europeo, che pure rivestono grande importanza, sono molti e sono certo diversi ed eterogenei: dal mercato digitale all'unione bancaria, dalle misure che rafforzano il coordinamento sullo sviluppo e l'occupazione al tema dell'immigrazione, che noi abbiamo insistito per inserire. Tuttavia, credo che vi sia un filo comune che lega tutti questi aspetti e che dobbiamo politicamente sottolineare e far emergere: il filo comune secondo me è che si è voltato pagina rispetto alla stagione di un'Unione europea che viveva solo di austerità, un'austerità senza sviluppo, e che si stanno rafforzando - questo almeno è il nostro auspicio, perché si rafforzino ancora di più - vincoli di condivisione e di solidarietà tra i Paesi dell'Unione europea sulle grandi problematiche. Ecco alcuni di questi punti: il completamento del mercato unico digitale e dello spazio europeo della ricerca è necessario da raggiungere nei prossimi due anni. È condiviso il dato delle grandi potenzialità di questi settori in termini di sviluppo e di occupazione. Sappiamo - lo diciamo tante volte - che la sfida globale si gioca sul piano dell'innovazione e che dobbiamo puntare con convinzione sugli investimenti in ricerca e tecnologia. Tuttavia, in molti Paesi membri dell'Unione la spesa pubblica destinata all'innovazione e alla ricerca è in calo, anche a causa delle ristrettezze che erano state imposte al bilancio dalle manovre di consolidamento fiscale (nel 2013 è stata lo 0,72 per cento del PIL europeo). Ancora prima di questo, vi è un altro aspetto negativo non meno grave che chiama in causa il modo di intendere l'integrazione europea: programmi nazionali diversi, fondati su criteri diversi, sono una arretratezza da superare. Il collega Guerrieri Paleotti ha posto, secondo me con competenza e grande efficacia, il tema che noi poniamo all'attenzione del Governo per questo Consiglio europeo: il Governo italiano deve sostenere il completamento del mercato unico digitale e in questo senso è necessario giungere alla rapida approvazione del pacchetto legislativo proposto dalla Commissione europea già nei prossimi mesi, e non rinviarlo alla prossima legislatura. Il Consiglio europeo - ed è il secondo tema che voglio sottolineare - è chiamato anche a valutare i progressi dell'unione economica e monetaria. Voglio intanto dire - è giusto anche rivendicarlo, non è sentimento nazionalistico - che nell'azione di contrasto alle tensioni finanziarie un ruolo di particolare rilievo è stato ricoperto dalla Banca centrale europea presieduta da Draghi: questi interventi hanno contribuito ad eliminare le asimmetrie che impedivano alla politica monetaria di esercitare una corretta influenza sulle economie dei Paesi caratterizzati da squilibri economici e finanziari. Com'è stato ricordato, e come noi dobbiamo sapere anche quando discuteremo di legge di stabilità, le condizioni finanziarie nell'area euro sono oggi meno critiche rispetto alla fine del 2011, ma il raggiungimento di un equilibrio stabile è ancora lontano; continua a mancare un meccanismo di riduzione delle divergenze nelle strutture economiche; gli squilibri del ciclo economico privilegiano alcuni Paesi a danno di altri, ragion per cui è necessario affrontarli con uno sforzo comune. Mi rivolgo ai due Ministri presenti per porre una questione che non è contenuta nella proposta di risoluzione che abbiamo presentato, ma è un tema importante. Nell'autunno 2012 è stata avanzata dal presidente Van Rompuy la proposta di un bilancio federale dell'area euro (quella che si chiama fiscal capacity ). Questa proposta è stata fatta propria anche dalla Commissione: si tratta di un strumento indispensabile per varare le riforme strutturali con politiche di coesione e di solidarietà sociale. Ma questa decisione è sospesa. Io credo debba diventare una delle priorità del semestre della Presidenza italiana, e sottopongo tale questione al Governo del nostro Paese.
2013-10-22	PD	ManconiLuigi	In questi giorni, insieme al sindaco di Lampedusa Giusi Nicolini abbiamo elaborato la prima bozza di un piano, un progetto ancora al suo stato iniziale, che vogliamo venga discusso, approfondito, sottoposto alla discussione pubblica, che ieri abbiamo presentato al Capo dello Stato, che ha mostrato grande interesse e che oggi lei, signor Presidente del Consiglio, ha avuto la bontà di richiamare. Ebbene, quel piano contiene un dispositivo semplicissimo, almeno sulla carta, arduo certo da realizzare, ma che costituisce a nostro avviso un'ipotesi seria, che può modificare radicalmente una politica dell'immigrazione che lei ha definito gravemente inadeguata.
2013-11-28	LN	BellotRaffaela	Siamo dunque a chiedere al Governo di promuovere una politica a sostegno della famiglia, quale nucleo fondamentale della società, nel riconoscimento del ruolo primario che riveste nell'educazione e nella crescita dei bambini e dei giovani adolescenti; di non farsi promotore di iniziative volte a diffondere posizioni ideologiche che scardinano i riferimenti valoriali che appartengono, da sempre, alla tradizione culturale, sociale e religiosa del nostro Paese; di promuovere iniziative volte a contrastare il fenomeno dell'immigrazione clandestina e a contrastare le associazioni criminali straniere che traggono profitto dalla tratta delle persone; di promuovere, anche attraverso iniziative legislative, misure effettive di contrasto al fenomeno dell'accattonaggio minorile; di adottare iniziative utili al sostegno delle scuole di ogni ordine e grado; di promuovere nuove politiche volte a disincentivare l'abbandono scolastico; di promuovere nelle scuole specifici corsi per l'alfabetizzazione linguistica al fine di elevare il livello di integrazione dei bambini stranieri; di realizzare un'indagine conoscitiva che quantifichi puntualmente l'effettiva domanda di servizi di asili nido; di promuovere l'incremento delle risorse destinate al Fondo nazionale delle politiche sociali verificandone, inoltre, l'equa ripartizione, garantendo che in tutte le città italiane vi sia la medesima accessibilità ai servizi; di porre in essere iniziative, anche di natura normativa, finalizzate ad istituire il tribunale della famiglia.
2013-11-28	LN	StefaniErika	È necessaria una considerazione ulteriore. Questa discussione dovrebbe costituire uno spunto per riflettere sul modo in cui limitare le condizioni in cui il fenomeno dello sfruttamento minorile avviene più facilmente. È per questo che dovrebbero essere messe in atto iniziative volte a valutare le problematiche connesse al problema dell'immigrazione, soprattutto di quella clandestina: i minori, sradicati dal proprio ambiente naturale, in condizioni di povertà, diventano facilmente preda di situazioni di violazione dei diritti fondamentali, dallo sfruttamento del lavoro minorile all'accattonaggio, dallo sfruttamento sessuale all'utilizzo a fini di microcriminalità.
2013-12-03	PD	MartiniClaudio	Infine, Prato non è solo capannoni dove scoppiano le tensioni sociali, ma città dove si studia e si approfondiscono anche questi problemi. A Prato ha sede un'università australiana, la «Monash University», che negli ultimi anni ha prodotto studi e ricerche di valore assoluto sulle questioni dell'immigrazione e dell'integrazione. Sono risorse che, assieme all'impegno della politica, dobbiamo saper usare dopo una simile tragedia.
2013-12-03	PD	MartiniClaudio	Signor Presidente, il Gruppo del Partito Democratico si associa alle parole da lei espresse in apertura di questa seduta, parole di cordoglio e di partecipazione umana al dolore dei familiari delle vittime. Esprimiamo anche vicinanza all'amministrazione comunale di Prato e a tutte le amministrazioni locali impegnate, perché sono gli amministratori locali quelli più a diretto contatto con i mille problemi che una vicenda di questo tipo evidenzia. Domani pomeriggio parteciperò alla riunione aperta del consiglio comunale della città di Prato; sarà quella l'occasione anche per rinnovare questa vicinanza. Il dolore e lo sgomento devono portare ad un nuovo e più forte impegno comune di tutti noi, fuori da ogni polemica e forzatura, e mi sembra che dal dibattito di stasera emergano condizioni nuove che vanno utilizzate. Le questioni che la vicenda pratese propone sono tante. Riassumo solo per sommi capi quelle per noi più rilevanti. Innanzitutto, urge una nuova politica per l'immigrazione che sia all'altezza dei nuovi tempi e delle nuove questioni. Diciamo apertamente che né il lassismo né il rigorismo hanno funzionato: ci vuole una politica ora intelligente e flessibile, che sappia gestire fenomeni ogni giorno inediti. In secondo luogo, ci vuole un più forte dialogo tra le autorità italiane e quelle cinesi a livello di Governi, ma anche a livello locale; proprio perché, come diceva il senatore Mazzoni prima di me, la comunità cinese sembra impenetrabile, a maggior ragione è necessario un dialogo istituzionale al massimo livello. In terzo luogo, è indispensabile un controllo più severo sul territorio. (Brusìo).
2013-12-10	LN	CandianiStefano	Come potete presentarvi in Europa, facendo credere di aver fatto una manovra economica che sia all'altezza, quando subito dopo rincorrete il tutto con una «manovrina»? C'era bisogno di un correttivo, perché non abbiamo fatto le cose ad hoc, perfette sin dall'inizio? Semplice, perché ormai il sistema prevede che si lavori solo sull'urgenza, solamente sui decreti, impedendo qualsiasi sviluppo e confronto con la società civile. E così fate decreti, presentate norme come quelle contenute nella legge di stabilità, aspettando che poi il panico si impossessi del Paese, vedendo quello che ne deriva e presentando eventuali emendamenti e anche una «manovrina» correttiva. Mi chiedo se questa è serietà. Chiedo a voi se questa è serietà. Questo Governo sa far rispettare gli interessi del Paese, oppure è lo zerbino della Germania? In effetti, ancora una volta, con questa manovra si rispecchiano interessi che non corrispondono a quelli del Paese, ma a quelli di una finanza in cui sono la Germania e l'Europa della Germania a fare la differenza, in cui cioè altri decidono l'agenda dei lavori. Andate dunque in Europa, ma siate veramente credibili e non fate provvedimenti mescolando l'immigrazione con la finanza degli enti pubblici. A questo punto francamente mi sorge un dubbio fondamentale. Come mai avete tolto risorse da fondi importanti come quello a sostegno delle vittime della mafia?
2013-12-10	LN	CandianiStefano	Mi verrebbe da chiedere chi è l'alchimista, il Cagliostro che impasta queste norme, chi continua a presentare una legge con un nome inserendovi anche altri provvedimenti. Deve essere chiaro all'Esecutivo che chi fa queste cose non fa il bene del Governo stesso e del Paese, perché prende in giro i cittadini dicendo loro che l'immigrazione ha la stessa priorità del finanziamento degli enti pubblici, che l'IMU ha la stessa priorità degli ammortizzatori sociali, mentre ciascuno di questi elementi ha necessità di essere trattato per proprio conto.
2013-12-10	LN	CandianiStefano	Questo è il dibattito che viene ad essere mescolato e confuso in Senato. Allora, ci troviamo ad analizzare interventi che riguardano l'immigrazione, trascurando il fatto che, ad esempio, si parla con superficialità della crescita. Mi viene da ridere pensando al ministro Saccomanni che, ancora una volta, ci vuole far credere che il Paese sta uscendo dalla recessione. Chiunque gira sui marciapiedi, per le strade e nelle piazze, chiunque va a verificare che cosa accade in questi giorni nel Paese, si accorge che siamo nella più nera recessione. Con questo provvedimento raffazzonato, che mette insieme una cosa all'altra, non si riesce certamente a fornire risposta a quello che si aspetta il Paese, cioè concretezza.
2013-12-10	LN	ConsiglioNunziante	Il testo prevede alcune disposizioni che hanno la sola finalità di fare rientrare l'Italia nei parametri dettati dall'Unione europea con il contenimento del rapporto deficit -PIL entro il tanto agognato 3 per cento. Signor Presidente, dobbiamo ammettere che su questo il ministro Saccomanni è stato di parola, perché sul finire dello scorso settembre aveva anticipato l'intenzione di correggere il celeberrimo parametro per 0,1 punti percentuali di PIL (il che vale circa 1,6 miliardi). Come sono state trovate le risorse è oggetto della nostra contestazione, e qui - come si suol dire, Presidente - casca l'asino. Le risorse sono state reperite con gli ennesimi tagli agli enti locali, con un restringimento sui vincoli del Patto di stabilità interno dei Comuni e con restrizioni che significano oltre 400 milioni di nuovi limiti di spesa imposti agli enti locali, nonché risorse reperite con le dismissioni. È il periodo giusto, signor Presidente, per dismettere immobili e metterli in vendita! Gli effetti negativi dell'applicazione del Patto di stabilità sono noti a tutti: calo degli investimenti, riduzione della crescita, ingessamento delle amministrazioni locali. Mi chiedo se questa vi sembra un'operazione intelligente, se questa manovrina era una cosa da farsi. Per ridurre il rapporto deficit- PIL stringete ulteriormente i vincoli del Patto di stabilità, che è la causa principale del decremento del PIL con la conseguenza di un peggioramento dello stesso rapporto deficit- PIL. In attesa di capire da qualche vostro luminare il senso di questa lungimirante strategia, segnaliamo che nel provvedimento vengono stanziati 190 milioni per il superamento della gestione emergenziale dell'immigrazione iniziata nel 2011. Allora, poniamo una domanda, la rivolgiamo anche a noi stessi, perché non abbiamo ben capito: è possibile che nello stesso provvedimento vengano analizzati il Patto di stabilità interno e la disposizione in materia d'immigrazione? È una domanda che ci siamo posti, ma la risposta è stata semplice: è la vostra metodologia, quella che vi è più congeniale, visti i precedenti, come la celebre accoppiata tra IMU e occupazione, già in scena su questi banchi in un recente decreto. Questo precedente non presagiva niente di buono. Riuscite a spiegarci cosa c'entra la finanza locale, devastata tra l'altro dalle vostre imposte shock, con il fondo sugli immigrati? Questa è una domanda a cui non si è riusciti a dare una risposta. Signori colleghi, il presidente di Confindustria Squinzi ha lanciato un ennesimo grido che non è neanche più di allarme, ma è un grido di puro e limpido dolore. Denuncia il rischio di desertificazione industriale, gli enormi problemi ambientali e la drammatica situazione dei beni culturali. Da questi banchi ne era già uscita una grande polemica, per quanto riguarda la questione dei soldi che venivano dati a Pompei. Un grido che più volte abbiamo lanciato anche noi, come Gruppo Lega Nord e Autonomie. Signor Presidente, diamo agli imprenditori la possibilità di recitare sul palcoscenico dell'economia quel ruolo di attori protagonisti che li ha sempre contraddistinti negli anni trascorsi; un protagonismo che potranno svolgere appieno solo se saremo in grado di porli nelle migliori condizioni per operare sui mercati nazionali ed internazionali. Questo sarà possibile, chiaramente, se daremo loro strumenti semplici, regole certe, poca burocrazia ed energia a costi sempre più contenuti. Altro grandissimo problema sono le banche. Tra l'altro, si legge sui giornali di questi giorni che i soldi ci sono, li hanno, la liquidità c'è, ma che sarebbero addirittura i privati e le aziende a non farne richiesta. Se questo fosse vero, signor Presidente, sarebbe veramente la morte dell'economia, della libera imprenditoria, del commercio e dell'artigianato; insomma, signor Presidente, di tutto quel tessuto economico che riguarda le piccole e medie imprese, soprattutto quelle a conduzione familiare, che hanno messo questo Paese in condizione di uscire brillantemente da quarant'anni di guerra. C'è poi questa Europa, signor Presidente: 27 Paesi che si incontrano e a volte si scontrano, con interessi diversi, obiettivi diversi, prerogative e peculiarità diverse. L'unica cosa che hanno in comune è un euro che, da quanto ho capito, non è che vada bene poi a tutti. Questa è l'Europa che impone rigore e chiede stabilità. Questa è l'Europa che, con il suo vice presidente Olli Rehn, bada più ai punti decimali che alla gestione dell'economia reale dei vari Paesi. Signor Presidente, mi permetto di ricordare al Vice Presidente della Commissione europea e Commissario per gli affari economici e monetari che «per un punto Martin perse la cappa» per uno 0,1 per cento di PIL si sta ulteriormente strangolando un Paese che ha mille difficoltà. Torniamo però alla questione del fondo di 190 milioni. Di questo fondo nulla o poco si sa: a chi verranno erogati questi soldi, per quali attività e con quali obiettivi? Quali verifiche ci saranno, e chi saranno i soggetti che controlleranno l'effettivo utilizzo dei fondi? Senza considerare che, su 190 milioni, ben 95 (cioè il 50 per cento) costituiranno oneri per il personale; ma non è dato sapere con quale contratto il personale verrà assunto, come sarà scelto, per quanto tempo, e probabilmente neanche per fare cosa. Mentre voi trovate soldi per gli immigrati, il Paese affonda, tra aziende che chiudono e giovani che senza lavoro scappano all'estero. Visto allora che il Governo italiano dà i soldi ai non cittadini italiani che arrivano in questo Paese, ci auguriamo che anche gli altri Stati facciano altrettanto, quando i nostri vanno all'estero per cercare lavoro. Questa è una vostra disposizione, che noi non accettiamo e cui siamo assolutamente contrari, anche perché, come voi ben sapete, è assolutamente inutile. Una volta finite le risorse del fondo, cosa succederà? La chicca però, signor Presidente, stando alla relazione tecnica allegata al testo, è che parte di questo fondo verrà coperta finanziariamente con una riduzione delle risorse a favore delle vittime dei reati mafiosi. Una chicca, signor Presidente, una grande manifestazione di rispetto nei confronti delle famiglie colpite da delitti di mafia. Signor Presidente, a me pare che questo Governo si stia comportando come il piccolo di statura Zaccheo nel Vangelo secondo Luca. Sembra quasi, signor Presidente, che siate saliti anche voi sul sicomoro, per veder arrivare la ripresa, la luce, quella agognata luce in fondo al tunnel, come degli illusi fatalisti. Ma con questi atteggiamenti, signor Presidente, il Nord vi sta dicendo: «Scendi, io proprio da te stavo venendo, smetti di essere birichino, ridai il maltolto a quelli cui lo hai sottratto e ti salverai». E il Nord vi sarà molto grato, signor Presidente.
