2013-07-03	PD	CardinaliValeria	Nell'ambito della dimensione esterna dell'Unione, l'obiettivo di rafforzare il ruolo dell'Unione europea sulla scena internazionale è stato predominante, e l'esigenza è di parlare con una sola voce. A tale proposito, la risoluzione ONU sullo status rafforzato dell'Unione europea in senso all'Assemblea generale delle Nazioni Unite è stato un risultato per il quale il Governo italiano si è battuto. In tema di allargamento, il Governo ha lavorato per garantire un adeguato riconoscimento dei progressi negoziali registrati dai Paesi candidati, in particolare per la Serbia, il Kosovo e il Montenegro. E tutti quanti abbiamo salutato l'ingresso della Croazia nell'Unione europea qualche giorno fa. In tema di politiche europee di vicinato, in particolare con riguardo alla sponda Sud del Mediterraneo, l'Italia ha rimarcato la necessità di fornire risposte adeguate alle istanze espresse dai Paesi in cui si è verificata la cosiddetta primavera araba, dal punto di vista del sostegno politico ed economico, ma anche del portare a compimento partenariati privilegiati, con la definizione di nuovi piani di azione con Marocco, Tunisia, Egitto e Libia. Per quanto concerne la cooperazione allo sviluppo, come diceva il collega che mi ha preceduto, l'Italia è il terzo contribuente al bilancio dell'Unione europea e il quarto contribuente al fondo europeo di sviluppo. Ovviamente, da questo punto di vista l'iniziativa è specificatamente rivolta al raggiungimento di obiettivi di sviluppo del millennio entro il 2015, con un particolare focus sulla sfida storica rappresentata dalla primavera araba e sul nesso tra migrazione e sviluppo. L'Italia ha sostenuto molto l'azione dell'Alto rappresentante Ashton volto a rafforzare le relazioni con i Paesi terzi in materia commerciale. Sempre in materia commerciale, e considerate le specifiche caratteristiche del sistema produttivo e industriale italiano, allo scopo di tutelare le sue tante eccellenze, il Governo ha sostenuto con successo la necessità di pervenire ad accordi commerciali equilibrati, mutuamente vantaggiosi e ispirati al principio di reciprocità, che perseguano in maniera incisiva e contestuale sia gli interessi commerciali sia la tutela del sistema produttivo degli Stati membri. Quindi, non una chiusura e una tutela, ma anche la possibilità di sviluppo. In questo contesto, il Governo si è impegnato perché venisse raggiunta una soluzione di compromesso per l'adozione di una regolamentazione sulla etichettatura di origine di alcuni prodotti provenienti da Paesi terzi (il cosiddetto made in). In seguito alla decisione della Commissione di ritirare la proposta, l'Italia ha chiesto alla Commissione di valutare possibili soluzioni alternative e di fornire una analisi giuridica dettagliata per definire uno schema di etichettatura a tutela dei consumatori, della trasparenza sui mercati e della concorrenza leale, suscettibile di non essere considerato un ostacolo tecnico ma, anzi, uno strumento per contrastare l'uso fraudolento delle indicazioni di origine europea. È evidente che su alcune questioni si è andato avanti, perché questo è un consuntivo e, nel frattempo, è intervenuta l'azione svolta primi mesi del 2013. Nel settore della politica di sicurezza e di difesa comune, tramite le proprie Forze armate l'Italia è risultata nel 2012 il quarto Paese ad aver contributo per la lotta alla pirateria. Per quanto riguarda gli affari interni, l'Italia si è impegnata per le problematiche connesse all'immigrazione illegale, anche se, da questo punto di vista, dobbiamo riscontrare forti resistenze da parte degli Stati membri non direttamente coinvolti nella gestione delle frontiere esterne, soprattutto di quelle marittime dell'Unione europea. Nell'ambito delle politiche relative al mercato interno si è avviato un processo di revisione delle diverse discipline esistenti per la valutazione della compatibilità degli aiuti di Stato con le regole del Trattato. In tema di proprietà intellettuale, per quanto concerne la creazione del brevetto europeo (di questo tema abbiamo parlato lungamente con il Ministro, e sono state poi anche fornite indicazioni). Italia e Spagna avevano presentato un ricorso alla Corte di giustizia sulla modalità di utilizzo della cooperazione rafforzata. Ma - a questo non è riportato nella relazione, perché è accaduto dopo, ma ovviamente ne diamo comunque contezza - il 16 aprile 2013 la Corte si è espressa nel senso del rigetto di questo ricorso. Occorre quindi valutare se aderire al sistema di brevetto europeo, oppure come andare avanti. Nell'ambito delle politiche sociali, l'iniziativa-faro è costituita dalla Piattaforma europea contro la povertà e l'emarginazione. Il Senato, in particolare, sta lavorando e producendo proposte, perché questo fenomeno colpisce in particolare la fascia di età minorile. Nel settore dell'istruzione si è lavorato per enfatizzare il ruolo dell'educazione come strumento della Strategia Europa 2020 e sull'esigenza di modernizzare l'istruzione superiore attraverso cinque direttive politiche, sulle quali autorità nazionali e istituti di istruzione superiore stanno lavorando e si confrontano. Così come per la cultura, dove si è lavorato molto per rendere il tema della diversità culturale e l'accesso alla cultura un tema predominante, anche attraverso la promozione di partnership creative. Nel settore del turismo, interessante è la prospettiva dell'istituzione di un marchio di qualità europeo, che si propone di aumentare la fiducia e la sicurezza dei consumatori nei prodotti turistici e di premiare gli sforzi dell'industria per offrire servizi di qualità. Sulla sanità i temi affrontati hanno riguardato non soltanto la libera circolazione nella somministrazione delle prestazioni dei sanitari, ma è stata anche rivolta attenzione alle gravi minacce per la salute a carattere transfrontaliero, rispetto cioè a come muoversi eventualmente in situazioni di questo tipo. In materia di tutela dei consumatori si segnala l'approvazione da parte del Consiglio, in data 11 ottobre 2012, di una risoluzione sull'agenda europea del consumatore che dovrebbe quindi portare a una proposta di regolamento volta a risolvere le controversie on line, con l'obiettivo di snellire la burocrazia e di portare al regolamento delle controversie on line. L'attività di ricerca e sviluppo presenta a mio avviso un dato molto interessante, perché uno dei limiti che si può riscontrare è legato allo scarso utilizzo dei finanziamenti presenti in alcuni settori, ciò è dovuto a mille motivi, alcuni dei quali proverò a spiegarli. Nell'attività di ricerca e sviluppo, il pacchetto legislativo Horizon 2020 mette a disposizione circa 80 miliardi di euro per il periodo 2014-2020 con l'obiettivo di raggiungere il 3 per cento del PIL entro il 2020 e di potenziare la competitività globale del sistema Europa. Quello delle politiche ambientali ed energetiche è un altro dei settori molto importanti su cui si è lavorato e anche questo Parlamento sta ponendo una grande attenzione, per promuovere in sede europea la transizione verso un'economia verde e l'adozione, nel perseguimento di politiche ambientali, di un approccio integrato con aspetti sociali ed economici, quindi non più a compartimenti stagni ma secondo un ragionamento più complesso che utilizza sostanzialmente tre pilastri di riferimento (obiettivi al 2020 emissioni al 2050, migliorare la legislazione ambientale e transizione verso un'economia verde), dando priorità al raggiungimento di un mercato unico dell'energia per riuscire quindi ad avere lo stesso trattamento tra regolazione di fonti rinnovabili e tradizionali. Mi avvio a concludere sul tema delle politiche di coesione, su cui c'è un grande lavoro ma su cui si rileva anche un neo. Alla fine del 2011 è stato adottato un piano di azione e coesione rafforzato nel dicembre 2012 con altre due fasi. Esso ha riprogrammato 3,5 miliardi di euro di fondi strutturali gestiti dalle Regioni su quattro priorità: istruzione e formazione, occupazione, infrastrutture ferroviarie, agenda digitale. Successivamente, a dicembre, sono state riconfermate e varate due fasi che mettono a disposizione 2,9 miliardi, la prima, e 5,7 miliardi, l'altra, per materie legate a inclusione sociale, crescita e competitività, con l'attenzione al peggioramento della situazione giovanile (sappiamo infatti quanto anche il premier Letta abbia posto l'accento e stia lavorando su questo), anche per aiutare le imprese e il lavoro. A tale riguardo dobbiamo tuttavia rilevare uno scarso accesso a questi fondi, a fronte invece di una contribuzione importante al bilancio europeo. Ciò è dovuto in parte all'eccessiva burocratizzazione, in parte al tema connesso al Patto di stabilità interno (oggi abbiamo letto una notizia positiva in tal senso), sul quale va a gravare il cofinanziamento delle Regioni e degli enti, e in parte alla difficoltà anche nella formazione e nella capacità di progettare. Quindi su questo punto vi è anche un invito a migliorare. Nella relazione consuntiva troverete inoltre tutti gli allegati che forniscono indicazioni molto particolareggiate.
2013-07-08	LN	CandianiStefano	Anche in questa occasione, lo ribadiamo: attenzione, perché la politica dell'immigrazione incontrollata che viene applicata in Italia finirà per causare problemi al resto dell'Europa, ottenendo come risultato finale un prevedibile isolamento di questo Paese.
2013-07-08	LN	CandianiStefano	Tra le questioni sul tavolo a livello europeo spicca certamente quella del contrasto all'immigrazione clandestina e della gestione dei flussi migratori. Su questo fronte chiediamo un impegno forte al Governo nel dare concreto seguito alla risoluzione approvata dal Senato, perché l'Italia non può essere lasciata sola dall'Europa di fronte a questo problema.
2013-07-16	M5S	PagliniSara	Ammettiamo che abbiamo fatto un salto sulla sedia quando abbiamo letto dove volete prendere i dieci milioni per prorogare i contratti ai dipendenti operanti agli sportelli dell'immigrazione. Li volete prendere al fondo per la solidarietà alle vittime delle mafie? Accipicchia! Neanche Superciuk, che rubava ai poveri per dare ai ricchi, sarebbe stato più diabolico!
2013-07-16	PD	AngioniIgnazio	Tornando al provvedimento, vengono reimpegnate le risorse già destinate ai contratti di solidarietà e non ancora spese, con oltre 57 milioni; si autorizzano poi le pubbliche amministrazioni a prorogare fino al 31 dicembre 2013 alcuni contratti di lavoro subordinato a tempo determinato nella pubblica amministrazione. Inoltre, con un emendamento al decreto presentato alla Camera dei deputati, si consente la proroga di alcuni contratti di lavoro a tempo determinato del personale educativo e scolastico operante negli asili nido e nelle scuole dell'infanzia degli enti comunali. Infine, viene prorogato al 31 dicembre 2013 il termine dei contratti di lavoro a tempo determinato in scadenza il 30 giugno 2013 dei lavoratori impiegati presso gli Sportelli unici per l'immigrazione delle prefetture, Uffici territoriali del Governo, e presso gli Uffici immigrazione delle questure. Queste sono, in sintesi, le misure del Governo contenute all'articolo 4.
2013-07-16	PD	DiGiorgiRosaMaria	«La Commissione programmazione economica, bilancio, esaminato il disegno di legge in titolo, - preso atto delle precisazioni del Governo circa l'adozione di un criterio prudenziale rispetto alla quantificazione della copertura di cui all'articolo 1, comma 4, del testo del decreto-legge, in particolare con riferimento alla prefigurazione del costo di accesso alle anticipazioni di tesoreria nell'ipotesi, pur improbabile, che vi accedano tutti i Comuni; - preso, altresì, atto che l'utilizzo degli avanzi di amministrazione consentito dal comma 2- bis dell'articolo 1 non pregiudica le ulteriori somme non vincolate ed il cui utilizzo risulta vietato dall'articolo 187, comma 3- bis del TUEL (d.lgs. 267/2000); - preso infine atto che il Governo ha assicurato la disponibilità delle risorse necessarie per la proroga dei contratti di lavoro a tempo determinato relativi alle esigenze delle Prefetture e delle Questure in materia di immigrazione esprime, per quanto di propria competenza, parere non ostativo, con la seguente osservazione: - l'utilizzo delle risorse del Fondo di coesione e sviluppo e di quelle relative al Trattato di amicizia italo-libico, di cui all'articolo 4, comma 1, trattandosi di risorse di conto capitale, comporta una dequalificazione della spesa». «La Commissione programmazione economica, bilancio, esaminati gli emendamenti relativi al disegno di legge in titolo, trasmessi dall'Assemblea, esprime, per quanto di propria competenza, parere contrario, ai sensi dell'articolo 81 della Costituzione, sugli emendamenti 1.11, 1.12, 1.13, 1.17, 1.18, 1.19, 1.20, 1.21, 1.22, 1.24, 1.25, 1.26, 1.27, 1.28, 1.29, 1.30, 1.31, 1.32, 1.34, 1.36, 1,40, 1.41, 1.42, 1.43, 1.44, 1.45, 1.46, 1.47, 1.48, 1.49, 1.200, 1.201, 1.202, 1.203, 1.0.3, 2.1, 2.2, 4.1, 4.2, 4.3, 4.4, 4.5, 4.6, 4.7, 4.8, 4.9, 4.10, 4.11, 4.12, 4.16, 4.17, 4.19, 4.20, 4.21, 4.22, 4,23, 4.24, 4.25, 4.30, 4.31, 4.32, 4.33, 4.34, 4.36, 4.200, 4.201 e 4.0.200. Il parere è di semplice contrarietà sulle proposte 1.0.200 e 4.26. Non vi sono osservazioni sui restanti emendamenti».
2013-07-17	LN	DivinaSergio	Signora Presidente, vorrei portare all'attenzione dell'Assemblea un caso che angoscia un paese, anzi direi una vallata, oltre che una famiglia. Il caso riguarda un siriano che ha ottenuto asilo politico e i suoi atteggiamenti nei confronti di una minorenne che vive in una località della Valsugana. Il ragazzo importuna sistematicamente questa minore, ottiene una condanna, il giudice ne ordina l'allontanamento da quella zona, ma il ragazzo persiste e ritorna nel paese. Nonostante abbia un foglio di via, egli continua a perseguitare questa ragazza: il suo obiettivo è quello di sposarla e portarla - a detta sua - nel suo Paese d'origine, cioè la Siria. Ottiene una prima condanna a otto mesi per questo atteggiamento persecutorio. Il comportamento viene reiterato; ottiene una seconda condanna; finisce di nuovo in carcere per altri tre mesi; ottiene infine un terzo arresto per altri e ulteriori tre mesi. Per questa famiglia, non occorre dirlo, è un autentico incubo. Il ragazzo, scarcerato per la quarta volta, viene sorpreso nascosto nel giardino della ragazza con l'intento di spiarla. I carabinieri, interpellati, dicono che non ci sono i presupposti per un arresto. Il ragazzo continua a dire (è la sua minaccia): Me lo suggerisce il mio Dio, la devo portare in Siria per sposarla». Vengono recapitate a mano lettere in serie che, oltre a significare la persistenza, denotano anche che la mano che imbuca o è la sua o addirittura quella di un complice. Avendo trattato la materia recentemente, sappiamo che il 10 per cento dei femminicidi è normalmente anticipato da atti persecutori di questo tipo. La famiglia è disperata. Il 25 maggio il soggetto ritorna in libertà, ma il copione è sempre lo stesso: i carabinieri lo accompagnano alla stazione, però dopo due ore di fermo lo devono liberare. La famiglia è distrutta, anche perché ha speso un'infinità di risorse per pagare gli avvocati senza ottenere alcun provvedimento. La figlia si ammala, viene addirittura ricoverata per crisi nervose; le assenze prolungate ne compromettono anche l'anno scolastico. Il soggetto si è ripresentato e oggi si trova in carcere, ma adesso le sue minacce sono più pesanti, in quanto - come è riportato sui giornali di oggi - avverte che farà saltare loro la casa, se non gli verrà concesso quello che sta chiedendo. Su questa vicenda si incrociano più problematiche: immigrazione, situazione dei rifugiati, reati (in questo caso, lo stalking ), Trattato di Istanbul, violenza sulle donne. Il caso non si sta risolvendo. Serve un interessamento forte del Governo, che deve assumere tutte le iniziative del caso. Dobbiamo ridare serenità a questa famiglia e sicurezza a questa ragazza, ma anche a tutta la Valle, che aspetta si faccia giustizia e chiede sicurezza e una presenza effettiva dello Stato.
2013-07-18	LN	CrosioJonny	Servono idee, Ministro, volontà e risorse per quello che non può e non deve restare un problema esclusivamente italiano. Ministro, alla luce di queste considerazioni e di altrettanti ben conosciuti problemi, non le sembra prematuro proporre una nuova legge sulla cittadinanza in maniera frettolosa e ben oltre quanto in maniera uniforme, nella giusta misura avviene nel resto dell'Europa? Siamo convinti che nel nostro Paese esistano le condizioni per proiettarci addirittura al di là delle leggi e delle regole adottate dai nostri partner europei? Lei è convinta, ministro Kyenge, che la soluzione dei problema passi attraverso la legge sullo ius soli ? Noi crediamo di no. Il Presidente del Consiglio, nella presentazione del programma di Governo, ci ha spiegato il significato della sua nomina. Sono le sue parole: «Una nuova concezione di confine, da barriera a speranza, da limite invalicabile a ponte tra comunità diverse». Ministro, noi crediamo che questo processo di integrazione che amiamo definire naturale, magari con delle imperfezioni, sia già in corso nel nostro Paese. Noi dobbiamo salvaguardare, però, una condizione fondamentale e necessaria: le leggi. Le norme che regolano questo processo non vanno stravolte nel nome di una politica sommaria e qualunquista, figlia di false ideologie politiche, ma vanno modulate con criterio per il bene del Paese e dei suoi cittadini. Non cadiamo nell'errore di pensare che con una sola legge si possa accelerare il processo di integrazione, escludendo le criticità esistenti e le difficoltà conosciute. Così metteremo solo la testa sotto la sabbia, mettendo a rischio il naturale processo di integrazione in corso. Ministro, i cittadini non devono essere trascurati e quelli che lo vogliono diventare non devono essere illusi. In conclusione, Ministro, il suo Dicastero non avrà il nostro sostegno. Esprimeremo un voto di astensione. La politica di immigrazione in corso va migliorata, va modulata con le analisi e le riflessioni che abbiamo voluto oggi sottolineare, ma noi vogliamo offrirle di meglio, ministro Kyenge: le proponiamo la nostra collaborazione, certamente critica ma leale e costruttiva. Le portiamo in dote l'esperienza di centinaia di sindaci che quotidianamente, con il buonsenso del padre di famiglia, fanno vera integrazione (escludiamo quei pochi inadeguati a questo ruolo). Questa dote, come la storia del nostro Paese, diventi modello di riferimento per un problema riconosciuto e condiviso, a prescindere dalle nostre origini.
2013-07-18	LN	CrosioJonny	Signor Presidente, onorevoli colleghi, ministro Kyenge, il nostro auspicio è che quella odierna possa diventare l'occasione per dibattere, con i toni del buon senso, non della necessità di un sostegno al suo Dicastero, ma per un ragionamento costruttivo e leale sull'importante e a volte scomodo tema dell'immigrazione e dell'integrazione. Ministro Kyenge, rivolgermi a lei mi risulta estremamente naturale, per un motivo molto semplice: la mia storia personale è molto simile alla sua storia. Come tanti in questo Paese, sono figlio di quella generazione di italiani che, alla fine degli anni Cinquanta, con la famosa valigia di cartone, hanno lasciato il nostro Paese in cerca di un lavoro e di un futuro migliore in tutta Europa e nel resto del mondo. I nostri padri hanno lavorato faticosamente, a testa bassa, contribuendo in maniera determinante, in tutti i Paesi europei, alla ricostruzione e alla ripartenza dopo il disastro del secondo conflitto mondiale. Tempi trascorsi, probabilmente. Perché le sto dicendo questo, Ministro? Per un semplice motivo: questo è uno dei modelli di riferimento che può servire, nelle parti buone e in quelle meno buone, per affrontare i temi dell'immigrazione e dell'integrazione. Procediamo con ordine. Noi pensiamo che in questo momento di congiuntura economica gli sforzi del Governo e le energie del Parlamento andrebbero concentrati a garantire ai cittadini italiani il superamento di questa crisi devastante. Oggi sono 8.814.000 le persone che nel nostro Paese vengono considerate in povertà assoluta: non riescono ad acquistare beni e servizi essenziali per una vita dignitosa (secondo fonti ufficiali ISTAT di ieri). Oggi garantire una vita dignitosa a tutti i cittadini italiani e stranieri regolari è e deve restare la mission politica di tutte le forze politiche. Mi chiedo e le chiedo, Ministro: è forse sbagliato cercare di garantire a tutti i cittadini che risiedono nel nostro Paese una vita dignitosa per loro e per i loro figli? Assolutamente no. Chiunque di noi abbia fatto l'amministratore locale ha contributo a questo processo, e lo ha fatto per tutti i cittadini, indipendentemente dalla loro nazionalità, dalla religione e dalle proprie convinzioni politiche. In migliaia di comuni nel nostro Paese convivono serenamente donne e uomini di razza e cultura distinte nell'origine, ma identiche nella quotidianità. Quali sono le condizioni che favoriscono questo processo? Regole: norme e leggi che regolano, appunto, un Paese civile; leggi e norme che ogni Paese civile, soprattutto democratico, adotta e applica per il suo stesso bene. Ma sono soprattutto il buonsenso e il forte senso civico dei sindaci e degli amministratori locali a favorire quello che si può definire il naturale processo di integrazione. Allora, dove nascono i problemi? Nascono quando forze politiche irresponsabili, mascherando dietro false ideologie i propri progetti politici, minano e cercano di compromettere quello che definiamo il naturale processo di integrazione. E lo compromettono trascurando i cittadini, ma soprattutto illudendo uomini e donne che, come noi a suo tempo, guardano ad altri Paesi nella speranza di un futuro migliore. Illuminati o presunti tali leader politici, oltre ad alte cariche istituzionali, rappresentano in maniera distorta l'immagine del Paese rafforzando l'idea che in Italia tutto si può e tutto si può avere, a prescindere dalle regole e dalle norme. Noi crediamo che siano degli irresponsabili. Infatti, Ministro, non c'è limite a questa ipocrisia e l'esempio di questi giorni, che ha visto una delle più alte cariche dello Stato proporre una casa certa per tutti i rom, è un passo falso istituzionale ed è una cecità civica. Ministro Kyenge, noi vogliamo sinceramente credere alla sua buona fede, ma siamo altrettanto convinti che nel nostro Paese forze politiche faziose stanno cercando di tradire la sua buona fede e quella degli italiani solo per il proprio tornaconto personale e quello di partito. Ministro Kyenge, favorisca il naturale processo di integrazione, ascolti i territori: lì veramente può trovare l'affermazione dei suoi convincimenti. Ma i problemi, purtroppo, Ministro, hanno anche altre origini, ben più complesse e complicate. Gli sconvolgimenti in atto nel Nord Africa aggravano una situazione già difficile e a tal proposito, ministro Kyenge, le facciamo una proposta: vuole veramente fare qualcosa per il nostro Paese? Vada in Europa, faccia la voce grossa; vada in Europa con autorevolezza, metta l'Europa davanti alle proprie responsabilità, chieda all'Europa di onorare gli impegni presi con il nostro Paese, dica all'Europa di smettere di guardare altrove, mentre nel Mediterraneo la gente è in balia degli eventi, lasciata al proprio destino.
2013-07-18	PD	CorsiniPaolo	Il termine immigrazione, di per sé, rimanda alla categoria della diversità e, soprattutto, al clima di sospetto che da sempre agita il confronto e lo scontro con l'immigrato, per cui l'altro è o diventa, non di rado, il nemico. Ma come accade questo? Come accade, cioè, che l'altro diventi nemico? La metamorfosi dell'alterità nella oppositività conflittuale vede allignare la propria radice nell'esercizio aprioristico e, in certo modo, spontaneo del sospetto: il sospetto che l'altro sia negativo per me, prima ancora che egli si sia rapportato realmente a me. In fondo, il sospetto contiene già la decisione che l'altro sia il negativo per me; quindi, l'esercizio del sospetto, in altri termini, rimanda a una sorta di pregiudizio, di pre-comprensione in cui l'altro è vissuto come nemico. In effetti, l'altro si presenta a noi con i tratti del diverso. I tratti del diverso, però, trapassano con grande facilità nei tratti dell'opposto quando il diverso ci pare minaccioso. E il diverso ci pare minaccioso soprattutto quando la nostra identità non tollera che esista altro oltre a sé, cioè quando, in modo più o meno inconscio, tende a totalizzare il senso.
2013-07-18	PD	CorsiniPaolo	Ora, anche alla luce degli avvenimenti che hanno coinvolto la signora Ministro, vorrei entrare nel cuore di un nodo irrisolto della convivenza civile in questo Paese che è costituito dal fenomeno della immigrazione.
