2022-01-05	CON	AlexanderJohnson	Yes. I do not recognise the account that my right hon. Friend has given: we do not do free trade deals on that basis. Indeed, I can tell him that since we took back control, net immigration has gone down—[Interruption.] That is all the Opposition want—their answer is, everywhere and always, uncontrolled immigration. That is their approach to the economy, and it is not the right way forward. That is why our Nationality and Borders Bill, currently in the House of Lords, is so important—it will enable us to take back control of our borders properly and to tackle illegal immigration. What would be good would be to hear some support from the Labour Benches.
2022-01-05	CON	EdwardLeigh	Apparently the Government are thinking of relaxing visa controls for India in order to get a free trade deal. While a free trade deal is valuable in itself, we should not be held to ransom. Does the Prime Minister agree that our new working-class voters who voted for Brexit did not vote to replace immigration from Europe with more immigration from the rest of the world, any more than that when they were told that we would take back control, we would lose control of the channel? Will he convince us that he is determined to connect to our supporters and control immigration?
2022-01-06	CON	JacobReesMogg	Since the joint intelligence centre was established in July 2020 we have, with France, dismantled 17 small boat organised crime groups and secured over 400 arrests. UK immigration enforcement has secured 67 convictions of the criminals driving small boat crossings since January 2020, resulting in sentences totalling over 54 years. Our Nationality and Borders Bill will give us more powers, including being able to do things like check people’s age so we know the facts when people claim asylum, which should make our system firmer and fairer.
2022-01-06	CON	SueEllenBraverman	To be clear, the UK prides itself on its leadership within the international system and the fact that it discharges its international obligations in good faith. The Nationality and Borders Bill brings in vital changes to enable this Government, and our immigration and Border Force operatives, to stop the illegal and dangerous trafficking of illegal migrants. I encourage everybody in this Chamber to get behind this vital Bill and support it.
2022-01-06	CON	VictoriaAtkins	Again, I hope the hon. Gentleman will appreciate that I cannot analyse 200 cases off the cuff at the Dispatch Box. The ACRS has now been launched and the ARAP scheme was launched some time ago, and assessments are being conducted to refer eligible people to those schemes. The family reunion rules are set out in the immigration rules, and we are working with third countries and other international partners where we can to try to secure routes outside of Afghanistan to the United Kingdom.
2022-01-06	CON	VictoriaAtkins	I know that this is an issue that is concerning many of our constituents. We have the safe and legal routes under the new plan for immigration, of which the ACRS and ARAP are a part. The family reunion rules will continue to apply, but I appreciate the difficulty that some are having in relation to still being in Afghanistan. That is why the work being done by the Minister for the Armed Forces, my hon. Friend the Member for Wells (James Heappey), is so important. It is through working with countries and regions that we will, I hope, be able to find other routes out, but we must emphasise to those individuals in Afghanistan that they will have a far better evaluation of their own safety and what they need to do to keep safe than I, sadly, can offer from the Dispatch Box today.
2022-01-06	CON	VictoriaAtkins	In relation to the first question, as I say, I am in the hands of my ministerial colleagues in the Ministry of Defence and the FCDO as to what can be done internationally, but the family reunion rules are as set out in the immigration rules. On trying to accommodate people in bridging accommodation close to their families—I think that was the right hon. Gentleman’s question—we are doing our level best, but I hope he and others will understand that, because of the scale of the evacuation and all the factors we have heard about, there are many factors we have to take into account, including the size of families, which we cannot always accommodate as quickly as we would like.
2022-01-06	CON	VictoriaAtkins	Ninety-seven per cent. of evacuees are registered with GPs and everyone has been offered covid vaccinations. We have launched a brand-new housing portal on gov.uk for members of the public to offer accommodation. We are working with the regulators and professions to assess and recognise Afghans’ qualifications, especially in sectors that need recruits, such as teaching and healthcare. We have made it easier for local community groups to support Afghans through the community sponsorship scheme, which will begin welcoming Afghan families later this month. We have developed a new integration programme tailored to the needs of this traumatised group of people, which has been piloted and which we will be rolling out shortly. We are also creating, from scratch, a new approach to employment, housing and integration to help Afghans to become self-sufficient as quickly and as well as they can. This is the new plan for immigration in action. I have always acknowledged that resettling such large numbers of people well will take time and demands care. I therefore urge colleagues across the House to work with their councils and communities to help us to build bright futures for our new Afghan citizens. I commend the statement to the House.
2022-01-06	CON	VictoriaAtkins	On ARAP, I believe the Minister for the Armed Forces, my hon. Friend the Member for Wells (James Heappey), used the phrase “necessary housekeeping.” We had to clarify the rules and eligibility criteria to remove uncertainty on who qualifies. By making it clearer for those who think they might be eligible, there will be more consistent decision making. Spouses and partners, along with children under the age of 18, will qualify as ARAP dependants under the immigration rules and will be eligible for relocation if the lead applicant is successful.
2022-01-06	CON	VictoriaAtkins	Today, I am pleased to inform the House that the Afghan citizens resettlement scheme opens formally. We will resettle up to 20,000 people under the scheme. I emphasise that it is in addition to the Afghan relocation and assistance policy, which provides a route to safety for any current or former locally employed staff working with the UK Government. About 7,000 people have already been helped through that scheme alone. The United Kingdom therefore has one of the world’s most generous humanitarian offers to vulnerable Afghans. This is the Government’s new plan for immigration in action, through which we help those in greatest need via that safe and legal route
2022-01-12	LAB	SarahChampion	I have raised the matter on multiple occasions with UK Visas and Immigration, but again, replies have not been forthcoming. My constituent was told that a decision was made on 20 December, and UKVI confirmed that to me, but she has still not been told what the outcome is. It completely ruined Christmas and new year for her and her children. I have chased up the case repeatedly, but I cannot get that decision. This is torture for my constituent. Madam Deputy Speaker, can you provide guidance on what I can do, what mechanisms are available to me, to get that decision, so that this woman can have some peace in her life?
2022-01-12	LAB	SarahChampion	On a point of order, Madam Deputy Speaker. My constituent, a survivor of child abuse, has worked with the National Crime Agency during recent prosecutions, but she has been waiting since July for a decision on a family permit application to the EU settlement scheme. I wrote to the Under-Secretary of State for the Home Department, the hon. Member for Torbay (Kevin Foster), who is the Immigration Minister, on 2 November, but have not received a reply
2022-01-13	CON	ScottBenton	The Nationality and Borders Bill is a crucial step forward to preventing illegal immigration and abuse of our asylum system, but the Home Office clearly cannot solve the problem on its own. Will my right hon. Friend update the House on cross-departmental efforts to stop small boats crossing the channel?
2022-01-13	LAB	SarahOwen	I am sure that many Members present have experienced the never-ending struggle of trying to get a timely response from the Home Office. In Luton North, we have hundreds of cases that have exceeded the 20 working day response time. It is simply not good enough, especially for those waiting on immigration and asylum cases who want to get on with their lives—they want to get jobs, feel safe and contribute to our society. I would ask for a debate, but what I really want is some answers for constituents.
2022-01-17	CON	KevinFoster	I have to point out to my hon. Friend that extending visas beyond six months comes with issues such as payment of the immigration health surcharge and the requirement to issue a biometric residence permit, where appropriate. There are some quite considerable issues with the request, but I am always happy to talk to him about how we can support the businesses in his constituency, and I would point out that visas are already not restricted to working at one farm.
2022-01-17	CON	KevinFoster	To be clear, the wider immigration system obviously operates separately from the Afghan citizens resettlement scheme, but we are carefully considering what the requirements are, and not least how we can ensure people can actually access the system to make applications because, as the hon. Gentleman will appreciate, for obvious reasons we cannot run our usual application centre that we would have in Kabul given the Taliban’s control of the territory.
2022-01-17	CON	PhilipDavies	If everyone is agreed that the channel crossings are so dangerous, we must clearly do whatever is necessary to stop them. Surely the quickest way to stop them is simply to turn the boats back and escort them back into French waters. I do not think it would take long for the word to get around that these crossings were futile. Has not the time come to do just that, on humanitarian grounds as well as to protect our borders from illegal immigration?
2022-01-17	CON	PritiPatel	I absolutely disagree with the right hon. Lady’s question. Had she read the new plan for immigration—the policy statement published for the benefit of all Members in March 2021—she would know that this Government are considering all options for outsourcing processing and for removing people with no legal basis to be in our country. I completely recognise that she disagrees with the policies of this Government—[Interruption.] It matters not which countries. We will continue to discuss this with a range of countries, because I, as Home Secretary, and this Government are determined to fix the decades-long problem of a very broken asylum system. Frankly, under successive Labour Governments there were mass failures to remove people with no legal basis to be in the country.
2022-01-17	CON	PritiPatel	I always enjoy the hon. Gentleman’s contributions. As we saw on Report and Third Reading of the Nationality and Borders Bill, the Scottish National party choose to deploy political gimmicks—I am being kind to the SNP—to frustrate the will of the public when it comes to reforming asylum and illegal migration. It is fair to say that the Conservative party in government, through the Nationality and Borders Bill and the new plan for immigration, will do everything possible to tackle the unscrupulous exploitation of people who cross illegally and will provide sanctuary to those who need our help and support—those fleeing persecution who need refuge. Frankly, when local authorities in Scotland are not even helping to accommodate these people, I take no lectures from the Scottish National party.
2022-01-17	CON	PritiPatel	My hon. Friend is absolutely right. That is why this Government are unapologetic for the fact that we now have the Nationality and Borders Bill and the new plan for immigration. We are operationalising these changes primarily because we need a system that is firm but also fair to those who need genuine help when fleeing persecution and claiming asylum. That is effectively what this Government are doing.
2022-01-17	CON	PritiPatel	My right hon. Friend’s question is an important one because, as all hon. Members will be well aware, I asked for MOD naval assets and support back in 2020, because no Department can resolve the complex issue of channel crossings on its own. It is also right, having called for MOD involvement, that we now bring the whole machinery of government, the ultimate utility, together to ensure that we work collectively to protect our borders. My right hon. Friend is right about the wider issues on immigration, and that is why we have the new plan for immigration.
2022-01-17	CON	PritiPatel	The Nationality and Borders Bill was overwhelmingly backed by elected MPs and is now being debated in the other place. Ahead of its Royal Assent, I am operationalising new changes on disrupting and deterring illegal migration, in line with the new plan for immigration which, as the House knows, was announced and published last week. We continue to work with our French counterparts. Law enforcement has achieved 67 small boats-related prosecutions since the start of 2020; we have dismantled 17 small boat organised criminal groups and secured more than 400 arrests
2022-01-17	CON	PritiPatel	We could rerun the debate on the Nationality and Borders Bill, which I would happily do. This Government are determined not just to reform what is a broken asylum system—we are lifting up every aspect of the dysfunctionality of the system—but to tackle the root causes of illegal migration. In March 2021 the new plan for immigration was published, and we had the Nationality and Borders Bill in this House last autumn. The Opposition seem to be on the wrong side of the argument. They do not really want to support an end to illegal migration or stop the people smugglers.
2022-01-17	CON	ThomasPursglove	I am grateful to my hon. Friend, who raises an important point. It is fair to say that the Nationality and Borders Bill and the new plan for immigration focus very much on returning those who have no right to be here, while ensuring that those who require our protection and are genuinely in need of support do get that support as quickly as possible.
2022-01-17	CON	ThomasPursglove	Our new plan for immigration will overhaul our asylum system and speed up the removal of failed asylum seekers. The Bill will introduce new measures to prevent repeated last-minute, meritless claims that are designed to frustrate proper removal. We are determined to return people who have no right to be here and arrive in the UK illegally.
2022-01-17	LAB	MohammedKhan	The Conservatives say that the asylum system is broken, but having been in power for more than a decade, the truth is that they are the ones who broke it. Asylums seekers are some of the most vulnerable individuals. The Greater Manchester Immigration Aid Unit revealed the emotional and physical trauma they experience—the anxiety, insomnia, self-harm, depression, deterioration of relationships with friends and support staff and reduced engagement with vital services. How has the Home Office’s ability to make initial decisions been allowed to collapse so completely under this Government? What steps will the Minister take to intervene to ensure the situation is addressed with urgency?
2022-01-18	CON	JamesHeappey	The Chief of the Defence Staff has been involved in all the conversations. As I have made clear, we should not be dismissive of the importance of securing our borders, not only from an immigration perspective but from a national security perspective. Migration is being used as a subthreshold weapon of competition elsewhere in Europe, and it cannot endure that our border is not properly secured
2022-01-18	CON	MartinVickers	Any of my constituents watching these exchanges will note the comments of Opposition Members who are trying to pour cold water on a plan that my constituents actually want. They want to see an end to this cross-channel illegal immigration, and they will also be disappointed to hear from the Minister that plans are not yet finalised, because hints and announcements have been made about the use of the Navy for many months—years, probably—and our military are adept at putting together plans quickly to respond to emergency situations. Can the Minister at least give my constituents some hint of when a robust policy will be in place and the Navy will be involved?
2022-01-20	CON	RobertSeely	I will not go on for too much longer, but I will raise just a couple of other points, if I may. There is a second element here that is critical, which is the intimidation, using data protection laws, of people who are doing due diligence work on our behalf as civil servants. We have seen that ENRC, as part of its wave of lawsuits, has started proceedings against the Serious Fraud Office, or was threatening to do so. I understand that threats of judicial review have also been made in relation to decisions made by the Department for Business, Energy and Industrial Strategy and by the Special Immigration Appeals Commission. We are getting into very serious territory when the functioning of Government, as well as the exposing of truth—and, dare I say, concepts such as justice—is being severely hammered and severely damaged
2022-01-24	CON	AlexanderBeresford	Finally, the hon. Gentleman mentioned dentists coming in from overseas. Those in the Commonwealth, new and old, will now be in a position to come here, once the immigration Bill is through and the General Dental Council gets the slight change in legislation it needs to bring the dentists in. They will come here, because this is an attractive area to work in national health, privately and in research.
2022-01-25	CON	MarcoLonghi	There is no area of the law that allows individuals, families, local government, business and so on to have more than two bites of the cherry in court—with one exception, namely illegal immigration appeals. That is another reason why the Opposition disagree with the Bill: because they are quite happy for the country to continue being a magnet for illegal immigration. When challenged in Committee, not once did an Opposition Member explain why illegal immigration should benefit from a third bite
2022-01-25	CON	NicholasFletcher	It is difficult to defend the UK’s immigration system to my constituents as fair and effective when they see in the news that hundreds of people arrive via the channel every week, yet the processes that we have in place seem to allow anyone to stay, regardless of how well-founded any claim is. The message that they are getting is that it does not matter whether someone is a genuine refugee: as long as they are prepared for a protracted legal battle, with legal aid at the taxpayer’s expense, they can stay for years, if not indefinitely. As I know from my casework, that does not incline my constituents to see all asylum applicants as potential refugees; on the contrary, it leads them to see all asylum applicants as willing to abuse the legal system. That perception may not be well founded, but it is understandable
2022-01-25	CON	NicholasFletcher	My main point is about Cart JR. It is a question of court resources, but it also relates to an issue about which my constituents frequently contact me: immigration. Most judicial reviews against the upper tribunal relate to immigration cases. I understand that some cases are quite complex, but others appear to be no more than an abuse of the judicial process through endless, meritless appeals. As the Justice Secretary has noted in previous debates on the Bill, the success rate is hardly above 3%—an appalling statistic
2022-01-25	LAB	AndrewSlaughter	In Committee, we objected to clause 2 both because of the nature of the cases subject to the Cart jurisdiction, which are primarily, but not exclusively, immigration and asylum cases, and because, on the Government’s own admission, it is designed to set a precedent for future employment of ouster clauses, which they clearly intend to become a more common feature of legislation. That is another attempt to subvert the authority of the courts. Unlike with clause 1, there is little that could be done to improve clause 2—you either like it or you don’t. Therefore, most commentators who are concerned by it think that the only solution is to strike it down. That was also the view of both Opposition parties in Committee, and we see from amendment 5 that it is also the view of the Liberal Democrats whose amendment to leave out clause 2 I have signed
2022-01-26	CON	KevinHollinrake	This is not a notional white-collar offence; it affects real people in very tangible ways. Terrorists and drug dealers depend on it to launder and legitimise their money through UK banks, companies and properties. Up to 50% of moneys flowing through Russian laundromats, often used for tax avoidance, for stolen public funds and to launder moneys derived from organised crime, flow through UK shell companies. UK corporate structures were involved in arms deals which breached sanctions in Sudan. HSBC and NatWest have been fined hundreds of millions of pounds for allowing criminals and Mexican drug cartels to launder their money through accounts held at their banks. An estimated £5 billion or so of taxpayers’ money, in the form of bounce back loans, has been taken fraudulently because some banks have not applied the most basic of checks. Criminals, despots and terrorists involved in people trafficking, illegal immigration, drug dealing, extortion, kleptocracy, the impoverishment of nations, and fraud—including what is taken directly from the public purse, to the tune of £30 billion per annum—are all facilitated by some of the lax rules that we have in this country
2022-01-27	LAB	CatherineWest	Madam Deputy Speaker, I know you agree with this being a day when we try to reflect on the words we use in Parliament. Some of my Jewish constituents have written to me when we have had debates about immigration in the House and asked that we always try to have those debates in a respectful way. They have asked that, when we talk about groups such as the Gypsy and Traveller community, we try to understand other perspectives and not just use language that may denigrate groups that are already experiencing a lot of discrimination.
2022-02-03	CON	RobertBlackman	My right hon. Friend is a great champion for us Back Benchers in getting information from Government Departments. Can he arrange for the Home Secretary, or a Minister from the Home Office, to come forward and give us a statement about what is happening to immigration correspondence? I received a plethora of emails this week. I shall quote from one of them, but they are all the same
2022-02-08	CON	ScottBenton	T5. Reforming our broken asylum system and tackling illegal immigration is in part dependent on reforming the Human Rights Act. The British people expect action on the issue, so how quickly can we expect firm proposals to reform the HRA, following the end of the consultation next month?
2022-02-09	CON	KevinFoster	As I said, we have already amended our guidance where a person’s right to a private and family life in the UK is relevant. An allegation in relation to TOEIC is not a block and does not mean that an application would not be granted. It is not an overriding consideration, as other evidence of criminality or dishonesty in the immigration system may well be. The hon. Gentleman will be familiar with that
2022-02-09	CON	KevinFoster	As always, I am happy to look at individual cases referred to me, but it would not be appropriate for me to discuss individuals on the Floor of the House. On the overall position, we have to look back at the scale of what was happening eight years ago. It is not happening in our immigration system today, as we have transformed the student visa system
2022-02-09	CON	KevinFoster	I am aware that BBC “Newsnight” is tonight examining the Home Office’s response to systemic fraud that took place in the teaching of English international communication exams prior to 2014. In 2014, the BBC’s “Panorama” programme uncovered examples of organised fraud on a significant scale taking place during TOEIC exams, as they are known, which were at the time required under immigration rules for student and other visas. The Home Office’s subsequent investigation into the abuse of English language testing revealed systemic cheating that was indicative of significant organised fraud. Ministers and Parliament were clear at the time that they expected a robust and speedy response. As such, the Government took a number of steps to fix the broken student visa system that operated before 2014 and to prevent such abuse from happening again
2022-02-09	CON	KevinFoster	On another route that has been cited, we are making sure that things such as HMRC data are rightly used in immigration applications. As it stands, the tribunal determination is imminent and we will announce further steps once we have it.
