2022-05-18	CON	KevinHollinrake	We have to look at the brutal facts, I am afraid. I was a bit disappointed, as I said earlier, by what the Governor of the Bank of England said to the Treasury Committee about some of the issues we are seeing with labour shortages, which are driving inflation. We looked at some of the issues that SMEs, in particular, are facing in terms of accessing labour. In 2020, the last year we have reliable data for, net migration into the UK dropped by 88% from 271,000 people down to 34,000 people. People may say that is a good thing because we wanted to get a hold of immigration, and some of it may be due to covid effects. Nevertheless, pubs, restaurants and farmers, all of whom are generally SMEs, are finding life very difficult. We have to make sure that there is an available supply of labour. Another issue causing particular problems for SMEs is red tape at the borders—non-tariff barriers, as they might be called. There is a 45% reduction in the number of SMEs exporting to the European Union. These are facts we have to confront and deal with
2022-05-18	CON	PhilipHollobone	May I encourage my hon. Friend to come to the Dispatch Box more often, because that was one of the best Government statements we have had in recent times? Residents in the Kettering constituency want foreign national offenders who have committed serious and violent offences to be deported and they will be appalled that, thanks to the intervention of lefty, woke human rights immigration lawyers, 107 of those who should have left our shores this morning remain on British soil. May I urge my hon. Friend to go further and faster, arrange more flights and attach conditions so that those who are deported are never allowed to re-enter the United Kingdom?
2022-05-18	CON	ThomasPursglove	Foreign criminals who abuse our hospitality by committing serious and violent crimes such as murder and rape should be in no doubt of this Government’s determination to deport them. The British people have shown repeatedly at the ballot box that they want an immigration system that is firm and fair. Our new plan for immigration, underpinned by the Nationality and Borders Act 2022, is the first major reform of the system in decades. With that Act now law, we are getting on with the job and operationalising the plan
2022-05-18	CON	ThomasPursglove	I am confident that we will have the resources that we need to deal with these issues, but I can absolutely say to the Chairman of the Select Committee that it does not help our day-to-day immigration work in other parts of the business to have to deal with these constant cycles of claims, appeals and deliberate attempts to frustrate removal. I would be absolutely delighted if we could free up resource in the Home Office to focus on processing other, related claims—in the asylum space, for example, or Ukrainian claims or whatever they are. We would be better placed if we could do that. As I have consistently said, the abuses of our immigration system that we have seen and continue to see make it much harder to get on with the day-to-day business and be as generous as we can be. We are generous, but we could be doing more if the system were in a better place.
2022-05-18	CON	ThomasPursglove	It is interesting that Ministers are often challenged about our evidence base for wanting to deliver reforms through the new plan for immigration and the Nationality and Borders Act, because the evidence that my hon. Friend points to—she raises these issues consistently—speaks precisely to why the change is necessary and why we are getting on with operationalising the measures in the Act. That work is happening at pace, and we will not waste a moment in bringing that work to fruition. My hon. Friend is right to recognise the challenges that the current situation is presenting, and I am conscious of the impacts on Dover in particular. She does a tremendous job in raising them with Ministers, and I am keen that we continue that dialogue.
2022-05-18	CON	ThomasPursglove	Secondly, the flight to Jamaica makes up just 1% of total enforced returns in the year ending September 2021. Criminals who have no right to be in the United Kingdom are regularly removed to countries across the world, and we will continue to do this to keep our citizens safe. Public safety is non-negotiable. However, many more criminals could have left the UK today. What we have seen over the last 24 hours is more last-minute claims facilitated by specialist immigration law firms, as well as representations from Opposition MPs to prevent this flight from leaving. It is no surprise that the Opposition voted against our Nationality and Borders Bill precisely because it seeks to address the merry-go-round of last-minute claims and to speed up the removal of dangerous criminals. Labour Members fought tooth and nail to prevent that Bill from becoming law, and votes have consequences. Convicted criminals guilty of heinous crimes, including manslaughter, rape, robbery, child sex offences, drug offences and violent crime, and persistent offenders remain in our country; had the legislation been passed more quickly, with Opposition support, those individuals might have been removed from the UK today. They remain here, and it is a stain on our country that they do. However, I assure the British people that we are taking action, and things are changing as we get on with delivering our reforms
2022-05-18	CON	ThomasPursglove	That caseworking side of things is so important in processing these cases, ensuring they are handled as expeditiously as possible and there is not needless delay. That is something I am looking at intensively and that is why we have the new plan for immigration and the reforms we are introducing. As I have said, I constantly have at the forefront of my mind the victims of criminality when reaching decisions and considering cases, and reading the representations that are made. When we talk in this House about serious violence, for example, and there are calls for root and branch action to tackle it, it is impossible to divorce what we are talking about today from the work we are doing more widely in Government to tackle that very harm and that scourge on our society.
2022-05-18	CON	ThomasPursglove	We are driving comprehensive reform of the whole asylum and migration system through the new plan for immigration. The hon. Lady asks for specific statistics, which I do not have to hand today. I will gladly take away her question and write to her. If I can provide more specific information, I will.
2022-05-18	CON	ThomasPursglove	We debated these matters in the Nationality and Borders Public Bill Committee. A person’s age upon arrival to the UK is not an exception to deportation. The length of time that a person has lived in the UK as well as the strength of their social, cultural and family ties are factors that are considered under the article 8 requirements of the immigration rules. Of course, there is ongoing dialogue with all our returns partners and all such matters are discussed as part of those deliberations and discussions.
2022-05-18	CON	ThomasPursglove	What we do as a Government is take responsibility for our returns. We live up to our legal obligations in this space, and that is right and proper, and what the British people expect. But we understandably expect other countries around the world to do the same in taking their immigration offenders and those who have committed criminality in this country and are liable to deportation
2022-05-18	LAB	StephenKinnock	The Opposition are committed to the principles of an immigration system that is firm, fair and well managed. First and foremost, it is deeply troubling that a number of expert reports over recent years have pointed to how Home Office failures have resulted in fewer foreign criminals being deported than should be the case. Indeed, in 2015, the independent chief inspector of borders and immigration stated that one in three failures to deport foreign criminals was a result of Home Office failure. Fast-forward to 2022, and the latest immigration figures show that the Home Office is still failing miserably in this regard
2022-05-18	LAB	VirendraSharma	Q5. The Home Office, the Department of Health and Social Care and others now regularly take six months to respond to letters to Ministers. People with immigration cases wait years to hear anything at all. However, instead of putting resources into fixing this unacceptable problem, the Prime Minister is choosing to fire thousands of civil servants, and his Minister is wandering around Whitehall putting Post-it notes on desks that he thinks look too empty. Will the Prime Minister personally look into this issue and instruct his Ministers and civil servants to give our constituents the attention they deserve?
2022-05-24	CON	JamesCartlidge	Last year, to ensure accessibility to vital support, we spent £1.7 billion on legal aid. We are consulting on changes that will result in an additional 2 million people in England and Wales having access to civil legal aid, with 3.5 million more people having access to legal aid at the magistrates court. By any measure, that is a very significant expansion of access. Alongside that, we propose to invest up to £135 million a year in criminal legal aid, more than £7 million in improving access to housing legal aid, and £8 million in expanding access to immigration legal aid.
2022-05-24	CON	KevinHollinrake	Yes, I think the hon. Member is absolutely right, and she does great work on the all-party group on immigration detention, which is heavily engaged with me on these matters. Whatever we do with these facilities, we have to plan them properly. That did not happen at Napier, hence the trouble. This is a better-planned site, there is no doubt about it—some of the issues of dormitory accommodation and other things have been solved, and the accommodation itself has been planned better—but it is much worse for accessing amenities and public services for the service users, which leads to all other kinds of problems
2022-05-24	LAB	MohammedKhan	I thank the hon. Member for Northampton South (Andrew Lewer) for raising the importance of access to legal aid. In fact, his region—the east midlands—has seen an above average fall in access to criminal and civil legal aid since 2013. Compared with England and Wales as a whole, the region also has a higher proportion of local authorities with no providers of legal aid on housing, immigration, family and community care law. These legal aid deserts are worst for family and community care law, with the cost of living crisis compounding that further. Victims are being let down at every stage. Legal aid deserts are a direct result of chronic underfunding, and they deny justice to victims across the UK. The Government have failed to deliver even the bare minimum of what Sir Christopher Bellamy advised in his review. I understand that the Government are considering a civil sustainability review, so perhaps the Justice Secretary will provide further details. The Government like to pay lip service to levelling up the country, but when will the Lord Chancellor level up access to justice?
2022-05-25	LAB	GeraintDavies	When I visited Lithuania, I went to centres at which hundreds and hundreds of people were arriving each day. People—usually women with young children—were processed within hours. Biometric and basic checks would be done, and then the individuals would be associated with a family, a kindergarten, work and so on. I talked to the head of the civil service about immigration and refugees, and she said that they regarded those people not as refugees, but as friends or part of their family, and as a support to their labour market. In Britain, the view tends to be, “Hold on, what about the cost to the health service, education and so on?” That is despite the fact that we have labour shortages, as 1.4 million Europeans who were registered to work here have stayed in Europe. Obviously, we should open our hearts and homes to the people of Ukraine, who share our values. We share their suffering, and we should support them in every way we can. Not enough is being done, and we need to do much more, much more quickly and effectively.
2022-05-25	LAB	LukePollard	I am grateful for that intervention, which prompts me to say to the Minister that the generosity of the British people needs to be matched by the generosity of our immigration system, especially for our friends fleeing Ukraine. At the moment, they do not match up as they should
2022-05-25	LAB	StephenDoughty	We heard a number of contributions. We heard frustrations with the Homes for Ukraine scheme from my hon. Friend the Member for Sheffield Central (Paul Blomfield) and other powerful voices, such as the hon. Members for Rutherglen and Hamilton West (Margaret Ferrier) and for Angus (Dave Doogan). I am sorry to say that I had a similar experience this morning when I was sitting in the Home Office area in Portcullis House dealing with people who have not been dealt with since March. I know the Minister for Immigration was listening and I urge Ministers to get their act together on that scheme. The British people have shown great will to support the people of Ukraine and our system needs to match that by living up to their expectations
2022-06-07	LAB	CliveEfford	My next point is about how the code has been applied in the past, because Ministers have resigned when they have inadvertently misled the House. The most recent example I think of is that of the former Home Secretary, Amber Rudd, who inadvertently misled the House about immigration figures, and as a consequence of the information that was supplied to her, resigned from her post. It is not true that the ministerial code requires only a slap on the wrist for senior members of the Government—far from it. There are numerous examples of Ministers who have gone because they have inadvertently—not deliberately or maliciously—misled this House. Should the conclusion to the investigation be that people have misled the House, inadvertently or otherwise, resignations should follow. The public expect nothing less. Last night’s vote was an opportunity to draw a line under the sorry situation in which we find ourselves, because it is undermining our democracy and undermining this House, and it is time that it was drawn to a conclusion. Last night Conservative MPs missed that opportunity, but I do not think the public will when their time comes.
2022-06-09	CON	StephenBarclay	One of the purposes of Cabinet Office questions is to enable Ministers to respond to issues as they arise. Obviously I have a range of external meetings that reflect the responsibilities that we have discussed in the House, not least my roundtable on food security and resilience, an issue that was raised earlier. As for the wider approach to illegal immigration, that is a policy matter for the Home Secretary, who leads external engagement on the issue, but of course the Cabinet Office plays a supporting role in relation to Home Office colleagues.
2022-06-09	LAB	AndrewGwynne	T8. As a former member of the Home Affairs Committee, I still take great interest in its work. I am reliably informed by my right hon. Friend the Member for Kingston upon Hull North (Dame Diana Johnson) that yesterday the Independent Chief Inspector of Borders and Immigration told the Committee that he had asked to meet the Chancellor of the Duchy of Lancaster to talk about the cross-Government approach to channel crossings and had been refused a meeting, and that the Home Secretary had cancelled requested meetings with him six times. Is this an acceptable approach to such a serious issue, and when will there be a meeting?
2022-06-09	LAB	RachaelMaskell	To get a response: the Equalities Minister, four months; the Health Minister, often four months but can be six months; and the Defence Minister, seven months, with our staff chasing and chasing, while being on the phone for three hours, or up to five hours to UK Visas and Immigration. Behind every letter and every call our office makes is someone in need—often pressing need. We all know that this is due to capacity, so how can the Government state that they plan to cut 20% of civil servant jobs, 91,000 people, when they cannot even cope with undertaking the most basic of tasks?
2022-06-13	CON	JackBrereton	Stoke-on-Trent has done more than most when it comes to refugee resettlement, while other parts of the country—often those represented by Opposition Members—have done little to nothing. Does my hon. Friend agree that it is a bit rich for Opposition Members to suddenly oppose these plans, which would offer real deterrence and stop illegal immigration into this country?
2022-06-13	CON	JamesDaly	Does my hon. Friend agree that millions of our fellow citizens voted in favour of Brexit and in support of this Government in 2019 to ensure that a Government would be in place to tackle illegal immigration and provide safe and secure borders? Whatever the plan may be, it is fulfilling a democratic mandate, and he should be congratulated on it.
2022-06-13	CON	ThomasHunt	Over the weekend, I learned that immigration and police officers who were seeking to remove from the community someone who was thought to have committed immigration offences were prevented and blocked from upholding the law by protesters. Will the Minister assure me that the individual in question will be held to account for any potential breach, as will the protesters who blocked those officers from upholding the law? Does he share my revulsion at the fact that a Labour councillor appears to have been involved in organising the protest, and the fact that Labour Members of this place have applauded those protesters over the last 24 hours?
2022-06-13	CON	ThomasPursglove	It has often occurred to me that there are individuals, in this House and beyond it, who believe that we ought to have unlimited immigration to our country and that there ought not to be proper border controls, but, of course, they do not want to be straightforward about those motives and intentions. We, as a Government, believe that there must be proper border controls. The last Labour Government actually respected some of these principles, but we do not hear any of them being talked about in the modern setting by the shadow Home Secretary or the shadow immigration Minister, the hon. Member for Aberavon (Stephen Kinnock)
2022-06-13	CON	ThomasPursglove	It is fair to say that the costs associated with this illegal migration to our country are considerable and unsustainable. That is why we have the new plan for immigration in place to get it under control and ensure that those who follow the rules and seek to come here through safe and legal means are not disadvantaged by those attempting dangerous and unnecessary crossings as we have seen. For example, we are spending nearly £5 million a day on hotel accommodation in the asylum system. That cannot carry on, and that is why we must act as we are proposing.
2022-06-13	CON	ThomasPursglove	It is fair to say that there is a strong Christian faith practised in Rwanda. I was certainly struck by that characteristic of the country when I visited it recently. My right hon. Friend, as a former immigration Minister, speaks with great authority on these matters.
2022-06-13	CON	ThomasPursglove	My hon. Friend speaks passionately on behalf of his constituents who want a common-sense approach to these matters. The British people are fair and generous—we have seen that in the response to the crisis in Ukraine, with people throwing open their homes—but what they do not find acceptable is illegal immigration to our country with people taking great risks and abusing the asylum system in the process, which then disadvantages people who come here through safe and legal routes. That is not right, and we believe strongly that action needs to be taken. That is precisely what we will get on and do.
2022-06-13	CON	ThomasPursglove	Our world-leading migration and economic development partnership with Rwanda is a global first and will change the way we collectively tackle illegal immigration. This is a global problem that requires international solutions
2022-06-13	CON	ThomasPursglove	The Government believe that as part of the wider, comprehensive new plan for immigration that we are delivering, this plan will have the effect of stopping these dangerous crossings of the channel—by small boat, for example. People are also coming across to the United Kingdom in the back of lorries, which is also highly dangerous
2022-06-13	CON	ThomasPursglove	Uncontrolled immigration reduces our capacity to help those who most need our support. It puts intolerable pressure on public services and local communities. Long-lasting change will not happen overnight; it requires a long-term plan. As I have said many times before in this House, there is no one single solution, but this Government will deliver the first comprehensive overhaul of the asylum system in decades.
2022-06-13	CON	TimothyLoughton	I have one query for the Minister. We interviewed Her Majesty’s inspector of borders and immigration last week, and there are still some concerns about the monitoring process that will be happening in Rwanda itself. When will he be giving us more details about those on the monitoring and scrutiny committee, and how will we ensure that the way people end up being treated once they are transported out to Rwanda will accord with the promises in the agreement?
2022-06-14	CON	KevinFoster	I feel sorry for those on the Labour Front Bench in some ways. They were told to come up with something on passports. Having said “Yes, captain” to the request, the shadow Home Secretary got her team together to come up with some ideas. First, they tried to think of a better way of delivering the service, but had no alternative to what we have done already. Then they looked to see what ideas they had put forward last year, but realised they had not said a word—the claim that it was predictable rather contrasted with their own lack of prediction. Perhaps they wondered whether they could demand that passport staff be in the office, but then remembered that they already are and what they said when the Minister for Brexit Opportunities and Government Efficiency, the right hon. Member for North East Somerset (Mr Rees-Mogg) suggested that about other public services. Perhaps they could have demanded that the contractor who prints the passports be nationalised, but realised that that sounded a bit too much like Jeremy. Maybe they could have pointed to output being higher under Labour, but then they realised it was not, due to the record outputs now being achieved. Then, with a deflated sigh, one of them must have said, “How about we just have a pop at the Minister?” which they all agreed was the only thing they could come up with, hence their motion today. The role of Immigration Minister is never an easy one. It brings challenges. It is certainly a role where you cannot please everyone. But it speaks volumes when Labour Members have so little to offer that they resort to a motion attacking the person not the policy. That is not uncommon. We see it on a raft of issues in my brief, where the Labour party has no policy, only political points. From the immigration health surcharge to our migration and economic development partnership with Rwanda, it has no clear view. On the changes needed to tackle abuse of our immigration system and evil people-smuggling gangs, it offers nothing but criticism. For all the Labour shadows I have had since December 2019, and there have been a few, we have not seen one coherent plan come forward. [Interruption.] There have been four choices to change. In short, they are only left with the personal, in the absence of any policy alternative
2022-06-14	CON	PaulHolmes	It is disappointing that yet again the shadow Minister, the hon. Member for Aberavon (Stephen Kinnock), has decided to stand at the Dispatch Box and castigate and criticise, but offered no alternative solution outlining what a Labour Government would do. He did it throughout my time as Parliamentary Private Secretary at the Home Office: he did it about immigration; he did it about policing; and he has done it about passports. All we hear is constant criticism with no plan as to what is best for the country. During the time in which I was privileged to have that job, I would sit behind the Minister and the Home Secretary, and one of the most frustrating things was having to be quiet and listen without being able to come back at the shadow Minister. I am glad that I can do so today—and may I just also congratulate my hon. Friends the Members for South West Hertfordshire (Mr Mohindra), for Bosworth (Dr Evans) and for Stockton South (Matt Vickers) on being appointed PPSs at the Home Office
2022-06-14	LAB	JessicaMorden	What makes it worse is that the MP hotlines at UK Visas and Immigration cannot answer passport queries. Despite details being taken and passed on to the Passport Office for a response, to date my office has struggled to obtain any replies through this correspondence chain, and has done so only via the drop-in service in Portcullis House. While I appreciate the excellent work that the staff are doing there—and they are—it is clearly not a sustainable system. I am fortunate in that I have a member of staff in Westminster and my constituency is less than three hours away on the train, but for other MPs further away, accessing this hub every week is difficult, and it is not a sustainable outcome for us. It is a logistical nightmare. Why can we not have a dedicated MP hotline for the Passport Office? We used to have one that worked very well, but the Government took it away from us
