2022-03-08	CON	KevinFoster	On the numbers that the right hon. Lady cites, we are training more decision makers as we speak. We are pulling people in from across UK Visas and Immigration to ensure that there is an almost frictionless approach to caseworking, and we will see the number of visas issued ramping up each day
2022-03-08	CON	KevinFoster	Those who are applying are actually in safe countries as we speak. As I have said, there is no requirement for people to stay in Ukraine to make an application if they can safely make their way across the border to one of the safe and democratic countries next door that we are supporting to provide support for those crossing the border. My right hon. Friend will know from his own experience that, for a range of reasons, if we bring people into the country we perform checks, but we certainly do not want to go down the route of using immigration detention powers while these checks are being undertaken. We do not believe that that would be appropriate at all.
2022-03-08	CON	KevinFoster	We will move out to extend this. We recognise the desperate plight that there is; that is why we are working with countries on the ground, providing humanitarian aid and ensuring that we are helping to provide support as people cross borders. We are looking to ensure that we have a wide system that allows people to come here, and abandoning many of our normal requirements for countries. We recognise that it is not a time for the usual immigration process, hence the system that we are setting up. As we have said, we have the confidence that it will expand. We know that the British people will be generous. We know that when we move to open up the sponsorship visa, many people, including many of our constituents, will want to step forward
2022-03-08	CON	MarkHarper	As a former Immigration Minister, I am very sympathetic to the need to do appropriate security checks. I have publicly defended the Government on this issue, but we need to grip the pace of this, which will require Ministers to take decisions to move things along quickly
2022-03-08	CON	RobertBuckland	One way we can rapidly scale up capacity is to use technology. What is my hon. Friend’s view of the ability of Ukrainians with biometric passports to use the UK Immigration: ID Check app, which does apply and has been used by many applications from Hong Kong? May I commend that course of action to him?
2022-03-09	CON	RobertWallace	On that last point, included in the increased package is more body armour, alongside what was donated by many countries in the conference in February. I am slightly in danger of entering into Home Office questions here, although I know that they took place yesterday. Although I was a Home Office Minister, one of the greatest delights was not being the immigration Minister, but the security Minister. All I will say is that I understand the feeling in the House, so does the Home Secretary and so does the Prime Minister, and we are working to resolve that matter as quickly as possible. As for the internal details of different immigration schemes, I gently refer my hon. Friend to the Home Office.
2022-03-09	CON	RobertWallace	On the immigration pathway, the overall number of 200,000 for family and uncapped for humanitarian is a good thing. The fact that Britain is the biggest single donor to humanitarian aid is a good thing. We should not underplay those two facts. I understand the frustration among both Ukrainians trying to flee and Members of this House about the speed of that processing. I said yesterday that the MOD will support the Home Office as requested; it has agreed in principle and we have work on today to make that go quicker.
2022-03-10	CON	PritiPatel	I thank the hon. Gentleman for the approach and the tone that he has taken. It is important for us to work together, and the Immigration Minister is in touch with the devolved Administrations. As we have made clear from day one, these are important discussions about the need to work collegiately and collectively on our response. This cannot be done purely through central Government; we have to work across the country to provide the support that is needed. Yesterday I was in Manchester and Derby, meeting members of the Ukrainian diaspora community to hear about their needs and to discuss how we can work not only centrally but with local authorities to give wider support
2022-03-10	CON	PritiPatel	My right hon. Friend is absolutely right. It is fair to say that he will be too familiar with the various processes around immigration checks, digitalisation and security, and the wider considerations that constantly have to be made. In terms of wider refugee policy, this is a whole-of-Government effort, so parts of it, particularly the community sponsorship route that I announced to the House last week, will be led by the Department for Levelling Up, Housing and Communities, which will lead on that primarily because of the local authority engagement and safeguarding that is required. There will be further announcements on that. The work of the Minister for Refugees will be split between both Departments to assist with the co-ordination effort that is required. I know my right hon. Friend will be familiar with how the Syrian vulnerable refugee scheme was created. In effect, we are trying to build on some of the previous models that have worked successfully in government.
2022-03-10	LAB	ApsanaBegum	The cruel “no recourse to public funds” condition prevents women from accessing help when most at need, and the hostile and racist immigration system tightens around women facing deportation, imprisons women in unacceptable conditions and even sees women drown at sea when they try to seek safety. I plead with the Government today: please scrap the inhumane Nationality and Borders Bill, which risks criminalising refugees, including Ukrainian refugees, who arrive in the UK through an irregular route. Instead, the Government should ensure that there are always safe routes for those seeking sanctuary and asylum
2022-03-10	LAB	DianaJohnson	Thank you, Mr Speaker. While I welcome the changes for Ukrainian passport holders, many Ukrainians do not have passports, as the Home Secretary has just said. I want to ask her about TLScontact, which has been subcontracted by the Home Office to carry out biometric checks. The chief inspector of borders and immigration told the Home Secretary that TLScontact was so hellbent on making profit that its use posed a risk of “reputational damage” to the UK. With Ukrainians fleeing for their lives and the chaos at the visa application centres with long waits and few appointments, can the Secretary of State tell me why that company is allowed to profit from the suffering and misery of Ukrainians by telling them that if they make additional payments, their cases will be expedited and they will get appointments more quickly? Is that right?
2022-03-10	LAB	EmmaLewellBuck	My constituent’s Ukrainian wife, Liudmyla Florence, was turned away from the UK visa office in Warsaw and told that she had to book an appointment and make an application online. The UK immigration website repeatedly stated, “Sorry, there is currently a problem with the service. Please try again later.” She eventually was given an appointment, but not until 17 March. What is Liudmyla supposed to do while the Home Secretary is getting her act together?
2022-03-10	LAB	MargaretHillier	As one of the top six customers of the Home Office on immigration issues, I have seen how this situation underlines the chaos in the Home Office’s immigration system. It is really struggling to keep up with the basics and when dealing with this surge it has understandably crumbled under the pressure. I am concerned that we have been waiting for all these days. We know that security checks need to take place, but what security risk is there from 90-year-old women, from people in their 60s, from mothers and small children? Has the right hon. Lady not given some thought to progressing them through faster and doing more checks on them here in the UK?
2022-03-10	LAB	SarahChampion	The Government’s immigration schemes do not adequately support aid workers seeking safe passage to the UK. Many Afghan aid workers feel abandoned by our Government. The Committee’s concern about immigration routes was narrow: the Government’s treatment of Afghan aid workers seeking safe passage to the UK. In our December oral evidence session, witnesses told us that the Government’s contingency plans for the evacuation of aid workers were neither apparent to the sector nor scaled adequately. Our report calls on the Government to accelerate without further delay all pathways of the Afghan citizens resettlement scheme, and ensure that aid sector staff are explicitly recognised and prioritised for protection under that scheme. We fear that the same approach to people fleeing a humanitarian crisis is being adopted by the UK Government in their response to Ukraine. Yesterday, we heard worrying reports that Ukrainian staff in the British embassy in Kyiv are being denied entry to the UK. Some British staff have described what is happening as “Afghanistan part 2”. Once again, we see the Government showing the same inflexibilities by only making limited, begrudging concessions to pre-existing UK immigration routes; failing to provide sufficient clarity on what routes are available; and dragging their feet in setting up new routes, or variations to existing ones. That response must change
2022-03-14	CON	MichaelGove	The scheme will be open to all Ukrainian nationals and residents, and they will be able to live and work in the United Kingdom for up to three years.[Official Report, 15 March 2022, Vol. 710, c. 9MC.] They will have full and unrestricted access to benefits, healthcare, employment and other support. Sponsors in the UK can be of any nationality, with any immigration status, provided they have at least six months’ leave to remain within the UK. Sponsors will have to provide accommodation for a minimum of six months. In recognition of their generosity, the Government will provide a monthly payment of £350 to sponsors for each family whom they look after. These payments will be tax-free. They will not affect benefit entitlement or council tax status. Ukrainians arriving in the United Kingdom will have access to the full range of public services—doctors, schools, and full local authority support. Of course we want to minimise bureaucracy and make the process as straightforward as possible while doing everything we can to ensure the safety of all involved. Sponsors will therefore be required to undergo necessary vetting checks, and we are also streamlining processes to security-assess the status of Ukrainians who will be arriving in the United Kingdom
2022-03-15	LAB	SamuelTarry	It will have escaped no one that, despite so little being done to help Ukrainians as they face the horrors of war, it is still far more support than was offered just months ago to those who were fleeing the brutal horrors of the oncoming Taliban regime in Afghanistan. In my Ilford South office, we still have more than 220 active cases of Afghan refugees, some of which are still receiving boiler-plate responses from the Home Office and the Foreign, Commonwealth and Development Office. Many are of people trying to flee Afghanistan because they continue to face oppression and threats to their lives; they are often people who worked directly with the UK Government. That is totally unacceptable. The promises we made at the time to take only 20,000 people over the next four years were deplorable, but showed the true face of our immigration and refugee policy
2022-03-16	LAB	StephenKinnock	The vast majority of the issues that need to be resolved around bringing Ukrainians into this country are clearly to do with immigration. The fact that this brief has been shifted is a clear indication that the Prime Minister has lost confidence in the Home Secretary.
2022-03-16	LAB	StephenKinnock	We have had to endure the embarrassing spectacle of the Home Secretary contradicting her own Department’s announcement on the number of visas granted, and then compounding the confusion by claiming that an application centre for Ukrainians had been opened in Calais when that was patently not the case. While I commend the Immigration Minister for deleting the tweet in which he suggested that Ukrainians fleeing the horrors of war should apply for fruit picker visas, I nevertheless repeat my request that he apologise for that tweet, as it is clear that such an apology would go a long way to reassuring the public that the Government have grasped the horrific reality of the situation
2022-03-21	LAB	LouiseHaigh	People throughout the country will be asking how it is possible that workers can be bussed in to instantly replace those in secure jobs. Is it not the case that P&O has exploited the immigration loopholes in exactly the same way as it has exploited loopholes in the minimum wage legislation for years, while the Government have sat back and allowed it to happen? This is the exact opposite of the promises made to the British people to safeguard their living standards, employment prospects and job security. In what world is this “taking back control”
2022-03-22	CON	AndrewMitchell	On amendment 11, my right hon. Friend the Member for Ashford (Damian Green) has already made clear the huge benefits that would come in if it were agreed to. It is designed to break the people-smugglers’ business model. The Government are quite right: people fleeing terror and persecution should only come here by safe and legal routes. We will only stop people in desperation coming over the channel—that is, set up the settlement pathway the Home Office rightly refers to and break the smugglers’ model—if, first, we have accessible and meaningful numbers, and, secondly, we are not restricted to one geographic area. The Home Office confirms that 87% of the 28,000 arriving illicitly in 2021 came from Iran, Iraq, Syria and Yemen, for whom there is currently no alternative legal and safe route to which they can apply to get to the United Kingdom. Endorsing resettlement is central to the Government’s new approach set out in the “New Plan for Immigration”, but Ministers have yet to bring forward any provision in legislation that would see the necessary safe and legal routes made available
2022-03-22	CON	AndrewMitchell	The two Lords amendments I particularly want to raise, which would improve the Bill, are those tabled by Lord Kirkhope of Harrogate. They should be given very serious consideration. Lord Kirkhope was the Immigration Minister under Michael Howard, the former Home Secretary in John Major’s Government. Both are much respected and on the right of the Conservative party. Our former colleague Lord Kirkhope’s views are an important contribution to this debate. Furthermore, he has a long-standing interest and expertise in the handling of population movement in Europe from Calais to Moscow
2022-03-22	CON	DamianGreen	I absolutely get that one of the Government’s key aims is to minimise and hopefully stop altogether this dangerous route of illegal immigration. I support them wholeheartedly in that aim. Been there, done that, when the traffic was in the backs of lorries, which was equally dangerous and also led to the deaths of innocent people fleeing trouble. It can be done; we can stop these routes. So why Lords amendment 11? The Government, and indeed the Minister in his opening remarks, have correctly asserted that people in need of protection must come to the UK via safe and lawful routes rather than making an illegal journey. However, those routes need to be available to people, and for far too many people, they are simply not available under the current system
2022-03-22	CON	DamianGreen	Returning to the Government’s wider plan, the new plan for immigration states: “The UK’s commitment to resettling refugees will continue to be a multi-year commitment with numbers subject to ongoing review guided by circumstances and capacity at any given time.” If nothing else, Lords amendment 11 invites the Government to take a small step forward—I agree with the hon. Member for Aberavon (Stephen Kinnock) that it is a small step, but it is a significant step and I hope we will vote on it later—to strengthen their objectives with a concrete and predictable floor of 10,000 places. That would provide local authorities and civil society more widely with the certainty, time and space to plan and to deliver the capacity so that resettlement can be successful. I should pause and pay tribute to my own local authority in Ashford, which was very active in coming forward early for the Syrian resettlement scheme and has done the same with the Afghans. I also pay tribute to the civil society NGOs in my constituency that are doing the same with Ukraine. I suspect that that is reflected all around the country. There are lots of people out there who want to be generous.
2022-03-22	CON	JohnHayes	I am grateful to you, Madam Deputy Speaker. Disraeli observed: “How much easier it is to be critical than to be correct.” Many of the amendments put forward by the Lords are carelessly critical. They are veiled, as these things so often are, in a thin covering of assumed moral superiority, but surely it is not moral to oppose a Bill that tries to make the asylum system fit for purpose. Surely it is not ethical to conflate illegal immigration with the immigration of those people who diligently seek to come to this country lawfully and to surmount the hurdles we put in their path, and who, having done so, take pride in making the contribution mentioned by the right hon. Member for Hayes and Harlington (John McDonnell).
2022-03-22	CON	RichardFuller	I want the UK to be known as a place of refuge and justice as well as a place of opportunity and freedom. When examining immigration Bills over the years, I have always looked to see where there could be an issue of moral hazard in what is being proposed and the changes being made. In this Bill, my eyes were immediately drawn to clause 62 and to Lords amendment 25. The title of clause 62 is “Identified potential victims etc: disqualification from protection”. The clause is replete with moral hazards in whatever actions the Government might take. As it happens, I do not think that the Government have got the balance right, but I am also not sure that the Lords amendment is quite right
2022-03-22	CON	SimonHoare	I served on the Committee stage of the Immigration Act 2016, and we should remind ourselves that Ministers told us then that that was the Bill to end all Bills and solve all problems, yet another one came along a minute or two later, so I have little or no doubt that we will return to many of these issues over the coming months and years
2022-03-22	CON	SimonHoare	This is also an opportunity to pause: all new laws and Bills set rules, guidelines, prohibitions and so forth, but that provides the House with an opportunity to briefly reflect on the enormous contribution of so many people not born in this country who have seen in this country a beacon of light and hope and decency, and who have made their way by all sorts of routes to put down roots and become part of our society. It is an opportunity to remind ourselves of the benefits of immigration and not to see it always through the prisms of prohibition and just say “It’s bad and must be controlled and stopped.” I strongly support many of the Lords amendments on the right to work. My hon. Friend the Minister said he could not support that because it would be a disincentive to those seeking to abide by the rules to allow people to work, yet as others have mentioned, we are rightly allowing those from Ukraine to do so without anyone making that point. My right hon. and learned Friend the Member for South Swindon (Sir Robert Buckland), my right hon. Friends the Members for Haltemprice and Howden (Mr Davis) and for Sutton Coldfield (Mr Mitchell), my hon. Friend the Member for Ashfield (Lee Anderson) and indeed the right hon. Member for Hayes and Harlington (John McDonnell) all expressed very cogently and calmly the clear economic and socioeconomic benefits of allowing people to work, and I urge the Minister, even at this late stage of ping-pong, to rethink on that issue
2022-03-22	CON	ThomasPursglove	I am not going to get drawn into listing all other possible exemptions to removal in that way, but I set out on Report that, for example, family groups would not be separated, because that would clearly not be in accordance with our international obligations. Clearly, much will depend on the particular circumstances of the countries we are working with. We always work in the asylum system and in the immigration space on a case-by-case basis, but I want to assure hon. Members that we will continue to uphold our international obligations and ensure that any removal is compliant with our obligations under the refugee convention and article 3 of the European convention on human rights, which protects against torture and inhuman and degrading treatment
2022-03-22	CON	ThomasPursglove	I turn to Lords amendment 40, which concerns the operation of the electronic travel authorisation scheme in respect of individuals travelling to Northern Ireland on a local journey from the Republic of Ireland. We have been very clear in emphasising our continuing commitment to the Good Friday agreement and the protocol, and we would like to take the opportunity to reassure colleagues again that there will be no controls on the border between Northern Ireland and Ireland. However, this amendment could result in an unacceptable gap in UK border security that would allow persons of interest or risk who would be otherwise refused an electronic travel authorisation to enter the UK legally, undermining the very purpose of the ETA scheme, which is to prevent the travel of those who pose a threat to the UK. It is important that, as now, all individuals—except British and Irish citizens—arriving in the UK, including those crossing the land border into Northern Ireland, continue to enter in line with the UK’s immigration framework to protect both the UK immigration system and the common travel area from abuse. This is a well-established principle of the operation of the common travel area and applies when travelling in all directions. The UK is entitled to introduce and change its own requirements in the interest of securing the UK border, and we will continue to liaise with the Irish authorities on matters of border security in relation to the common travel area. We therefore cannot support this amendment.
2022-03-22	CON	ThomasPursglove	Lords amendment 41 is a minor drafting amendment in relation to costs orders. It does not change the underlying policy, which requires tribunal procedure rules to be made setting out that the tribunal must consider whether to impose a charge or to make an order where prescribed conduct that is to be treated as improper, unreasonable or negligent has occurred. It simply clarifies that this requirement applies only in relation to the immigration and asylum chamber of the first-tier tribunal and of the upper tribunal. This will prevent any uncertainty from arising about the jurisdictions in which clause 77 should be applied, and I hope this clarification meets with the approval of the House
2022-03-22	CON	ThomasPursglove	Our view has long been that the number of refugees and people in need of protection that we resettle each year must be based on our capacity, our assessment of the international situation and our ability to care for people properly when they come to the UK. I understand that hon. Members are seeking assurances that our doors will remain open to those in need, but I respectfully suggest that what is really needed to deliver refugee resettlement is not a number but an approach—an approach that is compassionate and flexible. That is exactly what the Government are delivering through our new plan for immigration.
2022-03-22	CON	ThomasPursglove	Refugee family reunion allows a spouse or partner and children under 18 of those granted protection in the UK to join them here, if they formed part of the family unit before the sponsor fled the country. There is discretion to grant leave outside of the immigration rules for extended family members in exceptional circumstances. We have granted over 40,000 refugee family reunion visas since 2015, of which more than half were granted to children. In 2021, there were 6,134 family reunion visas issued, which was an increase of 28% on the previous year. Again, more than half were issued to children
2022-03-22	LAB	BethanWinter	Unfortunately, the Government are completely out of touch with that sentiment in their new plan for immigration. The Bill cuts across everything that we should stand for in this country. It breaches international laws, violates basic principles of justice and runs completely counter to what is needed. It will cause greater inequity and harm communities.
