2022-02-01	CON	RishiSunak	The hon. Lady talked about inflation; she is right and I am very cognisant of the anxiety that people are feeling about rising inflation. It is also right to put that in context. She said it is the highest tier since the early 1990s, and that is right. We are also seeing this as a global phenomenon—inflation in the US is running at its highest since the 1980s, and the highest since the eurozone was created—so we are not alone in facing those challenges. The Government have already set out a plan, but it is a plan that is working. In contrast to what she said about people losing their jobs, what we have seen is 11 months of falling unemployment, which is now back to the almost record pre-pandemic lows, and record numbers of people in work. That is the best way to tackle the cost of living—get people into work and make sure those jobs are well paid.
2022-02-01	CON	RobertSyms	We have had a pandemic, and the Prime Minister and the Chancellor put £400 billion into the economy to support businesses, people and employment. At one point, 11 million people—a third of the workforce—were being paid by the Treasury. If at that point one had said, “We will emerge with a growing economy, falling unemployment and 1.5 million vacancies,” it might have been thought to be a very optimistic scenario
2022-02-01	CON	SimonClarke	I completely agree with my hon. Friend. Kickstart is delivering valuable jobs and work experience to young jobseekers at risk of long-term unemployment. Although kickstart closed to new applications on 17 December, we are genuinely delighted at the response from employers. As I noted, more than 122,000 kickstart jobs have been started so far, and we expect more between now and the end of March. Employers should continue to engage with Department for Work and Pensions jobcentres and support the new way to work campaign to get more people into work.
2022-02-01	CON	SimonClarke	We know that young people have been disproportionately affected by the pandemic. I am delighted that, to date, more than 122,000 kickstart jobs have been started by young people across Great Britain, including in the constituency of my hon. Friend the Member for Gedling (Tom Randall). Youth unemployment fell by 11.1% in the three months to November 2021 and is lower than it was prior to the pandemic, and in December there were half a million more employees aged under 25 than in December 2020.[Official Report, 7 February 2022, Vol. 708, c. 7MC.]
2022-02-02	CON	AlexanderJohnson	No, I think everybody in this country can see that we have been through the biggest pandemic for 100 years and that we have looked after the people of this country to the tune of £400 billion, which we put into furlough and all the other schemes, with 11.7 million people protected. Everybody knows the cost of that. At the same time, despite all the difficulties we have faced, we have now got the fastest growth in the G7. That is absolutely true. We have youth unemployment at a record low. We have got three times as much tech investment coming into this country as France, and twice as much as Germany. [Interruption.] Yes, that is absolutely true. If we want to know about Labour economics, never forget that the last time they were in office, when they were finally booted out, they left a note saying, “There is no money left.” That is the way they run the country.
2022-02-02	CON	AlexanderJohnson	What we are doing is helping people with the cost of living, cutting taxes for those on universal credit, as I have said, and helping people with the cost of their fuel, with the cold weather payments and the warm home payment—doing all the things that this country would expect. We are lifting the living wage, which this party introduced. This Government have increased that by a record amount. Above all, the most important thing we are doing is helping people into work, with 500,000 people off welfare and into work under our way to work scheme. There are more people in work now than before the pandemic began, and that is the record of this Government. Never forget that there has never been a Labour Government who left office with unemployment lower than when they came to power.
2022-02-02	CON	IainStewart	This Government have consistently said that the best way to support people’s living standards is through good work, better skills and higher wages. Our plan for jobs is working, the economy is growing and unemployment is low. The national living wage, the universal credit taper and allowance changes are putting more money in people’s pockets.
2022-02-02	CON	LucyLeighFrazer	We have cut tax for low-income families by introducing the universal credit taper rate, saving working families £1,000 a month.[Official Report, 4 February 2022, Vol. 708, c. 6MC.] The hon. Gentleman will know that we increased the rate for the national living wage, and he will know about the half a billion pounds of household support for the hardest-hit families—not to mention the significant covid support that we have given the families who have needed it over the last 18 months to two years. However, the best way to help people to have appropriate incomes to support themselves is to get them into jobs, and that is why we have spent £2 billion to get young people into the kickstart scheme, and £2.9 billion to help the 1.4 million long-term unemployed to get into jobs, ensuring that we have a lower unemployment rate than comparable countries such as Canada, France, Italy and Spain
2022-02-03	CON	RishiSunak	If the hon. Gentleman looks at the remarks I made earlier, he will see that I was clear that there are 400,000 more people on payroll, and that is the right use of that statistic. It is obviously harder to track those in self-employment because we have real-time information numbers from HMRC for those on payroll. We are proud of our track record on jobs. Unemployment in this country was forecast to reach 12%, with millions of people unemployed, but unemployment has now fallen for almost 10 straight months. It is almost back to the record lows we saw pre-pandemic, and we have record job vacancies and record low redundancies. That is all evidence that our plan for jobs is working.
2022-02-03	CON	RishiSunak	The UK’s economic recovery has been quicker and stronger than forecast. In the depths of the pandemic, our economy was expected to return to its pre-crisis level at the end of 2022; instead, it got there in November 2021, a full year earlier. Unemployment was expected to peak at nearly 12%; instead, it peaked at 5.2% and has now fallen to just over 4%, saving more than 2 million jobs. With the fastest-growing economy in the G7 this year, with over 400,000 more people on payrolls than before the pandemic, and with business investment rising, it is no wonder that borrowing is set to fall from £320 billion last year—the highest ever peacetime level—to just £46 billion by the end of this Parliament. As we emerge from the depths of the worst recession in 300 years, we should be proud of our economic record. The economy is stronger because of the plan we put in place, because of the actions we took to protect families and businesses, and that plan is working
2022-02-04	CON	StuartAnderson	Another issue that needs to be looked at is guidance on potential barriers to work. Fewer than two in 10 people with learning disabilities are in employment. My constituency has the highest youth unemployment in the country. I recently held a jobs fair in the constituency with more than 50 different providers and several hundred people looking for work. Every single one of those providers had a job vacancy, and we were putting people together. Wolverhampton has the lowest youth employment, and with two in 10 people with learning disabilities currently out of employment, that will significantly impact communities in Wolverhampton. We need to look at that
2022-02-07	CON	MiriamDavies	Young people claiming universal credit and searching for work are supported through our boosted DWP youth offer. This includes new, dedicated support from youth employability work coaches. Despite the challenges of covid-19, the DWP has opened over 160 new, specialised youth hubs across Great Britain. These innovative and vital interventions contributed to over 130,000 young people starting kickstart roles and, most importantly, to a record low youth unemployment level.
2022-02-07	LAB	BethanWinter	The reality for so many people, including my constituents, is far removed from the rhetoric of this Government, and the impact on people in my constituency of Cynon Valley will be devastating. I have spoken about this many times. Over a third of people in Cynon Valley are living in poverty, and in some areas 50%—yes, 50%—of children are living in poverty. That is well above the UK national average. Unemployment rates are very high, and we have the highest rate of economic inactivity in the whole country
2022-02-07	LAB	DeborahAbrahams	Importantly, the EHRC and the JRF also concluded that social security cuts are the key determinant of the increase in poverty and that our social security system no longer plays a part in protecting people from poverty and destitution. What a thing to say in the fifth-richest country in the world. From 2018 data, the UK’s social security spending as a percentage of GDP was below both the EU27 and OECD average. On out-of-work support, even with the pandemic universal credit uplift of £20 a week, the UK still had the least generous support of the OECD. According to the IFS, unemployment support is 14% of average earnings, compared with 25% after the second world war. Many have spoken about the impact that is having on debt, fuel poverty, food poverty and so on. We must not forgot that there has also been an impact on homelessness
2022-02-08	CON	AlexanderStafford	I am listening carefully to the hon. Gentleman’s argument. I believe that he is making the point that Brexit is leading to some other cost of living issues. If that is the case, why are we seeing even greater levels of inflation and unemployment in other countries inside the EU? Rising costs and rising inflation are clearly a global issue, and nothing to do with Brexit.
2022-02-08	CON	JamesWild	As a Conservative, I want to see people keep more of the money that they earn. To help the lowest paid people do that, we are increasing the national living wage to £9.50 an hour from April for workers aged 23 and over. That represents an extra £1,000 a year for a full-time worker. Nearly 2 million families on low incomes will benefit from £1,000 a year through the cut in the universal credit taper and increases to work allowances. However, we also need to redouble our efforts to help people without a job to move into one of the 1.2 million vacancies across the country. In my constituency, there are 1,800 people on unemployment-related benefits. Although that represents a lower rate than the national average, it still represents untapped potential for individuals. Employers in my area, whether in food processing or in other parts of the economy, are crying out for staff, so I welcome the newly launched Way to Work scheme to match people to roles that exist in North West Norfolk and across the country. It is also important to recognise the direct support through the half a billion pound household support fund to help low-income households with the cost of food and other essentials, as well as the increase in the value of Healthy Start food vouchers, which the Minister referred to
2022-02-09	CON	AlexanderJohnson	Our plan for jobs is working. We have record low youth unemployment. Our plan for the NHS and care is working. Labour has no plan at all. Our plan for the country is working. We have a great vision to unite and level up across our country. Labour has no plan whatever. I say to him: plan beats no plan. We have a great plan for our country; they play politics.
2022-02-10	LAB	CliveEfford	The UK Statistics Authority has written to the Government because the Prime Minister used the wrong figures when he talked about crime being down by 14% when it is in fact up by 14%. The Government have similarly been written to about the use of unemployment statistics that neglect to include people who are self-employed, the number of whom has dropped by 700,000 to 800,000, so there are in fact fewer people in employment, contrary to what the Government say. Will the Leader of the House undertake to investigate all the Ministers, including the Prime Minister, who have misinformed the House, albeit inadvertently, on those statistics and ensure that they come back and put the record straight, as they are required to do?
2022-02-21	CON	JaneStevenson	Improving recruitment in areas such as Wolverhampton would really help diversity in the armed forces. Wolverhampton also has a very high rate of unemployment. What more can the Department do to ensure that every young person in Wolverhampton is aware of the fantastic opportunities open to them in the armed forces?
2022-02-21	CON	NadhimZahawi	I am glad to say that our economy is in a strong position to respond to these challenges, with the highest growth rate in the G7. On jobs, we have a record 1.2 million vacancies to fill; that is 59%—almost 60%—higher than pre-pandemic levels. Unemployment is falling and is now just 4.1%, and youth unemployment, especially, is at a record low
2022-02-22	CON	KwasiKwarteng	As we all know, rising energy bills are a cause for concern for people up and down this country, but we have stepped in to give families some breathing space, with our energy bills rebate and council tax discount. Our supply of gas is secure; unlike many European Union countries, we are not dependent on Russian gas. Much of our supply comes from British territorial waters and from reliable import partners, such as Norway. The UK is the fastest growing economy in the G7, unemployment is down to record low levels and wages continue to rise. There are challenges ahead, but Britain is bouncing back from the pandemic.
2022-03-03	LAB	NiaGriffith	I pay tribute to Jim Griffiths, who was described by James Callaghan as “one of Wales’s greatest sons”. If we look back at some of Griffiths’ achievements, we can see how relevant they are to some of the problems that we face today. In that radical Government of 1945, he brought in family allowances. They were to be paid to the mother, which is something that campaigners had been wanting for a very long time. He saw the poverty and malnutrition in his constituency and was determined to look after people who fell on hard times. He brought in the National Insurance Act 1946, which ensured unemployment benefit and sickness benefit, and the National Assistance Act 1948, which ensured that those who were unable to make the contributions necessary to be eligible for those benefits—people who had disabilities; people who had been unable to make enough contributions to cover their old age—were covered. He also brought in the Industrial Injuries Act 1946 to look after those who were injured at work, those who needed a disablement pension for life, and indeed money for the dependants of those who were killed at work
2022-03-08	CON	SimonClarke	I know there are some who ask why we need to raise tax at all, and instead say that we should borrow to fund permanent increases in spending. Throughout this speech I have outlined all that the Government have done to protect people’s finances as we recover from the pandemic and deal with the rising cost of living, and those actions mean our economy has made a strong recovery from covid-19. Our GDP has rebounded, and over the past months job vacancies have hit record highs, while the unemployment rate has fallen sharply. However, it is easy to forget that all those steps come at a huge cost. Covid casts a long shadow across our economy. Indeed, our debt is at its highest since the early 1960s. As I have reminded the House on many occasions, that high level of borrowing leaves us susceptible to shocks, including changes in interest rates and inflation.
2022-03-10	LAB	KatharineBrooksOsborne	For women in my constituency, the covid-19 pandemic has brought back economic and social circumstances that would not look out of place in the 1930s. Throughout the 1930s, it was women who suffered socially as a result of endemic unemployment and it was they who had to face the landlord, the butcher and the greengrocer as they had to manage a home on a significantly lower income. Ninety years later, throughout the coronavirus pandemic, when I look at the livelihoods of some in my constituency and the withdrawal of vital support and rising food and energy prices, it feels like history is beginning to repeat itself
2022-03-10	LAB	KatharineBrooksOsborne	I would like to start my contribution by reflecting on the shared and collective experiences of working class women in the Jarrow constituency over the last 90 years. As this country recovers from the covid-19 pandemic, I am reminded of the history of struggle that my constituency has faced in the past, and of how, despite being generations apart, the struggles of unemployment in the 1930s are difficult to separate from the aftermath of the covid-19 pandemic. It is important to note—and relevant to this debate—how both of those struggles have predominantly impacted working-class women
2022-03-10	LAB	KatharineBrooksOsborne	When society grappled with the issues faced by 1930s unemployment, which peaked at 80% in Jarrow, the national Government targeted the poor through the means test. When this country faced the unprecedented economic effects of the covid-19 pandemic, this Tory Government made the choice to withdraw the £20 increase to universal credit. All those actions, past and present, have one common dominator: for the people in my constituency, they have had a disproportionate effect on working class and marginalised women. As we rightly reflect on the great successes and the battles that have been won by generations gone by in the fight for women’s and girls’ rights, I would like to remind the House of how critical it is as we mark International Women’s Day that we remember the responsibility we have in this House for how our actions here impact on all the women in our constituencies, and of the battle to get women into this place. On this, the late, great socialist Ellen Wilkinson said: “Women have worked hard; starved in prison; given of their time and lives that we might sit in the House of Commons and take part in the legislating of this country.” I would like to personally say how fantastic it is that, in my local area, the leader and deputy leader of South Tyneside local authority, the Member for a neighbouring constituency—my hon. Friend the Member for South Shields (Mrs Lewell-Buck)—and the local police and crime commissioner are positions all represented by women. I was proud to stand on Labour’s 2019 manifesto, which sought to address some of the imbalances in our society that I have referred to, particularly with the commitment to close the gender pay gap by 2030, the demand that all workplaces have a menopause policy and the policy that survivors of domestic abuse would be entitled to 10 days of paid leave. Those much-needed policies have unfortunately been largely ignored and have faded away as we enter the current post-pandemic political world. They are policies that have never been more needed
2022-03-15	CON	GrantShapps	The hon. Lady mentioned and referenced employment and unemployment, and I have three facts for her. First, we have record levels of employment in this country, which are higher than before covid. Secondly, unemployment has been falling every month for the past year. Thirdly, no Labour Government in history have left power with unemployment lower than when they came to office.
2022-03-15	CON	HenrySmith	Over recent months, many young people in Crawley have benefited from the kickstart scheme. In contrast to every Labour Government, which have all left office with unemployment higher than when they started, does my right hon. Friend agree that the way to recovery for our economy and the cost of living is the multi-billion pound plan for jobs that the Government are delivering?
2022-03-15	CON	LucyLeighFrazer	The hon. Gentleman knows from the statistics announced this morning that wages are up in real terms compared with pre-pandemic levels. In fact, unemployment is now almost back to pre-pandemic levels, and is lower than in Canada, France, Italy, Spain and Australia. On his specific question, the North sea oil industry already contributes additional taxes through a 40% rate, which is double the amount that other corporations pay.
2022-03-15	CON	RishiSunak	I am grateful to my right hon. Friend for his typically thoughtful question. He is absolutely right about the circumstances we face. The data this morning shows record numbers of people on payroll, and that is to be welcomed. Indeed, the unemployment rate is now back to the levels we saw before the pandemic, thanks to our plan for jobs. There are record vacancies, and we want to get people into work. The best way to do that is to give them the skills they need and cut taxes to increase incentives. That is exactly what this Government are doing, and I expect us to make more progress in the months ahead.
2022-03-15	CON	RishiSunak	The forecast for the public finances will be updated next week. As for jobs, I am happy to confirm that, according to today’s figures, there are record numbers of people on payrolls, record numbers of vacancies, and, indeed, more people in work now than before the crisis—and the unemployment rate is now lower than, or at the same level as, it was before coronavirus hit.
2022-03-15	CON	SimonClarke	My hon. Friend is right about the Government’s record on employment, just as he is right about the Labour party’s record on unemployment. To continue to boost employment, wages and living standards, he rightly references our plan for jobs, which is proving to be an enormous success. In total, the Department for Work and Pensions spend on labour market support will be more than £6 billion over the next three years.
2022-03-15	CON	SimonClarke	People are rightly angry that fraudsters stole from covid support schemes, as am I. When the schemes were launched, there was cross-party consensus that we needed speed to protect jobs, and because of our action unemployment peaked at 5.2%, not the 12% predicted at the start of the pandemic. We designed the schemes to prevent as much fraud as possible, and lenders stopped nearly £2.2 billion of potential fraud from the bounce back loan schemes. We continue to take action on multiple fronts to recover money that was claimed fraudulently.
2022-03-15	CON	SimonClarke	Some 130,000 young people across Great Britain have benefited from the kickstart scheme so far, including in my hon. Friends’ constituencies. That is lower than the 250,000 jobs that the scheme could have funded, but the scheme was designed at a time when unemployment was expected to peak at 12%. The reality is that, thanks to the intervention by my right hon. Friend the Chancellor, the economy has recovered better than expected and unemployment peaked at 5.2% in 2020.
2022-03-15	CON	SimonClarke	Youth unemployment is lower today than it was pre-pandemic, and the wider success of the scheme has to be judged in the context that the worst-case scenario that we were looking to offset never came to pass because of the interventions that we made. If a scheme does not achieve the headline numbers that were anticipated at the time it was established because the wider economic performance of the country was so much better than anticipated, that is a success, not something to bemoan.
2022-03-16	CON	DominicRaab	Of course we listen carefully to Sir David Norgrove, but what I would say to the right hon. Gentleman is that he points to the data yesterday and it showed that unemployment has fallen below 4%, is back at pre-pandemic levels and is being termed a remarkable success by everyone, including the Resolution Foundation. He talks about the truth and there is one golden truth: whenever there has been a Labour Government in the past, unemployment has always been higher when they left office than when they started. That is the jobs guarantee you get with Labour.
2022-03-16	CON	HelenWhately	On top of everything we are doing to help people with the cost of living, we are helping people to help themselves through our plan for jobs, and that plan is working. The UK was the fastest-growing economy in the G7 last year, and the International Monetary Fund forecast, produced before Russia’s invasion of Ukraine, was for us to be the fastest-growing major advanced economy again this year. Unemployment has now fallen to 3.9%, below its pre-pandemic rate, and payrolled employees are at a record high.
