2022-01-05	CON	AlexanderJohnson	It is great to be here with the right hon. Lady, the shadow Secretary of State for the Future of Work—we know the future job that she has in mind. I wish her well. What we are focused on is delivering jobs for the British people. It is a quite extraordinary thing that there are now record numbers of people in work—420,000 more than there were before the pandemic began. We have youth unemployment at a record low. Never let it be forgotten that when omicron hit this country, what was the instinctive response of Labour Members? [Interruption.] That is right, Mr Speaker. They said that we needed a road map to lock down. If we had listened to them, we would not have anybody working at all.
2022-01-05	CON	AlexanderJohnson	It is not just Labour’s record in London or in Wales: every Labour Government in history since the second world war has left office with unemployment higher than when they came in. That is because only Conservatives can be trusted to deliver on the economy and on the people’s priorities, which is why, thanks to the policies that we have pursued, this country now has the fastest economic growth in the G7.
2022-01-05	CON	AlexanderJohnson	It was in fact Labour’s failure to invest in supply over a decade or more that reduced our ability to have cheaper, cleaner energy. We are rectifying that. We are taking the tough decisions that this country needs for the long term. It is because we have taken those tough decisions—because we have taken the balanced and proportionate approach we have that they opposed every step of the way—that we have youth unemployment at a record low. We have 420,000 more people in jobs now than there were before the pandemic began, and we have not only the most open society and economy in Europe but the fast economic growth in the G7. That is completely contrary to what the right hon. Lady has just said, and it is because of our stable, balanced and proportionate approach. Never let it be forgotten that when omicron presented itself, what did they vote for? They reached for the lever of more restrictions. They said lockdown; we said boosters. They carp from the sidelines; we get on with the job.
2022-01-05	CON	AlexanderJohnson	No—what I would tell the House and the country is that Labour incompetence has ruined this country time and time again. There has never been a Labour Government that have left office with unemployment lower than when they came in. And what is the right hon. Lady’s answer to the energy crisis? It is to nationalise our energy
2022-01-10	LAB	BethanWinter	In Cynon Valley, the rates of unemployment doubled during the pandemic and by March 2021 we had the highest rate of economic inactivity of all constituencies, not just in Wales but in Britain—a staggering 42% of people of working age. Many of these people, through no fault of their own, are now reliant on benefits that come within the scope of the welfare cap. We have 6,000 people on universal credit and over 5,000 still on legacy benefits. They are also now suffering from the £20 cut to universal credit
2022-01-11	CON	ChristopherGrayling	I have great respect for the hon. Member for Stalybridge and Hyde (Jonathan Reynolds). He deserves to sit in the front rank of his party, but I have to differ from him when he says that this Government have provided inadequate support to the business sector. I take him back to 2010. Both parties have faced a crisis; Labour had the financial crisis, we have had the pandemic. Both parties have had to spend hundreds of billions of pounds to prop up the economy. But back in 2010, when I became Employment Minister, unemployment was 2.7 million and the pressures were all upwards. Today, in the wake of the pandemic, having just before the pandemic managed to get unemployment back to the levels of the 1970s, and having feared that the pandemic would take us back to where we had begun, actually we have ended up, as we are, I hope, coming to the end of the pandemic, with unemployment heading down towards 4% and hopefully below, and significant numbers of vacancies in our economy. That has happened because Ministers took the right decisions at the right time and targeted their support in the best possible way. It is not possible to do everything for everyone—
2022-01-11	CON	ChristopherGrayling	The hon. Gentleman knows from experience, when this country has been through bad times, how devastating unemployment can be for communities, when people are looking for jobs and cannot find them. Today, if people are looking for jobs in our workforce, the opportunities are a whole lot better than they were back in 2010, even after the impact of a pandemic, and we should be pleased about that. Of course it is not a reason for complacency; of course we still face many economic challenges, but it is a major step forward for this country that we are not in the place that I thought we would end up in after a devastating pandemic, going back to those days of 2.5 million and 3 million unemployed. We do not have that right now, and that, I think, is because Ministers took the right decisions at the right time. I am proud that they did that
2022-01-11	CON	FayJones	Having spoken to my right hon. Friend the Chancellor, I am reassured by the way in which he is focusing on the issue of rising household costs. He is approaching it in a sensible and measured way, not with social media clickbait but with targeted interventions that will make a meaningful difference to those who need it most. As a result of investment in the kickstart scheme of around £2 billion, peak unemployment is now forecast to be 2 million fewer than previously feared. Keeping to the energy price plan and increasing the warm home discount and the winter fuel payment are all steps that will curb the rising cost of living, and the increase in the universal credit taper is a tax cut for 2 million low-income families. I and many other colleagues on this side of the House will be meeting the Chancellor again later this evening to discuss this in greater detail. I am extremely grateful to the Treasury and BEIS teams for the listening mode that they are so clearly in
2022-01-11	CON	FeliciaDrummond	The coronavirus job retention scheme supported 12 million workers when they could not be expected to work safely. However, funnily enough, the Opposition said that the scheme was a waste of money. Then there were predictions of mass unemployment as furlough began to end and business resumed activity. Those gloomy predictions did not turn out to be accurate and I do not think that the motion will be accurate. Businesses have been able to use loans and discretionary grants effectively, especially in the hospitality sector, which—I think we all agree—has faced the most challenges
2022-01-11	CON	FeliciaDrummond	We should also recognise when we talk about inflationary pressures that they generally have global origins. We live in a world with pressures that are outside the control of any Government. Having said that, consumer prices in the UK have increased more slowly than in many economies, including several in the eurozone. Current UK unemployment is considerably lower than in the eurozone—4.2% as opposed to 7.3%—and among the lowest in the developed world
2022-01-11	CON	SimonClarke	As a Government, we want to help people into work and to gain the skills they need. We are investing £900 million in each year of the spending review on work coaches, who will provide effective support to help jobseekers on universal credit move into work and, for the first time ever, help people progress once they are in work. We have also invested over £200 million in the JETS—job entry targeted support—scheme, for those unemployed for over three months. Applicants are supported with CV writing, interview skills and job search advice, worth £1,000 per person. We also know that young people were disproportionately affected by the pandemic, which is why we invested in kickstart to fully fund and create hundreds of thousands of jobs for young people. So far, over 112,000 young people have started a kickstart job. To help those affected by long-term unemployment, we launched the restart scheme, which provides up to 12 months of intensive, tailored employment support
2022-01-11	CON	SimonClarke	I do not think anyone is saying that we are going through an easy time. We have just emerged from the teeth of an international pandemic, which is still causing major challenges. We have now got to a situation where, despite all the dire predictions, we are back at almost pre-crisis levels of economic activity, and unemployment is fully 2 million fewer than was forecast at the height of the crisis in 2020. That is thanks to the co-ordinated policy decisions of this Government and it is certainly why this situation has not been much, much worse in millions of homes across the country.
2022-01-11	LAB	JonathanReynolds	I share the mutual respect that the right hon. Gentleman kindly outlined at the beginning, but he will accept, because this is his background, that there are 1 million fewer people in the labour market than pre the pandemic. Yes, unemployment has gone down, but of course the participation rate has gone down; it is not because those people have simply transferred across. The huge worry right now, and what is leading those shortages, is that participation has fallen. That is the true picture, surely, is it not?
2022-01-12	CON	AlexanderJohnson	What we are doing is offering financial and technical support to businesses, which are responding magnificently. As we come out of the pandemic, as I said to the House earlier, we are seeing record numbers of people in work and youth unemployment at a record low.
2022-01-12	CON	AlexanderJohnson	Yes indeed, and I thank my hon. Friend for that. It is notable that the Opposition do not like to dwell on these points, but it is an astonishing fact that we have 420,000 more people in work now than before the pandemic began, and youth unemployment is at a record low.
2022-01-14	CON	JulieMarson	The barriers to transport faced by people with disabilities prevents many from fulfilling their potential at work, which is devastating for them and a huge loss for UK plc. In 2020-21, 52.3% of disabled people were in employment, whereas the employment rate for people who are not disabled was 81.1%, down from 82.2%. The unemployment rate for disabled people was 8.4% in October to December 2020, which was up from 6.9% a year previously. Disabled people have an employment rate that is 28 percentage points lower than that of people who are not disabled, and this is referred to as the “disability employment gap”. The impact of the pandemic has exacerbated existing problems. Over the past year the proportion of disabled people in employment has gone down. The proportion of disabled people who are either unemployed or economically inactive has risen. People who are not disabled have also seen an increase in the proportion of that, but it is smaller and we need to be very aware of that. The Bill will not solve all those problems, but it will contribute to the long-term solutions that the Government are committed to, in order to make transport accessible, more affordable and readily available for people with disabilities
2022-01-14	CON	MarkJenkinson	In my constituency, as in others across England, there are pockets of deprivation, unemployment and sometimes, I have to say, hopelessness. I am acutely aware of the stark disadvantages faced by so many young people. They have so much to contribute, but so often they are written off too soon. If we are serious about “levelling up”—if it is to be more than just a slogan or a soundbite—giving all children access to good-quality careers advice is one of the most important weapons in our fight against poverty and despair. We must leave no child behind
2022-01-18	CON	JohnGlen	I am of course very concerned about businesses that are struggling and have been in difficulty, but I am pleased that the economy has recovered far quicker than many anticipated it would this time two years ago, and I am pleased that unemployment is at about 4.1%, rather than the 12% that was anticipated at the start of this crisis. There is no complacency from this Government, and there is an absolute determination to support businesses in getting back on their feet and trading. That is why we put in place so many interventions, which were designed in different ways to maximise the support to businesses and individuals across this country.
2022-01-19	CON	AlexanderJohnson	Let us be absolutely clear: the right hon. and learned Gentleman is continuing to ask a series of questions which he knows will be fully addressed by the inquiry. He is wasting this House’s time. He is wasting the people’s time. He continues to be completely irrelevant to the—[Interruption.] We have an inquiry, and I am not going to anticipate that inquiry any further. What I can tell him is that because of the judgments that were taken in Downing Street, because of the willingness of the British people to put trust, by the way, in those judgments and to come forward in huge numbers to get vaccinated, which people did—and I thank them for it from the bottom of my heart—and because they listened to our messages, we now have the fastest growing economy in the G7 and youth unemployment, which the hon. Member for Leeds West (Rachel Reeves) ought to care about, at a record low.
2022-01-19	CON	AlexanderJohnson	No, I really do not agree with the hon. Lady, and I do not think that she can have been following anything that has been said this afternoon. We have unemployment falling to near-record lows, and we have job vacancies at record highs. That is what Conservative Governments do: they create jobs and get the economy moving.
2022-01-19	CON	AlexanderJohnson	We will continue to look after people throughout this pandemic and beyond, but we have also been cutting crime by 10% and putting 11,000 more police officers out on the streets. There was record home building last year—more homes that at any time in the last 30 years. We are building 40 new hospitals. Gigabit broadband has gone up from 9% coverage in our country to 65% already. As I said already—I think three or four times today—we have more employees on the payroll now than before the pandemic began, and youth unemployment is at a record low
2022-01-19	LAB	MaryTwist	Q12. My constituents are rightly angry about the Prime Minister’s behaviour, but while Downing Street fights to save his political life, people across the north-east are worrying about rising food and energy bills, rising unemployment and rising levels of child poverty. He talks about levelling up, but my constituents are seeing opportunities cut. Does he agree that his Government have failed and it is time for him to go?
2022-01-20	CON	JacobReesMogg	We then come on to what the hon. Lady and other socialists have been saying about the Prime Minister. He has rightly apologised to the House for mistakes that have been made. He has apologised to the country for mistakes that have been made, and Sue Gray is carrying out an investigation, but the socialists never want due process to take place. They always want to make the decision before they have the facts. They do not want to do it properly. This Government are doing it properly, and while we were doing it properly, we set up, under this Prime Minister’s leadership, the furlough programme that saved 14 million jobs and that kept the economy going, which means that the economy is now back above its pre-pandemic levels and that youth unemployment is at a record low
2022-01-24	CON	DavidRutley	For young people, who are of course most at risk of long-term unemployment and have been hit particularly hard by the pandemic, we have the £2 billion kickstart scheme, which has seen over 122,000 young people start a six-month work placement across many different kinds of jobs and sectors, with 10,000 starts in Scotland alone. There are youth hubs in every jobcentre to support young people—150 youth hubs have been opened, 19 of them in Scotland—and extra support is available for those aged over 50 as well, to help them find the work they need and help them progress with their career aspirations
2022-01-24	CON	DuncanBaker	However as Conservative Members said in interventions at the beginning of the debate, it is fair to say that, since March 2020, the Government and the Chancellor’s response to the pandemic has been one of the best in the world, with help and support for millions and millions of people. It is widely expected that our recovery will be the best in the G7. We have unemployment back to pre-pandemic levels, and we have multiple job vacancies—last time I looked there were 1.25 million of them. The SNP must realise that we cannot spend £400 billion and be some £2.2 trillion in debt without needing some degree of responsible management of the public finances going forward, especially when we will have rising interest rates in the future
2022-01-24	CON	JeromeMayhew	The Government intervened right at the start of the pandemic to save jobs through the furlough scheme, which supported more than 1 million jobs in Scotland alone, and other schemes, from the self-employment income support scheme—I refer to my entry in the Register of Members’ Financial Interests—to the business bounce back loan scheme to CBILS, the coronavirus business interruption loan scheme. Those saved thousands of jobs, including in the business of which I formerly had the honour to be managing director. Without a CBIL, that company—which employs more than 1,000 people, including several hundred in Scotland—would likely have gone to the wall. It has not and is now growing again—probably because I am no longer directly involved in it—and it is creating many hundreds more jobs, here and in America. The impact of all that is that we did not suffer from 12% unemployment, which was the estimate of economists at the time. Now, as we leave this dreadful pandemic behind us—I hope—we have 4.2% unemployment throughout the country. In my constituency, it is at about 3.2%. Instead of having a jobs crisis in which people need jobs, the crisis in Broadland is the lack of people to fill the jobs available as our businesses grow
2022-01-24	CON	SimonClarke	I am glad to have this opportunity to respond on behalf of the Government. The UK economy is roaring back to life following the unprecedented challenges that we faced during the height of the coronavirus pandemic. It may have escaped the attention of Scottish National party Members, but job vacancies have hit record highs while the unemployment rate has fallen sharply. Our GDP has rebounded. We are set to enjoy faster growth this year than anywhere in the G7, and our economy is now bigger than it was before the pandemic
2022-01-24	CON	SimonClarke	If we look at the Office for Budget Responsibility forecasts, we see that they are for 6.5% growth in 2021 and 6% growth in 2022. That is an incredibly strong economic recovery, and one of which we should be very proud. With regard to the Kickstart scheme, we obviously always want to encourage maximum uptake and we continue to work to refine that scheme and make sure it works to best effect, but it must be considered in the context of an unemployment rate that is now only just over 4%. We have a very tight labour market, and that very success is leading to some of the challenges that we face in getting people through every different scheme.
2022-01-24	CON	SimonClarke	Job numbers are rising, unemployment is falling and the economy is back to its pre-covid level, but that has not happened by accident. The economy has been able to bounce back so strongly and quickly only because of the decisions made by this United Kingdom Government. Let me remind the House of those decisions. The £400 billion of direct economic support has protected millions of people’s livelihoods in every part of the United Kingdom, with the furlough and self-employment income support schemes safeguarding, in Scotland alone, more than 1 million jobs. The success of our vaccine roll-out has meant that we have retained the most open economy and society anywhere across Europe. And our plan for jobs is creating work opportunities and ensuring that people have the right skills to get into work
2022-01-25	CON	GrahamStuart	I welcome the investigation. We can see the absolute terror on the faces of the Opposition. For them, this is partygate, but they know that they are up against a Prime Minister and a Government who have brought youth unemployment to its lowest ever level. This Government, led by the Prime Minister, brought us the AstraZeneca vaccine and ensured that we had the most successful booster programme in the world. That is why there is absolute terror on the Opposition Benches that we should focus on policy in this place and on the priorities of the British people. That is why the Opposition are so desperate to land this even as the inquiry is going on.
2022-01-27	CON	JacobReesMogg	However, the key to ensuring that the economy works lies in the steps taken by the Government during the pandemic, when they introduced the furlough scheme and bounce back business loans to ensure that the structures of the economy survived it. That is fundamental to why we now have the highest payroll employment in our history, the lowest recorded youth unemployment in our history, and the economy back to where it was before the pandemic. So the real question on the cost of living is whether the economy is being managed well, and the answer to that is “Yes, it is, because of the decisions that this Government made.” The hon. Lady then raised the issue of fraud, and the £4.3 billion that has come out of the covid supplies. That is about 1% of the amount of money that British taxpayers provided. However, the Government have already stopped or recovered £743 million in overclaimed furlough grants. We have prevented £2.2 billion in fraud from our bounce back loan scheme, and our Taxpayer Protection Taskforce is set to recover an additional £1 billion; its investigations are under way. The Government take this seriously, but if we want to know who are the real experts in wasting taxpayers’ money, it is the socialists. When they were in opposition, what happened to the NHS computer system? How many billions were frittered away through their irresponsible approach to taxpayers’ money
2022-01-27	CON	JacobReesMogg	On the economy, I think the hon. Gentleman is simply wrong. The policy adopted during the pandemic has saved the UK economy—that is why it has already got back to its pre-pandemic level. The £400 billion of taxpayer support for individuals and industry meant that people did not lose their jobs and that businesses survived the pandemic. If we had not provided what was probably the greatest level of support of any country in the world, we would have reduced the supply available when the economy came back, and that would have been inflationary. It would also have had the effect of putting many tens or hundreds of thousands—possibly even millions—into unemployment; in fact, we have the lowest youth unemployment on record. I think the attack on economic management is simply misplaced and that my right hon. Friend the Prime Minister and the Government got the big decisions right. That has been so fundamentally important during the whole of the covid pandemic.
2022-01-31	CON	EstherMcVey	What a disappointment this statement is. Having read the newspapers, I was hoping to be able to come here and congratulate the Secretary of State on the Government’s recent conversion to common sense in halting the mandatory vaccination of NHS workers. Instead, he is making a half-and-half decision today, knowing that the sword of Damocles hangs over those 100,000 NHS workers, because they have to have their first vaccination on Thursday. He will then be sending them on a pathway to unemployment, along with the thousands of care workers who have already lost their jobs. What I want to know is what he is now going to do to help those thousands of people get a job, and what compensation he will pay them.
2022-02-01	CON	JeromeMayhew	We can expand that out to the national economy, because hon. and right hon. Members will recall that the economists were predicting an unemployment rate of 12% in response to the covid closure. We forget that now, because in fact the unemployment rate nationally today is 4.2%. That is millions of jobs and millions of families—hundreds of thousands of families, certainly—whose economies and lifestyles have been protected by the very speed at which the Government acted, but there was a partial cost to pay for that
2022-02-01	CON	MichaelEllis	Thirdly, the support worked. Many thousands of jobs were saved, and today we have a thriving labour market, with record low unemployment, the economy returning to its pre-pandemic size faster than expected, and you know what, Mr Speaker—the fastest-growing economy in the G7.
2022-02-01	CON	RishiSunak	Thanks to our vaccine booster roll-out, we now have one of the most open economies in Europe, and thanks to our economic plan, we are set to have one of the highest growth rates in the G7 this year and last. We continue to deliver on our plan for jobs, doubling down with a new target to move half a million more people off welfare and into work by the end of June. Unemployment is falling and is now down to almost record lows. Youth unemployment is already at record lows. All of this shows that our plan for jobs is working.
