2021-08-03	PD	PinottiRoberta	Nelle audizioni che abbiamo svolto, è stato evidenziato l'aumento esponenziale degli attacchi cyber, ulteriormente incrementati nel periodo Covid, per lo smart working e per le situazioni che si stavano creando. I dati sono impressionanti. Il tema legato al rischio dei dati sanitari, che oggi stiamo mettendo in evidenza per quello che riguarda la Regione Lazio, in Commissione difesa era già stato sottolineato dalla dottoressa Nunzia Ciardi, direttrice del servizio della Polizia postale, che ha fatto un'audizione brillantissima, molto interessante. Oltre a mettere in evidenza l'aumento dei crimini, ci ha raccontato la storia - che oggi sta riemergendo - di una donna tedesca, morta perché un attacco cyber ha bloccato di fatto un ospedale e, quando è giunta al pronto soccorso, non sono potuti intervenire, ma lei non aveva il tempo di arrivare in un altro ospedale. Stiamo quindi parlando di rischi non solo per le risorse e per l'economia, ma per la vita: questa è la gravità della situazione. È stato ricordato, inoltre, che anche l'Irlanda ha subito un attacco al sistema sanitario, proprio perché il tema della sanità, così importante per ciascuno di noi, diventa un elemento particolarmente sensibile. Al termine del lavoro svolto in Commissione, è stata votata all'unanimità una risoluzione finale che ha messo in evidenza una serie di impegni, che riguardano la Difesa e l'esigenza dei collegamenti internazionali, e ha messo a punto, come indirizzi al Governo, alcune delle questioni oggi al nostro esame, tra le quali l'esigenza di avere un'Autorità unica, debba occuparsi dei servizi pubblici, ma anche dei privati, e quella di formazione e di personale altamente qualificato, perché stiamo parlando di una materia con un'evoluzione così rapida che, se non stiamo al passo con i tempi, i cosiddetti cattivi diventano molto più forti di noi. Da questo punto di vista, è importante che oggi arrivi in Senato un provvedimento su cui ha lavorato molto la Camera. Sono d'accordo con i giudizi positivi che ho ascoltato da parte di molti colleghi sui miglioramenti apportati alla Camera, sia specificando i confini dell'Agenzia, sia ampliando il ruolo del Parlamento. Oggettivamente, però, il Senato ha un avuto un tempo molto ridotto per trattare il tema al nostro esame. È stato importante, comunque, che in Commissione tale approfondimento ci sia stato. L'Agenzia ha una personalità giuridica di diritto pubblico, è dotata di autonomia regolamentare, amministrativa, patrimoniale, organizzativa, contabile e finanziaria, ed avrà il compito di svolgere il ruolo di Autorità nazionale, come ricordava prima un collega di Forza Italia, attuando una centralizzazione delle funzioni e delle competenze che finora erano distribuite fra enti e Ministeri: questa era la principale fragilità, perché è necessaria una risposta unitaria e le risposte non possono essere frammentate. Nell'audizione dell'Autorità delegata, che si è tenuta alla Camera, il sottosegretario Gabrielli ha ricordato - e alcuni interventi lo hanno rilevato - come in realtà la Germania si sia mossa già nel 1991, creando un'Agenzia che oggi dispone di 1.200 unità di personale. In Francia, un'Agenzia simile è nata nel 2009. Lo dico perché ho sentito anche la collega Rauti dire che è tutta colpa del Governo, o comunque degli ultimi Governi. Ricordo che dal 1991 ad oggi si sono succeduti Governi di cui hanno fatto parte anche esponenti che oggi sono in Fratelli d'Italia. Lo dico perché, se vogliamo affrontare con serietà questi argomenti, visto che poi voteremo quasi all'unanimità, con alcune astensioni, forse sarebbe bene evitare i distinguo politici, altrimenti non riusciamo a capire davvero bene la materia. A questo punto, è stata identificata l'esigenza di avere un'unica autorità. All'inizio era stata individuata l'Autorità militare alla Presidenza del Consiglio, poi si è pensato al Dipartimento delle informazioni per la sicurezza (DIS). Oggi finalmente si individua lo strumento che considero corretto, perché c'è bisogno di avere un'agenzia che crei software e hardware, ma che sia un punto di riferimento sia per il pubblico sia per il privato. Da questo punto di vista, il tipo di strutturazione che si dà a quest'agenzia mi convince molto, perché i problemi che erano sorti in una prima ipotesi nel Governo precedente e che sembravano non delineare bene i confini fra le Agenzie di intelligence e il ruolo di questa adesso sono chiariti: l' intelligence fa l' intelligence, continua i propri compiti; è chiaro che si interfaccia con l'Agenzia - come faranno il Ministero della difesa e quello dell'interno - che però ha un altro ruolo, compreso quello importantissimo della produzione di strumenti. Infatti, se vogliamo che su questo tema l'Italia sia sicura, deve avere anche una capacità di produzione autonoma di sistemi. Il ministro Colao - e vedo qui la Sottosegretaria per questi temi - si dice preoccupato perché il 95 per cento delle pubbliche amministrazioni è molto debole da questo punto di vista e dice che sta lavorando sul cloud, rispetto al quale è importante utilizzare le migliori tecnologie, che in questo momento non sono italiane, le cui chiavi di utilizzo devono essere però nazionali. Con queste affermazioni fa una scelta importantissima, però dobbiamo implementarla con produzioni, capacità e quindi sviluppi anche industriali nazionali. L'Agenzia ha anche questa funzione, oltre a quella di essere il punto in cui arrivano gli allarmi degli attacchi, che prima erano al Ministero dello sviluppo economico (Mise), con una dotazione di personale estremamente ridotta, mentre ora ci sarà la possibilità di implementarla significativamente. Questo è un tema cruciale per il futuro di qualsiasi Paese e per la sicurezza dell'economia, dello sviluppo, della crescita, ma anche della vita, come ha dimostrato la storia di quella povera signora tedesca. Il cambiamento culturale che dobbiamo fare è fondamentale, perché, quando riceviamo un attacco, siamo già in ritardo. Il tema vero della cybersicurezza è infatti come prevenire e riguarda la safety più che la security, perché abbiamo bisogno di prevenire. Quando si parla di sicurezza, è sempre importante prevenire; lo è anche per le Forze armate, ma per la cybersicurezza diventa fondamentale, perché, quando si apre un varco, il rischio diventa veramente generalizzato.
2021-08-04	FI	PerosinoMarco	Signor Presidente, rappresentanti del Governo, colleghi, l'assestamento, di cui ha testé parlato la relatrice, comprende il recepimento del decreto-legge sostegni- bis per 40 miliardi e l'accertamento dei residui passivi, che è un'operazione molto importante. Il rendiconto comprende il conto del patrimonio, che evidenzia un peggioramento di 299 miliardi, con un totale di passivo del sistema Italia di 2.215 miliardi. I numeri non perdonano, questo è certo. Quanto contenuto in questi due Documenti che, assieme al bilancio di previsione, sono tra i più importanti all'esame di questo Parlamento, riporta quanto viene discusso in corso d'anno, su cui si va d'accordo o meno, ma che alla fine si traduce in numeri. Purtroppo il tutto passa in un paio d'ore perché i numeri sono antipatici, ma a mio avviso dovremmo approfondirli tutti insieme, approfittando della pausa estiva. Ripeto alcune cifre, riportate molto bene dai relatori. Le entrate finali sono pari a 569 miliardi e le spese finali a 840 miliardi. Le entrate complessive, che assommano il sistema del debito pubblico, cioè l'estinzione a scadenza e la riaccensione pari importo, oppure a importo superiore se necessario, come è stato fatto in questo anno, ammontano a 943 miliardi e le uscite sono pari a 1.076 miliardi. Il saldo da finanziarie è di 270 miliardi ed è stato finanziato con il debito pubblico. Il risparmio pubblico, che sarebbe la differenza tra le spese correnti meno le entrate tributarie ed extratributarie, è di 105 miliardi in negativo. Dovrebbe essere invece positivo per poter finanziare gli investimenti. Gli interessi passivi sono calati del 2 per cento, ma ammontano a 66 miliardi sul debito pubblico (che oggi è di 2.700 miliardi), perché scontano interessi più alti rispetto al mercato, ma si riferiscono al debito pregresso. Ora i BTP sono emessi a un tasso dello 0,50 per cento per i primi tre anni e all'uno per cento dopo il terzo anno, quindi il debito costerebbe molto meno se rinegoziato. Tuttavia, a mio avviso, il totale del debito italiano (come ho già detto qualche altra volta, ma questa volta l'ho messo in ordine e vorrei sottoporlo all'Assemblea e al Governo) è di circa 2.700 miliardi di euro. I 400 miliardi acquistati dalla Banca centrale europea, per me, sono debito pubblico; i 220 miliardi circa del PNRR di prossima contrazione o elargizione da parte dell'Europa sono tutto debito pubblico (tutto, perché mi si dimostri che i sussidi sono un'altra cosa). Ci sono, poi, secondo calcoli verosimili, circa 50 miliardi di crediti fiscali dei contribuenti, compreso l'ecobonus al 110 per cento che sta partendo. Ci sono da 30 a 50 miliardi di euro di debiti commerciali dello Stato. La sommatoria di questi importi fa 3.400 miliardi, che in rapporto a un PIL di 1.651 miliardi nel 2020 è circa al 200 per cento. Ma a questi importi io assommo, nel sistema Italia, anche gli NPL ( non performing loan ), che secondo l'importo più verosimile sono 370 miliardi. Passo ora a parlare di debito buono e debito cattivo. Il debito buono è quello che finanzia le spese necessarie e gli investimenti, ma non finanzia i privilegi - e ci sono - e la spesa improduttiva. Su questo bisogna puntare: avere certezza e provare a fare delle proposte per venir fuori da questa situazione. La sigla PNRR sta per Piano nazionale di ripresa e resilienza: sulla resilienza faccio ancora un po' di confusione e non so se tutti hanno capito bene, ma mi informerò. Ho l'impressione che in economia siamo, di fatto, commissariati dall'Europa e - udite, udite, bestemmia - commissariati da un italiano. In economia vi sono troppe norme, anche nei decreti-legge sostegni e, prima, nei decreti-legge ristori: troppa carta. Per l'ambiente ci sono troppe autorizzazioni da richiedere. Il decreto-legge semplificazioni ha fatto dei tentativi, che spero si possano tradurre in pratica, ma l'ostacolo è nella giustizia civile, penale e amministrativa. Pensate che le rocce e le terre da scavo sono ancora considerate rifiuti e se un cittadino, di qualsiasi professione, si permette di trasportare un camion, un trattore o un rimorchio carichi di questo materiale è sanzionabile penalmente, se non ha fatto una pratica che supera di 100 volte il valore della merce. Il Monte dei Paschi di Siena richiederà un'iniezione di denaro pubblico, dopo i 5,4 miliardi già erogati in passato; questo è altro debito che va ad aggiungersi, che secondo me dovrebbe essere addebitato a quelli che l'hanno fatto. Le Autostrade le abbiamo di nuovo incamerate; le manutenzioni, ordinarie e straordinarie, e gli investimenti sono un miraggio. È altresì un miraggio il risanamento dell'Ilva. Con il prezzo dell'acciaio odierno guadagnerebbe molti miliardi, che diventerebbero denaro pubblico, con imposte e stipendi; invece lavoricchia, fa cassa integrazione (che è un costo) e intanto compriamo l'acciaio dalla Cina al prezzo che vuole la Cina. La transizione green e la modifica dell' automotive porteranno notevoli problemi. L'INPS è sovraccarica di lavoro e di impegni, anche finanziari. La sanità, quando farà i conti con la pandemia, avrà un debito sommerso che stimo in 50 miliardi di euro. In questi due documenti, soprattutto nel rendiconto, si parla anche dei residui. I residui attivi sono 211 miliardi di euro, che farebbero parte del famoso magazzino fiscale (sono quelli degli ultimi anni). I residui passivi sono 196 miliardi, di cui 105 in conto capitale. Se questi partissero senza vincoli sarebbero già un cespite di sviluppo. Mancano, al 31 maggio, 691 decreti attuativi da inizio legislatura, a fronte dei 120 decreti-legge o leggi vigenti. Quanto all'inflazione, gli economisti dicono sempre, a posteriori : sarebbe dovuto andare in un certo modo, ma poi è andata in un altro modo; avevamo pensato che ci potesse essere la ripresa e che l'inflazione fosse dannosa, ma forse ci siamo sbagliati. Noi diciamo invece che l'inflazione al 2-3 per cento aiuta a pagare il debito e questo è un mito da sfatare in Europa. L'inflazione rimescola i fattori della produzione, lasciando indietro qualcuno in qualche fase, ma poi li riprende e dà effervescenza e forza all'economia. Il rendiconto non è perciò modificabile ed è la fotografia dell'Italia al 31 dicembre 2020. Credo che occorra una seria riflessione del Parlamento, della maggioranza così vasta e anche dell'opposizione costruttiva, e sia necessario parlare dei numeri, perché non vedo in prospettiva la volontà di innescare un meccanismo propositivo o produttivo, che dia almeno una proposta o una giustificazione. Non deduco questo dai dibattiti, non lo vedo nei giornali economici, non lo vedo da nessuna parte, fatte salve alcune frange dell'Italia produttiva, che capiscono la necessità di produrre tanto in Italia per ridurre questi importi macroscopici e molto pericolosi.
2021-08-04	M5S	MautoneRaffaele	Signor Presidente, vorrei stigmatizzare l'ennesimo episodio di violenza e di aggressione - in questo caso per fortuna solo verbale - subìto dal personale sanitario medico e infermieristico, avvenuta a Napoli, nella zona dei Quartieri Spagnoli; oggetto delle minacce verbali è stato il personale del 118, presente su un'autoambulanza impegnata nel primo soccorso. Ebbene, due giovani in scooter hanno affiancato il mezzo di soccorso, sferrando pugni e calci al veicolo, apostrofando gli operatori a bordo dello stesso con offese verbali, epiteti e minacce, con un linguaggio aggressivo e volgare. «Se passi di qua devi chiudere queste luci»: questa è la fase imperiosa e minacciosa pronunciata, quasi ad affermare il loro personale potere di concedere o meno il permesso di attraversare quel territorio, quasi fosse il loro territorio, probabilmente perché i lampeggianti dell'autoambulanza si potevano confondere con quelli della polizia. Questo è solo l'ultimo episodio in ordine di tempo, ma certamente non resterà tale, di aggressione subìta dai medici e dal personale sanitario del 118, ma in generale di tutta l'area dell'emergenza, compresi i pronto soccorso ospedalieri e le guardie mediche, che sono ripetutamente oggetto di aggressioni e sottoposti a enormi stress psicofisici, ancor di più in questo periodo di emergenza pandemica. Questa situazione è anche legata a una cattiva organizzazione, particolarmente sentita in alcuni territori dell'area dell'emergenza territoriale, che necessita di una completa e attenta riorganizzazione. La collega, senatrice Castellone, a tal proposito ha presentato un disegno di legge che, con il contributo di tutta la Commissione sanità, pur nelle differenti sensibilità e posizioni politiche presenti, dovrà necessariamente portare a una riforma del 118 e più in generale della rete dell'emergenza-urgenza, non più procrastinabile. Non basta chiamare semplicemente a parole "eroi" i medici e gli operatori sanitari che operano con impegno ed abnegazione tutti i giorni, rispondendo alla domanda di emergenza salute, ma è indispensabile riconoscerne il ruolo fondamentale e imprescindibile nel nostro sistema di emergenza e di assistenza sanitaria.
2021-08-04	M5S	PresuttoVincenzo	Signor Presidente, onorevoli colleghi e colleghe, rappresentanti del Governo, oggi in quest'Aula stiamo discutendo due tra i provvedimenti più importanti della nostra attività istituzionale: il rendiconto di gestione per l'anno 2020 e l'assestamento al bilancio dello Stato per l'anno 2021. Con il Rendiconto generale dello Stato il Governo comunica a noi parlamentari il risultato della gestione finanziaria dell'anno appena concluso, mentre con l'assestamento vengono simultaneamente aggiornate le previsioni riportate nell'ultimo bilancio approvato e si avviano i lavori per la prossima legge di bilancio. Noi tutti dovremmo dedicare molta attenzione a questi due provvedimenti, analizzandone ogni singola voce per comprendere meglio come sta funzionando lo Stato, qual è l'impatto delle nostre scelte politiche e dov'è necessario intervenire per correggere le disfunzioni. Purtroppo questo non accade e si perde una grande occasione, quella della consapevolezza, lo strumento più importante che abbiamo a disposizione e che ci aiuterebbe a trovare le soluzioni per risolvere i problemi. Il Parlamento è sempre più attratto dalla legge di bilancio, ma perde di vista le grandi informazioni che arrivano oggi in quest'Aula attraverso l'intervento dei due relatori e gli interventi che stiamo facendo per spiegare cosa appunto sta accadendo allo Stato. L'analisi finanziaria riportata in questo rendiconto riguarda un anno straordinario, il 2020, l'anno nel quale la pandemia da Covid-19 ha fatto sentire tutti i suoi effetti negativi, mettendo a dura prova lo Stato ed i cittadini. Infatti, i valori economici finanziari e patrimoniali in esso riportati misurano il disagio cui è stato sottoposto il nostro Paese, che ha coinvolto tutti gli aspetti della nostra vita. Leggendo il rendiconto relativo agli anni precedenti, emergeva che venivamo già da una situazione finanziaria che presentava diverse criticità. Ad esempio, sollecitati dall'Europa al rispetto del Patto di stabilità abbiamo sempre dovuto prestare molta attenzione alla situazione del debito pubblico in rapporto al prodotto interno lordo, il PIL, un indice molto conosciuto da quasi tutti i cittadini. Non siamo, però, riusciti a mettere in atto quei provvedimenti e le riforme attesi da anni, necessari per migliorare i valori di questo indice. In fondo, sarebbe stato semplice: bastava far crescere il prodotto interno lordo, prestando attenzione all'ambiente e alla sostenibilità. In alternativa, si potevano attuare misure per ridurre il debito pubblico oppure conseguire entrambi i risultati. Tutto ciò, però, non è stato fatto. Poi è scoppiata la pandemia da Covid-19, che ha fatto emergere tutte le debolezze del nostro Paese, a partire dalla gestione del sistema sanitario pubblico, che ha mostrato tutta la sua fragilità rispetto ad uno dei fenomeni più prevedibili a livello mondiale: il contagio da virus. Lo stesso rapporto Stato-Regioni è stato messo a dura prova proprio sulla gestione della sanità, la materia concorrente simmetrica per eccellenza, trasferita alle Regioni in funzione della riforma del Titolo V della Costituzione. Anche su questo tema, che riguarda il corretto funzionamento della pubblica amministrazione a livello centrale e periferico c'è molto su cui riflettere. In pratica, abbiamo avuto la riprova che una determinata modalità di organizzare la pubblica amministrazione non ha dato il meglio di sé; questo rispetto, ad esempio, al tema delle autonomie, che va attenzionato facendo tesoro dell'esperienza avuta nell'ambito sanitario. La pandemia ha anche condizionato e limitato i rapporti sociali, creando dei forti disagi al sistema economico, generando una crisi della domanda. Ciò ha avuto ripercussioni sulle attività imprenditoriali e su quelle professionali, interessando quasi tutte le categorie lavorative. È stata limitata la possibilità per gli studenti di frequentare in presenza le scuole di ogni ordine e grado e per i cittadini di poter interagire agevolmente con le istituzioni. A fronte di quanto appena riportato sul 2020, per fronteggiare l'emergenza da Covid-19 abbiamo dovuto adottare misure straordinarie, che hanno avuto un forte impatto sul bilancio dello Stato, sia per quanto riguarda le risorse stanziate, ma anche per quanto riguarda l'andamento della gestione e la realizzazione della spesa. Porto alcuni esempi. Con il decreto cura Italia abbiamo adottato misure per potenziare il Servizio sanitario nazionale e dare sostegno economico alle famiglie, ai lavoratori e alle imprese più colpite dalla crisi; con il decreto liquidità abbiamo adottato, fra le altre, misure per facilitare l'accesso al credito e gli adempimenti fiscali per le imprese; con il decreto rilancio abbiamo adottato misure in materia di salute e di sostegno al lavoro e all'economia, nonché di politiche sociali. Con il decreto Covid-19 agosto abbiamo adottato ulteriori misure per il sostegno ed il rilancio dell'economia; con i decreti ristori abbiamo integrato in un solo disegno di legge ben quattro provvedimenti in materia di tutela della salute, di sostegno ai lavoratori e alle imprese, di giustizia e sicurezza. Nel complesso, questi provvedimenti del 2020 hanno immesso nel bilancio dello Stato risorse aggiuntive per oltre 205 miliardi di euro, con il Parlamento impegnato a votare gli scostamenti di bilancio per garantire la copertura finanziaria in virtù della sospensione temporanea dei vincoli del Patto di stabilità. Inoltre, è doveroso da parte mia, visti i precedenti interventi, ricordare la grande funzione sociale assolta dal reddito di cittadinanza, fortemente voluto dal MoVimento 5 Stelle già dal 2019.
2021-08-05	M5S	MarinelloGaspareAntonio	L'autista è l'esclusivo operatore che svolge: attività di conduzione dei mezzi di soccorso sanitario e salvaguardia della sicurezza degli occupanti dei mezzi medesimi; accertamento dell'efficienza e della sicurezza del veicolo di soccorso affidatogli; conoscenza di tutti i presidi sanitari a bordo; comunicazione radiotelefonica con la centrale operativa 118, con gli altri mezzi di soccorso e con le aree di emergenza e pronto soccorso degli ospedali; comunicazione gestuale e luminosa con l'eliambulanza; capacità di lettura della cartografia; conoscenza e utilizzo dei sistemi di navigazione e posizionamento globale GPS; collaborazione nell'intervento di soccorso sanitario nelle varie fasi del suo svolgimento; immobilizzazione e posizionamento corretto e adeguato del paziente per il trasporto. Da Nord a Sud sono sempre più numerosi gli episodi di aggressione, segno evidente che il pericolo riguarda tutto il territorio italiano. Ritengo quindi doveroso da parte delle istituzioni evidenziare questi episodi, anche per continuare a tenere alta l'attenzione verso questa categoria di lavoratori, che durante il periodo pandemico hanno dato ulteriore dimostrazione della loro capacità e dell'abnegazione al lavoro, consapevoli del rischio cui andavano incontro. Nella mia vita professionale ho trascorso trentatré anni come medico di emergenza e urgenza e conosco quindi molto bene il grande lavoro svolto giornalmente dagli autisti delle ambulanze. A tal proposito, con questo mio intervento voglio anche richiamare l'attenzione del Parlamento sull'assoluta necessità di completare e accelerare l' iter legislativo del disegno di legge n. 1127 (Riconoscimento della figura e del profilo professionale di autista soccorritore), depositato nel marzo 2019, al fine di regolamentare questa figura inserendo importanti aspetti normativi, tra cui l'esigenza di garantire un'adeguata formazione, anche in considerazione della delicatezza delle mansioni espletate per il riconoscimento della figura. Proprio in questi giorni in Commissione sanità abbiamo incardinato il provvedimento. Auspico quindi che si proceda spediti, in accordo con tutte le forze politiche, perché su queste tematiche non possono esserci divisioni e l'impegno deve essere sinergico a livello istituzionale.
2021-09-15	FdI	ZaffiniFrancesco	Collega Sileri, con riferimento alle sue affermazioni, dico che sono molto convincenti, anzitutto per i suoi colleghi di partito. Stamattina ho ascoltato il collega Endrizzi. Collega Sileri e colleghi che fate parte con me della Commissione igiene e sanità, nei primi anni di lavoro della Commissione abbiamo ascoltato pareri assolutamente discordanti sui pro vax da parte dei rappresentanti del suo partito. Pertanto, se lei oggi è riuscito a folgorare, sulla via di Pregliasco, i suoi colleghi, le dico due volte bravo. Ha folgorato sulla via di Pregliasco, anzi di Sileri.
2021-09-15	LN	RipamontiPaolo	Poiché oggi rincorriamo un po' la campagna vaccinale anche attraverso obblighi surrettizi che stanno innescando non poche polemiche e, da questo punto di vista, invito anch'io ad abbassare un po' i toni, credo sia utile una maggiore trasparenza sull'indicazione dei dati forniti quotidianamente dal Ministero e ripresi dai media. A me viene spontaneo, da uomo vaccinato, pensare che il percorso vaccinale sia davvero una tutela così come è riportato sul sito dell'Istituto superiore di sanità. Nel momento in cui vengono forniti i dati dei contagiati, degli ospedalizzati, delle terapie intensive e dei deceduti, vorrei che fosse chiara la percentuale di vaccinati che sono stati contagiati, ricoverati, che sono in terapia intensiva e di vaccinati che purtroppo sono deceduti.
