2021-05-06	PD	DAlfonsoLuciano	Sappiamo che, prima della pandemia, nella pancia della pubblica amministrazione italiana c'erano 150 miliardi di euro, per rendere moderno il sistema Paese e fornire di infrastrutture adeguate il suo territorio. A quei 150 miliardi di euro adesso si aggiungono i 248 miliardi di euro del recovery plan e le risorse del prossimo settennio della programmazione, come Stato membro della UE. Ciò che serve ulteriormente è rendere la decisione della pubblica amministrazione certa e veloce, organizzando i rapporti tra la pubblica amministrazione e la vita dell'economia e dell'impresa sulla base del valore dell'immediatezza. Non è possibile che ci vogliano settantadue mesi per mettere a regime la qualità di un progetto. In Italia abbiamo fatto passare un messaggio sbagliato e sbilenco. Sblocca cantieri? No! Prima di tutto serve uno sblocca progetti, in maniera tale che il progetto abbia la comanda dell'opera da farsi. Dobbiamo ricostituire le competenze nella pubblica amministrazione, per fare in modo che ciò che si vuole per fronteggiare un bisogno, attraverso il progetto poi accada esattamente. Vi racconto un episodio, in breve: sono cento anni che il Comune e i cittadini di Chioggia attendono che si naturalizzi il passaggio di proprietà, da un terreno in possesso, che venne dato loro da Mussolini, ad un terreno che poi sarebbe stato affrancato, secondo le parole pronunciate dai vertici di Palazzo Chigi nel corso di cento anni. Siamo ancora in attività istruttoria, nonostante il Parlamento abbia deliberato e legiferato. Questa è la prova simbolo di come a volte la pubblica amministrazione arrivi a divorare, ad ostruire, ad assumere un atteggiamento da mammalucco, nei confronti di progetti che riguardano la vita reale. Abbiamo dunque un Ministero incaricato di riformare la pubblica amministrazione e abbiamo un impegno preciso nell'agenda del Governo: dobbiamo ridurre i tempi, non togliere la salvaguardia del rispetto della trasparenza, del diritto penale e della par condicio, ma occorre fare in modo che i pronunciamenti degli enti terzi arrivino per tempo, perché questo tipo di lavoro, finanziato dalla risorsa pubblica, consentirà alle imprese di avere digitalizzazione e cablaggio, nei rapporti tra progetto di vita dell'impresa e sistema della PA e consentirà alle scuole di avere la continuità dell'offerta formativa, come all'università. Pensate anche al bisogno di telemedicina, che prossimamente, a seguito della pandemia, diventerà una realtà. Non possiamo immaginare che la fragilità si chiamerà soltanto pandemia da Covid-19, perché probabilmente in futuro conosceremo anche altre forme di fragilità e ci sarà bisogno di organizzare la continuazione dell'offerta formativa, educativa e della sanità a distanza. Tutto questo richiede investimenti, ma anche attività decisionale nell'immediatezza, misurazione della quantità e della qualità dei risultati e valutazione. Abbiamo conosciuto lo smart working, una forma organizzativa imposta per necessità, ma dobbiamo anche riorganizzare i carichi di lavoro per fare in modo che si tratti di lavoro e che non sia la negazione del lavoro. Tutto questo richiede che si continui a legiferare nel merito, come abbiamo provato a fare nell'attività riguardante il primo decreto-legge sostegni: un'attività che ha tolto di mezzo la polemichetta, l'atteggiamento di interesse di parte. Sono molto soddisfatto, per esempio, per il lavoro che siamo riusciti a mettere a segno a proposito dei settori deboli della cosiddetta economia della collettività, della consistenza numerica. Pensate agli impianti di sciovia, agli impianti della montagna: sarebbe immaginabile che si liberino dalla debolezza senza l'aiuto pubblico? C'è un settore - quello delle realtà aeroportuali - che ad oggi non ha conosciuto alcun tipo di sostegno. C'è stato un tentativo di aiuto nella legge di bilancio in esercizio quest'anno; ancora, però, deve arrivare a destinazione. Dobbiamo aiutare le società aeroportuali altrimenti perderemo la connettività aerea, che significa velocità per le economie, facilità negli spostamenti. Il quadro delle questioni lo dobbiamo tenere a mente sapendo che non è finita, che il valore di 1.700 miliardi riguardanti il nostro PIL non si ripristina né con i 32 miliardi già deliberati né con i 40 che delibereremo. C'è bisogno di mettere a sistema una condizione di premura e di aiuto che davvero recuperi quello che abbiamo dovuto interrompere. Ce la dobbiamo mettere tutta, dobbiamo fare in modo che la pubblica amministrazione sia un alleato della vita reale e dobbiamo fare in modo che le misure destinate alla formazione e all'innovazione siano davvero a disposizione di tutti i luoghi...
2021-05-13	FI	GasparriMaurizio	Signor Presidente, in questa fase Forza Italia ha insistito perché il Governo prendesse atto di una serie di questioni, a cominciare dall'evoluzione della situazione sanitaria in miglioramento, anche se nessuno sottovaluta i pericoli, né dichiara superata l'emergenza. Dobbiamo dire che la nascita di un nuovo Governo ha determinato la correzione di alcuni errori e ritardi, perché la cosa principale di questi tempi è la campagna di vaccinazione, che sta determinando un'inversione di rotta. Ci sono alcuni ritardi. Ad esempio nel Lazio, al di là di quello che si dice, c'è una differenza notevole tra le dosi a disposizione e quelle utilizzate. Il Lazio dovrebbe raggiungere i livelli che in questi giorni ha raggiunto la Lombardia, paradossalmente grazie a un romano che è andato a Milano a rendere più rapidi i riti della Lombardia, che in genere è più efficiente di altre realtà del territorio. L'andamento della campagna vaccinale è certamente importante, però abbiamo avanzato delle sollecitazioni anche all'interno del Governo (la nostra azione è trasparente). Il nostro capo delegazione e i nostri Ministri hanno posto al Presidente del Consiglio una serie di questioni per rendere più rapido il processo di apertura. L'ordine del giorno, per quanto si possa considerare insufficiente e limitato, prende atto di un'evoluzione positiva della situazione, delle discrepanze e delle asimmetrie che hanno penalizzato alcuni settori. Pensiamo ai parchi tematici, ad alcuni ambiti culturali come biblioteche, teatri e cinema, nonché ai parchi acquatici e al tema delle cerimonie che sono state bloccate e limitate. È ovvio che sono momenti di incontro, addirittura di affettività, quindi occasioni più pericolose di altre sotto il profilo della diffusione del contagio. Però ora si può cominciare a immaginare una ripresa di quella che non è solo una dimensione sociale (il matrimonio, la festa, la ricorrenza: questi eventi scandiscono la vita delle persone e delle famiglie), ma è anche un'attività economica e produttiva che in Italia è diventata negli ultimi anni anche una risorsa, perché persone da varie parti del mondo scelgono il nostro Paese per celebrare i matrimoni, per far sì che i nostri borghi e i nostri mille luoghi apprezzabili diventino anche una risorsa per eventi che collegano la cerimonia a una location - come oggi si dice - di grande prestigio. C'è, poi, il problema delle contraddizioni, che noi vogliamo sottolineare anche in questa occasione, nella ristorazione, nei bar. Ora si è aperta l'attività all'esterno; tuttavia, anche attraverso questo ordine del giorno e questo dibattito, noi invitiamo il Governo a riflettere sulle contraddizioni. Ci sono ristoranti che non hanno la possibilità di svolgere attività esterne e ci sono ristoranti che hanno spazi interni al chiuso molto ampi, dove, con il rispetto delle distanze e delle regole, probabilmente si può svolgere un'attività in tutta sicurezza, con distanze maggiori e affollamenti minori rispetto a una serie di tavolini. Ci sono contraddizioni tra le mense che possono svolgere una certa attività, con affollamenti o comunque con presenze notevoli, e altre situazioni. Capisco che l'evento sportivo genera un affollamento imprevedibile: nella tale città si vince il campionato, nella talaltra si sale in serie A. È difficile gestire il pubblico, anche se in qualche città, aprendo gli stadi e ammettendo 3.000 persone a festeggiare, separate per tribune, dentro uno stadio da 50.000 posti, non sarebbe successo nulla, mentre lasciarli per strada è stato peggio. Penso anche ad alcune manifestazioni politiche, che ho visto in televisione affollate: quelle fatte da un certo settore si possono fare, gli altri basta che dicano una frase fuori posto e vengono perseguitati. C'è un po' di ipocrisia diffusa. Noi invitiamo, con questo dibattito e con questo ordine del giorno, a uscire dall'ipocrisia. Con il nuovo Governo sono cambiate alcune cose; alcune regole si stanno modificando; le vaccinazioni sono partite; alcune persone che non avevano dato le risposte adeguate sono state avvicendate. Mi pare che adesso, da quanto ho letto sui giornali, stia lasciando il posto anche Parisi, che si sarebbe dovuto occupare di lavoro e che aveva rendiconti di viaggio molto costosi. Plaudiamo ai cambiamenti anche in altre strutture; penso alla nomina dell'ambasciatrice Belloni al DIS; cambia un condizionamento politico che aveva molto caratterizzato il dibattito prima della crisi di Governo, quando le deleghe ai Servizi sono diventate discussione diffusa. Non è che tutto vada già bene, quindi vogliamo sollecitare il Governo ad avere più coraggio. Lunedì ci saranno altre riunioni: benissimo. Le Regioni stanno facendo richieste, nelle Conferenze Stato-Regioni che con il ministro per gli affari regionali Gelmini si succedono continuamente. L'andamento della salute, da un lato, e della diffusione dei vaccini, dall'altro, consente di fare delle scelte. Invitiamo - e mi rivolgo ai rappresentanti del Governo - a cancellare alcune contraddizioni. Ieri a Roma hanno manifestato i dipendenti dei centri commerciali perché devono restare chiusi nel fine settimana. Poi però (cito il nome di un'azienda ma non ce l'ho con loro) da IKEA, che è come un centro commerciale per ampiezza, ma è monomarca, quindi non è un centro commerciale (è un "negozione" grande, come La Rinascente) l'affollamento c'è lo stesso nel fine settimana. Invece un centro commerciale, che ha i vigilantes e la sicurezza privata, quindi può anche disciplinare l'ingresso e le uscite delle persone e fare una valutazione, non ha avuto la possibilità di svolgere la sua attività nei fine settimana. Ci sono alcune decisioni cervellotiche. Io ho sottolineato le cose che il Governo fa bene ma francamente a volte, quando ascolto il professor Locatelli, con tutto il rispetto, a parte il linguaggio un po' legnoso e aulico, alcune cose non le capisco. Sarà il linguaggio o sarà la mia inadeguatezza a certi livelli di scienza, ma alcune valutazioni empiriche devono essere fatte. Nei trasporti si registrano affollamenti molto più alti di quelli che si registrerebbero in un ristorante dai locali ampi, che anche al chiuso, con le distanze, potrebbe lavorare. Perché l'IKEA può avere l'affollamento e il centro commerciale non può avere nel fine settimana un ingresso e un'attività regolamentati? Abbiamo bisogno, insomma, di dare segnali di fiducia. Concludo sul tema del coprifuoco e degli orari: non solo è importante prendere le decisioni che noi ci auguriamo il Governo assumerà nelle prossime ore, rivedendo gli orari e una organizzazione sociale che è stata compressa per le ragioni che conosciamo e che oggi può tornare a respirare; ma c'è anche la prospettazione della stagione turistica. Quindi poter dire che c'è un'evoluzione in progress aiuterà chi deve fare le prenotazioni in albergo e chi deve vincere, con le spiagge, le montagne e le città d'arte italiane, la concorrenza spagnola e greca, che si sta proponendo in questi giorni. Dunque non basta solo fare qualche spot su un'isola Covid free, da qualche parte, ma bisogna rassicurare coloro che, pian piano - perché purtroppo il percorso sarà lento - fanno delle prenotazioni e vogliono venire in Italia, ad avere una prospettiva e una dinamica che consenta loro di immaginare, compatibilmente con i dati dell'epidemia, di svolgere in Italia un'attività di turismo e di fruizione delle nostre bellezze. Quindi mi auguro che, anche sull'onda di questo dibattito, il Governo assuma un ritmo più incisivo e più rapido e cancelli alcune contraddizioni. Il professor Locatelli si faccia un giro in metropolitana e vada a vedere la differenza con il grande magazzino o il centro commerciale, perché, francamente, alcune di queste persone forse non hanno mai visto tali realtà. Ci vuole dunque maggiore coerenza nella regolamentazione. Non siamo mai stati dalla parte dei negazionisti, abbiamo sempre sottolineato - per primo lo ha fatto il presidente Berlusconi - le situazioni di pericolo che il nostro Paese ha vissuto e vive ancora, così come la necessità di cautela, di prudenza e di saggezza e siamo sostenitori attivi delle campagne vaccinali. Da Forza Italia è venuta la proposta di coinvolgere il mondo della sanità del territorio, il mondo delle imprese e il mondo delle farmacie. Il piano da 500.000 vaccinazioni al giorno l'ha consegnato per primo il nostro partito, in occasione delle consultazioni che hanno preceduto la formazione dell'attuale Governo. Quindi siamo sempre stati oggettivi, con i piedi per terra e con realismo. Con lo stesso realismo, diciamo al Governo di avere più coraggio e più determinazione, perché l'Italia deve tornare a vivere e a crescere.
2021-05-13	FI	RonzulliLicia	Con questa norma gli operatori della sanità saranno puniti solo se la morte o le lesioni colpose saranno attribuiti a colpa grave. È una norma che consente anche da parte delle procure una ragionevole gestione delle notizie di reato, escludendo automatismi che spesso si rivelano solo dannosi per l'operatore. È una norma che vince il timore di agire, che sconfigge la patologia della medicina difensiva, liberando i medici e gli infermieri dalla paura di intervenire. È una norma che evita quello che sarebbe stato un inutile processo e clamore mediatico, e di processo mediatico purtroppo spesso si muore.
2021-05-13	FI	SiclariMarco	La situazione epidemiologica da Covid-19 sta registrando nel nostro Paese degli incoraggianti segnali di miglioramento e tutti i dati confermano questa tendenza, come rilevato anche dal presidente Brusaferro dell'Istituto superiore di sanità. Anche per quanto riguarda l'immunità del nostro Paese, la campagna vaccinale è partita e ora è a regime, superando mezzo milione di vaccinazioni giornaliere.
2021-05-13	M5S	LanziGabriele	Signor Presidente, è passato più di un anno da quando il Covid-19 ha stravolto le nostre vite, un anno in cui questo virus si è portato via, solo in Italia, oltre 123.000 persone: figli, genitori, amici, colleghi di lavoro, persone con una storia che è stata spezzata. Abbiamo affrontato un lockdown nazionale e momenti impensabili prima del febbraio 2020, scene come quella dei camion militari carichi di feretri che lasciavano Bergamo, che non dimenticheremo mai. Siamo stati in guerra, una guerra che non è stata combattuta da soldati, ma da medici e operatori sanitari. Il Governo nazionale italiano, guidato dal nostro Giuseppe Conte, ha fatto un lavoro straordinario per proteggere la salute di tutti i cittadini italiani. Sono stati stanziati oltre 13 miliardi per potenziare il nostro Servizio sanitario nazionale. Abbiamo assunto medici, potenziato strutture, abbiamo cercato in tutti i modi di colmare le lacune lasciate da dieci anni di politiche sanitarie scellerate che sono costate alla nostra sanità ben 37 miliardi di tagli.
2021-05-13	M5S	MautoneRaffaele	Se si firmano contratti per le aziende produttrici, come ha fatto il commissario europeo alla sanità, in cui si accettano clausole contrattuali che declinano da ogni responsabilità l'azienda produttrice dopo la semplice consegna delle dosi vaccinali, non si possono scaricare sugli operatori sanitari oneri e conseguenze derivati da eventuali danni o effetti collaterali collegabili alla somministrazione dei vaccini. In questo senso, un altro enorme passo avanti è stato fatto grazie a un emendamento voluto dal MoVimento 5 stelle, a prima firma della senatrice Evangelista, approvato in Commissione, per cui durante lo stato di emergenza epidemiologica da Sars-Cov-2
2021-05-18	LN	RufaGianfranco	C'è anche lo zampino di qualche burocrate potente, ignorante o servile, che rivendica corrette alcune ridicole scelte, come nel caso del nutri-score che qualche blasonato tecnico italiano, che stranamente passa da ruoli primari in salute a quelli in agricoltura, forse invidiando chi passa dall'economia all'Organizzazione mondiale della sanità, un tecnico che vuole regolamentare il nutri-score per evidenze scientifiche. Non capisce veramente un «cavolo» - è proprio il caso di dirlo in questo caso - o non ricorda nemmeno con quale cibo siano cresciuti lui e i suoi genitori, oppure faccia crescere i suoi figli con tarme essiccate, cibi indefiniti prefritti e bibite gassate.
2021-05-19	M5S	CioffiAndrea	Nella striscia di Gaza la situazione legata alla pandemia è già drammatica. Ad aprile 2021 il 60 per cento degli israeliani risultano vaccinati, contro solo l'1 per cento dei palestinesi. I primi vaccini per gli abitanti dei territori palestinesi sono arrivati dal programma Covax, ovvero il meccanismo dell'Organizzazione mondiale della sanità (OMS) per rifornire i Paesi più poveri ed in via di sviluppo: si tratta di 70.000 dosi di fronte a una popolazione di oltre cinque milioni. Medici senza frontiere parla di una goccia in mezzo al mare; Save the children ha dichiarato che nell'ultima settimana a Gaza sono state distrutte o fortemente danneggiate 50 scuole. Che futuro si garantisce ai bambini se le scuole vengono distrutte? Nonostante l'evidente sproporzione di forze, le vittime di questa situazione sono entrambi i popoli che subiscono le conseguenze delle azioni di chi vuole la guerra. Chi la vuole non è mai il popolo, che la guerra la subisce, ma chi usa la guerra per mostrare i muscoli e conservare o prendere il potere. Da entrambi i lati la guerra è usata per biechi giochi di potere. Quattro elezioni parlamentari in due anni, da un lato, e nessuna elezione dal 2006, dall'altro, testimoniano, infatti, una situazione di stallo impressionante, che ha portato all'inasprimento delle posizioni e alla strumentale riesplosione delle tensioni. La guerra fa schifo!
