2021-01-12	FI	RizzottiMaria	È con grande rammarico per la sua scomparsa e con commozione che ricordo la senatrice De Biasi. Ebbi l'onore di essere Vice Presidente, nella scorsa legislatura, quando lei era Presidente della Commissione sanità. Insieme facemmo molte battaglie, ma battaglie vere, a volte ovviamente anche per differenze di opinione. Ricordo, sulle disposizioni anticipate di trattamento, quando io insistevo perché fosse lasciata ai medici la libertà di coscienza. Ricorderò sempre una frase di Emilia: «Donne, cultura, informazione, lavoro». Queste sono le quattro parole che ho nel cuore e che difendeva senza avere mai paura di fronte a nessuno. Agli inizi, nella nostra Commissione, a volte eravamo un po' allibiti, perché Emilia era una donna molto spontanea e spesso la sua veemenza ci lasciava un po' interdetti, ma imparammo prestissimo a conoscerla, a conoscerci e ad apprezzarci. Lei era una donna vera, non conosceva l'ipocrisia, si poteva capire il suo pensiero dal suo volto. Ho ancora presente l'immagine di quando, magari dissentendo dagli interventi di qualcuno di noi, alzava gli occhi al cielo o inarcava il sopracciglio e poi sapevo che il mio compito era sempre quello, passato il temporale, di fare in qualche modo da pompiere. Sentiva la Commissione sanità come una famiglia e ricopriva questo suo ruolo di Presidente con grande orgoglio. Ricordo un giorno, quando in audizione proprio a proposito del decreto Lorenzin c'era un audito che rappresentava i no vax e che insultò tutti noi commissari, dandoci degli ignoranti e dei venduti e il presidente De Biasi lo interruppe di colpo e lo fece immediatamente uscire dalla Commissione. Molte cose portammo avanti in quella legislatura, argomenti importanti, come appunto quello sulle disposizioni anticipate di trattamento, la legge sui vaccini, che è stata ricordata; dopo vent'anni si riuscì a portare a termine la legge per il riordino delle professioni sanitarie, e si portò a termine anche la legge Gelli sulla responsabilità civile dei medici, che però non è ancora molto utilizzata, visto che mancano, a distanza di quattro anni, i decreti attuativi. Si fece un'indagine conoscitiva molto accurata sulla sostenibilità del sistema sanitario. I risultati di questo documento sono ancora oggi - anzi, soprattutto oggi - attualissimi. Per questo Emilia ricevette anche un premio dalla fondazione GIMBE per il suo impegno come persona che amava profondamente e difendeva il sistema sanitario nazionale. Vorrei ricordare un suo intervento in Assemblea durante la discussione di una mozione sul tumore al seno, in occasione della quale disse: quante donne, anche giovani, avremmo potuto curare per tempo se gli ospedali nelle diverse Regioni avessero fatto quello che dovevano fare, cioè informare i cittadini e consentire alle donne di decidere, con loro e per loro, percorsi diagnostici e di prevenzione a partire dagli screening ? Questo purtroppo non viene fatto e lo sappiamo perfettamente. Non possiamo tollerare che le capacità professionali di tanti medici vengano umiliate nel non poter curare le donne perché ci sono scelte che decidono di andare in un'altra direzione e spendere i soldi della prevenzione, per altro, se non addirittura, con gravi problemi anche di legalità.
2021-01-12	M5S	PellegriniMarco	Signor Presidente, la senatrice De Biasi, scomparsa davvero prematuramente, era originaria del mio territorio, essendo nata a San Severo, in provincia di Foggia, ma era milanese d'adozione, come è stato ricordato più volte. A Milano ha infatti vissuto più di quarant'anni, durante i quali il suo impegno politico e nella società civile è stato massimo. Dapprima militante del PCI, a cui ha dato il proprio contributo, per la sua trasformazione e per la costruzione del PDS e poi, via via, fino al manifesto fondativo del PD. È stata consigliere comunale a Milano per il PDS, due volte deputata, nella XV e nella XVI legislatura e poi senatrice nella XVII legislatura. Il suo impegno politico si è esplicitato su più fronti. Diceva infatti: «Donne, cultura, informazione e lavoro sono le quattro parole che ho a cuore» e infatti la sua azione è stata sempre rivolta alla difesa delle donne, dei loro diritti, della parità di genere in ogni ambito, sia in famiglia, che nel lavoro, nel sociale e nella vita politica. Nell'ambito culturale il suo apporto è stato tangibile, come dimostrano l'approvazione della legge sullo spettacolo dal vivo, ma anche la legge sull'equo compenso ai giornalisti autonomi, la riforma dell'editoria, le misure di agevolazione fiscale per il cinema e per il riconoscimento dell'indennità di disoccupazione per gli artisti. Come hanno ricordati i colleghi, è stata Presidente della Commissione igiene e sanità del Senato nella scorsa legislatura e anche in questo campo ha dato il suo fattivo e concreto contributo, lavorando perché si arrivasse ad importanti progressi di civiltà e di rispetto della dignità dei pazienti. Mi riferisco in particolare alle disposizioni anticipate di trattamento, un tema che in Italia rientra in un ambito sempre particolarmente delicato, al consenso informato e alla responsabilità degli esercenti la professione sanitaria. Si è anche impegnata per l'approvazione della riforma degli ordini e delle professioni nell'ambito della salute, per il rafforzamento e l'ammodernamento del Servizio sanitario nazionale, per garantire la sua universalità ed equità, specialmente nei confronti delle categorie più fragili. Si può affermare con sicurezza che ha sempre lavorato per la valorizzazione di quello che potremmo definire il capitale umano del nostro Servizio sanitario nazionale e per promuovere il dialogo e il confronto tra le istituzioni e le organizzazioni dei cittadini e dei pazienti. Proprio grazie a questo suo impegno indefesso nel comparto della salute ha ricevuto, nell'anno 2016, dalla fondazione GIMBE, il riconoscimento intitolato «Salviamo il nostro Servizio sanitario nazionale». Alcune scelte ci hanno diviso, come è normale e come succede in politica, ma posso affermare con sicurezza che, con la scomparsa di Emilia De Biasi, perdiamo una donna che ha dedicato la sua vita agli altri e alla politica, sempre attenta ai bisogni dei cittadini e al rispetto e al rafforzamento delle istituzioni repubblicane. Faccio le mie condoglianze e quelle del Gruppo a cui appartengo alla famiglia, dicendo che - sì, è vero - ci mancherà tanto.
2021-01-12	PD	MirabelliFranco	Signor Presidente, la ringrazio per le parole che ha appena pronunciato e per il ricordo di Emilia. Molti in quest'Aula l'hanno conosciuta durante la scorsa legislatura e hanno potuto riconoscere in lei una donna non comune, intelligente, determinata, lavoratrice appassionata. Emilia era una donna libera, gelosa della propria libertà. Amava formarsi le opinioni studiando, leggendo e, se era necessario, non aveva timore a esprimere opinioni non scontate, a volte scomode, che sosteneva in modo appassionato, anche rischiando di andare sopra le righe. Emilia era una donna libera, colta, non comune, che ha dedicato la sua vita e i suoi talenti alla politica, alla difesa della Costituzione, ma prima di tutto alla sua città, Milano, di cui è stata consigliere comunale e che è sempre stata al centro della sua attività politica e parlamentare. Accanto a Milano per Emilia c'era l'elaborazione delle politiche femminili, che è stato il filo conduttore che ha segnato la sua vita e su cui ci ha lasciato tanto. L'altra sua passione era la cultura, come lei, signor Presidente, ha ricordato bene. Per due legislature alla Camera fu riferimento su questo tema, ma, al di là della sensibilità politica che la portava a lavorare per sostenere la cultura e rendere fruibile a tutte e a tutti quella cosa, Emilia capiva davvero di cultura, di musica e di teatro: su questo aveva tanto da insegnare e questa sua sensibilità le ha dato la possibilità di coltivare tante relazioni e di entrare in rapporto con mondi spesso lontani dalla politica. In questo ramo del Parlamento Emilia ha lavorato poi per un'intera legislatura come Presidente della Commissione sanità: lo ha fatto mentre si discutevano temi importanti e controversi. Tenne una posizione difficile, ma coerente e alla fine vincente, sulla vicenda di Stamina: lo fece con coraggio, sfidando le minacce odiose che le arrivarono. Con la stessa determinazione si espose ai no vax e sostenne la legge Lorenzin. Chi l'ha conosciuta non può non aver ricordato in questi giorni, in cui la questione delle vaccinazioni diventa centrale per sconfiggere la pandemia, il suo impegno su questo. Emilia De Biasi ci ha abbandonato presto, troppo presto, ma non ha mai perso un minuto della sua vita per migliorarsi e guardare il mondo. L'ultima volta che ci siamo sentiti era entusiasta, mentre aspettava di iniziare un nuovo ciclo di chemioterapia, perché la sua vista era migliorata e finalmente riusciva a leggere. Emilia era così, amava soprattutto alimentare il pensiero e le conoscenze. A nome del Gruppo Partito Democratico voglio esprimere a Guglielmo, suo marito, alla mamma e ai fratelli la nostra vicinanza e le condoglianze, dicendo loro che siamo orgogliosi di aver lavorato con lei e che le tante cose che ha fatto e ci ha insegnato la faranno restare con noi.
2021-01-13	FI	PaganoNazario	La sanità, poi, è non solo una questione di gestione diretta dell'organizzazione sanitaria dei tanti medici, operatori e infermieri, ma concerne anche e soprattutto la gestione di un percorso che si riflette su altre questioni: sulla scuola, sul trasporto pubblico locale, sulla vita delle famiglie. Questi sono temi che - a nostro giudizio - hanno evidenziato dei vulnus, dei problemi. Se vogliamo parlare della scuola, non lo si può fare solo in termini di date, perché - come mi ricordava il collega Cangini (il nostro esperto) - è soprattutto una questione di dati più che di date: non sappiamo esattamente quanti sono i contagi e i focolai nelle scuole; si parla soltanto di quando chiuderle o riaprirle. Esiste una possibilità di venire incontro a queste esigenze? Forza Italia ha fatto le sue proposte anche in questo caso; abbiamo proposto - per esempio - di fare in modo che possano essere riaperte stabilendo dei turni di mattina e nel pomeriggio. Il problema del personale - glielo dico subito - non esiste, può essere tranquillamente risolto; non è un problema. Quanto al trasporto pubblico locale, sarà pur vero che è un tema di competenza regionale, ma bisognava fare qualcosa di più. La Conferenza permanente per i rapporti tra lo Stato, le Regioni e le Province autonome serve per affrontare temi particolarmente gravi.
2021-01-13	FI	RizzottiMaria	Venendo al futuro prossimo - che poco roseo ci sembra, considerato lo stato della maggioranza, sempre che ci sia ancora - la ringraziamo per l'annuncio di 18 miliardi del recovery fund per la sanità, anche se erano già presenti nella vecchia bozza, visto che la parte riferita all'edilizia sanitaria rientrava in un capitolo diverso e non compariva quindi negli interventi specifici. Ottimo lavoro. Il gioco delle tre carte ha funzionato ancora; peccato che lei abbia ammesso che per la sanità di miliardi ne servano 60 e non sappiamo in che modo arriveranno, a meno che non abbiate deciso di utilizzare finalmente i soldi del MES sanitario, dopo aver fatto digerire i nuovi ingressi nella compagine ministeriale. C'è confusione sulle zone (gialle, arancioni, rosse, bianche) e confusione sulle dosi di vaccini a disposizione, nonché sul controllo di chi riceve i vaccini. Ad esempio, chi monitorerà le vaccinazioni? L'Aifa, la farmacovigilanza? È dal 2017 che aspettiamo che ci sia un'anagrafe vaccinale in tutte le Regioni italiane.
2021-01-13	M5S	CastelloneMariaDomenica	Sempre sulla collaborazione si deve basare anche l'attuazione dei progetti previsti dal recovery plan. Noi siamo molto orgogliosi del piano che riguarda la sanità, perché i progetti su tale materia si basano su quelli che per noi sono i pilastri fondamentali: il rafforzamento della medicina territoriale, istituendo finalmente in tutte le Regioni le case della salute, gli ospedali di comunità, rafforzando la presa in carico domiciliare, fornendo ai medici di medicina generale gli strumenti di telemedicina che noi chiediamo da un anno (quanto sarebbero serviti già nella gestione di questa pandemia). Il secondo pilastro, per i progetti di sanità inclusi nel recovery plan, concerne le nuove tecnologie e la digitalizzazione: si parla da quindici anni di fascicolo sanitario elettronico, di cartella elettronica, adesso devono diventare realtà. Occorrono investimenti in prevenzione: abbiamo detto in tutte le lingue che per passare dalla medicina d'attesa alla medicina d'iniziativa bisogna prevenire le malattie. Anche in questa pandemia i malati oncologici, i malati fragili sono spesso stati abbandonati perché non hanno avuto accesso a percorsi differenziali. Per questo la prevenzione deve essere rafforzata su tutto il territorio nazionale. Infine ci sono gli investimenti in ricerca e in formazione. Vorrei dunque concludere questo mio intervento, chiedendo davvero a tutti di saper diventare dei costruttori di bene, come ci chiede il presidente Mattarella, perché la storia non ci perdonerà se in questo momento non saremo in grado di costruire il nuovo Paese, il Paese che ci aspetta.
2021-01-13	M5S	LicheriEttoreAntonio	Ieri sera è venuto alla luce il recovery plan italiano, all'interno del quale i fondi dedicati alla sanità, anche grazie all'intervento e al contributo di Italia Viva, sono saliti a circa 20 miliardi, che si sommano ai 13 miliardi che questo Governo vi ha dedicato l'anno scorso.
2021-01-13	M5S	LicheriEttoreAntonio	Stiamo parlando di risorse complessive per 33 miliardi, che è una cifra eccezionale per la sanità italiana. È eccezionale proprio perché nel decennio trascorso e precedente al 2018 la sanità ha avuto tagli per 37 miliardi, che si sono tradotti in ospedali chiusi e posti letto cancellati. I 33 miliardi complessivi dedicati alla sanità sono soldi e investimenti che rendono sterile, superfluo e provocatoriamente inutile qualsiasi tipo di richiamo a quei soldi che giacciono nelle casseforti di quell'organismo tecnico intergovernativo che non ha niente a che vedere con l'Europa e che si chiama MES.
2021-01-13	PD	BoldriniPaola	Signor Ministro, la ringraziamo ancora una volta della sua presenza qui in Parlamento, e non solo perché viene a relazionare sulla situazione relativa all'emergenza Covid, e quindi anche sui DPCM, ma anche perché dimostra ancora una volta il ruolo importante di quest'Assemblea nella sua interlocuzione diretta con il Governo. Anch'io auspico - come il collega Errani diceva prima - che tale interlocuzione sia finalizzata anche alla raccolta di suggerimenti da parte nostra; suggerimenti che ci pervengono ovviamente dal territorio, da tutti i cittadini che continuamente ascoltiamo in merito a tutto quello che sta succedendo. È passato un anno ormai da quando, per la prima volta, le autorità di Wuhan ci hanno detto - forse anche un po' tardivamente - che c'era un allarme di contagio rispetto a quello che, purtroppo, è diventato una pandemia globale che ci sta attanagliando ormai da troppo tempo. Abbiamo trascorso un anno pieno di sofferenze, paure, disagi sociali, economici e psicologici, ma la strada del ritorno alla normalità è ancora lunga: lo dicono gli scienziati, lo ribadiscono gli esperti. Tuttavia, forse possiamo iniziare a intravedere una luce, perché abbiamo una speranza grazie agli sforzi portati avanti dalla ricerca scientifica, che finalmente ha illuminato la strada. Ma non abbiamo ancora vinto: il percorso non sarà breve. Devo ringraziare davvero, ancora una volta, in quest'Aula, tutti gli operatori sanitari che stanno salvaguardando le persone, che, purtroppo, sono colpite dalla pandemia. Il virus non ci sta lasciando neanche un momento e sta circolando ancora di più. Quindi, grazie davvero a tutti gli operatori. L'inizio della campagna di vaccinazione è stato un momento che tutti noi abbiamo sperato; abbiamo seguito i servizi relativi all'arrivo delle prime dosi e, quindi, nutriamo speranza e ottimismo, ma manteniamo alta la guardia. Non possiamo dire che ce l'abbiamo fatta, che è tutto finito. No, è ancora lungo il percorso. C'è però una cosa importante: dobbiamo essere veloci nel vaccinare più persone possibili; dobbiamo rafforzare la squadra; chi, in base alle competenze professionali, può aiutare, deve essere reclutato. Signor Ministro, abbiamo sentito anche del suo nuovo accordo con i medici di medicina generale: benissimo, perché sono i nostri primi interlocutori, per cui, se anche loro hanno la possibilità di essere vaccinati e di vaccinare, aggiungiamo ulteriori forze. E penso anche alla sanità militare come alla Croce Rossa: ben vengano tutti coloro i quali siano in grado di poter aiutare, perché il fattore tempo è determinante. E perché lo è? Abbiamo sentito parlare delle mutazioni del virus che stanno arrivando, e per fortuna oggi Pfizer ha detto che il vaccino copre anche le varianti inglese e la sudafricana. Tuttavia, prima si opera, meglio è proprio per questo motivo. Il fattore tempo è importante: di fronte alla grande crisi economica che stiamo vivendo, la sanità deve mettere al centro la salute delle persone. I problemi sanitario ed economico sono correlati. Dobbiamo attenzionare entrambi. Sono partiti in questo periodo i bandi delle Regioni - la mia Regione li ha fatti partire l'altro giorno - per ristorare immediatamente tutte quelle attività che, purtroppo, sono state chiuse e, attraverso la loro chiusura, ci hanno aiutato a evitare la diffusione del virus. Ebbene, non devono pagare per tutti noi. C'è un altro tema delle ultime ore e minuti, signor Ministro, che credo non sia un bel segnale, perché il mondo ci guarda e la minaccia di una crisi di Governo nel bel mezzo di una pandemia non è assolutamente necessaria. Spero allora che, al contrario, tutti abbiano la coscienza di considerare gli interessi dell'intera collettività. Il futuro è nel sentirsi fratelli e non nel voler dominare, ha detto Papa Francesco, e viene subito in mente l'immagine del Santo Padre in una piazza San Pietro vuota; immagine che si affianca a quella del nostro Presidente della Repubblica, quando ha detto che dobbiamo essere costruttori e rappresentare il Paese: per fortuna - devo dire - ci sono loro, i grandi saggi. Prima il collega Zaffini ha affermato che in Europa abbiamo sbagliato tutto. Io dico che non è assolutamente così, come hanno riconosciuto anche scienziati che abbiamo audito in Commissione. Alla domanda specifica su che cosa abbiamo fatto di sbagliato, hanno risposto: quello che potevano fare le persone che non sapevano qual era la strada da percorrere. Quindi è stato fatto molto bene; ovviamente bisogna apportare delle correzioni, ma non sapevamo che cosa ci aspettasse. Devo dire quindi che, sia con riguardo alla campagna vaccinale che stiamo affrontando, sia anche rispetto a quanto è stato fatto prima nell'emergenza, tutti noi ci abbiamo provato. Gli altri Paesi europei non stanno meglio di noi. Come sappiamo, siamo oggi tra le prime regioni in Europa per le vaccinazioni, per cui riusciamo ad affrontare anche questa emergenza. Come ho anche ribadito poco fa, siamo tutti consapevoli che, rispetto alle esigenze dell'economia e del commercio, la salute della gente viene al primo posto e, solo limitando le cause dell'epidemia, saremo in grado di favorire anche la ripresa economica, e ne abbiamo veramente tanto bisogno. In tutto questo la somministrazione più veloce possibile del vaccino può consentire di tornare alla normalità in tempi brevi, per cui è giusto immunizzare tutti gli operatori sanitari - com'è stato detto, sono coloro che fronteggiano il virus in prima fila - nonché le categorie più deboli, arrivando - come dice benissimo anche il Piano nazionale vaccinale - a vaccinare anche altre categorie, prevedendo di anticipare la vaccinazione per gli insegnanti per favorire la riapertura delle scuole, di cui ha parlato benissimo la senatrice Iori prima, così come hanno fatto tanti altri colleghi. La riapertura delle scuole passa anche attraverso la vaccinazione degli insegnanti e - dico io - anche dei giovani, quando sarà ora. Se è vero, infatti, che dobbiamo fare uscire dagli ospedali le persone e alleggerire le nostre strutture sanitarie, riteniamo che la scuola sia però un altro fattore fondamentale e importante. Ne va davvero della salute dei nostri giovani, anche con riguardo al disagio mentale che stanno vivendo in questo momento. Si tratta quindi di trovare una strategia di tipo adattivo per quanto riguarda il piano pandemico e le vaccinazioni. Lo stesso professor Brusaferro ha detto che bisognerà valutare le situazioni e vaccinare in caso di focolai. Penso anche ad altri settori, a cominciare dal trasporto, che non bisogna solo riorganizzare; occorre pensare anche agli operatori dei trasporti, nonché allo stesso personale delle carceri, che ci sta aiutando in questo periodo. Si tratta dunque - lo ripeto - di adattare in maniera flessibile quello che è un piano che ormai tutti conosciamo e che è molto importante seguire. Signor Ministro, aggiungo che i cittadini sono ormai molto, troppo provati e penso davvero anche alla loro salute mentale, a cui ho appena accennato parlando dei giovani. Serve farsi carico anche di questo aspetto, che non è di poca importanza, perché la salute psicologica delle persone individualmente considerate è la salute psicologica di tutta la società, essenziale per la tenuta della stessa. Come io sento e come tutti credo vediamo, fra le persone comincia a esserci qualche risentimento per quello che sta succedendo. È fondamentale che sia prestata dunque attenzione anche alla salute psicologica, un aspetto importante che le chiedo quindi di tenere in considerazione. Penso che le prospettive di un altro vaccino in arrivo, in aggiunta ai due che abbiamo già avuto, siano segnali super-incoraggianti. Abbiamo visto che in questo l'Europa è stata brava e unita: si è agito tutti insieme per l'acquisizione dei vaccini e sono convinta che anche da questi segnali dobbiamo imparare. Bisogna essere pazienti e avere fiducia, tanta fiducia, anche e soprattutto nella scienza e investire soprattutto nella ricerca: è un altro messaggio che ci sta dando questa pandemia. Guardiamo che cosa siamo riusciti ad avere in poco tempo, grazie alla tecnologia innovativa dei vaccini che sono stati studiati. Signor Ministro, noi le diamo ancora una volta fiducia votando a favore della proposta di risoluzione che abbiamo presentato. Credo però che il buon senso e la responsabilità dei cittadini, che ringrazio ulteriormente, debbano continuare a giocare un ruolo fondamentale in questa importante partita che è tutta della salute.
