2021-04-07	M5S	SileriPierpaolo	In particolare, il trattamento terapeutico della patologia si è articolato su diversi approcci differenziati, che sono andati a coinvolgere in primis farmaci a potenziale attività antivirale contro il SARS-Cov-2, farmaci ad attività profilattica e terapeutica contro le manifestazioni trombotiche, farmaci in grado di modulare la risposta immunitaria e infusioni di plasma mirate a un trasferimento di anticorpi neutralizzanti il legame tra il nuovo coronavirus e il suo recettore espresso dalle cellule umane. È opportuno sottolineare che ancora oggi esistono larghi margini di incertezza rispetto all'efficacia di alcuni degli approcci terapeutici appena menzionati e che l'uso delle differenti terapie piuttosto che l'assenza di impiego delle stesse dipendono dalla severità delle manifestazioni cliniche presentate dai malati. Proprio in considerazione dell'alto livello di incertezza con cui queste terapie sono messe a disposizione e del particolare stato di emergenza rispetto a una pandemia che in effetti stiamo imparando a conoscere - come ho detto prima - giorno per giorno, è importante aggiornare continuamente le informazioni relative alle prove di efficacia e sicurezza che si rendono progressivamente sempre più disponibili. A tale scopo, la commissione tecnico-scientifica dell'AIFA ha predisposto una serie di schede che rendono espliciti gli indirizzi terapeutici entro cui è possibile prevedere un uso controllato e sicuro dei farmaci utilizzati nell'ambito di questa grave emergenza. Le schede riportano in modo chiaro le prove di efficacia e sicurezza ad oggi disponibili, nonché le interazioni e le modalità d'uso raccomandabili nei pazienti con Covid-19. Nello stesso formato vengono individuati i farmaci per cui è bene che l'utilizzo rimanga all'interno di sperimentazioni cliniche controllate. In data 30 novembre 2020 è stata adottata la circolare del Ministero della salute n. 24970 in merito alla gestione domiciliare dei pazienti affetti da SARS-Cov-2, al fine di fornire adeguate indicazioni operative, tenuto conto dell'attuale evoluzione della situazione epidemiologica sul territorio nazionale. In tale circolare viene segnalata la necessità di razionalizzare le risorse al fine di poter garantire la giusta assistenza a ogni singolo cittadino in maniera commisurata al grado e alla gravità del quadro clinico. La circolare riporta, tra l'altro, che i National Institutes of Health statunitensi hanno formulato una classificazione fondata anche sui criteri radiologici e con i limiti e le difficoltà legate alla realizzazione di questa indagine in una situazione pandemica in cui vengono individuati cinque stadi clinici della malattia. Nel paragrafo "Principi di gestione della terapia farmacologica" viene specificato che le indicazioni fornite si riferiscono alla gestione farmacologica in ambito domiciliare dei casi lievi di Covid-19. Inoltre, viene sottolineato che, onde evitare il rischio di ospedalizzazioni tardive, nel caso di aggravamento delle condizioni cliniche del paziente durante la fase di monitoraggio domiciliare, andrà eseguita una rapida e puntuale rivalutazione generale per verificare la necessità di un'ospedalizzazione o di una valutazione specialistica del soggetto. Nella medesima circolare è stata altresì delineata una rappresentazione schematica del monitoraggio del soggetto infettato da SARS-Cov-2 e della dinamica possibilità di transizione da paziente a basso rischio a paziente con quadro in evoluzione peggiorativa, tale da richiedere o una modifica della terapia o un ricovero ospedaliero. Le raccomandazioni fornite dalla circolare riflettono i dati della letteratura scientifica e tutte le informazioni attualmente esistenti. I trattamenti sintomatici, come il paracetamolo o i farmaci antinfiammatori non steroidei (FANS), possono essere utilizzati in caso di febbre o dolori articolari o muscolari, a meno che non esista una chiara controindicazione all'uso. Altri farmaci sintomatici possono essere utilizzati in base al giudizio clinico. Non esistono infatti ad oggi evidenze solide e incontrovertibili, ovvero derivanti da studi clinici controllati, di efficacia e sicurezza per l'impiego di altre terapie nelle prime fasi della patologia in questione. Un esempio su tutti può essere l'indicazione a non utilizzare routinariamente i corticosteroidi. Tale raccomandazione si basa sul fatto che attualmente esistono evidenze di un beneficio clinico di tali farmaci solo in questo setting di pazienti/fase di malattia. È necessario ricordare che in molti soggetti con malattie croniche l'utilizzo del cortisone può determinare importanti eventi avversi che rischiano di complicare il decorso della malattia virale. Sono stati resi disponibili per le terapie anti Covid-19, con il decreto del Ministero della salute del 6 febbraio 2021, «Autorizzazione alla temporanea distribuzione dei medicinali a base di anticorpi monoclonali per trattamento di Covid-19», ai sensi dell'articolo 5, comma 2, del decreto legislativo 24 aprile 2006, n. 219, gli anticorpi monoclonali. In accordo con le specifiche determine autorizzative dell'AIFA, la selezione del paziente da trattare con tali anticorpi monoclonali è affidata ai medici di medicina generale, ai pediatri di libera scelta, ai medici delle USCA e in generale ai medici che abbiano l'opportunità di entrare in contatto con pazienti affetti da Covid-19 di recente insorgenza e con sintomi lievi e moderati e di indirizzarli rapidamente alla struttura presso la quale effettuare il trattamento terapeutico. È raccomandato il trattamento nell'ambito di una struttura ospedaliera o comunque in un contesto che consenta una pronta e appropriata gestione di eventuali reazioni avverse gravi, secondo i percorsi identificati e implementati a livello regionale. La prescrizione del trattamento deve garantire la somministrazione del prodotto il più precocemente possibile rispetto all'insorgenza di sintomi e comunque non oltre dieci giorni dall'inizio degli stessi. La terapia con anticorpi monoclonali anti-SARS-Cov-2 dev'essere riservata, in base alle evidenze della letteratura scientifica attualmente disponibile, ai pazienti con Covid-19 di recente insorgenza, con infezione confermata da SARS-Cov-2 e definiti ad alto rischio di sviluppare forme gravi, in accordo con i provvedimenti autorizzativi dell'AIFA. Ciò premesso, passando a recenti iniziative già in corso, comunico quanto segue: è stato recentemente istituito un apposito gruppo di lavoro presso il Ministero della salute, composto da rappresentanti istituzionali e professionali del mondo scientifico di elevata professionalità e competenza, inclusa AIFA, con l'obiettivo di aggiornare la menzionata circolare del 30 novembre 2020. L'aggiornamento si sta completando alla luce delle nuove conoscenze acquisite e delle esperienze intervenute in ambito farmacologico e clinico, nonché delle recenti indicazioni dell'AIFA sui singoli trattamenti farmacologici. È comunque sempre previsto un periodico aggiornamento delle indicazioni. Si precisa inoltre che la versione aggiornata del documento sarà integrata con i tempi della terapia con anticorpi monoclonali, della gestione del paziente di età pediatrica ed evolutiva, con l'utilizzo di strumenti telemedicina e alcune specificazioni per la gestione del paziente anziano e della donna in stato di gravidanza. Le indicazioni contenute nel documento tengono conto degli studi osservazionali nazionali e internazionali e sono confermate dalle evidenze emerse dalle revisioni sistematiche della letteratura e sono conformi a quanto suggerito dalla comunità scientifica; da ultimo, tengono conto delle raccomandazioni pubblicate e divulgate dall'OMS. Dal punto di vista terapeutico, viene sottolineata la possibilità di avviare i pazienti con Covid-19 di recente insorgenza e con sintomi lievi e moderati alla terapia con anticorpi monoclonali. Inoltre, le indicazioni contenute nel documento tengono conto degli studi osservazionali nazionali e internazionali e vengono confermate dalle evidenze emerse in esito alle revisioni sistematiche della letteratura scientifica e sono conformi a quanto viene suggerito dalla comunità scientifica; da ultimo, tengono conto delle raccomandazioni pubblicate e divulgate sempre dall'Organizzazione mondiale della sanità. Da ultimo, con specifico riferimento all'impugnativa relativa alla nota AIFA del 9 dicembre 2020, recante i principi di gestione dei casi di Covid-19 nel setting domiciliare, citata nelle premesse della mozione, confermo che il TAR del Lazio, sezione Terza, con ordinanza resa in camera di consiglio il 2 marzo scorso (n. 1412 del 2021), ha accolto l'istanza cautelare e, per effetto, ha sospeso l'efficacia della stessa, fissando la trattazione nel merito il 20 luglio 2021. Atteso che l'ordinanza suddetta è stata notificata in data 8 marzo ultimo scorso ad AIFA, l'Agenzia ha tempestivamente richiesto all'Avvocatura generale di interporre appello dinanzi al Consiglio di Stato. Passo ora ai pareri. Il parere è contrario all'ordine del giorno G1, presentato dal senatore Ciampolillo.
2021-04-07	M5S	SileriPierpaolo	Per quanto riguarda l'ordine del giorno G2, il parere è favorevole a condizione che vengano accolte le seguenti modifiche. Relativamente all'impegno n. 1, dopo la parola «aggiornare» si propone di inserire le seguenti: «a cura del Ministero della salute, avvalendosi all'occorrenza dell'Istituto superiore di sanità, AIFA e AGENAS». Conseguentemente, si propone di cancellare le parole «per il tramite». Il parere è favorevole con riferimento all'impegno n. 2 e all'impegno n. 3, a condizione che alla fine siano aggiunte le seguenti parole: «nel rispetto dell'autonomia regionale». Il parere è favorevole con riferimento agli impegni nn. 4 e 5.
2021-04-08	FI	BinettiPaola	Signor Presidente, Governo, colleghi, il tema di cui ci stiamo occupando oggi con l'esame di queste mozioni e fortunatamente con la presentazione di un ordine del giorno unitario, che impegna tutto il Parlamento e che quindi speriamo abbia forza presso il Governo per ottenere l'adempimento degli impegni indicati nella nostra mozione, tocca veramente il cuore del problema. Il cuore del problema oggi è che abbiamo scoperto di avere in Italia da un lato una sanità ospedaliera ad altissima evoluzione, anche sotto il profilo tecnologico, e dall'altro una sanità domiciliare che in qualche modo soffre ancora di povertà strumentale sotto il profilo diagnostico e di rarefazione relazionale. Sappiamo bene che il medico di medicina generale, il cosiddetto medico di famiglia, stenta molto oggi a recarsi a casa del paziente e a prendersi cura di lui, anche semplicemente guardandolo in faccia. Molto spesso questa relazione matura e si esaurisce nell'arco di una telefonata; e nemmeno di una telefonata a nuova evoluzione (guardandosi negli occhi via Skype, per capire di cosa il paziente abbia bisogno), ma piuttosto di una vecchia telefonata. Cosa voglio dire con questo oggi? Noi dobbiamo ripensare la medicina territoriale, perlomeno sotto tre profili. Il primo profilo fondamentale è quello della competenza del medico di medicina generale. Abbiamo bisogno di restituire al medico di medicina generale una competenza clinica ben più sofisticata di quella che molto spesso assorbe attraverso la tradizionale scuola di medicina. Abbiamo bisogno di sapere oggi (cosa che abbiamo toccato con mano) quanto sa il medico di medicina generale dei quadri come per esempio quello della polmonite interstiziale bilaterale, che ha caratterizzato tutta l'evoluzione della pandemia come elemento di gravità; cosa sa il medico di medicina generale in un contesto formativo che sgancia l'esperienza clinica dall'esperienza più strettamente territoriale? Egli non è esposto alla relazione formativa importante della struttura ospedaliera ad ampio spettro, come quella che dovrebbe garantire la sua formazione sotto il profilo clinico. Abbiamo bisogno di rivedere questa formazione. Sarà inutile spendere tempo ed energie a valorizzare la competenza del medico di medicina territoriale, se non gli garantiamo tutti gli strumenti necessari a raggiungere quella formazione che oggi, considerato il livello sofisticato in cui si muovono le nostre diagnosi differenziali, egli deve riuscire a ottenere. In secondo luogo abbiamo bisogno che la medicina territoriale si avvalga veramente di strumenti tecnologici di ultima generazione. Non possiamo utilizzare strumenti obsoleti e non possiamo sottovalutare la sua formazione sotto il profilo della digitalizzazione. Abbiamo bisogno che questi medici siano in grado di fare una diagnosi facendo anche le cose più semplici: penso ad esempio all'elettrocardiogramma da inviare, da vedere e da leggere; penso alla possibilità di stabilire un contatto con altri colleghi e con altre persone competenti sotto forma di briefing virtuali. Oggi una tecnologia sofisticata va trasferita al letto del paziente o comunque a casa del paziente, nel suo domicilio. È lì che dobbiamo portare la tecnologia. Tutti noi siamo abituati a ricevere informazioni e dati sul cellulare che abbiamo in tasca, che vibra continuamente mantenendoci, volenti o nolenti, collegati a un filo diretto. Noi abbiamo bisogno che ogni paziente sia, in qualche modo, il centro di una digitalizzazione differita, secondo il vecchio modello hub and spoke, per cui si ha una centrale dove si concentrano le competenze di un certo tipo e una distribuzione capillare in tempo reale, cosa che oggi non c'è. Poi, abbiamo bisogno di un terzo elemento fondamentale che è, paradossalmente, l'altra faccia di questa digitalizzazione sofisticata, spinta capillare e diffusiva, che è la qualità della relazione interpersonale. Abbiamo sentito e sappiamo tutti che, per i motivi più vari, molto spesso quella che è venuta meno in questo periodo di pandemia è stata la relazione. I pazienti si sono sentiti soli: si sono sentiti soli perché, in qualche modo, li abbiamo isolati e si sono sentiti soli perché, in qualche modo, si sono isolati. C'è il paziente che si è isolato, all'inizio, per una forma di paura del contagio. Poi, però, questa paura si è trasformata in un'altra cosa, nella paura di andare in ospedale, cioè la paura di uscire di casa e di non vedere più le persone care. Ci siamo trovati in un contesto rarefatto, in cui il paziente era veramente in una terra di mezzo che non era marcata né dalla medicina ospedaliera di alto profilo tecnologico, ed era caratterizzata dalla carenza assoluta di assistenza socio-sanitaria. Sono venute meno le istanze che il territorio deve garantire in termini di qualità, di accoglienza e di presa in carico. La nostra mozione dice proprio queste tre cose: vogliamo e pretendiamo maggiore e migliore formazione per i medici di medicina generale, anche in termini di capacità di lavorare in équipe multiprofessionali. È stato depositato un disegno di legge molto interessante sulla figura dell'infermiere domiciliare, dell'infermiere familiare. Non è una parte accessoria rispetto a questo progetto, perché anche il medico di medicina generale che lavora sul territorio non può farlo da solo, ma ha bisogno di lavorare con altri, perché ha bisogno di intercettare i bisogni del paziente a 360 gradi e, una volta che li ha intercettati, ovviamente ha bisogno di soddisfarli. Noi oggi sappiamo che il medico guarda in faccia il suo paziente secondo uno stile di formazione clinica, accademica, sociale, organizzativa e tecnologica. Ho detto accademica perché abbiamo bisogno anche di riportare la riflessione scientifica nel lavoro del medico di medicina generale. Se la medicina generale non produce attività scientifica, quella che noi misuriamo col numero delle pubblicazioni che escono, con la loro qualità e con il loro impact factor, se non si fa ricerca a partire dal letto del paziente, nella casa del paziente, nelle circostanze in cui vive il paziente, non riusciremo a migliorarne la qualità. Tutte le sere lo ripetiamo: le decisioni vanno prese in base alla scienza, ma se non faccio senza non potrò prendere decisioni adeguate. Quindi, dobbiamo restituire una dignità molto profonda alla persona, al lavoro e al modello dell'assistenza domiciliare. Dobbiamo investire tecnologicamente e coraggiosamente. Non basta il computer che usano i ragazzini. È con la rete che viaggiano le informazioni; è nella rete che viaggia, fortunatamente, la ricetta dematerializzata, per cui medico ti visita, fa la ricetta, la manda direttamente in farmacia e qualcuno può andare a prendere il farmaco oppure dalla farmacia possono portarlo a casa. Questo, infatti, ce lo ha insegnato il momento attuale. Noi dobbiamo ripensare la medicina generale a 360 gradi. Ci servono risorse culturali, risorse economiche, risorse sociali e risorse tecnologiche, ma ci serve una vision. Dobbiamo ripensarla con una vision diversa. Non è una medicina di serie B. È una medicina che deve essere di serie A e, per di più, stellata, proprio perché deve ribaltare una posizione. Questo è necessario se vogliamo liberare gli ospedali da ricoveri non necessari, che appesantiscono le strutture e poi non permettono di concentrarsi sui pazienti ad altissima criticità.
2021-04-08	FdI	ZaffiniFrancesco	Signor Presidente, colleghi, forse questa mattina sfugge ai più, in questa modalità un po' intima e un po' distratta dei lavori del Senato, la paradossalità dell'atto che stiamo producendo e - voglio sperare rapidamente - licenziando all'unanimità. La paradossalità sta nel fatto che il Senato della Repubblica raccomanda, sollecita e imprime una spinta al Governo perché faccia - direi - quasi il minimo indispensabile del suo dovere, e cioè l'aggiornamento dei protocolli di cura del Covid-19. Stiamo parlando di qualcosa che rientra nell'ordinaria amministrazione, la gestione di un condominio, del grande condominio di questo Paese, impegnato in un'emergenza che si chiama emergenza da Covid-19, che si ritrova uno strumento indispensabile, quale appunto un protocollo da assegnare alle Regioni e, attraverso le Regioni, a tutto il personale sanitario impegnato nel trattamento della domiciliarità, non aggiornato. Noi abbiamo a disposizione oggi un documento del 30 novembre scorso; oggi è l'8 aprile. Nel frattempo sono successe tante cose, anche nelle caratteristiche del virus che circola in modo differente rispetto a prima del 30 novembre. Sono intervenute le varianti, sono intervenuti nuovi farmaci e tutto questo all'insaputa del Ministero della salute e, apparentemente, della nostra comunità scientifica; e per comunità scientifica intendo l'Istituto superiore di sanità, l'AIFA e il suo consiglio. Dal 30 novembre ad oggi serve il Senato della Repubblica per suonare il campanello e dire «sveglia»: questa è una paradossalità gigantesca, colleghi. Non a caso anche noi di Fratelli d'Italia, molto felicemente, ci siamo prestati, nell'unanimità sollecitata dalla collega senatrice Castellone - la ringrazio come sempre per il lavoro che svolge - a sottoscrivere questo documento, perché esso, anche se nessuno mi è sembrato l'abbia voluto osservare, è l'ennesima riprova paradigmatica delle mille inadempienze, dei ritardi, delle lacune e a questo punto anche della colpe dell'azione di contrasto alla pandemia, che hanno caratterizzato l'attività del Governo Conte, prima, e del Governo Draghi, oggi, in sostanziale continuità. Oggi il Senato della Repubblica si trova a dover dire al Ministro della salute e a tutto l'apparato che lo circonda di aggiornare un protocollo di cura datato 30 novembre, e che - come è stato osservato anche dalla Presidente della Commissione igiene e sanità, che ringrazio per il suo intervento - suggeriva tra l'altro la vigile attesa e il paracetamolo, cioè quello che è sostanzialmente ha letteralmente sfondato - lo ripeto: sfondato! - i nostri ospedali e le nostre terapie intensive. Ripeto: la vigile attesa e i paracetamolo! Rispetto a tutto ciò, non posso non sentirmi costretto a chiedere, ancora una volta, cosa occorre che faccia un Ministro per essere sostituito. E lo dico con tutto il rispetto per la sua figura, perché evidentemente non c'è niente di personale. Colleghi, ditemi voi cosa occorre che faccia. Cito una seconda paradossalità e mi dispiace in questo caso dover appuntare un'eccezione rivolta al collega Sileri, che ha letto una relazione evidentemente preparata per lui da qualcun altro. Arriva il rappresentante del Governo in Aula in questo momento e, invece di dire «Beh, vabbè, sì, però...» o non so sinceramente quello che avrebbe potuto dire a discolpa, anche parziale, e di fatto illustra un trattato di farmacologia domiciliare ad un'Assemblea che fa politica o dovrebbe fare politica. Anche in questo caso ho ascoltato allibito la relazione del rappresentante del Governo e ancora una volta non posso non osservare che siamo totalmente fuori strada. È qui che ci spieghiamo, in modo assolutamente drammatico, perché il Paese le ha sbagliate tutte fino a oggi. Abbiamo il record dei decessi e ancora non riusciamo a spiegarci cos'è accaduto e per quale motivo abbiamo tale record, pur essendo partiti per primi con un lockdown drammatico nel marzo dell'anno scorso. Abbiamo registrato il peggior abbattimento di PIL di tutta Europa e quindi i due provvedimenti, che dovrebbero operare come vasi comunicanti, ovvero le restrizioni per evitare l'aggravamento della pandemia, sono tutti e due al top, al massimo livello. Abbiamo fallito nel tracciamento, che abbiamo perso da tempo, con la famosa app Immuni. Oggi, 8 aprile diciamo al Ministro - non so quando ottempererà: probabilmente fra un mese - di fare il protocollo per le cure domiciliari. Pensate che lo farà domani? Verrà fatto fra un mese e quindi, ancora una volta, da novembre ad oggi siamo senza protocollo per le cure domiciliari. Stiamo fallendo nell'ultima spiaggia, che è quella della campagna vaccinale. Siamo ancora alle prese con la mancanza di vaccini. Anche il decreto Covid tratta della capacità delle Regioni di somministrare e inoculare vaccini. Dico però al generale Figliuolo che abbiamo le mitragliatrici, ma non abbiamo le cartucce, nel senso che non ci sono i vaccini. Questa è la drammatica realtà. Anche nel piano del generale Figliuolo, che per il primo trimestre, cioè al 31 marzo scorso, prevedeva oltre 15 milioni di dosi, ne mancano all'appello più di 2 milioni. Colleghi, di fronte a tutto questo pandemonio che sta accadendo, io credo che si debba fare un reset e pretendere veramente un cambio di paradigma rispetto all'azione di contrasto della pandemia posta in essere dal Governo. In questa sede non occorre ricordare che proprio solo qualche giorno fa i giornali economici ci hanno raccontato che in Italia, in un anno di pandemia, abbiamo perso quasi un milione di posti di lavoro, senza che sia strada liberalizzata la facoltà di licenziare: pur con il blocco dei licenziamenti abbiamo perso un milione di posti di lavoro. Tutto questo, colleghi, anche a chi è più realista del re, anche a chi si atteggia per essere più realista del re, dovrebbe procurare non dico tanto, ma un sussulto di dignità, e non mi viene un'altra parola; un sussulto di dignità nel pretendere che questo Governo faccia fino in fondo il proprio dovere, a cominciare dal Ministro della salute che deve affrontare questa pandemia. Se volete a tutti i costi che resti lui, almeno faccia cose diverse. Oggi il Senato della Repubblica scavalca il Ministro nel fare il proprio dovere, il minimo indispensabile - mi viene da dire il minimo sindacale - e gli dice di aggiornare quella circolare, quel protocollo del 30 novembre scorso, che peraltro anche a quella data riportava qualche castroneria, come afferma tutta la comunità scientifica. Colleghi, spero che nei prossimi giorni accada più o meno la stessa cosa in tanti altri ambiti: certificata, constatata la limitatezza della capacità di contrasto dell'epidemia, auspico che il Senato, per quanto ci riguarda - e la Commissione, per quanto mi riguarda - possa sostituirsi altre volte virtuosamente per integrare le manchevolezze, i ritardi, le lacune e - vorrei dire - le gravi colpe di questo Governo, i cui risultati, i cui effetti drammatici sono ormai sotto gli occhi di tutti.
