2021-09-07	LAB	CliveLewis	The Government have produced a piece of legislation straight out of the far-right playbook from the United States to look for a problem that does not exist. This tactic is drawn straight from the authoritarian playbook of racist American legislators. Their voter suppression laws have been and are being used to reinstate Jim Crow-era mass disenfranchisement via the back door. The Southern Poverty Law Centre, which has commented on such legislation, says: “The real reason these laws are passed is to suppress the vote, and that is in fact what happens.” We have a crisis of democracy precisely because established institutions have failed to represent the public as a whole—failed to challenge economic self-interest in favour of the common good. The truth, as this Government know, is that their ideology of destructive and unequal growth, fuelled by oil and gas, is not shared by the British public. Even the super-wealthy see the uninhabitable world this system is creating. They choose to flee to private islands or hide out in vast compounds in the depths of New Zealand and elsewhere. This Bill, along with the protest ban and the attacks on the independent judiciary and human rights, is a buttress against the public. Authoritarian control is being shored up because this Government know they cannot win public consent freely and fairly for policies that will continue to impose poverty on an ever-greater number of people so that wealth can be extracted for a few. [Interruption.] You sit there looking incredulous, yet that is what your politics and your policies do, day in day and day out.
2021-09-07	LAB	FleurAnderson	It has been asked, who opposes these measures? Leading civil rights groups such as the American Civil Liberties Union and the Southern Poverty Law Center came together to warn the UK Government that UK Government voter ID policies will harm democracy. Did this make the Minister think twice about that policy? When Age UK said that compulsory photo ID will make 4% of over-70s—that is equivalent to 360,000 people—less likely to vote, did the Minister reconsider that policy? When Lord Woolley of Woodford, director of Operation Black Vote, said in evidence to the Joint Committee on Human Rights that “tens of thousands, if not hundreds of thousands, might be impeded by this imposition, clearly it is not proportionate and could actually have a monstrous negative effect” did this make the Minister reconsider her policy? And when the Royal National Institute of Blind People raised serious concerns about the impact of these measures on blind people, did that make the Minister rethink the policy
2021-09-07	LAB	FleurAnderson	My hon. Friend the Member for Luton South raised the disproportionate outcome of these measures. My hon. Friend the Member for Leeds North West (Alex Sobel) raised the important issue of the glaring omission of student ID cards from the list of IDs. My hon. Friends the Members for Hornsey and Wood Green (Catherine West) and for Swansea West made passionate interventions about deeply concerning issues of voter suppression that is in keeping with the US Republican party. We cannot be deluded by Ministers into thinking the voter ID laws we are debating today are any different from the dangerous laws passed by the Republican party. The parallels we have drawn and the similarities are worth serious investigation. American civil rights groups have been fighting for years to combat restrictive voter suppression laws, particularly those affecting ethnic minority communities
2021-09-08	CON	EdwardLeigh	For a low-tax Conservative, it is relatively easy to attack this measure—indeed, I could spend my entire five minutes doing so. I could quote the fates of previous conservative Governments, whether led by President George Bush in America or John Major here, who have put up taxes dramatically—John Major did so in a recession—and been punished at the polls. It is relatively easy to attack this measure but much more difficult to provide an alternative. The manifesto point need not be laboured. Labour produced a manifesto with all sorts of spending promises in 2005 and, arguably, they had more chance of foreseeing the global crash in the markets that followed during that Parliament than we ever had in foreseeing a pandemic. So I do not think the manifesto attack holds water
2021-09-08	LAB	JanetDaby	Should the Health and Care Bill pass as written, in April we will enter a new phase, where the NHS will be broken down into dozens of smaller units that will have private companies on their boards, including American health insurance companies seeking only profit. The deputy chair of the British Medical Association wrote last year: “rather than finding a moment of clarity in this crisis to reinvest in a publicly provided health service and build for a better future, the Government has doubled down on its failures, choosing to throw huge amounts of money at scores of private firms…rather than rebuilding the health and care system and empowering those with the greatest expertise.” What we are left with is a fragmented healthcare system that is a skeleton of what it once was, with workers underpaid and exhausted, and social care neglected
2021-09-09	CON	JacobReesMogg	The hon. Lady raised the important issue of Afghanistan and what is going on there. The evacuation of 15,000 people, including 8,000 British nationals and 5,000 people through the Afghan relocations and assistance policy is a remarkable mission. It was carried out well and competently, and that is something we should note and approve of. Of course the withdrawal from Afghanistan was not a decision taken exclusively by Her Majesty’s Government. I sometimes get teased for valuing our imperial history and being proud of it, and thinking what a great country we were when the Pax Britannica was across the world. But it is not the Pax Britannica any more; it is, if anything, the Pax Americana, and if the United States does not want to stay in Afghanistan, it is unlikely that we could stay there by ourselves. In that context, my right hon. Friend the Foreign Secretary is someone in whom we can all have confidence. He was working hard when he was on holiday, and he has attended to his duties
2021-09-09	LAB	NeilCoyle	I am mindful that our country’s Afghan failure follows the aid budget cut and the abolition of the Department for International Development. Jo, along with the hon. Member for Tonbridge and Malling (Tom Tugendhat) and my hon. Friend the Member for Wirral South, wrote an excellent piece called “The Cost of Doing Nothing”, which remains valid, and on which I am sure both those Members will speak today. It makes me nervous that the UK looked decidedly isolated internationally, with the US ignoring us and the suggestion from the Foreign Office in March that an alternative alliance could be built to replace American forces ultimately leading to nothing but our scrambled exit and capitulation to the Taliban
2021-09-13	CON	ChristopherGreen	The hon. Gentleman makes an interesting point, but I fundamentally disagree. In countries with fixed-term Parliaments, such as the United States of America, they legislate for two years and then campaign for two years, whereas if we do not know the time of the next general election, we do not know when we will start campaigning. Often, even Prime Ministers of the day do not know when the elections will be, because they are not fixed in time, so it is difficult for the Government to start campaigning. Actually, I think the Bill will reduce the campaign period
2021-09-13	CON	GrantShapps	He points out that the shortages are in Romania, Poland, Germany and many other countries. It is not just a European problem, but a global one. In the words not of a UK haulier, but of the chief executive of US Xpress, telling of the problems in the American trucking market: “The driver situation is about as bad as I’ve seen in my career.” This is a global problem that we will try to resolve
2021-09-13	CON	NadhimZahawi	Earlier this year, the Medicines and Healthcare products Regulatory Agency approved the covid-19 vaccines supplied by Pfizer and Moderna for 12 to 17-year-olds. It confirmed that both vaccines are safe and effective for this age group. Following that decision, the Joint Committee on Vaccination and Immunisation recommended vaccination for all 16 and 17-year-olds and for 12 to 15-year-olds with serious underlying health conditions. It next looked at whether we should extend our offer of vaccination to all 12 to 15-year-olds, which would have brought us into line with what is already happening in countries such as France, Spain, Italy, Israel and the United States of America. It concluded that there are health benefits of vaccinating this cohort, although they are finely balanced
2021-09-13	CON	NadhimZahawi	It was never in the JCVI’s remit to consider the wider impacts of vaccinations, such as the benefits for children in education or the mental health benefits that come from people knowing that they are protected from this deadly virus. It therefore advised that the Government may wish to seek further views on those wider impacts from the United Kingdom’s chief medical officers. The Secretary of State, together with the Health Ministers from the devolved nations, accepted that advice. Our CMOs consulted with clinical experts and public health professionals from across the United Kingdom, such as the Royal College of Paediatrics and Child Health. They have also benefited from having data from the United States of America, Canada and Israel, where vaccines have already been offered to children aged 12 to 15 years old
2021-09-13	CON	NadhimZahawi	The important thing to remember is that the JCVI’s advice was very much predicated on what it was clinically qualified to look at. It was its recommendation to the chief medical officers to then take a further look. My hon. Friend will recall that JCVI’s advice was that, on balance, it is beneficial for children to have the vaccine rather than not have the vaccine, but not enough to recommend a universal programme, hence its advice to CMOs to go further on that. The work the CMOs have done in recommending a single dose is very much predicated on the data they have seen. JCVI, by the way, were in the room during the deliberations from America and elsewhere on the myocarditis on the second dose.
2021-09-14	CON	DavidDavis	T3. In the recent court decision to extradite Dr Mike Lynch, the Serious Fraud Office made a submission in defiance of normal standards of British justice. Despite the SFO finding no case to answer, it nevertheless recommended extradition to the United States. It did so because American prosecutors have a higher chance of conviction because they use coercion and threats to turn junior staff into prosecution witnesses, which is done without the prosecutors being required to tell the court. These tactics also prevent defence witnesses from appearing. We explicitly prohibit such behaviour in British courts because we believe it would undermine British justice, so the SFO should not be recommending the extradition of British citizens to face this parody of justice. Will the Justice Secretary review this, with a view to putting in place proper guidelines to prevent it happening in future?
2021-09-15	CON	AlexanderJohnson	My hon. Friend is absolutely right to point out the problem of lorry driver shortages, which is affecting the whole world, from Europe to North America. What we are doing immediately is working to get out more licences. We are taking advantage of our post-Brexit freedom so that all the young thrusters on the Conservative Benches with a post-1997 driver’s licence can now drive a vehicle with a trailer as well—everybody can drive a vehicle with a trailer as well. But after a long period of stagnation in wages for those in the road haulage industry, we are also seeing a long-overdue increase in wages. That is part of the same phenomenon that this Government are introducing and the Labour party is opposing.
2021-09-15	LAB	BarryGardiner	When Kabul fell a month ago, Members of Parliament and their staff worked round the clock to assist British citizens and their Afghan partners and children, and tried to get them safe passage back to the UK, but everything had started too late and the American deadline governed everything. We need to assess the utter failure of intelligence that had insisted that the Afghan Government would hold Kabul for a further three months. We need an inquiry into why, after 20 years of occupation, our military had not prepared a plan B for an emergency evacuation
2021-09-15	LAB	ChristopherBryant	Is there not another issue? Lots of the people about whom many hon. Members have been writing to three Departments—let us hope that, as I think the Minister for the Middle East and North Africa said last week, we will get the reply from the Foreign Office, which will apparently be by the end of tomorrow—will now need consular support from somewhere, either in country or out of country. However, as I understand it, the Government have done nothing to make that provision available to them. Unlike what the Americans are doing, it feels like we have given in and surrendered.
2021-09-15	LAB	JohnCryer	I personally, like many of us, have dealt with in excess of 200 cases, or 200 individuals rather—not so many cases, but over 200 individuals, many of them British nationals. We have been able to get some of them out of Kabul, where they were concentrated, but many are still stuck there. I have had many reports of rapes, abductions, murders and attacks on Hazaras; many of the cases I have happen to be Hazaras. There are stories of young men and boys threatened with “Either you join the Taliban or we’ll shoot you”, and of girls and young women—we have heard these stories before—forced into sexual slavery or forced into marriage against their will. Journalists and academics, with absolutely no connection with the American and British forces—no connection—are still being threatened into silence and threatened with death and torture
2021-09-15	LAB	JohnCryer	The motion directly calls for a Joint Committee investigation because we need to know who said what to whom, who made the decisions and what conversations have taken place over the past few weeks. For example, we do not even know if any representations—any representations—were made by British Ministers or civil servants to their American counterparts on the speed and timetable of the withdrawal. That question has not yet been answered
2021-09-16	CON	AlexanderJohnson	I do not want to go into the details of the contracts, but the House will understand that what we are doing is seeking, with our American friends and our Australian friends, to help the Royal Australian Navy to acquire the type of nuclear submarines that are appropriate for the current geopolitical situation they find themselves in. I have absolutely no doubt that the skills and expertise that are available in this country—across the whole UK—will be called upon extensively to fulfil that objective.
2021-09-16	LAB	KeirStarmer	I thank the Prime Minister for an advance copy of his statement. The recent events in Afghanistan show us how precarious international stability can be. New challenges can emerge and issues in faraway corners of the globe can quickly turn into threats at home, so Labour welcomes increased co-operation with our allies. Australia and America are two of our closest security partners. Sharing resources and intelligence with them and enhancing capabilities makes them safer, makes Britain safer, and makes the world safer
2021-09-20	CON	EdwardLeigh	Now, following the debacle in Afghanistan, we know that we cannot rely on America, will the Secretary of State make his commitment clear to our closest and traditional ally, France, which is vital for our interests, particularly in regard to migration and many other issues? Will he commit himself to working with the French to improve relations and perhaps involve them in this new relationship in the Pacific?
2021-09-20	CON	GrantShapps	Throughout the crisis, I have remained in regular contact with my opposite number, US Secretary of Transportation, Pete Buttigieg. As the Prime Minister has arrived in the United States of America, I am delighted to announce to the House today that the Government there have agreed that vaccinated Brits will be able to travel into the US from early November, reciprocating the policy that we introduced this summer. This is testament to the hard work and progress made by the expert working group set up at the G7 to restart transatlantic travel—the flagship route of international aviation
2021-09-20	CON	JohnRedwood	Will the Secretary of State talk to the industry urgently about having more gas storage capacity? We have tiny capacity compared with most advanced countries, and that would provide a buffer to smooth supplies and keep prices down if this turns out, as we hope it will, to be a short-term interruption to supply from Russia and America.
2021-09-20	CON	NigelEvans	I thank the Secretary of State for Transport for his statement and for responding to 20 questions. I am sure that I shall be booking my next flight to America in early November, or shortly.
2021-10-19	CON	LauraTrott	T2. Last week, a whistleblower told the American Congress that Facebook had repeatedly misled the public about the impact of its platform on children’s health. Does my right hon. Friend agree that it is time for Facebook to be transparent about the impact of its platform, and to share with the public what it knows about the impact on children’s health?
2021-10-19	CON	LeeRowley	Just as they do naturally, British businesses are getting back on their feet and doing what they do best. We know that this is a difficult time and has been an extraordinarily difficult time, but I pay tribute to businesses for being able to get going again. A strong growth story is being shown by the level of unemployment, which has fallen for six months in a row and is now below 5%— lower than the levels in France, America, Canada, Italy and Spain; one of the fastest recoveries of any major economy in the world; business confidence being up; and job vacancies growing for eight consecutive months and at a record high
2021-10-19	CON	PaulScully	All I have heard is negativity from the Opposition with no answer, but we are making sure that the 352 billion reasons to allow the economy to bounce back are as effective as possible. Our plan is working. Our unemployment rate is at less than 5% and falling, which is lower than France, America, Canada, Italy and Spain. We have one of the fastest recoveries of any major economy in the world, and GDP is growing. That shows that the Government’s approach is a success and that we have fostered the right environment for the economy to grow
2021-10-20	CON	CrispinBlunt	The effect of the Minister’s statement means that in practice, compounds will largely not be researched to become medicines. That would require market authorisation as, under the apparent new policy, which has so far never been presented to the House, compounds can never escape the rigours and expense of schedule 1. For British scientists that is a particular barrier to the exciting science around the psychedelic class of drugs that is now more easily developed and researched in North America than it is in the UK, where the science began. For those British scientists denied the opportunity to do that research, due to the costs imposed by the scheduling, it is a constant frustration that there is no recent scientific basis to support the scheduling in the first place
2021-10-21	CON	RebeccaClarkPow	By the way, we will actually spend more in percentage terms on international development than America, Japan and Canada, contrary to some of the things being spread by the hon. Member for Brighton, Pavilion. We have a huge focus on finance. We have doubled our international climate finance to at least £11.6 billion between 2020 and 2025. We have two new finance initiatives under way for biodiversity funding.
2021-10-22	CON	PaulScully	It has been an extraordinary and difficult 19 months for all of us. The impact of the covid-19 pandemic on the whole country has been profound. Millions of people were on the precipice of losing their jobs, livelihoods and homes, but the forecast was wrong and the unemployment rate in the UK is at less than 5% and falling. That is 2 million lower than some of the forecasts and it is lower than France, the United States of America, Canada, Italy and Spain. As we heard from my hon. Friend the Member for Broadland (Jerome Mayhew), the high levels of youth unemployment in Spain and Ireland compared with the UK show that we are getting things right here
2021-10-22	LAB	AndrewMcDonald	I congratulate the hon. Gentleman on his wonderful news. We are discussing Centrica. Have he and his colleagues on the Committee committed the calamitous acquisitions by British Gas Centrica in America, which brought on it the financial pressures that it had to deal with? Its choice was to instigate section 188 notices and start the process, rather than to begin consultation, which is what Labour Members are trying to achieve with the Bill.
2021-10-25	CON	JamesCleverly	The right hon. Lady raises an important point. I can assure her that we speak about this issue, as I say, directly with the Iranian regime, but also with other countries, both in the region and those friends and allies that we have in Europe and in the United States of America. We will not rest in our efforts to bring British dual nationals home not because questions are raised in the House or exchanged in correspondence, but because it is the right thing for us to do. We do not need to be pressured into doing this. This is what we choose to do because it is the right thing to do, and I can assure her and the House that it will remain a priority until they are all able to come home.
2021-10-25	LAB	MohammedKhan	We are two months on from the crisis, but many Afghans still have no certainty about their future. Amnesty has accused the Government of moving “at a snail’s pace” in their efforts to assist at-risk Afghans. I want to request two things of the Minister. The first, which a number of colleagues have already touched on, relates to the unaccompanied children in Doha. There are some 200 of them. America, Canada and other countries are dealing with this, but there are 15 children there who have connections with Britain. Can they be looked at urgently? Secondly, there are many family members who are stuck because they are children or husbands who are British citizens, but the wife is not. This also needs to be dealt with urgently, and the family route needs clarification.
2021-11-01	CON	RoystonSmith	Southampton has many strengths: it has historic medieval walls and one of the busiest ports in the country; it is home to the iconic Spitfire; and it is from Southampton that the pilgrim fathers set sail to the new world more than 400 years ago. The Port of Southampton and Carnival cruises are large private sector employers, and we benefit from a healthy public sector too, with two world class universities, the National Oceanography Centre, a renowned specialist hospital and a Premier League football club. On the face of it, it all sounds rosy, but if we scratch beneath the surface, we see a different picture. The city and my Southampton, Itchen constituency have some of the most deprived wards in the country. We have too many children in care, our schools underperform and we have generations in the same family who have never worked. The city had a proud shipbuilding and aviation heritage. It produced the famous Ford Transit van until 2013, and was home to Pirelli Cables and British American Tobacco. Those blue-collar jobs have mostly all gone; all too frequently, they have been replaced with jobs in retail, hospitality and leisure, with few, if any, prospects, no job security and notoriously low pay
2021-11-01	LAB	MatthewWestern	Let me contrast this with what Labour would promise. We have made it clear that we will not cut corners on children’s education. The full £15 billion that was called for by the catch-up tsar would be put into our schools. There would be a proper rise in the minimum wage to £10 per hour. We would cut VAT on energy bills to help families through this winter. We would remove business rates to help our businesses and secure jobs. We would deliver a green industrial revolution providing jobs and investment in every community. We would provide an industrial strategy. Just look at what Joe Biden has done in the US with his $52 billion CHIPS for America Act to secure semiconductor supplies. That is what I call a strategy. The choice is clear between the high-tax, low-productivity, low-growth model of this Government and the fair-tax, high-productivity, sustained growth model offered by Labour.
2021-11-02	CON	JohnMercer	While I have been sitting here, I have been looking at some figures. It is difficult to compare apples with apples when it comes to veterans’ affairs, because different countries do this differently, but in America, for example, £270 billion a year is spent on veterans. That includes allowances, payments for injuries and so on, but it is a lot of money. We compare better with countries such as New Zealand, with 31,000 veterans. This time last year, it spent £10 million in its office for veterans’ affairs purely on administration. The closest match, however, is probably Australia, with 325,000 veterans. It spent £11.5 billion in its Department of Veterans’ Affairs last year
