2021-01-06	LAB	PaulBlomfield	So much now depends on the vaccine. Let us remember that the first vaccine to enter British arms, and which we should celebrate, was developed by scientists of Turkish origin in Germany with an American company and manufactured in Belgium—an international response to an international crisis. I hope that that will be reflected in our country’s wider response, and I hope Ministers will confirm that, as we roll out the vaccine in the UK, they will work with our partners around the world to ensure it also reaches those who desperately need it in low-income countries. In agreeing to these measures today, let us also resolve to tackle the injustices that have been highlighted by this crisis.
2021-01-11	CON	AndrewBowie	We debate this this evening at a time when the values we stand for as a country, when the values of all liberal democracies of the world, seem more under threat than at any time in living memory. The western world, once confident and convinced of the powers of capitalism, democracy and free trade, has been shaken by two decades of terrorism, ill-managed overseas conflicts, a devastating financial crisis, the European migrant crisis and a lurch towards nationalism and populism. Now, economies are ravaged by covid-19, and last week we saw the bastion of American democracy—the Capitol, the literal shining city on the hill—overrun by a mob demanding that the results of a free and fair election be overturned because their leader refused to accept the result; actions we would normally associate with a tinpot dictator, not the leader of the free world. And so in front of us is the greatest challenge since we rebuilt our world after the second world war. We must take on the democracy deniers; we must re-establish and defend the rules-based order; and we must champion free trade. The challenge we have is great. We see Russia and China. We see threats to democracy and trade all around the globe
2021-01-11	CON	DanielKawczynski	The United States of America has been a very good example in its effective engagement with the three seas initiative, treating those 12 countries as a specific entity, investing in them and supporting them strategically from a defence perspective. In the post-Brexit era, we can show real leadership on our continent by supporting the three seas initiative and putting sanctions on the Nord Stream 2 pipeline. Now no longer constrained by our membership of the European Union, we ought to follow our American friends in imposing sanctions on any company involved in the Nord Stream 2 pipeline, which is a real issue for many politicians who represent countries in the three seas initiative
2021-01-11	CON	DanielKawczynski	This undersea gas pipeline that the Germans are building directly to Russia, bypassing all the gas and oil networks that run through our NATO partners, is extremely dangerous because it puts our NATO partners at great additional pressure from Moscow and makes them susceptible to additional energy blackmail, which the Russians have used so successfully in the past. The United States of America has managed to halt temporarily the construction of the Nord Stream 2 pipeline through sanctions on companies involved. I urge the Minister now, in a post-Brexit context, to show the same courage and resolve that his American counterparts are doing in standing up from a moral, strategic and security perspective, challenging the Germans not to endanger our NATO partners in this way, and imposing sanctions on any company involved in this highly risky project for the future security of our continent.
2021-01-11	CON	ElizabethTruss	As we recover from covid-19, we need to think radically about how we generate economic growth and how we are going to use our new global platform in 2021 to promote free and fair trade—how we are going to take on those countries that try to cheat and to undermine free enterprise. In 2020, we negotiated trade agreements covering 63 nations and the European Union, and in 2021 we will use this year, including our presidency of the G7, to champion free and fair trade in an era rife with pernicious practices. We will promote modern rules that are relevant to people’s lives for digital and data trade. We will champion high environmental and animal welfare standards in a science-led approach, and we will push for modernisation of the World Trade Organisation and trade agreements to reflect our values of free enterprise and fair play. We will also build an advanced network of trade deals, from the Americas to the Indo-Pacific, with the UK at its heart as a global services and technology hub. We have already reached deals covering 63% of UK trade, well on our way to our manifesto target of 80% in three years. We want to hit that target and to deepen our existing relationships in areas such as services and technology
2021-01-11	CON	ElizabethTruss	Furthermore, we will be working with our friends and family across the world to drive forward free and fair trade, setting the global standard for trade in the 21st century. We are already in deep negotiations with the United States, Australia and New Zealand, and, this year, we will apply to one of the most dynamic trading areas on earth—the Comprehensive and Progressive Agreement for Trans-Pacific Partnership. Joining is part of our plan to grow our economy by making it far easier for British goods to reach our friends in Asia and the Americas. This high standards agreement would align the UK with some of the world’s fastest growing economies in a free trade area covering nearly £9 trillion of GDP. We will also deepen our relationships with countries such as Canada, Mexico, South Korea and Israel. As well as this, we are working closely with India, the world’s largest democracy, on an enhanced trade partnership, reflecting our mutual interest in technology and innovation. We are also in talks with Brazil and our allies in the Gulf.
2021-01-11	CON	HenrySmith	Decades ago, it was almost unthinkable that the United Kingdom should leave the European Union, but I always had a conviction that the best future prosperity for this country was as an independent nation using, and being a conduit between, our unique global links—through the Commonwealth and our strong alliance with the United States of America—and our proximity to the continent of Europe. In the UK-EU trade agreement, that is what we have achieved. We have continuing trade with our European friends and allies, and the ability, as we heard from the Secretary of State for International Trade in her opening remarks, to forge global trade deals with countries as far afield as Canada, Japan, Singapore, Turkey, Mexico and elsewhere. I know that in the coming months and years, more trade deals will be achieved
2021-01-11	CON	RichardGraham	So the idea that the UK has become little England, cut off from the world, does not match the reality of global Britain and the way in which we are facing the greatest global challenge of 2020-21. In our chairmanship of the G7 and the climate change summit COP26 this year, we have other opportunities to try to help the world resolve some of our greatest challenges. This means not only leading by example, which the Prime Minister’s 10-point green plan and his financial commitments bring alive, but working with the crucial partners to achieve common goals, and that includes both the United States of America and China. Global Britain therefore needs calm diplomacy focused on delivery; strong values; and a pragmatic recognition that this House accepts that there is little social justice without a strong economy and that exports bring huge mutual benefits to both our partners abroad and here
2021-01-11	LAB	EmilyThornberry	With every hour of delay that passes at Dover, every consignment that is turned away, and every product that is, after all, having to face tariffs because of rules of origin, British businesses are losing money. Meanwhile, in the rest of the world, we have not gained one single penny in extra trade from the Government’s leap of faith: not one single agreement that we did not have before, and not one single export facing lower tariffs than it did in December. Indeed, as we heard the last time we were here, according to the Government’s own figures, our country is forecast to be worse off and to make lower exports thanks to the Secretary of State’s enhanced deal with Japan compared with the deal that we had before. So it is understandable—perhaps inevitable —that when the Government resume their talks with Australia, New Zealand and America; when they start their talks with India, Brazil and the Gulf states; when they try to turn 14 pages of cut and paste into proper treaties with Mexico, Turkey or Canada; and most of all, when they make their formal bid for accession to CPTPP, they will be desperate to do these new trade deals at any price, to make up for our losses with Europe
2021-01-13	LAB	MargaretHodge	It is shameful to find that America is more effective at pursuing corporations and their directors than we are. Let us consider Standard Chartered, a British-headquartered bank. In 2019, it was fined for money laundering failures and breaching sanctions—£102 million in the UK, but £842 million in the USA. In both the LIBOR scandal and the subsequent rigging of foreign exchange rates, most of the outrageous behaviour took place here in the UK, but most of the fines were imposed in the US. In 2019, the US dished out £1.67 billion-worth of money laundering fines. We took less than £300 million. The Government may want to promote outsourcing, but does that really mean we want to outsource enforcement to the Americans
2021-01-14	CON	DavidDavis	To give the Government proper credit, they have instigated the provision of a supplement free of charge to the clinically extremely vulnerable in care homes. However, if supplementation is to have any material effect, the dosage has to be sufficient to correct the existing deficiency. Sadly, with the Government’s programme for the clinically extremely vulnerable, the supplementation falls far short of this. The Government are providing supplements of 400 international units, or IU. That is in line with what the national health service currently recommends to tackle issues surrounding bone health. By contrast, the American health authorities recommend 600 IU to 800 IU depending on age. The latest research from the Royal College of Physicians recommends that health authorities should urgently recommend a higher supplementation of 800 IU to 1,000 IU a day, which would more than double the current daily recommended dose of vitamin D
2021-01-14	CON	JacobReesMogg	Finally, on the US Administration, we are right to be allies of democracy. It is really important that we get on with the incoming American President. I must confess that the actions of the outgoing President were a matter of the gravest concern. I do not think it is the business of Government Ministers to criticise the leaders of friendly countries, but what happened in Capitol hill is a reminder of how delicate and fragile democracy is and the responsibility of politicians to protect democracy and not to be what one might call an accessory before the fact to disorder. That is a real problem, and let us hope for better things in the United States and that our special relationship will be able to flourish.
2021-01-14	CON	PeterBone	I do not know whether the Leader of the House is a fan of “The West Wing”, the fictitious political drama about an American President, but in that drama C. J. is the press secretary to the President, and every day she strides to the podium, announces the President’s policy and answers questions
2021-01-19	CON	AnthonyMangnall	I revert to what the Minister said earlier about the House being able to have more scrutiny through the International Trade Committee’s individual report on a trade deal, and then a future trade debate can happen around the deal, whether it is between the UK and America or whoever. There should be multiple debates on these trade deals, so that we can all feel that the scrutiny has taken place. That is important, and I do not believe it to be completely against what others are arguing. [Interruption.] The right hon. Member for Islington South and Finsbury (Emily Thornberry) is chuntering from a sedentary position. In her entire speech, she said absolutely nothing about the EU-China deal. She seems completely content to ridicule every continuity agreement that we have come to. The purpose of what we are doing here today, what we have done previously and what we will do in the future is to enable us to scrutinise those trade deals, so that the Committee may report back, and to ensure that Back Benchers from every part of this country are able to decide what our future is when it comes to those deals
2021-01-19	CON	AnthonyMangnall	I will carry on, but my right hon. Friend can come back to me later on. We need to get to the point where we can help those countries where genocide is being committed. That is not done by a trade deal. What do the people who are suffering expect? Is it the High Court deciding whether or not to sign a trade deal? They expect the international community to be engaged and to take action, and that is what we must seek to do. This is global Britain, and global Britain must reach out to its allies to create new institutions and ensure that we take action where appropriate. If we are unhappy with the current international landscape, let us seek to create new international bodies with like-minded colleagues, whether it be Five Eyes or North America. Those are the things that we must do, and we must be ambitious in doing so. I believe to my heart that the Government have the right intent of doing that
2021-01-19	CON	DamianCollins	In opening the debate earlier, my right hon. Friend the Minister for Trade Policy told the House that the Government’s forthcoming online harms Bill was the correct place to ensure the internet safety of children and all UK citizens. However, I understand why Baroness Kidron moved to insert Lords amendment 7 in the Bill, to ensure that those rights cannot be traded away in the small print of a future agreement. We can easily see how rights granted in international trade agreements on how companies can use data, where they can processes it and whether they can be subject to an independent audit of their algorithms could undermine the ability to create and enforce a robust duty of care regime on technology companies to meet their obligations to tackle online harms. In fact, in the trade negotiations between the UK Government and the outgoing Trump Administration in America, the US negotiators have sought to do just that. President Trump’s Government have sought to persuade the UK to trade away digital and data rights as part of securing a deal, as they have done in their agreements with Canada, Mexico and Japan. That would clearly be unacceptable, and I am pleased that Ministers continue to reassure me and others that they would not allow that to happen. Indeed, the UK has objected to those provisions being inserted in the trade agreement. A first positive step from the incoming Biden Administration will be to remove those clauses from the negotiating text
2021-01-19	CON	DamianCollins	There were 342 assaults on journalists in America last year and there have been 13 further this year. Will my right hon. Friend work with the new Administration in America to protect the rights of journalists around the world, and also call on social media companies to do more—[Interruption]—not just to tackle harmful disinformation, but to make sure that social media platforms are not used to incite attacks against journalists?
2021-01-19	CON	DominicRaab	My hon. Friend is right; we have taken decisive action in relation to South Africa and South America. We have also, as a precautionary measure, suspended the travel corridors and ensured that we have a system in place whereby people have to have a pre-departure negative test. The passenger locator form is backed up by increased enforcement by both Public Health England and Border Force. Of course, we have also reintroduced quarantine on arrival, with extra checks to ensure that people are resting in the home.
2021-01-20	CON	AndrewGriffith	May I first take the opportunity today to congratulate our friends in the United States? They are one of our longest and most enduring partners, including in the domain of investment, where we are each one of the largest investors in each other’s economy. In fact, 1 million people in the UK go to work every day for an American company, and 1 million Americans work for British companies
2021-01-20	CON	KatherineFletcher	I want specifically to speak to new clause 5 and the attempt to seek clarification on the definition of national security. In the spirit of clarity, let me take a step back to take a step forward. What does the Bill do? It enables us to catch up with nations such as America, Australia and Canada, in protecting us from threats from people overseas who try to use business and ideas, candidly, to do us harm. It gives us a legislative framework to address that, and I echo the comments of many Members to put stickers on how important that is
2021-01-20	CON	NigelEvans	I would like to add my congratulations to the 46th President of the United States of America. In the past, I have worked on three presidential elections. I congratulate both Joe Biden and his Vice-President, Kamala Harris. I am certain that when they visit the United Kingdom, they will be guaranteed a very warm welcome.
2021-01-21	CON	ChrisPhilp	I thank my right hon. Friend for his intervention. The test is not that the justice systems are identical; it is that they are just. I do not think I would accept the argument that the American system is fundamentally unjust. However, if there are particular circumstances of a case—perhaps the case he mentions would have met that test, had he advanced that defence —where a grave injustice is threatened, then the UK courts, on human rights grounds, which include the right to a fair trial, can be invoked and a UK judge, or an English judge, can be invited to prevent extradition. It was on grounds, as I understand it, very similar to those that the recent case involved the judge making precisely that finding, so if a miscarriage of justice is threatened, an application can be made to an English judge to prevent the extradition using arguments not unlike those my right hon. Friend has just advanced
2021-01-21	CON	DavidDavis	David Bermingham, one of the NatWest three, described to the House of Lords how he and his co-defendants were extradited to Texas and “put in…hand chains, foot chains”— restraining “belts and everything else”, and then “strip-searched”. This is designed not only to intimidate the accused, but to score a PR victory for American prosecutors. Those extradited to the US face this treatment whenever they are dragged into and out of court in front of the television cameras and the paparazzi. All this comes at the expense of the presumption of innocence
2021-01-21	CON	DavidDavis	Defendants then face enormous pressure from the US authorities to agree a plea bargain. They are told that if they refuse a deal, they will be denied bail and face decades in a maximum-security prison, but if they plead guilty, they will receive a much lighter sentence in an open prison. They are also reminded of the huge financial cost in America of protracted and complex trials, often running into the millions or tens of millions. It takes a brave person to turn down the easy route
2021-01-21	CON	DavidDavis	I had not intended to interfere with the Minister’s course, but since this point has been raised, I will say that the most fundamental thing under-pinning all extradition arrangements—whether they are with America, Europe or whatever—is a presumption that the justice systems are reasonably equivalent. This is where the weakness comes in
2021-01-21	CON	DavidDavis	In a 2011 report on our extradition arrangements, Lord Justice Scott Baker concluded that we did not need to change the rules to ensure that London-based offences are dealt with here in the UK. He was wrong. He failed to give enough weight to the US ambition to extend its extraterritorial jurisdiction of commercial crimes. He also made no allowance for the incredibly one-sided nature of prosecution and trial of foreign suspects in the US justice system. An American citizen facing extradition to the UK can challenge it in a US court on the basis that there is no “probable cause”, but a UK citizen facing extradition has no right to a reasonable grounds hearing. That is what the Joint Committee on Human Rights called in 2011 a “lack of reciprocity in the Treaty” when it called for reform of that treaty
2021-01-21	CON	DavidDavis	It is often the case that once extradited to America, the accused is refused bail. This is on the basis that they are a flight risk. The result is that they are thrown in a cell, often shared with a fellow inmate—possibly a hardened criminal—and their access to legal papers is massively restricted. Their ability to contribute meaningfully to their defence is totally handicapped. This is particularly damaging in all those white-collar cases, where the relevant evidence can stretch to millions of pages and the prosecution face no requirement to tell defendants which pieces of evidence they intend to rely on
2021-01-21	CON	DavidDavis	My argument to the Minister—and I am not expecting a great reply today—is that we must rethink the entire relationship with the United States on extradition. We must navigate a constructive path forward for both countries based on arrangements that are balanced, fair and reciprocal. We should remember that we are friends, not enemies; allies, not rivals. This is particularly important as we seek to embark on a new trading relationship. In the next decade, our two countries will develop even closer commercial relationships. Businesses developed by brilliant British inventors and scientists will look to merge and co-operate with or sell to big American companies in the bigger American market. If the current extradition treaty stands, every one of them could face American extraterritorial legal actions and a legal system stacked against them. In the interests of both countries, that must change
2021-01-21	CON	DavidDavis	Plea bargains are just one of the tools used by US prosecutors to stack the deck against defendants. They also deliberately use the threat of prosecution to disable the defence’s witnesses. Witnesses willing to co-operate with the prosecution are given immunity, while witnesses who refuse to do so find themselves threatened with prosecution. For cases where the alleged crime is in Britain, no British defence witness is going to travel to a court in the US and risk being charged on arrival and never coming back. What is more, prosecutors label these witnesses as co-conspirators, which handicaps the defence’s ability but maximises the prosecution’s ability to use their evidence. These tactics are such a serious issue that in one American case—that of Mohammad Dolah—the judge described it as “a fundamental unfairness that might well amount to a denial of due process.” It is not just the prosecution inside the courtroom stacking the deck against the defendant. The first amendment to the American constitution allows the American media to print and broadcast sometimes frenzied coverage of trials, which inevitably prejudices their outcome. In effect, high-profile defendants in the US face trial by media, as well as trial by jury. That has been laid bare in a string of cases, most famously that of O. J. Simpson, but perhaps most perniciously in the case of the Central Park Five, which is not so well known here but is well known in the United States. That case led to a miscarriage of justice for 13 years—that person was in jail for 13 years, and he was eventually exonerated
2021-01-21	CON	DavidDavis	Since we agreed the UK-US extradition treaty in 2003, it has been abundantly clear that the British Government of the day struck a truly dreadful deal. Asymmetric, ineffective and fundamentally unfair on British citizens, it is a terrible flaw in our own justice system. The previous Labour Administration approached the treaty as though their duty was first and foremost to support the wishes of our American friends, not to safeguard the rights of UK citizens.
2021-01-21	CON	DavidDavis	Such a seemingly minor change in language has a dramatic effect. With the US being a larger country, and with the UK being closer to the frontline on terrorism, we would expect the numbers being extradited from the United States to the UK to be greater than those going in the opposite direction. The reverse applies. The US has surrendered only 58 individuals to the United Kingdom since 2007, with only 11 of them American citizens, while 135 have gone the other way
2021-01-21	CON	DavidDavis	Take the case of Christopher Tappin, who was extradited. He was somewhere in his 60s—65, maybe—and he was threatened with a 30-year sentence if he did not confess to a crime that he did not believe he had committed. That is an intolerable difference, and it is not just criticised here. As the Minister quite rightly says, it is the subject of massive criticism in the United States, but they are stuck with it until they change it. It seems to me that when we think about the treaties, not just for America but for other areas, we should consider trying to guarantee equivalence of justice in delivery, as well as in principle.
