2021-04-12	LAB	HilaryBenn	The Duke was, as are we all, a product of the age in which he was born and of his upbringing. When he was born in 1921, Queen Victoria had died only 20 years previously and Lloyd George was Prime Minister. It was another era. As we sometimes wrestle with our past and how we should come to terms with it, we cannot forget that fundamental truth about how each one of us is shaped. Nor can we truly understand the person without also understanding the age in which they lived, as the Duke of Edinburgh always sought to do, and he lived for a very long time. Even if we did not know all that he was doing, he was ever present our lives, as he was that constant strength to Her Majesty the Queen. As we have watched the tributes and the newsreels about his life, we have inevitably reflected upon our own lives, upon what has changed and what that has meant as we ourselves have got older. This is, after all, the human condition. As the American baseball player Satchel Paige wisely observed: “Age is a case of mind over matter. If you don’t mind, it doesn’t matter.” I suspect that the Duke would have agreed with that sentiment
2021-04-13	CON	GeorgeDuncanSmith	I thank Mr Speaker for his opening statement of support, which is absolutely right, and the Minister for his response. Surely the key question is: where do we go with our relationship with China? China has sanctioned, without reason, British politicians, people beyond the political sphere and organisations. It has also sanctioned people in Europe and in America. Surely it is now time for the Government to lead our allies in Europe and the United States in saying to China that there can be no preferential trade, economic or commercial deals done while our citizens are sanctioned. Will the Minister resist any moves by any other part of Government to water down any of the measures in the new National Security and Investment Bill, which is going through Parliament?
2021-04-13	CON	JohnRedwood	The Government should take some encouragement from the United States’ example. The United States’ monetary stimulus and fiscal stimulus are huge. If we adjust for the size of the economies, the stimulus under the Federal Reserve Board’s actions and President Trump and now President Biden is about twice the scale of the UK stimulus in monetary terms and is considerably higher in fiscal terms. Perhaps the US is taking more risks with inflation than we would like. I am not suggesting that we need to match the American numbers, but I am saying to the Government that we are nowhere near the American numbers, so worry not. This is the time for stimulus—this is the time to make sure that the economy is properly supported and people can get back to work
2021-04-13	CON	JohnRedwood	The Republic of Ireland also has a much higher GDP per head. It is more than twice the EU average, and it is considerably higher than the United Kingdom’s. That is entirely because the Republic of Ireland has this extremely attractive tax policy, which has been so successful in attracting a lot of inward investment, a lot of jobs based on that, and a lot of turnover and profit booking, particularly from great American corporations
2021-04-13	CON	JohnRedwood	There is a huge amount to be done, but the Government should be of good cheer. There can be a very rapid recovery. They have not done too much on the deficit or the monetary stimulus and have fallen quite a long way behind America in the size of the stimulus. They should be ready to do more, be generous if the controls have to go on longer than we would like, and work with the small business community and the big business community on what is a sensible tax regime. There are issues still to be solved on business rates and VAT. The whole purpose of the reviews should be to promote a strong recovery—better jobs, more better-paid jobs, more small business—and then the revenue will flow. Think of the jobs, the incomes and the prosperity, and the revenue follows. Thinking too much about the revenue first, in the mood of putting everybody’s taxes up, will be a great dampener on the recovery we need.
2021-04-13	CON	MelvynStride	Remarks were made about tax breaks for tech giants. It is for the Government to decide whether their corporation tax policy is to go in lock step with President Biden’s idea of minimum corporation tax rates across the world. That could be one solution to profit shifting. We must not forget, however, that this country has been in the vanguard, unilaterally rolling out the digital services tax to make sure that companies including Amazon, Google and eBay pay the appropriate level of tax. It is for the Americans to join us in a multilateral endeavour to make sure that such taxes actually work. I am quietly optimistic that the new American Administration is at least leaning in the right direction. I would be interested to hear the Exchequer Secretary explain why the diverted profits tax increase just maintains the punitive margin between the level of that tax and the increased corporation tax in the years ahead, rather than the decision being made to widen the margin, given how successful the diverted profits tax has been in preventing profit shifting
2021-04-13	LAB	GeraintDavies	Turning back to the nurses, in Wales we have the highest proportion of single earner households in the country and the lowest average wage, which is 70% of gross value added in terms of the UK average. These people might include a nurse as the only earner in a poor household who has faced nearly 10 years of pay freezes and now another pay cut. It is no surprise that nurses are going to food banks. These things are not necessary; they are political choices. I am just drawing the contrast between those who have so much and those who have not enough. Mention has been made of Amazon and the fact that it and others have basically decimated our physical retail side. There are questions about what should be done about that. In my view, local authorities should be empowered to provide digital marketplaces to support local businesses to sell to local people with overnight delivery so that people would have a choice between sending their money offshore to some huge American organisation that does not pay tax, is destroying local jobs and undermining workers and supporting local businesses through a collective approach with a modernised online service
2021-04-13	LAB	PeterDowd	The hon. Member for Hitchin and Harpenden (Bim Afolami) talked about productivity. Yes, we are one of the worst nations in the G7 for productivity. We are about 30% less productive than the Germans, about 20% less productive than the French, about 9% less productive than the Italians, and similarly 30% less productive than the Americans. There is nothing at all in this Bill in substance that deals with productivity issues. As much as the hon. Gentleman likes to say it, the Bill does not deal with that. It does not deal with job insecurity, low pay and low skills. It does not deal with inequality in education, social care and health. It talks about levelling up, but when, where and how? They are just phrases. There is absolutely no action and no route for the action that the Government wish to take over the years
2021-04-13	LAB	RuthJones	Many in Newport West were delighted by the election of Joe Biden and Kamala Harris, and I for one was among them. The Minister will know that the American Government have taken action where we have not, so can the Minister be clear? He has already been asked the question, but I was not clear on his answer. Does he intend to bring forward further sanctions on other entities and more senior individuals in relation to the appalling situation in Xinjiang? A simple yes or no will do.
2021-04-14	LAB	MatthewPennycook	In a letter to all UNFCCC—United Nations framework convention on climate change—parties this week, the COP President rightly argued that we must halve global emissions by 2030 if we are to keep the goal of limiting global warming to 1.5° within reach, yet he will know that recent UN analysis makes it clear that current national pledges will reduce emissions by just 1% by the end of this critical decade. We need the major emitters to do much more if we are to close the gap. That means a need for deep cuts in American emissions and for Chinese emissions to peak by 2025, but it also means a need for tangible progress on the part of India. With the Prime Minister meeting President Modi later this month, will the COP President tell the House what the UK is willing to put on the table, particularly in terms of climate finance and technological support, to help to ensure that India feels able to increase its ambition markedly ahead of the summit?
2021-04-19	CON	OliverDowden	I am happy to give my hon. Friend that assurance. I often say, as Secretary of State for Digital, Culture, Media and Sport, that the two things that people around the world know about the United Kingdom and instantly mention, whether I am speaking to an opposite number in east Asia, in North America or in Europe, are the royal family and the premier league. It is a jewel in the crown of the United Kingdom and we will do what is required to defend it.
2021-04-19	LAB	LucyPowell	I thank the Secretary of State for his clear statement. It was not that long ago that I watched my club, Manchester City, which I now represent, beat Gillingham in the second division playoff final. We are now in what might be called our glory days, but those of us who remember the Gillingham game know that the glory days do not always last. Does the Secretary of State agree that a closed-shop league, where there are no bad days and no glory days, is no league at all and has no place in our national game? British football fans are rightly outraged by that notion, which goes against our deeply held culture of fair and open competition and backing the underdog. It is an American export that we just do not want.
2021-04-20	CON	AndrewMitchell	Are the Government not a little concerned that when they are chairing the G7 in a global pandemic, when international development has never been more important, the Germans have hit the 0.7%, the French have embraced the 0.7%, and the Americans have increased their international development spending by no less than $15 billion, whereas we in Britain are breaking our promise to the poorest, breaking our manifesto commitment on which we were all elected just over a year ago, and cutting humanitarian aid, leading directly to hundreds of thousands of avoidable deaths, particularly among women and children?
2021-04-20	CON	JamesHeappey	As I said, there is a logic to this, because we were at a decision point no matter what. On 1 May, the accommodation would run out and we would be preparing for a fighting season; or we would need a new political accommodation with the Taliban, and that would remove the political imperative altogether; or we would take the decision, as the President did, and with which NATO subsequently agreed unanimously, to leave and, in doing so, to force the pace of the political process. I think that is the right thing. The opportunity to prosecute counter-terrorism missions from the wider region into Afghanistan is something that we are working up with our NATO allies and the Americans at the moment. I am sure that the UK will have a role in that
2021-04-20	LAB	CatherineWest	The scale of tax offences is clear, with a recent TaxWatch report finding that between 2009 and 2019, the UK prosecuted 23 times as many people for benefits offences as for tax offences—that theme has been echoed in today’s speeches—despite the fact that the value of tax fraud is nine times higher than that of benefit fraud. We know that American research has shown that for every $1 the Internal Revenue Service invests, it gets back $10 of benefit for the public purse, and I wonder what the consultation the Treasury ran said about incentivising officers based in HMRC so that the more money brought back, the more colleagues come on board to help them in their important work
2021-04-20	LAB	ChristopherBryant	I am glad to hear that, but, in 1994, the UK, Russia and the United States of America signed the Budapest memorandum, which issued not exactly guarantees but assurances that we would respect the independence, sovereignty and existing borders of Ukraine, in return for which Kiev surrendered 1,900 strategic nuclear warheads, which was vital to secure peace in the region. Is it not now all the more incumbent on us to make it very clear that we will continue to provide political, diplomatic, scientific, financial and, if necessary, military support to Kiev?
2021-04-21	CON	AndrewRosindell	  I was deeply concerned at the weekend following reports in the Sunday Express that the statue of the great United States President Ronald Reagan that once stood in Grosvenor Square has been removed and remains out of public sight. I know the Prime Minister will agree with me that President Reagan was a true friend to the United Kingdom who, alongside Margaret Thatcher, ended the cold war and supported Britain during the liberation of the Falkland Islands. Now that our American friends have moved to a new embassy in Wandsworth, does the Prime Minister agree that President Reagan’s statue should be moved to a more prominent location on Parliament Square, so that visitors from home and across the globe can honour this remarkable man?
2021-04-22	CON	AndrewSelous	I thank my hon. Friend for that question. I can tell her that the Church Commissioners own 95,000 acres of forestry across the United Kingdom, Ireland, the United States of America and Australia; 2,166 acres of our forestry is in Wales. All our forests conform to the UK woodland assurance scheme and the UK forestry standard and have Forestry Stewardship Council certification, which the World Wide Fund for Nature recognises as the hallmark of responsible forest management.
2021-04-22	CON	GeorgeDuncanSmith	Therefore, we have a problem—how can we get there? The only way, really, is what other countries have taken to doing now. The United States has made it clear that it believes that this is a genocide. Holland has followed suit and so has Canada. I hope, therefore, that today we will do so too. If we think that the American Administration that has just come in is going to somehow walk away from the previous Administration on this, it is worth quoting what is being said in the United States. The new Secretary of State, Antony Blinken, said: “My judgment remains”— he is referring to the statement by Mike Pompeo, his predecessor— “that genocide was committed against the Uyghurs and that has not changed.” So now two Administrations in America line up behind this and still stand up for it. On 22 February 2021, Canada’s Parliament voted unanimously on a motion to declare the situation in Xinjiang a genocide. On 25 February 2021, the Dutch Parliament, the States General, passed a non-binding motion declaring that the treatment of the Uyghurs in Xinjiang amounts to a genocide. What do we have to know? We have to have significant reports, witness testaments, satellite imagery and Chinese local governmental data, and we have all of that. It is out there in the public domain now, and more and more is being collated
2021-04-22	CON	NigelHuddleston	Professional wrestling brings incredible joy, as my hon. Friend said, to people right across the country. It has a proud and rich history in this country. If we ask anybody who grew up in the UK between the 1960s and 1980s, as a few of us did, what they think of when somebody mentions wrestling, they will probably talk about Big Daddy and Giant Haystacks and watching “World of Sport” on ITV—those fantastic Saturday afternoons watching wrestling. “World of Sport” finished in the 1980s and the WWF, now WWE, took over. We saw an Americanisation of wrestling for quite a long period, but despite the American dominance, British wrestlers did manage to infiltrate the very top echelons of wrestling, including Davey Boy Smith, better known as The British Bulldog. He was there, as my hon. Friend mentioned, at Wembley Stadium in 1992 when 80,000 people attended the SummerSlam
2021-04-22	CON	SallyAnnHart	Since the holocausts from Rwanda to Cambodia and from Bosnia to Syria, tyrannical and totalitarian regimes have too often been able to discriminate against, persecute and murder segments of their populations with impunity, based on nothing more than someone’s ethnicity or faith. Such actions too easily and too often culminate in mass slaughter and genocide. Looking at the world in which we live today, we really need to examine the evidence of human rights abuses taking place. At this very moment, as is being increasingly and commendably recognised by fellow parliamentarians and foreign officials in democracies around the world, like America, Canada and the Netherlands, the persecution of Xinjiang’s Uyghur people is being thrust to the centre of the global stage
2021-04-22	LAB	FleurAnderson	Between now and then, though, there are still concrete actions we can take, and I will outline four. First, we must declare this a genocide. We could do that now through this motion, which I will be supporting, or if not, through making Government time for a further debate in which we can make that declaration. America, the Netherlands and Canada have done this. Secondly, the Foreign Secretary has described what is happening in Xinjiang as “barbarism we had hoped was lost to another era”.—[Official Report, 12 January 2021; Vol. 687, c. 160.] Therefore, when will this House be presented with legislation strengthening section 54 of the Modern Slavery Act 2015 so that all companies have a responsibility to prove that their supply chains are free of forced labour, and also strengthening sanctions for non-compliance
2021-04-27	CON	JamesCleverly	I thank my hon. Friend for the points she raises about the international nature of this situation. Of course, we work closely with our international partners —as I have said, with the E3 and the United States of America—in particular with regard to our policy towards Iran. We will work with any and all international friends and partners to bring pressure to bear for the release of their and our dual nationals in detention. The challenge is that Iran does not recognise dual national status and therefore denies us a number of the consular access opportunities we would normally have. We will continue to work to secure the release of our British nationals in Iran.
2021-04-27	CON	JamesCleverly	The hon. Lady speaks about international co-operation. Of course we co-operate with our international partners on a whole range of issues with regard to Iran, including the United States of America and the E3, and, as I have already said, we are working with Canada on the work that it is doing on the initiative against arbitrary detention. We will continue to focus our efforts on getting Mrs Zaghari-Ratcliffe home to the UK and the other dual nationals in detention fully released.
2021-04-27	LAB	TulipSiddiq	Will he acknowledge that Nazanin is being held hostage by Iran and is a victim of torture? In light of the recent adjournment of the IMS debt hearing scheduled for last week, what are the Government doing to ensure the debt is paid promptly? The Prime Minister said yesterday that he was working with our American friends on this issue. Can the Minister please explain what that involves and why the US has had more success in securing the release of dual nationals than we have? Tomorrow, another British-Iranian dual national, Mehran Raoof, is on trial in Iran. What link does the Minister see between development in that and Nazanin’s case and upcoming talks on the Iran nuclear deal
2021-04-28	LAB	WilliamEsterson	The Minister could do worse than look at the United States, where they know the value of small businesses to the economy. The US Federal Reserve bank found that 30% of small businesses in the US—that is 9 million of them—did not expect to survive 2021 without assistance, which is why the US Small Business Administration has been tasked with supporting small businesses to build back better, alongside President Biden’s American Rescue Plan Act. In the UK, more than 1 million small businesses face similar concerns. Would it not be great if the UK had a small business administration to look after microbusinesses, the self-employed and SMEs? As the Minister should know, it is vital to distinguish between those fundamentally different types of business. The US Small Business Administration shows clear intent to support smaller businesses as part of a concerted and thought-out plan for the long term, not just a quick fix
2021-04-29	CON	GrantShapps	My right hon. Friend is absolutely right to highlight the threat. I wonder whether everybody realises that the Mayor of London would like to introduce this border tax, so that non-Londoners end up having to pay for his financial mismanagement of London. It is not on. It is called taxation without representation and, as our American cousins used to point out, that is tyranny.
2021-05-11	CON	JohnRedwood	I hope the Government will work more, as the Gracious Speech implied, on national resilience. That issue is becoming common—indeed, President Biden is working hard on that in the United States of America. We have seen how, if we become too dependent on overseas interests, we must be careful in the field of energy. We have seen our French neighbours threatening Jersey over the energy supply that it currently receives from an interconnector to France. I hope the Government will learn a lesson from that. Interconnectors under the sea are vulnerable if other countries are hostile to us, because of the physical location of the cable. We should move our policy from one of increasing dependence on more interconnectors to import energy, to one of wanting self-sufficiency and capacity in the United Kingdom. We always used to have that, and surely it would be a good source of jobs and investment if we set ourself the target of getting back to meeting our own needs in whatever suitable style the Government wish
2021-05-12	CON	AlexanderJohnson	My hon. Friend makes a good point about the United States of America. We are on that issue with our American friends, but people have to recognise that we are still at risk of importing new variants into this country. We have seen the arrival of B1.617.2 and we must be cautious. On that basis, the green list—as my hon. Friend knows, some counties are already on that list, and they are very attractive-looking destinations, as far as I can see—will be subject to review every three weeks.
2021-05-12	CON	HuwMerriman	I warmly welcome the Prime Minister’s statement and the inquiry. As our fantastic vaccination programme continues to be rolled out and our vaccination continues to be effective against all mutant strains, and as other countries catch up, will the Prime Minister look at widening the green list of countries to which travel is permitted? Will he ensure that the airports have the border control and digitisation resources to deal with more passengers? Can he also warmly encourage President Biden, when he sees him next month in Cornwall, that other Americans would like to come over to this great country and, indeed, we would like to go over to theirs?
2021-05-12	LAB	CatherineWest	We all know that we have less than a decade to make the bold changes demanded by the UN’s climate body to limit temperature rises, but this Queen’s Speech is bereft of any programmes or resource allocation to implement the green jobs plan we need to meet the target. In fact, the Government completely scrapped their only green jobs scheme, the green homes grant, after it was outsourced to a private American firm which botched the roll-out. Ministers will trumpet the newly announced national infrastructure bank, which we have been calling for for a long time now, but the Office for Budget Responsibility has said that the new bank will provide less than half the funding we used to receive from the European Investment Bank and offer a fraction of the funding recommended by the National Infrastructure Commission to tackle the climate emergency
2021-05-12	LAB	GarethThomas	To be fair, the FCA did make it clear to the all-party parliamentary group on mutuals that there would be some boxes it needed to tick as the sale of LV= proceeded. Serious questions are now being asked about the FCA. It was asleep at the wheel when London Capital and Finance was collapsing, again asleep at the wheel when Greensill tottered into insolvency, and now seems determined to take sleeping tablets as a thriving, well-capitalised British success story is being handed over lock, stock and barrel to one of America’s most controversial private equity giants. I urge Ministers to take the opportunity to investigate
