2021-06-30	CON	TobiasEllwood	This will be China’s century, as it eventually overshadows and overtakes America as the dominant military, economic and technological superpower, yet here we are in Britain still failing to put two and two together. For a nation that usually prides itself on its place and influence in the world and its grasp of global situational awareness, I am genuinely baffled to understand why it is not reading and responding to this bigger picture. China is offering a competing authoritarian ideology and is leveraging its colossal economic growth to undercut western competition. On this current glide path, the world will splinter into two spheres of competing influence. Now is not the time to cut our defence budgets or our aid budgets as these threats increase, yet here we are doing both. There is a phenomenal opportunity for British leadership here, made all the easier with the new US Administration, to craft a post-Brexit international role at the very moment the west is required to regroup. I urge this Government to listen to the voices here today in this Parliament and see the bigger picture, recognise the scale of the threat we face, invest in the statecraft and the hard and soft power tools we need, and expand Whitehall’s international bandwidth, for the actions we the west choose to take over the next few years could have implications for how the next few decades play out.
2021-06-30	LAB	KerryMcCarthy	MPs have been contacted by the Galapagos Conservation Trust, which says that grants to the trust to conduct research on the prevention and removal of plastic waste were cut by 64% this year, and that funding for future years is not guaranteed. Fifty jobs are now at stake. Each year, 1 million tonnes of plastic waste leak into the ocean from the Pacific coastline of central and south America, and without action that amount will double by 2025, threatening an area where more than 20% of unique marine species live
2021-06-30	LAB	RushanaraAli	On the economic dimension, we have to think about the linkages, as the former Prime Minister said in her speech. Others have spoken about the influence that Britain can have on the global stage. If we provide the support to countries that need help, according to the International Monetary Fund the cumulative gain will be $9 trillion by 2025, with $3.6 trillion accruing to the advanced economies, which will recoup $1 trillion in tax revenues. So it is in our economic interest to help countries develop, get out of the pandemic, and survive and thrive. There is not just a moral imperative, albeit that is very important for our country and we are all proud to be a part of what we have done over the last few decades. A country-by-country analysis by Save the Children shows that American and European funding of vaccines will each be repaid 35 times over in increased trade and output
2021-07-01	LAB	CatherineWest	I also want to draw attention to the cross-party nature of today’s debate. I was really delighted to see that on a British-America Parliamentary Group tour in the US, the Minister was working cross-party with us on questioning the reductions to the HIV/AIDS budget that the former President of the USA was attempting to introduce at the time. It was fantastic to work across Parliament as the British-American Parliamentary Group to make the case for continued funding for HIV programmes abroad. It shows the best of our Parliament when we work together across the piece on those important programmes. In the same spirit, may I encourage the Minister to question whether rolling out the red carpet for Viktor Orbán, as was done by No. 10, is the right tone? I worry that the struggle for equal treatment for LGBTQ communities is being set back in that part of Europe. The hon. Member for Glasgow South described his experience in Kiev. It is a struggle—a day-to-day, hour-by-hour struggle there—and we must never forget that
2021-07-05	CON	RobertWallace	The truth is that the right hon. Gentleman does not seem to understand defence procurement or how things are manufactured. For example, 15% to 20% of the global components for all 3,000 of the F-35 aircraft—the rear part of the aeroplane—are made in Lancashire. Many of the highly complex, highly expensive defence projects are a collaboration. Typhoon is often championed on both sides of the House: that is an international collaboration between Spain, Italy, Germany and the United Kingdom. When the right hon. Gentleman mentions the word “supplier”, he is of course deliberately confusing that with the actual number of jobs and the ownership of their business. Let us ask the question: how many people are working on American companies’ business but based in the UK? He will find that most of them are here in this country.
2021-07-05	CON	RoystonSmith	British and American F-35s recently conducted operations from the UK’s aircraft carrier HMS Queen Elizabeth as part of Operation Shader to degrade the capabilities of Daesh. Will my hon. Friend, as much as he is able, update the House on the nature of those operations and their strategic importance?
2021-07-05	LAB	BenjaminBradshaw	Given that Americans and other Europeans have already been free to travel again for some time, and given that we were promised a vaccine dividend, when can the millions of British families who are separated from loved ones abroad or who simply want a foreign holiday expect to get back the same freedoms that other Europeans and Americans already enjoy?
2021-07-06	CON	AlecShelbrooke	I honestly believe that we have to be very careful at the moment. It is getting better now, but we have been through a period in which the value of the democratic processes in many democracies has been questioned. We have just seen a narcissistic, arrogant now ex-President of the United States with, quite frankly, low political intellectual ability, undermine the entire system to the point he literally caused five people to die because he did not accept the result of an election. He used social media and all the other things to stir it up by saying, “I won this election.” He clearly did not, but most polling shows that a whole swathe of voters in America think that he did, which again undermines democracy
2021-07-06	CON	SajidJavid	We all know that the impact of this terrible virus has been very different across the world. The hon. Gentleman has talked about countries in the far east. The impact in South America, India and Europe has been very different. I do not think we can simply draw a conclusion that the reason for that difference is the policy on masks. The primary reason that we were able to announce the step 4 measures yesterday was the vaccine. If the hon. Gentleman looks at the countries he mentioned, particularly Japan, he will see that their vaccination rates are a lot lower than ours. That will partly explain why they may be taking a different approach to tackling the pandemic at this point.
2021-07-06	LAB	CatherineSmith	I have sparred with the right hon. Member for Elmet and Rothwell (Alec Shelbrooke) on many other constitutional and electoral matters over the years—it is always a pleasure—but I very much agreed with him when he was talking about the threats to democracy and democratic systems globally, including his point about the United States of America. However, I disagreed with his analysis of the 2017-19 Parliament, which was echoed by some of his colleagues. I think we are unfairly blaming the Fixed-term Parliaments Act as the sole cause of the difficulties that the Government had at that time. If I close my eyes and imagine that that Act was not in place in the 2017-19 Parliament, I do not see that the political path would have been much smoother for the Government, so it is unfair to blame solely that Act for the Prime Minister’s difficulties at that time. When we legislate, we should be careful not to base everything on recent political experience. Indeed, we are legislating for constitutional matters that should not only secure as broad a consensus as we can across the House but stand the test of time. We should not base everything on the specific and unique circumstances in that Parliament
2021-07-07	CON	PaulScully	The Minister for Equalities is doing a lot of work in this area, as is our Department of Health and Social Care. We are committed to reducing inequalities in health outcomes, and Professor Jacqueline Dunkley-Bent OBE, the chief midwifery officer, is leading work to understand why mortality rates are high, consider evidence and bring action together, because this is a complex situation. It is not just within maternity; it is far more holistic than that, for instance on whether people are accessing health services in the first place, and with the fact that we had some of the highest rates in the EU of obesity and underweight issues going into maternity and the highest rates of smoking in pregnancy in the EU—indeed, our level is even higher than America’s.
2021-07-07	LAB	BellaviaRibeiroAddy	On Monday, we celebrated the 73rd birthday of the NHS—one of the very best things about our country. Many Opposition Members, and our constituents, remain committed to protecting the fundamental right to universal healthcare, free at the point of delivery, but this Government remain a constant threat to our public health service, with no staff pay rise, a 25% cut in the number of mental health beds, and the widespread sell-off of GP practices, such as the Edith Cavell Surgery in my constituency to American private insurance giant Centene. There is also the Health and Care Bill, which will only open the doors wider for privatisation. Why is the Prime Minister continuing to eviscerate our most essential public services, and why will he not listen to the thousands of essential workers who demonstrated on Saturday to end NHS privatisation, chronic underfunding and understaffing, and to keep the NHS public?
2021-07-08	CON	AlexanderJohnson	I thank my hon. Friend for her service in Afghanistan for the BBC World Service. I know that she knows and cares deeply about that that country. We will of course work with the Americans and all our NATO allies to achieve the objectives that she sets out, particularly protecting this country against terrorist threats, but also making sure that any settlement that we are able to encourage protects the rights and freedoms of women that have been won partly through the efforts and sacrifice of the British armed services.
2021-07-08	CON	AlexanderJohnson	I thank my right hon. Friend, who knows a great deal about Afghanistan and the problems it faces. Of course, we have raised repeatedly with our American friends and other NATO colleagues the legacy that we wish to preserve in Afghanistan, particularly the gains made for women, and they understand that. In all candour, I must be honest and say that I do not think that the military options open to us are very great, and I think that people need to recognise that, to return to the point I made to my right hon. Friend the Member for Chingford and Woodford Green (Sir Iain Duncan Smith). But we will do whatever we can diplomatically and politically to get a realistic lasting solution for Afghanistan.
2021-07-08	CON	AlexanderJohnson	I thank the hon. Gentleman and join him in paying tribute to the sacrifice of all serving men and women of the Irish Guards, the Royal Irish Regiment, as well as all those who sacrificed their lives in Afghanistan, and everything they did to protect the people of that country. As he knows, the UK helped to train about 5,500 officers in the Afghan security and defence forces. We will continue to invest in them, with £58 million a year in the way that I described. We will, of course, be doing that in concert with our American friends and allies.
2021-07-08	CON	AlexanderJohnson	On the morning after 11 September, few would have predicted that no more terrorist attacks on that scale would be launched from Afghanistan in the next 20 years. Those gains were achieved by an American-led military intervention mounted with overwhelming international support, including troops from dozens of countries, and the first and only invoking of NATO’s article 5 security guarantee. We can take pride that Britain was part of that effort from the beginning
2021-07-08	CON	AlexanderJohnson	President Biden announced in April that all American forces would leave by September at the latest, and the NATO summit declared last month that the alliance’s military operations in Afghanistan were “coming to an end”. As a result, all British troops assigned to NATO’s mission in Afghanistan are now returning home. For obvious reasons, I will not disclose the timetable of our departure, but I can tell the House that most of our personnel have already left
2021-07-08	CON	AlexanderJohnson	Yes, as I said in my answers to the right hon. Member for Ashton-under-Lyne and other Members who have effectively asked the same question, the circumstances in 2001 when this country went into Afghanistan were quite exceptional. NATO’s article 5 of mutual appeal for defence was invoked by our American friends. That is why we went in and it was a quite exceptional moment
2021-07-08	CON	EdwardLeigh	The Prime Minister has been given a hard time today and I have a lot of sympathy for him because, given that we have to follow in the wake of the Americans, we have very few cards to play. I give him credit for coming here and taking it on the chin, but this is a catastrophic defeat for the west. It is a very sad day for tens of thousands of British personnel whose life’s work may now lie in ruins, and an abandonment of all our friends in Afghanistan. Let us be honest, the Taliban will probably take over large tracts of the country and the rest may be taken over by a warlord, so it is a desperate situation
2021-07-08	CON	ThomasTugendhat	Now I understand that it is hard to do that and I understand it demands a lot. The integrated review set out a really impressive strategy and it was not just summarised with the three words, “God bless America”.
2021-07-08	LAB	BenjaminBradshaw	I warmly welcome this statement, which finally restores to us some of the freedoms that our European neighbours and Americans have been enjoying for some considerable time. If I understood the Secretary of State correctly, the green list testing requirements will still leave travel more restricted this summer than it was last summer, when we did not have the vaccines. As he will understand, reciprocity is absolutely vital for travel, and the lack of immediate reciprocity for other countries means that they are less likely to open up to us anytime soon. So why, when many European countries already accept our vaccine passport, are we incapable of accepting theirs now?
2021-07-08	LAB	JeremyCorbyn	This has to be a day of reflection. We have spent billions of pounds in the war in Afghanistan, 450 British troops have lost their lives, thousands of Americans and other troops have lost their lives, many, many thousands of Afghan people have lost their lives and many more have been forced to be refugees in exile all around the region as well as in western Europe. Surely we need to think about this very carefully. It is disappointing that the Prime Minister appeared to reject calls for an inquiry at the Liaison Committee yesterday and appeared to reject the request for an inquiry made by the right hon. Member for Bournemouth East (Mr Ellwood) today. May I ask him to think again about that? Surely we need an inquiry into how such a decision came around to go into Afghanistan in the first place, and now the withdrawal from Afghanistan and of course the chaos that is being left behind
2021-07-12	CON	JohnHayes	Those are all contestable opinions. Of course they are all matters of debate and of course some of them are contentious views, but the whole point about a free society is that we should be able to hold and express contentious views. It is worrying—more than that, chilling—that, as has been said, we are creating a cohort of young people who are hyper-sensitive: no longer daring; no longer prepared to think the unthinkable; deprived of intellectual rigour and imagination. The hallmarks of that woke culture—as we have heard, perpetuated principally on social media—are spite, hate and vitriol. Frank Luntz, the American pollster, has warned that the culture battles we have seen so far are nothing compared with what is on its way. The cultural detritus from the United States is making its way to our shores relentlessly: a culture that is intolerant of measured, principled disagreement. It has gripped many in the United Kingdom, as I have already described. I could go on with a list and I am happy to make that list available to the House of Commons Library if that is helpful to colleagues who doubt the depth of the problem
2021-07-13	CON	AnthonyMangnall	As we have heard in the course of this debate, the 0.7% target was not only a manifesto commitment made by every political party in this place but a commitment to the world’s poorest. It was a commitment to join in force with other nations around the world. Many Members have said, “We didn’t do anything—no other country followed us” but Germany, Denmark, Sweden, Norway and Luxembourg all now fulfil the 0.7% target, France is set to hit the 0.7% target next year, and the United States of America has uplifted its spending by $16 billion. We say that we did not have influence; I beg to differ. Today’s debate is really about the fight for parliamentary engagement. In 2015, this House voted for the International Development Act, which enshrined the right to make sure that we did not make short-term decisions and that when the years were good the spending went up and when the years were bad the spending went down. That is something we should have kept in mind before we made today’s decision. Instead, we have been offered a mirage. What looks like a compromise is something that will never be reached. Despite the arbiters of the OBR, the spending decisions on the issue will still be made by the Treasury. This announcement comes before a spending review, so we do not know how much is going to be spent on social care, health or education. We do not know what the Government’s financial commitments will be in the years to come. We are therefore being led down the garden path, and by that I am appalled. Just as with Gordon Brown’s checklist to join the euro, we will never meet these targets
2021-07-13	CON	ThomasTugendhat	My hon. Friend is completely correct. Of course, the reality is that we are not living in a vacuum—we are not taking these decisions with nobody watching. Our friends are watching and our rivals are watching. As we make this decision, as we change our policy on Afghanistan, and as we buy different seats at various UN tables through our diplomacy in sub-Saharan Africa, Asia and South America, we know that we are changing the rules by which we live. We are literally changing the standards of our modern world through how we buy support, develop allies and partner around the world. As Members have said, this debate is of course about the world’s poorest, but it is not just about the world’s poorest. Fundamentally, it is about Britain and how we protect ourselves. How do we shape this world? How do we get the standards that make sure that British businesses succeed, British finance shapes the world and British rules are those that the world lives by? We do that by making sure that we win the votes at the UN by making sure that we have the voices around the table—the voices of the Foreign Ministers of countries around the world. We can do it; I know that because we have done it. For 20 years we have won debates, shaped arguments and defended our position. We have done it by doing well and by doing good—exactly as the Chancellor demonstrated in his pre-political career
2021-07-14	CON	AlexanderJohnson	I thank my hon. Friend, who knows a lot about the subject that she mentions. This is a fantastic opportunity for this country, because we do indeed produce a great many tech breakthroughs and we are very much looking at how to scale up fast, but we must not forget that, as I speak, there are three countries in the world that have scaled up tech breakthroughs to 100 unicorns worth more than a £1 billion. Only three countries have 100 unicorns. They are the United States of America, China and the United Kingdom.
2021-07-14	LAB	JonTrickett	There are two competing views of health provision facing each other. Either health is about an ethos of care or it is about making money. This Bill leads in one direction. The Government do not want to fund the NHS properly, so they are trying to entice more private money into health, often from sources, we note, from the Tory party. Privatisation puts one person’s wealth in front of another person’s health. We should look at the pages of the American health service providers today salivating at the prospect of growing NHS waiting lists, and now, so-called independent providers are to be invited to sit on boards that actually manage the NHS budgets. The idea of profiteering from someone else’s ill health is repulsive to most British people, yet it is intrinsic to this Bill. We can call it only one thing: parasitic capitalism. Along with the Royal College of Nursing, the British Medical Association and many other practitioners, we must resist the creeping destruction of our NHS.
2021-07-15	CON	AlexanderStafford	The People’s Republic of China is a cause for concern beyond the Xinjiang crisis, too. Commercially, companies fear upsetting the Chinese government and Chinese consumers, so they will often bend to Chinese demands. It is simply not right that British and American companies, based in the UK and the US, accept the diktat of a foreign dictatorship
2021-07-15	CON	NusratUlGhani	There is some anxiety that we cannot take action unilaterally, but that is also nonsense. Many Parliaments around the world are currently debating, discussing or putting motions in place to ensure that politicians and diplomats will not be turning up at these Olympics. It is also quite exciting to note how forceful and bold the Biden Administration are being on this. Just last night, a motion was moved in the Senate to declare that all goods coming in from Xinjiang are slave labour goods and will now be blacklisted and not allowed to be imported into America. These are the motions we should be moving in this House; our position should not be to say, on the one hand, that this is an industrial-scale version of human rights abuses and, on the other hand, that there is nothing we can do
2021-07-15	LAB	MohammedKhan	Calls for a diplomatic boycott of the Beijing Olympics are gaining momentum internationally. It is high time that the UK demonstrates leadership on the issue and follows in the footsteps of the EU and America to send a strong message to the international community that the UK condemns the shocking human rights abuses taking place in Xinjiang and in Hong Kong. We cannot let China divert attention away from international criticism of its human rights abuses and oppressive policies
2021-07-19	CON	NadhimZahawi	I am grateful to my hon. Friend for his question. The vaccination rates in the United Kingdom have been incredibly high. We are at 88% with the first dose and 68% with double doses. On double doses, we are actually ahead of the United States of America. That does not mean we become complacent, however. We are doing everything we can to ensure that every cohort, and every ethnicity has the ability to access the vaccine
2021-07-19	CON	NadhimZahawi	On vaccinating 12 to 15-year-olds, the right hon. Gentleman asked about the number for England. Approximately 370,000 children will receive that protection. We are currently not following the United States of America, Israel or other countries in vaccinating all children, although the JCVI is continuing to review the data and is waiting for more data on second doses. Millions of children in the US have already received a first dose but there is a time lag for second doses and that is being kept under review. We publish the JCVI advice accordingly
2021-07-19	CON	NadhimZahawi	We and the devolved Administrations have accepted the advice of the Joint Committee on Vaccination and Immunisation to vaccinate vulnerable children, those children who live with vulnerable adults, and 17-year-olds close to their 18th birthday. The committee is, however, keeping the situation under review and looking at more data emerging from other countries, including the United States of America, on whether we should vaccinate all children. I reassure the hon. Lady that children will have two supervised tests on their return and that testing will continue until the end of September. A combination of that and vaccinating at scale all adults helps us to control transmission. Double-vaccinated people reduce transmission rates by about 50%.
2021-07-20	CON	GeorgeDuncanSmith	I have some questions for my right hon. Friend. Will he explain why the Government did not come to the House yesterday to make a statement? Given that this is an aggressive attack, why are the Government allowing the UK’s largest silicon chip manufacturer, Newport Wafer Fab, to be bought by a Chinese firm when they know very well what they are up to? Why is it that the US Justice Department, also with this, brought federal criminal charges against four named MSS officers over their role in the hacking of the American targets, yet no such charges have been brought against operatives here
