2022-02-15	FI	CaligiuriFulviaMichela	Signor Presidente, rappresentante del Governo, colleghi, oggi, così come lo scorso 10 giugno, ci troviamo a discutere del nutri-score all'interno del contesto della strategia Farm to fork. Da quel giorno riscontro maggiore consapevolezza nel problema e impegno per la risoluzione dello stesso da parte dell'Esecutivo e del Ministero. Ringrazio i sottosegretari Centinaio e Battistoni e la nostra capogruppo Bernini per tenere sempre alti i problemi così sentiti. Ho riscontrato la stessa volontà tra i colleghi della Commissione agricoltura; ringrazio il presidente Vallardi e tutti i colleghi, così come è stato già detto, con i quali abbiamo deciso di portare in Assemblea questa mozione condivisa per dimostrare il nostro costante sostegno nei confronti dell'eccellenza dei prodotti agroalimentari. Un settore che vale ben oltre 522 miliardi di euro. A questo settore, traino dell'economia, traino del nostro PIL e una delle materie prime fondamentali, si chiede uno sforzo non indifferente al fine di raggiungere con successo i tanti obiettivi prefissati. Uno fra tutti la neutralità climatica entro il 2050. È quindi evidente come sia necessario ora più che mai mettere in atto qualsiasi strumento efficace al fine di supportare il lavoro dei nostri imprenditori agricoli, veri e propri custodi del patrimonio naturale italiano. Bisogna farlo per tutelare le produzioni, la nostra competitività in Europa e nel mondo, in un contesto dove la concorrenza, spesso sleale e spietata, sembrerebbe non aiutare il made in Italy. Bisogna farlo anche alla luce delle innumerevoli sfide già affrontate dai nostri imprenditori, i quali anche in un periodo di estrema emergenza come la crisi sanitaria hanno dimostrato alti livelli di resilienza, garantendo il cibo sulle nostre tavole quando ciò non era del tutto scontato. Si sono aggiunti inoltre le epidemie di xylella e peste suina, l'eccessiva presenza di fauna selvatica, eventi climatici straordinari, mancanza di manodopera, poche garanzie del reddito dei nostri imprenditori, aumento dei costi dell'energia e delle materie prime. All'interno delle politiche dei Paesi dell'Unione europea ci si approccia alle problematiche in modo naturalmente differente, ma la sintesi da trovare per regole comuni deve essere necessariamente condivisa e armonizzata tra tutti. Penso alla necessità di scegliere un sistema di etichettatura nutrizionale unico nell'ambito della strategia europea sugli aspetti sanitari connessi ad esempio ad alimentazione, sovrappeso, obesità e lotta contro il cancro. In Italia, patria della dieta mediterranea, che ricordiamo è patrimonio dell'UNESCO e sistema nutrizionale consigliato ovunque perché sano, si è pensato di presentare quale schema armonizzato europeo il nutrinform battery, che ruota intorno alla scelta consapevole del consumatore. Il sistema antagonista, come abbiamo già ascoltato, proposto dalla Francia, è il tanto discusso nutri-score, il quale con la sua etichettatura a semaforo indirizza, nel vero senso della parola, la scelta del consumatore, di fatto condizionandolo. Come Forza Italia, lo scorso 23 novembre abbiamo presentato il nostro piano anti nutri-score, determinati ad evitare la sua adozione a livello europeo, perché lesiva degli interessi italiani e soprattutto perché pericolosa per il consumatore. Lo abbiamo già fatto in quest'Aula, ma lo ricordo ancora, perché è emblematico: il nostro olio extravergine di oliva, cardine della dieta mediterranea, emblema del nutrirsi in maniera sana, verrebbe etichettato come arancione-rosso, mentre una porzione di patatine, fritte con chissà quale olio, utilizzato chissà quante volte in un qualsiasi fast food, secondo il nutri-score avrebbe semaforo verde. Tutto ciò è assurdo, quanto pericoloso, perché tale etichettatura non svolge quello che dovrebbe essere il suo unico compito: informare in modo corretto i consumatori, educandoli ad un regime di alimentazione e ad uno stile di vita sano. È di pochi giorni fa la notizia che lo stesso inventore del nutri-score propone una nuova tinta del semaforo: il nero funereo per qualsiasi prodotto alcolico, scatenando polemiche, non solo in Italia, ma anche in Francia, essendo l'Italia, insieme alla Francia, leader nel settore a livello mondiale. Sappiamo che tutti i prodotti, solo se consumati in eccesso provocano danni all'organismo. Allora da dove proviene la volontà di etichettare qualsiasi bevanda con un tasso alcolemico superiore al 1,2 per cento come altamente dannosa? Credo sia per la voglia di cavalcare l'onda e di presenziare ai talk show. Tutto ciò, però, a danno dei tantissimi produttori italiani e non, ma anche dei consumatori, messi in allarme con un sistema di informazione scorretto e poco apprezzato a livello internazionale. Da differenti studi emerge la volontà del consumatore di ricevere informazioni sulla qualità del cibo che si acquista, sugli effetti sulla salute, quindi sull'apporto in termini di grassi, zuccheri e sali rispetto all'assunzione quotidiana. In particolare il nutrinform battery è il tipo di sistema più apprezzato dai consumatori. Mi auguro che con oggi, in attesa della decisione definitiva da parte della Commissione e auspicandone saggezza e raziocinio, si possa scrivere la parola fine ad un attacco ingiusto a ciò che rappresenta uno dei nostri fiori all'occhiello, cioè i tesori italiani dell'agroalimentare. Condividendo appieno gli impegni che il Governo assumerà per tramite di questa mozione, come appunto la promozione del nutrinform battery, le iniziative per il riconoscimento del valore delle produzioni made in Italy, contrastando il fenomeno dell' italian sounding, fino al contrasto delle importazioni di prodotti che non rispettano gli stessi criteri di sostenibilità ambientale, economica e sociale imposta ai produttori europei, annuncio il voto favorevole del Gruppo Forza Italia, certa che qualsiasi decisione che verrà assunta dall'Esecutivo sarà a tutela del comparto.
2022-02-15	FI	DeBonisSaverio	I motivi di perplessità delle etichette a semaforo sono diversi. Innanzitutto, alcuni esperti hanno fatto notare come l'algoritmo utilizzato per assegnare i colori ai vari prodotti sia poco trasparente. Inoltre, il criterio dei colori è troppo riduttivo e semplicistico, per cui di fatto risulta più un'induzione al consumo, una sorta di strategia di marketing, che una vera informazione nutrizionale su base scientifica. Infine, ma non per ultimo, ciò che l'Italia contesta a questo sistema è che nessun cibo è buono o cattivo di per sé, ma deve essere valutato in base al suo apporto quotidiano di energia, sali, zuccheri e proteine, nell'ambito dell'intera dieta del consumatore. In base a questo sistema - ad esempio - ci troviamo di fronte al paradosso per cui una bevanda gassata o con edulcoranti, oppure la carne sintetica, appaiono più sani di un cucchiaio di olio d'oliva o di un pezzo di parmigiano. È evidente che c'è qualcosa che non va in questo sistema. L'Italia ha proposto un sistema alternativo a batteria denominato nutrinform, che parte da un criterio completamente diverso dal nutri-score, dal momento che valuta il ruolo strategico del singolo prodotto all'interno della dieta. Una buona cultura alimentare si basa sull'educazione e sulle scelte consapevoli dei consumatori, con una dieta varia che non escluda alcun alimento, ma ne consenta il consumo secondo frequenze e porzioni adeguate. Il rischio principale di un sistema fuorviante come il nutri-score è di penalizzare fortemente sui mercati i prodotti d'eccellenza del nostro made in Italy. Del resto, le attività di pressione per fare concorrenza all'agroalimentare italiano non sono certo una novità. Importante sarebbe spingere la Commissione a realizzare massicce campagne informative: non basta sapere cosa si compra, ma anche le quantità da consumare. Occorre fare un passo in più: un cibo sano innanzi tutto, quello che viene prodotto con pratiche sostenibili non impattanti sugli ecosistemi. L'agricoltura biologica in questo è la migliore garanzia della salubrità degli alimenti; i consumatori devono essere consapevoli se nel cibo siano presenti o meno residui di pesticidi o di altri contaminanti. Tra l'altro, tutto questo avrebbe un potente effetto di prevenzione sanitaria che ridurrebbe i costi del nostro bilancio sanitario. Per questi motivi, nella mozione firmata insieme ad altri colleghi della Commissione agricoltura, abbiamo chiesto vari impegni al Governo. Auspico vivamente che il Governo voglia raccogliere tali impegni e che l'Italia in generale muova passi concreti e decisivi verso un'agricoltura sostenibile, dignitosa per gli agricoltori - guardiani del nostro paesaggio e dell'ambiente - e attenta ai bisogni dei cittadini.
2022-02-15	LN	RufaGianfranco	; abbiamo messo due milioni per la distribuzione delle derrate alimentari, abbiamo voluto l'albo degli agromeccanici e abbiamo anche voluto un fondo di cinque milioni per l'acquisto di macchinari e software per l'Agricoltura 4.0. Questo lo facciamo perché ci mettiamo la faccia, e lo facciamo con il sottosegretario Gian Marco Centinaio, persona preparata; quindi, questo è anche il nostro compito di essere al Governo. Il cibo è narratore dell'Italia e se non lo difendiamo perderemo odori e sapori che ci hanno fatto crescere in salute. Il Farm to fork, ovvero dalla fattoria alla tavola, è auspicabile se è dalle fattorie italiane alle tavole di tutto il mondo e non il contrario. È come per la storia dell'energia: la facciamo produrre in Francia e la acquistiamo a un costo maggiore. I dubbi ci sono. Alcuni dei metodi del Farm to fork sono buoni: riduzione di pesticidi e degli antimicrobici, dei fertilizzanti, della perdita dei nutrienti, ma, come afferma il Dipartimento dell'agricoltura degli Stati Uniti d'America, si arriva addirittura a dover importare frutta e verdura, praticamente la dieta mediterranea. Una maggiore richiesta comporterebbe un maggior costo, una maggiore scarsità di prodotti e un inquinamento della dieta mediterranea e questo è quanto rischiamo venga provocata dal Farm to fork. C'è poi l'altro enorme problema dell' italian sounding, che potrebbe essere ancora più rilevante. Già perdiamo 100 miliardi al confronto dei 50 miliardi derivanti dal made in Italy. Occorre fare attenzione, quindi, anche alla contraddizione che in Europa si realizza quando si sottoscrivono accordi commerciali con il Mercosur, dove si inquina e da dove invece si permette l'importazione. Nutri-score e Farm to fork sono quindi progetti lodevoli, ma l'Italia può farne a meno, se viene intaccata la nostra dieta mediterranea, sinonimo di buona crescita e salute.
2022-02-15	LN	RufaGianfranco	È quindi un metodo contro le eccellenze, su una richiesta già ben confezionata e condizionata, ed è fastidioso che, tra le associazioni che fanno parte di Euroconsumers, ci sia anche l'italiana Altroconsumo a favore del nutri-score, con 377.000 iscritti, i quali penso non sappiano che questa fa parte di un network internazionale, che il BEUC a cui è iscritto non accetta, fatturando anche 200 milioni l'anno e pare essere indagato anche nei Panama paper. Oltre a loro, ci sono anche dei quotidiani on line sempre a loro legati; quindi, a pensar male è peccato, ma spesso si indovina, come diceva qualcuno. E poi, ci sono ricchi facoltosi che spingono per le bistecche artificiali per poi produrle in bioreattori consumando non solo energia ma anche acqua. C'è soprattutto un fatto: se L'Italia non accetta il nutri-score ne ha anche un'oggettiva ragione, perché la nostra dieta, patrimonio dell'UNESCO, permette una longevità più alta in Europa, una migliore aspettativa di vita - la Germania, ad esempio, è diciassettesima - e il più basso indice di obesità, che in Francia, un altro Paese che vuole il nutri-score, è aumentato del 145 per cento dagli anni Ottanta ad oggi. C'è da preoccuparsi invece per l'obesità infantile che sta aumentando proprio perché si sta annacquando e inquinando la dieta mediterranea. È proprio questo, la difesa della dieta mediterranea, ciò che facciamo nella nostra Commissione, e ringrazio tutti i membri della Commissione agricoltura, a cominciare dal nostro presidente Vallardi, perché noi difendiamo le oltre 1,5 milioni di aziende che ci permettono il 15 per cento del PIL in Italia, con oltre 500 miliardi di fatturato. Insieme al Governo abbiamo fatto anche abbastanza; qualche risultato l'abbiamo ottenuto: la difesa dell'aceto balsamico, della filiera del latte; abbiamo abbassato le accise sulla birra, istituito un fondo per la peste suina africana, ottenuto un aumento da 105 a 160 per il fondo per le aziende danneggiate dalle avversità atmosferiche. Ancora, cinque milioni per salvare l'apicoltura, 20 milioni più 56 milioni per le eccellenze gastronomiche, 500.000 euro per le piante aromatiche, 25 milioni per la promozione del vino. Abbiamo difeso il Prosecco dal Prošek e l'etichetta del Chianti italiano
2022-02-17	M5S	GirottoGianniPietro	Signor Ministro, i cambiamenti climatici e il degrado ambientale sono ormai una minaccia enorme per l'Europa e per il mondo. Per superare tali sfide, a luglio 2020 la Commissione europea ha presentato il green deal europeo, che trasformerà l'Unione in un'economia moderna, efficiente sotto il profilo delle risorse e competitiva, garantendo che nel 2050 non siano più generate emissioni nette di gas a effetto serra e che la crescita economica sia dissociata dall'uso delle risorse. Gli Stati membri pertanto sono impegnati ad affrontare i bisogni che il cambiamento epocale richiede rispetto ai nuovi stili di vita e ai modelli di consumo dei beni, che comportano necessariamente una trasformazione radicale dei processi con una forte spinta all'innovazione nei sistemi di produzione e di consumo. L'Italia, in risposta a tali sfide, tramite il Comitato nazionale per la transizione ecologica, si è dotata di un Piano per la transizione ecologica (PTE) che coordina le politiche in materia di raccordo con il green new deal europeo e il Piano nazionale di ripresa e resilienza (PNRR). Il PTE individua le azioni, le misure, le fonti di finanziamento e il cronoprogramma, nonché le amministrazioni competenti all'attuazione delle singole misure, articolate in otto ambiti di intervento previsti, per i quali verranno costituiti appositi gruppi di lavoro: decarbonizzazione, mobilità, qualità dell'aria, suolo, dissesto, risorse idriche, infrastrutture, biodiversità, il mare, la promozione dell'economica circolare, della bioeconomia e dell'agricoltura sostenibile. Un ruolo strategico, in coerenza con la pianificazione del PTE, è rivestito dal settore produttivo industriale che, per mantenere la propria competitività, dovrà adeguare i vecchi sistemi produttivi a nuovi modelli, fortemente innovativi e ambientalmente sostenibili. A tal fine, è necessario che lo Stato, attraverso misure e azioni di dettaglio, accompagni in questo passaggio storico il tessuto produttivo, in particolare i cosiddetti settori hard to abate e automotive. Attualmente sono disponibili alcuni strumenti per sostenere interventi strutturali rivolti alla decarbonizzazione e alla riconversione, con risorse disponibili dall'Emission trading scheme (ETS), dal PNRR, dal Piano di transizione 4.0 e dal Fondo per la decarbonizzazione previsto nell'ultima legge di bilancio. Tuttavia, occorre velocizzarne l'applicazione, introducendo e sostenendo con convinzione nuovi strumenti e innovazioni tecnologiche, in particolare dirette a sostenere l'autonomia energetica delle attività produttive, attraverso la creazione di configurazioni, come le comunità energetiche e l'autoconsumo diretto, che permettano di ridurre i costi dell'energia. Le chiedo di sapere come ritenga di sostenere il processo di innovazione in ottica di transizione ecologica e, in particolare, quali misure intenda adottare per accompagnare in tale percorso i differenti comparti industriali, assicurando competitività e sostenibilità ambientale delle imprese. PRESIDENTE. Il ministro dello sviluppo economico, onorevole Giorgetti, ha facoltà di rispondere all'interrogazione testé illustrata, per tre minuti.
2022-02-23	FI	GasparriMaurizio	Lo stesso fece con Gheddafi e - guarda caso - dalla Russia e dalla Libia arriva l'energia italiana. Anche Gheddafi era antipaticissimo e adesso lei quante telefonate deve fare per parlare con la Libia? Era meglio Westminster in Libia al posto di Gheddafi, ma il mondo non è come noi vogliamo, è come è e quindi Berlusconi parlava con Putin, con Bush e con Gheddafi.
2022-02-23	FI	GasparriMaurizio	Ricordo - qualcuno più grande lo ricorderà - le domeniche a piedi degli anni Settanta, e non quelle ecologiche, perché c'era la prima crisi petrolifera; poi ci fu la seconda con la guerra Iran-Iraq. Quindi, quando programmiamo l'indipendenza energetica? No alle trivelle, no a questo, no a quell'altro. È un tema che va affrontato, che non risolve il problema dell'energia domani mattina e delle bollette, per le quali servono i soldi ora e subito del Governo, come Forza Italia ha chiesto. Ma possiamo andare avanti per anni e anni o fino alla prossima tappa della storia con 5 miliardi alla settimana? Il tema energetico va posto perché emerge. Ci può essere una crisi nel mondo e la si deve poter affrontare senza dipendere da altri. Peraltro, rispetto alle sanzioni, state anche attenti: abbiamo perso 10 miliardi di export con le altre sanzioni alla Russia per la Crimea e non li abbiamo mai recuperati. Esportiamo mobili - perfino il tavolone con cui Putin tiene a distanza gli altri statisti è stato realizzato in Lombardia - prodotti agroalimentari e le calzature di Fermo. Quindi, subiamo dei danni. I turisti russi che vengono da noi spenderanno anche in contanti. Diciamolo anche al Governo: i contanti non sono poi così maledetti quando vengono a pagare i nostri camerieri, i nostri albergatori, i nostri marinai.
2022-02-23	LN	CanduraMassimo	L'altra considerazione geografica che vorrei fare è che giustamente parliamo di Ucraina in termini di sovranità violata, di problemi economici e sociali - ci sono profughi, morti e feriti - ma per la Russia il problema è di nuovo securitario. Tutte le invasioni che storicamente il popolo russo ha subito vengono da Ovest. È chiaro che Napoleone e Adolf Hitler non sono sicuramente l'Europa di oggi e non ci rappresentano in alcun modo. Ma, dal punto di vista psicologico, l'appoggio della popolazione russa al presidente Putin - qualcuno l'ha chiamato lo zar - deriva da questo. La sindrome di accerchiamento non è qualcosa di teorico o un capriccio dei giornali, ma è qualcosa di sentito all'interno della popolazione russa. Ed è un fattore importantissimo, se auspichiamo una democratizzazione della Russia. E, quando ci confrontiamo con essa, dobbiamo tenere conto per forza di cose della visione del nostro competitor. Lo facciamo in una relazione di amicizia e lo facciamo anche quando si combatte: si deve conoscere il proprio nemico. Il fatto poi che dall'Asia arrivi il precetto «conosci il tuo nemico», e in Europa Socrate dicesse «conosci te stesso», sottolinea di nuovo la diversità di visione della vita e dell'uomo tra due culture. Parliamo, quindi, in questa visione, anche del manifestarsi delle intenzioni. Il riconoscimento della sovranità e dell'indipendenza di queste due Repubbliche è una violazione della legittima sovranità dell'Ucraina. L'Ucraina non è parte della NATO, ma il 12 giugno del 2020 l'Ucraina è diventata opportunity partner della NATO. Non è un ruolo di partner nel senso di alleato, ma ha lo scopo di garantire l'interoperabilità tra i sistemi militari del Paese partner e del resto dell'Alleanza. Chiaramente, se mi metto dal punto di vista russo come declinato poc'anzi, non posso vedere in questo qualcosa di indirizzato alla pace e alla collaborazione. Mi fa piacere - è un principio sacro - che lei abbia parlato del principio della porta aperta: la NATO è aperta a tutti gli Stati che ne vogliono far parte. È giusto che sia aperta ed è giusto che l'Ucraina, con un Governo democratico, chieda di farne parte. Anche il consiglio NATO-Russia - ricordo il vertice di Pratica di Mare del 2003 - aveva iniziato un percorso che sembrava estremamente promettente, ma non tutti i Paesi del mondo sono d'accordo, anche a Occidente, con questa visione, che io condivido. Qui ci aiuta un inglese che sicuramente lei conosce: è Halford Mackinder, grande padre della geopolitica, che parlava di Heartland, il cuore della Terra, il continente euroasiatico. Chi controlla il continente eurasiatico, che va da Vladivostok alle sponde dell'Atlantico, controlla il mondo. È chiaro che la priorità, per chi non fa parte e non controlla tutto questo continente, diventa opporsi al fatto che questa immensa massa si coalizzi, si coaguli. Di qui la necessità di una Russia nemico e di un Occidente separato dalla Russia. Quello che sto dicendo è che la democratizzazione e l'amicizia devono essere qualcosa che viene da entrambe le parti e non da una sola. Ciò che la Russia sta facendo in Ucraina è assolutamente illegittimo, dal punto di vista del diritto internazionale: ben vengano le sanzioni, che però devono avere un effetto sulla Russia e non sui nostri cittadini. Prima ho sentito parlare qualcuno di sacrifici per l'imprenditoria. Ebbene, guardate che un sacrificio per un imprenditore, italiano come di un altro Paese, non è il sacrificio di un estraneo: l'imprenditore aumenta i prezzi delle merci, licenzia, fallisce. Queste sono le reazioni di fronte a una crisi del genere. Fatto ciò, sono i nostri cittadini a pagare. Di conseguenza, auspico che lo Stato italiano, nel momento in cui le sanzioni verranno declinate, dia una mano a quei settori dell'economia italiana colpiti dagli effetti di tali sanzioni. Sottolineo un secondo elemento, storicamente parlando. Nel 2014 sono state emanate delle sanzioni in particolare nel settore agroalimentare - io sono veneto - che hanno colpito duramente il tessuto economico del Nord-Est del Paese. La Russia in quel periodo importava circa il 32 per cento di foodstuff, dei materiali alimentari, dall'estero. Sapete qual è stata la reazione alle sanzioni? Nel 2021 hanno importato il 12 per cento: li abbiamo aiutati a essere autonomi. Le patate comprate prima in Europa centrale vengono comprate dal Kazakhistan. Non so se quelle sanzioni abbiano avuto l'effetto auspicato; sulla nostra economia sono state disastrose. Al fine di ispirare buona volontà alla Russia e a Putin, ho più di qualche dubbio. C'è una cosa che vorrei sottolineare: la questione dell'energia e del coordinamento dell'Unione europea, signor Ministro. La Francia e la Germania hanno due mix energetici completamente diversi: la Germania sta dismettendo il nucleare e il carbone, affidandosi al gas per la transizione ecologica, così come richiesto dalla tassonomia di recente approvata dall'Unione europea; la Francia invece prosegue sul nucleare. Possiamo ben capire che la strategia energetica e la strategia verso la Russia di questi due Paesi non può essere compatibile e non può esserlo nemmeno con la nostra. Di conseguenza, parlare di una strategia comune dell'Unione europea mi fa un po' sorridere: come può esserci una strategia comune dell'Unione europea anche solo sul piano energetico? Sono d'accordo con lei, signor Ministro: bisogna attrezzarsi per affrontare le crisi non solo dal punto di vista geopolitico, ma anche sul lato della domanda e dell'offerta. Ma, quando abbiamo una capacità di stoccaggio del gas in tutta Europa pari a meno di un quinto del consumo annuale, dove possiamo andare? Non si può assolutamente risolvere questo problema, perché le energie alternative rinnovabili arriveranno tra qualche anno, quando avremo risolto i problemi di accumulazione e trasmissione dell'energia, con la tecnologia. Ma l'energia è come l'aria che respiriamo: non ne abbiamo bisogno fra cinque, dieci o quindici anni, ma ne abbiamo bisogno subito. Quindi non è corretto - a mio avviso - affidarci alle energie rinnovabili di domani per risolvere un problema che oggi può strangolare la nostra economia; e questo semplicemente perché è evidente. Basta vedere quello che sta succedendo in Italia con il caro bollette, che è legato a un andamento dei prezzi dovuto alla crisi geopolitica, e non solo. Sarebbe auspicabile, in ambito europeo, ridiscutere i ritmi della transizione ecologica: il 2035 si avvicina e non come una data di speranza, ma come una minaccia. Mi scuso se mi sono dovuto interrompere per problemi di respirazione. La ringrazio, signor Ministro, e auspico che lei difenda l'Italia.
