2022-03-17	FI	DamianiDario	Servivano, dunque, proprio il rilancio e il sostegno ed ecco perché veniva varato il cosiddetto decreto sostegni- ter; un decreto da oltre 5 miliardi di euro, che poi però si è dimezzato nel momento in cui, una volta varato, la situazione storica, economica e politica, del Paese e del mondo andava cambiando. In quel momento particolare è iniziato il problema dell'aumento dei prezzi. Avevamo già un po' di inflazione, ma era quella classica economica, legata alla ripresa e all'aumento del PIL. Andava, quindi, governata in quel modo. Invece, poi con il nuovo momento geopolitico e con la guerra è cambiato un po' tutto e, dall'inflazione, siamo passati a un caro prezzi: energia, benzina, petrolio, che gli italiani oggi stanno toccando con mano. Come sappiamo tutti, quando si va alla pompa di benzina ci si accorge di quello che - ahimè - sta succedendo e che dobbiamo assolutamente evitare. Nel momento in cui cambiava lo scenario, il Governo ha cominciato a pensare ad altri provvedimenti. Sono state sollevate questioni anche da parte politica, da parte di tutti noi, rispetto al decreto-legge n. 4: pensiamo alla questione del blocco delle cessioni del credito, anche in quel caso una misura molto importante che abbiamo voluto sostenere nella manovra finanziaria, che abbiamo rivisto e fatto in modo che ci fossero delle proroghe. Con il blocco della cessione del credito abbiamo notato che anche quel tipo di attività economica nel nostro Paese si stava bloccando. Quindi, la nostra spinta politica ha portato il Governo a intervenire anche in questo caso con un provvedimento di sblocco. Ecco perché dico che le situazioni sono state molteplici, ma alla fine abbiamo saputo governarle tutti insieme in un certo modo. A quel punto il Governo ha deciso di spostare il decreto-legge sull'energia - da un punto di vista politico, per la sua conversione - alla Camera dei deputati e una parte del nostro decreto-legge sostegni- ter è andato, nell'altro ramo del Parlamento, cosicché noi abbiamo lavorato su ciò che restava. Il decreto-legge è passato da circa 6 miliardi di euro ai 2 miliardi attuali. Sapevamo sin dal primo momento - e ce lo siamo subito detti con il Governo, cercando di compattare la maggioranza in un grande senso di responsabilità - che non c'erano a disposizione risorse aggiuntive per il Parlamento per migliorare il testo attraverso l'attività emendativa. Questo ha creato un minimo di tensione, avendo tante proposte la loro onerosità, che abbiamo superato attraverso un confronto all'interno della maggioranza, e siamo riusciti a portare in porto il decreto-legge. Sappiamo che il Governo sta lavorando anche in queste ore ad altri provvedimenti, come ci è stato annunciato nelle ultime settimane, quando abbiamo avuto modo di avere confronti politici interessanti. La settimana scorsa il capo di Gabinetto del Ministro dell'economia ci ha detto cose importanti, tra cui la possibilità di anticipare di un mese la nuova programmazione economica e finanziaria per fare in modo di arrivare a nuovi decreti cosiddetti fiscali, che servono ad aiutare famiglie e imprese. Aspettiamo l'arrivo di questi provvedimenti che al momento sono più attuali rispetto al decreto-legge sostegni, il quale però - come ho detto - ci ha dato la possibilità di lavorare bene. L'approvazione di circa 100 emendamenti non onerosi è comunque un risultato che come una maggioranza abbiamo condiviso. Nel mio intervento parlerò anche del dibattito che si è tenuto ieri, che ha visto certamente qualche malumore - li ritengo fisiologici - che ha colpito un po' tutti i Gruppi, naturalmente per le difficoltà incontrate. Le risorse erano poche per riuscire a prendere degli impegni, ragion per cui si è lavorato esclusivamente sugli emendamenti non onerosi. Ad ogni modo, ribadisco che l'approvazione di 100 emendamenti non onerosi è un risultato molto importante. Abbiamo condiviso tutti insieme una metodologia di lavoro che ha portato all'approvazione - vorrei darne veramente risalto - di un ordine del giorno vincolante. Ritengo sia molto importante che, nelle prossime misure che il Governo in questo momento sta studiando ed elaborando, possa arrivare immediatamente il nostro ordine del giorno, che abbiamo scritto fino alle ultime ore prima di arrivare qui in Aula, che porta dei contenuti molto attuali, tra cui anche le risultanze degli impegni di Versailles che i Capi di Stato hanno preso, in modo tale da essere per quanto possibile aggiornati. Su questo e sull'ordine del giorno vorrei quindi concentrarmi ora per spiegare il lavoro importante che è stato portato a termine. Con poche risorse a disposizione e tanti emendamenti onerosi, a quel punto potevamo scegliere diverse strade: fare uno spezzatino di tante piccole misure oppure concentrare quelle risorse in alcuni cosiddetti temi comuni. Ogni Gruppo politico ha sottoposto al Governo alcune proposte e siamo poi arrivati, alla fine, a una sintesi politica di come utilizzare le risorse e ci siamo concentrati su alcune misure. Quest'anno abbiamo avuto la fortuna di approvare la manovra finanziaria nella quale abbiamo inserito molti interventi, e alcuni di quelli rimasti fuori abbiamo cercato di recuperare nella parte delle risorse economiche di questo decreto, ossia alcuni di quegli impegni assunti nella manovra finanziaria ma che non hanno trovato spazio in quell'occasione. Bisognava quindi dare compimento a quella parte di misure per il terremoto che non aveva trovato collocazione nel provvedimento della manovra finanziaria. Dunque impegniamo 10,5 milioni di euro proprio per la vicenda dei cosiddetti inagibili del terremoto del 2012 dell'Emilia Romagna, della Lombardia e del Veneto. Da un confronto fra i Gruppi emerge, anche su questo, un'altra parte di interventi che dobbiamo riuscire a inserire nei prossimi decreti, come quelli relativi al problema delle rate dei mutui sui fabbricati resi inagibili dal terremoto. Molti Gruppi pensavano che, nell'ambito delle misure per il sisma, oltre al tema degli inagibili, venisse affrontato anche il discorso delle rate dei mutui, ma non è stato così. Una proposta che facciamo subito al Governo è quindi di prevedere questo tipo di intervento. Dal momento che il decreto è spogliato della parte energia e resta il discorso superbonus, abbiamo ritenuto di concentrarci sugli Ateco e abbiamo deciso di avanzare varie proposte giunte ai Gruppi politici proprio su questo tema. Si sono quindi ampliate le platee e, non potendolo farlo sicuramente ad invarianza economica, perché le risorse sarebbero state veramente irrisorie, abbiamo deciso di intervenire in due fasi differenti. Pensavamo, prima di tutto, di impegnare 10 milioni di euro e invece poi abbiamo deciso di aggiungerne altri 20 e di inserire molte richieste che oggi abbracciano moltissimi settori. Avevamo pensato anche di dare una mano al turismo, che per alcuni aspetti ha avuto la possibilità, anche nell'estate scorsa, di lavorare tranquillamente. Avevamo pensato - anche questo è un ragionamento che abbiamo inserito in tante varianti all'interno dei codici Ateco - di dare un sostegno alle città turistiche - oggi siamo a Roma, la capitale d'Italia, che è la città turistica per eccellenza - che hanno veramente sofferto non soltanto con la pandemia, ma in questo momento anche con la guerra in atto, che rende tutto più difficile e che, quindi, dobbiamo sostenere. Avevamo pensato anche alla questione delle città d'arte e tutto ciò che ad esse ruota intorno ha trovato allocazione all'interno dei codici Ateco. Abbiamo pensato a quel punto all'importanza di dare un segnale politico, che ci univa e andava incontro a imprese e famiglie, riprendendo in mano una questione che aveva visto nel precedente decreto milleproroghe alla Camera fare un altro passetto avanti che dovevamo completare: sto parlando della rottamazione- ter. Con il Governo abbiamo studiato una misura importante, che apre alcune finestre. Detto sinceramente, questa misura è apprezzata da molti e soprattutto ha ottenuto, in maniera trasversale, il consenso dei Gruppi politici dell'intero arco costituzionale. Siamo riusciti a mettere su il provvedimento della rottamazione- ter, con l'apertura di finestre che oggi danno modo di riprendere il percorso di sostegno e di aiuto in un momento di grande difficoltà, in cui le decisioni da prendere in una famiglia e in un'impresa sono veramente particolari. Ci sono da pagare le spese vive, appunto la corrente e l'energia, e ci sono anche le cartelle di un tempo, quelle dovute alla chiusura, alla pandemia e ai due anni precedenti. È un momento difficile e dobbiamo cercare di aiutare su più fronti famiglie e imprese. In questo caso, abbiamo pensato alla rottamazione- ter e abbiamo concesso questo.
2022-03-17	FI	ModenaFiammetta	È lo spirito costruttivo ciò che ho trovato nel nostro relatore Damiani, relatore per Forza Italia, che voglio ringraziare insieme ai componenti della Commissione bilancio. È lo spirito costruttivo che ha mosso tutto il Gruppo sia nella presentazione degli emendamenti che nel coordinamento, nonché nel lavoro di direzione svolto dalla presidente Bernini, con la volontà specifica di essere consapevoli che, seppure si trattava di un provvedimento limitato, anche e soprattutto dal punto di vista delle risorse, su quello bisognava lavorare per affrontare il più possibile le questioni. E si è lavorato sapendo anche che si tratta di un tassello, e non solo perché è un provvedimento datato ma anche perché nel frattempo si sono aggiunti altri due decreti-legge. Ho sentito parlare molto di energia, ma sappiamo benissimo che il provvedimento sull'energia, con le sue risorse, è all'esame della Camera. Noi abbiamo lavorato con le risorse ricavate dai ristori - come ricorderete tutti - che non sono stati utilizzati.
2022-03-17	FdI	CalandriniNicola	Signor Presidente, mi unisco ai relatori di maggioranza nei ringraziamenti per il lavoro svolto in Commissione, che certamente è stato condotto in modo ordinato, seppur molto compresso rispetto ai tempi, per i continui incontri di maggioranza per cercare di trovare in qualche modo un equilibrio complessivo rispetto al maxiemendamento che oggi arriva in Aula. Come dicevo già ieri, quando sono intervenuto come relatore di minoranza, denunciamo però e continuiamo a denunciare pesantemente questa sorta di cambio di passo che c'è stato in questa legislatura e che non ha precedenti ovvero il monocameralismo alternato che di fatto ha modificato la Costituzione, per cui siamo passati da un bicameralismo perfetto ad un bicameralismo imperfetto. Su questo non faremo sconti, perché non è possibile continuare in questa direzione, con questo protagonismo del Governo che è senza precedenti nel Paese. È una situazione effettivamente molto imbarazzante per una democrazia avanzata qual è quella del nostro Paese. Per venire al tema all'ordine del giorno, vorrei dire anche ai relatori che questo decreto è superato, sì, ma non a causa degli eventi legati al conflitto bellico che in qualche modo è alle porte della nostra Europa, perché il problema è anche precedente, in quanto già il 27 gennaio, quando è stato approvato dal Consiglio dei ministri, questo decreto era del tutto insufficiente. Ne ho parlato ieri, sciorinando una serie di numeri riferiti a tutti i settori interessati, che già in quel momento non avevano alcun tipo di risorse aggiuntive per affrontare la situazione drammatica che stavano vivendo a causa della pandemia. Come dicevo, siamo in presenza di un decreto-legge che, invece che sostenere il mondo delle imprese, sta uccidendo molti settori, in particolare quello edilizio, inserendo l'ennesimo correttivo antifrode che penalizza anche le persone oneste, che in quest'ultimo anno hanno operato con onestà rispetto a questa misura. Voglio fare l'esempio di un altro emendamento semplice, senza alcun problema di copertura, che prevedeva lo spostamento almeno di tre mesi della scadenza per le case unifamiliari, dal 30 giugno al 30 settembre, per consentire lo stato avanzamento lavori. Considerando le quattordici modifiche fatte a questo superbonus era il minimo che ci si potesse aspettare. Ebbene, nemmeno su questo emendamento c'è stato il coraggio, da parte del Governo e della maggioranza, di dare una risposta. Su questo non siamo assolutamente disponibili e non siamo ottimisti rispetto ai temi in esame, visto che sul superbonus tutti siamo d'accordo nel dover frenare le truffe, ma non come si voleva fare con questo decreto-legge, perché anche l'Agenzia delle entrate ci ha confermato che le truffe, per questa misura, incidevano solo per il 3 per cento. Questo accanimento, che ha portato a circa quattordici modifiche, appare del tutto inadeguato e ha basi piuttosto fragili. Quindi ci auguriamo che, almeno nella fase finale di questa misura, si consenta di proseguire in modo ordinato, in modo tale che fino al 31 dicembre 2023 si possa consentire alle famiglie e alle imprese italiane di dare risposte rispetto alla spinta economica che può darci questo decreto, per quei numeri che ho dato ieri, quando ho spiegato che cosa rappresenta l'edilizia per il nostro sistema Paese. Siamo in presenza di un decreto-legge che è largamente insufficiente. Lo scoppio della guerra tra Russia e Ucraina lo ha reso del tutto inutile e superato dagli eventi che ci sono stati, ma anche da situazioni precedenti al conflitto che si è generato. Ad esempio, vi è la questione del caro energia, che - lo voglio ricordare - era già presente in legge di bilancio, perché noi abbiamo provato a spostare delle somme, addirittura parte delle somme che prevedevano la riduzione delle tasse, che nessuno ha potuto verificare, perché di quegli otto miliardi previsti per gli scaglioni Irpef nessuno si è accorto. Fermo restando che noi siamo sempre favorevoli quando si parla di riduzione delle tasse, abbiamo detto che andavano creati degli effetti moltiplicatori. Vi sono i 10 miliardi del reddito cittadinanza (lo voglio ricordare, perché quest'anno il Governo dei migliori ci ha messo addirittura un miliardo di euro in più e siamo passati da 9 a 10 miliardi), più gli otto miliardi della riduzione delle tasse. Noi dicevamo di spostarli almeno in parte per creare quell'effetto moltiplicatore sul prodotto interno lordo nazionale a sostegno delle piccole e medie imprese, che rappresentano l'80 per cento delle imprese italiane e sono la spina dorsale del sistema economico del Paese. Al caro energia si è aggiunto anche un ingiustificato caro carburanti. Oggi vediamo che nei Paesi limitrofi, come ha accennato il collega Misiani, come la vicina Slovenia, è stato messo un tetto al prezzo dei carburanti: un litro di benzina costa 1,50 euro, mentre noi siamo arrivati addirittura a quasi 2,50 euro e non si capisce perché non si fanno le stesse cose che fanno i nostri Paesi confinanti.
2022-03-17	FdI	CalandriniNicola	Voglio aggiungere una cosa molto chiara. Questo è il tempo delle decisioni, è il tempo della responsabilità; non è il tempo di inventarsi, come avete fatto nelle scorse settimane, la riforma del catasto (di cui all'articolo 6 della legge delega per la riforma fiscale), che colpisce quanto di più prezioso c'è per gli italiani: la propria casa di abitazione. Come ha detto anche il nostro leader nazionale, mentite sapendo di mentire. Infatti, l'ulteriore prelievo fiscale sulla casa c'è, perché lo dicono le norme che accompagnano l'articolo 6: si vogliono aumentare gli estimi per tassare e colpire particolarmente l'abitazione principale, per compensare le imposte sul lavoro. Questo dice la norma di cui all'articolo 6. Soprattutto state rispolverando lo ius soli, sotto le mentite spoglie della legge sulla cittadinanza. Questi sono gli schiaffi in faccia che gli italiani non vogliono prendere, che soffrono. In questo momento degli immigrati stanno venendo in Europa e in Italia e noi dobbiamo essere consapevoli di dover accogliere a braccia aperte queste persone, che scappano da una vera guerra, che è quella che oggi investe la Russia e l'Ucraina. Noi oggi, in questa sede, dobbiamo assumere le nostre responsabilità, ma serve un intervento diretto dell'Europa, altrimenti non ce la possiamo fare. Voi continuate a dire che non si può parlare di scostamento, addirittura che sia pericoloso farlo, quando, fino a sei mesi fa, avete impegnato 200 miliardi di euro nello scostamento di bilancio, impegnando i nostri figli e i nostri nipoti per i prossimi cinquant'anni; oggi invece dobbiamo stare attenti a parlare di scostamento. Serve però l'intervento dell'Europa. Se non volete parlare di scostamento, parliamo di clausole di salvaguardia: dobbiamo evitare che possa rientrare in campo il patto di stabilità in Italia, perché non ci sono le condizioni. Serve un nuovo recovery plan, da guerra, un recovery bellico. Servono misure mirate nei confronti delle materie prime, delle bollette; servono aiuti mirati anche sul lavoro, per creare quell'effetto moltiplicatore che faccia da spinta per far ripartire l'economia. Non avendo più tempo mi accingo alle conclusioni, Presidente. Noi saremo dalla parte degli italiani e non del Governo Draghi, perché ci ha deluso. Saremo sicuramente dalla parte del popolo italiano, sperando che il presidente Draghi, insieme alla maggioranza, pensi alle imprese, alle famiglie, agli agricoltori. Oggi infatti le famiglie hanno paura di ricevere la bolletta dell'energia elettrica o di andare al distributore a fare un pieno di benzina; è proprio ciò che noi non volevamo, che non serviva a questo Governo. Questo, invece, è ciò che il Governo sta facendo. Quindi noi, per questo e per tanti altri motivi che non ho il tempo di illustrare, non esprimeremo un voto favorevole e ci pronunceremo contro la questione di fiducia posta su questo provvedimento.
2022-03-17	LN	TosatoPaolo	Alla crisi dell'industria, dei settori economici, del settore agricolo, sta seguendo e seguirà purtroppo la crisi sociale, delle famiglie, e non solo delle fasce più vicine alle soglie di povertà, ma anche del ceto medio. Chi oggi si può permettere di vivere dignitosamente con gli aumenti di gas, energia elettrica e carburante, quali fasce della popolazione? Forse per la prima volta possono farlo solo i redditi medio-alti, una minoranza della nostra popolazione. La rateizzazione delle bollette e delle tasse non basta, non serve, rinvia i problemi e non li risolve; rende la salita per uscirne ancora più impervia.
2022-03-17	LN	TosatoPaolo	Il prossimo decreto-legge energia, quello che noi ci aspettiamo venga varato in questo fine settimana, non può essere attendista, timido o parziale; deve essere coraggioso e risolutivo. Sull'aumento dei carburanti la Lega è stata la prima forza politica a chiedere di intervenire sulle accise, sull'IVA, sull'extragettito, ma noi vogliamo un provvedimento efficace: una diminuzione di 15 centesimi non è una risposta adeguata.
2022-03-17	LN	TosatoPaolo	Questa può essere una settimana decisiva. Noi abbiamo grandi aspettative dal decreto energia, ma abbiamo anche grandi aspettative dal decreto che cambierà le regole rispetto al contenimento della pandemia e alle regole che abbiamo fissato per limitare la gravità della situazione. Noi diciamo e chiediamo un basta alle regole che hanno comportato il green pass, il super green pass e l'impossibilità, per i lavoratori ultracinquantenni, di potersi recare sul proprio posto di lavoro. Anche questa è una risposta che il Paese si aspetta. Abbiamo varato provvedimenti in situazioni emergenziali. L'emergenza oggi è minore: dobbiamo prenderne atto e dare nuova libertà al Paese e ai cittadini che pretendono questi risultati. Sosterremo il Governo, ma chiediamo, in definitiva, più rapidità, più consapevolezza, più coraggio e più determinazione.
2022-03-17	M5S	PellegriniMarco	Basta guardare a cosa stanno facendo alcuni hedge fund in merito alle speculazioni folli del prezzo del gas sulla borsa TTF di Amsterdam. Cosa deve ancora succedere affinché il Governo intervenga urgentemente e con forza sulla questione dei prezzi energetici, vista la situazione drammatica in cui versano milioni di italiani? Cosa deve ancora succedere affinché si approvi uno scostamento di bilancio che dia respiro a interi settori produttivi che sono sull'orlo della chiusura a causa dell'aumento del costo dell'energia e di tutto ciò che consegue alla guerra che, purtroppo, c'è in Ucraina? Nel 2020 abbiamo approvato scostamenti per 130 miliardi, in un momento altrettanto drammatico per il Paese e per tutto il mondo. E i risultati ci hanno dato ragione in termini di conservazione dei posti di lavoro, di tenuta sociale, di ripresa del PIL nell'anno successivo, che ha stabilito un record : è arrivato a 6,6 per cento, e voglio rimarcarlo. Esiste un debito buono come un debito cattivo. Quando si fanno politiche espansive intelligenti, come quelle messe in atto dal Governo Conte 2, con il fondamentale impulso del MoVimento 5 Stelle - politiche che creano ricchezza diffusa - si fa un servizio al Paese, ai cittadini, a chi lavora e produce. In questo decreto-legge siamo riusciti a portare a casa la riapertura dei termini per la rottamazione- ter, che tanti auspicavano, ma al contempo riteniamo non più rinviabile una rottamazione- quater delle cartelle esattoriali per gli anni 2018-2020, che - lo sottolineo con forza - non sarebbe un condono, perché i contribuenti pagherebbero le imposte fino all'ultimo centesimo
2022-03-17	PD	BiniCaterina	(ore 10,56) ( Segue BINI, sottosegretario di Stato alla Presidenza del Consiglio dei ministri ).Penso a tutta una serie di tematiche e di questioni fondamentali che, a volte anche a costo zero, consentono comunque di dare respiro ad alcuni settori e a volte invece anche con un costo, perché comunque sugli Ateco e sul sisma abbiamo preso delle misure che, seppure con cifre ridotte, sono riuscite a risolvere alcune questioni. Non è che questo risolva il problema che va crescendo nel Paese, problema sul quale è ora in esame il decreto energia alla Camera e sul quale ci saranno altri provvedimenti da parte del Governo, perché la crisi che si annuncia ed è in corso non sappiamo quando terminerà e soprattutto che forma prenderà. Sappiamo però che il nostro Paese dovrà anche ripensare in qualche misura alle proprie fonti energetiche e dovrà trovare il modo per tamponare le emergenze e le situazioni critiche. A questo ci prepareremo con nuovi interventi normativi e provando, nei prossimi provvedimenti, a fare sempre meglio anche nei rapporti con il Parlamento (saluto appunto il ministro D'Incà, che mi ha appena raggiunta).
2022-03-17	PD	BiniCaterina	Il Consiglio dei ministri ha approvato il decreto-legge sostegni- ter il 28 gennaio; era un'altra era geologica, nonostante siano passati cinquanta giorni: il Covid sembrava ancora presente, ma forse riusciva a rallentare un po'; non c'era la guerra in Ucraina. Oggi, il Covid, che aveva rallentato, sta ricrescendo e nel frattempo c'è una nuova emergenza, perché questa guerra sta creando un problema economico immenso al nostro Paese e all'Europa intera. In questo senso, come molti di voi hanno detto, questo decreto-legge rischia di non essere più attuale, di non essere più aggiornato al tempo che stiamo vivendo. Per questa ragione ci siamo posti un problema e avete fatto bene come maggioranza a presentare l'ordine del giorno, che il Governo ha accolto. Un ordine del giorno completo di tanti temi, dall'energia ai carburanti, alle imprese energivore, dall'autotrasporto agli enti locali, al settore agricolo, al turismo: tutte questioni sulle quali insiste profonda crisi e non poteva essere sufficiente la conversione di questo decreto-legge per provare anche minimamente a risolverle con le risorse minime che il Parlamento aveva a disposizione. Ciononostante, credo che l'esame parlamentare del provvedimento lo abbia notevolmente migliorato, perché siamo riusciti - con emendamenti di spesa, ma anche con proposte ordinamentali - a dare un contributo positivo al Paese. Penso al tema della rottamazione- ter e alla questione della riammissione in termini, ai codici Ateco, al payback per le imprese farmaceutiche, al sisma, ai macchinari salvavita che richiamavo prima, ai segretari comunali e provinciali come anche alla proroga dei bilanci delle Regioni. Penso al bonus terme, alla cessione del credito.
