2022-04-21	M5S	LanziGabriele	Signor Presidente, ci troviamo oggi a votare il cosiddetto decreto bollette, con il quale è stato introdotto un primo pacchetto di misure volte a contenere lo straordinario aumento dei costi dell'energia elettrica e del gas naturale. Il fenomeno ha generato una vera e propria emergenza che sta colpendo indistintamente tutti, famiglie e imprese. La posizione mia e del MoVimento 5 Stelle non può che essere favorevole, quando si parla di misure di sostegno ai cittadini e al tessuto produttivo. Siamo stati i primi a chiedere al Governo di intervenire con misure straordinarie, ricorrendo finanche a un nuovo scostamento di bilancio.
2022-04-21	M5S	SantilloAgostino	Non esiste altro modo! A chiederci l'intervento sulle fonti rinnovabili di energia è proprio quel 15 per cento di cittadini che, nel primo bimestre, non ha avuto i soldi per pagare le bollette dell'energia elettrica. C'è povertà energetica del nostro Paese: il 15 per cento degli italiani, già prima della pandemia e della guerra, viveva in povertà energetica e questi numeri sono drammaticamente destinati ad aumentare. Se non interveniamo sulle fonti energetiche, quella gente non saprà come pagare bollette ancora più salate e ancora più costose. Basta dare un'occhiata al bilancio energetico nazionale per capire a che punto siamo con lo sviluppo delle fonti rinnovabili in Italia. Oggi, il nostro approvvigionamento da fonti rinnovabili avviene per il 20 per cento, mentre la fa sempre da padrone l'utilizzo di petrolio e di metano, che va ben oltre il 33-35 per cento.
2022-04-21	M5S	SantilloAgostino	È vero che, parlando del contenimento dei costi dell'energia, va bene intervenire, come prevede il decreto-legge al nostro esame, con l'annullamento degli oneri generali di sistema per le utenze elettriche o, ancora, riducendo le aliquote dell'IVA sulle forniture di gas metano. Quindi, alleviare il costo per i cittadini italiani e per le imprese funziona, ma sappiamo molto bene che non può bastare, perché va in primo luogo rimarcato che un contenimento dei costi si può avere soltanto se abbiamo un risparmio concreto nell'utilizzo delle fonti energetiche: occorre quindi consumare di meno. In secondo luogo, dobbiamo far sì che il nostro Paese non dipenda più energeticamente da altri Paesi e tutto questo si può ottenere soltanto in un modo, onorevoli colleghi, ovvero con l'utilizzo delle fonti rinnovabili di energia.
2022-04-21	PD	CominciniEugenio	Infine (ma non da ultimo), non bisogna dimenticare che il gas, come ogni commodity, è scambiabile sui mercati finanziari attraverso strumenti come futures e derivati, il che genera quotidianamente un prezzo finanziario disancorato dallo scambio materiale di energia. Il gas si quota come le azioni di una società, che salgono e scendono secondo logiche diverse da quelle industriali, e può raggiungere, come appunto si è verificato, picchi molto rilevanti, disancorati dalle quantità prodotte e scambiate. Il Governo è dunque intervenuto con determinazione nel tentativo di ridurre i pesanti effetti critici degli aumenti del costo del gas, mentre ancora poco in Europa si è potuto fare per fronteggiare la speculazione finanziaria cui ho accennato. Su questo sarà importante che sia l'Europa stessa a poter prendere decisioni, che possano limitare la fluttuazione così forte che il prezzo del gas ha avuto. Il testo del decreto-legge emanato dal Governo, poi modificato dalla Camera dei deputati nell' iter di conversione in legge e che oggi discutiamo contiene misure importanti, alcune delle quali hanno già visto dei seguiti nel decreto-legge taglia prezzi, ora in discussione nelle Commissioni 6ᵃ e 10ᵃ del Senato. Il decreto-legge dispone l'azzeramento di oneri di sistema elettrici e del gas per il secondo semestre del 2022 e conferma il taglio dell'IVA sul gas. C'è la novità della rendicontazione da parte di ARERA sulle risorse stanziate per il taglio degli oneri generali delle bollette; la rendicontazione dovrà riguardare in particolare le disponibilità in conto residui trasferite alla cassa per i servizi energetici ed ambientali e distinguendo tra comparto elettrico e settore del gas. La rendicontazione dovrà essere trasmessa da ARERA al Ministero della transizione ecologica, al Ministero dell'economia e delle finanze e alle Commissioni parlamentari entro il 16 maggio. La norma prevede inoltre una rendicontazione a decorrere dal 1° giugno 2022 ed entro trenta giorni dalla data di entrata in vigore di ulteriori misure di contenimento degli effetti degli aumenti dei prezzi e un'altra con cadenza annuale. Il Ministero della transizione ecologica dovrà poi predisporre la strategia nazionale contro la povertà energetica; la strategia dovrà prevedere la fissazione di obiettivi indicativi periodici al fine di elaborare a livello nazionale misure strutturali e di lungo periodo ed integrare tutte le azioni in corso a quelle programmate nelle diverse politiche pubbliche per contrastare in modo omogeneo ed efficace il fenomeno. Il decreto riconosce alle imprese energivore che hanno subito un significativo incremento del relativo costo un contributo straordinario sotto forma di credito d'imposta pari al 20 per cento delle spese sostenute per la componente energetica acquistata ed effettivamente utilizzata nel secondo trimestre del 2022. Il bonus è riconosciuto anche in relazione alla spesa per l'energia elettrica prodotta e autoconsumata dalle imprese energivore nel secondo trimestre del 2022. È una prima importante misura, ci sono dei seguiti nel cosiddetto decreto taglia prezzi che citavo prima e la discussione che faremo qui in Senato su quel provvedimento potrà apportare ulteriori riconoscimenti. Una misura analoga riguarda anche le imprese a forte consumo di gas naturale, cui va un contributo straordinario sotto forma di credito di imposta pari al 15 per cento della spesa sostenuta per l'acquisto del gas consumato nel primo trimestre solare dell'anno 2022 per usi energetici diversi dagli usi termoelettrici. È stato poi dato via libera ad una ridefinizione importante del mercato elettrico, con la possibilità per il Gestore dei servizi energetici (GSE) di ritirare e acquistare energia da fonti rinnovabili mediante la stipula di contratti di lungo termine di durata pari almeno a tre anni. L'energia acquistata dal GSE sarebbe poi ceduta ad un prezzo fissato da un decreto ministeriale del Ministero della transizione ecologica in via prioritaria a grandi aziende, piccole e medie imprese e a clienti delle isole maggiori. Sempre sul fronte delle energie da fonti rinnovabili, il decreto prevede misure per lo sviluppo di tali fonti e per il contenimento dei prezzi energetici. Si interviene sulla disciplina relativa ai criteri in base ai quali un cliente finale diviene autoconsumatore di energia rinnovabile. In particolare viene introdotta un'ulteriore ipotesi relativa alla produzione e all'accumulo di energia elettrica rinnovabile per il proprio consumo da realizzare con impianti da fonti di energia rinnovabile ubicati presso edifici o in siti diversi da quelli presso i quali l'autoconsumatore opera, escludendo l'allacciamento di utenze diverse da quella dell'unità di produzione e dell'unità di consumo. Si eleva poi da tre a quattro il numero di cessioni effettuabili con riferimento ai crediti di imposta. In particolare viene prevista la facoltà di un'ultima cessione da parte delle sole banche a favore dei soggetti con i quali abbiano concluso un contratto di conto corrente. Le norme si applicano alle comunicazioni della prima cessione del credito e dello sconto in fattura inviate all'Agenzia delle entrate a partire dal 1° maggio 2022. Il decreto interviene su molti altri fronti, ho citato solo i passaggi più importanti. Le difficoltà pesantissime a cui il decreto pone un primo rimedio - non dobbiamo nascondercelo - sono frutto di tensioni internazionali sulle quali il nostro Paese ha preso posizioni chiare e rispetto alle quali credo che tutte le forze politiche non dovrebbero più avere alcun tipo di tentennamento ed essere determinate nel sostenere e riconoscere questa azione in maniera chiara. Tali tensioni internazionali stanno comportando l'impoverimento di famiglie e imprese non soltanto nel nostro Paese. Non possiamo permetterci che le tensioni geopolitiche internazionali e gli effetti economici provochino la sfiducia dei cittadini nelle istituzioni democratiche. Lunedì festeggeremo il 77° anniversario della Liberazione dal nazifascismo, un fatto storico che sta alla base della nostra stessa convivenza civile repubblicana, ma anche un'esperienza che rievoca fatiche e drammi. La storia ci insegna che non possiamo arretrare sulla difesa dei principi e sul mantenimento del sostegno a chi ha più bisogno. Il Governo e la maggioranza proseguano il loro impegno per sostenere il Paese in questo momento complicato: nessuno si deve sentire solo in questa difficile fase. È il nostro impegno e lo porteremo avanti con determinazione.
2022-04-21	PD	CominciniEugenio	Signor Presidente, il testo del decreto-legge da convertire in legge che ci apprestiamo a votare contiene misure urgenti per il contenimento dei costi dell'energia elettrica e del gas naturale, per lo sviluppo delle energie rinnovabili e per il rilancio delle politiche industriali. Esso è frutto di un primo intervento del Governo, datato 1° marzo scorso, teso a limitare i rincari delle bollette conseguenti agli ingenti aumenti del gas.
2022-04-21	PD	FerrazziAndrea	Leggo testualmente le conclusioni della comunicazione RePower EU: «Gli sviluppi osservati negli ultimi mesi sui mercati dell'energia» quindi si riferisce anche alla crisi ucraina «, in particolare il cambiamento drastico verificatasi nelle ultime settimane sul versante della sicurezza, impongono un'accelerazione netta della transizione verso l'energia pulita così da aumentare l'indipendenza energetica dell'Europa». L'Europa non ha materie proprie; ormai le fonti sono quasi tutte esaurite, c'è qualcosa nel Mare del Nord, fondamentalmente di proprietà della Norvegia, che non fa parte dell'Unione europea e che in pochi mesi ha avuto un vantaggio di 150 miliardi a fronte di 5 milioni di abitanti. Vogliamo continuare con queste politiche o vogliamo parlare di politiche di riequilibrio, di transizione, di giustizia sociale, di abbattimento dei costi, di abbattimento delle emissioni, di sicurezza energetica, che vuol dire sicurezza geopolitica per uscire dai ricatti? È giusto, infatti, uscire dal ricatto di Putin, ma non possiamo metterci strutturalmente e nel tempo nelle mani dei ricatti di Paesi come l'Angola, il Congo, l'Algeria e poi vediamo chi
2022-04-21	PD	FerrazziAndrea	Signor Presidente, colleghe e colleghi, la situazione attuale meritava un decreto di questo tipo, molto impattante e molto importante. Il nostro Paese, attraverso l'azione del Governo, nel 2021 era riuscito a compiere un'opera eccezionale, con una crescita del prodotto interno lordo superiore al 6 per cento, una delle migliori performance a livello occidentale, e certamente la crisi ucraina, con tutti i suoi - chiamiamoli così - derivati, ha posto un momento di inciampo rispetto a questa crescita, che dunque deve essere affrontato politicamente con grandissima decisione. E questo decreto interviene prontamente, con risolutezza e con decisioni anche molto radicali. Signor Presidente, non voglio entrare nella discussione dei 43 articoli che costituiscono il decreto nella sua interezza, che sono già stati esaminati anche nel dibattito di questa mattina. Voglio piuttosto fare una riflessione sull'impostazione generale, sulla filosofia di fondo e, soprattutto, sulla prospettiva che dobbiamo costruire anche attraverso questo decreto. Certamente il primo passo è prendere atto del fatto che ci sono innumerevoli imprese e milioni di famiglie del nostro Paese che stanno subendo le conseguenze devastanti dello scellerato attacco all'Ucraina da parte di Putin, una responsabilità politica assoluta che ha delle conseguenze in tutto l'Occidente, anzi, in tutto il mondo, per cui giustamente a livello generale - in particolare da parte delle singole Nazioni - si sta cercando di intervenire. Questo decreto fa proprie dunque una serie di opzioni fondamentali per aiutare i cittadini e le famiglie e per sostenere le imprese in maniera trasversale, perché l'aumento dei costi del gas e dell'energia in generale è tanto sconsiderato quanto, per certi versi, imprevisto. Parliamoci chiaro: l'aumento dei prezzi dell'energia non è collegato solamente alla crisi ucraina; si era determinato già precedentemente, negli ultimi mesi del 2021. Non c'è alcun dubbio che sono intervenuti elementi fortemente speculativi. Le imprese che lavorano con il gas, con il petrolio, diciamo generalmente con le commodity fossili anche per la produzione dell'energia elettrica - e sappiamo che il nostro Paese produce quasi più del 40 per cento dell'energia elettrica bruciando queste commodity - in Italia, dove sono pochissime, hanno avuto un extra -reddito, un extra -utile di 40 miliardi di euro negli ultimi cinque mesi. A livello europeo è stata fatta una stima che ammonterebbe ad almeno 200 miliardi di euro, per cui è assolutamente corretto redistribuire questi utili che, come abbiamo già detto, non nascono da una capacità gestionale dell'impresa stessa, ma da elementi speculativi che nella quasi totalità dei casi sono certamente esogeni rispetto a queste imprese, ma dei cui benefici le imprese godono. È corretta dunque, come dicevo, una redistribuzione. L'Autorità di regolazione per energia reti e ambiente (ARERA) aveva proposto un contributo del 40 per cento; noi stiamo operando in quella direzione. Voglio ricordare che il Partito Democratico è stato il primo dell'arco costituzionale a presentare un emendamento in questa direzione nel decreto sostegni- ter. Il Governo ci ha chiesto di ritirarlo, dicendo che avrebbe inserito il contenuto di quella proposta in un altro provvedimento e lo ha fatto in questo decreto. È un primo passo un contributo del 10 per cento. Il totale dell'ultimo decreto Ucraina 2, chiamiamolo così, che stiamo discutendo in Commissione, viene finanziato, per esempio, esattamente in questo modo. È in questa direzione che dobbiamo procedere, chiedendo cioè un contributo a tutte le imprese che hanno avuto extra -utile e distribuendolo alle famiglie e alle imprese che stanno pagando un prezzo sconsiderato. Tuttavia, signor Presidente, colleghi e colleghi, dobbiamo guardare anche oltre il contingente, aiutando chi è in difficoltà, ma costruendo anche una prospettiva di crescita. È di ogni evidenza che l'elemento centrale è la costituzione finalmente di un'autonomia energetica del nostro Paese, che si realizza essenzialmente all'interno di politiche integrate a livello europeo. Non può esserci alcun Paese che riesce a reggere da solo l'urto di un mercato internazionale sul prezzo del gas, delle materie prime e via dicendo. La spinta del nostro Governo e del Parlamento verso l'integrazione è dunque assolutamente fondamentale. Invito tutti a leggere l'ultima comunicazione sull'energia della Commissione europea al Parlamento europeo, al Consiglio europeo, scritta e inviata l'8 marzo (poco più di un mese fa) e intitolata RePower EU, che sarà la piattaforma fondamentale per tutte le operazioni in campo energetico che l'Europa si accinge a fare nel corso prossimi anni. La filosofia di fondo di quell'intervento è esattamente quella ripresa nel decreto-legge in esame. Vorrei essere chiaro, perché c'è chi sembrava quasi felice della crisi energetica: ricordo infatti alcuni interventi anche all'interno di quest'Aula di qualche settimana fa, dicendo che era ora di mettere al bando la rigenerazione, di superare tutta la questione del green, non capendo che invece va fatto esattamente l'opposto.
2022-04-26	FdI	LaPietraPatrizioGiacomo	Signor Presidente, onorevole Sottosegretario, colleghi senatori, è innegabile che stiamo vivendo un momento particolarmente complesso, che per molteplici cause impatta in maniera negativa sul sistema agricolo e non solo. Un conflitto è in atto sul territorio europeo fra Ucraina e Russia; una situazione economica, già di per sé drammatica a causa della pandemia, negli ultimi anni ci ha colpito in maniera drammatica sul piano sanitario, con conseguenze negative anche sul settore produttivo; il cambiamento climatico provoca eventi sempre più estremi. In questo contesto si innestano regole, leggi e direttive fatte in momenti diversi, in momenti in cui la normalità - se così vogliamo chiamarla - poteva permettere di fare scelte che oggi purtroppo dobbiamo avere il coraggio - e, aggiungo, la saggezza - di cambiare per non peggiorare ancora di più la situazione. L'atto in discussione va in questa direzione. Fondamentalmente chiediamo al Governo di rimandare di due anni l'entrata in vigore delle regole di attuazione del deflusso ecologico dei corsi d'acqua, in sostituzione del deflusso minimo vitale, che - lo voglio sottolineare - comunque rimane in vigore. Non ripercorro la storia amministrativa delle varie disposizioni, mi limito soltanto a segnalare come in questo contesto sia indispensabile tale atto per non precludere ulteriormente il prelievo di acqua. Occorre dare delle priorità e avere responsabilità. Sia ben chiaro che abbiamo a cuore l'ambiente e l'ecosistema dei corsi d'acqua, tant'è che le regole del deflusso minimo vitale ci sono e restano, ma oggi dobbiamo fare i conti con una situazione mutata. Occorre quindi capire i motivi di questa richiesta e di questo atto. Abbiamo detto come la concomitanza di alcune situazioni stia creando una tempesta perfetta per la gestione del sistema idrico nazionale. La pandemia ha creato non pochi problemi, bloccando per due anni la maggior parte degli interventi ordinari e straordinari. A causa delle norme sanitarie molti uffici sono stati chiusi o con personale ridotto; progettualità sospese; tutto rallentato per concentrarsi giustamente sull'emergenza sanitaria. Però adesso dobbiamo recuperare il tempo perduto. L'aggressione russa all'Ucraina ha provocato un aumento esponenziale dei costi dell'energia e delle materie prime. Le sanzioni hanno provocato un impatto negativo anche sulle nostre aziende, a cui dobbiamo cercare di dare risposte concrete. Oggi l'Europa si accorge che non esiste una sovranità alimentare. L'Italia si accorge di quanto sia dipendente dalle importazioni, quindi si è deciso giustamente di aumentare gli ettari coltivati e per questo occorre conseguentemente più acqua. I cambiamenti climatici ormai sono caratterizzati da eventi straordinari e improvvisi, a volte con eccesso di precipitazioni, a volte con periodi di siccità prolungata, come quello che stiamo vivendo adesso, con mesi di siccità e un periodo invernale che ha visto poco innevamento e che, stanti le previsioni, continuerà con un'estate con precipitazioni scarse, aggravando ancora di più la situazione. In tutto questo si innesta l'entrata in vigore del deflusso ecologico: un'ulteriore criticità normativa che al momento va rimandata. In Commissione abbiamo capito le conseguenze dell'entrata in vigore di questo principio e dopo aver audito, in poco più di due mesi, molti soggetti, abbiamo redatto questo documento da sottoporre al parere dell'Assemblea per impegnare il Governo in alcune azioni da attuare per approfondire l'impatto dell'entrata in vigore delle regole del deflusso ecologico, ma sostanzialmente a prorogare di due anni dall'entrata in vigore di queste regole e a fare ulteriori approfondimenti in merito, anche in prospettiva delle problematiche sopra descritte, in modo da rendere il tutto più sostenibile. Certo, la gestione delle risorse idriche, che investono comparti differenti fra loro - dall'irrigazione agricola all'uso civile, dall'uso artigianale-industriale alla produzione di energia elettrica (ricordo che negli ultimi mesi la produzione di energia idroelettrica è calata del 50 per cento a causa della siccità in atto) e, non ultima, la salvaguardia dell'ambiente - non può basarsi solo sulla problematica dell'oggetto di questo documento, ma dovrebbe avere un più ampio spettro di azione, con una cabina di regia che possa meglio coordinare tutti gli attori coinvolti nella gestione delle risorse idriche: dalle Regioni alle autorità di bacino, dagli ambiti territoriali ai Comuni, dalle società titolari delle reti ai consorzi. Presidente, mi permetta di fare una riflessione che riguarda in particolare i lavori parlamentari e la gestione degli stessi da parte del Governo, poco attento - uso un eufemismo - non solo alle proposte dell'opposizione, ma ai lavori delle stesse Commissioni. Ad ottobre 2020, in Commissione agricoltura, abbiamo approvato all'unanimità, se non vado errato, la relazione sull'affare assegnato relativo alle problematiche concernenti i consorzi di bonifica ed irrigazione e colgo l'occasione per ringraziare il relatore di allora, senatore Trentacoste, del lavoro fatto. In quella relazione si impegnava il Governo su diversi punti e cito i più rilevanti: il rilancio del ruolo strategico dei consorzi di bonifica e irrigazione nella gestione e nella difesa del territorio e delle sue risorse nel contrasto al rischio idrogeologico e nel supporto all'agricoltura nazionale; una revisione e un rafforzamento del modello di governo dei consorzi che consolidi il ruolo dell'agricoltore e dei beneficiari diretti delle attività consortili; l'emanazione di provvedimenti volti al potenziamento del Piano nazionale invasi, al fine di completare i lavori di esecuzione delle opere già parzialmente realizzate; predisporre lo studio di un piano di dragaggio degli invasi e di cura dei corsi d'acqua che consenta di recuperare il volume di raccolta idrica. Tutte azioni che, se messe in campo, oggi ci avrebbero permesso di affrontare il problema idrico sicuramente con maggiore tranquillità. Tutto questo non è stato possibile farlo, quella relazione non è arrivata in Aula e quindi non abbiamo potuto dare questi indirizzi che sarebbero stati fondamentali oggi per risolvere il problema della questione idrica. Parimenti - per fare un ulteriore accenno - se si fosse portato in Aula l'affare assegnato sui danni all'agricoltura, approvato in Commissione, forse l'emergenza sulla PSA si sarebbe potuta affrontare in maniera differente. Presidente, la politica - lo dico al rappresentante del Governo - deve anche prevenire e non può affrontare solo le emergenze quando le stesse possono essere invece previste. Dico ciò anche per stigmatizzare come questa maggioranza eterogenea rinuncia a discutere provvedimenti non solo di buonsenso, ma anche necessari, pur di garantire il precario equilibrio fra le varie forze politiche che la compongono. Noi di Fratelli d'Italia, come sempre, diamo il nostro contributo e garantiamo il nostro appoggio a tutti quei provvedimenti che riteniamo utili e necessari per la Nazione. Per tutti questi motivi, annuncio, come già espresso in Commissione, il voto favorevole del Gruppo Fratelli d'Italia.
