2022-06-30	FI	GiammancoGabriella	Argomento di dibattito è e sarà nelle prossime settimane il prezzo del gas, per l'impatto che ha e che continuerà ad avere sulle bollette e sui bilanci delle nostre aziende, che sono sempre più in difficoltà. A ciò si aggiunge ovviamente il caro carburante, che complica le cose ulteriormente. Serve quindi uno scatto dell'Europa e Forza Italia proseguirà la sua battaglia con grande determinazione per limitare l'indiscriminato amento del prezzo di queste materie prime, dell'energia, del gas e del carburante.
2022-06-30	FI	GiammancoGabriella	Signor Presidente, onorevoli colleghi, la legge di delegazione europea, come ogni anno, affronta diverse tematiche, allo scopo di recepire la legislazione europea, ma nel contesto storico in cui ci troviamo assume senz'altro un particolare valore, perché è anticamera dell'Europa del futuro. L'Europa è stata infatti costretta dalla pandemia prima e oggi dalla guerra a cambiare finalmente volto, a mostrare un maggiore spirito solidaristico e ad essere più madre che matrigna. Nessun Paese membro ipotizza più di uscire dall'area euro, l'antieuropeismo è diventato minoritario e ha lasciato il posto a un approccio di critica costruttiva nei confronti di ciò su cui ancora c'è da lavorare. Nell'ultimo Consiglio europeo poi è successo qualcosa di molto significativo: l'Ucraina e la Moldavia hanno acquisito lo status di Paesi candidati all'ingresso nell'Unione europea: un'ottima notizia, considerato che lo spirito d'inclusione dell'Unione europea è la migliore risposta all'espansionismo russo. Non dobbiamo dimenticare però i Balcani occidentali, dove da tempo la Macedonia del Nord e l'Albania aspettano di aprire i negoziati per l'adesione ed è nostro interesse strategico rispettare l'impegno per una loro adesione rapida all'Unione. Il Consiglio europeo ha anche rinnovato alla Commissione l'invito ad esplorare con urgenza modalità per ridurre i prezzi dell'energia. Il tema è diventato vitale per il nostro Paese e per l'Europa tutta. Non può esserci più spazio per i partiti del no a tutto e neppure per una distopica decrescita felice.
2022-07-05	FI	CraxiStefaniaGabriellaAnastasia	Signor Presidente, onorevoli colleghi, il dramma che da mesi si consuma sul limes europeo ci ha portato a guardare alla dimensione internazionale con rinnovata attenzione. Alzare lo sguardo al di là dei confini nazionali, farsi portatori di iniziative di cambiamento, tanto nella realtà europea che sullo scacchiere internazionale, non è un'opzione; è, con tutta evidenza, una necessità inderogabile poiché scelte o mancate scelte, inazione o timori in politica estera ricadono sul destino dell'Italia. Il rilancio della dimensione franco-italiana intesa come cooperazione rafforzata risponde innanzitutto a questa logica, alla necessità di sviluppare intense relazioni, utili per incidere nei nuovi scenari, tutelare i nostri interessi e contestualmente promuovere il nostro tessuto economico, spesso penalizzato dalla mancanza di processi di dialogo istituzionale in grado di tutelare e sostenere i nostri campioni nazionali al pari della nostra piccola e media imprenditoria. Non sfugge a nessuno, tantomeno in quest'Aula, il profondo legame tra Italia e Francia; un legame che, per svariate ragioni, travalica la politica e interessa diversi ambiti. È un rapporto che negli ultimi lustri - dobbiamo dirlo senza ipocrisia - è stato segnato da momenti di tensione, caratterizzato da grandi diffidenze e connotato da tratti asimmetrici dal punto di vista degli interessi e delle opportunità. Tutto ciò non è stato foriero di successi per nessuno, men che meno per il nostro Paese. Basti guardare allo scenario internazionale, al Mediterraneo, dove lo scontro tra Italia e Francia che è già stato richiamato (pensiamo alla Libia) ha schiuso le porte della regione al protagonismo di attori terzi, dalla Russia alla Turchia, passando per la Cina; oppure, spostando lo sguardo, pensiamo alle resistenze francesi sulla vicenda Fincantieri STX, che hanno impedito di creare un campione mondiale della cantieristica navale. È evidente che la scarsa capacità di dialogo, la mancanza di una relazione priva di un'effettiva dimensione bilaterale franco-italiana abbia pesato, e molto, in queste e in molte altre situazioni; ha rappresentato un fattore penalizzante che nell'interesse reciproco, nell'interesse dell'Italia, andava affrontato e rimosso. Tanto più è necessario farlo ora, in uno scenario globale profondamente mutato, segnato da venti di guerra che ridefiniscono ogni paradigma e ci chiamano, come Stati nazione e come Europa, a una prova di maturità. Pertanto, creare una cornice strutturale di dialogo e di confronto, ancor prima che di cooperazione, tra Italia e Francia, non è solo utile, ma è necessario. Il cosiddetto Trattato del Quirinale è quindi un punto di partenza per dare corso a una nuova stagione di rapporti tra Roma e Parigi. Esso definisce, per l'appunto, una cornice di dialogo e di possibili iniziative nei diversi ambiti previsti nei 12 articoli del testo. Sarà quindi la volontà di una sua piena applicazione e la qualità delle azioni concrete a determinare la sua capacità di incidere. Dobbiamo tutti essere consapevoli, però, che il trattato non produrrà un allineamento strategico e permanente tra Italia e Francia. Attraverso la creazione di canali tradizionali stabili, però, possiamo prevenire e gestire i conflitti, così come attraverso una fitta rete di interazioni formali a molteplici livelli e tra diverse agenzie, compreso un vertice intergovernativo annuale, una serie di forum ministeriali di consultazione permanente e programmi congiunti di formazione e di scambio, possiamo definire posizioni e azioni comuni. Il Trattato immagina quindi lo sviluppo di relazioni a ogni livello, anche nell'ambito della diplomazia parlamentare, e prevede una cooperazione rafforzata in materia di affari esteri e comunitari sulle questioni della sicurezza e della difesa, fino a una cooperazione economica, industriale, digitale e spaziale. A mio avviso, proprio sulla materia estera, nell'area del mare nostrum, il trattato può dare buoni frutti, se irrobustito e coltivato sapientemente dalle parti, anche alla luce del fatto che lo scorso febbraio la Commissione europea ha avviato la definizione di una sua agenda mediterranea. Premesso che da tempo, come Forza Italia, andiamo ripetendo che un Paese come l'Italia dovrebbe stilare un documento strategico nazionale unico, che racchiuda un disegno complessivo della nostra azione sul piano internazionale, è del tutto evidente che la complessità delle situazioni, tanto sul piano globale che sul Mediterraneo, necessiti di azioni coordinate plurali, che vanno sviluppate in rapporto e in sinergia con altri partner. È soprattutto su questo fronte che Italia e Francia hanno quindi, a mio avviso, la necessità di incontrarsi. Esse devono interagire e, diversamente dal passato, devono avere un orizzonte comune. Infatti, già prima della guerra in Ucraina, il ritiro americano dall'area del Mediterraneo allargato, con il contestuale acuirsi del confronto nell'Indo-Pacifico, aveva posto i Paesi europei, in primis Italia e Francia, dinanzi all'esigenza di occuparsi in modo strutturato della sicurezza e dello sviluppo di quest'area. Questo vale ancor più ora, visto che il Mediterraneo sarà uno dei teatri dei nuovi confronti globali. Una cooperazione strutturata e bilanciata tra Roma e Parigi è pertanto utile ad affrontare problemi che, in un contesto di forte interdipendenza, non possiamo risolvere da soli. Ad esempio, con l'invasione da parte della Russia dell'Ucraina è stato evidente che stabilizzare la regione mediterranea offre all'Italia l'occasione di diversificare, senza sorprese, l'approvvigionamento delle fonti combustibili: questione strategica e di vitale importanza. Il contesto interno europeo è poi segnato da dinamiche favorevoli alla realizzazione in concreto di quanto è negli intenti del Trattato del Quirinale. Insieme possiamo lavorare per influenzare l'agenda comunitaria su alcune issues, quali l'ambiente, l'energia e la difesa comune, che, dev'essere chiaro, è da sviluppare come strumento integrato alla NATO. Il Trattato offre la cornice per dare vita a un asse sulle questioni comunitarie, per affrontare il tema ineludibile e vitale di una riforma strutturale e radicale, quanto profonda, dell'Unione europea: dai temi della governance politica alle questioni economiche e monetarie, serve un reset, un nuovo corso. Serve l'Europa che non c'è e di cui avremmo bisogno. Certo, non bisogna farsi illusione, cedere alla retorica e pensare che il Trattato del Quirinale possa da solo fare da contraltare e sostituire la relationship franco-tedesca o, peggio, credere che questo possa creare un diverso baricentro della politica europea. Non è questo il senso e non è questo l'obiettivo. Ovviamente il dialogo tra Roma e Parigi, come abbiamo visto, sarà fondamentale per tracciare il futuro dell'Europa, ma il Trattato va inteso come uno sviluppo proficuo, soprattutto coordinato e - voglio sottolinearlo - bilanciato dei rapporti con la Francia, in un quadro di collaborazione diffusa. Inoltre, consentitemi di rimarcare l'importanza dell'avvio di una cooperazione franco-italiana nel settore agricolo e agroalimentare per un'azione congiunta che porti alla tutela a tutti i livelli delle denominazioni di origine e delle indicazioni geografiche registrate nell'Unione europea e per la protezione e valorizzazione del patrimonio culturale. Infine, reputo doverosa una riflessione su alcune riserve che sono emerse in questi mesi e che si sono appalesate sia in fase di approvazione del testo da parte della Camera sia in parte in questo dibattito. A dirla con parole chiare, certo che pretendiamo che chi si è macchiato di delitti nel nostro Paese debba scontare in Italia la sua pena.
2022-07-05	M5S	LoreficePietro	Continuo con il mio intervento. Un riferimento è stato fatto dalla collega De Petris, ma anche dalla collega Garavini, alla vicenda legata ai gilet gialli. Posso dire che alla fine il Ministro degli affari esteri attuale ha potuto mettere in campo un cosiddetto ravvedimento operoso firmando il Trattato. Pertanto quel passaggio va stigmatizzato e va consegnato alla storia, però ognuno di noi evolve, cambia anche le posizioni e questa può essere l'occasione per trattare anche questa questione. Il collega Candiani ha richiamato gli importanti rapporti con i "cugini" transalpini - la cooperazione tra noi e la Francia è importante su tanti asset di rilievo strategico, dall'aerospaziale al navale - ma ha anche fatto un riferimento chiaro alle interazioni e ai piani strategici riferiti al comparto energia, altro tema importantissimo e quanto mai attuale. Ha fatto un positivo richiamo alle rinnovabili, anche se nell'ordine del giorno G102 (testo 3) c'è un riferimento generico alla ricerca. Noi del MoVimento 5 Stelle chiaramente siamo a favore della ricerca scientifica, però si è tirato in ballo il nucleare di ultima generazione con riferimento chiaro alla fissione e a impianti che richiedono decine di anni (trenta o quarant'anni) per la loro realizzazione. In merito alla fusione nucleare, siamo ampiamente già dentro ai comparti di ricerca e mi permetto di ricordare che uno dei progetti, tra cui l'ITER, è in cantiere da oltre vent'anni e sono state spese ingentissime risorse, ma ancora non vede e non vedrà la luce, se non tra diversi decenni. In conclusione, dichiaro che il MoVimento 5 Stelle voterà favorevolmente sulla ratifica del Trattato.
2022-07-05	PD	PortaFabio	Voglio ricordare che la Francia, dopo la Germania, è il nostro secondo partner commerciale e che, a seconda degli anni, noi continuiamo a essere il terzo o secondo partner economico della Francia. Abbiamo peraltro anche interessi strategici comuni: siamo entrambi fondatori dell'Unione europea e della NATO, siamo parte del G7 e del G20. Siamo altresì Paesi con una forte e naturale propensione mediterranea. Sono dimensioni politiche che ci vedono avere interessi comuni, che non sempre hanno dato luogo in questi anni a forme di cooperazione o a punti di vista collimanti. Non aiuta però di certo guardare a questi episodi del passato per costruire una relazione futura. Voglio anche ricordare che se il Next generation EU è stato adottato con le caratteristiche e i criteri che conosciamo, che tra l'altro hanno permesso al nostro Paese di beneficiare di un apporto di oltre 200 miliardi di euro, ciò è il risultato del forte impegno condotto da Italia, Francia ed anche dalla Germania a livello di Unione europea. Grazie a questo impegno si sono superati ostacoli che sembravano insormontabili. Si tratta quindi di un trattato importante che - è bene ricordare - non ha un valore soltanto bilaterale, anzi direi che la sua caratteristica è proprio la sua fortissima dimensione europea. Una dimensione, come sappiamo tutti, sconvolta negli ultimi mesi dalla crisi in Ucraina, che ha mutato e sconvolto lo scenario e che ci chiama tutti a nuove responsabilità. Abbiamo bisogno di un salto di qualità nel processo di integrazione europea e di una terza fase nel processo di integrazione dopo quella dei Padri fondatori, dopo quella di Maastricht e dell'euro. Oggi abbiamo necessità di un salto in avanti e di un'ulteriore integrazione per dare maggiore coesione e unità all'Unione europea. Sappiamo di avere una politica estera comune, ma spesso le relazioni bilaterali tra Paesi si sovrappongono, non sempre in maniera organica, con detta politica estera. Credo siano proprio queste la sfida e la scommessa più grande che con questo Trattato abbiamo davanti; un impegno però che presuppone una regia e una guida comune. Sappiamo che queste cose non sono affatto scontate perché l'Unione europea è fatta di 27 Paesi e su ciascuno di questi temi è necessario trovare sintesi, consenso e coesione. Serve quindi un'azione coordinata e Italia e Francia devono, attraverso questo Trattato, essere protagoniste di tale coordinamento. Occorre un'azione di impulso che dia all'Unione europea livelli più elevati di integrazione, che sono la conditio sine qua non perché parli con una voce e agisca come una sola forza. Il Trattato del Quirinale tra Italia e Francia, firmato lo scorso 26 novembre, ha giustamente creato, anche al di fuori dei confini dei nostri due Paesi, un grande interesse proprio perché può preludere a un'espansione e a un approfondimento delle relazioni bilaterali, nonché a ricalibrare gli equilibri a livello europeo e ad aprire una nuova era di coordinamento tra i due Paesi in sede di relazioni bilaterali ed europee. Ricordavo i forti legami commerciali che uniscono l'Italia alla Francia: basti pensare che nel 2019, ossia l'ultimo anno prima della pandemia, il commercio bilaterale ammontava a ben 80 miliardi di euro e che l'Italia è il terzo fornitore della Francia e il terzo mercato di esportazione per quel Paese. Si tratta di due economie con sistemi produttivi integrati, con ben 1.700 aziende italiane attive in Francia e ben 3.000 aziende francesi presenti nel nostro Paese. La Francia è il principale investitore estero in Italia, ma sono importantissimi e rilevanti anche gli investimenti italiani in Francia. Il Trattato crea quindi una fitta rete di relazioni informali a più livelli tra diverse agenzie, comprensiva di un importante vertice intergovernativo annuale, una serie di forum ministeriali, consultazioni permanenti, programmi congiunti di formazione e scambio di funzionari. Tra le aree di cooperazione spiccano gli affari esteri, la sicurezza, la difesa, gli affari europei, la giustizia e gli affari interni, le migrazioni, la cultura, la ricerca e la cooperazione economica e industriale, soprattutto nel campo dello spazio e dell'innovazione. Ciò forse non produrrà automaticamente un allineamento di carattere strategico permanente, ma creerà canali istituzionali permanenti attraverso i quali gestire anche i conflitti, se ci saranno, e soprattutto per definire azioni comuni. In sostanza, l'obiettivo è una partnership più solida tra Francia e Italia in Europa. Tre sono le politiche europee dove maggiore è il coordinamento francese: la governance dell'eurozona, la governance della migrazione e la maggiore autonomia strategica in politica estera e di sicurezza. In estrema sintesi, il Trattato del Quirinale è un atto di diplomazia lungimirante che dovrebbe dare maggiore stabilità a una relazione politica complessa, espandendo legami economici e culturali e spingendo verso un avvicinamento in politica estera, il tutto rafforzando la fortissima identità europea dei nostri Paesi. Tutto ciò viene fatto per fare in modo che i successori, quando ci saranno, del presidente Macron e del presidente Draghi potranno anche essere meno allineati e ignorare certi meccanismi di consultazione, ma certamente con maggiore difficoltà. Vi assicuro che nel volatile mondo delle relazioni internazionali questa è una polizza assicurativa non comune. Ricordo, infine, che a livello regionale il nuovo accordo riconosce la stretta interconnessione tra Francia e Italia, attraverso il comune bacino del Mediterraneo, a promuovere l'uso sostenibile dell'energia e investimenti verdi in Nordafrica e Africa subsahariana. Ricordiamo anche che in questi giorni il Presidente della Repubblica si trova in quelle Regioni del Paese. Con questo Trattato il nuovo motore franco-italiano sarà fondamentale per affrontare alcune delle principali questioni all'ordine del giorno, tra cui il rafforzamento della sovranità europea e la risposta all'emergenza climatica. Signor Presidente, mi sia infine consentito soffermarmi brevemente sull'agghiacciante attualità. Nel leggere il Trattato, nella sua premessa, ho visto che si fa riferimento alla cooperazione nel settore alpino, alle nostre montagne e alle profonde mutazioni che l'emergenza climatica sta causando. Credo che questo Trattato abbia anche un valore per quanto riguarda il futuro dell'ambiente e con questo riferimento voglio esprimere, a nome mio, del Gruppo Partito Democratico e dell'Assemblea, il cordoglio alle sette vittime, ai familiari e ai cinque dispersi del disastro della Marmolada, sperando che tragedie del genere non si ripetano più.
2022-07-06	LN	BossiSimone	Signor Presidente, purtroppo ad oggi, dopo appena un mese di irrigazione, la situazione nella Bassa Lombardia è sotto gli occhi di tutti. È una situazione che definisco non grave, ma drammatica. Il mondo agricolo è consapevole di ciò che sta accadendo e forse è l'unico a rendersene conto. Certo, se non piove non è colpa di nessuno, per carità, ma non è per dare colpe o per cercare un colpevole che ho deciso di fare questo intervento. Io ho deciso di prendere la parola oggi perché sto facendo mia e dell'Aula la paura di tutta una filiera, quella agricola che, se non produce oggi, domani non avrà nulla da mettere sulle nostre tavole. Di fronte alle immagini dei campi aridi e spogli di produzione, mi domando perché, se il mondo agricolo non si vuole arrendere e non si sta arrendendo, la politica si sia già arresa. Non basta rifugiarsi dietro le misure di indennizzo contenute nei decreti che verranno emanati. Gli agricoltori del Nord stanno ancora chiedendo, a gran voce, che i bacini montani lascino andare l'acqua per salvare almeno quella parte di produzione e di coltura che ancora oggi può essere salvata. Non parliamo di vent'anni di irrigazione e di acqua. Parliamo di poche settimane, parliamo di circa venti giorni di acqua. L'altro ieri ho incontrato gli agricoltori della Coldiretti, che mi hanno portato in quei campi. Ho visto i loro occhi affranti di fronte ai raccolti secchi. Ho visto nei loro occhi rassegnazione per l'abbandono da parte delle istituzioni. Proprio parlando con loro ho deciso di intervenire e di prendere la parola in questa Aula. Il mio è un appello al Ministero, al Ministro e ai Presidenti di Regione, perché ancora una parte di raccolto si potrebbe salvare, intervenendo non domani o dopodomani, ma oggi e subito. Manca all'appello l'80 per cento dei raccolti di mais da trinciato e di foraggio da fieno. I prati stabili sono definitivamente compromessi e oltre alla perdita economica perdiamo anche un importante patrimonio di biodiversità. Ci saranno pesanti ripercussioni anche per l'alimentazione delle mandrie di bovini e qualche azienda si vedrà costretta a ridurre il numero di capi non potendo garantirne l'alimentazione. È quindi necessario l'immediato rilascio di tutta l'acqua invasa nei bacini alpini che ammonta, al 26 giugno, a 182 milioni di metri cubi. Dico questo perché ci sono norme che stabiliscono il prioritario uso agricolo dell'acqua rispetto ad altri usi: agricolo, potabile, uso domestico ed energetico. Senza cibo l'energia servirà a poco.
2022-07-06	LN	RomeoMassimiliano	Signor Presidente, siamo d'accordo sulla richiesta del rappresentante del Governo di rinviare la discussione sulle mozioni sul tema dell'energia e su quello delle sale cinematografiche purché la discussione di tali mozioni avvenga entro quindici giorni. È evidente che è la Conferenza dei Capigruppo a stabilire il calendario dei lavori, però ieri come Gruppi di maggioranza ci siamo sentiti e l'intenzione è quella di voler a tutti i costi trattare questi due temi entro e non oltre i prossimi quindici giorni, perché poi sappiamo bene che arriveranno dei decreti-legge e ci saranno tante urgenze. Dovremo trovare quindi il tempo di discutere le mozioni su questi due temi perché sono entrambi importanti. Pertanto, siamo d'accordo sulla richiesta, però nella Conferenza dei Capigruppo ribadiremo l'impegno a calendarizzare la discussioni delle mozioni sui due suddetti temi entro e non oltre quindici giorni. PRESIDENTE. Non intende quindi chiedere la votazione? Ha posto una condizione politica. ROMEO (L-SP-PSd'Az). No, signor Presidente.
2022-07-06	PD	MalpezziSimonaFlavia	Signor Presidente, anche noi non chiediamo la votazione sulla richiesta avanzata dal Governo. Siamo d'accordo con quanto appena dichiarato dal Capogruppo della Lega, senatore Romeo. Come Capigruppo, la scorsa settimana abbiamo deciso di dare uno spazio a queste mozioni, comprendiamo la necessità di questo slittamento, ma ribadiamo la necessità - e lo faremo nella prossima Capigruppo - di porre ancora in calendario la discussione delle mozioni sull'energia e sulla crisi delle sale cinematografiche al più presto possibile, proprio perché riteniamo che il Parlamento possa esprimersi su entrambi i temi. Il mio è quindi è un intervento volto a rafforzare questa posizione.
2022-07-13	FI	CaligiuriFulviaMichela	Signor Presidente, signor Ministro, colleghi, sembra ormai un ricordo lontano quando due anni fa i Presidenti di Regione temevano la zona rossa a causa del dilagare dei contagi da Covid-19. Spesso ci siamo ritrovati in quest'Aula a discutere delle ripercussioni di tali chiusure sul tessuto economico e abbiamo votato misure a sostegno dei comparti strategici del nostro Paese. Nel dibattito ci siamo concentrati spesso sul settore agricolo, il quale dall'inizio della pandemia è entrato nell'occhio del ciclone, purtroppo senza riuscire ad uscirne, per la chiusura del settore hotellerie-restaurant-café (Horeca), la concorrenza sleale di Paesi con costi di produzione inferiori, il caro energia, il caro carburante (anche e soprattutto quella agricolo), la diminuzione del potere di acquisto delle famiglie e ora, dulcis in fundo, la siccità, la quale - bisogna prenderne atto - è figlia dei cambiamenti climatici, ma anche di una gestione poco attenta verso la risorsa indispensabile per eccellenza: l'acqua. Secondo i dati Istat, la causa delle crisi idriche e delle difficoltà nell'approvvigionamento di acqua è da ricercare nei fattori di debolezza strutturale del nostro sistema idrico: soprattutto reti inadeguate e infrastrutture vetuste. Si pensi che solo nel 2020 sono andati dispersi nelle reti dei capoluoghi di provincia un miliardo di metri cubi di acqua, il 36,2 per cento di tutta quella immessa in rete. Credo sia inaccettabile alla luce della crisi che stiamo vivendo oggi, ma soprattutto per via della consapevolezza - come diceva anche il Ministro poco fa - che la mancanza di acqua stia diventando, anno dopo anno, sempre più ricorrente, intensa e prolungata. Va bene, quindi, lo stato di emergenza e mi auguro che a breve sia emanato anche un decreto-legge ad hoc, rispetto al quale ho un piccolo suggerimento. Qualora si optasse per la nomina di un commissario, si valuti la possibilità di una nomina di un subcommissario del comparto agricolo, proprio per dare la giusta rilevanza a tale settore, che sta soffrendo.
