2015-06-24	LN	CentinaioGianMarco	Innanzi tutto, Presidente, come già l'ultima volta che è venuto in quest'Aula a parlarci sempre dello stesso argomento, la domanda che ci facciamo è a cosa servono sedute del Senato come questa, perché se l'obiettivo è quello di venire a raccontarci le stesse cose che racconta a «Porta a Porta», allora le ho già sentite a «Porta e Porta» o magari in qualche altro talk show. Se invece l'obiettivo è quello di venire in Senato e dirci esattamente quello che lei domani e dopodomani andrà a fare, allora anche oggi abbiamo abbastanza "toppato". Innanzitutto, signor Presidente, vorremmo deplorare la decisione di prorogare le sanzioni alla Russia al 1° luglio. Anche in questo caso ve ne siete lavate le mani e avete abbandonato le aziende italiane al loro destino, salvo poi fare i simpatici con Putin quando viene in Italia. Domani però non tratterete di questo, non ne parlerete; evidentemente avete argomenti più importanti rispetto alle problematiche che hanno i nostri concittadini e le nostre aziende. Domani sicuramente non parlerete dei nostri marò perché, poverini, sono abbandonati al loro destino e né lei, né il suo Governo, né i suoi colleghi in Europa si ricordano di due persone che stanno ancora nelle mani della giustizia indiana, che mi sembra di aver capito essere più efficiente di quella italiana. Sulla questione greca, signor Presidente, mi preme evidenziare che anche in questo caso non ci piace essere presi in giro. Non ci piace essere presi in giro sul ruolo dell'Italia, perché a maggio 2015 (non lo dice il senatore Centinaio, ma il «Corriere della Sera») l'Italia è stata classificata tra i cinque Stati con maggiori squilibri e rischia l'apertura di una procedura d'infrazione. Quindi, se il penultimo della classifica va a fare la morale all'ultimo, forse è meglio avere un minimo di dignità e pensare a quello che non siete in grado di fare a casa nostra, piuttosto che andare a guardare ciò che succede a casa d'altri.
2015-06-24	M5S	FattoriElena	L'ultimo punto: Russia e Ucraina. Nessuno vuole una guerra fredda o calda. Vogliamo che l'Italia si ponga come mediatore tra queste due parti e si faccia carico di ridurre le sanzioni e l'embargo verso la Russia, che tanto danneggia i nostri agricoltori.
2015-06-24	M5S	FattoriElena	Non abbiamo parlato di Trattato transatlantico sul commercio e gli investimenti (TTIP) né di Russia e Ucraina: vogliamo tacere anche su questo? Il TTIP è un accordo importantissimo, il più grande del mondo. Forse non se ne parlerà al Consiglio europeo; ne parleremo qui in Parlamento e vorremmo un impegno del Governo a garantire trasparenza rispetto ad un accordo che modificherà la vita dei cittadini in maniera irreversibile, nonché una particolare attenzione sulla clausola sulla Risoluzione delle controversie tra investitore e Stato (ISDS) che consentirà alle multinazionali di fare causa agli Stati membri.
2015-06-24	M5S	MartonBruno	Allora, Presidente, lei mi deve dare una risposta, se è possibile. Qual è la sua politica? Come prevede di redistribuire tale ricchezza a quei popoli per evitare che non sentano più l'esigenza di migrare? Perché noi dobbiamo sempre affrontare il tema delle conseguenze e mai quello delle cause? Allora, la causa sono le politiche di tutti gli Stati del mondo; sono le politiche aggressive degli Stati Uniti; sono anche le sanzioni alla Russia. Guardiamo il conflitto ucraino. C'è di mezzo il gas. Nel Congo è per il coltan; per Israele e Palestina è l'acqua, mentre in Nigeria per il petrolio. Mi dice cosa dobbiamo fare? È un serpente che si morde la coda.
2015-06-24	PD	TrontiMario	Badate, è la stessa cosa la pulsione irrazionale, di massa, antipolitica e antieuropea. Non a caso esse si saldano oggi in questi movimenti, che forse non è nemmeno corretto definire populisti, perché il populismo è stato anche storicamente una cosa seria, progressista, negli Stati Uniti, in Russia, in America Latina. Questi sono veramente i movimenti della paura e del rancore, con delle ragioni, purtroppo, oggettive. È quelle ragioni che bisogna colpire, per rimediare: è necessario mettere mano a un progetto politico di Europa, supportato da una classe dirigente, politica, europea (e ho letto nelle dichiarazioni del Presidente anche questa esigenza).
2015-06-24	PD	TrontiMario	L'Europa, se vuole crescere politicamente, ha da riscoprire il primato bismarckiano della politica estera. L'Europa non può occuparsi solo di se stessa; deve occuparsi del mondo, farsi protagonista della ricerca di un nuovo ordine mondiale, farsi nuovo nomos della Terra: solo la grande cultura europea può aspirare ad assolvere a questo mandato. Se quello della Guerra fredda era, a suo modo, un discutibile ordine mondiale, purtroppo questa pace calda che ne è seguita, ha prodotto un disordine mondiale. Dopo la fine del mondo bipolare non si è passati, per fortuna, a un mondo unipolare, come qualcuno sperava e magari desiderava. Siamo in un mondo multipolare, che chiede di essere governato, ma che è difficilissimo da governare. Qui, di nuovo, la politica, che non è solo uso della forza, che pure quando serve è necessaria, ma anche abile capacità di manovra. All'Europa spetta il maggior carico dell'iniziativa di fronte alla pressione che sale dal Sud del mondo, ma ci vuole un'Europa unita più larga. L'ancora giovane presidente Obama dovrebbe ascoltare i consigli del novantatreenne Kissinger che se ne intende più di lui, e forse anche più di noi. FATTORI (M5S). Il nuovo che avanza! TRONTI (PD). Non è stato casuale il suo incontro con il nostro presidente Napolitano: due personalità che conoscono bene l'Europa e il mondo. Il consiglio di Kissinger è di non isolare la Russia, di non sbagliare bersaglio, di non ricominciare con una guerriglia fredda sui confini orientali dell'Europa. La Russia è Europa. Mai come oggi torna la necessità di una grande alleanza Occidente-Oriente dell'Europa, e forse del mondo, di fronte ai pericoli veri, inediti, violenti e drammatici che vengono dal Sud, ma che - ripeto - provengono anche dall'interno dell'Europa e dell'Occidente. La stessa emergenza immigrazione andrebbe letta e gestita in questo contesto. Signor Presidente del Consiglio, concludo con un suggerimento: non si lasci travolgere da queste quotidiane «baruffe chiozzotte», tradizionali per il nostro Paese, ricordando la famosa commedia di Goldoni. Lei governi al meglio, con prudenza e saggezza, ma nello stesso tempo, con i suoi collaboratori, in primis con il suo valido Ministro degli esteri, spinga lo sguardo lontano: riuscirà così meglio a vedere anche le cose più vicine.
2015-06-30	LN	DivinaSergio	Ciò che servirebbe, e che non compare da nessuna parte, sarebbe lo screening del comparto. Il comparto agricoltura è composto da una miriade di micro e mini-aziende, a volte consorziate e a volte raggruppate in cooperative, che hanno però una caratteristica: un'età avanzata di tutti gli addetti del settore. In primis, per i giovani questo è un settore poco appetibile, perché è un lavoro massacrante. In agricoltura si lavora trecentosessantacinque giorni all'anno, ma il fattore principale, forse, è che nessun giovane riesce a realizzare, a mettere in piedi, e neanche a subentrare in un'azienda di famiglia: pur supponendo che tra più soggetti ve ne sia uno solo a volerla gestire e portare avanti, questo non avrebbe la capacità finanziaria di saldare i coeredi per poter fare questo tipo di lavoro. Se dunque si vuole che questo settore vada avanti, bisogna consentire ai giovani di accedere all'autoimprenditorialità. Questo è un settore che non si tocca mai e si dimentica completamente. Dopodiché, serve coerenza e linearità. Vogliamo aiutarlo questo settore o lo usiamo e ci serve solo per spremerlo? Si dice che lo si vuole aiutare, ma si aumentano le accise sul gasolio agricolo; si dice che lo si vuole aiutare ma si introduce una tassa, la più sciocca e iniqua che vi sia, sui terreni agricoli, come fossero terreni produttivi di altra natura; si introduce per la prima volta un'imposta che va a gravare i redditi già contenutissimi del settore più bistrattato che abbiamo. Nel nostro Paese vi sono poi stati eventi meteorici calamitosi, terremoti e alluvioni, che hanno messo chiaramente in notevole difficoltà tutti i settori, tra cui le attività agricole. Ebbene, qual è stata la risposta dello Stato? Una piccola risposta ridicola, se vogliamo: sono stati dilazionati gli oneri fiscali. Non si è toccato assolutamente nulla. C'è stata una piccola dilazione, per il resto, poi, si sono pretese in toto tutte le imposte soggette a dilazioni. Il settore stava in piedi. Le medie e grandi aziende avevano ancora una capacità di produrre e trovare mercato esterno dal momento che quello interno, in tutti i settori tra cui quello agricolo, ha segnato fortemente una riduzione di passo; ebbene, il nostro Governo ha seguito gli americani, gli USA, le direttive dell'Unione europea, sanzionando la Russia, per le questioni ben note relative all'Ucraina, e questa ha risposto con delle sanzioni. Adesso abbiamo i numeri... PRESIDENTE. Senatore Divina, concluda per favore. DIVINA (LN-Aut). Vado a concludere, Presidente. Nel 2014 ci abbiamo rimesso quasi un miliardo e mezzo di euro. Le stime per il 2015 parlano di una perdita di 3 miliardi sulle esportazioni. Questa è politica estera, ma se la politica estera si riverbera su quella interna bisogna capire che il settore è sempre quello. Puniscilo con la mano destra o con la mano sinistra ma è sempre quello. Per finire veniamo a quello che speriamo l'attuale Governo abbia il coraggio di prendere in mano, evitando di seguire le direttive dell'Unione europea per produrre formaggi sostanzialmente anche senza latte. Sarebbe il colpo di grazia al settore lattiero-caseario, uno dei fiori all'occhiello della nostra agricoltura e anche delle nostre esportazioni perché la gastronomia italiana ha ancora un marchio, un nome e un suo mercato. Abbiamo bloccato il Governo - il collega Candiani ha parlato del TTIP - quando voleva seguire gli standard americani ossia invecchiare il vino non più in botti, in barrique, ma usando dei trucioli. Il tempo necessario per l'invecchiamento di sei, dodici o diciotto mesi si riduceva a poche settimane, ma non era lo stesso prodotto.
2015-07-08	PD	MaranAlessandro	Dico che voteremo contro, anche se noi non ci nascondiamo le difficoltà e il fatto che, all'indomani del referendum greco, lo scenario sia preoccupante. La tragedia greca è diventata una noiosa partita di poker, con tanto di apertura al buio, bluff, controbluff; e ammesso che anche questa volta si riesca ad evitare la Grexit, il rischio è che si tratti dell'ennesima soluzione di basso profilo, magari per ritrovarsi tra qualche tempo nella stessa situazione. Il Regno Unito è incamminato sulla strada della "Brexit" e, vista l'ideologia del nuovo Premier polacco, diventa possibile anche l'uscita della Polonia, che doveva essere il prossimo candidato per l'annessione alla moneta unica e la principale testimonial dei successi europei, come la Spagna di Mariano Rajoy, dove l'affermazione di Podemos la dice lunga sulla popolarità delle politiche economiche imposte dall'Europa, indipendentemente anche dai relativi successi economici. Non ci nascondiamo che l'Europa nel suo complesso è ancora immersa nei postumi di una crisi finanziaria, di origine americana, ma che gli Stati Uniti sembrano ormai essersi lasciati alla spalle da un pezzo. Per non parlare dell'incapacità di formulare una strategia comune in termini di politica estera o di energia, che pure dovrebbero rappresentare interessi europei comuni. Certo che ci sono difficoltà e problemi che noi non ci nascondiamo, ma continuiamo a pensare che le ragioni a favore dell'Unione europea siano oggi persino più forti di ieri. Con il ribaltamento delle fonti di crescita mondiale e il successo di grandi Nazioni, come la Cina, l'India o gli Stati Uniti, un'Europa frantumata in tanti piccoli Paesi non avrebbe nessuna chance. Viviamo, in tutti i Paesi europei, una fase storica di drammatiche sfide esterne. Tutto cambia intorno a noi. I cambiamenti strutturali stanno rimodellando non solo la politica italiana, ma il vasto mondo. Quando gli storici, tra cent'anni, guarderanno ai primi anni di questo secolo, l'evento più rilevante probabilmente non sarà la crisi finanziaria che attanaglia da anni il mondo occidentale. La storia più importante sarà quella che gli americani chiamano the rise of the rest : l'ascesa dei resto del mondo, la crescita, il risveglio di Paesi come la Cina, l'India, il Brasile, la Russia, il Sudafrica, il Messico, l'Arabia Saudita, la Turchia e potrei continuare nell'elenco. È la più grande uscita di massa dalla povertà nella storia del mondo. Qui ha origine gran parte dei nostri problemi. Trent'anni fa, quando una Regione come la mia era alle prese con la ricostruzione del Friuli terremotato, una città come Shenzhen non esisteva ancora; oggi ha quasi 9 milioni di abitanti, più o meno la popolazione dei cinque distretti di New York, e molti dei suoi residenti sono nati in campagna, nella miseria, e oggi hanno un tenore di vita grossomodo equivalente a quello di Brooklyn. In una sola generazione, un villaggio di pescatori è diventato il quarto porto al mondo, che movimenta, da solo, più di quanto riescono a fare insieme Los Angeles e Long Beach, i due maggiori porti americani. Nel giro di soli trent'anni, circa 300 milioni dì cinesi sono passati dalla miseria più nera a standard economici capaci di reggere il confronto con quelli occidentali: un'impresa senza precedenti nella storia mondiale. Si tratta di una crescita che è più visibile in Asia, ma non è confinata all'Asia: più dì trenta Paesi africani (due terzi del Continente) sono cresciuti negli anni recenti ad un tasso superiore al 4 per cento annuo. È ovvio che il sistema internazionale costruito dopo la seconda guerra mondiale sia diventato praticamente irriconoscibile a fronte a questo enorme cambiamento. Non è scritto da nessuna parte però che il declino, la decadenza, un destino di minor potere regionale e globale, sia un esito inevitabile per l'Europa e per il nostro Paese. La tecnologia, il ruolo dell'immigrazione, i miglioramenti nella sanità pubblica, norme che incoraggino una partecipazione più grande delle donne nell'economia, sono solo alcune delle misure che potrebbero cambiare la traiettoria delle tendenze attuali, e sarà cruciale ancora una volta circa gli esiti il ruolo della leadership, perché i leader e le loro idee contano, ma salta agli occhi che il nostro futuro è necessariamente legato a quello dei nostri partner europei. Si tratta di cogliere fino in fondo la lezione della crisi dell'eurozona in quanto conseguenza dell'incompiutezza e contraddittorietà del cammino seguito dall'Unione dopo Maastricht. Quel che occorre non è solo una politica monetaria, ma è una politica fiscale, di bilancio e macroeconomica effettivamente europea. Insomma, è verso un'Europa più federale, più integrata, più forte nella sua capacità di parlare ed agire all'unisono che è inevitabile e, noi riteniamo, indispensabile muoversi. Noi vogliamo andare avanti e non tornare indietro. Le cose che dovrebbe fare l'Europa sono piuttosto evidenti. Approfittando anche del referendum britannico, per l'Unione europea va trovata una nuova forma di convivenza fra Paesi che sono interessati soltanto ad un'area di libero scambio e chi vuole invece una maggiore integrazione, tanto da condividere la moneta. L'attuale modello istituzionale, con tutti i parlamentari europei che votano su politiche che interessano solo una parte, cioè i Paesi dell'euro, non ha senso. Non funziona un'unione monetaria basata su complicatissime regole che nessuno capisce, affidate per la gestione ad un organismo presumibilmente tecnico, come la Commissione, ma che in realtà decide in modo discrezionale. Per tenere assieme l'area monetaria ci vuole senz'altro maggiore convergenza, maggiore cessione di sovranità. Lo ripetiamo: maggiore cessione di sovranità. Ma questa deve essere accompagnata da un rafforzamento della legittimità democratica dei centri decisionali europei e da meccanismi solidaristici e di distribuzione del rischio tra i Paesi membri. Ciò significa rafforzare il Parlamento europeo rispetto al Consiglio e alla Commissione sulla gestione del bilancio e sulla politica economica europea, ma significa prevedere anche che figure apicali della governance europea, tipo il Presidente dell'Unione, siano elette direttamente da tutti i cittadini europei, non soltanto da una parte. Non è un caso che lo stesso Draghi non perda occasione per dire che la politica monetaria è di per sé insufficiente. È di questo che noi dovremmo discutere e parlare. Ma l'impressione è che piuttosto che affrontare un difficile dibattito tra se stessi e con le proprie opinioni pubbliche, i Governi europei e molti dei partiti europei preferiscano non far nulla e cullarsi nell'illusione che la nuova politica monetaria della BCE li tenga fuori dai guai. Ma la scelta dell'Europa e della Grecia non è quella fra euro e dracma e la scelta dell'Italia non è quella fra euro e lira, fra democrazia e autocrazia, quanto tra piccoli sacrifici distribuiti fra tutti i Paesi europei ed enormi sacrifici per il popolo greco oggi e per noi domani. Voglio ricordare un bel libro pubblicato negli ultimi anni, in occasione del centenario della Prima guerra mondiale: «I sonnambuli», di Christopher Clark, che si concentra sull'analisi delle ragioni che hanno condotto allora la guerra. Quel che più colpisce nell'analisi di Clark è che nemmeno gli statisti capirono perché entrarono in guerra. Ognuno di loro, tedeschi compresi, si sentiva attaccato e riteneva di combattere una guerra puramente difensiva. Emerge un quadro sconcertante di statisti prigionieri delle loro paranoie, che si divertono a bluffare e a giocare continuamente al rialzo, nella speranza che l'avversario non reagisca. Anche allora ognuno degli Stati aveva qualche valida ragione e, nel contempo, tutti hanno avuto torto nel non essere riusciti a trovare una soluzione pacifica alla crisi determinata dall'attentato di Sarajevo. Come allora, a trascinarci in basso non sono soltanto i Governi (non lo furono allora, come oggi), ma anche la politica, la cultura politica comune, l'orgoglio, il nazionalismo, le cose di cui abbiamo sentito parlare poco fa. Anche i popoli barcollano sperduti, spesso disinformati, impauriti, fantasticando recinti nazionali eretti contro l'economia mondo; credono di contestare i Governi, ma ne sono in realtà i complici, condotti e come sempre guidati da qualche imbroglione disposto a gettare il pitale su Montecitorio e disposto a invocare le radiose giornate. Non per caso, uno degli architetti della moneta unica come Helmut Kohl ha ribadito, all'inizio della crisi greca, che l'euro nientemeno ha a che fare con la possibilità di impedire la guerra. Gli spiriti malvagi del passato non sono stati messi al bando una volta per tutte, ma possono sempre tornare. Il che significa che l'Europa resta una questione di guerra e di pace e che l'aspirazione alla pace rimane la forza motrice dell'integrazione europea. «L'Europa è il nostro futuro» - ha insistito Kohl - «Non c'è alternativa all'Europa e abbiamo tutte le ragioni per essere fiduciosi che la nostra Europa uscirà rafforzata dalla crisi attuale, se lo vogliamo». Ed ha aggiunto: «Non facciamoci fuorviare». Anche per questo noi voteremo contro, per non farci fuorviare. Non vogliamo farci fuorviare, ma vogliamo andare avanti e non tornare indietro.
2015-07-22	PD	ToniniGiorgio	Venendo al provvedimento al nostro esame, si tratta di un passaggio importante della politica estera italiana e anche di un primo successo della nostra politica estera, che da molto tempo lavora per spostare verso il Mediterraneo l'asse e il fuoco dell'attenzione nostra e dell'Europa. Giustamente, l'Europa è ovviamente preoccupata per il deteriorarsi dei nostri rapporti con la Russia. Questo è certamente un problema di assoluto e straordinario rilievo, perché l'Unione europea è collocata, dalla geografia e dalla storia, ai confini con la Russia. Questi confini si sono andati assottigliando man mano che Paesi che facevano parte del cosiddetto blocco sovietico prima della caduta del Muro di Berlino, hanno chiesto ed ottenuto progressivamente l'ingresso nell'Unione europea, in quella che è stata definita la strategia dell'allargamento (ma che, forse, sarebbe meglio definire la strategia della riunificazione europea). Nessuno di noi può quindi trascurare l'importanza ed il valore strategico di questo scenario, cioè del rapporto tra l'Unione europea e la Russia.
2015-07-23	LN	CandianiStefano	Penso a quella schifezza che vuole mettere in croce il lavoro dei tassisti onesti e regolari, magari andando a offrire anche pranzi e cene a parlamentari ed esponenti di Governo, perché queste sono le azioni poste in essere dalle lobby che si attivano all'interno del Parlamento e sotto le forze politiche. Su questo dovremmo avere degli indirizzi di rispetto del lavoro. No, signora Presidente: non ci siamo. Vedremo poi nella fase emendativa come sarà considerato il resto degli emendamenti. Non ci piace quest'Europa delle banche; non ci piace quest'Europa che omologa tutto e che vuole tutto grigio, una creta grigia per poterla manovrare e deformare a proprio uso e consumo. L'Italia sta già pagando troppo i costi dell'Europa e non mi riferisco sono solo a quelli delle tasse che vengono pagate in Europa. Ricordiamoci sempre che quando si tratta di fondi europei stiamo parlando di soldi degli italiani, non di risorse degli altri Paesi europei che vengono spese in Italia; inoltre, paghiamo un'altra volta per le sanzioni che l'Europa ha imposto alla Russia. Su questo vorremmo un dibattito. Ci auguriamo inoltre che questi aspetti di mero recepimento burocratico siano realizzati almeno seguendo la corretta scadenza temporale, visto che stiamo parlando della legge europea del 2014, mentre siamo nel 2015 e dovremmo aver inoltrato il nostro sguardo verso il futuro.
2015-09-10	PD	CorsiniPaolo	Frutto di un negoziato piuttosto rapido, l'accordo, che si affianca a quello già vigente in materia di scambi e cooperazione economica, costituirà la cornice giuridica per il rafforzamento della cooperazione settoriale con un Paese dalle considerevoli potenzialità strategiche, stanti anche i suoi rapporti con la Cina e la Russia, destinato altresì ad essere maggiormente integrato nell'economia mondiale e nella cooperazione regionale ed internazionale.
