2015-03-18	PD	PizzettiLuciano	Sulla proposta di risoluzione n. 4, a prima firma del senatore Centinaio, esprimo parere non favorevole sulle premesse e parere favorevole sugli impegni del Governo, invitando ad accogliere le seguenti riformulazioni della parte dispositiva. Al primo capoverso, dalle parole «garantendo, comunque, l'ammontare del futuro trattamento», sopprimere le parole «garantendo, comunque» e premettere la parola «favorendo» alle parole «l'ammontare del futuro trattamento pensionistico». Al terzo capoverso, con la riformulazione si chiede di sopprimere la parola «autonomamente» e di aggiungere, dopo le parole «sulla base di criteri certi», le parole «e condivisi». Infine, all'ultimo capoverso si chiede di sopprimere le parole «venga opportunamente modificata per depotenziarne la portata antirussa» riformulando in tal modo il capoverso: «Ad agire in ambito europeo affinché l'agenda della Presidenza di turno lettone favorisca un processo di effettiva distensione in Ucraina, coinvolga i Paesi partner in una gestione effettivamente condivisa dell'emergenza migratoria mediterranea, se possibile anche favorendo azioni di accoglienza in Africa nelle quali procedere alla verifica della sussistenza dei requisiti necessari alla concessione del diritto d'asilo, e promuova l'adozione di una linea d'azione comune nei confronti della guerra civile libica e di quella siriana». Si chiede quindi di inserire la parola «favorendo» al posto della parola «creando», perché non è nelle nostra disponibilità la «creazione» di alcunché in quei luoghi. Sulla proposta di risoluzione n. 5, a prima firma del senatore Cioffi, il Governo esprime parere contrario. Sulla proposta di risoluzione n. 6, a prima firma del senatore Paolo Romani, il parere è contrario sulle premesse. Si propone invece la riformulazione degli impegni. Al punto 8), si chiede di fermarsi alle parole «a porre particolare attenzione alla questione Ucraina-Russia», sopprimendo quanto segue. Al punto 9), si chiede di fermarsi alle parole «all'Ucraina», sopprimendo il resto. Il parere è inoltre contrario sui punti 10) e 16). Se vengono accolte tali riformulazioni, il parere resta contrario sulle premesse ma è favorevole sugli impegni. PRESIDENTE. Sottosegretario Pizzetti, ai fini di una maggiore chiarezza, le chiedo di specificare se lei proponga di sopprimere i punti 10) e 16) della proposta di risoluzione n. 6. PIZZETTI, sottosegretario di Stato alla Presidenza del Consiglio dei ministri. Sì, Presidente, occorre riformulare i paragrafi 8) e 9) ed eliminare i successivi 10) e 16) della proposta di risoluzione n. 6.
2015-03-25	M5S	MorraNicola	Fra l'altro, è notizia di ieri che anche qui a Roma alcuni amministratori locali, sia della Regione Lazio, sia del Comune di Roma, siano stati colti (probabilmente, perché sono semplicemente stati raggiunti da un avviso di garanzia) con il piede in fallo. Ritenevo che questo ulteriormente potesse rappresentare un motivo per prestare attenzione a tale tematica. PRESIDENTE. La invito a riprendere il suo intervento. MORRA (M5S). Signora Presidente, come dicevo, affrontiamo l'esame di un disegno di legge (mi riferisco, in particolare, al disegno di legge n. 19) che era nato sotto altri auspici. Chi istituzionalmente presiede questa Aula, e cioè il presidente Grasso, nel secondo giorno di vita di questa legislatura aveva depositato questo testo anticorruzione al fine di dare un segnale forte al Paese. Questo segnale così forte è arrivato in Aula dopo oltre due anni. Evidentemente, tutta questa volontà di portare in Aula un provvedimento che forse poteva disincagliare dalle secche della corruzione e dell'ingiustizia il Paese, non c'era. Scusate se sono alterato, ma noto con grande piacere l'attenzione con cui si segue questo dibattito. Insegnava un certo filosofo prussiano, che probabilmente a nessuno di voi interessa, e cioè Immanuel Kant: «Se la giustizia scompare, non ha più alcun valore che vivano uomini sulla terra». È proprio questo il senso della riflessione che voglio proporre perché qua, come si suol dire: "non gliene può frega' de meno a nessuno". Solo parole, tanto che ci sono voluti due anni per portare un vostro provvedimento bandiera in Aula, ma non riuscite a tradurre queste parole in fatti, in voti.
2015-04-09	M5S	MontevecchiMichela	Signora Presidente, l'Europa ha bisogno del Mediterraneo ed il Mediterraneo ha bisogno dell'Europa. Le comuni ed indissolubili matrici storiche e culturali danno vita a quella che è stata più volte denominata la regione euromediterranea: è per questo che l'equilibrio politico e sociale dell'area delle sponde del Sud del Mediterraneo è di primaria importanza. Stabilizzare i Paesi della cosiddetta primavera araba vuol dire frenare l'immigrazione, soprattutto clandestina, e la tratta di esseri umani. È perciò importante l'impegno di permettere la presentazione della richiesta di asilo nei Paesi di origine e quello di rivedere la regolamentazione europea sull'immigrazione, come da sempre richiesto dal Gruppo Movimento 5 Stelle e come proposto anche da un nostro disegno di legge, che l'attualità impone di discutere tutti insieme, senza bandiere né barriere. Noi siamo pronti: la situazione contingente impone provvedimenti fattivi. Non limitiamoci, come al solito, a mettere delle toppe e a fare la parte dei riparatori, quando invece è ora di costruire e di prevenire. Dobbiamo dare una seria sferzata al fenomeno delle tratte, alla gestione criminosa dei barconi della speranza, e dobbiamo dare e ridare dignità all'essere umano. Stiamo per votare una risoluzione più che mai opportuna, che però dovrà avere un seguito reale e non rimanere in queste stanze. Il bacino del Mediterraneo ha un'importanza strategica, sotto tutti punti di vista: commerciali, sociali e politici. Il ruolo dell'Italia potrà essere quello di protagonista o addirittura di capofila per lo sviluppo di questo bacino, in una visione proficua. Basti pensare alle potenzialità commerciali, a quelle agricole e a quelle alimentari, che oggi sono invece impostate più in chiave concorrenziale, spesso scorretta e senza il controllo delle produzioni che arrivano da noi, dando talvolta ai Paesi del Nord Africa un ruolo di crocevia per le produzioni intensive e geneticamente modificate - come ad esempio quelle del Brasile - dirette ai grandi mercati di Cina e Russia. Attualmente ci si sta muovendo in direzione contraria rispetto ai buoni propositi presenti nel testo in esame: l'IMU agricola e l'Expo, sponsorizzato dalle multinazionali dell'alimentazione, come la nota catena americana, danno poco spolvero alle nostre eccellenze e alle potenzialità della area mediterranea. E noi oggi subiamo inermi. La situazione della Libia deve essere risolta a livello diplomatico ed eventuali azioni europee devono puntare alla cooperazione e allo sviluppo, soprattutto con l'impiego di forze civili. Anche in questo caso il fenomeno va stroncato all'origine, ovvero alla radice, intervenendo sugli armamenti, sulla corsa al profitto a tutti i costi e sulla strumentalizzazione della religione. Il rubinetto della produzione e della fornitura di armi deve essere chiuso. I pretesti per la guerriglia, che si schermano dietro ad una pseudovisione religiosa, devono essere ridotti a zero. L'azione diplomatica deve essere seria e di uno spessore tale da non consentire più pasticci, perché si tratta di un vero e proprio pot-pourri di errori consecutivi, come nel caso della questione palestinese, che oggi rischia di mettere un intero popolo in ginocchio, anche dal punto di vista umanitario. Guardiamo a quanto sta accadendo nel campo profughi di Yarmuk in Siria, dove ci sono decine di migliaia di persone in condizioni disperate, tra cui 3.500 bambini, che sono i primi a pagare e i veri ignari di tutto. A Yarmuk non arrivano né cibo, né acqua, né medicine, come ci fa sapere l'organizzazione Save the children. È un vero inferno nell'inferno, per decine di migliaia di persone, prese nella morsa violenta dello Stato islamico e del Fronte al-Nusra, che oggi pare controllino l'80 per cento del campo. Ribadiamo e ripetiamo le nostre domande: chi arma lo Stato islamico? Davvero l'azione diplomatica non ha mai potuto prevenire questo stato di cose? Purtroppo sembra che gli equilibri legati al profitto abbiano il sopravvento sulla dignità umana. Voteremo, dunque, a favore della risoluzione in esame, ma siamo coscienti che non bastano le parole scritte su un foglio bianco a produrre una seria svolta umanitaria, politica ed economica. Servono quelle azioni che, dallo scorso novembre, quando votammo il precedente testo, non sono mai state messe in campo. È dunque l'ora di passare dalla parola all'azione: noi siamo pronti.
2015-04-29	LN	DivinaSergio	Signor Presidente, approfitto dei pochi minuti che abbiamo a fine seduta per riportare un fatto abbastanza importante, considerato anche con altrettanta attenzione. Il 14-15 aprile la ministra Federica Guidi ha guidato una delegazione ministeriale in Azerbaijan; oltre a tutto il suo gabinetto, la ministra ha portato il direttore generale per la sicurezza dell'approvvigionamento e delle infrastrutture energetiche, il direttore dell'Istituto per il commercio estero, gli amministratori delegati di SIMEST e il presidente di SACE (le due strutture che garantiscono i nostri investimenti all'estero). Questa nostra visita in quel Paese è stata vista con estrema attenzione. Per i colleghi che non conoscono molto bene la situazione, ricordo che l'Italia per quel Paese caucasico è diventata il primo partner commerciale: nel 2014 gli interscambi commerciali hanno superato i cinque miliardi di dollari. L'Azerbaijan è un Paese estremamente importante per il ruolo che riveste per la nostra sicurezza energetica, se pensiamo alla situazione ucraino-russa. Infatti, se pensiamo alla possibilità che, con le nostre sanzioni nei confronti della Russia, si incrini il mercato primario di gas che riceviamo da quel Paese, verifichiamo come, a questo punto, sia importante avere alternative accessibili e immediate. Bene, questo intervento lo faccio anche a nome dell'Associazione interparlamentare Italia-Azerbaijan, di cui sono presidente. Proprio dalla controparte azera, mi viene detto che questo tipo di rapporto, ed in particolare questa visita, è stato molto apprezzato. Questo dovevo pertanto riferire all'Assemblea ed ai rappresentanti del Governo presenti.
2015-05-12	LN	CandianiStefano	Signora Presidente, piuttosto che una cattiva raccomandazione approvata è meglio un ordine del giorno non accolto dal Governo. Ciò vale ancora di più perché l'ordine del giorno in esame si riferisce alla crisi che ha colpito le nostre esportazioni verso la Russia. Se aspettiamo ancora un po' l'approvazione di questo provvedimento, quel problema internazionale potrebbe essere già superato. È un paradosso reale.
2015-05-14	LN	CandianiStefano	La ringrazio, signora Presidente, ma non importa, perché questo dà il senso e l'idea di quanto sia considerato questo provvedimento. Come dicevo, il tutto si basa sulla legge n. 234 del 2012, secondo la quale il Governo, ai sensi dell'articolo 29, è tenuto a presentare alle Camere, entro il 28 febbraio di ogni anno, un disegno di legge di delegazione europea con l'indicazione dell'anno di riferimento e poi un secondo disegno di legge, seguito dalla dicitura «secondo semestre», entro il 31 luglio dall'anno di riferimento. Questo consente a tutta la struttura del Paese non semplicemente di soddisfare le esigenze, diciamo pure estetiche, del Governo nel recepire le direttive ma di potersi adeguare. All'inizio il Governo Renzi poteva lamentare di avere ricevuto un'eredità di arretrati da smaltire, ma oggi, 14 maggio, ad un anno e mezzo dall'insediamento del Governo, l'unica cosa di cui possiamo prendere atto è che non esiste più il Ministro delle politiche europee (c'è un Sottosegretario). E la stessa attenzione con la quale il Governo affronta questo provvedimento ci dice che la premura non è tale, perché siamo ormai all'anno 2015 inoltrato e stiamo parlando ancora della competenza 2014. Signora Presidente, c'è una disarticolazione tra questo stesso provvedimento e quello che avviene nel Paese, e le spiego subito. Quando è stato presentato questo provvedimento, esso prevedeva degli articoli, che poi sono stati via via tolti perché cannibalizzati da altri decreti‑legge fatti dal Governo. Ora mi chiedo: qual è, in questo caso, la ratio nel presentare una legge e poi estrarne dei pezzetti rendendo più disomogenea anche la lettura? Diciamolo pure, è una semplice approvazione formale. Allora vorremmo sapere dal Governo qual è oggi realmente il significato dell'appartenenza del nostro Paese all'Unione europea, perché i cittadini devono avere coscienza e consapevolezza di quali sono i costi sopportati dall'Italia per appartenere all'Unione europea e quali sono i benefici. Vogliamo parlare della politica di difesa comune? L'Italia partecipa all'Europa, ha una politica di difesa comune e, quindi, dovrebbe risparmiare sui costi della difesa nazionale. Ma i risparmi vengono reinvestiti magari sulla scuola, sulla previdenza? Non è così. Sappiamo che l'Europa sostanzialmente non ha una politica di difesa comune. Quale sarà, allora, la ragione? Abbiamo oggi una politica estera europea, che dà all'Italia, come a tutti gli altri Paesi, dei vantaggi rappresentativi? Non è così e se ne deve dar pace anche il presidente Renzi, dopo tutti gli sforzi formali, e non sostanziali, che ha fatto per avere la ministra Mogherini a rappresentare la politica estera europea. Nella realtà dei fatti - abbiamo potuto verificarlo in queste stesse ore con la gestione del problema degli sbarchi dei clandestini provenienti dalla Libia - la ministra Mogherini può essere al limite il portavoce dei desiderata dei più potenti e forti Paesi europei, ma non è certamente il Ministro che fa sintesi tra tutti e dà un vantaggio competitivo all'Italia nella politica estera. Addirittura, paradossalmente, la politica estera europea ci rende più deboli. Perché? È molto semplice. Cosa vi aspettate? Vi aspettate di ottenere dall'ONU una risoluzione per poter intervenire e bloccare dalla Libia l'afflusso di clandestini attraverso gli sbarchi organizzati dagli scafisti? Magari chiedete al Consiglio di sicurezza dell'ONU un mandato per andare ad operare in Libia e affondare i barconi quando devono partire? Magari vi rivolgete a quello stesso Consiglio in cui siede la Russia, che è stata schiaffeggiata dall'Unione europea e oggi, invece, dovrebbe acconsentire a dei vantaggi per un territorio che le è lontano, quello italiano, quando noi siamo stati così distratti nei confronti della politica estera russa quando si parlava di Ucraina? Ci domandiamo ancora una volta quale sia il senso dell'appartenenza reale all'Unione europea. Devo dedurre, da quello che sta facendo il Governo, che il senso sia avere buone normative, pseudo normative, che normino e regolamentino. Come si diceva, in maniera molto brillante ed efficace, qualche anno fa, si regola quanto deve essere lungo il cetriolo, come devono essere fatti gli ortaggi e come deve essere vestito il capotreno sul treno. Signora Presidente, certamente non è banalizzando che si sminuisce il contenuto della legge, ma prendiamo atto di quale sia oggi la reale consistenza per il Governo: questo è un atto squisitamente di recepimento di direttive europee e normative. Punto e basta. Non abbiamo potuto sentire e apprendere il significato che il Governo Renzi dà all'appartenenza dell'Italia all'Unione europea. E non lo abbiamo appreso oggi, ancor di più, a semestre europeo terminato. Non ci sono risultati da poter mettere in campo, perché il made in Italy - e non finirò mai di dirlo - non è stato tutelato. E anche in questo recepimento di direttive non c'è nulla che sostenga quel made in Italy che lei stessa, signora Presidente, come il sottoscritto e gli altri componenti della Commissione, quando si è recata in visita all'Unione europea, ha cercato di promuovere. La differenza tra noi e il Governo è che a noi non interessa una fotografia davanti alla lavagna; a noi interessa il contenuto, non interessano le parole scritte con il gessetto. E a questo proposito porto un paradosso proprio delle ultime ore: il presidente Renzi si è fatto fotografare davanti ad una lavagna mentre scriveva con il gessetto. Ma questa era la volta buona di prendere in mano un iPad e far vedere che le scuole italiane sono, invece, l'eccellenza in termini di tecnologia. Invece no: ripercorre lo stereotipo di una scuola fatta con la lavagna e il gessetto. Lo stesso traspare da questa legge. Qual è l'idea di appartenenza all'Unione europea che il Governo trasmette con questo provvedimento? È semplicemente quella di accettare un recepimento regolamentare e normativo che aggiunge burocrazia alla burocrazia e non dà valore competitivo al Paese. A coloro che oggi si sentono già incoronati dalla fine della recessione dico di prestare attenzione: qui non si tratta di fare i gufi, ma occorre essere consapevoli che, negli altri Paesi europei, quel piccolo vantaggio competitivo che abbiamo avuto dalla diminuzione del costo del petrolio si è già trasferito sull'economia reale in termini di vantaggi, riduzione dei costi e maggiore competitività. Noi tutto questo non lo abbiamo, signora Presidente. Mi rivolgo al sottosegretario Gozi: occorre un impegno che non sia formale, che non attui semplicemente delle disposizioni perché devono essere fatte. Infatti, il refrain «ce lo chiede l'Europa, ce lo dice l'Europa» poteva andar bene alla professoressa Fornero e al professor Monti nel dire: «dovete bervi un bel bicchiere di olio di vaselina, ce lo chiede l'Europa». Oggi però il Paese ha bisogno di competitività, di essere serio, di dire che se c'è un'Europa è quella che dà la possibilità di avere un made in Italy protetto, non quella che svende il nostro Paese e lascia venire i cinesi a prendersi i pezzi migliori della nostra economia. Signora Presidente, non siamo convinti del metodo con cui il Governo ha gestito il provvedimento in esame, ancor più che del contenuto del provvedimento stesso.
2015-06-03	M5S	BertorottaOrnella	Signor Presidente, il disegno di legge n. 1879 di ratifica ed esecuzione dell'Accordo tra il Governo italiano e quello kazako sulla cooperazione militare può apparire, a prima vista, uno dei tanti Accordi in tema di sicurezza che il nostro Paese stringe da tempo in ogni parte del mondo. Secondo questo Accordo, l'Italia fornirà, oltre a servizi di intelligence e formazione per l'esercito kazako, anche assistenza e fornitura di navi, aerei e armi pesanti, con relativo munizionamento. Quindi più che un accordo sulla difesa, questo disegno di legge è di fatto, un accordo per la vendita di armi ad un Paese che non rispetta i diritti umani e la democrazia. Appare infatti chiaro il gap democratico del Kazakhstan che dal 1991 ha in carica lo stesso Presidente, il quale ha sempre represso nel sangue e nella carcerazione qualsiasi tipo di opposizione. Il caso Shalabayeva è solo l'ultimo in ordine cronologico, a dimostrazione di quanto l'opposizione kazaka sia più formale che altro. Basti ricordare che a tutte le tornate elettorali Nazarbayev vince con percentuali superiori al 90 per cento; condizione, questa, che qualsiasi Paese democratico, definirebbe quantomeno anomala. È da ricordare inoltre come il potere di Nazarbayev si estenda in maniera incontrollata, arrivando persino a punizioni collettive, come nel caso della protesta degli operai delle compagnie petrolifere a Zhanaozen, nata per rivendicare salari e condizioni di vita migliori e repressa nel sangue con 16 morti tra i manifestanti, l'imposizione del coprifuoco da parte del Governo e addirittura la negazione del diritto di voto per i 50.000 abitanti della città in cui si svolsero le proteste. Altro aspetto da sottolineare riguarda il culto della personalità di Nazarbayev, che non esita a promuovere la sua immagine con ogni mezzo. Questi sono alcuni esempi della situazione in Kazakhstan. Più volte le organizzazioni umanitarie hanno denunciato pratiche di censura da parte del Governo, oltre che vere e proprie azioni mirate a minacciare o ad arrestare dissidenti politici. Proprio le compagnie petrolifere tra cui l'ENI, naturalmente, sono responsabili dello sfruttamento e delle pessime condizioni di lavoro dei kazaki, che giustamente protestano, incontrando però la repressione governativa, che in questi casi agisce in sintonia con le compagnie petrolifere, o forse sarebbe meglio dire per procura. Una risoluzione del Parlamento europeo del 15 marzo 2012 invita il Kazakhstan ad adottare politiche antirepressive riguardo al diritto di sciopero, al diritto di assemblea e alla libertà di stampa, subordinando queste azioni alla conclusione di accordi di natura sia politica sia economica e soprattutto militare. Ebbene, signor Presidente, nell'accordo in discussione oggi, non c'è alcun riferimento alle azioni di miglioramento della democrazia, della libertà di stampa e di manifestazione, ma si fa esplicito riferimento alla fornitura di arsenali aerei, navali e di armi pesanti nonché al loro munizionamento. Se il rispetto dei diritti umani è stata la causa ufficiale degli interventi in Iraq e in Libia, se il rispetto dell'individuo è alla base del supporto degli Stati europei ai ribelli siriani, allora mi chiedo perché, riguardo al Kazakhstan, non è fatta alcuna menzione nell'accordo sul miglioramento delle condizioni democratiche del Paese. Chi ci garantisce che queste armi, una volta ottenute non vengano usate contro la popolazione? Nazarbayev ha oggi 74 anni e non ha ancora indicato un successore ed è presumibile che la sua uscita dalla scena politica, presto o tardi, condizionerà la stabilità del Paese. L'assenza di diritti umani certifica l'assoluta irresponsabilità di questo accordo, che non presta alcuna attenzione alle conseguenze, ma evidentemente si accontenta di chiudere un buon accordo economico di vendita di armi per le nostre imprese, magari in cambio di risorse energetiche primarie, di cui il Paese è ricco, e a cui faceva cenno il senatore Divina. Allora signor Presidente, bastano i dati economici per ripulire uno Stato dittatoriale? Nel 2013 lo scambio commerciale con il Kazakhstan ha raggiunto 4,6 miliardi di euro. Le esportazioni dell'Italia in Kazakhstan sono state pari a 733 milioni di euro, mentre le importazioni pari a 3.867 milioni di euro. L'Italia rimane nel 2013 il secondo Paese fornitore dell'Europa dopo la Germania e l'ottavo fornitore in assoluto, e risulta il primo destinatario di merci dal Kazakhstan (soprattutto per i prodotti energetici). L'Italia è dunque al terzo posto in assoluto tra i partner commerciali del Kazakhstan, dopo Russia e Cina, e risulta tra i principali investitori europei (nono Paese per capitale investito in termini assoluti) soprattutto nel settore petrolifero e in quello delle costruzioni. In effetti, il presidente del Consiglio Renzi non si è posto molte domande durante la sua visita nel Paese nel giugno scorso. Era andato a firmare accordi petroliferi e di transito militare per il nostro contingente in Afghanistan e a chiudere il caso Shalabayeva, proprio con Nazarbayev. Se questa è la considerazione per i diritti umani, allora appaiono quanto meno grottesche, le scuse che hanno portato all'invasione dell'Iraq e della Libia, e all'attacco per procura alla Siria, tutti Paesi che non rispettano i diritti umani così come Nazarbayev. Ma si sa che il petrolio e gli interessi dell'ENI sanano qualsiasi problema democratico. Per la sua posizione geopolitica il Kazakhstan è un attore centrale anche per il recente accordo strategico sino-russo, in quanto il Paese confina a Nord con la Russia e a Est con la Repubblica Popolare Cinese. Questa particolare situazione rende e renderà il Kazakhstan sempre più instabile, per ovvie ragioni di predominanza geopolitica dei due colossi. La fornitura di armi al Kazakhstan non verrà vista di buon occhio né dai russi, né dai cinesi, che considereranno l'Italia partner strategico della dittatura kazaka, e di conseguenza agiranno anche contro di noi, in una già tesa situazione diplomatica, soprattutto con la Federazione Russa. Il PD e i galoppini che appoggiano questo Governo siano consapevoli di ciò e si assumano le responsabilità di questo accordo fino in fondo. Stiamo dando gli strumenti per una potenziale mattanza della popolazione kazaka e lo stiamo facendo consapevoli di ciò che potrebbe accadere. Queste, signor Presidente, sono le ragioni che ci spingono a votare contro questo Accordo. Votare a favore per noi significa associarsi ad una dittatura sanguinaria e totalitaria, che nulla porterà di buono agli italiani.
