2017-01-30	LAB	StellaCreasy	There are some things that should not take too much thought. Sometimes something is just wrong, and we need to say that it is wrong. We do not need to judge the angles. Of course we need a trade deal with America, but we should not be trading our values to secure it. Indifference to cruelty of this kind damages not just our nation, and not just our nation’s standing, but our world. It makes it harder for us to stand alongside those people in our communities tonight who are fearful of the division that we are seeing as a result of this ban. It makes it harder for us to advocate our values, and to take on other countries that also ban people. It makes it harder for us to do our job. We are people in positions of power. We need to hear the voice of our communities who are saying that this is not the world that they want, and act accordingly.
2017-01-30	LAB	YvetteCooper	The ban also threatens our security. It is immediately counterproductive to prevent from entering the US those Iraqi citizens in the Iraqi Government and armed forces with whom the US may need to work in the fight against IS. Inevitably, the Iraqi Parliament has responded by saying that American citizens will be prevented from entering Iraq. We need these countries to work closely together, and with us, in order to defeat terrorist extremists. We should be fighting against them together, and not be divided.
2017-01-31	CON	GeorgeFreeman	At a time when trust in politics has never been so low, we have an opportunity to restore public trust in mainstream politics not to score easy points, but to show that we are worthy of the sovereignty vested in us and in the name of which the Brexiteers have campaigned. Our Brexit deal must be an ambitious Brexit deal for Britain. It must be a Brexit that means we can once again control our own laws, strengthen our Union, protect workers’ rights and strike ambitious new trade deals around the world. [Interruption.] Yes, for Scotland, too. To do this, however, we will have to continue to be engaged with the world, and to cherish our British values. [Interruption.] As the Prime Minister made clear in her recent electrifying speech—I encourage the right hon. Member for Gordon (Alex Salmond), who is chuntering from a sedentary position, to read it—the work of bridging the gap between Europe and the United States will remain one of the key tasks of international relations for many decades to come. I believe our Prime Minister has set out to do for markets and the west what the great Lady Thatcher did for the defence of the west. Last week, she showed that she was more than up for leading such a mission. It may not always be easy, but it is necessary for this country, which is not something that the right hon. Gentleman who was chuntering understands. I welcome the fact that she has made such an encouraging start with President Trump—he, too, has been elected—because although he campaigned for “America first”, the foreign policy signals are that for the Americans it is now a case of “Britain first”, and we should welcome that.
2017-01-31	CON	ThomasTugendhat	The Franks casket symbolises exactly what we are. It symbolises the fact that we are a union of peoples and that we are a combination of our past and our future, because it is inscribed in runic and in Latin. It has stories of Romans, of Jews and even of pagan Germans, Madam Deputy Speaker. I was particularly struck because, of course, this debate is part of a long, long series of discussions that our country has been having not only with itself but with our community in Europe and the wider world. That conversation is democracy. That conversation is humanity. There is an idea that there is a final part or an end state that we are about to hit—the departure from the European Union or the vote to invoke article 50—but they are not end states in any real sense. We are still going to be part of a European community, because we are 20 miles from the coast of France. We are still going to be part of a global community, because our cousins live in America, India, Canada and even Zimbabwe. We are part of this international world, so this is not an end state—it is merely a stage. It is our duty to make sure that the next stage, the only one we have any ability to control, is successful
2017-01-31	LAB	BenjaminBradshaw	Yes, that was the time for arguing the principle. This is the time for arguing about the type of Brexit that we believe is in the best interests of our country. I am afraid that some of my colleagues are clinging to the straw of the vote that the Government have promised on any deal at the end of the two-year negotiation process, yet the Government have made it absolutely clear that the only choice will be between their hard Brexit and WTO rules. This could be our only chance to prevent the hardest of Brexits or to soften its blow, and I cannot and will not vote to destroy jobs and prosperity in my constituency. I fully accept that it is easier for me to vote against article 50 because my constituency voted remain. I have been overwhelmed by the support for my position that I have received from my constituents and Labour party members, but I completely understand that some colleagues, particularly those in areas that voted heavily to leave, will find it more difficult to do this. In the end, however, as the right hon. and learned Member for Rushcliffe (Mr Clarke) so ably reminded us, we are elected representatives who are called upon to use our own judgment about what is in the best interests of our constituencies and the country. Do we believe that cutting ourselves off from our closest friends and main trading partners will hurt or help our constituents and our country? Do we honestly think it is in our national interests to hitch ourselves to this American President? We will all be judged in the future on how we voted on this Bill
2017-01-31	LAB	CliveEfford	There are some questions to be asked about whether members of the Government are acting in our best interests. We had the spat with the Italian Economic Development Minister over whether Italy would be hurt by selling less prosecco to the UK, where he turned around and said, “We may sell a little less prosecco, but that’ll be happening in one country, while you’ll be selling less to 27 countries.” We had the comments of the Foreign Secretary over freedom of movement as a founding principle of the European Union, where he used a very unfortunate word in an interview with a Czech newspaper and said it is a “total myth” and “nonsense” to say it is a “founding principle”. He may well believe that that is true, but that is not the way to go about negotiating with people who are going to have an important say over future trade agreements for this country. Then, when it came to the meeting about the outcome of the American presidential election, he spoke down to the people attending a meeting specially convened to discuss that, and said: “I would respectfully say to my beloved European friends and colleagues”
2017-01-31	LAB	GeraintDavies	As for Trump, in his inauguration speech he complained that countries were ravaging America’s economy, selling their own products, taking America’s jobs and stealing its companies. If anybody on the Government Benches thinks we are going to have a good deal from Trump, they have got something else coming. The Trump Administration will strip away our public services and public health, our environment and our rights at work, because those things will no longer be protected by the European Court of Human Rights. That is the future we face: as some sort of low-tax haven, with low skills and low standards. We will try to get into the European market and rightly be penalised by EU tariffs
2017-01-31	LAB	HeidiAlexander	I am not normally a pessimist, but I feel I am watching a slow-motion car crash and I have to do something about it. Over the next 12 months, Europe is likely to experience the political turmoil that we, along with America, have experienced over the past 12 months. Now is not the time to be making threats and burning bridges. Now is not the time for party politics. My country comes first and that is why I will vote against this Bill at the first opportunity.
2017-01-31	LAB	MargaretBeckett	As for the United States, I am sure that the Secretary of State for Exiting the European Union, who, like me has had a degree of experience in complex international negotiations, is as conscious as I am that one of the first prerequisites is to listen to the words. It was not the President of the United States who said that Britain would be at the front of the queue, it was British politicians. What the President said was, “You’re doing great.” I do not take much comfort from that, especially coming as it does from a President whose motto is “America first.” I wholly share the fears that have been expressed, and that probably will be again in this debate, about the possibility of America’s companies wishing to exploit the healthcare market here or weaken our regulations on, for example, food safety
2017-01-31	LAB	MarkHendrick	In my view, it is a tragedy that we have seen introduced into the House a Bill that will result in our withdrawal from the European Union at the same time as our Government are seeking to embrace an extreme right-wing United States President and Administration who seem hellbent on disrupting a long-standing progressive and multilateral world order based on trade, NATO and the European Union. The American President, whose slogan is “America first”, and who talks in protectionist terms and about a possible trade war with China, hardly seems likely to provide the UK with favourable trade terms, given that the UK has relinquished any leverage it might have had by unilaterally announcing that it is to leave the EU single market. What is on offer from the United States to replace the high-quality consumer standards that EU membership has given us? The answer is chlorinated chicken, beef injected with growth hormones and genetically modified products that do not comply with the EU’s strict precautionary principles
2017-01-31	LAB	PeterKyle	Respecting the small majority who voted leave means getting things right, and I have three tests for the city that I represent that must be met before I can in all conscience support the formal process of leaving the EU. In a city with an outward-looking economy and the head offices of American Express and EDF, is it likely after Brexit that talent and goods will be able to travel uninhibited to and from the continent when our local economy demands it? Will our two universities still have visa-free access to students and teachers from EU countries, and will their £10 million of annual EU funding be protected in the long term? And will Brexit have a negative impact on Brighton and Hove’s tourism economy, which relies on 8.5 million visitors a year, many from EU countries
2017-01-31	LAB	PhilipWilson	As the Prime Minister searches for trade deals that we cannot start negotiating formally until we have left the EU, she should consider the manner in which she proceeds. The Prime Minister knows the dilemma this country is in, but she must consider her demeanour. She shows too much haste, especially in securing a state visit for the President of the United States seven days into his presidency when President Reagan waited 17 months to visit the UK. It was not even a state visit, and we all know how close President Reagan was to Margaret Thatcher. All this reveals that the Prime Minister’s haste is undue. Some say that the Transatlantic Trade and Investment Partnership negotiations would be a risky agreement between the US, representing 350 million consumers, and the EU of 28 countries, representing half a billion. Wait until we see what is on offer from President Trump, who puts “America first”, when he knows he is negotiating with one country of 65 million people that is desperate for a deal. I do not believe that this fact will have been lost on the arch-dealmaker himself. If the Prime Minister is prepared to walk away from the EU because “no deal for Britain is better than a bad deal for Britain”, will she walk away from a trade deal with the US on the same basis? The Government want to see us as a great global trading nation, and I do as well. So to avoid us standing on the street corner, cap in hand, I would not walk away from the EU without a deal being struck. Without a deal, I would stay at the negotiating table until I got one—walking away is not an option. I know that my voting to trigger article 50 may come as a disappointment to some of my constituents, while others may believe that leaving the EU is the correct course. The debate in the House of Commons over the next two weeks will be the start of the process, not the end. I reserve judgment as to my future voting intentions. We need to get what follows right. As much as I do not like the result of the EU referendum, neither can I ignore it. I will therefore continue to exercise my duty in good faith, with the wellbeing of my constituents and the country at the forefront of the decisions I make. I quote the Secretary of State for Brexit: “If a democracy cannot change its mind, it ceases to be a democracy.”
2017-02-01	CON	CarolineSpelman	I am no starry-eyed Europhile. The political leadership in Europe failed to inspire its citizens about the benefits of working together. Other countries are seeing the rise of extreme right parties that promise to solve their problems. This goes beyond Europe. The leadership of the rich nations around the world are struggling to find answers to the impact of globalisation for the low waged. In America, Obama tried to extend healthcare to the poorest, and here we have the introduction of the living wage, but maybe we need to look to places such as Scandinavia for better models of wage equality and fairness in society. Those are the big questions left when we exit the European Union and we will need to answer them in our own way
2017-02-01	CON	GeorgeOsborne	We have to accept that, in a democracy, the majority has spoken. Although I am a passionate believer in an open, internationalist, free-trading Britain, I am also a passionate believer in Britain as a democracy. It is unfashionable in schools these days to teach what I believe to be a true tale of our nation’s history, which stretches from Magna Carta to the Glorious Revolution, the founding fathers of the American constitution, the Great Reform Act, female emancipation and the like, but we have given the modern world a version of democracy that has spread far beyond our shores
2017-02-01	CON	JamesHowarth	I have another note of caution: the EU’s determination to create an EU defence identity shows no sign of relenting. Such a policy presents a direct threat to the ultimate guarantor of European security, NATO, and risks alienating its principal paymaster, the United States of America. I shall support this Bill tonight.
2017-02-01	CON	JulianBrazier	Russian armed forces regularly carry out large-scale exercises, including with nuclear-capable equipment, on the borders of eastern Europe. Does my right hon. Friend agree that the American commitment to NATO is absolutely pivotal to protect the countries of eastern Europe from going the same way as eastern Ukraine?
2017-02-01	CON	NigelHuddleston	The manifesto on which I stood in 2015 not only promised an in/out referendum on Europe, but stated: “We will honour the result of the referendum, whatever the outcome.” During the referendum campaign, I committed to respecting the result, even if it was decided by just one vote. In the end, the difference was more than 1 million votes. That 72% of the population turned out showed just how seriously the British public took the task of deciding their future. In my constituency, the turnout was more than 80%. By contrast, 58% turned out for the recent US presidential election. That was an election with huge consequences, not only for the USA but for the world, yet nearly 100 million Americans could not be bothered to turn out and vote
2017-02-01	CON	TheresaMay	My hon. Friend is absolutely right. We should never forget that America is our most important ally. Our relationship is long standing and American men and women served and died alongside UK men and women in two world wars to protect our security and the security of Europe. If we were not able to have that relationship and to see that commitment to NATO, in particular, we would leave this country and Europe less safe.
2017-02-01	LAB	DanielZeichner	How quickly we have forgotten just how this was achieved. At this of all times, when the world is such an uncertain place, this is not the moment to turn away from our European home, and to take a huge gamble on getting a deal with the most reckless and unreliable American President any of us have known
2017-02-01	LAB	JamesCunningham	Earlier, my right hon. Friend the Member for Doncaster North (Edward Miliband) mentioned climate change and the American President, who said he will tear up the agreements on that subject. Where will Britain stand then? What support will it get?
2017-02-01	LAB	MadeleineMoon	I accept the outcome of the referendum. We are leaving the European Union, but that does not mean that I am willing to vote for the Conservative party to lead this country into a treacherous, uncertain future. There is a Gramsci quote that, depending on the translation, says that the old order is dying, the new one is struggling to be born, and in the interregnum monsters are abroad. They most certainly are. We are voting before we know the outcome of three European elections that will influence the deal we finally face. And then there is Trump’s America. Can we trust any part of our economic security to an America that has just had Trump’s inauguration speech: support for torture, a ban on Muslims entering the US, anti-climate-change rhetoric, the clear statement of “America first”, and the commitment to end trade agreements that are not in America’s best interests
2017-02-02	CON	DavidLidington	The unique feature of the EU referendum was that Parliament passed an Act that expressly referred the decision to the British people. I certainly felt that we were honour-bound to accept the verdict. As for the state visit by the President of the United States, of course people are free to express their opinions, and it is right that the Petitions Committee has allocated time for the petition to be debated. The Government take the view that a state visit is perfectly appropriate. The relationship between the United Kingdom and the United States of America—including with its elected head of state—matters to the security of our citizens and the geopolitical role of the west, as well as to our commercial and industrial interests. For those reasons, it is right that we should welcome the elected head of the United States of America in the way we have his predecessors.
2017-02-02	CON	JulianBrazier	The second reason is the effect on officers. The statement in the covenant is clear, but let me digress for a second. America has a policy of having allowances rather than family accommodation in some cases where housing in the area is affordable, but it is strictly based on rank. In contrast, the Government state that “the accommodation allowance of tomorrow will be provided based on… need, regardless of…rank”
2017-02-02	CON	ThomasTugendhat	However, the experience was also hugely demanding. We were operating in very difficult circumstances, in heat and dust, sleeping little, often in danger—at risk of either improvised explosive devices or direct action—and also working alongside people from other nations. I speak not only of the Americans with whom, obviously, we worked very closely, the Australians with whom I had the great joy of serving, or the Estonians, Danes and Czechs, all of whom were impressive and quirky in their own ways, but of Afghans and Iraqis—men of huge courage and great integrity who literally put their lives on the line for us and many of whom, sadly, did not live to tell the tale
2017-02-02	LAB	KeithVaz	This week we spent 17 hours discussing the European Union, but we did not spend a single minute on the crisis in Yemen, where half the population are still starving. Last Sunday, President Trump authorised the first attack on al-Qaeda in Yemen, causing the death of one American soldier and 14 casualties. When can we have an update on the urgent situation in Yemen? We hold the pen at the UN on this subject. We desperately need a ceasefire. When can we know what is happening?
2017-02-06	CON	JulianLewis	Thank you, Mr Speaker. Given that there can be no security for Europe without the intimate involvement of the United States of America, will my right hon. Friend please redouble her efforts to persuade our continental friends—and, indeed, our friends on the Opposition Benches—that, whatever they feel about an individual President’s personal qualities, the way to proceed has to be to reach out to him, to respect his office and to keep strengthening the alliance?
2017-02-06	CON	TheresaMay	I have been very clear that it is in the interests of the UK to have a continuing strong European Union, and that is a point that I have made to the American Administration.
2017-02-06	CON	TheresaMay	I was also able to relay my discussions with President Trump on the importance of maintaining the sanctions regime on Russia in response to its actions in Ukraine, and I very much welcome the strong words last week from the new US ambassador to the United Nations, Nikki Haley, in confirming America’s continued support for these sanctions
2017-02-06	CON	TheresaMay	My hon. Friend is right to raise concerns about the ballistic missile tests that took place. The overwhelming message that we took from the informal Council in relation to working with America on a number of issues, including not only Russia and Ukraine but Iran, was that it is important for us to engage directly with the American Administration on these matters and, obviously, make clear the positions that we hold in Europe.
2017-02-06	CON	TheresaMay	My right hon. Friend is right. One of the themes at the informal Council was the recognition of the role that America has played in supporting Europe’s defence and security and of the need to engage fully with the American Administration. That is what we are doing and what I encourage others to do.
2017-02-06	CON	TheresaMay	Of course, there are some areas where we disagree with the approach of the new Administration, and we should be clear about those disagreements and about the values that underpin our response to the global challenges we face. I also argued at the Council, however, that we should engage patiently and constructively with America as a friend and ally—an ally that has helped to guarantee the longest period of peace that Europe has ever known. For we should be clear that the alternative of division and confrontation would only embolden those who would do us harm, wherever they may be
2017-02-06	CON	TheresaMay	Turning to America, I opened a discussion on engaging the new Administration, and I was able to relay the conversation I had with President Trump at the White House about the important history of co-operation between the United States and the countries of Europe. In particular, I confirmed that the President had declared his 100% commitment to NATO as the cornerstone of our security in the west. I also made it clear, however, that every country needed to share the burden and play its full part, meeting the NATO target of spending 2% on defence. It is only by investing properly in our defence that we can ensure we are properly equipped to keep our people safe
2017-02-06	CON	TheresaMay	Turning to last week’s informal European Council in Malta, Britain is leaving the European Union but we are not leaving Europe, and a global Britain that stands tall in the world will be a Britain that remains a good friend and ally to all our European partners. So at this summit we showed how Britain will continue to play a leading role in Europe long after we have left the EU, in particular through our contribution to the challenge of managing mass migration; through our special relationship with America; and through the new and equal partnership that we want to build between the EU and an independent, self-governing, global Britain. Let me take each point in turn
2017-02-06	LAB	WesleyStreeting	As members of the single market and customs union, we are part of the largest free trade area in the world. We have heard a lot about global trade and our relationship with the rest of the world, but what is often overlooked is that membership of the European single market and customs union facilitates global trade. In fact, the EU has more free trade agreements with the rest of the world than the United States of America, China, Canada, Japan, Russia, India and Brazil. Every single sector of our economy will be affected by the decisions that our Government make and the outcome of the negotiations
2017-02-07	CON	JeremyHunt	We looked at this extremely carefully, and I have a lot of sympathy with what my hon. Friend is saying. People do not have to have medical insurance if they visit countries such as America as a tourist, and we do not want to insist on that for visitors to this country because of our tourism industry here. We concluded that it was better to have a system in which people who get a visa to come and live here have to pay a surcharge. That is why we have introduced the visa health surcharge, which raises several hundred million pounds for our NHS.
