2017-03-28	CON	SueEllenBraverman	Secondly, financial remedies and maintenance are rooted in a bygone era where women were entirely financially dependent on their husbands. The reality today is that many women are able to support themselves, so divorce should not mean an automatic entitlement to lifetime support from an ex-husband. Scotland and North America limit payments, so why don’t we? Unless Baroness Deech’s Bill on this subject secures Royal Assent, a commission should make recommendations on how to strike a better balance so that England can shed its reputation as the divorce capital of the world
2017-03-28	LAB	EmilyThornberry	I have been told that the UK is, in fact, increasingly stepping back on the diplomatic front for fear of upsetting the Saudis on the one hand, and the Americans on the other. I am told by my sources on the 38th floor that the new Administration in America are now considering stepping up their support for the coalition military campaign. If that is right, will the Minister confirm that the Saudis have been given the rest of the year to stabilise Yemen—that is the wording—and to reassert the Yemeni Government’s authority over the entire country? Surely that cannot be the case, because we all know that a military approach alone will not work. May I also ask about the role of Stephen O’Brien? He is a former Member of this House whom many Members will know. He is now the United Nations Under-Secretary-General for Humanitarian Affairs and is obviously important in this regard. He has said that we are facing the worst humanitarian crisis since 1945 and that the crisis is in Yemen. I would appreciate it if the Minister could confirm that Mr O’Brien is not leaving his post and that rumours he is leaving, not out of choice but because of Saudi objections, are wrong
2017-03-28	LAB	EmilyThornberry	Let me welcome the Secretary of State back from his trip to Washington. More than ever, it is vital that Britain uses, in his words, our “extraordinary relationship” to ensure that America makes the right decisions on the world stage. The Secretary of State has consistently told us that we should be optimistic about the outcome. Indeed, two days ago, he told us: “They have an agenda very close to ours. The U.S. is back.” With that in mind, will he tell us specifically what impact he believes today’s presidential energy independence Executive order will have on the Paris climate change agreement? During his trip to Washington, what representations did he make about that Executive order?
2017-03-28	LAB	KeithVaz	How did we arrive at this point? In the Arab spring of 2011, Yemen and Tunisia stood apart in the region as the sites of the only peaceful transitions to democracy. Particular praise for that goes to the current Minister for Europe and the Americas, who became the Prime Minister’s envoy to Yemen. The UK has maintained stronger links with Yemen than any other western country. Three Members of this House were born there: myself, my hon. Friend the Member for Walsall South (Valerie Vaz) and the hon. Member for Portsmouth South. Members such as the hon. Member for Charnwood (Edward Argar), who is the vice-chair of the all-party group, have visited the country, and Members including the hon. Members for Beckenham (Bob Stewart) and for Tonbridge and Malling (Tom Tugendhat) have served there in the armed forces
2017-03-29	CON	ClairePerry	The Prime Minister will know that the reason we currently have a strong economy is partly due to the decisions taken by the previous Government and partly because nothing has actually changed economically, other than the sharp depreciation in our currency. As we go into a period of enhanced risk and uncertainty for our country and businesses, a process I think she will lead us through admirably, does she not agree that it is time to start talking facts and sense to the British people, rather than rhetoric and ideology, and in particular reject the idea that no deal and a reliance on WTO rules would somehow be okay? I am sure she will have seen recent research from the National Institute Of Economic and Social Research, which suggests that a WTO deal, despite all the trade deals we want to sign with China, Brazil, India and America, would represent a loss of trade of a quarter—a quarter—to the British economy. We cannot do that to this country. I hope she will tell us that we are not going to do that to our country. Can we start talking in facts and perhaps trust experts a little bit more?
2017-03-29	CON	PritiPatel	My hon. Friend has raised this issue with me previously. On support for family planning around the world in light of America’s policies, I am delighted to confirm that we are hosting a conference in July this year, working alongside Bill Gates, the private sector and others, to continue to demonstrate UK leadership on this issue while challenging others to step up.
2017-03-30	CON	DavidDavis	No, not at all. The whole point of this is to bring those laws back within the control of Parliament and our own courts, and our courts will continue to interpret them as they see fit. They may continue to obey precedent, or they may decide to change it. That will be a matter for them, and, ditto, it will be a matter for the House of Commons to decide whether it wants to change such matters as well. Let me add, as an aside, that the Supreme Court often looks at what is done by other courts around the world—not just the European Court of Justice but, for instance, the American courts—in order to make its decisions.
2017-03-30	CON	DavidDavis	The right hon. Gentleman is half right and half wrong. What the Prime Minister was referring to yesterday was, of course, the importance of either maintaining something very similar to, or putting in place a replacement for, the justice and home affairs strand of the European treaties. He is right in one respect: if we are to exchange data with not just the EU but other countries, such as the United States, we will undoubtedly need data protection, such as data laws and privacy protection, that meets their standards. The Bill will ensure that we get to that point on the day we leave the European Union and can therefore continue to exchange data. There is no doubt that there will be continuing discussions thereafter about how we maintain all our standards at the same level. However, that will be with not just the European Union, but all our allies, whether America, Canada, the “Five Eyes” —everybody.
2017-04-18	CON	AlexanderJohnson	Furthermore, it seems unclear from the right hon. Lady’s account whether she supports the American action at all. I wonder whether she could enlighten the House as to whether she is in favour of what the Americans did. For the first time in five years, the Trump White House has shown that the west is not prepared to sit by and watch while people are gassed with weapons that should have been banned—
2017-04-18	CON	AlexanderJohnson	I am obviously disappointed that the shadow Foreign Secretary should choose to intrude into this very important consideration relatively separate issues of domestic political policy: we are trying to explain the position of the UK, and indeed the west, towards the Assad regime. And, by the way, we are having a televised debate now in case she had not noticed, and we should continue in that way. To answer the right hon. Lady’s serious point, we are engaged in trying to use the opportunity provided by American action to drive forward the political process. It is not easy, and I think in all honesty that she should reflect on her approach, because what we are trying to do requires a great degree of cross-party support. We want the Russians to face up to the real option before them. If they continue to back Assad, they will be backing a regime that—I hope Members heard what I said about the use of chemical weapons—has been proved beyond a shadow of doubt to have used chemical weapons that are banned under international law. I would like the Russians to accept that there is a deal. That could be that they have an improvement in their relations with the Americans, and work together with the rest of us to tackle the scourge of Daesh. In return, the Russians need to understand that they need to make a serious commitment to a political process. At the moment, they are not doing that. They need to make a proper commitment to a ceasefire, and at the moment they are not making that commitment. They need to stop their client using chemical weapons. They said that they would do that in 2013. Rather than simply parroting the lines of the Kremlin, the right hon. Lady should support the collective action of the west, not just the G7 but the like-minded countries—
2017-04-18	CON	AlexanderJohnson	Obviously, we deplore any civilian deaths in Syria, but I also deplore any false equivalence between American actions and the dropping by the Assad regime of barbaric weapons, which were banned in 1925.
2017-04-18	CON	AlexanderJohnson	That was the message that Secretary Tillerson conveyed to Putin and to Sergei Lavrov on 12 April. We will do our utmost in the UK to hold accountable anyone found responsible for that gas attack, and we will work with our American counterparts to create the conditions for Russia to work with us and to escape its entanglement with the toxic Assad regime, which poisons Russia’s international reputation just as surely as it poisons its own people
2017-04-18	CON	AlexanderJohnson	The Government believe that the US action was a necessary, appropriate and justified response to an awful crime. As many as 20 Syrian military aircraft are believed to have been destroyed, and, as the House will know, Assad’s air force has been bombing civilians day after day for most of the past six years. The destruction of some of those strike aircraft will in itself save some lives, but still more important, I think, is President Trump’s emphatic message that the era during which Assad’s barbarism met with passivity and inaction has finally come to an end. America’s determined response creates an opportunity to break the deadlock and pave the way for a political settlement of Syria’s tragedy, but that will happen only if Russia is prepared to bring Assad to the negotiating table and begin a transition to a new Government who will represent the sole chance of peace in Syria. After the chemical attack and the American strike, the priority was for Secretary Tillerson to convey that message to Russia with the backing of as many countries as possible. The combined weight of the G7, and like-minded countries in the region, unanimously supported the US military action as a “carefully calibrated” response to a “war crime”, and mandated Tillerson to go to Russia and urge the Russians to “promote a real and genuine political process in Syria”
2017-04-18	CON	AlexanderJohnson	The hon. Lady will know that the UK is already the second biggest donor of humanitarian aid to the region, so we have a record that we can be proud of. I return to what she had to say about the American strike. I am looking at faces that are familiar from previous statements on Syria; month after month I have come here to update the House on how that tragedy is unfolding, and I see people who have taken a passionate interest in this subject and have called repeatedly for us to do more. Finally, the United States has taken what we believe to be condign action—action that I think is entirely appropriate—but somehow it fails to find favour with the hon. Lady
2017-04-18	CON	AlistairBurt	I thank my right hon. Friend for his statement and for the tone with which he made it. One of the purposes of the American action the other day was, as it would have been in 2013, to demonstrate to President Assad that he cannot militarily subjugate all his people and, therefore, to give force to negotiations in which he will actually have to concede something. The difficult question is this: had the US Secretary of State asked my right hon. Friend for some sort of support that evening, what would have been his answer? Do he and the Government consider themselves bound by the decision of the House in August 2013 and David Cameron’s statement afterwards? If so, does he intend to return to the House to discuss the matter further? If not, what might the United Kingdom be able to do to demonstrate its force and resolve against such actions as those we saw from President Assad the other week?
2017-04-18	CON	NicholasSoames	It is obviously right that a diplomatic joint approach in Syria is more important than unilateral action. Will the Foreign Secretary therefore commit to continuing to work closely with our American allies and other partners and friends to bring an end to this barbaric slaughter in Syria?
2017-04-18	CON	RishiSunak	From the discovery of Australia to the invention of the cat’s eye, the history of Yorkshire’s people is nothing if not entrepreneurial. That spirit is alive and well in my constituency in particular. From Heck sausages to Tennants auction house and the Wensleydale Creamery, ambitious SMEs are at the heart of our community and economy. Before I arrived in this place, I spent my career investing, backing businesses like those with the capital they needed to grow. I am delighted that this Finance Bill recognises what my years in the investment industry taught me—that ready access to finance is the fuel of success for ambitious SMEs, just as successful SMEs are the fuel of a prosperous economy. Yet, as I have said in the House before, the UK funding landscape for growth businesses presents challenges. Just 3% of British companies manage to expand beyond 10 employees—half the success rate of businesses in America. The UK has a relatively shallow bond market for early stage businesses, and a venture capital sector that is just a seventh the size of America’s. British entrepreneurs often face an uphill struggle to attract equity risk capital. That is why the Government have enhanced the enterprise investment scheme and created the seed enterprise investment scheme. Since their inception, these programmes have together helped more than 3,000 companies to raise more than £15 billion in early stage finance. The Finance Bill builds on that success to ensure that these schemes help even more small businesses to access investment, grow and create jobs
2017-04-18	LAB	HilaryBenn	In the light of the American Vice-President’s current visit to the region to consult, one hopes, South Korea and Japan, among others, on the most effective way of containing North Korea’s nuclear ambitions, and reflecting on the Foreign Secretary’s own experience at the recent G7 summit, does he think that there is the potential for further economic sanctions directed at Pyongyang? Does he think that China would fully support such a step?
2017-04-20	CON	RichardHarrington	For most people, the decision to move abroad is voluntary; it remains a personal choice dependent on the individual’s circumstances. The Scottish National party spokesperson, the hon. Member for Rutherglen and Hamilton West, said in her summing up that people may not have been aware that they were moving to a country with different pension arrangements. Others have mentioned the line and short distance between Canada and America. However, people who move abroad find out about so many things, including visas; they have to.
2017-04-20	LAB	RonnieCampbell	But that was then. The factory has been a good employer. It was taken over in 1990 by Procter & Gamble, which made another success of it, and then came the merger—it is not a takeover—with Coty, an American company that does the same thing. It makes hair things for women and that sort of thing. I don’t know everything it does, but it’s all beauty stuff anyway. I think some of us need a bit of that as well
2017-04-20	LAB	RonnieCampbell	I wonder why the merger was not a takeover, because as MPs we see takeovers all the time. With every takeover—no matter where the company is from, but especially if it is American—something happens to our companies. In the case of this merger, we have lost a factory. Then I was given a hint about reverse Morris trusts; I had never heard of them, but they are an American thing that can be used when an American company takes over a British one. In this case, we are talking about a merger, not a takeover. I have got the figures here, which show that the existing Coty shareholders own 48% of the combined company, while the Procter & Gamble shareholders own 52%. I gather from that information that Procter & Gamble is still the bigger shareholder. So this is a merger. I understand that the reverse Morris trust is a tax fiddle in America—not here, although we have got them—and it has something to do with a tax rebate on a factory that is going to shut. Of course, the factory that I am talking about is going to shut, so the company will get a tax rebate. I am a bit out of my depth, really, but there is information about it on Wikipedia, and some people might want to study it
2017-04-24	CON	OwenPaterson	The institutions were set up and the Belfast agreement was passed after the most extraordinary period of negotiation, man-years of effort and bipartisan agreement in this House when members of Conservative Administrations made intensely difficult decisions that were supported by the Labour Opposition. In turn, when Labour came to power and we were in opposition, we supported the Labour Government. I had the honour to be shadow Secretary of State when the last major element, the devolution of policing and justice, went through, and we backed Labour all the way. There was a similar process in Dublin, where both main parties consistently supported the process, and of course none of this could have happened without the extraordinary support of both parties in the United States of America
2017-04-24	CON	RichardPlunkettErnleErleDrax	Although not all breeders are unscrupulous, the public and the primates need to be protected. It is a fact that most buyers are well meaning, wanting only an entertaining and lovable pet that can be fed on scraps from the table, but the truth is that almost no domestic owner is equipped to look after primates properly. When, months after buying one of these tiny creatures, they call for help because their monkey is lying on the floor of the cage crying, it is far too late. Most south American monkeys—all 66 species for sale come from there—are extremely sensitive to a lack of vitamin D, and the lack of sunlight in a British birdcage deprives them of this crucial nutrient, as we might expect. Without it, they can, almost overnight, develop rickets. Although, with the right treatment in expert hands, rickets can be reversed, the agonising skeletal damage is permanent. Even without rickets, a marmoset frequently becomes aggressive and/or withdrawn, as its unnatural confinement takes hold, with it starved of its natural habitat and unable to mix socially with other monkeys.
2017-04-25	LAB	AndrewBurnham	That brings me to the point that my hon. Friend the Member for Kingston upon Hull North raised earlier. When we read the warning from the Americans in 1975 about blood products being derived from blood that had been taken off convicts on skid row and the letter some seven years later in which the Oxford Haemophilia Centre stated that it was necessary to push on with trials—to find out whether the products were infectious by giving them to patients—we soon start to see that there was something here that needed to be hidden
2017-04-26	LAB	GordonMarsden	The Americans have a saying that goes something like, “When you get lemons, you have to try to make lemonade,” and that is what we have all tried to do. We have tried to make a flawed Bill better fit for purpose, and to help, not hinder, the dynamism that I have talked about. We have had a decent thrash at it; without that decent thrash and the work of the House of Lords, I think it would have been a very poor Bill indeed.
2017-04-27	LAB	PaulFlynn	On a point of order, Mr Speaker. I wish to raise a matter that strikes right at the heart of the integrity of our democratic system. It is based on the final report of the Public Administration and Constitutional Affairs Committee, as well as two articles in The House magazine, one by a Conservative Member and one by a Labour Member, all of which sound notes of alarm that our electoral system is the most vulnerable it has been since 1880. There is powerful evidence of foreign Governments interfering in the elections in America and possibly here. There is also overwhelming evidence of money being paid in huge amounts, entirely invisible to the system, by the use of methods including algorithms, botnets and artificial intelligence in a manner understood by nobody except those who participate in it. We should be vigilant in this election, because the Electoral Commission does not have the tools to deal with interference of this kind, and we are trying to run a modern election with the tools of the 19th century.
2017-06-21	CON	KennethClarke	The first demand of any American Administration—assuming we even get anywhere with the protectionist and isolationist current Administration—will be that we open up to their beef. Personally, I do not have any hang-ups about hormone-treated beef, but there will have to be some quite hard negotiations about exactly how far we are going to open up our market to the Americans, who are always anxious to get rid of their heavily subsidised agricultural produce. They will not regard us as strong bargaining partners in the situation we have put ourselves in. I shall not go on, but the whole idea of leaving the customs union has its limitations
2017-06-21	CON	NigelEvans	I am a Brexiteer, and I am delighted that we are going to leave the European Union, but we must ensure that the new opportunities of trade are realised, whether that is with the United States of America or, indeed, with the European Union. When we import £80 billion more than we export, the European side has clear interests in trading with us. Getting controls on immigration means that we cannot be in the customs union. We cannot be a member of the single market, but we will trade with it. All of that has to happen, and—this is exciting for me—Parliament will be the Parliament of an independent country where we govern ourselves with our legislation
2017-06-26	CON	DavidDavis	As I was saying, the 90% growth outside the European Union means that our relative share of trade in the EU has gone down. In services, for example, we are now 60% outside the EU and 40% inside it, and all of this is without preferential trade agreements for much of our trade. Just so that the House understands, the best academic data that I could find show that creating a new trade agreement increases the amount of trade by about 28%. If the House wants an individual parable, in the first seven years of its operation, the North American Free Trade Agreement increased trade by 40%. These are really significant items of policy that we can exercise.
2017-06-26	CON	JohnWhittingdale	The trade Bill allows us now to reach new agreements with the countries that offer the greatest opportunities—the countries that are experiencing the fastest growth and where there is the most likely demand for British exports and British goods. It is no coincidence that there is no European trade deal with China, India, Australia, Brazil, New Zealand, or the United States of America, and yet all those countries want to do business with us and trade with us, and this gives us the opportunity to do so
2017-06-26	CON	RobertCourts	Free trade is not just about the interests of finance—important though that is to the UK economy—but about helping the poorest around the world and in our society, too. It is anticipated that free trade, which is the greatest tool for reducing poverty that history has ever seen, could reduce the annual food bill for people in the United Kingdom by up to £361 per household. That is a prize worth considering. It may be that there is no need to reinvent the wheel. I urge the Government to look around the country and the world to see whether there are existing arrangements that we may be able to accede to. It may well be that the North American Free Trade Agreement or the Trans-Pacific Partnership would welcome a dynamic, outward-looking free trading Britain, and we should seize those opportunities if they are out there
2017-06-26	CON	TheresaMay	I am very happy to say that we have already had a number of productive engagements on the issue of future trade with countries across the world, notably with India and America, but with other countries, too. We have had discussions with Australia, New Zealand, China and other countries across the world. There are real opportunities for the UK once we leave the European Union, and we will be making every effort to ensure that we take those opportunities.
2017-06-26	CON	TheresaMay	On climate change, the Council reaffirmed the commitment of all member states to fully implement the Paris agreement. The UK has already reaffirmed its own commitment, and I have expressed my disappointment to President Trump that he has taken a different decision. We will continue to make the case to our American allies to think again
