2017-01-10	CON	AlanMak	Since 1953, the Foreign Office has supported Marshall scholarships to help young Americans to study in the UK. Will my right hon. Friend continue to support this increasingly important aspect of the special relationship?
2017-01-10	CON	AlexanderJohnson	I have given my views about Sir Ivan, but I am happy to repeat them: I think he is, as the hon. Gentleman said, an outstanding public servant, and he always gave me very frank advice. It is vital for officials to continue to give their round, unvarnished views of matters such as the ease of negotiating free trade deals. It is not necessarily going to be simple, but there is no reason to think it cannot be done speedily, and no reason to think we cannot have fantastic free trade deals, not least with the United States of America.
2017-01-10	CON	AlexanderJohnson	I honestly cannot speak for the response of my counterparts. The hon. Gentleman can take this in whichever way he chooses, but all I can say is that there was a wide measure of agreement on both sides of the table on some of the problems that our societies face in America and UK, on the need for some fresh thinking, and on the huge potential of the UK and the US to work together to solve those problems.
2017-01-10	CON	TobiasEllwood	My right hon. Friend knows the region well and he is absolutely right. I want to make it clear, however, that the coalition has made errors. It has made mistakes. It has not endured sustained warfare in this manner before, and it is having to meet international standards as never before. It is having to provide reports when it makes mistakes, and it has never done that before. It has no experience of even writing reports. It wants to meet those standards and to work with the international community. We need to ensure that when errors are made, the coalition puts its hand up in the same way that we do and that the Americans did in Afghanistan only a few months ago.
2017-01-10	LAB	KeithVaz	I thank the Minister and the Foreign Secretary for their personal efforts in trying to broker a ceasefire. That is the key: we need a ceasefire in the same way as Turkey and Russia managed to achieve one for Syria. Have there been any further discussions with the United States about getting this back on to the agenda of the Security Council? I know that the Foreign Secretary was in America at the end of last week, so was this issue raised? When can we get this back for discussion at the UN?
2017-01-11	CON	MichaelFreer	The American Government operate the Global Equality Fund to ensure that marginalised groups are not left behind. Will my hon. Friend consider whether the UK should initiate a similar fund?
2017-01-11	LAB	MargaretGreenwood	Let us be clear: there is nothing inevitable about these Tory cuts. This is a political decision and it is being used to drive through changes including the introduction of accountable care organisations, borrowing a model from America where such organisations are used to deliver private insurance-based healthcare. An NHS manager from my constituency has written to me saying: “The STPs and national policy are currently pushing for a redesign of services—primary care at scale and a move to make system-wide organisations. The real punch line is there is no funding to make these changes. Locally there is talk about an Accountable Care Organisation for Wirral—meetings of senior managers across health and social care are being held on almost a weekly basis to create a roadmap for this to happen. With no money with which to do it. Having fragmented services and finally recognised the failure and destruction caused by the faux ‘internal market’ in the NHS, they are now making services use what pitiful resources they have to try and put it all back together. I truly despair that there will not be an NHS this time next year.” That is a stark warning and a damning indictment of the Government’s failure. The Secretary of State should be addressing the crisis by giving the NHS and social care the funding they need, to make up for this crisis of the Government’s own making around access to GP appointments, a failure to train enough nursing staff, a failure to fund social care, and cuts to community pharmacies when communities need them most
2017-01-11	LAB	PaulaSherriff	When is the Secretary of State going to stand up and take responsibility for what is going on? People are waiting hours for ambulances and waiting for hours in A&E. They are being treated on trolleys in seminar rooms and in corridors. Where does this end? We are already seeing the creeping privatisation of our NHS, with companies such as the dreadful Virgin Care putting profits before patients. Perhaps the end goal is for us to move to an American-style system where people are literally dying on the streets and where someone turns up at A&E and the first question is, “Have you got insurance, and can you prove it?” My constituency is served by two hospitals: Dewsbury and district hospital and Huddersfield royal infirmary. Both are due to be downgraded, losing vital services and beds as their respective trusts struggle to meet the financial pressures that have been placed on them. One of the hospitals that is supposed to pick up the resulting demand from the downgrades, Pinderfields hospital in Wakefield, was last week warning people against attending its A&E, and this is before the downgrades have even taken place. I am in absolutely no doubt that if the downgrades go ahead, lives will be lost. I plead with the Ministers and the Secretary of State to stop those downgrades now and to bring forward the much-needed funds that could save the lives of my constituents. It was interesting to hear the Prime Minister refer to those hospitals today at Prime Minister’s questions. She said that there were two hospitals in the trust. Perhaps someone could pass on to her the fact that there are three
2017-01-12	CON	TobiasEllwood	The fact that my hon. Friend says he is positive about the region, given the amount of knowledge he has, fills me with a sense of promise that we are going in the right direction. I join him in paying tribute to Tom Perriello, although I have no idea what the American envoy to the great lakes region will do next, as changes are taking place
2017-01-12	CON	TobiasEllwood	The last Quad meeting I attended was in Riyadh on 18 December, and we agreed to urge all the Yemeni parties to engage with the UN process and put the needs of Yemen’s people first. We will continue to engage directly with the parties and with our partners in the region to support the UN’s proposals for peace. I spoke to President Hadi on 6 January—just a week ago—to emphasise the urgent need to find a way forward in the political process. We clearly have a transition, and in America, Rex Tillerson will take over from John Kerry. He is familiar with the area, having lived and worked in Yemen for about three years during his career.
2017-01-12	LAB	EmilyThornberry	The Foreign Secretary was right last month to call Yemen a “proxy war” and he was right to criticise Saudi Arabia’s “puppeteering”. Although I am happy to applaud his honesty, it is just his hypocrisy that is all the more disappointing. If he knows what Saudi Arabia is really doing in Yemen, he should follow America’s lead and stop selling it arms. If he is worried about the scale of civilian casualties, he should back a proper, independent, UN-led investigation to see whether international laws have been broken. If he wants to see an end to the conflict and get the children of Yemen the humanitarian aid that they need, he should have the guts to stand up to Saudi Arabia and present the UK’s resolution to the UN. It is time for the Government to stop the hypocrisy and the delaying tactics and start doing the decent thing: present the draft UN resolution, end the conflict, demand an independent investigation of war crimes, and send a signal of intent to the Saudis today by supporting this motion.
2017-01-12	LAB	KeithVaz	Because of the vacuum that has been created—obviously, with a new Administration—Britain holds the pen, as we are told, at the Security Council. There is nothing to stop us hosting a conference that tries to bring all sides together or tabling a resolution, because it will take several months for the new American Administration to get into the right position. Of course, they might take a different view from the Obama Administration.
2017-01-12	LAB	KeithVaz	I was delighted by the ceasefire brokered on Syria, where the Russians and the Turks were able to make sure that we had peace in Syria. I know it is a bit wobbly, but it was followed by the UN endorsing that ceasefire. If we can get this in Syria, why can we not have it in Yemen? I am very pleased with the role the Foreign Secretary has played and the honesty with which he has spoken about Yemen. If we take him at his word, the British Foreign Secretary will be working with the new US Secretary of State and with the Russians, who are now the friends of the Americans—or will be after 20 January. The Chinese will go along with the ceasefire—I met the Chinese ambassador recently and asked whether China would support it and he said it would—and the French are on board. As the five permanent members are going to be on board and the other countries are so supportive, I think we can get this through. Will the Minister therefore tell us when that timetable is going to be achieved
2017-01-13	CON	OliverColvile	I must pay tribute to Radio Plymouth, which is probably the best example of a local community radio station in the city as a whole, and covers a series of issues. One of the great things about community radio is that it can cover specific community events. In 2020, Plymouth will be celebrating Mayflower 400. The Mayflower left Plymouth after a journey into Torbay and other places, and those on board went on to found the American colonies. We need to provide good community coverage of the commemoration of that event, so that people can become engaged with it
2017-01-16	CON	SajidJavid	My hon. Friend has also done a lot to champion business and economic growth in the midlands. That first mission—the trade mission to north America—went well. It went so well that we went ahead with a second mission—to China—for the midlands region. My hon. Friend will be pleased to know that we are working with the Department for International Trade and other Departments across Government, and we will shortly publish a midlands engine strategy, reaffirming our commitment to the area.
2017-01-16	LAB	SusanJones	Many Members on both sides of the House have spoken passionately today about integration, diversity and bringing people together. My hon. Friend the Member for Barnsley Central (Dan Jarvis) cited a moving quote by President Obama. This is not all about being in one’s own little bubble and talking to people who agree with ourselves; it is about coming together with different people. I remember a television programme from a few years ago—I think it was a “BBC Parliament when we are not here” type of programme—and sitting on a stage were former Presidents Bill Clinton and George W. Bush, who were discussing with young people some sort of leadership programme that they had established in the United States. I always remember former President Clinton talking about the idea of bringing together young African-Americans who are active in their community and getting them on the same programmes as young people involved in the Tea Party movement who believe that the world would be a better place if everything operated in their small town. He spoke about bringing together those energies and about how the synergy between them creates something better for society. I am not sure how many of those ideas are at play in the US at the moment, but what a fantastic idea it is to bring together different groups of young people so that they can share their different ideas. Who knows what might come out of that
2017-01-16	LAB	VernonCoaker	It is a pleasure to follow the hon. Member for Kingston and Surbiton (James Berry). I very much agree with the remarks he made about the contribution made by the Scouts and Girlguiding, and by the other organisations. I also agree with his really good point about how the Peace Corps and the AmeriCorps in America contribute to many of the aims we seek to pursue here in Parliament today. I say to the Minister that all Opposition Members, along with our Front-Bench team, very much welcome the Bill, which we think is an important step forward in achieving the goals we all share
2017-01-17	CON	ChristopherDavies	After the Brexit vote last year, we are now in possession of the ambition that our American cousins have held for more than 300 years, for we can truly state that Great Britain is the land of opportunity. Now is the time to capitalise on that. All that matters is that we go into our negotiations with the right attitude and protect our rural economy for the long term.
2017-01-17	CON	DavidDavis	We have security arrangements with other allies—America for a start—which do not run into that problem, so I would not think that that is an issue.
2017-01-17	LAB	ChristopherBryant	Russia has been up to its usual tricks in trying to stir up trouble between Serbia and Kosovo this week, and it is of course trying to face down the United States of America and, for that matter, other members of NATO on the border with Poland and Estonia. I believe that the bedrock of our national security is NATO—I hope my party does, too—but on coming back from the EU, successive Foreign Secretaries, Home Secretaries and Prime Ministers have come to this House and said that they are proud to have been able to make sure that the EU keeps strong sanctions in place against Russian territorial aggression. How will we be able to do that in future when we have left the European Union?
2017-01-18	LAB	HilaryBenn	In the United States of America, we will witness on Friday the inauguration of a new President who, to say the least—notwithstanding what the right hon. Member for New Forest East (Dr Lewis) said in his intervention—appears to be sceptical about the international rules-based system and the institutions, such as the EU, NATO, the World Trade Organisation and the United Nations, that we created precisely to give the world greater security. I was astonished to hear him describe Angela Merkel’s decision to provide shelter to 1 million refugees as a “catastrophic mistake…taking all of these illegals”, as if he were completely unaware of America being a country built on providing a welcome to those seeking shelter. That is best expressed in these famous words: “Give me your tired, your poor, Your huddled masses yearning to breathe free”— words forever associated with the Statue of Liberty
2017-01-19	CON	DesmondSwayne	With the decision of the Backbench Business Committee not to schedule a debate on settlements and the destruction yesterday of Umm al-Hiran, is there a possibility of a Government statement on what appears to be a significant shift in Government policy over recent days as we cosy up to the incoming American Administration in granting complete impunity to Israel?
2017-01-19	CON	EricPickles	This month sees the release of the film “Denial”, which depicts one of the most infamous libel trials of the past 20 years involving the American historian, Deborah Lipstadt, and David Irving. If one looks at the trailer, and at the comments made beneath it, one can see that there are thousands of abusive comments claiming that the holocaust was a fake. Only a few days ago David Irving claimed that he is inspiring a new generation of “holocaust sceptics”—a fancy way of dressing up holocaust denial
2017-01-19	LAB	RupaHuq	Holocaust Memorial Day has renewed significance this year. We live in a time of post-truth politics and fake news. Members have mentioned the film “Denial”, which I had an opportunity to see earlier this week. It deals with the trial in which the Nazi David Irving opposed the American academic Deborah Lipstadt. I warmly recommend the film, which is a fact-packed treatment of the downfall of the UK’s most notorious rewriter of history. It is frightening to hear that he is making something of a resurgence. I think that such views are as ridiculous as those of people who think that the earth is flat, and we need to call them out
2017-01-20	CON	AlanMak	The work of my hon. Friend the Member for Milton Keynes South on international trade is important. He mentioned free trade agreements, and we know that we can trade in the modern world only if our merchant shipping fleet is fit for purpose. We can make legal agreements with our friends and partners in Europe, Asia, north America, Africa, Latin America and other parts of the world, but we have to turn those paper commitments into practical reality, and this country’s merchant shipping capability plays a key role in that
2017-01-20	CON	IainStewart	I can relate my personal experiences. Growing up thinking that you are different is very tough. Even in these more enlightened times, people still think something is wrong with them, and they might be inhibited from pursuing what they want to do. It is not a well-known subject, but a growing body of evidence in psychology is unravelling and pointing out the damage that can be done. If Members are interested in reading about it, I would point them to a very good book by Professor Alan Downs called “The Velvet Rage”. He documents both in America and here how, even after homosexuality has been decriminalised, when we have same-sex marriage and civil partnerships and when much of the discrimination has been removed, lots of young people still grow up feeling different. Some deal with it better than others, but it still does long-term damage to a lot of people, and that is why removing discrimination from legislation is so important; it is not just a tidying-up exercise
2017-01-20	CON	PeterHeatonJones	The Bill relates specifically to the rights of LGBT employees on merchant ships, which by their very nature operate all over the world. We do not want an individual to be free from discrimination on board the ship only to face potential discrimination when they disembark on a foreign shore. We must continue to fight for the rights of LGBT citizens and workers in other countries. Today, events across the Atlantic may knock this fine debate off the top of the news bulletins, surprising as that may seem; as a former journalist, I have a hunch that it will not lead the six o’clock news tonight, but let us do our best. On the day when President Obama leaves office in America, let us pay tribute to his work in advancing LGBT rights in the USA. The job is not finished by any means: in many states, someone can still be denied public services or dismissed from their job simply for being lesbian, gay, bisexual or transgender. However, President Obama leaves office after eight years with the LGBT community in the States far more protected than it has ever been. Let us hope that nothing is done over the next four or eight years to unwind any of that good work
2017-01-20	CON	PhilipDavies	Much has been said about this issue, but I think it important to reflect on why homosexual acts were grounds for dismissal in the first place, so that the reasons can be viewed today in that context. One of the best explanations in relation to military life came from my right hon. Friend the Member for Mid Sussex (Sir Nicholas Soames) in 1996, when he was a Defence Minister. He said: “The current policy of excluding homosexuals from the armed forces is not—I repeat, not—the result of a moral judgment. The prime concern of the armed forces is the maintenance of operational effectiveness and our policy derives from a practical assessment of the implications of homosexual orientation on military life. I do not believe that the services have a right to be different, but I firmly believe that they have a need to be different.” My right hon. Friend went on to say that military life is different from civilian life, and this was a cross-party view at the time; it was made in the same debate by Dr John Reid—now Baron Reid—from the Labour Benches. My right hon. Friend went on to say in the debate: “Service personnel are regularly required to live in extremely close proximity to one another in shared, single-sex accommodation with limited privacy and sometimes under stressful conditions.” He also pointed out that the belief was that those conditions, with “the need for absolute trust and confidence between all ranks, require that the potentially disruptive influence of homosexual orientation and behaviour be excluded.”—[Official Report, 9 May 1996; Vol. 277, c. 505-06.] That was the view at the time, and I might add that General Colin Powell, former chairman of the Joint Chiefs of Staff in America, held the same view at the time. He saw sexuality as different from race and sex. He said: “Unlike race or gender, sexuality…is manifested by behaviour. While it would be decidedly biased to assume certain behaviours based on gender or membership in a particular racial group, the same is not true for sexuality.” As I have said, this was the view at the time. We consider it to be a ridiculous view to hold. I do not condone or understand those views, but that was the consensus at the time—cross-party, in different countries. It was not unique to this country.
2017-01-23	CON	JulianBrazier	Does my right hon. Friend agree that secrecy and transparency are simply incompatible, and that it is right that every British Government—as well as, indeed, every Government of our nuclear allies, the Americans and the French—have always put secrecy first in this area?
2017-01-23	LAB	ChristopherBryant	Many Opposition Members share the Defence Secretary’s commitment to the deterrent and, for that matter, his concern about national security, but the logic of what he is saying is that there was a security breach, and it happened this weekend, as American officials are now briefing CNN and British officials are secretly briefing The Guardian and The Sunday Times. Surely, according to his own logic, there must now be a full investigation.
2017-01-23	LAB	DennisSkinner	How can this be an independent nuclear deterrent if Donald Trump, the President of the United States of America—a man who is as thick as two short planks—is given the information, but nobody on the Opposition Benches is allowed to see it?
2017-01-23	LAB	KevinBrennan	Does not the Secretary of State’s characteristic “Name, rank and serial number—don’t tell him, Pike” approach actually make no sense at all given that, following the reports we have had, our American counterparts in Congress will certainly be given full details of what happened in the test? Does not his stonewalling do nothing to strengthen our security and everything to undermine the credibility of this House?
2017-01-24	CON	ChristopherGreen	The World Trade Organisation has done a fantastic amount of work to reduce trade barriers around the world, and it is the basis of our trading relationship with the United States of America, where we have a trade surplus. Does my right hon. Friend agree with me that this provides a great foundation for a trade deal with the EU, and that it is now for the EU to do something better than that?
2017-01-25	CON	AlunCairns	Welsh produce, and Welsh lamb and beef in particular, is world leading, and there are great opportunities as we exit the European Union to explore and exploit new markets. Hybu Cig Cymru specifically recognised that £20 million could be brought to Wales from accessing the north American market. These are the ambitions that we want to have, and my right hon. Friend the Prime Minister will of course put Britain first in any negotiations.
2017-01-25	CON	TheresaMay	On the issue of my visit to the United States of America, I am pleased that I am able to meet President Trump so early in his Administration. That is a sign of the strength of the special relationship between the United Kingdom and the United States of America—a special relationship on which he and I intend to build. But I also say to the Leader of the Opposition that I am not afraid to speak frankly to a President of the United States; I am able to do that because we have that special relationship—a special relationship that the right hon. Gentleman would never have with the United States.
2017-01-25	CON	TheresaMay	We will be out around the world with the EU, America and other countries negotiating good free trade deals for this country that will bring prosperity to this country. The right hon. Gentleman wants to talk about Brexit, but I have to say to him that he is the leader of his party and he cannot even agree with his shadow Chancellor about Brexit. The shadow Chancellor cannot agree with the shadow Brexit Secretary, the shadow Brexit secretary disagrees with the shadow Home Secretary, and the shadow Home Secretary has to ring up the leader and tell him to change his mind. He talks about us standing up for Britain; they cannot speak for themselves and they will never speak for Britain.
2017-01-25	LAB	JeremyCorbyn	We would never allow Britain to be sold off on the cheap. How confident is the Prime Minister of getting a good deal for “global Britain” from a President who says he wants to put America first, buy American and build a wall between his country and Mexico
