2017-10-16	CON	NigelHuddleston	In contrast to some Opposition Members, I believe in the special relationship with the US. It is a mutually beneficial and enduring relationship that goes way beyond that between one US President and one UK Prime Minister. Can the Minister assure me that the Government are pulling all the available levers in that relationship at every level to persuade our American friends to retain this deal?
2017-10-16	CON	SimonHoare	If we and the EU do not like the legal advice, and if we want somehow to disaggregate membership of the EU and of Euratom, we could possibly get some different lawyers to say something different. I must say that I am about to dash out and get myself the stiffest of stiff drinks, because I am going to do something that I never thought I would do—[Interruption.] It is interesting that the Under-Secretary of State for Exiting the European Union, my hon. Friend the Member for Wycombe (Mr Baker), arrives in the Chamber just at this moment—his stage timing is exemplary—because I am going to pray in aid one Mr Dominic Cummings, a man I have not joined on a campaigning platform before. If even Mr Cummings, getting terribly hot under the collar, does not believe that leaving Euratom is some sort of demonstration of Brexit adherence or virility or some test to be passed, that should give us pause for thought. Because Euratom has not done anything wrong, and because it has not offended against the principles of this House or the country, I fully commend the strategy adopted by Her Majesty’s Government. We need to be pragmatic and sensible in laying the foundations for this important part of our economic life in case, at the end of the process, we find ourselves having to leave. I do not know whether we will end up like Switzerland, which has special status and is seen as an equal partner, or whether we will end up like the United States of America or Australia, which have looser agreements but are not seen as equal partners. Let us see
2017-10-16	LAB	BenjaminBradshaw	Does this episode not illustrate the folly of breaking from our natural friends and allies in Europe and throwing in our lot with an unpredictable and irrational American President? That would be the outcome of the extreme hard Brexit that the Minister’s boss and the other hard Brexiteers on his Benches are pursuing.
2017-10-16	LAB	ChristopherBryant	Britain had just restarted diplomatic relations with Iran and a new British ambassador was on his way to Tehran when George W. Bush foolishly included Iran in the “axis of evil” speech, making it much more difficult for us to progress our relations with Iran. Is it not now all the more important to make it absolutely clear that we are a country in our own right and will not necessarily follow the American line, and that we will want to make strong alliances with our allies in Europe in the future, even if we are not a member of the EU?
2017-10-16	LAB	EmilyThornberry	Let us make it clear that when Donald Trump talks about the deal needing to be fixed, that is utterly disingenuous, when the only evidence that it is in any way broken is a figment of his fevered brain. Yet sadly this behaviour is what we have come to expect of this President. Some of us in the House have been sounding these warnings from day one of his presidency, whether over climate change, human rights or the Iran nuclear deal. When we raised those fears in the House, what did the Foreign Secretary say? He said that I was being “too pessimistic”. He told us that his strategy of hugging the President close—inviting him to meet the Queen, holding his hand when needs be—was the way to wield influence. Specifically on the Iran deal, the Foreign Secretary stood at the Dispatch Box seven months ago and said that I had simply got it wrong on the Iran deal. He said: “We were told that the…plan of action on Iran, was going to be junked”, but “it is now pretty clear that America supports it.”—[Official Report, 28 March 2017; Vol. 624, c. 116.] Well, one of us got it wrong. One of us was being naive and complacent, and one of us is seven months too late in waking up to this issue. It really is high time that we had a Government capable of standing up to Donald Trump, not just meekly following his lead. Perhaps in his response the Minister can make a start by making clear two specific differences between this country’s policies and Donald Trump’s. Will he make it clear today that the Government will reject any attempt to make the deal subject to new conditions that have nothing to do with Iran’s ability to develop nuclear weapons? Will he also make it clear that we reject an approach whereby international agreements can be made by one President and torn up by the next for purely political reasons? It puts us in the invidious position that we will never ever feel secure doing a deal with America again. Will he share that concern today and reassure our allies that this is one Trump lead that the British Government will never follow?
2017-10-16	LAB	HilaryBenn	As the right hon. Gentleman can already tell, the Government’s strong support for the deal is widely shared on both sides of the House. Does he agree, however, that among the consequences of President Trump’s announcement are, first, that it will undermine confidence in international agreements of this sort—and, as we have already heard, this agreement was painfully and painstakingly negotiated by many people including Baroness Ashton—and, secondly, that it will enable the less than moderate forces in Iran to say to the more moderate forces, “We told you that you could not trust the United States of America”, which is not in anyone’s interests?
2017-10-16	LAB	RebeccaLongBailey	One example is that we will need to reach an agreement on the international supply chain for nuclear reactors. Without such an arrangement in place, it is possible that the existing nuclear power stations such a Sizewell B will be forced to close until such time as the agreement is sorted out. The UK will need to conclude individual and separate nuclear co-operation agreements with non-EU countries such as Australia, Canada, Japan, South Africa, Kazakhstan, the United States of America and others. We will need to agree new inspections with the IAEA. The status of supply chains such as nuclear isotopes for medical treatment will need to be maintained, supplied by reactors in EU countries. There is the issue of research in nuclear technology including, importantly, the fusion research carried out at the Joint European Torus facility in Culham, which the Secretary of State has already mentioned. These are all at serious risk if a fully worked-out series of agreements is not in place to allow these activities continuous operation. Working out a way to honour our safeguarding commitments under the nuclear non-proliferation treaty is only the start of the process and we should not delude ourselves that achievement of that solves the Euratom issue. It does not.
2017-10-17	CON	AlexanderJohnson	I have regular discussions with our P3 partners—the French and the Americans—and with Italy, Egypt and the United Arab Emirates on how we can bring together the international community in support of the United Nations plan for Libya, which in our view offers by far the best hope for that country and the best prospect of security for all its people.
2017-10-17	CON	AlexanderJohnson	The hon. Gentleman is completely in error when he says that. In point of fact, both the French and the Dutch appealed to us at various times for help with their own needs, and, of course, we were very glad to supply that. We are now working with them and the Americans to make sure that we have a joined-up plan to react in the event of any future hurricanes.
2017-10-17	CON	EdwardLeigh	T5. Even if the Americans have 100% reliable intelligence to find every single nuclear site and rocket launcher in North Korea, the regime has thousands of guns mounted in caves near the border ready to bomb Seoul. In these circumstances, will the Foreign Secretary encourage the Trump Administration to pursue diplomacy in Korea, as in Iran? To coin a nostrum, “Jaw-jaw is better than war-war.”
2017-10-17	CON	GregoryClark	We certainly do, and I am delighted that my right hon. Friend has been part of the process of educating generations of Conservative Front Benchers. In fact, the UK’s stock of overseas investment is second only to that of the United States of America. For this country to be second only to the United States in terms of the value of the assets that we own overseas is a remarkable achievement, and he is right to pay tribute to that.
2017-10-17	CON	JulianLewis	I warmly thank the Foreign Secretary for suggesting that he and I should visit the BBC Monitoring Service at Caversham Park before the crazy decision is implemented next year to sell off the site and break our link with the similar American operation there. Will he remonstrate with his officials, however, on the grounds that 45 minutes for a walk-through on a Thursday is not long enough for him to see what is going on there? Given also—[Interruption.]—that the Chairman of the Foreign Affairs Select Committee cannot accompany us, should the visit not be altered?
2017-10-17	LAB	IanAustin	T4. We should all be very worried about the malevolent involvement of the Iranian hard-line al-Quds force using American heavy weapons against our brave allies the Kurds. Will the Minister make it clear that Iraqi forces must not enter the four provinces of the Kurdistan region, and that the only way forward is co-operation in Kirkuk and wider dialogue based on the Iraqi federal constitution, which is supposed to guarantee Kurdish rights?
2017-10-17	LAB	JeffreySmith	In March, the Foreign Secretary told this House that the Labour party had been “far too pessimistic” about Donald Trump. He said specifically that the nuclear deal with Iran “was going to be junked”, but “it is now pretty clear that America supports it.”—[Official Report, 28 March 2017; Vol. 624, c. 116.] Does the Foreign Secretary think that those comments perhaps demonstrate that he has a lack of political judgment?
2017-10-18	LAB	JeremyCorbyn	It is very interesting that the Prime Minister talks about what happened 10 years ago. Her former friend George Osborne said earlier this week: “did Gordon Brown cause the sub-prime crisis in America? No.” He went on to say that “broadly speaking” the Government “did what was necessary in a very difficult situation”
2017-10-19	LAB	ElizabethMcInnes	The damage to the developing foetus is thought to be caused in the first trimester of pregnancy when the anti-epileptic drug crosses the placenta into the foetus, and the effects depend upon the dosage and the drug. Sodium valproate, or Epilim, is indicated in 80% of cases of foetal anticonvulsant syndrome. Experts such as Dr Peter Turnpenny, clinical geneticist at the Royal Devon and Exeter Hospital, say that Epilim may affect about 560 babies every year. He adds: “About 10% of foetuses exposed to sodium valproate will have a major congenital malformation such as cleft palate. 12% are likely to be diagnosed with a neurodevelopmental disorder.” Reports linking valproate to birth defects started to appear, most notably, in 1981, with a paper by H. Nau entitled “Valproic Acid and its Metabolites”. In 1983, the British Medical Journal published an article in which the Royal Liverpool Hospital cited two cases suggesting a link between birth defects and valproate taken during pregnancy. The American Journal of Medical Genetics cited seven cases in 1984 of children born with malformations to mothers taking valproate, and the Journal of Paediatrics cited 26 cases in 1986. The list goes on. It would appear that the evidence was steadily building up with the publication of more and more cases linking valproate to birth defects. The Committee on Safety of Medicines and the Medicines and Healthcare Products Regulatory Agency noted those reports, and, I hope, monitored the use of valproate, particularly during pregnancy.
2017-10-19	LAB	PaulFlynn	GlaxoSmithKline in America has been fined—it is hard to believe—$3.5 billion. What was the fine for? It had suppressed the evidence of the trials it had carried out. It did not publish any of the negative results of the trials it carried out, and only the ones that were neutral or favourable. Drugs that were killing people were getting on to the market—this is a British company. What did the MHRA do in this country? Nothing! I wrote to them saying, “For goodness’ sake, you have to act against GlaxoSmithKline.” It is no coincidence that the person who chaired the regulatory body for more than a decade was a previous employee of that company. I am not saying that in this instance the body did absolutely nothing; it did produce the tools and provided advice, but that clearly did not work—how could it have done if 68% of the women still taking the drug did not know
2017-10-19	LAB	PaulFlynn	We have had the effect of a drug called Vioxx for arthritis sufferers. According to the Food and Drug Administration in America, it caused 60,000 deaths; imagine it—60,000 deaths. How many bad reactions did the MHRA have in this country? About six. We would still be using it if the FDA had not discovered that death was one of the side effects of the drug, which was taken by millions
2017-10-20	LAB	ChristopherBryant	My hon. Friend makes a good point. This is a debate for another day, but my feeling is that this country wants a Swedish standard of NHS on American levels of taxation, and in the end I just do not think that works. The Unison survey I mentioned earlier said that 87% of mental health staff felt that the lack of staff was the major contributory factor in attacks, and 50% felt that over-reliance on agency staff was a problem because those staff do not know the patients well enough to ensure safety and deal with them appropriately. If the Bill is to have the desired effect, it is self-evident that the police, the Crown Prosecution Service and prisons will need adequate resources
2017-10-23	CON	JamesGray	Britain had close working defence relationships with all European countries for decades before the EU was even invented, and for centuries before that with many of them. Does the Secretary of State agree that although we will of course maintain close defence relationships with France, Germany and other European countries, Brexit gives us an opportunity to redevelop some of our defence relationships across the world—with the old Commonwealth and the United States of America, and of course with NATO being at the centre of it all?
2017-10-23	CON	LeeRowley	Many Members have mentioned our wish to become a world leader in technology of this kind, and I support what they have said. The hon. Member for Kilmarnock and Loudoun (Alan Brown) spoke of the importance of putting money behind activities such as this, and I agree with him to an extent, but I also think it important to establish the right regulatory framework. Places like Silicon Valley are streets ahead of many parts of the world when it comes to automated vehicle technology, but it should be noted that only a handful of American states have taken up the opportunities that it has provided. We heard earlier about companies in China, such as Geely and Baidu, which are proceeding apace with automatic technology, and about Chinese-owned companies such as Volvo, which is doing the same on our own continent, but the country has a real opportunity, as an early adopter, to provide the frameworks that will allow such companies to innovate and thrive. That is why we should be careful about the regulatory framework, as the Government are being here
2017-10-23	LAB	BenjaminBradshaw	Did the EU Council discuss Russia, and in that context have the UK Government or their agencies been asked for help or information by the American congressional team or US special counsel Robert Mueller, who are investigating alleged Russian subversion of the US presidential election?
2017-10-25	CON	TheresaMay	I am very happy to give that commitment. A lot of work has been done in relation to this issue by me, the Business Secretary, the Chancellor of the Exchequer and other Ministers with our opposite numbers in America and Canada. We will certainly continue that work. Obviously, the most recent announcement in relation to Airbus and the C series is important. We want to ensure that those jobs stay in Northern Ireland, because we recognise the importance of those jobs to the economy of Northern Ireland and, obviously, also to the people and their families.
2017-10-26	CON	LukeGraham	Ideologies that suppress, torture and kill simply because of one human’s feelings towards another are unacceptable. We in the UK must show international leadership, as it is very important in this issue. The United States was once a beacon for all kinds of individual rights and I would like to share with Members my disappointment, which I am sure they share, at the decisions of the latest American President to ban further recruitment of trans soldiers and to deny the funding of certain medical treatments for those soldiers. If someone is brave enough to fight for their country, their country should be brave enough to fight for them
2017-10-26	LAB	BenjaminBradshaw	I wonder whether the Leader of the House can answer a question the Prime Minister failed to answer when I asked her on Monday, or ensure that I get a written answer: have the Government or their agencies received any requests from Robert Mueller, the special counsel, or the congressional investigators in the United States for help or information in connection with their inquiry into Russian subversion of the American presidential election?
2017-10-26	LAB	DawnButler	Tragically, of those LGBT people killed in the Americas in 2013-14, 46% were trans women, and more than 2,000 trans gender and gender-diverse people were murdered in 65 countries between 2008 and 2015, according to the trans murder monitoring project. Although Labour has often led the way on LGBT+ rights, it is important, given that we are discussing the global situation and as the hon. and learned Member for Edinburgh South West (Joanna Cherry) has just said, that we in the UK get our own house in order. People fleeing persecution often end up on our shores. Therefore, how we treat people fleeing violence, persecution and death is vital in the battle for human rights
2017-10-26	LAB	StephenTwigg	Most of the examples I have given are, understandably, from Russia, Africa and the middle east, but I want to say something about what is happening in the United States of America. President Trump’s decision to ban transgender people from the US military is an enormous shame, one I hope we can condemn on a cross-party basis. I pay tribute to the chairman of the joint chiefs of staff in America for his positive and measured response to President Trump’s actions. I urge our Government to do all they can to press President Trump to think again on his attempt to ban trans people from the US armed forces
2017-10-26	LAB	StephenTwigg	That, however, is not the only incident of greater homophobia and transphobia in American politics and policy. Recently, the United States voted against a UN Human Rights Council resolution that condemned the use of the death penalty against people because they are LGBT. President Obama left a very positive legacy on LGBT. Tragically, President Trump is undoing it. That leaves a vacuum in global LGBT rights. I hope that the United Kingdom, working with like-minded countries around the world, will play a leadership role to ensure we do not slip back, but instead move forward to global LGBT equality.
2017-10-30	CON	AlexanderJohnson	I have been pretty clear with the House already that we see the most fertile prospects now in the new push coming from America, and we intend to support that. As and when it becomes necessary to play the recognition card, we certainly will do it—we want to do it—but now is not yet the time.
2017-10-30	CON	AlexanderJohnson	I strongly agree. It has been salutary for people to look back over the last 100 years at the many missed opportunities and at the reasons Balfour thought it necessary to make his declaration. It was not, as is frequently said, simply that Britain wanted to solicit American support in the first world war; it was genuinely because of a need, an imperative, to deal with the pogroms and the anti-Semitism that had plagued Russia and so many parts of eastern Europe for so long. It was vital to find a homeland for the Jewish people, and history can be grateful that Balfour made the decision he did, though we have to understand at the same time the injustice and suffering occasioned by that decision.
2017-10-30	CON	AlexanderJohnson	Indeed, and I am hard where it is necessary, but there is a job to be done. At the moment, as I think the right hon. Lady would accept, there is a conjuncture in the stars that is uncommonly propitious. I will not put it higher than that, but there is a chance that we could make progress on this very vexed dossier. We need the Americans to work with us to do that and we need them to be in the lead because, as she will understand, of the facts as they are in the middle east
2017-10-30	CON	AlexanderJohnson	The House knows the troubled history of the peace process so far. The truth is that no direct talks have taken place between the parties since 2014. But the US Administration have shown their commitment to breaking the deadlock, and a new American envoy, Jason Greenblatt, has made repeated visits to the region. The Government will of course support these efforts in whatever way we can, and we urge the parties to refrain from acting in ways that make the goal of two states ever harder to achieve. For Israelis, that means halting settlement activity in the occupied territories. The pace of construction has regrettably accelerated, notably with the approval of the first new housing units in Hebron for 15 years and the first completely new settlement in the west bank since 1999. For Palestinians, it means restoring full counter-terrorism co-operation with Israel, in line with UN resolution 2334, and implementing the recommendations of the Quartet report on curbing incitement
2017-10-30	LAB	EmilyThornberry	Will the Foreign Secretary tell the House today whether the Government still plan to recognise the state of Palestine and, if not now, when? Conversely, if they no longer have such plans, can the Foreign Secretary tell us why things have changed? He will remember that on 13 October 2014, the House stated that the Palestinian state should be recognised. The anniversary of the Balfour declaration is a reminder that when the British Government lay out their policies on the middle east in black and white, those words matter and can make a difference. With the empty vessel that is the American President making lots of noise but being utterly directionless, the need for Britain to show leadership on this issue is ever more pressing
2017-10-30	LAB	LukePollard	It is important that we recognise our friends and NATO allies, especially those from America, who have transferred personnel to serve in our UK armed forces in engineering grades. In particular, I welcome the transferring of people from the US Coast Guard to serve in the Royal Navy. There remains much more to do, however, and I would welcome a greater effort from Ministers in terms of how we invest more in engineering. That is especially a concern in nuclear engineering skills, particularly as the new generation of nuclear new build power stations comes online and there is a temptation to poach people by offering them better pay, terms and conditions and lifestyle.
2017-10-31	CON	AndrewSelous	Full-body scanners that detect drugs that are concealed within the person are successfully used across America. The Ministry of Justice has trialled one scanner. Has there been an evaluation, will we see more trials, and could the scanners be used on a mobile basis?
2017-10-31	CON	BrettElphicke	Does my right hon. Friend agree that the greatest threat to tax havens is not the blustering of the Labour party, but countries such as the United States of America reducing their tax rates so much that it does not become in any way effective to be using these kinds of places for any function and business?
2017-10-31	CON	JohnRedwood	I was about to draw the attention of the House to hugely important debates about to be undertaken in both the Senate and the House of Representatives in the United States of America. New York and other great centres are already very attractive magnets for rich people and large-scale investors. They are suggesting that they might take their top rate of tax down from 39.6% to 35%, simplify their income tax brackets from seven to just three, and take their corporation tax rate down from a very high headline 35% to an effective rather lower rate of 20% or even lower, because they are very serious about becoming tax competitive again. They will be a lure, just as surely as some European countries on the continent are trying to be more of a lure
